id	created_at	hashtags	cleaned_text
1061248169932140545	2018-11-10	[]	pric fre tel story hum right act kailash satyarth whos effort rescu 80 child fact work ind
1061232802564325376	2018-11-10	[]	@iamkelseylu's new mus video wardrob ev stun la landscap watch
1061217331597242368	2018-11-10	[]	six celebr makeup art shar favorit highlight tim
1061202186842062848	2018-11-10	[]	ballroom marf max mar host riot spaghett western gal
1061186942170263552	2018-11-10	[]	tbilisi's photograph street styl access plast dol
1061171383412162560	2018-11-10	[]	christian @louboutinworld's new pint sho caps mad roy baby
1061155948008497152	2018-11-10	[]	ultim holiday gift guid kid tot teen
1061140479323049985	2018-11-10	[]	11 beauty gift mom guar favorit child stat
1061125338313449473	2018-11-10	[]	longtim martin margiel mus kristin de coninck shar learn design friend antwerp six sculpt exhibit par
1061109783292510208	2018-11-10	[]	ultim gift guid every guy lif
1061094329987555328	2018-11-10	[]	10 minut get ready @rihanna's quick guid going makeup cov
1061078938557014018	2018-11-10	[]	first @thespicegirls @backstreetboys off 1998
1061063770146029570	2018-11-10	[]	11 best gift aspir art lif
1061048424043347968	2018-11-10	[]	que eye's @antoni shar detail dream kitch
1061032586510766081	2018-11-09	[]	insid 2018 @victoriassecret show party
1061017248540823562	2018-11-09	[]	bell hadid tak victoria's secret runway makeup streets lik pro
1061001551366578178	2018-11-09	[]	beauty pion behind @tenoverten_nyc tak less philosoph fash
1060989152307625991	2018-11-09	[]	@kelelam shut instagram maj glit makeup mom
1060973613225009154	2018-11-09	[]	glow skin harsh dry month turn @palomuh elsesser's beauty tip
1060960538384048128	2018-11-09	[]	see @victoriassecret angel @taylormariehill's tip bombshel brow lash day
1060945285348777989	2018-11-09	[]	naom campbel look @marcjacobs's 1993 grung show
1060930016576454660	2018-11-09	[]	fash design bell freud put mag touch new london penth
1060914454496468992	2018-11-09	[]	go backst victoria's secret fash show nyc
1060898785956630528	2018-11-09	[]	faux leath ev bet real thing design say ye
1060883238883868678	2018-11-09	[]	stefano pilat return runway mil mont
1060867656419631106	2018-11-09	[]	erykah badu's pench overs hat run famy
1060852213097132032	2018-11-09	[]	@jlo @arod corp couple's styl
1060836780558245888	2018-11-09	[]	gre jon mak pot pan want put away
1060821421457321984	2018-11-09	[]	gig bell hadid third time's charm @victoriassecret
1060806214672678913	2018-11-09	[]	girl run world 2018 @adweek brand geni award
1060790993098891264	2018-11-09	['#emilyblunt']	decemb cov star answ effortless red carpet hair here's proof
1060775678159794178	2018-11-09	[]	kendal jen got mind birthday gift sist
1060760299245051905	2018-11-09	[]	print harry ask fath walk megh markl aisl
1060744883319853056	2018-11-09	['#vsfashionshow']	@adrianalima got larg lif send fin
1060742843969482752	2018-11-09	['#emilyblunt']	fiv thing know @voguemagazine's decemb cov star
1060727007246467072	2018-11-09	[]	emy blunt john krasinsk secret hollywood's best coupl
1060711591497400320	2018-11-09	[]	glow lik @victoriassecret angel accord celebr fac
1060696241171062784	2018-11-09	"[""#ezramiller's""]"	. latest red carpet risk piccioli's maj @moncler best yet
1060680528452616192	2018-11-08	[]	@victoriassecret model miss cre educ eq
1060667809838100480	2018-11-08	[]	debut collect @samimiro us vint fash help sav planet
1060652083110703111	2018-11-08	['#emilyblunt']	watch @voguemagazine's decemb cov star fil vogue's edit chief
1060643040044302336	2018-11-08	['#emilyblunt', '#73']	field phon cal mak din reserv read cop examin deceiv dissimil cer belt somehow spar mom answ quest
1060639846891429889	2018-11-08	[]	emy blunt star cov decemb issu read ful interview
1060639567836000256	2018-11-08	[]	hist jewelry debut @metmuseum's latest exhibit body transform
1060627518112366598	2018-11-08	[]	tel stud new fash collab reimagin greas 2018
1060609926702252032	2018-11-08	[]	architect @victoriassecret fash show stil bank bombshel
1060571719612751872	2018-11-08	[]	may cal srpls new collect model uniform less vib
1060552177956110342	2018-11-08	[]	thought pray enough tak act gun viol
1060552161346629634	2018-11-08	[]	massacr borderlin bar gril 304th mass shoot year; 12 day sint america's last
1060550576340115458	2018-11-08	[]	lingu franc celebr stor op bleeck street
1060516463528808448	2018-11-08	[]	@goop lab @onekingslane new design destin know
1060501164012306433	2018-11-08	[]	icon delia's model rememb brand's '90s heyday
1060485818530312192	2018-11-08	[]	it art cur maurizio cattel art pres mind new exhibit alessandro michel shangha
1060470448792711168	2018-11-08	[]	jewelry design launch japanes akoy pearl collect nail pol match
1060455118896795648	2018-11-08	[]	brid wor @simone_rocha_ new york city secret wed
1060439993859129346	2018-11-08	[]	girl spider's web's sverrir gudnason know lif chang
1060424881886650368	2018-11-08	[]	@arianagrande's newest styl inspir middl divorc first wiv club
1060409523498872832	2018-11-08	[]	@amytastley @beeprinsloo @barneysny celebr intery design extraordinair ryan korb
1060394067257974784	2018-11-08	[]	@jlo pul ultim beauty pow mov airport
1060378637004951553	2018-11-08	[]	spring runway tel us wear noth beig brand direct show us
1060363339451240450	2018-11-08	[]	emm thompson mick jag celebr knight brit roy famy
1060348151398326273	2018-11-08	[]	10 @victoriassecret model shar on beauty produc can't liv without
1060335440434286592	2018-11-08	[]	get know @ellekingmusic chart rock 55 tattoo beauty standard liv
1060319833638817793	2018-11-07	[]	bell hadid wear head look diff form fal neut
1060306160849506305	2018-11-07	[]	@moschino @hm collect hit stor tomorrow nov 8 see every look
1060280536017633288	2018-11-07	[]	new e champ design across europ
1060264765040279553	2018-11-07	[]	tild swinton sandro kop subvert coupl styl wes anderson's new exhibit
1060249640057126912	2018-11-07	[]	kim kardash west bring back cargo pant
1060234238086316043	2018-11-07	[]	@marcjacobs mad fash hist collect 26 year ago
1060221857163608064	2018-11-07	[]	meet new skin bright ingredy that's tak dark spot breakthrough result
1060210476087476226	2018-11-07	[]	weekend dalla vogue's edit ham bowl tak city's vibr art scen publ priv museum vog intern edit larg report can't vis treas texa art hub
1060207449758752768	2018-11-07	[]	@dualipa us neon top art camoufl
1060191873946578944	2018-11-07	[]	dov street market's new los angel stor gam chang
1060176318346809349	2018-11-07	[]	@marcjacobs's grung collect perry el back see every look
1060163677385572352	2018-11-07	[]	model carolin bil brah tak vint busy next level new brick spac
1060148386811265024	2018-11-07	[]	18 car model hair transform stol heart
1060117967013339137	2018-11-07	[]	@prada pres lunchbox fund's an fal benefit din new york
1060102667643617280	2018-11-07	[]	jony iv marc newson design lab diamond ring see believ
1060087289504784384	2018-11-07	[]	roland mouret's new book lif work bring past right pres
1060072143076184066	2018-11-07	[]	jewelry design caitlin mociun wor bold stripes pugl wed
1060056866955411456	2018-11-07	[]	hugh jackm trad wolverin polit premy front run first film releas elect day
1060041598346637313	2018-11-07	[]	@timberland's first cre direct christopher raeburn talk
1060026418573332480	2018-11-07	[]	aerin laud martin mondador sartogo celebr launch aerin caban est lauder's form townh
1060011248601968640	2018-11-07	[]	elev last halloween costum inspir feel movy
1059995882949632001	2018-11-07	['#cvff']	best hair makeup look 2018 show
1059980543822127109	2018-11-07	[]	denver's coolest bar resta shop on neighb
1059965215285174272	2018-11-07	[]	foundrae's new bespok jewelry allow cre story enamel symbol gemston
1059949576008933383	2018-11-06	[]	@beyonce giv high fash shout @betoorourke
1059934210746650625	2018-11-06	[]	new york city styl hustl rul democr look lik
1059924206710853632	2018-11-06	[]	rememb nam oliv obl @adidasoriginals @kendalljenner's latest collab
1059908990849683457	2018-11-06	[]	lourd leon shat beauty stereotyp body hair lik fam moth
1059895032214360070	2018-11-06	[]	idr elb fin @people's sexiest man al
1059879516733095936	2018-11-06	[]	western pac nat palau becam first country ban reef tox sunscreen nee know
1059863765229932549	2018-11-06	['#cvff']	insid look 2018 gal din
1059850592372310018	2018-11-06	[]	meet @jadebirdmusic raz brit folk sing tak cue american
1059835463899512832	2018-11-06	[]	insid vog @cfda fash fund fash show
1059820149002379265	2018-11-06	[]	new soho lipstick bar whip perfect shad holiday red
1059804813163147264	2018-11-06	[]	fka twig new instagram zin reinv 90s new york club styl today
1059789342682595328	2018-11-06	[]	kendal jen celebr 23rd birthday cit bik season's covet coat
1059774056877166593	2018-11-06	[]	insid @lacma's art film galahon catherin op guillermo del toro
1059758524950085632	2018-11-06	[]	nin dark nail pol shad bet black
1059743028489924608	2018-11-06	[]	vog edit mood they're buy beat end daylight sav tim
1059727587965091840	2018-11-06	['#carv']	season serg ruffieux leav
1059712149386420225	2018-11-06	[]	@diddy off intim look birthday beauty routin ep
1059696912822136832	2018-11-06	[]	jul roberts' infam armpit hair rev stat on think
1059681479029112832	2018-11-06	[]	feminin icon twin aspir week's styl look
1059666019839549440	2018-11-06	[]	georg condo raf simon turn dia's fal night gal
1059650667546116097	2018-11-06	['#cvff']	what's menu award din chick pot pie cours
1059638074420932609	2018-11-06	['#cvff']	@pyermoss win bod jonath coh nam run
1059636791853101059	2018-11-06	['#cvff']	indust spac brooklyn transform @cfda vog fash fund award
1059624226850775042	2018-11-06	[]	alway cold best wint access keep cozy head toe
1059608977179373568	2018-11-06	['#cvff']	we'r liv red carpet view latest ar 15th @cfda fash fund
1059594792479440896	2018-11-05	[]	@balenciaga's new book unlik anyth seen
1059579194974396422	2018-11-05	[]	art behind nigeria's newest dant anthem crazy styl
1059563902906888193	2018-11-05	[]	fash label mad vot merch they're shar they're head pol novemb 6
1059563199517855744	2018-11-05	[]	elect day tomorrow ready rock vot @gigihadid
1059547267017912320	2018-11-05	[]	new book bernadet van track evolv bernadet corp
1059535816685424641	2018-11-05	[]	@cfda fash fund win annount tonight shop look fin exclud 10 corso como
1059522407940177920	2018-11-05	[]	@newmuseum alexand @mcqueen hon laur prouvost artsy din
1059507117575544832	2018-11-05	[]	nee inspir wardrob week tak look latest street styl cov tbilis fash week
1059491808424669184	2018-11-05	[]	midterm elect almost nee know
1059482948225916928	2018-11-05	[]	@elsahosk unveil @victoriassecret fantasy bra ultim angel makeup look
1059462358781837312	2018-11-05	[]	lov hat cow print stay shop 13 farm piec season
1059446940943945728	2018-11-05	[]	new york city marathon young olymp run puerto rico
1059431530223808512	2018-11-05	[]	hunt vint treas chasseress bring fresh edit week
1059416285426135040	2018-11-05	[]	nin transgend gend nonconform writ know
1059401131569410048	2018-11-05	[]	rees witherspoon rev new bold brunet hair col los angel
1059385755791962117	2018-11-05	[]	got $20 spar jean basquiat's favorit @commedesgarcons coat
1059370311307743232	2018-11-05	[]	solang design mowalol ogunles sound grow skin rich ashy moist import makeup
1059355137154707456	2018-11-05	[]	model alexandr elizabe channel halloween obsess chic short film
1059339897302061056	2018-11-05	[]	@haimtheband obsess hoc poc costum prov
1059324591368273920	2018-11-05	[]	celebr knock door new fant fundra
1059309416753848320	2018-11-05	[]	tak fin jewelry mak class taught paint diamond necklac on vog edit shar expery
1059293906872008704	2018-11-05	[]	@lykkeli tour lif new mom los angel revit person styl
1059278408281214978	2018-11-05	[]	new diet bas skin typ glow week
1059263094030041088	2018-11-05	[]	watch @toroymoi embrac normc styl mus video freel
1059247820006481923	2018-11-05	[]	tak look back @kendalljenner's dram beauty look
1059235149844492289	2018-11-05	[]	francesco fucci's new vis @theory__ vib
1059233569124638721	2018-11-04	[]	simon spurr's new sho label march nyc rock 'n' rol tour
1059218272623706115	2018-11-04	[]	recip perpet best tak holiday meal next level
1059202611327500290	2018-11-04	[]	justin bieb test driv matrimon man bun los angel
1059171631665430529	2018-11-04	[]	@wutangclan launch lipstick collab already break internet
1059156415628132357	2018-11-04	[]	bell hadid tak runway look streets
1059141124542095363	2018-11-04	[]	dry shampoo work easy way fix
1059125731974938624	2018-11-04	[]	46 gwyne paltrow @goop want rebrand menopaus
1059110230494195712	2018-11-04	[]	@chanel cout keir knightley goe disney princess nutcracker's world premy
1059094769668968448	2018-11-04	[]	every wom get hormon check 20s
1059079551916146689	2018-11-04	[]	shop fall's best boot every pric
1059064018722349057	2018-11-04	[]	get bet night's sleep top pri
1059048449205829640	2018-11-04	[]	tbilis model ag found skat skat
1059033004935405568	2018-11-04	[]	mad brand bring sup afford bas soho
1059017653958909952	2018-11-04	[]	martin @margiela mak rar stat contemp fash
1059002355214102528	2018-11-04	[]	consid real apply spring 2019's haut swimwear
1058987147687026688	2018-11-04	[]	kendal jen gig hadid palom elsess shar scariest spookiest story
1058971678636683266	2018-11-04	[]	dian von furstenberg's beauty rul everyon wom know 30
1058956493842714624	2018-11-04	[]	vivien westwood say frack abb them dant party
1058944566626258944	2018-11-04	[]	nicola ghesqu grac coddington rev fash secret @metmuseum
1058929329105711104	2018-11-04	[]	print harry becom ultim instagram husband
1058913955597479936	2018-11-04	[]	nicola ghesqu grac coddington rev fash secret @metmuseum
1058898794413244416	2018-11-04	[]	pre lady gaga's favorit celin bag
1058883039462412289	2018-11-04	[]	fash week migr tbilis georg fam hometown balenciag vet design demn gvasal view best street styl look far
1058867410927796225	2018-11-03	['#metgal']	born @ladygaga @harry_styles @serenawilliams cochair fashion's biggest night 2019
1058855209341014016	2018-11-03	[]	car delevingn tie grown way
1058839883928793088	2018-11-03	[]	get priceless paint across oc lou vuitton cours
1058827950865440770	2018-11-03	[]	olivy roust @balmain speak new cout collect docu lif
1058815846192201728	2018-11-03	[]	michel obam remind us stil styl icon
1058804193262231552	2018-11-03	[]	model know every beauty trick book
1058792150274596864	2018-11-03	[]	dar eyeshadow instagram
1058780397536985088	2018-11-03	[]	roy walk runway fash week
1058767776347840513	2018-11-03	[]	700 peopl turn mass medit nyc lik
1058755650950434816	2018-11-03	[]	dar eyeshadow instagram
1058742079080275969	2018-11-03	[]	model know every beauty trick book
1058730491854102530	2018-11-03	[]	11 cout gown fit disney princess
1058718066081759232	2018-11-03	[]	supermodel naom campbel shar best beauty hack
1058706714176970756	2018-11-03	[]	kat middleton cinderell fash mom @mcqueen
1058694388027715584	2018-11-03	[]	view latest brid fal 2019 collect @oscardelarenta
1058679093431021569	2018-11-03	[]	examin blond privileg real
1058663632165310464	2018-11-03	[]	lov vint nee check instagram vint shop
1058651943558615040	2018-11-03	[]	coach found giv back help @selenagomez @michaelb4jordan
1058637086457249792	2018-11-03	[]	plenty wel girl instagram filipino actress on look
1058621747547791360	2018-11-03	[]	priyank chopr tech invest
1058608984129716225	2018-11-03	[]	chrissy teig john legend beyont jay z best celebr couples' costum halloween 2018
1058593582439981057	2018-11-03	[]	yv saint laur first design act lik rock star
1058581178943447040	2018-11-03	"[""#baekhyun's""]"	get clos look @weareoneexo's second unisex streetwear caps priv bbh
1058568817167732736	2018-11-03	[]	french girl best workout secret corset activewear bien
1058556431065145345	2018-11-03	[]	throwback beauty mom mad hist versac runway
1058543946127851520	2018-11-03	[]	30 fash brand redesign phantom oper mask char
1058528199863349248	2018-11-03	[]	rememb pot perform art alexand @mcqueen's collect 13 year lat
1058512551951114242	2018-11-03	[]	hist behind kat middleton's stun stat banquet jewel
1058499785219551234	2018-11-02	[]	dakot johnson's fam grandmoth prov 80 new 50 suspir premy
1058484510629773312	2018-11-02	[]	@versace beauty rul every bombshel know heart
1058471875825803264	2018-11-02	['#nyfw']	21 new fac @esteelauder shar workout beauty prep
1058460413619326977	2018-11-02	[]	recip perpet best tak holiday meal next level
1058444849958019073	2018-11-02	['#nowyouknow']	bri vinait explain green new deal latest
1058431708083773440	2018-11-02	[]	@chanel cout keir knightley goe disney princess nutcracker's world premy
1058419240452153344	2018-11-02	[]	nata portm show us wear hed sliman'es new celin suit
1058403921876738048	2018-11-02	[]	fash week migr tbilis georg fam hometown balenciag vet design demn gvasal view best street styl look far
1058391403410141184	2018-11-02	[]	print harry becom ultim instagram husband
1058376098847866880	2018-11-02	[]	@haimtheband obsess hoc poc costum prov
1058364052035067904	2018-11-02	[]	exclud first look gwyne paltrow's wed dress off wed photo
1058348116494172160	2018-11-02	[]	@timberland's first cre direct christopher raeburn talk
1058332971755810817	2018-11-02	['#metgal']	spark approv heel sal $50 tim holiday
1058317558405849091	2018-11-02	[]	ev art act sexy beast host benefit @ppfa
1058302155235442688	2018-11-02	[]	ladies' night am ballet the fal gal
1058286924090236929	2018-11-02	[]	solang design mowalol ogunles sound grow skin rich ashy moist import makeup
1058271441655713792	2018-11-02	[]	guest party lik rockst ramon stev mil last night's premy bohem rhapsody
1058256000451395585	2018-11-02	[]	soc platform sex wel shak intim digit ag
1058240778466541568	2018-11-02	[]	meet styl turn design liv fash lif noth boilersuit
1058225276402851845	2018-11-02	[]	ahead releas bohem rhapsody @zandra_rhodes model wed top freddy mercury fel lov
1058209792257417216	2018-11-02	[]	victoir de castel reflect 20 year @dior's cre direct fin jewelry
1058194599431340032	2018-11-02	[]	six celebr makeup art shar favorit highlight tim
1058179145950224384	2018-11-02	['#forcesoffash']	go behind scen vogue's second an conf
1058163560231112704	2018-11-02	[]	get bet night's sleep top pri
1058147746148945922	2018-11-02	[]	@laquansmith bring glam fearless vis new @asos collab
1058132432711495680	2018-11-01	[]	beyont jay champ black pow legend halloween
1058116690922389504	2018-11-01	[]	olivy roust @balmain speak new cout collect docu lif
1058101375043862529	2018-11-01	[]	best celebr halloween makeup instagram
1058086064936681472	2018-11-01	[]	@bellahadid @theweeknd giv beetleju high fash makeov
1058070689360560128	2018-11-01	[]	rihann shut halloween debut fall's must lip col
1058058786525585408	2018-11-01	[]	chrissy teig john legend beyont jay z best celebr couples' costum halloween 2018
1058045647964831747	2018-11-01	[]	suit fal wed guest's go
1058029700390494208	2018-11-01	[]	halloween candy regul hangov read
1058014069960175617	2018-11-01	[]	justin bieb shav head debut rad buzz cut halloween
1057998608895827968	2018-11-01	[]	believ av niru dream second @marcjacobs collab
1057983441650749440	2018-11-01	[]	l bas ecuad sing reinterpret r&amp;b baby girl styl
1057967984944254976	2018-11-01	[]	hyein seo four cult kor label threw hous party brought seo fash feet
1057952534973874178	2018-11-01	[]	queen letiz spain real lov @stevemadden heel
1057937238355599360	2018-11-01	[]	hyp meet hyg introduc @publicschoolnyc @eileenfisherny's collab
1057922102429409281	2018-11-01	[]	girl spider's web's sverrir gudnason know lif chang
1057906931518582784	2018-11-01	[]	sir hotel bring bit rom downtown detroit
1057891476837986304	2018-11-01	[]	18 car model hair transform stol heart
1057876224410861568	2018-11-01	['#forcesoffash']	go behind scen second an conf
1057861013188603905	2018-11-01	[]	secret behind clair foy's rad transform girl spider's web
1057845666863611905	2018-11-01	[]	calvin donn ver insid fash group international's night star gal
1057830473911689216	2018-11-01	[]	new soho lipstick bar whip perfect shad holiday red
1057815285229633536	2018-11-01	[]	tak fin jewelry mak class taught paint diamond necklac on vog edit shar expery
1057799389295661056	2018-11-01	[]	celebr knock door new fant fundra
1057783617655574528	2018-10-31	[]	david casav arch collect peek insid debut book
1057768131815444481	2018-10-31	[]	victor secret help kim kardash sist incred group costum
1057759526408077314	2018-10-31	[]	sery spooky dilar findikoglu's haunt halloween hous cast sin spel
1057743581484646405	2018-10-31	[]	behat prinsloo perfect shad @victoriassecret blond next week's show
1057732083060273155	2018-10-31	[]	brief or hist @xboygeniusx boygeni @lucydacus @phoebe_bridgers @julienrbaker
1057716162245652485	2018-10-31	[]	top mom print harry megh markle's roy tour
1057703877880020993	2018-10-31	[]	vaquer mad halloween costum old box bunch bow on fak crow
1057690175025897472	2018-10-31	[]	glit gloom @christopherkane sav resort 2019 collect photo pitch direct holiday season read ful review view collect
1057674234552557568	2018-10-31	[]	leg expand reach pres first ful pre collect spring 2019 read review see ful collect
1057658496282431488	2018-10-31	[]	japanes televid legend tetsuko kuroyanag halloween inspir nee
1057643051894652929	2018-10-31	[]	meet mol moorkamp design dress new gen uptown girl
1057627693959835649	2018-10-31	[]	allison sarofim host an ep halloween bash guest natal vodianov stefano tonch
1057612447287255040	2018-10-31	[]	headstrong non whos miss serv return vet cost ment heal reliev celebr 6th an gal
1057597325475016704	2018-10-31	[]	sar eirud farm girl swed becam on season's biggest model
1057581842960994308	2018-10-31	[]	@everlane elimin virgin plast busy start new outerwear collect
1057566497017655296	2018-10-31	[]	casablanc new menswear lin par serv high styl apr sport eas
1057551172666564608	2018-10-31	[]	suspira's costum design giul piersant mak dress hair redefin '70s styl someth chic horr
1057536042109149195	2018-10-31	[]	bet midl celebr hulaween glam gho
1057520885203169280	2018-10-31	[]	dress kid halloween instagram
1057505513192259584	2018-10-31	[]	megh markl play pregn glow easy makeup trick
1057490164732301313	2018-10-31	[]	mad walk shop fall's best afford boot $200
1057474702195810310	2018-10-31	[]	@thombrowneny's new golf caps collect stroke rest
1057458685599985664	2018-10-31	[]	30 fash brand redesign phantom oper mask char
1057443128314081280	2018-10-31	[]	welcom salem every day halloween
1057427196615241728	2018-10-31	[]	megh markl op pitfal soc med
1057411072200720384	2018-10-30	[]	nin makeup remov halloween night beyond
1057395783413178374	2018-10-30	[]	beyont first halloween costum pay tribut '90s r&amp;b icon
1057380432579383297	2018-10-30	[]	big new marys reeves' latest collect grow ready select includ first ev denim view spring 2019 collect marys
1057364726555074560	2018-10-30	[]	lago there's thing overdress view best street styl look lago fash week
1057349469963014144	2018-10-30	[]	supermodel's cout halloween costum must seen believ
1057338098592464896	2018-10-30	[]	daniel martin @cuyana team beauty ev
1057322924288434176	2018-10-30	[]	priyank chopr whitney wolf herd bring @bumble ind lav styl
1057311222113038336	2018-10-30	[]	ram malek gav world on first look kri van assche's new @berluti last week view look label's spring 2019 menswear collect
1057295731290193921	2018-10-30	[]	can't vot candid understand posit they're run @oliviamunn explain ic
1057280078898491393	2018-10-30	[]	sienn mil found perfect fal dress $70
1057264639770288128	2018-10-30	[]	expert hair styl model weigh get cool girl cut
1057249267335815168	2018-10-30	[]	piec lik charm mus fest goer world next sum view polo ralph laur spring 2019 collect
1057234071095595008	2018-10-30	[]	fash royal daught margherit maccapan misson launch styl sun swimwear
1057218613860581376	2018-10-30	[]	vivien westwood say frack abb them dant party
1057203395805753345	2018-10-30	[]	kor model rev best sheet mask perfect poreless skin
1057188190036131840	2018-10-30	[]	watch novemb cov star clair foy get touch wild sid
1057172790229590016	2018-10-30	[]	@lenawaithe go deep sneak cult latest project
1057157324140355585	2018-10-30	[]	ryan gosl swe vest pinnac hot dad fash
1057145884729839616	2018-10-30	[]	ryan gosl swe vest pinnac hot dad fash
1057134161708924928	2018-10-30	[]	french montan drake's new styl mus video tribut hip styl icon watch
1057118937366839297	2018-10-30	[]	@_maxwell_'s model sham video mak stat col
1057103451958771714	2018-10-30	[]	best new mascara nee lif fal
1057087501393977344	2018-10-30	[]	ryan gosl swe vest pinnac hot dad fash
1057071937086726144	2018-10-30	[]	design gary graham relaunch room upst new york
1057056780067500032	2018-10-29	[]	best mascara buy accord vog edit
1057041290095931392	2018-10-29	[]	clair underwood dress @houseofcard's madam presid
1057025448134217728	2018-10-29	[]	lov japan's princess ayako wed longtim lov kei moriy
1057010130389291009	2018-10-29	[]	look insid priyank chopra's brid show tiffany's blu box caf
1056994546846973952	2018-10-29	[]	fut diet noth cal count
1056979022113054721	2018-10-29	[]	eight ey mask best beauty sleep lif
1056963790837821441	2018-10-29	[]	megh markl continu speak believ roy tour
1056948317085712384	2018-10-29	[]	priyank chopr pul ultim makeup risk brid show
1056935518175420423	2018-10-29	[]	valu gre dress quit lot ev worn priceless jewel la kat middleton alexand mcqueen tak look best dress best dress week
1056924165062774784	2018-10-29	[]	watch @ciara break icon dant mov new singl dos
1056916247550529537	2018-10-29	[]	kor model rev best sheet mask perfect poreless skin
1056901044230389760	2018-10-29	[]	card b's extrem hair transform shock pixy waist wav
