id	created_at	hashtags	cleaned_text
1093084827946049536	2019-02-06	[]	best fash madrid runway
1093072805846020101	2019-02-06	['#vogueworld']	insid beirut's bright beauty drag
1093061327587889153	2019-02-06	[]	lov difficult wom on vog writ learn mayb cal difficult bad thing
1093049532341018624	2019-02-06	['#vogueworld']	fac canva art tak makeup new extrem
1093037997082185731	2019-02-06	['#vogueworld']	four beauty renegad mak stat eyebrow soc media's head trend
1093026069693849600	2019-02-06	['#vogueworld']	doppelg kat moss rihann jan birkin
1093014658603208704	2019-02-06	['#vogueworld']	shangha par ir yang subvert crazy rich chines stereotyp
1093002622934675462	2019-02-06	['#vogueworld']	tin gao ant model challeng fashion's beauty norm
1092995558338412544	2019-02-06	['#vogueworld']	par art tak beauty inspir artwork
1092983397520207872	2019-02-06	[]	jen lawr report eng
1092972692180033536	2019-02-06	['#nyfw']	see court seat febru
1092959653573537792	2019-02-06	['#vogueworld']	lun new year splash red summon good luck
1092947449369559040	2019-02-06	[]	priyank chopra's dog fash pet hollywood
1092934910153756672	2019-02-05	['#vogueworld']	it paralymp veronic yoko pleban inspir body confid wom everywh
1092922105547706370	2019-02-05	[]	see ful fal 2019 ready collect @officialrodarte
1092916643980816384	2019-02-05	[]	designer's guid lamu island kenya's hid parad
1092904638486065153	2019-02-05	['#vogueworld']	meet @levantecanta modern italy's renaiss wom
1092891385789927424	2019-02-05	['#nyfw']	batshev op pop dressmak heav tim
1092883685240647681	2019-02-05	[]	@kendalljenner get bang
1092871649576304640	2019-02-05	['#nyfw']	@iamkelseylu stev lacy bring nois sesso's first show
1092858511032242176	2019-02-05	['#vogueworld']	aust r&amp;b art @oscarkeysung kid dress box
1092846020822745088	2019-02-05	[]	@virgilabloh talk pre '19 discuss keyston @louisvuitton vis
1092834331763109889	2019-02-05	[]	@gucci1017 might found next big trend men's outerwear
1092830584945156096	2019-02-05	['#vogueworld']	today we'r excit debut platform launch new edit 100
1092822167048343553	2019-02-05	[]	stranger things' natal dyer @sundancefest's breakout styl star
1092810104594989058	2019-02-05	[]	christoffer lundm debut women's off tig sweden's fal '19 collect
1092809345711116293	2019-02-05	[]	fal karin kristin tj sof wallenstam sist trio behind dagm let light shin see ful collect
1092808854482624513	2019-02-05	[]	see ful fal 2019 men's collect @toddsnyderny
1092800373625114627	2019-02-05	[]	smartest money resolv mak year
1092785233655676928	2019-02-05	[]	everyth know print harry megh markle's roy baby
1092770102947336192	2019-02-05	[]	second year @moncler geni encompass 10 collect three new nam ad lin on subtract
1092754790537404417	2019-02-05	['#pfw']	forget @hm chang direct immers the project sedon arizon
1092739232421081089	2019-02-05	[]	monic bellucc prov there's ag limit flawless street styl 54
1092724038991003649	2019-02-05	[]	@kofi siribo new front row star watch
1092708898371526657	2019-02-05	[]	set scen michael philouz recal spectacul venu par menswear show
1092693507767193600	2019-02-05	[]	vogue's intern edit larg ham bowl head turkey's capitol whirlwind weekend celebr birthday dec art collect serd gulgun
1092678202181513216	2019-02-05	[]	new york city resta know wint
1092662766396162048	2019-02-05	[]	story behind @iamkelseylu's extraordin hairy dress
1092647587755278337	2019-02-05	['#metoo']	meet two rec parson grad challeng china's anti- mov fash
1092635210439630853	2019-02-05	[]	lov husband alway lov headband on vog edit expl deal within lov rel
1092622530655981570	2019-02-05	[]	win ticket fash week don favorit designer's char cho
1092610271351328770	2019-02-05	[]	@tovestyrke hit swed pop star support emerg design
1092597578036924416	2019-02-05	[]	skateboard photograph ev mock's rad pink buzz cut caught frank ocean's at
1092584961901817856	2019-02-05	[]	year runway zaddy milf
1092569259966939136	2019-02-04	['#nyfw']	every show pres calend
1092556388176408576	2019-02-04	[]	galaxy hop @cartier's latest high jewelry collect inspir cosmo
1092544681274212352	2019-02-04	[]	best street styl photo stockholm's fal 2019 fash show
1092533340865994752	2019-02-04	[]	@yg's sup bowl mak point polit stat
1092521501570457601	2019-02-04	[]	see ful fal 2019 men's collect @palomospain
1092506874388328450	2019-02-04	['#superbowl']	gisele's effortless wav real star
1092485342664507399	2019-02-04	[]	@rihanna watch sup bowl eith
1092473254755950592	2019-02-04	[]	week world best dress brav frigid wint weath ensembl defy impact combat plummet temp sharp suit fru col unexpect trous look
1092461600517312512	2019-02-04	[]	real thing eth consum
1092449543000653826	2019-02-04	[]	meet chines wom cut hair lifetim vil huang luo china's guangx reg fam dram long hair worn fem resid
1092437237449535488	2019-02-04	['#valentinesday']	ahead look back 15 sweet heart runway
1092421707078488064	2019-02-04	[]	tripl cleans expert way wash fac
1092406362221543425	2019-02-04	[]	@justinbieber drop beig streetwear collect
1092391218607198208	2019-02-04	[]	@justinbieber drop beig streetwear collect
1092375874899533825	2019-02-04	['#superbowl']	13 icon ad tim
1092360710779228162	2019-02-04	[]	best curl tim marilyn monro @rihanna
1092345331654643712	2019-02-04	[]	fak best faux fur coat wear wint long
1092330013066780672	2019-02-04	[]	french girl's guid bang accord par girl
1092314880798019584	2019-02-04	[]	@beyonce @s_c_ want join veg mov
1092299457058738176	2019-02-04	[]	fantast haut cout shoot vog
1092284244892762114	2019-02-04	[]	41 mem model wed
1092268674298363904	2019-02-04	[]	let's reconsid long skirt 13 chic long opt
1092253211006849025	2019-02-04	[]	let's reconsid long skirt 13 chic long opt
1092237765746528256	2019-02-04	[]	tiny sunglass last year ask @rihanna
1092226051248455680	2019-02-04	[]	list soul origin scor dev hyn @blood_orange compos fal 2019 @louisvuitton men's show
1092213149607051264	2019-02-04	[]	10 beauty produc every model medicin cabinet
1092198002121474048	2019-02-03	[]	find london's hid french sid
1092182716626423809	2019-02-03	[]	seren william megh markl bff beauty mom ev across pond
1092170382885433345	2019-02-03	[]	@arianagrande fix tattoo ye read 7 ring
1092157808030769157	2019-02-03	[]	see best street styl copenh fash week
1092142622515306498	2019-02-03	[]	75 ep street styl coat tim
1092127438518259712	2019-02-03	[]	16 chic funct bag tak off beyond
1092115077388558337	2019-02-03	[]	meet epar luxury skin lin design wom col
1092100420313538560	2019-02-03	[]	celebr dress sub weath week's best fash instagram
1092086488433655809	2019-02-03	[]	french model's beach snap pregn body confid finest
1092074935437148160	2019-02-03	[]	best beauty instagram week fil fit goal self mom
1092062936829493248	2019-02-03	[]	@celinedion's new shirt speak volum
1092047621487763457	2019-02-03	['#superbowl']	year's best commerc
1092036180705755136	2019-02-03	[]	keep kardashians' new vint collect
1092024011507277824	2019-02-03	[]	menswear styl hack every wom know
1092012137327878144	2019-02-03	[]	fash world nee commit 18 model standard
1092000148698423296	2019-02-03	[]	here's every person find runway show
1091984998184423424	2019-02-03	[]	bot valentine's day gift bouquet
1091973564478169088	2019-02-03	[]	naom chin wing striking 17 trinidad tobago model watch
1091959093730951168	2019-02-03	[]	bienvenu l'avenue par resta land @saks design first sup
1091943983549501440	2019-02-03	[]	nee new dress award season friday night din rent armar eco age's pop la
1091928859015041024	2019-02-03	[]	country pow passport world
1091913447544180736	2019-02-03	[]	@beyonce rev forgot '90s trend
1091898287114866689	2019-02-03	[]	deb around wear vint fur
1091882933823201282	2019-02-03	[]	insid miami's pegas cup world's richest hors rac
1091867797133684736	2019-02-03	[]	drip hard gucc man quavo
1091852631612551171	2019-02-03	[]	lov vint nee check instagram vint shop
1091840939050586112	2019-02-02	[]	lov vint nee check instagram vint shop
1091828983782612992	2019-02-02	[]	sou am city nam world capit architect
1091817175738957825	2019-02-02	[]	@gwynethpaltrow's guid healthy sunday brunch
1091805030590697472	2019-02-02	['#10yearchallenge']	best photo
1091793335767977984	2019-02-02	[]	writ fash hist @metmuseum on dress tim behind muse team keep 33 fash ensembl al look best
1091781313605091328	2019-02-02	[]	oper star @isabelleonardny sing @sesamestreet perform ruth bad ginsburg suprem court
1091769210219491330	2019-02-02	[]	introduc uson new post dress label inspir frank lloyd wright
1091757091897987072	2019-02-02	[]	supermodel naom campbel shar best beauty hack
1091744946330234880	2019-02-02	[]	healthy diet fut focus eat
1091732626753372161	2019-02-02	[]	21 stun unconv eng ring $1
1091717273226829824	2019-02-02	[]	10 clueless beauty rul stil swear two decad lat
1091704948163788800	2019-02-02	[]	vint account instagram tail mad mal fash nerd
1091690827355701248	2019-02-02	[]	know gisel b brok leonardo dicaprio
1091679440793407490	2019-02-02	[]	street trend fal 2019 menswear show
1091666604524371968	2019-02-02	[]	bohem beach town colombia's best secret
1091651133855145984	2019-02-02	[]	first @liluzivert @lilyachty tri @louisvuitton earbud
1091637904655421445	2019-02-02	[]	cora marabel giv eco fash french girl twist
1091625914272763904	2019-02-02	[]	newlyw nick jona priyank chopr jona attend second an learn lab vent wint gal
1091614538183704576	2019-02-02	[]	31 fab valentine's day gift celebr lov every form
1091599666389700608	2019-02-02	[]	cobr mak shirt pant jacket want wear
1091587335077224449	2019-02-02	['#superbowl']	touchdown beauty look watch sunday's big gam
1091572135900971008	2019-02-02	[]	mak person 14 custom jewelry gift valetine's day
1091559924457455617	2019-02-02	[]	print harry megh markl almost ready mov frogm cot
1091547346159263744	2019-02-02	[]	12 fac body moist transform dry wint skin overnight
1091531584052830208	2019-02-02	[]	@beyonce borrow boy
1091517403371061249	2019-02-02	[]	new contemp label draw princess diana's cas styl
1091502027161645062	2019-02-02	[]	11 cout gown fit disney princess
1091489808206172161	2019-02-02	[]	dress typ par wait hom profess rif j weston loy olivy saillard pres 17 new bespok vary hous class moccassin 180
1091477405179498496	2019-02-01	[]	yv saint laur first design act lik rock star
1091461602161975301	2019-02-01	[]	strong see inspir mess megh markl wrot banana pack meal @one25charity char assist fem sex work street bristol
1091449464525672451	2019-02-01	[]	@chrissyteigen bring back volumin blowout bev hil
1091437788636024832	2019-02-01	[]	megh markl know navig heel baby bump
1091422591473119235	2019-02-01	[]	@celinedion shut par 70s disco curl moulin roug min dress
1091406876821147648	2019-02-01	[]	throwback beauty mom mad hist versac runway
1091391488234319872	2019-02-01	[]	hailey baldwin tak beig beyond bas
1091376039115272192	2019-02-01	['#superbowl']	year's best commerc
1091360875469070336	2019-02-01	[]	form cour design mey arnaud vail relaunch first collect copern
1091347137558908928	2019-02-01	[]	keep kardashians' new vint collect
1091331620303450112	2019-02-01	[]	anyon mak mal fash har hap @virgilabloh
1091316395156127744	2019-02-01	[]	see best street styl copenh fash week
1091301575967105024	2019-02-01	[]	madonna's instagram rev secret fash tal
1091290121117286400	2019-02-01	[]	priyank chopr step on winter's afford pair jean
1091277409482100736	2019-02-01	[]	victor beckham's new fash pal son brooklyn's new girlfriend
1091265779243380737	2019-02-01	[]	writ fash hist @metmuseum on dress tim behind muse team keep 33 fash ensembl al look best
1091253716219580416	2019-02-01	[]	cur chap lip wint
1091242294819409921	2019-02-01	[]	examin blond privileg real
1091230432820105216	2019-02-01	['#pfw']	forget @hm chang direct immers the project sedon arizon
1091218839944220673	2019-02-01	[]	brid wor custom @calvinklein groom wor custom bucket hat miam muse wed
1091207043069997063	2019-02-01	[]	second year @moncler geni encompass 10 collect three new nam ad lin on subtract
1091183407290335232	2019-02-01	[]	irin shayk @theirishayk debut new waist hair par
1091172071483281409	2019-02-01	[]	sou am city nam world capit architect
1091157078830399488	2019-02-01	[]	@beyonce rev forgot '90s trend
1091144207694266369	2019-02-01	[]	@beyonce @s_c_ want join veg mov
1091130320206868485	2019-02-01	[]	@trvisxx tak man har pol vortex
1091118044041093120	2019-01-31	[]	seren william megh markl bff beauty mom ev across pond
1091105215015727104	2019-01-31	[]	@vintnerdaughter launch second produc wel wor wait
1091093086137188353	2019-01-31	[]	street trend fal 2019 menswear show
1091080677439737857	2019-01-31	[]	season scarf salv ferragamo sumatr print stand
1091068717855883264	2019-01-31	[]	latest street styl photo copenhagen's fal 2019 fash show
1091055899022688257	2019-01-31	[]	@celinedion's new shirt speak volum
1091043730839257088	2019-01-31	[]	@mileycyrus @rowanblanchard @amandlastenberg toast @miumiuofficial women's tal
1091032362249535489	2019-01-31	['#superbowl']	13 icon ad tim
1091020989167751170	2019-01-31	[]	meet nat am art whos hand skat sho becom sens
1091008506520653824	2019-01-31	[]	@arianagrande fix tattoo ye read 7 ring
1090996410051371009	2019-01-31	[]	@celinedion shut par 70s disco curl moulin roug min dress
1090984913808035840	2019-01-31	[]	mask ban puffy
1090969516434182149	2019-01-31	[]	meet styl turn design liv fash lif noth boilersuit
1090954207887278086	2019-01-31	[]	object edit can't stop think
1090938812199587840	2019-01-31	[]	daniel day ultim man crush
1090923430831104000	2019-01-31	[]	hyp meet hyg see fal 2019 menswear collect @astridandersens
1090908287590109184	2019-01-31	[]	let's reconsid long skirt 13 chic long opt
1090892800621793280	2019-01-31	[]	mary poppin return guid london
1090877370016374784	2019-01-31	[]	fak best faux fur coat wear wint long
1090862181988610048	2019-01-31	[]	queen elizabe ii's travel wardrob champ brit fash
1090846913556082688	2019-01-31	[]	@iamcardib already liv best lif 2019
1090831372657328128	2019-01-31	[]	set scen michael philouz recal spectacul venu par menswear show
1090815573297119232	2019-01-31	[]	writ fash hist @metmuseum on dress tim behind muse team keep 33 fash ensembl al look best
1090799981433417728	2019-01-31	[]	object edit can't stop think
1090784738716061697	2019-01-31	[]	const innov cult includ convers tapestry ceo vict lui
1090780005641134080	2019-01-31	[]	madonna's instagram rev secret fash tal
1090768450392334336	2019-01-31	[]	see best street styl copenh fash week
1090755825969385478	2019-01-30	['#valentinesday']	ahead look back 15 sweet heart runway
1090751022023278592	2019-01-30	[]	copenh paint sculpt mak ear minim covet season
1090747967273881600	2019-01-30	[]	@justinbieber drop beig streetwear collect
1090736035359875073	2019-01-30	[]	keep kardashians' new vint collect
1090723156770373640	2019-01-30	[]	christian dior design dream wow london
1090711680131256321	2019-01-30	[]	@mcqueen's sarah burton fost fash tal
1090698936837390336	2019-01-30	[]	@liluzivert's col cho put gen yellow sham
1090688395800653824	2019-01-30	[]	@rihanna tak wint sand frosty new height
1090676337235427330	2019-01-30	[]	megh markl reinv roy updo london
1090663621531783168	2019-01-30	[]	sit nee sit tak outstand jeff goldbl look
1090651562681217024	2019-01-30	['#sund']	see @lupita_nyongo's stun @versace puff 2019 film fest
1090636053814435845	2019-01-30	[]	best new plac eat stay play seattl
1090620549573808128	2019-01-30	[]	on vog writ lov kat moss' new look
1090605048718127105	2019-01-30	[]	fantast hair makeup last styl tweak zoom detail scroll latest behind mag spring '19 cout show cov
1090589779496972288	2019-01-30	[]	object edit can't stop think
1090574481700081664	2019-01-30	[]	nicol kidman's cool braid win best courtsid beauty aust op
1090559050046160896	2019-01-30	[]	best cold weath access also brightest expand col palet season mix thing
1090543766568648704	2019-01-30	[]	gam beauty produc wor hyp 2019
1090528367663898625	2019-01-30	[]	insid cre direct elian gil rodriguez's escap pristin parad philippin
1090513256446414848	2019-01-30	[]	rihanna's report launch luxury brand look lik
1090498058062831618	2019-01-30	[]	week 2019 @kesharose already mak good new year's resolv
1090482612060213248	2019-01-30	[]	nicol kidman's cool braid win best courtsid beauty aust op
1090467300350808064	2019-01-30	[]	fantast hair makeup last styl tweak zoom detail scroll latest behind mag spring '19 cout show cov
1090451623472701441	2019-01-30	[]	season suggest plethor plaid
1090436094242504705	2019-01-30	[]	lordel nasc label cre sustain gend non cloth
1090420354089189376	2019-01-30	[]	monic bellucc prov there's ag limit flawless street styl 54
1090404779333959680	2019-01-30	[]	beckhams' latest fash mom doubl world's wait
1090389337206857728	2019-01-29	[]	fab mystery man @maisonvalentino's cout show
1090373699327483904	2019-01-29	[]	nel diamond hon luncheon support hudson riv park
1090362101607088128	2019-01-29	[]	carolin polachek @carolineplz turn sick day maj fash mom
1090348978649137152	2019-01-29	[]	last two year copenh fash week grown high vis ent glob fash industry street styl photo prov
1090337298527543304	2019-01-29	[]	@madonna's cool braid ultim travel day beauty solv
1090325017894834177	2019-01-29	[]	@celinedion real car think attitud continu embody kind want bring us 2019
1090313152221331456	2019-01-29	[]	weekend on @sundancefest celebr celebr festival's dar rost
1090300647289827334	2019-01-29	[]	@itsshangela turn @sagawards
1090288868258168835	2019-01-29	[]	kat middleton @mcqueen littl box bag turk label
1090277149620219909	2019-01-29	[]	@altuzarrastudio's got brand new bag
1090265537169379328	2019-01-29	['#sagaward']	@yarashahidi's outfit two stun look on
1090251217694089218	2019-01-29	[]	best beauty instagram week @kaiagerber @imaanhammam
1090235671934132225	2019-01-29	[]	@prada mak unlik cameo @thesimpsons
1090220295359787008	2019-01-29	[]	@prada mak unlik cameo @thesimpsons
1090205098033192960	2019-01-29	[]	dakot johnson's gym hair workout mot nee
1090193552351657984	2019-01-29	['#sagaward']	best beauty look 2019
1090181739287363585	2019-01-29	[]	@celinedion giv execut real cout twist
1090166518980186113	2019-01-29	[]	netflix's sex educ sweet raunchy pretty clos perfect tv sery
1090151332009385984	2019-01-29	[]	@celinedion giv execut real cout twist
1090139899800547328	2019-01-29	[]	@offsetyrn could pul suit col
1090124718974345216	2019-01-29	[]	@celinedion shut par 70s disco curl moulin roug min dress
1090109498545631232	2019-01-29	[]	meet mar amtoft mikkels design behind copenh coolest new lin velvet bodysuit
1090097384263217157	2019-01-29	[]	@celinedion shut par 70s disco curl moulin roug min dress
1090085991593988096	2019-01-29	[]	fac sound 2 mask routin hom
1090073341279588352	2019-01-29	[]	fin good new marco zanin going launch label
1090061479066419206	2019-01-29	[]	print harry megh markl outfit new child look back roy belov baby access
1090049016426102784	2019-01-29	[]	netflix's sex educ sweet raunchy pretty clos perfect tv sery
1090037551971348480	2019-01-29	[]	forget diamond pearl perfect valentine's day gift
1090025397406834688	2019-01-28	[]	@jordan_roth broadway produc four tony nam july premy moulin roug dress shar spring 2019 haut cout show journ
1090013904347021313	2019-01-28	[]	15 star inspir fash design year
1090002262183809026	2019-01-28	['#sagaward']	emm ston brok red carpet rul
1089990579239436288	2019-01-28	[]	tak not @aoc rev mult skinc routin instagram
1089975384983130115	2019-01-28	[]	priyank chopr nick jona anoth wed receiv tim nor carolin
1089951256980934656	2019-01-28	['#73questions']	phoeb wal @fleabag's return stag fem rag mother's best adv latest
1089939917969477632	2019-01-28	[]	know tak @bellahadid's best paparazz pict @theweeknd
1089928037955747840	2019-01-28	[]	virgil abloh show mal har spring 2019 debut cre direct menswear lou vuitton sint celebr @realchalamet @michaelb4jordan test red carpet
1089915239104172034	2019-01-28	[]	cout show par award ev west coast globe's best dress star ful forc past week
1089899779134492672	2019-01-28	[]	say goodby wint red cc cream
1089884482428174336	2019-01-28	[]	pul ev bik short chrissy teig
1089869222338088960	2019-01-28	[]	wrap suit thing mahershal al
1089854025116405761	2019-01-28	[]	compet k star jessic jung com soc med styl
1089838606565429248	2019-01-28	[]	writ fash hist @metmuseum on dress tim behind muse team keep 33 fash ensembl al look best
1089823372815618048	2019-01-28	[]	best new plac eat stay play seattl
1089808110091493381	2019-01-28	[]	beauty look domin instagram fee ind year slat aesthet sound best beauty instagram week
1089792872474398720	2019-01-28	[]	stil nee wint coat milen silvano's upcyc sheepskin belong top wish list
1089777489063395328	2019-01-28	[]	@gwynethpaltrow queen monochrom yet
1089762372686958594	2019-01-28	[]	@mileycyrus pay tribut chris cornell's styl leg
1089747155441643521	2019-01-28	['#sagaward']	emm ston brok red carpet rul
1089740368063725569	2019-01-28	[]	lik men red carpet har off stay
1089734590753923072	2019-01-28	[]	see unconv styl win night
1089733824777543680	2019-01-28	['#sagaward']	@yarashahidi's outfit two stun look on
1089723806539759621	2019-01-28	['#sagaward']	see mad best dress list tonight's
1089711418751045632	2019-01-28	['#sagaward']	best beauty look 2019
1089704227918807040	2019-01-28	['#sagaward']	@ladygaga step bombshel leg rev 2019
1089694931168477184	2019-01-28	[]	katy perry orlando bloom start 2019 apr ski couple's edit
1089679709795946497	2019-01-28	[]	penelop cruz good jewelry bal import tre
1089664299994361857	2019-01-27	['#sagaward']	see red carpet styl year's
1089663980371697664	2019-01-27	[]	hyp meet hyg see fal 2019 menswear collect @astridandersens
1089648561820782593	2019-01-27	[]	mary poppin return guid london
1089633234877665280	2019-01-27	[]	coco chanel mad habit wear singl whit camell black lik jewel icon born @chanelofficial's new high jewelry collect celebr
1089617558267936768	2019-01-27	[]	on vog writ lov kat moss' new look
1089604320369274880	2019-01-27	[]	viv @itsjeremyscott designer's retrospect op dalla
1089592030257385472	2019-01-27	[]	13 best fash instagram week
1089579689700659206	2019-01-27	[]	best beauty instagram week @kaiagerber @imaanhammam
1089564263033827328	2019-01-27	[]	fak best faux fur coat wear wint long
1089548730993397767	2019-01-27	[]	luxury oil detox soak here's tak perfect wint bath
1089533533218136064	2019-01-27	[]	first tim 30 year look lik osc hap without host
1089518081238536192	2019-01-27	[]	gam beauty produc wor hyp 2019
1089502436052688896	2019-01-27	[]	mask ban puffy
1089487163295703040	2019-01-27	[]	deep day 10 best moist sav dry wint skin
1089471762159538177	2019-01-27	[]	daniel day ultim man crush
1089456481416691713	2019-01-27	[]	gam beauty produc wor hyp 2019
1089441302486372352	2019-01-27	[]	mak dry january's mocktail
1089426160759513093	2019-01-27	[]	lordel nasc label cre sustain gend non cloth
1089410945649131520	2019-01-27	[]	best new plac eat stay play seattl
1089395570194685952	2019-01-27	[]	stil nee wint coat milen silvano's upcyc sheepskin belong top wish list
1089380368841654277	2019-01-27	[]	rihanna's report launch luxury brand look lik
1089364855302377473	2019-01-27	[]	queen elizabe ii's travel wardrob champ brit fash
1089349750296662018	2019-01-27	[]	ye thing last forev cas mem cav cak convint sad colleg girl long ago thing might turn ok on vog writ rememb carol chan meant many
1089334144918798337	2019-01-27	[]	watch @troyesivan romp around breezy new mus video
1089318673406410753	2019-01-27	[]	@rwitherspoon real think vogue's new origin short pul back curtain
1089303239940550656	2019-01-26	[]	best brunet tim pen cruz jacky
1089287969880588288	2019-01-26	[]	week 2019 @kesharose already mak good new year's resolv
1089272327907561474	2019-01-26	[]	megh markle's rainy day dress cost less $35
1089256999844564992	2019-01-26	[]	watch exclud clip halston @sundancefest premy
1089241325948555264	2019-01-26	[]	go big stay hom sup chunky swe
1089225583890976768	2019-01-26	[]	extrav envy destin wed vog
1089210078006251521	2019-01-26	[]	season suggest plethor plaid
1089194491318288384	2019-01-26	[]	@adele transform anoth fam country sing instagram
1089179030346190849	2019-01-26	[]	everyth know print harry megh markle's roy baby
1089163730418585600	2019-01-26	[]	anyon mak mal fash har hap @virgilabloh
1089148150386958336	2019-01-26	[]	insider's guid atin hid parad northeast coast brazil
1089132664651681793	2019-01-26	[]	wed berkshir turn exub lawn party
1089117242716053504	2019-01-26	[]	fil fjord streetwear grown
1089101845807677440	2019-01-26	[]	first daniel day brooklyn beckham rock class am workwear label
1089086697785249792	2019-01-26	[]	@mileycyrus bring disco glamo light day
1089071115413213186	2019-01-26	[]	@bellahadid bring back 80s access
1089055654516613120	2019-01-26	[]	work appropry cold weath proof vog staff pick best sho wear work wint
1089040367620669441	2019-01-26	[]	@cartier launch new jewelry collect world din party
1089024916647755776	2019-01-26	[]	@liluzivert fashion's hottest new access man bag
1089009432464379904	2019-01-26	[]	melbourn @vogueaustralia aust fash council celebr loc tal
1088993692692688896	2019-01-26	[]	@chanel's new beauty at mad expery perfect instagram
1088981365197029376	2019-01-26	[]	@celinedion shut par 70s disco curl moulin roug min dress
1088969317348196357	2019-01-26	[]	meet @ellabalinska charlie's angel star stol show cout week par
1088956455259172864	2019-01-26	[]	insid styl kat young's @chanel trip par cout week
1088954575950962689	2019-01-26	[]	@mileycyrus prov know pow access
1088943115053031424	2019-01-25	[]	queen elizabe mad pow stat troubl tim
1088930790220681217	2019-01-25	[]	@victoria beckham frick @sotheby celebr fem triumph exhibit 21 work groundbreak fem art 16th 19th century
1088925508547551234	2019-01-25	[]	adam selm launch rev tim favorit pop cult exerc mom
