id	created_at	hashtags	cleaned_text
1085369144684486658	2019-01-16	[]	penelop cruz good jewelry bal import tre
1085356183672758272	2019-01-16	[]	new manhat salon slic par heav
1085340660930998272	2019-01-16	[]	@iamcardib's 10 challeng instagram tel us styl
1085326385248235521	2019-01-16	[]	count spring 2019 cout season look back fiv haut arch show first look back @chanel's spring 1997 cout collect pres ritz hotel par
1085311248437264384	2019-01-15	[]	writ fash hist @metmuseum on dress tim behind muse team keep 33 fash ensembl al look best
1085299883559526402	2019-01-15	[]	invit @louisvuitton men's show spark michael jackson glov
1085284455638548481	2019-01-15	[]	first solo muse show jord casteel's hum portrait get ev clos
1085272682499854336	2019-01-15	[]	fal lind menswear lead kirk mill filt deeply person tak fash anecdot avat romanov famy view collect
1085261345933705216	2019-01-15	[]	view every look spring 2019 ready collect @rachel_comey
1085253064322367488	2019-01-15	[]	offset rap goe rav
1085238468882518016	2019-01-15	[]	view ful runway @heronpreston's fal 2019 men's show
1085237953868238848	2019-01-15	[]	see every look @albertaferretti's pre '19 collect
1085229241908846592	2019-01-15	[]	tiny sunglass last year ask @rihanna
1085217401950617601	2019-01-15	[]	busy week menswear show london flor edit buy mov mil look photograph phil oh's street styl photo what's trend it city
1085205063302295553	2019-01-15	[]	broadway legend carol chan died 97
1085202882327121921	2019-01-15	[]	menswear styl hack every wom know
1085191294119366661	2019-01-15	[]	see ful runway @tomford's fal 2019 men's collect
1085176155987234818	2019-01-15	[]	let's reconsid long skirt 13 chic long opt
1085160849373835264	2019-01-15	[]	let's start year posit not 11 reason excit 2019 fash
1085145606333648896	2019-01-15	[]	styl kat young talk mak gold glob mag rachel weisz
1085130383207944193	2019-01-15	[]	pre @fendi took inspir book 19th french ironwork gat ant tom men japanes kimono see ful collect
1085115221910478848	2019-01-15	[]	compet k star jessic jung com soc med styl
1085099952701956096	2019-01-15	['#timesup']	hollywood spotlit year's gold glob
1085084505403121664	2019-01-15	[]	go wint wed without on styl coat
1085069353945653248	2019-01-15	[]	@delvaux op first us flag on icon corn new york
1085054058338107392	2019-01-15	[]	consid heel snow boot stay high dry wint
1085042461347586048	2019-01-15	[]	@gigihadid show support @amarch4ourlives
1085028728743317505	2019-01-15	[]	tripl cleans expert way wash fac
1085013206882488320	2019-01-15	[]	@chewinggum's @michaelacoel goe glob devast new project
1085001362306461696	2019-01-15	[]	@lin_manuel receiv stand ov @hamiltonmusical's op night puerto rico
1084986844515844096	2019-01-15	[]	design duchess @givenchy's clar waight kel mak mark
1084972334321225728	2019-01-15	['#beautysecret']	here's @brumarquezine fak brazil glow dead wint latest
1084958745388560384	2019-01-14	[]	meet design behind @ladygaga's mesm sci costum
1084943455024017408	2019-01-14	[]	person brand replac logo trend @kaliuchis say ye
1084928174788657152	2019-01-14	[]	chrissy teig oliv mun step 2019's biggest red carpet beauty trend
1084915641495289857	2019-01-14	[]	kat middleton celebr 37th birthday
1084902303084220418	2019-01-14	[]	timo chalamet's red carpet sign quick becom clear
1084887201798852609	2019-01-14	[]	veg fash week com la lot eco leath faux fur
1084875321353080839	2019-01-14	[]	@ladygaga red carpet @criticschoice award
1084863466488430592	2019-01-14	[]	megh markle's reg purpl @aritzia dress already sold
1084848147648704515	2019-01-14	[]	see ful runway @fendi's fal 2019 menswear collect
1084839132965335040	2019-01-14	[]	see ful fal 2019 men's collect @missoni
1084825404685381632	2019-01-14	[]	see look 21 fal 2019 menswear show
1084813276637249539	2019-01-14	[]	10 best dress celebr week prov year strong start
1084797950998597632	2019-01-14	[]	supermodel maggy riz ad stor own fash resum
1084782759678304256	2019-01-14	[]	lupit nyong'o's gold glob heel cost $45 look less
1084767571503652865	2019-01-14	[]	propos supermoon switzerland led wed celebr utah desert
1084752235731578882	2019-01-14	[]	smartest money resolv mak year
1084736818493489154	2019-01-14	[]	victor beckham's new fash pal son brooklyn's new girlfriend
1084721681443287040	2019-01-14	[]	victor beckham's new fash pal son brooklyn's new girlfriend
1084706309918859269	2019-01-14	[]	75 ep street styl coat tim
1084690892542357504	2019-01-14	[]	see look @etroofficial fal 2019 menswear collect
1084677924991709184	2019-01-14	[]	nee runway nicola ghesqu hir pow poss @louisvuitton pre lookbook
1084668780075278336	2019-01-14	[]	view complet @dsquared2 fal 2019 menswear collect
1084653247300857858	2019-01-14	[]	see complet @msgm_ fal 2019 menswear collect
1084639837217587201	2019-01-14	[]	see look sunne fal 2019 menswear collect
1084627414272167941	2019-01-14	[]	see look @prada fal 2019 menswear show
1084611983754887168	2019-01-14	[]	fiv thing know @iamsandraoh
1084596775372103681	2019-01-13	[]	beyont jay help louvr muse set new record
1084581518515859456	2019-01-13	[]	tail on domin trend fash mom mean fruit tim @theory__ view ful pre '19 collect
1084565895865880579	2019-01-13	[]	country pow passport world
1084550495883141120	2019-01-13	[]	@ladygaga chic nyc
1084534990472429568	2019-01-13	[]	megh markle's new roy respons perfect fit
1084519376726999040	2019-01-13	[]	bohem beach town colombia's best secret
1084504054011740160	2019-01-13	[]	french girl's guid bang accord par girl
1084488729044103168	2019-01-13	[]	2019 gold glob vir mom
1084473595273904129	2019-01-13	[]	find london's hid french sid
1084458238568026112	2019-01-13	[]	2019 gold glob vir mom
1084444419045113857	2019-01-13	[]	lov vint nee check instagram vint shop
1084432106061729794	2019-01-13	[]	week raf simon's depart annount calvin klein swift undo chang mad
1084416601972269056	2019-01-13	[]	15 star inspir fash design 2019
1084402483261308928	2019-01-13	[]	see every cheeky piec @rihanna's @savagexfenty valentine's collect
1084390345046220800	2019-01-13	[]	season scarf salv ferragamo sumatr print stand
1084377677241507840	2019-01-13	[]	700 peopl turn mass medit nyc lik
1084365366162276352	2019-01-13	[]	styl kat young talk mak gold glob mag rachel weisz
1084353101728006144	2019-01-13	['#unsungherooffash']	let gabriel held's spotlight hero '90s red carpet 2019 styl touchston
1084337867395080192	2019-01-13	[]	model know every beauty trick book
1084325708728619013	2019-01-13	[]	view complet @neilbarrett fal 2019 menswear collect
1084313493820637184	2019-01-13	[]	see every look @brioni_official fal 2019 menswear show
1084301283895455745	2019-01-13	[]	styl workout sho sneakerhead gym fan
1084289131101016065	2019-01-13	[]	view complet @marniofficial fal 2019 menswear show
1084277094748745728	2019-01-13	[]	see look @mbcountyofmilan fal 2019 menswear show
1084265101648113664	2019-01-13	[]	@bellahadid bring back 80s access
1084252711825088512	2019-01-13	[]	see look @ralphlauren fal 2019 menswear collect
1084240707114749958	2019-01-13	[]	see look @versace fal 2019 menswear show
1084228354306392064	2019-01-12	[]	best backst photo fal 2019 menswear show
1084214977689456642	2019-01-12	[]	robert pattinson show skin red carpet wel sort
1084199471934771200	2019-01-12	[]	best dress celebr gold glob red carpet
1084187531938275329	2019-01-12	[]	dakot johnson's gym hair workout mot nee
1084175020333690880	2019-01-12	[]	@eizamusica mast wak regim learn mom focus skin first makeup second
1084162148044029959	2019-01-12	[]	fil fjord streetwear grown
1084150028111892480	2019-01-12	[]	plenty wel girl instagram filipino actress on look
1084137730886561797	2019-01-12	[]	beauty ic maid walk snowstorm john galliano's fal 2019 show
1084125809437220867	2019-01-12	[]	first breakout beauty trend 2019 already blow instagram
1084113449423114240	2019-01-12	[]	watch brazil pop star @pabllovittar spectacul 15 drag transform
1084099848591368192	2019-01-12	[]	meet nat am art whos hand skat sho becom sens
1084088003407106048	2019-01-12	[]	examin blond privileg real
1084072460885131264	2019-01-12	[]	jean dama french red lipstick second easy bang trim
1084059979160662017	2019-01-12	[]	lady gag prov diamond dark root girl's best friend
1084048081442742272	2019-01-12	[]	faux leath ev bet real thing design say ye
1084035147870146568	2019-01-12	[]	@louisvuitton land new york resort 2020 show
1084019856415051776	2019-01-12	[]	dar eyeshadow instagram
1084007027947507712	2019-01-12	[]	@iamkelseylu's flo braid ste spotlight new mus video i'm lov
1083994852168265729	2019-01-12	[]	miss latest street styl cov florence's fal 2019 pitt uomo fair
1083982570767953920	2019-01-12	[]	giv happy hour sav on vog writer's san heal
1083968469404737536	2019-01-12	[]	think streetwear new phenomenon meet luc benin start hyp 30 year ago
1083953124706967552	2019-01-12	[]	wrap suit thing mahershal al
1083940874843754497	2019-01-12	[]	felish noel shift euroc nar around renaiss art trend label fe noel
1083928224172773377	2019-01-12	[]	vogue's sex object expl fraught territ gend sex technolog intersect
1083914809144475648	2019-01-12	[]	megh markle's hatch dress matern brand act chic
1083902306775715841	2019-01-12	[]	extrav envy destin wed vog
1083889458699739142	2019-01-12	[]	@lupita_nyongo step head metal
1083874296819302400	2019-01-11	[]	priyank chopr nick jona continu jet streak glam carib vac
1083858586386776064	2019-01-11	[]	@prada mak unlik cameo @thesimpsons
1083845894909366278	2019-01-11	[]	new detail megh markl print harry's country est
1083833431879045120	2019-01-11	[]	@blakelively beat wint chil kil leg rev
1083821136675303428	2019-01-11	[]	@gucci1017 @keyshiakaoir continu court sid hot streak
1083809519707308032	2019-01-11	[]	bohem beach town colombia's best secret
1083797694110490626	2019-01-11	[]	watch @troyesivan romp around breezy new mus video
1083786140640002048	2019-01-11	[]	neon green clear winter's hottest trend here's 25 supercharg piec bright wint wardrob
1083782151156453377	2019-01-11	[]	first breakout beauty trend 2019 already blow instagram
1083779253857067008	2019-01-11	[]	neon green clear winter's hottest trend here's 25 supercharg piec bright wint wardrob
1083770538298888195	2019-01-11	[]	see latest collect anton marra
1083762022049828864	2019-01-11	[]	week raf simon's depart annount calvin klein swift undo chang mad
1083748926807715840	2019-01-11	[]	tail on domin trend fash mom mean fruit tim @theory__ view ful pre '19 collect
1083737393017044992	2019-01-11	[]	compet k star jessic jung com soc med styl
1083722114304303104	2019-01-11	['#pittiuomo']	@luisaviaroma @nakedheartf annount collab dazzl gal din
1083706707203817472	2019-01-11	[]	beauty ic maid walk snowstorm john galliano's fal 2019 show
1083691468030726145	2019-01-11	[]	we'r feel nostalg vog runway
1083676152407969793	2019-01-11	[]	stil nee wint coat milen silvano's upcyc sheepskin belong top wish list
1083660844934881281	2019-01-11	[]	valentino berlut al aldo mar camillo goe solo flor see every look
1083645708719280128	2019-01-11	[]	kri jen jen garn rooney mar attend @theartofelysium's heav
1083631554776186880	2019-01-11	[]	best new plac eat stay play seattl
1083616234640420864	2019-01-11	[]	@ritaora giv priv jet styl cool fash twist
1083600854203023360	2019-01-11	[]	country pow passport world
1083585456242130944	2019-01-11	[]	loos messy updo becom someth sign duchess sussex latest look tak decid pol roy
1083569754005295108	2019-01-11	[]	@bellahadid @karliekloss @joansmalls suit @louisvuitton menswear @virgilabloh @chromeheartsusa din
1083554562945044481	2019-01-11	[]	netflix's sex educ sweet raunchy pretty clos perfect tv sery
1083542175424700416	2019-01-11	[]	@gwynethpaltrow queen monochrom yet
1083529820363984899	2019-01-11	[]	best dress celebr gold glob red carpet
1083516528539123713	2019-01-11	[]	somehow ram malek pul red suit red carpet
1083501355921272838	2019-01-10	[]	go big stay hom sup chunky swe
1083487948346146818	2019-01-10	[]	bell hadid tak @virgilabloh's warc vest street
1083475332299137027	2019-01-10	[]	@rwitherspoon real think vogue's new origin short pul back curtain
1083473812677713927	2019-01-10	[]	frank oc pul anyth
1083462351930695682	2019-01-10	[]	megh markle's new roy respons perfect fit
1083449701763084290	2019-01-10	[]	rolf ekro fin design delight audy two debut pitt uomo week on fash unus backst
1083433933889511425	2019-01-10	[]	@ladygaga chic nyc
1083422269249064960	2019-01-10	[]	frank oc rev skin routin mus royal beauty idol
1083409621191221254	2019-01-10	[]	lady gag apolog work r kel pul song itun
1083396924865155074	2019-01-10	[]	thing know @voguemagazine's febru cov star @rwitherspoon
1083382133161373696	2019-01-10	[]	see every cheeky piec @rihanna's @savagexfenty valentine's collect
1083370548321812482	2019-01-10	[]	jam weekend london menswear flock migr flor ita bian pitt uomo fair plenty street styl look inspir
1083358466469740545	2019-01-10	[]	75 ep street styl coat tim
1083349319716143109	2019-01-10	[]	@rwitherspoon febru cov star see ful spread
1083346849334001664	2019-01-10	[]	first fash show year kick fal 2019 men's season vog runway shoot backst first tim
1083334798926598144	2019-01-10	[]	wed berkshir turn exub lawn party
1083323368898744321	2019-01-10	[]	gam beauty produc wor hyp 2019
1083311232290037760	2019-01-10	[]	styl kat young talk mak gold glob mag rachel weisz
1083299103130427393	2019-01-10	[]	first @dior men @thombrowneny gilet jaun impact fal '19 par men's show
1083285425991622656	2019-01-10	[]	fak best faux fur coat wear wint long
1083274049365725184	2019-01-10	[]	luxury oil detox soak here's tak perfect wint bath
1083262269902020610	2019-01-10	[]	@itsgabrielleu wor @pyermoss see beal street could talk send pow mess
1083250617303400448	2019-01-10	[]	@iamcardib's track suit typ velo athl
1083238535921127425	2019-01-10	[]	probiot skin car act wor accord expert here's
1083227106912464902	2019-01-10	[]	@kaliuchis rais bar kil thigh boot
1083171223201288195	2019-01-10	[]	crazy stuff anim chair @kyliejenner's instagram
1083158430016253952	2019-01-10	[]	glen mart tak cent stag pitt immagin flor
1083145859989147648	2019-01-09	[]	irin shayk elev new bob french girl beauty sign
1083132929323294725	2019-01-09	[]	jam weekend london menswear flock migr flor ita bian pitt uomo fair ev street styl photo
1083121008343687168	2019-01-09	[]	star born @ladygaga big last night's @nbrfilms award
1083108182988181504	2019-01-09	[]	@bafta nomin bradley coop mad hist
1083097613484871680	2019-01-09	[]	first tim 30 year look lik osc hap without host
1083094589894995968	2019-01-09	[]	maggy marilyn doubl sustain pract 2019 push cloth view every look pre '19 collect
1083087124277149696	2019-01-09	[]	unplug see @annasui's origin grung collect
1083075778999390214	2019-01-09	[]	see ful fal 2019 menswear runway
1083074191702798336	2019-01-09	[]	asymmet jean next big denim trend
1083069664584978432	2019-01-09	[]	@dvf emphas synergy pre explain want celebr freedom liberty view every look pre '19 collect
1083060968249274368	2019-01-09	[]	london newcom bianc saund brav modern masculin stereotyp fal 2019 menswear collect
1083047519830134786	2019-01-09	[]	@marcjacobs design turn back hand tim jacob ask longtim friend @annasui bring back look icon grung collect
1083046777551548416	2019-01-09	[]	tig sweden's fal 2019 menswear collect label expery subtl mix contrast text blend harmon mix workwear tail milit sportswear view every look
1083038721782493185	2019-01-09	[]	pre design team @emiliopucci tap label's play spirit infus collect energet vib see every look
1083037715640320001	2019-01-09	[]	happy birthday kat middleton look back lif rom print william
1083026203039223813	2019-01-09	[]	margot robbie's star rol barby reinforc old stereotyp defy
1083014361537544193	2019-01-09	[]	here's kil afternoon sug crav
1082999094065483776	2019-01-09	[]	breakout star ded red carpet win tran commun gold glob
1082983671555125248	2019-01-09	[]	2019's anticip am resta op
1082968518260387842	2019-01-09	[]	@yalitziaaparicio @romacuaron prov fash star watch
1082954245182287873	2019-01-09	['#goldenglob']	unsung red carpet hero '90s
1082939012686462976	2019-01-09	[]	here's wint glamp right
1082927559812120576	2019-01-09	[]	chic wint boot real wear work
1082915349702631425	2019-01-09	[]	think work abroad here's go
1082899880635498496	2019-01-09	[]	meet striking new @gucci perfum pluck alessandro michele's crazy mind
1082888542517370880	2019-01-09	[]	st vint produc sle riot grrl styl look
1082876493473161217	2019-01-09	[]	vogue100 host intim post glob lunch kick red carpet season de award show trend
1082864995052998656	2019-01-09	[]	jordanluc brainchild jord bow luc marchetto pair 34 mix brit it styl
1082842248654581761	2019-01-09	[]	strategies fight cold flu wint
1082829932961714176	2019-01-09	['#goldenglob']	beauty trend rul 2019 red carpet
1082817928582565888	2019-01-09	[]	styl kat young talk mak gold glob mag rachel weisz
1082806143725027328	2019-01-09	[]	body workout ready holiday
1082792493484257280	2019-01-09	[]	bold beauty styl profess bul rid
1082777160602079239	2019-01-08	[]	see every cheeky piec @rihanna's @savagexfenty valentine's collect
1082772695648034817	2019-01-08	[]	2019 twenty year debut par trap lindsay loh back
1082760796273340416	2019-01-08	[]	fab faux stol mak old coat feel new
1082748817676648453	2019-01-08	[]	see ful pre 2019 runway @moschino
1082742085835464708	2019-01-08	[]	dakot johnson's gym hair workout mot nee
1082730281440825350	2019-01-08	['#goldenglob']	watch @troyesivan get ready first
1082718864767635456	2019-01-08	[]	us london start thing cre not fal 2019 menswear show
1082706914750939138	2019-01-08	[]	@keyshiakaoir's extrav birthday dress mad mil cryst weigh 100 pound
1082694817996591105	2019-01-08	[]	kim kardash west kany expect baby boy
1082690683306168323	2019-01-08	[]	lourd leon hit beach complet noughty fash
1082678575160061952	2019-01-08	[]	insid gold glob award hollywood's liveliest night year
1082678078822907904	2019-01-08	[]	gemm chan shar insid look gold glob night
1082670384208584706	2019-01-08	['#goldenglob']	beauty trend rul 2019 red carpet
1082659006810861568	2019-01-08	[]	see ful fal 2019 menswear collect zegn
1082646595492069377	2019-01-08	[]	find london's hid french sid
1082631090538536960	2019-01-08	[]	mask ban puffy
1082615782637518849	2019-01-08	[]	term styl nba play russel westbrook athlet inst com mind
1082600358805950464	2019-01-08	[]	@lalignenyc hous fluff get head start cozy coat season
1082585109889499136	2019-01-08	[]	queen elizabe ii's travel wardrob champ brit fash
1082569589932863488	2019-01-08	[]	famy sery got best opt right
1082554408179781632	2019-01-08	[]	katy perry orlando bloom start 2019 apr ski couple's edit
1082539203261616128	2019-01-08	[]	beyont jay help louvr muse set new record
1082526676343554048	2019-01-08	[]	@asvpxrocky @kyliejenner big fan brooklynit adam neven's handcraft design
1082514197097918464	2019-01-08	[]	mak dry january's mocktail
1082502452300169216	2019-01-08	['#unsungherooffash']	let gabriel held's 2019 styl touchston
1082473495496441856	2019-01-08	[]	@iamcardi tak mommy styl dazzl new level instagram
1082427836777070592	2019-01-08	[]	fiv thing know @iamsandraoh
1082415700910714881	2019-01-07	[]	lupit nyong'o's gold glob heel cost $45 look less
1082403628625920000	2019-01-07	[]	inspir craig green's fal 2019 collect lineup tak look back synthet fash
1082391198642376704	2019-01-07	[]	cynto brown sent lif prison juvenil victim sex traffick fin go fre
1082384017759064064	2019-01-07	[]	french girl's guid bang accord par girl
1082371770651475968	2019-01-07	[]	object edit can't stop think
1082356645945053187	2019-01-07	['#goldenglob']	@gemma_chan shar snap night meet husband kick heel chang party look cours end night slic pizz
1082344884630106112	2019-01-07	[]	here's kil afternoon sug crav
1082332803826630659	2019-01-07	[]	rememb bab simpson vog edit gre am fre spirit
1082331816772726784	2019-01-07	[]	see latest collect @acoldwall
1082325649241579520	2019-01-07	[]	bab simpson form vog edit collab irv pen died 105
1082325277492031489	2019-01-07	[]	view fal 2019 menswear collect ol spent
1082313574134005761	2019-01-07	[]	first fash show year kick london fal 2019 men season vog runway shoot backst first tim
1082301349692403713	2019-01-07	[]	view @phoebeenglish's fal 2019 menswear collect
1082301107752308736	2019-01-07	[]	see ful fal 2019 menswear collect per g
1082294247146094592	2019-01-07	[]	@altuzarrastudio 10 celebr design reissu friends' favorit arch piec
1082282882285137922	2019-01-07	[]	week's wardrob inspir tak look best dress celebr week
1082269745351663616	2019-01-07	[]	see every look fal 2019 menswear collect craig green
1082258112797700096	2019-01-07	[]	celebr own bar wor hyp
1082242701838503943	2019-01-07	[]	mask ban puffy
1082227300555460608	2019-01-07	[]	far plac celebr welcom 2019
1082212008932634624	2019-01-07	[]	mary poppin return guid london
1082200240969736192	2019-01-07	[]	angelin joly mak cas neut
1082188818764234752	2019-01-07	[]	victor beckham's new fash pal son brooklyn's new girlfriend
1082175641330556928	2019-01-07	[]	sar gilbert wif lind perry step suit gold glob
1082164138904903681	2019-01-07	[]	best backst photo fal 2019 menswear show
1082152363484430336	2019-01-07	[]	watch @juliaroberts @theirishayk @lauraharrier get ready gold glob instagram
1082148347933270016	2019-01-07	[]	sandr oh singl import reason watch gold glob award tonight
1082140022780948480	2019-01-07	[]	jul robert bring back shock red carpet ped 2019 gold glob
1082139785504919552	2019-01-07	[]	breakout star ded red carpet win tran commun gold glob
1082137256247394305	2019-01-07	[]	ris actress breakout bob gold glob red carpet
1082132268527816704	2019-01-07	[]	2019 gold glob vir mom
1082123438519734272	2019-01-07	[]	best dress celebr gold glob red carpet
1082117629211480066	2019-01-07	[]	bradley coop irin shayk win sexiest red carpet coupl gold glob
1082113353215029248	2019-01-07	[]	best beauty look 2019 gold glob award
1082109843442466816	2019-01-07	[]	am hor story star wor @margiela's icon heel glob red carpet
1082107578564395009	2019-01-07	[]	win 2019 gold glob
1082098777077497858	2019-01-07	[]	60 jamy lee curt turn shock whit everyth ultim red carpet mov
1082097758176247808	2019-01-07	"[""#goldenglobes'""]"	cast @blackpanther chicest trio
1082096948218380289	2019-01-07	[]	timo chalamet took mom gold glob wor fashion's buzziest label
1082089715816378368	2019-01-07	[]	kendal jen fin set record straight acn empow
1082089204971200519	2019-01-07	[]	@michaelb4jordan wear custom riccardo tisc @burberry gold glob red carpet see ar
1082086432922050560	2019-01-07	['#goldenglob']	@ladygaga shut red carpet @maisonvalentino cout
1082082890572275713	2019-01-07	[]	heid klum wear @m_lhuillier fal 2019 gold glob red carpet see ar
1082080305115250689	2019-01-07	[]	see latest red carpet ar gold glob
1082078900392546305	2019-01-07	['#timesup']	hollywood spotlit year's gold glob
1082074242382999552	2019-01-07	[]	@ladygaga wear custom @maisonvalentino gold glob red carpet see latest ar
1082068573177163777	2019-01-07	['#goldenglob']	ahead @bafta los angel host star haut tea party
1082067991397847048	2019-01-07	['#goldenglob']	runway red carpet @hereisgina wear @reem_acra spring 2019 gown 2019 see
1082063262433329153	2019-01-06	['#goldenglob']	judy gre wear @albertaferretti limit edit fal 2018 cout red carpet see ar
1082062283944144897	2019-01-06	['#goldenglob']	sean pen host pre- cor gal rais $3 mil hait reliev
1082060411757912067	2019-01-06	['#goldenglob']	kik layn wear @dior haut cout 76th an see latest red carpet ar
1082057943598751744	2019-01-06	[]	gold glob host @iamsandraoh wear @versace red carpet see latest ar
1082056653753802754	2019-01-06	['#goldenglob']	@lauraharrier wear @louisvuitton red carpet
1082055742025289728	2019-01-06	[]	@kimkardashian west miam look go new condo
1082047771614605312	2019-01-06	['#goldenglob']	we'r liv 76th an award see latest ar
1082040123771052032	2019-01-06	[]	hyp meet hyg see fal 2019 menswear collect @astridandersens
1082039129884553222	2019-01-06	['#goldenglob']	ev dunda show spring 2019 cout collect
1082031905829277696	2019-01-06	[]	see fal 2019 menswear collect @fashion_east
1082025048913952768	2019-01-06	[]	@traceeellisross's sequin suit pay hom wom congress
1082013470072160257	2019-01-06	[]	beauty look domin instagram fee ind year slat aesthet sound best beauty instagram week
1082001302308245505	2019-01-06	[]	best street styl photo london's fal 2019 menswear show
1081988806524497921	2019-01-06	[]	see latest collect @chalayanstudio
1081988036169224198	2019-01-06	[]	there's new beckham womenswear view latest collect @kentandcurwen david beckham cre direct daniel kearn
1081979875064496129	2019-01-06	[]	see latest collect iceberg
1081968325062807555	2019-01-06	[]	india's andam island could new mald
1081953150175768581	2019-01-06	[]	consid gwyne paltrow's perfect imperfect strands 2019 resolv leav blowdry hom
1081937803137699843	2019-01-06	[]	monaco's roy famy spent christmas year
1081922647003414528	2019-01-06	[]	botswan top travel list year
1081907193937563648	2019-01-06	[]	pre @fendi took inspir book 19th french ironwork gat ant tom men japanes kimono see ful collect
1081892000562143232	2019-01-06	[]	beauty boy timo chalamet put dap @thombrowneny suit palm springs
1081876718665773056	2019-01-06	[]	propos supermoon switzerland led wed celebr utah desert
1081861432159940609	2019-01-06	[]	delicy meal delivery program healthy happy 2019
1081846006570991616	2019-01-06	[]	smartest money resolv mak year
1081830517392269314	2019-01-06	['#goldenglob']	unsung red carpet hero '90s
1081815049751142400	2019-01-06	[]	ahead gold glob sunday tak look back shock mom award show 75 year
1081799572257730560	2019-01-06	[]	here's watch @goldenglobes 2019 onlin
1081784041635016707	2019-01-06	['#goldenglob']	roundup best dress tim
1081768736208633857	2019-01-06	[]	13 best beauty mom pre 2019 collect
