id	created_at	hashtags	cleaned_text
1090021347663712257	2019-01-28	[]	that's ev get onto period poverty fact wom lit cannot afford period brit vog beauty edit @lisaniven11 writ
1090018143781744640	2019-01-28	[]	hair skin body tre thing tre 2019
1090014910266904576	2019-01-28	[]	embrac in skintellect 2019's beauty buzzword know try
1090011735048810496	2019-01-28	['#mondaymot']	pair salv shrill cry alarm clock enl workwear wardrob
1090008488644874240	2019-01-28	[]	thank beauty wif @liamhemsworth said @mileycyrus g us gal
1090005533925494785	2019-01-28	['#sagaward']	alway gre opportun beauty expery unconv lipstick shad dram hairstyl perhap
1090002731249606656	2019-01-28	[]	uncomfort tru seem heal issu prim affect wom get airtim on affect men
1090000537259556864	2019-01-28	['#sagaward']	see red highlight last night's screen act guild award 2019
1089997255246073856	2019-01-28	[]	perfect precurs osc @ladygaga brought star born direct co bradley coop onst rev perform
1089994048398606338	2019-01-28	[]	wheth tre someon els simply show lov brit vogue's favourit
1089990824153239553	2019-01-28	[]	brit vog deputy edit sarah har shar week styl edit week's agend perfect pair black mul
1089987966091608064	2019-01-28	[]	think rachel friend uniform slip dress strappy heel bar bag mock
1089984981378707456	2019-01-28	['#mondaymot']	fulfil 2019 workout goal new op
1089981952944422912	2019-01-28	[]	allow vog solv snowboard ski wear worry ultim edit best ski wear seen wint beyond
1089978999705604102	2019-01-28	[]	good holiday revolv around sev day uninterrupt rest ros
1089976004314103809	2019-01-28	[]	new cont hid man sin ss19 headband buy best film play see
1089973039498969089	2019-01-28	['#osc']	@raven__smith reflect week world hook fyr fest docu nomin rev @celinedion return cout glory
1089970215314751490	2019-01-28	[]	herringbon print wal long options; new season suit com every colo rainbow
1089967390966849537	2019-01-28	[]	academy award fast approach tim catch film talk award season
1089964534431993857	2019-01-28	[]	year obsess sweet yellow fruit moist condit property deep
1089961709488476161	2019-01-28	[]	glit fac @givenchy metal acc @eliesaabworld cam beauty cout season
1089960011529420800	2019-01-28	[]	hard assum menstru contraceiv prim mal issu bet opt deal
1089958805155258371	2019-01-28	[]	riccardo tisci's first campaign @burberry feat blockbust lin
1089955794970382337	2019-01-28	[]	@shonaghmarshall hann moon joyc ng two emerg fash photograph whos work quest ag approach rac gend sex
1089953057188782080	2019-01-28	[]	wear marches red carpet alway polit act
1089950096236732416	2019-01-28	[]	com book stayc think outsid box
1089947140720340992	2019-01-28	[]	vog giv ultim guid hol step tak prev fight wint cold
1089943993952149505	2019-01-28	[]	six nee bag trend keep on step ahead sum
1089941973312647170	2019-01-28	['#sagaward']	see red highlight last night's screen act guild award 2019
1089941896628183041	2019-01-28	['#sagaward']	chadwick boseman's goosebump respons black panther's win celebr young gift black cast
1089941568965001216	2019-01-28	['#sagaward']	@ladygaga debut iv @dior ss19 cout gown unveil runway day ago
1089940483562975232	2019-01-28	['#sagaward']	@lauraharrier @ladygaga @gemma_chan @lupita_nyongo standout look
1089939967697186816	2019-01-28	[]	must new styl ultim class vog round best whit train ad collect footwear favourit
1089939042538569728	2019-01-28	['#sagaward']	see win last night's
1089936961752784898	2019-01-28	[]	@naomicampbell mak cov debut edit story real wom genuin icon read ful march 2019 editor's let @edward_enninful
1089935902208602114	2019-01-28	[]	head @britishvogue instagram channel see liv cov rev edit @edward_enninful march 2019 cov star @naomicampbell
1089935742082695168	2019-01-28	[]	head @britishvogue instagram channel see liv cov rev edit @edward_enninful march 2019 cov star @naomicampbell
1089935431347642368	2019-01-28	[]	xxl mass lay look lik hot pink ring saturn
1089934130354311168	2019-01-28	[]	behind intery new abod thought vicky charl favourit amongst clooney beckham
1089932560162045952	2019-01-28	[]	cov star @naomicampbell wear @maisonvalentino @cartier necklac feat march 2019 issu brit vog newsstand friday febru photograph stev meisel styl @edward_enninful
1089931700090605568	2019-01-28	[]	march 2019 cov star @naomicampbell photograph stev meisel styl @edward_enninful head @britishvogue instagram channel watch liv cov rev
1089930142762369024	2019-01-28	[]	naom campbel cov march issu brit vog
1089928251433254913	2019-01-28	[]	@alisonloujewels @balenciaga @tiffanyandco @boucheron shop vogue's edit best hoop ear buy
1089926232114896896	2019-01-28	[]	brand exerc duo plan ent yet work hand film fest
1089925939931369472	2019-01-28	[]	@naomicampbell star brit vog march 2019 cov star newsstand friday febru photograph stev meisel styl edit @edward_enninful hair guido palau mak @patmcgrathreal
1089924233285812224	2019-01-28	[]	soph neophitou shar obsess beg grad becom resign buy flat
1089922458281496577	2019-01-28	[]	hollywood royal act roy vog look back icon wed dress tim
1089920149711392768	2019-01-28	[]	coincid sal headband
1089917117393223682	2019-01-28	[]	ahead releas @aprivatewar war correspond @janinedigi reflect lif friend form colleagu mary colvin trailblaz wom went
1089913845940932610	2019-01-28	[]	research don much soon issu affect almost every wom know mil world brit vog beauty edit @lisaniven11 ask
1089911555121123334	2019-01-28	[]	introduc vog busy new digit b2b titl off analys fash beauty luxury industry
1089908585663000576	2019-01-28	[]	seek definit rivier chic tak cue cru spring
1089905811537776641	2019-01-28	[]	way detox right way rest skin pre season glory
1089902751604199424	2019-01-28	[]	there's new approach beauty hollywood award season
1089899429509976064	2019-01-28	['#mondaymot']	vog edit shar fit resolv new year
1089895995746516992	2019-01-28	[]	next phas @orousteing's @balmain expand plan design com iphon
1089892691796738048	2019-01-28	['#fetishey']	tim spring sum 2019's biggest beauty trend @patmcgrathreal launch mascar
1089889372630142976	2019-01-28	[]	week @laurabailey_uk shar play battl book netflix sery bing art instagram account follow
1089886327376621568	2019-01-28	['#sagaward']	@ladygaga debut iv @dior ss19 cout gown unveil runway day ago
1089883861956333569	2019-01-28	[]	today's high uk launch @milkmakeup produc look
1089881431071952896	2019-01-28	[]	ant awak favourit fragr relaunch crux brit vog beauty lifestyl direct @jessicadiner edit
1089877926701613058	2019-01-28	[]	viv forev right
1089874649897451520	2019-01-28	[]	thank beauty wif @liamhemsworth said @mileycyrus g us gal
1089873445075238912	2019-01-28	[]	wheth tre someon els simply show lov brit vogue's favourit
1089869494321848320	2019-01-28	['#sagaward']	kudo @iamsandraoh on cap look hit graeco sweet spot
1089868739758178305	2019-01-28	['#sagaward']	see red highlight last night's screen act guild award 2019
1089868487043018752	2019-01-28	['#sagaward']	alway gre opportun beauty expery unconv lipstick shad dram hairstyl perhap
1089861100898869253	2019-01-28	[]	effortless pow styl there's noth lik boil suit say brit vogue's shop edit naom smart
1089855069577793537	2019-01-28	[]	perfect precurs osc @ladygaga brought star born direct co bradley coop onst rev perform
1089847632305053696	2019-01-28	[]	fem empow cent @roksandailincic's etho mess keen reinforc latest collect
1089843189912092672	2019-01-28	['#brexit']	mean cre six london design weigh leav eu impact fash via @
1089840503477145600	2019-01-28	[]	bet hairstyl compl @ladygaga's disney @maisonvalentino cout gown princess shad periwinkl
1089833759824846848	2019-01-28	[]	@dgandyofficial tyson beckford @luckybsmith vog chart mal model domin runway fash campaign magazin past three decad
1089825562993049600	2019-01-28	['#mondaymot']	fulfil 2019 workout goal new op
1089824449879265280	2019-01-28	[]	red pink togeth colo combin deserv at outsid febru 14
1089823265227526144	2019-01-28	['#sagaward']	@ladygaga wor iv @dior ss19 cout gown unveil runway day
1089822078369521665	2019-01-28	['#sagaward']	see win last night's
1089815339322478592	2019-01-28	[]	@missvogueuk meet @ncutigatwa @sexeducation new @netflix sery everyone's rav
1089794830350368769	2019-01-28	[]	gag follow cher's footstep ad best actress osc stash grammy
1089789883546304512	2019-01-28	[]	com innov beauty industry tour de forc
1089783939915489285	2019-01-28	[]	want travel smart fair aw go
1089780095936540672	2019-01-28	[]	think ahead holiday three spectacul new op rad 2019
1089774153668939776	2019-01-28	[]	seem fal back lov bar accord research @k_worldpanel sal soap ris per cent nat
1089769387979165698	2019-01-28	[]	mak ens good cleans every morn new year's resolv
1089763158636531712	2019-01-28	[]	tri fail becom morn person
1089758700498313216	2019-01-28	[]	pair salv shrill cry alarm clock enl workwear wardrob
1089752477308805122	2019-01-28	[]	best new produc every hair typ
1089739994791661568	2019-01-28	[]	2019 shap stell smal screen cast lik pack sery star pow
1089736287538548736	2019-01-28	[]	industry hair innov pion new skinc year beauty look lik brit vog beauty lifestyl direct @jessicadiner
1089723866497216512	2019-01-28	[]	vog giv ultim guid hol step tak prev fight wint cold
1089700071489392640	2019-01-28	[]	alongsid lik fran sum @hannah_motler nor at gisel norm part new brit invas model tak industry storm
1089675715887411200	2019-01-28	[]	let known fiv piec adv definit mak skinc routin
1089671496933486593	2019-01-27	[]	hair skin body tre thing tre 2019
1089667790200541185	2019-01-27	[]	coincid sal headband
1089663665329053696	2019-01-27	['#chanelhautecout']	cal nonch par way mak ent fash show
1089660949743763458	2019-01-27	[]	cout biggest cheerlead @celinedion back fab frow form spring 2019 show
1089658617899503616	2019-01-27	[]	beyond @sexeducation's frank com sex someth els stand foc fem pleas
1089656640092164096	2019-01-27	[]	easy al tough extery sovereign jacket world
1089654662331023360	2019-01-27	[]	academy award fast approach tim catch film talk award season
1089651640288854017	2019-01-27	[]	rul mad brok non dict cannot wear
1089648429037486081	2019-01-27	[]	@missvogueuk shar best invest piec ad wardrob wear throughout 2019
1089645448749551618	2019-01-27	[]	season jewellery front
1089642978430332931	2019-01-27	[]	@arianagrande nev shy femin id
1089640994281345024	2019-01-27	[]	herringbon print wal long options; new season suit com every colo rainbow
1089640747245191168	2019-01-27	[]	new year brought new sens bright bold
1089637779385008128	2019-01-27	[]	ant awak favourit fragr relaunch crux brit vog beauty lifestyl direct @jessicadiner edit produc week
1089635552545132547	2019-01-27	[]	pearl tak four year develop 10 per cent cult glow sufficy rady lust mak tasaki's grad
1089632581866475526	2019-01-27	[]	good holiday revolv around sev day uninterrupt rest ros
1089629130155589637	2019-01-27	[]	@arianagrande might rev trackl forthcom alb surpr stop
1089627150154637312	2019-01-27	[]	there's chang aesthet hap camp @dualipa
1089624659799277570	2019-01-27	['#osc']	@raven__smith reflect week world hook fyr fest docu nomin rev @celinedion return cout glory
1089621903902425089	2019-01-27	[]	@edward_enninful @naomicampbell join 14 new industry expert 2019 @lvmh priz jury
1089619652928552960	2019-01-27	[]	viv forev right
1089617401937911809	2019-01-27	[]	giant bow feath fantasy haut cout pres par week
1089612871846252544	2019-01-27	[]	new cont hid man sin ss19 headband buy best film play see
1089611129142341632	2019-01-27	[]	behind intery new abod thought vicky charl form soho hous favourit amongst fam acquaint roy coupl clooney beckham
1089608142621761536	2019-01-27	[]	on handl coupl styl lik david @victoriabeckham
1089604993559203841	2019-01-27	[]	@balmain's return cout 16 hiat saw new memb olivy roust littl black book; emm mackey
1089601429847855104	2019-01-27	[]	six nee bag trend keep on step ahead sum
1089598193195716608	2019-01-27	[]	film televid tour the cult delight 2019 stor us
1089595482278690817	2019-01-27	[]	think ahead holiday three spectacul new op rad 2019
1089592477563187200	2019-01-27	[]	@yoon_ambush talk vog juggl @ambushdesign label cre @dior hom tackl gend stereotyp
1089589267423203329	2019-01-27	[]	pow way styl key access 2019 way 1708 lik
1089586262577766400	2019-01-27	[]	wear marches red carpet alway polit act
1089583035719344129	2019-01-27	[]	consid dakot johnson's versatil inst transform styl inspir nee get mov 2019
1089579822207115264	2019-01-27	[]	wheth cam milky beig shim sand deep espresso appear abund mad pain chic impact
1089579816213532673	2019-01-27	[]	secret pul dos je ne sai quo
1089577636777676801	2019-01-27	[]	rul mad brok non dict cannot wear
1089576840593838081	2019-01-27	[]	year obsess sweet yellow fruit moist condit property deep
1089574863294119937	2019-01-27	[]	riccardo tisci's first campaign @burberry bring chief cre officer's vis divers eclect includ beauty burberry lif
1089572066989404165	2019-01-27	[]	pair salv shrill cry alarm clock enl workwear wardrob
1089567960363139073	2019-01-27	[]	talk exquisit gown defin cout fash week season
1089565141107179520	2019-01-27	[]	cours on maj beauty mom oliv colm queen an
1089562390910386177	2019-01-27	[]	gag follow cher's footstep ad best actress osc stash grammy
1089557216942845952	2019-01-27	[]	unmiss oversea show wor plan city break around
1089552648917958656	2019-01-27	[]	@chanel @tomford @marcjacobs unveil beauty collect spec mal custom mak design men long nich
1089549456628948994	2019-01-27	[]	cout biggest cheerlead @celinedion back fab frow form spring 2019 show
1089545687757406208	2019-01-27	['#chanelhautecout']	cal nonch par way mak ent fash show
1089543460871389185	2019-01-27	[]	rest model wor heel cowboy boot annount instagram sport non pair convers
1089540988987756544	2019-01-27	[]	god bless us every on confirm tom hardy star new sery
1089538015364554757	2019-01-27	[]	many hoop littl tim shop vogue's edit best
1089534384221364224	2019-01-27	[]	pair class 90s @victoriabeckham tel vog latest collab
1089531336480751617	2019-01-27	[]	@chanel @dior beauty dram extrav tak plac
1089528353630183424	2019-01-27	['#chanelhautecout']	fin @chanel show highlight haut cout calend karl lagerfeld tradit greet alongsid brid season
1089525131033149440	2019-01-27	[]	say wom world siz beauty cannot wear dress @beberexha shar via instagram
1089522173872693249	2019-01-27	[]	yesterday speak singl verb person 7am 6pm @nellfrizzell nee chat baby can't speak
1089519197628047366	2019-01-27	[]	await detail cal nam sequel dos guadagnino fash film ev san timo chalamet welcom
1089514735526129664	2019-01-27	[]	alway fun cloth dad paint jul garn hit sery ozark tel vog new campaign @katespadeny
1089512023350759425	2019-01-27	[]	talk @v_and_a '80s collect pre key trait cre london @kasiamaciejowska ident stil relev today
1089509049924833281	2019-01-27	['#osc']	rememb bj swan mom 2001
1089506504343019520	2019-01-27	[]	vogue's guid year's hottest ticket uk afield cult buff
1089504270251188224	2019-01-27	[]	spic girl releas stat decl band deeply shock appal
1089501287912218625	2019-01-27	[]	kat '90s @versace brid @maisonvalentino gown brok internet twic
1089496829039951874	2019-01-27	[]	@arianagrande nev shy femin id
1089493103541714945	2019-01-27	[]	high uk launch @milkmakeup ar tomorrow brit vog beauty lifestyl direct @jessicadiner shar top favourit produc beauty brand
1089491071527211008	2019-01-27	[]	bet hairstyl compl @ladygaga's disney @maisonvalentino cout gown princess shad periwinkl
1089488832943276032	2019-01-27	[]	look back kat moss' best mem hair look dat
1089486359398699009	2019-01-27	[]	everyth know @justinbieber @haileybieber's upcom celebr
1089481615670235137	2019-01-27	[]	must new styl ultim class vog round best whit train ad collect footwear favourit
1089477653395050497	2019-01-27	[]	fiv easy way stay fit minim effort
1089474690538721281	2019-01-27	[]	easy al tough extery sovereign jacket world
1089469736495259648	2019-01-27	[]	beyond @sexeducation's frank com sex someth els stand foc fem pleas
1089465519172931584	2019-01-27	[]	infanticid nanny sex parisien french novel le sliman peculi gift tel chil uncomfort story
1089461576502071297	2019-01-27	[]	on expery new dye job perhap 2019 resolv tak risk beauty
1089458588458848257	2019-01-27	[]	season jewellery front
1089455872940625921	2019-01-27	[]	bruno sialell four design four year french fash hous @lanvinofficial
1089452648556830721	2019-01-27	[]	new year felt lik perfect tim launch collect @netaporter's glob buy direct tel min vog
1089448705328066560	2019-01-27	[]	saf say many wom happy hear @manuatelier launch first footwear collect ear jun
1089443559701393408	2019-01-27	[]	appear young princess dian also expect cast anderson thatch suggest @thecrownnetflix season four span '80s
1089441081400479744	2019-01-27	[]	@chanel @tomford @marcjacobs unveil beauty collect spec mal custom mak design men long nich
1089436135741378566	2019-01-27	[]	pow way styl key access 2019 way 1708 lik
1089433897061007361	2019-01-27	[]	week's agend perfect pair black mul
1089423915972214785	2019-01-27	[]	embrac in skintellect 2019's beauty buzzword know say jessic din
1089419884608585728	2019-01-27	[]	can't beat hypebeast join
1089330041387921410	2019-01-27	[]	achiev pregn glow everyone's alway going
1089308517209686021	2019-01-26	[]	best new produc every hair typ
1089305303210999810	2019-01-26	[]	shi labeouf's screenwriting debut cameo girlfriend fka twig unexpect com pair emm thompson mindy kal
1089301094713516035	2019-01-26	[]	@yoon_ambush talk vog juggl @ambushdesign label cre @dior hom tackl gend stereotyp
1089298618786500608	2019-01-26	[]	pow way styl key access 2019 way 1708 lik
1089295626708365312	2019-01-26	[]	think ahead holiday three spectacul new op rad 2019
1089292900612091904	2019-01-26	[]	carry bradshaw's '90s fend baguet dior styl princess dian lov '80s
1089289832881369090	2019-01-26	[]	wheth cam milky beig shim sand deep espresso appear abund mad pain chic impact
1089286879701360641	2019-01-26	[]	@orangefeeling @bonnaroo @allpointseastuk excit fest lin uk europ beyond
1089284137482100741	2019-01-26	[]	sometim way tru relax leav london behind escap countrysid peac coupl day
1089280931528089600	2019-01-26	[]	best @airbnb book luxury wint getaway
1089278700854669312	2019-01-26	[]	secret pul dos je ne sai quo
1089275466735849472	2019-01-26	[]	season on stood quit lik gam thrones's star @maisie_williams
1089272258806378496	2019-01-26	[]	new year brought new sens bright bold
1089271773286318080	2019-01-26	[]	rul mad brok non dict cannot wear
1089268551628845057	2019-01-26	[]	on handl coupl styl lik david @victoriabeckham
1089265071883210753	2019-01-26	[]	on expery new dye job perhap 2019 resolv tak risk beauty
1089261625398517760	2019-01-26	[]	beyond @sexeducation's frank com sex someth els stand foc fem pleas
1089258900677894147	2019-01-26	[]	valentino today includ want cout relev today old tim @maisonvalentino's pierpaolo picciol shar
1089258398598729730	2019-01-26	[]	rumo larg celebr aflo outlet ev whisp sav card sent retract
1089255924060041216	2019-01-26	[]	@arianagrande nev shy femin id
1089252454343106560	2019-01-26	[]	beauty dram extrav @chanel @dior giambattist vall
1089250234507714561	2019-01-26	[]	talk exquisit gown defin cout fash week season
1089247267238936576	2019-01-26	[]	easy al tough extery sovereign jacket world
1089243809786007555	2019-01-26	[]	util up ap 2019 gateway trend boil suit
1089239840800022528	2019-01-26	[]	year weinstein scand brok marches fin com cold
1089238118664933376	2019-01-26	[]	duk duchess sussex's new ar due spring renov report fast occur frogm cot
1089235616179646471	2019-01-26	[]	could new must access everyon wear com sum
1089233137224335360	2019-01-26	['#chanelhautecout']	cal nonch par way mak ent fash show
1089230165341814787	2019-01-26	[]	rest model wor heel cowboy boot annount instagram sport non pair convers
1089228135638491137	2019-01-26	[]	@orousteing brought @balmain back cout week schedule first tim sint 2002
1089224416825884674	2019-01-26	[]	monic bellucc long styl icon world film
1089220927747964928	2019-01-26	[]	nour cleans effect tre best produc tackl adult acn
1089218005765160960	2019-01-26	[]	shi labeouf's screenwriting debut cameo girlfriend fka twig unexpect com pair emm thompson mindy kal
1089214763282903040	2019-01-26	[]	new photograph exhibit invit view quest individ
1089212051698921473	2019-01-26	['#lfw']	@anyahindmarch set london fash week bar high
1089206610482921475	2019-01-26	[]	on handl coupl styl lik david @victoriabeckham
1089204368937795586	2019-01-26	[]	cours on maj beauty mom oliv colm queen an
1089199756960780289	2019-01-26	[]	gag follow cher's footstep ad best actress osc stash grammy
1089194564844486656	2019-01-26	[]	best london the show 2019 hot ticket london stag year ahead
1089190717631668227	2019-01-26	[]	giv court revamp vog ultim altern dat idea
1089187932303511552	2019-01-26	[]	diff good mak brush mak beauty regim noth short amaz
1089184441723965444	2019-01-26	[]	god bless us every on confirm tom hardy star sery slat fest highlight decemb
1089181967218868224	2019-01-26	[]	third cout collect helm @givenchy clar waight kel want complet blank canva tel vog
1089178989602787329	2019-01-26	[]	@alisonloujewels @balenciaga @tiffanyandco @boucheron shop vogue's edit best hoop ear buy
1089175227471446016	2019-01-26	['#osc']	rememb bj swan mom 2001
1089168961458049024	2019-01-26	[]	alway fun cloth dad paint jul garn hit sery ozark tel vog new campaign @katespadeny
1089165944964952064	2019-01-26	['#chanelhautecout']	fin @chanel show highlight haut cout calend karl lagerfeld tradit greet alongsid brid season
1089162955827171329	2019-01-26	[]	@chanel @dior beauty dram extrav tak plac
1089160506726903810	2019-01-26	[]	pair class 90s @victoriabeckham tel vog latest collab
1089157034577219589	2019-01-26	[]	hop mak workforc fut repres fac london britain whol er felln tel brit vog latest vent @working_title
1089154249836167168	2019-01-26	['#oscarnom', '#osc']	rom favourit lead pack 10 nomin feat maj categ
1089151767206653952	2019-01-26	[]	long david beckham around star campaign [model] going get chant cast direct jam scul writ vog
1089149299005505536	2019-01-26	[]	coincid sal headband
1089146567083417601	2019-01-26	[]	best london the show 2019
1089144295435710465	2019-01-26	[]	spic girl releas stat decl band deeply shock appal
1089141561370255360	2019-01-26	[]	kat '90s @versace brid @maisonvalentino gown brok internet twic
1089138107277037568	2019-01-26	[]	fiv easy way stay fit minim effort
1089135874229575680	2019-01-26	[]	@arianagrande nev shy femin id
1089131632118956032	2019-01-26	[]	look back kat moss' best mem hair look dat
1089129118464118784	2019-01-26	[]	high uk launch @milkmakeup ar next week produc look
1089127143093747712	2019-01-26	[]	everyth know @justinbieber @haileybieber's upcom celebr
1089124422349406214	2019-01-26	[]	bet hairstyl compl @ladygaga's disney @maisonvalentino cout gown princess shad periwinkl
1089121699499528194	2019-01-26	[]	must new styl ultim class vog round best whit train ad collect footwear favourit
1089118989144469504	2019-01-26	[]	war correspond janin di giovann reflect work mary colvin marth gellhorn lee mil clar hollingwor
1089116246170365953	2019-01-26	[]	want mak someth univers hum cor @virgilabloh com inaug campaign @louisvuitton
1089112959161372672	2019-01-26	[]	easy al tough extery sovereign jacket world
1089109996405776384	2019-01-26	[]	vog edit shar fit resolv new year
1089107028608516096	2019-01-26	[]	effortless pow styl there's noth lik boil suit
1089103650444709889	2019-01-26	[]	beyond @sexeducation's frank com sex someth els stand foc fem pleas
1089100403181043716	2019-01-26	[]	infanticid nanny sex parisien french novel le sliman peculi gift tel chil uncomfort story
1089096432924192769	2019-01-26	[]	pow way styl key access 2019 way 1708 lik
1089093712691503104	2019-01-26	[]	@chanel @tomford @marcjacobs unveil beauty collect spec mal custom mak design men long nich
1089091481032372224	2019-01-26	[]	appear young princess dian also expect cast anderson thatch suggest @thecrownnetflix season four span '80s
1089088752180477952	2019-01-26	[]	saf say many wom happy hear @manuatelier launch first footwear collect ear jun
1089084248789827584	2019-01-26	[]	new year felt lik perfect tim launch collect @netaporter's glob buy direct tel min vog
1089081515961712640	2019-01-26	[]	bruno sialell four design four year french fash hous @lanvinofficial
1089078408712200192	2019-01-26	[]	on star embrac dark season switch emm ston
1089073898614861824	2019-01-26	[]	season jewellery front
1089066409039155200	2019-01-26	[]	seem fal back lov bar accord research @k_worldpanel sal soap ris per cent nat
1089062704558600192	2019-01-26	[]	put test
1089059193997398018	2019-01-26	[]	get mot newest crop fit op london
1089051508702875648	2019-01-26	[]	princess leia's icon hair par glamo moulin roug 30 best beauty transform
1089040306039898112	2019-01-26	[]	coincid sal headband
1089024042101821440	2019-01-26	[]	2019 shap stell smal screen cast lik pack sery star pow
1089001733748154368	2019-01-26	[]	ment heal benefit far outweigh phys decid reduc alcohol intak dram 2015 @parislees lif pow champagn diet
1088979209731624960	2019-01-26	[]	@missvogueuk meet @ncutigatwa @sexeducation new @netflix sery everyone's rav
1088956501245476864	2019-01-26	[]	new cont hid man sin ss19 headband buy best film play see
1088953277755080704	2019-01-26	[]	good holiday revolv around sev day uninterrupt rest ros
1088950076012183553	2019-01-26	['#osc']	@raven__smith reflect week world hook fyr fest docu nomin rev @celinedion return cout glory
1088946352040620033	2019-01-25	[]	valentino today includ want cout relev today old tim @maisonvalentino's pierpaolo picciol shar ahead brand's show today
1088942652031201280	2019-01-25	[]	giant bow feath fantasy haut cout pres par week
