id	created_at	hashtags	cleaned_text
1093088506329686016	2019-02-06	[]	ad dog rescu @priyankachopra nor shor anim leagu littl two year ago
1093087675542847488	2019-02-06	[]	j spot new york giant rock fing
1093086097083695104	2019-02-06	[]	teddy bear weird bunch ros aly object card vers writ someon wareh
1093085560401473536	2019-02-06	[]	on bing 2019
1093082150696636416	2019-02-06	[]	recal elbaz ysl michael kor c lagerfeld chlo twic
1093078068565037057	2019-02-06	[]	spot lik bell hadid victor beckham outfit favo hardwork way
1093073348270215169	2019-02-06	[]	mak ens good cleans every morn new year's resolv
1093067385463033856	2019-02-06	[]	wel fact @naomicampbell beauty icon sint first burst onto scen
1093060694126272513	2019-02-06	[]	@mydrunkelephant @larocheposayuki @la_prairie see brit vogue's favourit new way transform skin
1093050783992594432	2019-02-06	[]	think ahead holiday three spectacul new op rad 2019
1093046975547740160	2019-02-06	[]	want travel smart fair aw go
1093042765246709760	2019-02-06	[]	hair skin body tre thing tre 2019
1093022167694958593	2019-02-06	['#osc']	rememb bj swan mom 2001
1093000412100206592	2019-02-06	[]	@chanel @tomford @marcjacobs unveil beauty collect spec mal custom mak design men long nich
1092978376195887104	2019-02-06	[]	par good fash op commun regroup fash profess brand entrepr design expert said isabel lefort
1092956362273738752	2019-02-06	['#marypoppinsreturn']	every singl costum @the_favourites cre six week sandy powel also work tim
1092934924263452672	2019-02-05	[]	brit vogue's pick best novel memoir story essay hit bookshop season
1092932211010166786	2019-02-05	[]	spring horizon think pink
1092929232093749248	2019-02-05	[]	century sint first raz market wom cre what's chang
1092926262585245696	2019-02-05	[]	chant meet on @naomicampbell
1092923293517127680	2019-02-05	[]	see sing put best pok fac ahead pot fab gag fash mom yet
1092920335463264257	2019-02-05	[]	@dualipa start 2019 on clear agend want continu empow wom
1092917211709231105	2019-02-05	[]	off @gwynethpaltrow bring @goop wel knowledg @netflix
1092913941917913089	2019-02-05	['#egggang', '#talkingeg']	instagram battl swept soc med mystery set dethron kyly jen
1092910975672639489	2019-02-05	[]	skat boy brit aristocr profil pol teen lik young leonardo dicaprio
1092907788584583169	2019-02-05	[]	@ladygaga @louisvuitton @reginaking @yalitzaaparicio @prada rachel weisz opt @marcjacobs
1092904571041705995	2019-02-05	[]	fash industry becom ev astut popst busy strategies follow @rihanna's latest mov @savagexfenty
1092901547468640261	2019-02-05	[]	cost best pict osc campaign run 15 mil doubl cost decad ago
1092898541087932418	2019-02-05	[]	osc bought
1092895562431713280	2019-02-05	[]	@yoox unveil franc sozzan priv collect 397 ready haut cout piec 190 access lat edit wardrob
1092892598686109696	2019-02-05	['#equinoxhotel']	contribut edit march 2019 cov star @naomicampbell showcas pow hum body @equinox first ev hotel campaign
1092889628225482753	2019-02-05	['#askev']	issu bor bor bor lif good on read ask @evawiseman
1092886663460806657	2019-02-05	[]	princess diary hap can't wait next instal quot mad movy mag stil ad today
1092883693289525248	2019-02-05	[]	wond ingredy tre acn breakout new gen retinol suprem ant
1092880660556120065	2019-02-05	[]	spot lik bell hadid victor beckham outfit favo hardwork way
1092877941485289475	2019-02-05	[]	april @v_and_a reop jewellery gallery 80 new addit includ queen victor sapphir coronet
1092874901080469505	2019-02-05	[]	real bought ide rom partn sort mag secret door whol world @dollyalderton
1092871908490690562	2019-02-05	[]	soc med link direct impact increas death gen wellb group young peopl
1092869146302472192	2019-02-05	[]	scand girls' favourit knitwear menswear label that's found fan skept
1092866177955700737	2019-02-05	['#newvog']	edit @edward_enninful cov rev alway spark hiv cre soc med
1092863408259694592	2019-02-05	['#wakeup', '#handmaidst']	styl pierc tak fam 1984 ronald reag polit campaign morn americ poign riff
1092860601435594753	2019-02-05	[]	fash fan stil mourn loss old celin rihann step coat phoeb philo last collect
1092858052905189386	2019-02-05	[]	@asos fin launch first homew lin pric start 8
1092855392235864064	2019-02-05	['#nyfw']	expect new design tak class hous form fixt mak return
1092852662016659459	2019-02-05	[]	reg stat welcom headband lif
1092849914797871109	2019-02-05	[]	best headband market right subtl nod roy fash
1092847199594209280	2019-02-05	[]	industry stil drag feet recogn wom helm film stop us celebr 2019 fem film
1092844714473197568	2019-02-05	['#yearofthepig']	happy chines new year @emma_weymouth shar vog secret two fest dish @chinatanglondon
1092842264999665665	2019-02-05	[]	vog photograph jeps stockholm capt emerg street styl trend
1092839818789310466	2019-02-05	['#osc']	vog meet three wom direct whos film hit view crit alik overlook best direct categ
1092834271973294080	2019-02-05	[]	week sarah har shar three wom fac nee facetim
1092832988440784896	2019-02-05	[]	vog photograph jeps stockholm capt emerg street styl trend
1092831400837898240	2019-02-05	['#dumbo']	14 star alongsid ev green colin farrel tear @disney_uk class com march 29
1092828607557320705	2019-02-05	[]	harry's influ particul poign emerg menswear design @danielwfletcher
1092826289243897857	2019-02-05	[]	spring horizon think pink
1092825522776748038	2019-02-05	[]	brit vogue's pick best novel memoir story essay hit bookshop season
1092824241949556736	2019-02-05	[]	celebr march 2019 issu brit vog host liv sign cov star @naomicampbell london friday click attend inform
1092822056696205314	2019-02-05	[]	easy al tough extery sovereign jacket world
1092819023744634881	2019-02-05	[]	perfect pair pearl ear lip balm sav pout wint new season item ad basket
1092815943514947585	2019-02-05	[]	off 2019's start block tim start plot plan spring sum look
1092812743646871553	2019-02-05	[]	welcom first dig diary month download best bit tech cur @thedigifairyz
1092809488086777856	2019-02-05	['#7rings']	styl mom can't miss @arianagrande's mus video
1092806449246416897	2019-02-05	[]	distinct rememb going justin bieb concert walk red carpet ful fac acn @kendalljenner set record straight acn
1092803428609343489	2019-02-05	['#osc']	new host perform film predict win big night
1092796631915917313	2019-02-05	[]	const head continu foc remain fix
1092792193566326785	2019-02-05	[]	priyank chopr play award 2018 netflix docu sery cult lead bhagw shree rajneesh
1092788173552476160	2019-02-05	[]	journ pur honest bring just bring voic voiceless nobl @janinedigi
1092783912374468610	2019-02-05	[]	@mariekondo lead us toward world fre clut read top tip mast ultim digit tidy
1092779744356192263	2019-02-05	[]	@missvogueuk profil styl mal celebr watch 2019
1092775226641956864	2019-02-05	[]	see sing put best pok fac ahead pot fab gag fash mom yet
1092773559217332224	2019-02-05	[]	lov preach femin sist seem lik clout mayb mak diff someon lif bet @dualipa tweet
1092771839800160257	2019-02-05	[]	contribut edit cov star @naomicampbell tak behind scen march 2019 issu brit vog newsstand watch ful episod
1092771039006867456	2019-02-05	[]	feel degrad off com think cap @becauseimfreida rev
1092767366063235073	2019-02-05	[]	good new ss19 sho trend real someth everyon
1092763369436864513	2019-02-05	[]	@mydrunkelephant @larocheposayuki @la_prairie see brit vogue's favourit new way transform skin
1092759648350937088	2019-02-05	[]	off @gwynethpaltrow bring @goop wel knowledg @netflix
1092757157181865984	2019-02-05	['#osc']	i'm sur i'll terr bradley coop said upcom perform lady gag here's everyth nee know hollywood's biggest night film
1092753931413962752	2019-02-05	[]	@olehenriksen fan rejo skinc brand lov hollywood back relaunch uk
1092750946587869184	2019-02-05	[]	@ladygaga @louisvuitton @reginaking @yalitzaaparicio @prada rachel weisz opt @marcjacobs
1092747651131559936	2019-02-05	['#yearofthepig']	@emma_weymouth expl lif behind clos door on london's styl chines resta
1092746688266153984	2019-02-05	['#egggang', '#talkingeg']	instagram battl swept soc med mystery set dethron kyly jen
1092745698603261952	2019-02-05	[]	skat boy brit aristocr profil pol teen lik young leonardo dicaprio
1092744462365876225	2019-02-05	[]	fash industry becom ev astut popst busy strategies follow @rihanna's latest mov @savagexfenty
1092742201229131776	2019-02-05	[]	best found put best fac forward
1092738501093806080	2019-02-05	[]	@laurabailey_uk secret get sleep first hotel beat track
1092734547807080448	2019-02-05	[]	fail leath jacket covet design bag @missvogueuk shar best invest piec ad 2019 wardrob
1092730933034262528	2019-02-05	[]	naom click immedy two us chat polit day kendrick sampson shar play naom campbel boyfriend brit vogue's march 2019 issu newsstand
1092728367282114560	2019-02-05	"[""#lucyboynton's""]"	approach red mak less head stat interest detail caus
1092726462560514049	2019-02-05	[]	meet @cynthialovely 25 sing sign @katyperry label unsub record
1092722241995984896	2019-02-05	[]	would lik littl brav mak look right
1092718913933242368	2019-02-05	['#osc']	far hollywood studio go boost chant night
1092710101507624965	2019-02-05	[]	wond ingredy tre acn breakout new gen retinol suprem ant
1092705520392306688	2019-02-05	[]	shi labeouf's screenwriting debut cameo girlfriend fka twig unexpect com pair emm thompson mindy kal
1092700277139038208	2019-02-05	[]	chicest vog edit complet un federico marchett tel vog exclud interview
1092695575739420672	2019-02-05	[]	april @v_and_a reop jewellery gallery 80 new addit includ queen victor sapphir coronet
1092692180710445056	2019-02-05	[]	apply pur lemon juic clear skin coconut oil altern moist
1092688887896522752	2019-02-05	[]	best new produc every hair typ
1092676974722588672	2019-02-05	[]	seem fal back lov bar accord research @k_worldpanel sal soap ris per cent nat
1092655649190801408	2019-02-05	[]	princess diary hap can't wait next instal quot mad movy mag stil ad today
1092636307262722049	2019-02-05	[]	lif fin exceiv boredom mean feel lik enough on read tel @evawiseman
1092615528236154882	2019-02-05	[]	gag follow cher's footstep ad best actress osc stash grammy
1092599440819585025	2019-02-05	[]	@glossier's adapt min pig she formula design mak produc suit wid audy miss success
1092594489502457856	2019-02-05	['#selfc']	2018 year hasht clock 10 mil post instagram wel trend know 2019
1092591260978823168	2019-02-05	[]	pair salv shrill cry alarm clock enl workwear wardrob
1092587548071940096	2019-02-05	[]	vog shar adv avoid look botox tre
1092584330000564224	2019-02-05	[]	@missvogueuk meet @ncutigatwa @sexeducation new @netflix sery everyone's rav
1092580780151373824	2019-02-05	[]	bet hairstyl compl @ladygaga's disney @maisonvalentino cout gown princess shad periwinkl
1092569878110851072	2019-02-04	['#askev']	issu bor bor bor lif good on read ask @evawiseman
1092567210088976384	2019-02-04	[]	par good fash op commun regroup fash profess brand entrepr design expert said isabel lefort
1092564232124665856	2019-02-04	[]	allow vog bring wel travel inspo twist
1092561241959251970	2019-02-04	[]	shi labeouf's screenwriting debut cameo girlfriend fka twig unexpect com pair emm thompson mindy kal
1092558288351363072	2019-02-04	[]	real bought ide rom partn sort mag secret door whol world @dollyalderton
1092555380159381505	2019-02-04	[]	wond ingredy tre acn breakout new gen retinol suprem ant
1092552378644090880	2019-02-04	[]	best found put best fac forward
1092549599678660608	2019-02-04	[]	@laurabailey_uk secret get sleep first hotel beat track
1092546619239739393	2019-02-04	[]	naom click immedy two us chat polit day @kendrick38 shar play @naomicampbell boyfriend brit vogue's march 2019 issu newsstand
1092543614197092353	2019-02-04	[]	meet @cynthialovely 25 sing sign @katyperry label unsub record
1092540846417870848	2019-02-04	[]	rat ag 15 continu ris tak phrase suicid gen
1092538346558099456	2019-02-04	[]	scand girls' favourit knitwear menswear label that's found fan skept
1092535944572559361	2019-02-04	['#wakeup', '#handmaidst']	styl pierc tak fam 1984 ronald reag polit campaign morn americ poign riff
1092533890261098499	2019-02-04	[]	fash fan stil mourn loss old celin rihann step coat phoeb philo last collect
1092531586795556864	2019-02-04	[]	@asos fin launch first homew lin
1092529348312289281	2019-02-04	[]	good new ss19 sho trend real someth everyon
1092527110722383878	2019-02-04	[]	reg stat welcom headband lif
1092525133955325953	2019-02-04	[]	industry stil drag feet recogn wom helm film stop us celebr 2019 fem film
1092523150141804545	2019-02-04	[]	@emma_weymouth expl lif behind clos door on london's styl chines resta
1092521168215724035	2019-02-04	['#osc']	vog meet three wom direct whos film hit view crit alik overlook best direct categ
1092519188315496449	2019-02-04	[]	week sarah har shar three wom fac nee facetim
1092517195308036096	2019-02-04	[]	parlia commit annount uk retail fail promot environ sustain
1092515027876306948	2019-02-04	[]	perfect pair pearl ear lip balm sav pout wint new season item ad basket
1092513049930592258	2019-02-04	[]	john krasinsk big cry emy blunt acceiv award quiet plac sag mood @raven__smith reflect week's column
1092510803964686336	2019-02-04	['#dumbo']	14 star alongsid ev green colin farrel tear @disney_uk class com march 29
1092508574801190918	2019-02-04	[]	off 2019's start block tim start plot plan spring sum look
1092506580485062663	2019-02-04	[]	tak inspir street styl mast copenh fash week capt vog rov photograph jeps
1092504080939999232	2019-02-04	[]	matthew adam dol art school mowalol meet new gen rad cre refresh luxury fash
1092501831480213512	2019-02-04	['#7rings']	arian grande's new japanes tattoo act transl
1092499351748923392	2019-02-04	[]	insoucy messy bun team hairdress georg northwood pol look form eng roy
1092497363292340225	2019-02-04	['#newvog']	edit @edward_enninful cov rev alway spark hiv cre soc med
1092495888847642625	2019-02-04	[]	2019's skinc launch excit bunch see brit vogue's favourit new way transform skin
1092494105593237505	2019-02-04	[]	febru
1092492372993368071	2019-02-04	[]	@priyankachopra play award 2018 netflix docu sery cult lead bhagw shree rajneesh
1092490875958108161	2019-02-04	[]	welcom first dig diary month download best bit tech cur @thedigifairyz
1092489151478415361	2019-02-04	[]	feel degrad off com think cap @becauseimfreida rev
1092487393427554304	2019-02-04	[]	@mariekondo lead us toward world fre clut read top tip mast ultim digit tidy
1092485930437525504	2019-02-04	[]	hugh took new surpr wel oth imagin less soey kim tel brit vog
1092484184973762564	2019-02-04	[]	rul mad brok non dict cannot wear
1092482409713582081	2019-02-04	[]	@missvogueuk profil styl mal celebr watch 2019
1092480779337302016	2019-02-04	[]	shop sustain @reveenvert found @corahiltson
1092479466138415104	2019-02-04	[]	nee ampl mot hit gym week look non brunet bombshel dakot johnson
1092476624619126785	2019-02-04	[]	stell addit already excel cast els expect high return @fleabag season 2
1092473613184311296	2019-02-04	['#osc']	film win big year's star ceremony
1092470906742550528	2019-02-04	[]	journ pur honest bring just bring voic voiceless nobl @janinedigi
1092468450142892033	2019-02-04	[]	new episod youtub channel see visit @britishvogue off first saw new cov
1092468022374207488	2019-02-04	['#eebafta']	duk duchess cambridg attend sunday evening's ceremony
1092465284793987074	2019-02-04	[]	@naomicampbell march issu unveil set internet alight art immedy got work sketch paint digit vert stev meisel im
1092463072827052035	2019-02-04	[]	embrac class sunset end oth pref someth littl out
1092460586783387648	2019-02-04	[]	fash fan stil mourn loss old celin rihann step coat phoeb philo last collect
1092458079923376128	2019-02-04	[]	par jackson tim tabloid print rum let everyon know
1092455560534994944	2019-02-04	[]	stress cold weath remedy form bas vog beauty &amp; lifestyl direct @jessicadiner's edit week
1092452960876089345	2019-02-04	[]	@olehenriksen fan rejo skinc brand lov hollywood back relaunch uk
1092450157281591297	2019-02-04	[]	wheth tre someon els simply show lov brit vogue's favourit
1092447436277235713	2019-02-04	[]	fulfil 2019 workout goal new op
1092444953383444481	2019-02-04	[]	on mess duchess sussex send wardrob import sustain fash
1092441982834749440	2019-02-04	[]	scand girls' favourit knitwear menswear label that's found fan skept
1092441199473057792	2019-02-04	[]	@traceyemin back new exhibit @_whitecube first london show four year
1092438492024582144	2019-02-04	[]	@asos launch first homew lin expect co high assault hom wel wardrob
1092435935868923904	2019-02-04	[]	hid gallery untouch beach vog pick plac wor travel year
1092433313476870144	2019-02-04	['#nyfw']	expect new design tak class hous form fixt mak return
1092430563837952001	2019-02-04	[]	industry ris vog get insid track rent prem fash
1092428048685764608	2019-02-04	[]	ev glut opt avail keep bas shad interest tak skil
1092425166821486592	2019-02-04	[]	stick ent sweepstak grand priz fre @beyonce @s_c_ ticket lif
1092422255563456512	2019-02-04	[]	@missvogueuk meet @ncutigatwa @sexeducation new @netflix sery everyone's rav
1092419288923803648	2019-02-04	[]	three lush gard throughout christian @dior's lif inspir cre ultim fantasy gown
1092416999949549568	2019-02-04	[]	interest part becom adult thing becom bittersweet emm ston rev
1092414510269452288	2019-02-04	[]	three lush gard throughout christian @dior's lif inspir cre ultim fantasy gown
1092412256967630848	2019-02-04	[]	@chanel @tomford @marcjacobs unveil beauty collect spec mal custom mak design men long nich
1092409789517365255	2019-02-04	[]	2019's skinc launch excit bunch see brit vogue's favourit new way transform skin
1092407087987085312	2019-02-04	[]	parlia commit annount uk retail fail promot environ sustain
1092406937373868032	2019-02-04	[]	industry stil drag feet recogn wom helm film stop us celebr 2019 fem film
1092404099784626176	2019-02-04	[]	week's @laurabailey_uk lov shar secret get sleep first hotel beat track
1092403677770452992	2019-02-04	[]	@cynthialovely sign @katyperry label unsub record liv lif win despit mad pass init audit stag am idol
1092401449445847040	2019-02-04	[]	rat ag 15 continu ris tak phrase suicid gen
1092401311306469377	2019-02-04	[]	naom click immedy two us chat polit day @kendrick38 shar play @naomicampbell boyfriend brit vogue's march 2019 issu newsstand
1092399223780331522	2019-02-04	[]	{i} real interest part becom adult thing becom bittersweet emm ston rev
1092396495691763712	2019-02-04	[]	new year brought new sens bright bold
1092395057255272449	2019-02-04	[]	soc med link direct impact increas
1092393539848282114	2019-02-04	[]	harry's influ particul poign emerg menswear design @danielwfletcher
1092390769531502593	2019-02-04	[]	vog debunk myth behind sleep sci find much sleep id amount
1092387806909992960	2019-02-04	[]	@naomicampbell march issu unveil set internet alight art immedy got work sketch paint digit vert stev meisel im
1092385708269072384	2019-02-04	[]	2019's skinc launch excit bunch see brit vogue's favourit new way transform skin
1092382617838723077	2019-02-04	[]	feat direct @gileshattersley meet hollywood's rel actress
1092381980371681280	2019-02-04	[]	three lush gard throughout christian @dior's lif inspir cre ultim fantasy gown
1092380326205247488	2019-02-04	[]	@asos launch first homew lin expect co high assault hom wel wardrob
1092379580218912768	2019-02-04	['#wakeup', '#handmaidst']	long trail @handmaidsonhulu fin
1092378719157698561	2019-02-04	[]	@parisjackson tim tabloid print rum let everyon know
1092378431017414656	2019-02-04	[]	fash fan stil mourn loss old celin @rihanna step coat phoeb philo last collect
1092377177449005056	2019-02-04	[]	on mess duchess sussex send wardrob import sustain fash
1092373386125365249	2019-02-04	['#nyfw']	new york fash week kick febru expect new design tak class hous form fixt mak return
1092369044446085121	2019-02-04	[]	com innov beauty industry tour de forc
1092366856885886976	2019-02-04	[]	first tim @parisjackson tak soc med address rum ment heal
1092364835805949952	2019-02-04	[]	2019's skinc launch excit bunch see brit vogue's favourit new way transform skin
1092361115483422720	2019-02-04	[]	sustain increas forefront shoppers' mind vog rev upgrad wardrob borrow buy
1092356453900406784	2019-02-04	[]	think ahead holiday three spectacul new op rad 2019
1092350569329709057	2019-02-04	[]	pair salv shrill cry alarm clock enl workwear wardrob
1092345849227681793	2019-02-04	[]	caf din party park pub eith sect famy are noth
1092341234188894208	2019-02-04	[]	wond ingredy tre acn breakout new gen retinol suprem ant
1092336155096432640	2019-02-04	[]	want travel smart fair aw go
1092330427602341888	2019-02-04	[]	new design tak class hous form fixt mak return vog fash crit and christian mads highlight on watch
1092327132523651072	2019-02-04	[]	mak ens good cleans every morn new year's resolv
1092323921448312832	2019-02-04	['#osc']	rememb bj swan mom 2001
1092320692337590272	2019-02-04	[]	fut sustain fash lie rent econom
1092317458898264064	2019-02-04	[]	good new ss19 sho trend real someth everyon
1092313974870294528	2019-02-04	[]	hair skin body tre thing tre 2019
1092307933055074304	2019-02-04	[]	tri fail becom morn person
1092304212103495681	2019-02-04	[]	on bing 2019
1092300487829921792	2019-02-04	[]	fail leath jacket covet design bag @missvogueuk shar best invest piec ad 2019 wardrob
1092284000226418689	2019-02-04	[]	wel fact @naomicampbell beauty icon sint first burst onto scen
1092273374062088193	2019-02-04	['#marypoppinsreturn']	every singl costum @the_favourites cre six week sandy powel also work tim
1092252575649406981	2019-02-04	[]	fem empow cent @roksandailincic's etho mess keen reinforc latest collect
1092231505487847425	2019-02-04	[]	infanticid nanny sex parisien french novel le sliman peculi gift tel chil uncomfort story
1092211242574512129	2019-02-04	[]	reg stat welcom headband lif
1092209010562994176	2019-02-03	[]	think ahead holiday three spectacul new op rad 2019
1092206778320850945	2019-02-03	[]	tak inspir street styl mast copenh fash week capt vog rov photograph jeps
1092204053659033600	2019-02-03	[]	limit way leng design styl brid veil oft sign nupt op splendour
1092202075524603909	2019-02-03	[]	costum drama known lav wardrob cult film whos sart detail legend
1092198922662146048	2019-02-03	[]	want travel smart fair aw go
1092197180100829185	2019-02-03	['#osc']	win big year
1092195454975127552	2019-02-03	[]	queen bar bia kat moss talk us lifelong obsess
1092193463674773505	2019-02-03	[]	baby johnny dep kat moss serg gainsbourg jan birkin
1092191982691192832	2019-02-03	[]	self mov boom pac lif rig new therapy try
1092188780453421056	2019-02-03	[]	sleep bet import beauty sleep
1092185803776765953	2019-02-03	[]	hid gallery untouch beach vog pick plac wor travel year
1092184309946109952	2019-02-03	[]	stell addit already excel cast els expect high return @fleabag season 2
1092180823351197697	2019-02-03	[]	sometim way tru relax leav london behind escap countrysid peac coupl day
1092179345119039488	2019-02-03	[]	ess beauty kit ens perfect prep travel plan wint
1092177113157943296	2019-02-03	[]	@orangefeeling @bonnaroo @allpointseastuk excit fest lin uk europ beyond
1092174143993323521	2019-02-03	[]	start plan wint weekend getaway
1092171152540217346	2019-02-03	[]	there's nev appet tim go veget london din vogue's favourit
1092168682766327809	2019-02-03	[]	@justinbieber fin unveil first look fash brand drew
1092165471124799488	2019-02-03	[]	sery glow skin ev hairstyl see @naomicampbell's mem beauty look
1092162744948805632	2019-02-03	[]	duchess sussex justin bieb read styl not seem
1092160033738186753	2019-02-03	[]	best mid skirt high street reach cult stat @missvogueuk edit top market right
1092158044002308096	2019-02-03	[]	get excit tim choos new train @missvogueuk's best new releas
1092154799762653184	2019-02-03	[]	yesterday speak singl verb person 7am 6pm @nellfrizzell nee chat baby can't speak
1092151351780560897	2019-02-03	[]	deserv kind karm @gabrielahearst tel vog see megh oprah carry handb
1092149112974102529	2019-02-03	[]	brit vog deputy edit sarah har shar week styl edit week's agend perfect pair black mul
1092147394769227777	2019-02-03	[]	fairyt abrupt cam end ev follow dat expery turn com rom soey kim tel brit vog
1092144169982849024	2019-02-03	[]	@mariekondo rev top tip mast ultim digit tidy
1092140956147576832	2019-02-03	[]	littl fai work lot mimos blair waldorf
1092138476890394629	2019-02-03	[]	@missvogueuk profil styl mal celebr watch 2019
1092136280098553856	2019-02-03	[]	giv court revamp vog ultim altern dat idea
1092132281899208704	2019-02-03	[]	brand exerc duo plan ent yet work hand film fest
1092129222708133890	2019-02-03	[]	someth littl bond @altuzarrastudio say approv also real want bag
1092126507009486850	2019-02-03	[]	could bet tour guid blair seren
1092123526759366656	2019-02-03	[]	century sint first raz market wom cre what's chang
1092120456222703617	2019-02-03	[]	fail leath jacket covet design bag @missvogueuk shar best invest piec ad 2019 wardrob
1092116904137969666	2019-02-03	[]	allow vog solv snowboard ski wear worry ultim edit best ski wear seen wint beyond
1092114085695631360	2019-02-03	[]	diff good mak brush mak beauty regim noth short amaz
1092113587890475008	2019-02-03	[]	wed fest keep com @priyankachopra @nickjonas
1092111333070299136	2019-02-03	[]	@justinbieber fin unveil first look fash brand drew
1092108268984565760	2019-02-03	[]	appoint sou bank est mark megh first roy patron posit took queen ear year
1092105413431054337	2019-02-03	['#osc']	rom favourit lead 10 nomin feat maj categ expect 2019
1092102438432264192	2019-02-03	['#diordesignerofdream']	go insid high @v_and_a exhibit christian @dior design dream
1092098979876225025	2019-02-03	[]	sery glow skin ev hairstyl see @naomicampbell's mem beauty look
