id	created_at	hashtags	cleaned_text
1083372900005175297	2019-01-10	[]	consid sign veganu commit mon plant eat
1083368741629501442	2019-01-10	[]	brit vog look back jul roberts' icon fash mom film
1083365025098727424	2019-01-10	['#backtowork']	shop brit vogue's edit best 2019 diary grac desk com janu
1083361348099158016	2019-01-10	[]	chief cre off riccardo tisc new vis @burberry see brit vog shoot star kat moss lily jam @jessglynne
1083357876738056194	2019-01-10	[]	nev let shit stop @kendalljenner set record straight acn
1083353856208265216	2019-01-10	[]	here's every piec @rihanna's latest @savagexfenty lingery collect valentine's
1083350450009763840	2019-01-10	[]	on two roy wed supermodel sing act tying knot
1083348706399797249	2019-01-10	[]	@patmcgrathreal mascar com
1083347665612623872	2019-01-10	[]	trend might chang thing real lik prob
1083346917143310337	2019-01-10	[]	cult delight 2019 stor us
1083343255994093568	2019-01-10	['#lfwm']	see styl highlight best dress capt @garconjon
1083339548590067713	2019-01-10	['#thursdaythought']	destiny los stupid excus wait thing hap instead mak hap blair waldorf
1083335008612503552	2019-01-10	['#veganu']	13 beauty brand know lif veg newcom
1083331385895632896	2019-01-10	[]	hard imagin @kyliejenner would quiet get eng without splashy break internet rev
1083330492756299778	2019-01-10	[]	annount @patmcgrathreal's instagram pag fetishey mascar set launch febru 14
1083329232787464192	2019-01-10	[]	addit queen pass two patron duchess sussex also tak patron two addit char part off work portfolio
1083329183349121025	2019-01-10	[]	carry bradshaw's '90s fend baguet dior styl princess dian lov '80s
1083324644705349632	2019-01-10	[]	@margotrobbie annount play @barbie liv remak vog look back standout film rol dat
1083317705002926081	2019-01-10	[]	celebr colo rhythm afr spirit afropunk known divers mus sup crowd
1083310881289711616	2019-01-10	[]	step guid bleach hair perfect result minim dam
1083305186439897088	2019-01-10	[]	hit refresh newest launch land vog beauty lifestyl direct @jessicadiner desk new year
1083303244087087104	2019-01-10	[]	us eclect divers diff peopl try push every season celebr individ glen mart said latest collect
1083301759324512256	2019-01-10	[]	mak ens good cleans every morn new year's resolv
1083300089907609600	2019-01-10	[]	birthday wel wish duchess cambridg pour yesterday kat spend day celebr
1083294807630536704	2019-01-10	[]	'rather fix soc media's 'blackfishing' phenomenon foc dismantl harm stereotyp black women's body say @renireni
1083287571847876608	2019-01-10	[]	half century launch crack begin appear im contraceiv pil wom turn away
1083280627678568448	2019-01-10	[]	play dealt intens emot subject mat got know wel @freyamavor__
1083272960276865024	2019-01-10	[]	stell act car enough @drewbarrymore sint turn hand beauty mak brand @flowerbeauty
1083268957056974848	2019-01-10	[]	wheth work spotlight memb fash commun strengthened industry fabr
1083264965576937472	2019-01-10	[]	@longchamp @chanel @mango @gabrielahearst best wint naut piec seen
1083237236789993472	2019-01-10	[]	new year resolv receiv lot bad press here's begin year posit goal
1083203944581644288	2019-01-10	[]	fil mot lyr fast beat tun provid back track pav run dynam group class
1083184664829935618	2019-01-10	[]	look wom inspir lat andy warhol challeng er ide beauty could
1083165199941677056	2019-01-10	[]	2019 hold best new beauty launch
1083161225737981952	2019-01-10	[]	princess leia's icon hair par glamo moulin roug 30 best beauty transform
1083157430203281411	2019-01-10	[]	20 gown rememb defin 2018 com red styl
1083153971475296256	2019-01-10	[]	return legend @dior access colo sho domin
1083148979750256640	2019-01-09	[]	@the_favourite's emm ston oliv colm humo becam part parcel tim shoot 1704 dram
1083143313287512065	2019-01-09	[]	fash icon past pres undoubt inform wardrob 2019
1083137592890220544	2019-01-09	['#januaryblu']	think ahead holiday three spectacul new op rad 2019
1083133886488633344	2019-01-09	[]	liv cor buy inject warm hom year ahead
1083130171140554754	2019-01-09	[]	award actress talk vog wom walk red carpet goe ultim beauty tre
1083123649807294464	2019-01-09	[]	adorn int piec lik @monicavinader kasun @wolfandbadger @versace
1083118366213189632	2019-01-09	[]	osc actress @violadavis's best red mom
1083114118163451908	2019-01-09	[]	ment heal benefit far outweigh phys decid reduc alcohol intak dram 2015 @parislees lif pow champagn diet
1083110125290901519	2019-01-09	[]	prim tim chunky coat
1083105362532880392	2019-01-09	[]	watch prep tear around 8 minut mark @karliekloss shar unseen foot wed day
1083099945635401733	2019-01-09	[]	trend beg explod instagram
1083095583458541569	2019-01-09	['#thefutureissu']	vog sat ris model on ir law rev cont bag
1083091841870905347	2019-01-09	['#killingev']	hit show writ co phoeb wal com back
1083087276987637761	2019-01-09	[]	ev want know @hermes_paris birkin bolid story behind acclaim kel bag
1083083138321006592	2019-01-09	[]	want travel smart fair aw go
1083078217014169605	2019-01-09	[]	let known fiv piec adv definit mak skinc routin
1083072010593406978	2019-01-09	['#thefavourit']	heart see fem film receiv 12 baft nomin includ best film recognit wom best direct categ stil woe lack
1083067346779103237	2019-01-09	['#marypoppinsreturn']	design start plan mag nanny's wardrob return cherry tre lan
1083063848544940033	2019-01-09	[]	vog giv ultim guid hol step tak prev fight wint cold
1083057664815480832	2019-01-09	[]	vog look rarest handb auct find modern collect item sel record amount
1083053347165425665	2019-01-09	[]	ultim guid interest ret expery purchas tre mind body soul
1083047153495408640	2019-01-09	[]	@rihanna skinny brow brid beauty look help defin favourit beauty trend 2018
1083043113944473600	2019-01-09	[]	@britishvogue edit wel resolv
1083041969897656321	2019-01-09	[]	dakot johnson's post braid certain reason enough book heart pump sess right
1083036724761104390	2019-01-09	[]	rol hil northern ireland badland spain vog tak tour icon @gameofthrones loc visit
1083031027528990723	2019-01-09	[]	2019 kick look back every fash mom ignit vogue's new cyc 2018
1083024509320523776	2019-01-09	[]	quest lumin skin tak right approach put highlight powd mak surpr comeback
1083018952559812610	2019-01-09	[]	includ duchess cambridge's icon bount blow bow access look everyon want reply wint
1083015029648228354	2019-01-09	['#eebafta']	see @bafta nomin list ful includ @the_favourite pick impress 12 nomin across categ
1083014497793703936	2019-01-09	[]	@yxngbane @troyesivan
1083010685313921024	2019-01-09	['#eebafta']	nomin host detail @baftas 2019 tak plac febru 10 @royalalberthall
1083005931322003456	2019-01-09	[]	@skyatlantic's ep dram @gameofthrones fin set return 2019
1082999152764698624	2019-01-09	[]	find skinc produc suit skin typ routin
1082992931961819136	2019-01-09	[]	marry princess dian lif cambridg vog tak look print charles' extraordin lif spotlight
1082986485417164805	2019-01-09	['#pittiuomo2019']	see styl men wear flor week
1082982620760326150	2019-01-09	[]	21 acn cam back ful forc due shift hormon stress lat due non fash show schedule
1082978662054539264	2019-01-09	[]	blur fin lin minim appear por ev skin ton on hero produc
1082973970910068736	2019-01-09	[]	could bet tour guid blair seren
1082971993455116289	2019-01-09	[]	oh i'm gym
1082970375569448961	2019-01-09	[]	@victoriabeckham's chic suit @traceeellisross effortless cool @gucci get see who's wear week
1082967090200489984	2019-01-09	[]	breakfast favourit carav resta boujiest brunch chiltern fireh simply must expery least
1082963361690779649	2019-01-09	[]	stil cho may rais eyebrow amongst longtim crit dol
1082961431635656704	2019-01-09	[]	queen elizabe princess margaret fash princess jan birkin serg gainsbourg
1082957429212626945	2019-01-09	[]	@rihanna look ahead valentin day lin @savagexfenty lingery cut saccharin connot hallmark holiday
1082953970971299840	2019-01-09	[]	@caradelevingne @ladygaga @traceeellisross celebr lead tail trend
1082949793218023425	2019-01-09	['#duchessofcambridg']	happy birthday turn 37 today tak look back best styl mom
1082945819706384384	2019-01-09	[]	way inst upgrad ponytail season
1082937960901853189	2019-01-09	[]	got baby girl fam xma jap kim kardash west capt retrospect instagram story holiday haul
1082936887961108480	2019-01-09	[]	last tre self book read album list fest break here's vog editors' rad week
1082930032639725568	2019-01-09	[]	covet class runway novel vog celebr icon @chanel bag design hist
1082923064730501120	2019-01-09	[]	'rather fix soc media's 'blackfishing' phenomenon foc dismantl harm stereotyp black women's body say @renireni
1082919163977449472	2019-01-09	['#baft', '#thefavourit', '#eebafta']	see nomin list ful includ pick impress 12 nomin across categ
1082915843569274880	2019-01-09	[]	vogue's beauty edit @lmsvogue condit nev opt extr
1082909483205038080	2019-01-09	['#katemoss']	@stellamccartney @kaiagerber wom today tomorrow
1082909235040714754	2019-01-09	[]	everyth nee know must @chanel docu @netflix
1082902215285764096	2019-01-09	[]	latest hi fac gadget sup skinc suppl biggest beauty trend
1082898492933193728	2019-01-09	[]	latest beauty trend help spee beauty regim
1082877336800903168	2019-01-09	[]	@karllagerfeld's show set @chanel legend here's look back best
1082849418733371394	2019-01-09	[]	includ return muff
1082818180806893568	2019-01-09	[]	new year new bet tim makeov
1082810179681480704	2019-01-09	[]	industry hair innov pion new skinc year beauty look lik brit vog beauty lifestyl direct @jessicadiner
1082806222473084928	2019-01-09	[]	@arianagrande @malala @dinaashersmith @mayajama
1082802510891532289	2019-01-09	['#iambecom']	mom pict tel @michelleobama's incred story
1082798794620747777	2019-01-09	[]	pink @maisonvalentino gown worn @traceeellisross @ladygaga meghan's multipl @givenchy gown wom led way sty year
1082795283216547845	2019-01-09	"[""#bradpitt's""]"	vog tak look back bril rol on favourit
1082790831650684928	2019-01-09	[]	get inspir brid look best celebr wed hair cut hairstyl tim
1082787347111002112	2019-01-08	['#marypoppinsreturn']	vog speak emy blunt cast return 54 hiat spec
1082783871756894208	2019-01-08	[]	vogue's pick year's top jewellery mom
1082780337544089601	2019-01-08	[]	shot stev meisel new campaign @chloefashion evok feminin utop every wom em com spring
1082776863133581313	2019-01-08	[]	osc actress @violadavis's best red mom
1082773379378237441	2019-01-08	[]	@longchamp @chanel @mango @gabrielahearst best wint naut piec seen
1082769912307896321	2019-01-08	[]	@dior repres dream fash cre direct mar graz chiur tel vog explain brand pul pow brid
1082768383018442753	2019-01-08	[]	see every singl look @itsjeremyscott's @moschino rom collect
1082766404175179776	2019-01-08	[]	ment heal benefit far outweigh phys decid reduc alcohol intak dram 2015 @parislees lif pow champagn diet
1082762940326035456	2019-01-08	[]	everyth nee know must @chanel docu @netflix
1082759479517696001	2019-01-08	[]	four ev tak plac californ market cent compr catwalk show pres list conscy design
1082755889117974530	2019-01-08	[]	nomin host detail bafta 2019
1082752502838251520	2019-01-08	[]	freshw pearl piec @ladygaga lov colo block bag want snap @selfridges
1082748923159166978	2019-01-08	[]	season @fashion_east off robyn lynch mowalol stef cook demonst divers trio collect forward design
1082745116199133184	2019-01-08	[]	high street high end vog edit 10 best mascar wand leng curl defin
1082741421600321537	2019-01-08	[]	21 acn cam back ful forc due shift hormon stress lat due non fash show schedule
1082737927644504064	2019-01-08	[]	rest skin pre season glory vog pres detox beauty regim embrac doubl cleans declut mak bag
1082734410305277952	2019-01-08	[]	here's
1082730910917758977	2019-01-08	[]	bell hadid kendal jen show two piec togeth mak surpr stell vis
1082727451921473537	2019-01-08	[]	vog debunk myth behind sleep sci find much sleep id amount
1082723969097191429	2019-01-08	[]	vog tak look back pion pow dress suit stat thank bring back
1082720233675214854	2019-01-08	[]	hail superfood savio comp poison
1082715868553973760	2019-01-08	[]	adorn int piec lik @monicavinader kasun @wolfandbadger @versace
1082712096855465985	2019-01-08	[]	return legend @dior access colo sho domin
1082708149914820610	2019-01-08	[]	autumn 2019 menswear show watch season kick london weekend
1082704273216073728	2019-01-08	[]	man also behind alex chung's tousl wav alic vikander's red carpet styl
1082700300971134976	2019-01-08	[]	latest hi fac gadget sup skinc suppl biggest beauty trend
1082696548075606016	2019-01-08	['#davidbowy']	rememb would mus legend's 72nd birthday today
1082695347758120960	2019-01-08	[]	vog look rarest handb auct find modern collect item sel record amount
1082693286534483968	2019-01-08	[]	could dress tim next year
1082691447235756032	2019-01-08	[]	say feel lik want run away famy respons @evawiseman adv on wom deal feel jad
1082686874886565888	2019-01-08	['#timesup', '#goldenglob']	christian bal unus mus oliv colm explicit shout act kept mov al biggest talk point 2019
1082682900179505152	2019-01-08	['#goldenglob', '#bohemianrhapsody', '#thew']	see 2019 win list ful includ win ram malek glen clos
1082680941158547456	2019-01-08	[]	play barby promot confid curios commun throughout child journey self @margotrobbie said play icon dol
1082678922901368833	2019-01-08	[]	@rihanna skinny brow brid beauty look help defin favourit beauty trend 2018
1082673347912261632	2019-01-08	['#goldenglob']	go clos best beauty look 2019
1082669368264310784	2019-01-08	['#goldenglob']	cas somehow miss see show red carpet gown 2019's ceremony
1082663094504079361	2019-01-08	[]	ben cottrel matthew dainty flex fet sportswear musc @cottweiler collect hum wel
1082656850116575232	2019-01-08	['#backtowork']	shop brit vogue's edit best 2019 diary grac desk com janu
1082652952706367490	2019-01-08	[]	congrat sal rooney youngest ev win @costabookawards spok vog novel norm peopl last year
1082650556869632001	2019-01-08	[]	@skinowl's cult buy @clinique_uk's de produc hardest work ey cream nev let
1082643528436584450	2019-01-08	[]	much lik worn levi's 501s breton stripes fring look bet french wom secret pul dos je ne sai quo
1082642614938206208	2019-01-08	[]	cashm tracksuit travel toiletry vog pres perfect pack list cosy break away
1082635727177953285	2019-01-08	['#selfc']	2018 year hasht clock 10 mil post instagram wel trend know 2019
1082631632836792321	2019-01-08	['#goldenglob']	cas somehow miss see show red carpet gown 2019's ceremony
1082626744018972674	2019-01-08	['#killingev']	hit show writ co phoeb wal com back
1082623275249876993	2019-01-08	[]	on two roy wed supermodel sing act tying knot
1082616765379678208	2019-01-08	[]	@caradelevingne @ladygaga @traceeellisross celebr lead tail trend
1082611450907164672	2019-01-08	"[""#britishvogue's"", '#katemoss', '#lilyjam']"	febru issu @burberry's chief cre off pres refresh tak brit id fash see shoot star
1082605733290627073	2019-01-08	[]	@kendalljenner op skin heal
1082605313826713600	2019-01-08	[]	look wom inspir lat andy warhol challeng er ide beauty could
1082601508020072448	2019-01-08	[]	mak ens good cleans every morn new year's resolv
1082594783493787648	2019-01-08	[]	here's
1082590144589414400	2019-01-08	[]	play dealt intens emot subject mat got know wel @freyamavor__
1082588136885100545	2019-01-08	['#goldenglob']	@ladygaga also rev celebr win
1082588082807951362	2019-01-08	[]	2019 year fin opt fring
1082585945701081093	2019-01-08	[]	popst on blu mood
1082582124224569344	2019-01-08	[]	2019 hold best new beauty launch
1082575757233319938	2019-01-08	[]	act end someth could channel traum gend girl spider's web star tel vog
1082570323747319808	2019-01-08	[]	cult delight 2019 stor us
1082565823913443328	2019-01-08	['#marypoppinsreturn']	design start plan mag nanny's wardrob return cherry tre lan
1082560602613182465	2019-01-08	['#thefutureissu']	@dinaashersmith keep self intact ev lif push track
1082553932226981889	2019-01-08	[]	step guid get skin smoothest ev seen
1082551643995078657	2019-01-08	[]	hid gallery untouch beach vog pick plac wor travel year
1082547399770472449	2019-01-08	[]	harsh real janu rev neglect skin dehydr lacklust ess grey brit vog contribut edit @funmifetto shar favourit mask combat dehydr skin post season
1082543353538007040	2019-01-08	[]	vogue's beauty edit @lmsvogue condit nev opt extr
1082539825700442112	2019-01-08	[]	beauty ess rit part routin
1082512522958290944	2019-01-08	[]	on think takeout del on pict fiv ton dalmat marbl stainless steel
1082479737488986112	2019-01-08	[]	stell act car enough @drewbarrymore sint turn hand beauty mak brand @flowerbeauty
1082453452515618816	2019-01-08	[]	consid sign veganu commit mon plant eat
1082446467439226880	2019-01-08	[]	20 gown rememb defin 2018 com red styl
1082440569069232128	2019-01-08	[]	celebr colo rhythm afr spirit afropunk known divers mus sup crowd
1082436888189915142	2019-01-08	[]	princess leia's icon hair par glamo moulin roug 30 best beauty transform
1082432442647146496	2019-01-08	[]	return legend @dior access colo sho domin
1082429027443453953	2019-01-08	['#iambecom']	mom pict tel @michelleobama's incred story
1082422813506584579	2019-01-07	[]	last tre self book read album list fest break here's vog editors' rad week
1082416629609349121	2019-01-07	['#thefutureissu']	vog sat ris model on ir law rev cont bag
1082410089858981889	2019-01-07	[]	im fash photograph legend inspir party snap wint
1082403592433221632	2019-01-07	[]	fash icon past pres undoubt inform wardrob 2019
1082398453559369733	2019-01-07	[]	prim tim chunky coat
1082393814617280513	2019-01-07	[]	ros star buy @aromaassoc @aesopskincare's bottl calm help allevy anxy
1082388356108091393	2019-01-07	[]	everyth blair waldorf taught @missvogueuk lov lif label
1082381679501680640	2019-01-07	[]	trend beg explod instagram
1082374783575183362	2019-01-07	[]	want travel smart fair aw go
1082368057903902722	2019-01-07	[]	bespok scarlet pet dunda dress jerry hal meet bianc jag meet liz tayl @emrata tel vog
1082362542821904384	2019-01-07	[]	thought last night @goldenglobes
1082359120571875328	2019-01-07	[]	cours @gucci's latest apothec perfum collect look beauty smel
1082352244958343168	2019-01-07	[]	fam slinky dress hard way halston design cho best dress wom 70s includ bianc jag liz minnell
1082347111868452864	2019-01-07	[]	see red hair mak gold glob 2019 clos
1082345497812119552	2019-01-07	"[""#bradpitt's""]"	vog tak look back bril rol on favourit
1082340939086118912	2019-01-07	[]	@ladygaga's sparkl @tiffanyandco set @lupita_nyongo's stun @bulgariofficial ear saiors ronan's show @chopard
1082337313450061825	2019-01-07	[]	way inst upgrad ponytail season
1082330789558317056	2019-01-07	[]	film perform overlook clear com divers repres chang afoot
1082326540413816833	2019-01-07	[]	destiny los stupid excus wait thing hap instead mak hap blair wal
1082324312512700423	2019-01-07	[]	@arianagrande @malala @dinaashersmith @mayajama
1082320461411831809	2019-01-07	[]	much
1082318149767348224	2019-01-07	['#goldenglob']	mad night surpr win loss film perform certain overlook clear com divers repres chang afoot say @sarahc_k
1082313694585995267	2019-01-07	[]	sea class men suit cody fern opt bril fresh look complet icon @margiela boot
1082308204447649794	2019-01-07	['#goldenglob', '#bohemianrhapsody']	see 2019 win list ful includ unexpect win ram malek last night's star ceremony
1082302472801185800	2019-01-07	[]	trailblaz docu watch the ticket book exhibit see @laurabailey_uk shar best pick week
1082297721191579648	2019-01-07	['#goldenglob']	vog get insight wom respons @killingeve star phoeb wal @iamsandraoh @jodiecomer's kick look
1082292280541802501	2019-01-07	[]	brit vog look back jul roberts' icon fash mom film
1082289932708794370	2019-01-07	['#lffm']	see styl highlight best dress capt @garconjon
1082286211316805632	2019-01-07	['#veganu']	13 beauty brand know lif veg newcom
1082284466473717761	2019-01-07	[]	@gucci launch alchem gard collect fin fragr pack beauty prob break instagram
1082280732519739394	2019-01-07	[]	marry princess dian lif cambridg vog tak look print charles' extraordin lif spotlight
1082275109140869122	2019-01-07	[]	find skinc produc suit skin typ routin
1082271463112130560	2019-01-07	['#goldenglob']	sandr oh mad hist year's becom first as act win multipl award see mom might miss
1082268310283128834	2019-01-07	[]	selen gomez's latest @balenciaga look prov alway fresh new way reinv logo swe
1082268184563118082	2019-01-07	[]	@gucci launch alchem gard collect fin fragr pack beauty prob break instagram
1082261219531198465	2019-01-07	[]	see red hair mak gold glob 2019 clos
1082257566669914112	2019-01-07	[]	selen latest get involv logo man
1082251312299982848	2019-01-07	['#goldenglob']	@realchalamet win award best son year
1082245601037828096	2019-01-07	[]	@srd_____ @acoldwall discuss quick asc leicester's hous est forefront intern renown
1082239186072227842	2019-01-07	[]	mak ens good cleans every morn new year's resolv
1082235865903128576	2019-01-07	['#goldenglob']	see insid party win nomin took dant flo celebr
1082233185868673024	2019-01-07	[]	fash quit lit die
1082229293269295104	2019-01-07	['#goldenglob']	act har prec detail @realchalamet's @louisvuitton ensembl
1082229262923587584	2019-01-07	[]	sho divid opin 30 year
1082228013218050048	2019-01-07	[]	new year new bet tim makeov
1082224832199184384	2019-01-07	['#timo', '#goldenglob']	nam anoth act could pul latest look
1082220063787229187	2019-01-07	[]	ultim guid interest ret expery purchas tre mind body soul
1082216610423820288	2019-01-07	['#goldenglob', '#osc']	bellweth red dial firm set disney princess 2019
1082215409837842432	2019-01-07	[]	led lik @gemma_chan @ladygaga @maisonvalentino cout
1082213601312759813	2019-01-07	['#timesup', '#goldenglob']	christian bal unus mus oliv colm explicit shout act kept mov al biggest talk point 2019
1082210655434883072	2019-01-07	['#backtowork']	shop brit vogue's edit best 2019 diary grac desk com janu
1082204045153091585	2019-01-07	[]	wheth work spotlight memb fash commun strengthened industry fabr
1082198098825363456	2019-01-07	['#thefutureissu']	worst feel skinless every nerv end raw expos writ oliv suds essay brit vog
1082194621059481601	2019-01-07	[]	ev want know @hermes_paris birkin bolid story behind acclaim kel bag
1082188547711483904	2019-01-07	[]	@srd_____ @acoldwall discuss quick asc leicester's hous est forefront intern renown
1082185084067872768	2019-01-07	[]	on two roy wed supermodel sing act tying knot
1082182548757729280	2019-01-07	['#goldenglob']	every beauty look red carpet clos detail
1082181630322769921	2019-01-07	[]	industry hair innov pion new skinc year beauty look lik brit vog beauty lifestyl direct @jessicadiner
1082177543355150336	2019-01-07	[]	search trend 2018
1082176257511440385	2019-01-07	['#goldenglob']	best dress see every look
1082173357595021312	2019-01-07	['#goldenglob']	vog get lowdown styl elizabe saltzm kil look
1082172482444976128	2019-01-07	[]	lady gag nev on dress red occas
1082169967808839680	2019-01-07	['#goldenglob']	lupit nyong michael b jord dana gurir hit step rep distinct look somehow look ev bet complet trio
1082169895624867840	2019-01-07	[]	@ladygaga red carpet halv
1082168707655368705	2019-01-07	[]	last night's
1082167449246666757	2019-01-07	['#goldenglob']	every beauty look red carpet clos detail
1082166922739941377	2019-01-07	['#goldenglob']	go clos best beauty look 2019
1082163203231154176	2019-01-07	['#goldenglob']	tonight's kick start an award season calend see show ar
1082161158172348416	2019-01-07	['#goldenglob']	clair foy @miumiuofficial @ladygaga @maisonvalentino every red look 2019
1082159215374929921	2019-01-07	['#januaryblu']	think ahead holiday three spectacul new op rad 2019
1082157383168647170	2019-01-07	[]	frost @tiffanyandco diamond mil dollars' wor prec around neck complet
1082156124965462016	2019-01-07	[]	
1082152349978714113	2019-01-07	['#goldenglob']	every beauty look red carpet clos detail
1082151906057863168	2019-01-07	[]	2019 kick look back every fash mom ignit vogue's new cyc 2018
1082149833283194880	2019-01-07	[]	chalamet clear moth biggest fan also bit fanboy design behind red carpet ensembl
1082147316683792387	2019-01-07	[]	vog get lowdown styl elizabe saltzm
1082146058480771072	2019-01-07	['#goldenglob']	every red look 2019
1082142283636469760	2019-01-07	[]	lady gag nev on dress big occas
1082139997472522241	2019-01-07	['#goldenglob']	celebr tonight's star ceremony look back best gown tim
1082139767091810307	2019-01-07	['#goldenglob']	lupit nyong michael b jord dana gurir hit step rep distinct look somehow look ev bet complet trio
1082137250488496128	2019-01-07	['#goldenglob']	every beauty look red carpet clos detail
1082134733969072128	2019-01-07	[]	competit tonight far best dress goe belov momm
1082133913974259712	2019-01-07	['#goldenglob']	@taylorswift13 mad surpr appear 2019 pres award best origin scor best origin song see win
1082133882525372416	2019-01-07	['#goldenglob']	congrat @iamsandraoh win best perform actress televid sery rol @killingeve 76th an see win
1082133867266564102	2019-01-07	['#goldenglob']	congrat glen clos win 2019 best perform actress lead rol wif see win
1082133261713838087	2019-01-07	['#goldenglob']	tonight's
1082122051538862086	2019-01-07	[]	vog get lowdown styl elizabe saltzm
1082121296509571072	2019-01-07	['#goldenglob']	every beauty look red carpet clos detail
1082114038794997761	2019-01-07	['#goldenglob']	tonight's kick start an award season calend see show ar
1082113324530237442	2019-01-07	['#goldenglob']	celebr tonight's star ceremony look back best gown tim
1082112338579341313	2019-01-07	['#goldenglob']	@ladygaga's blu hair @lupita_nyongo's blu mascar @goldenglobes
1082109221813043201	2019-01-07	[]	co serv maj fash mom
1082108492134170624	2019-01-07	['#goldenglob']	congrat @ladygaga win 2019 best origin song @starisbornmovie
