id	created_at	hashtags	cleaned_text
935233728972034049	2017-11-27	[]	click @racked cyb monday newslet lik
935229754713702401	2017-11-27	[]	exhibit coat
935218623198658561	2017-11-27	[]	everyth
935214656351850496	2017-11-27	[]	get gift shop don way everyth sal
935211081991114753	2017-11-27	[]	want swindl peopl gre sum money dress part
935140404038471680	2017-11-27	[]	mak get dress morn 10 tim easy
934990916334399488	2017-11-27	[]	nich hijab sportswear ign long tim
934986507349254149	2017-11-27	['#rack']	gift guid pick legend makeup art @patmcgrathreal fin releas perm collect ear year win big point whoev gift
934967260803768320	2017-11-27	[]	thought poss lov @violadavis via @bravotv
934941843946532864	2017-11-27	[]	ev brid try hard thought miss thing nev liv plu bridesmaid lif
934920201157582848	2017-11-26	[]	produc definit nee drop lot cash
934898811457044480	2017-11-26	[]	rath spend money sho bag know gift lov on
934874905644019713	2017-11-26	[]	rac polit mix goth aesthet
934851749323579392	2017-11-26	[]	eyeshadow peopl hat eyeshadow
934842530297982976	2017-11-26	[]	cyb monday sal uniqlo includ piec brand biggest collab year
934831870654562304	2017-11-26	[]	boot ey sal forev
934820109050437632	2017-11-26	[]	zar cyb monday sal 40% already sel fast
934808716368666624	2017-11-26	[]	rich sometim fam get marry
934785311749447681	2017-11-26	[]	start found cov grey skin follow powd offset sweating; next cam blush ad col lif fac
934630541583835136	2017-11-26	['#rack']	gift guid pick fun torto acet ear com $50 grab pair
934622992205799424	2017-11-26	[]	tru
934603363160793088	2017-11-26	[]	let seny pick outfit yearbook photo
934580465566040065	2017-11-26	[]	now's gre tim buy sil fur coat
934559828353191936	2017-11-25	[]	ev go hom reason
934535667786375168	2017-11-25	[]	unfortun kind
934520064878952448	2017-11-25	[]	best produc buy @urbandecay's weeklong sal
934513270517616640	2017-11-25	[]	think much excit go gym
934504966856761344	2017-11-25	[]	stil ton beauty sal shop today best on
934490368971644928	2017-11-25	[]	say whaaaaaaaa
934475761494478849	2017-11-25	['#giftguid']	pick three sock set sal weekend 30%
934469732379648000	2017-11-25	[]	brb gott book next hair appoint via @allure_magazine
934467996185227264	2017-11-25	[]	shop weekend maj @garmentory sal
934461932634959872	2017-11-25	[]	shop lingery coat sho we'v got cov
934454112258736129	2017-11-25	['#glit']	@glamglow's mask act wor rack investig
934427467988729856	2017-11-25	['#smallbizsaturday']	giv maj chain rest shop amaz smal bout instead
934423429645787137	2017-11-25	[]	look screams i'm extrem pract lik mak effort footwear stil want giv impress wel
934259346510315521	2017-11-25	['#blackfriday']	buy we'r chat facebook group join
934243995357548545	2017-11-25	[]	30% everyth zar today
934228643911385088	2017-11-25	[]	spend money today sal wor wait monday
934217823093747713	2017-11-25	['#rack']	gift guid pick jewelry cas makeup bag ad purs gift us leath cas howev choos
934207014451990528	2017-11-24	[]	@clairembiggs recommend
934206621135331330	2017-11-24	['#blackfriday', '#askrack']	we'r sign night catch cov
934190579667406848	2017-11-24	[]	feel combin two trend on velvet ankl boot brocad ankl boot $77
934189840962347010	2017-11-24	[]	thing season com dress @oaknyc hand half includ shopbop's sal
934188742260281345	2017-11-24	[]	ye @hels nordstrom throw bon gift purchas lol diptyqu that's one's tough cal reinforc ak beauty report @cherylanneny see don
934185173796769793	2017-11-24	[]	@thathagengrrl second part quest challeng find com work us cam amaz kid's vert
934184428410167296	2017-11-24	[]	faux fur leopard coat $83 discount leopard incred it'd sil show
934182684011778048	2017-11-24	[]	ok comfort definit want go @camper @ghbass clark person lov
934182074621276160	2017-11-24	[]	sleep @ghbass brand's fact outlet lot real good deal today lik loaf $40
934179950025957376	2017-11-24	[]	@hestragloves cc @kbudelis
934179471929856000	2017-11-24	[]	want forev pair definit @hestragloves littl $100 they'll last cool fabr vs leath uniqlo's heattech cashm glov
934173679507984387	2017-11-24	[]	zar black friday sal 30% entir sit stuff wor buy
934170816056578049	2017-11-24	[]	we'r stil stil qs
934169322330775553	2017-11-24	['#primeday', '#blackfriday', '#cheddarl']	hug retail @amazon cre holiday riv @eliza_pb explain
934159860375212032	2017-11-24	[]	lot sift @garmentory sal also real good gre loq boot $100
934153695465496577	2017-11-24	['#cybermonday']	remind sal wor wait
934151990560600064	2017-11-24	[]	@jillkd oh certain
934140822743904256	2017-11-24	[]	oh ye definit good on plu gre mess ad overal vib
934139313092288512	2017-11-24	[]	oh @freshbeauty's sug lip real fant chapstick sint col wild pig
934138329544691712	2017-11-24	[]	brainstorm quest hop could com someth glossy obvy say market edit honest that's prob best bet bar real col pack 10 year old would apprecy
934137159862415361	2017-11-24	[]	@carigervin @tiffanyyannetta also stil pajam beat lov let going sit sometim next week today they're 20%
934134570957660161	2017-11-24	[]	also forget @asos carry beauty produc produc also sal today
934130718774620160	2017-11-24	[]	hey ck's off extr 40% sitewid th weekend plu fre ship cod nee get discount exclud lik underwear 205w39nyc collect
934130609118760961	2017-11-24	[]	yay we'r happy
934125269782233088	2017-11-24	[]	got gre opt buy @birchbox sav 10% spend $30 15% $50 25% $75 buy direct @kiehls pick delux sampl ord $45 get fre travel bag $85 could also giv gift keep
934121264729509888	2017-11-24	[]	want splurge leath jacket sal @thearrivalsnyc real good cheap good
934120058044985345	2017-11-24	[]	hi look lik @sephora best bet today; pretty much every vert lun mark least 20%
934119929971798017	2017-11-24	[]	here's list black friday cyb monday sal don port sal char
934118182931058689	2017-11-24	[]	hey shannon cur obsess @topshop's karp loaf tot gucc doppelgang way less $$$ comfy
934118165881090048	2017-11-24	[]	favorit track pant 20% weekend rest @outdoorvoices sit
934117195503800322	2017-11-24	[]	gorg dainty black diamond necklac @catbirdnyc half today $276 $138 tempt
934115939649540098	2017-11-24	[]	we'v heard gre thing on @baliintimates also @chantelleparis off 50% today
934113231492276225	2017-11-24	[]	lov @jcrew's stad clo chateau park $219 today tot wor pref puff @aritzia's nev disappoint
934112205582331904	2017-11-24	['#askrack']	hey @elanafishman shop team tweet burn black friday quest us try get gre deal
934111534070009856	2017-11-24	[]	pricey pretty good waffl shirt @americangiant reason teen stor good on try @brandyusa @aerie
934108353285980165	2017-11-24	[]	go check @aritzia everyth 50% put many coat less $300
934106514679320581	2017-11-24	[]	@charstoneloves @hm ev dress modest espec @themodist's bf sal awesom 50% cod blackfriday50 carry many gre brand
934105585334784001	2017-11-24	[]	on gabriel union's favorit beauty produc sal today sery bet celeb endors skinc could poss nee
934104923989528576	2017-11-24	[]	got try faux on @topshop @aveclesfilles vert
934101849409576961	2017-11-24	[]	ok here's candl sal scoop boy smel 25% us pinkpromo @contextskin 30% friday30 nord good 20% blackfriday
934098836427075586	2017-11-24	[]	@charstoneloves honest @hm's sal real real good 70% plu 20% cod 1662 mak swe $9
934097746671349760	2017-11-24	[]	we'd act suggest wait sunday check uniqlo that's they'll mark ultr warm coat
934095608268443648	2017-11-24	[]	sho forget scop @charstoneloves sal 40% entir sit many fun pair
934091707519467520	2017-11-24	[]	ohhhh definit cloud paint quad though ask @loltanisha said lik thing kind can't go wrong
934090016925667328	2017-11-24	[]	@carigervin @tiffanyyannetta @eberjey want fant hip brand lik @sleepyjonesing head @netaporter sal
934089760557191169	2017-11-24	[]	@carigervin @tiffanyyannetta ye @eberjey run 30% sitewid sal us cod joy lov gisel pjs
934088367364599808	2017-11-24	[]	@mariayagoda cloth check @oakandfort's bf sal honest @hm sup good rn
934087891248205826	2017-11-24	['#nordengood']	@mariayagoda us cod blackfriday 20%
934087408026636288	2017-11-24	[]	@mariayagoda also context us cod friday30
934086968220225536	2017-11-24	['#boysmel']	@mariayagoda lol quest day most lov candl def 25% cod pinkpromo
934084445031817217	2017-11-24	[]	@kbudelis @tiffanyyannetta @herschelsupply otherw start
934084204958187520	2017-11-24	[]	@kbudelis @tiffanyyannetta check @herschelsupply lad sal today women's rain jacket pretty cut
934080258210398210	2017-11-24	[]	act crack brand's deal enjoy fre express ship every ord best mov might on tier promo lik shopbop's
934080193832128512	2017-11-24	[]	@itsestafiesta unfortun check sist sit @curbed's list
934079825417003008	2017-11-24	[]	@llbean they're 20% outerwear sal
934078770067181569	2017-11-24	[]	pal @hillarydixler cur sequin shop favorit pick @eloquii sal
934078010864623617	2017-11-24	[]	@ohheycarina hik boot definit head em get real deal
934077853867618307	2017-11-24	[]	lot skinc deal mad list right
934077169617330176	2017-11-24	[]	@levi's forev everything's 40% bout siz limit
934075919756681216	2017-11-24	[]	@shopbop sal also real good market edit @loltanisha pul togeth list best stuff buy sal item 75%
934074378266009603	2017-11-24	[]	whol sit half plu extr 10% spend $100
934073293761544193	2017-11-24	[]	they're sneaky say limit tim we'd surpr cyb monday sal that's eq good poss bet though
934072913015267329	2017-11-24	[]	kind slight funky cool tak
934072023319564288	2017-11-24	[]	ye ord tim
934071922329112576	2017-11-24	[]	let's start faux fur sint fun leopard emerald low siz i'm sorry bc said sal remain good prob cheap find sal
934068319308611584	2017-11-24	[]	20% select item that's info annount anyth definit upd
934067577957113857	2017-11-24	[]	look lik two dec opt monday brand's sit 25% ord $50 neiman's off $50 $200 regul purchas today want real stock buy stuff neiman's
934065060154101760	2017-11-24	[]	@itsestafiesta we'r sist sit @curbed definit here's link black friday post
934064764132708354	2017-11-24	['#askrack']	hey racked's shop direct @tiffanyyannetta look anyth particul today tweet us we'll try find sal cours
934060838129930240	2017-11-24	[]	speak half here's @theoutnet's clear sect we'v tak liberty sort low high
934056917609086976	2017-11-24	[]	@ultabeauty @stowaway off 50% everyth cod 50bf17
934056079473954817	2017-11-24	[]	ok onto today's sal @ultabeauty off 50% bunch good stuff includ buxom lash mascar bar min found prim three ult palet
934053597200945152	2017-11-24	['#cybermonday']	first we'd remiss tel sal wor wait
934052204389990401	2017-11-24	['#blackfriday']	happy we'r going tweet today's best sal right thread follow along look shop
933900985000488961	2017-11-24	[]	fabl aesop's hand soap
933880098201141248	2017-11-24	['#askrack']	shop spec cloth beauty produc tomorrow nee help find perfect thing tweet us shop team help find
933879422742081536	2017-11-24	[]	ton sal hap black friday wor wait cyb monday
933855937953071104	2017-11-24	[]	bye march cloth
933836056759222273	2017-11-23	[]	fleec thank
933809634049064961	2017-11-23	[]	top draw fav weekend
933787738842677248	2017-11-23	[]	maj
933764838353813504	2017-11-23	[]	pierc gen peopl feel vuln espec pierc involv cloth com via @refinery29
933742190098108419	2017-11-23	[]	good look hard achiev irl
933722056142626816	2017-11-23	['#gentrifiedgreen']	rememb neim marcus' read hist soul food depart stor thanksg
933697897748627456	2017-11-23	[]	try knock entir holiday shop list tomorrow check favorit idea
933536332432809984	2017-11-23	[]	streaky orang tan day via @bof
933520981162905600	2017-11-23	[]	covet @urbandecay nak palet here's buy
933510159740968960	2017-11-23	['#blackfriday', '#askrack']	look someth spec nee help find tweet us quest shop team help find also this^^ tim facebook group com hang
933492040163381248	2017-11-23	[]	also id hid thanksg food baby
933475682377785344	2017-11-22	[]	expend red bottom bloody sho
933464357593329665	2017-11-22	[]	there's bet week buy ear want month
933463089760043009	2017-11-22	[]	com hang @racked @canalstreetmkt next week spend money stay fre man
933449762904436737	2017-11-22	[]	peopl impress nobody via @forbes
933439948975255552	2017-11-22	['#rack']	gift guid pick curb iphon addict ear introduc today's you beauty film get tel lik instagram irl
933433406162997253	2017-11-22	[]	mak black friday gam plan
933417813305384960	2017-11-22	[]	loc j may long world
933411282967023619	2017-11-22	[]	nee new pair jean cheap got cov right
933410251440717824	2017-11-22	[]	200 employ los job fut remain 40 vint loom remain unknown via @bof
933397712564899841	2017-11-22	[]	sup sup stok host liv read @racked part collab can street market thursday decemb
933390896346947585	2017-11-22	[]	oh hey look @racked's black friday sal post we'v already don twelv
933380118025818113	2017-11-22	[]	nev enough right
933368484636979200	2017-11-22	[]	newslet help avoid black friday sign
933354639180910595	2017-11-22	[]	sneak sneak via @purewow
933349864909484038	2017-11-22	[]	pleas retail tot ruin pun
933342321525035009	2017-11-22	[]	think hat crowd black friday study say
933324944460705792	2017-11-22	[]	ev wait 'til friday on
933174700099776512	2017-11-22	[]	brand tak stand cancel black friday promot stil cyb monday sal plan real mak diff
933168823582179329	2017-11-22	['#rack']	gift guid pick handmad ceram candl look smel gre keep giv soy wax burn us hold plant mug
933161362326458369	2017-11-22	[]	real reason season
933147776132591622	2017-11-22	[]	wel guy
933130658918084608	2017-11-22	[]	heck suppos decid wear
933117573599760384	2017-11-21	[]	star they're lik us also adult acn
933101217944715265	2017-11-21	[]	wann eth shop black friday deal check
933094672536399872	2017-11-21	['#blackfriday', '#askrack']	got shop quest try find spec item tweet us shop edit answ qs day long friday
933080831618199552	2017-11-21	[]	ain't nobody got tim tangl via @refinery29
933080278339325953	2017-11-21	[]	@annahider hold
933055433136312320	2017-11-21	[]	wheth brand particip black friday stil particip black friday
933051651941912576	2017-11-21	[]	easy us
933030290209103872	2017-11-21	['#simonmil']	els going find @mansurgavriel sho @acnestudios coat bag sal
933028991853740033	2017-11-21	[]	wom sery real superhero via @purewow
933025227625451521	2017-11-21	[]	hard tim splurging activewear holiday weekend best tim giv
933017683746066433	2017-11-21	[]	stay warm look good cheap
933006132418772992	2017-11-21	[]	@quillemons us glitterboy mov help ban stigm around men makeup
933002581118464000	2017-11-21	[]	work black friday every singl year six year
932995026602381312	2017-11-21	[]	buy sens stuff lik sock swe could go sparkl
932987475806564353	2017-11-21	['#ladybird']	prep rol saoirs ron watch clueless sabrin teen witch
932979926927585281	2017-11-21	[]	wear auth photo follow year
932962301921067008	2017-11-21	[]	know nee new pair boot
932812562588229632	2017-11-21	[]	solang could sel us high whit underwear
932797212639326208	2017-11-21	['#ama']	cas miss 'em
932784881817436160	2017-11-21	[]	louboutin back card way
932776324829036544	2017-11-21	[]	issu black wom fac dai not stop shit via @polygon
932766761941897217	2017-11-21	[]	sport correspond uniform way bring peopl togeth
932752668442816512	2017-11-20	[]	week's good tim underwear refresh
932746261094195200	2017-11-20	['#rack']	gift guid pick day what's cut pair littl kids' sneak minit vert on buy pink glit
932739331697102855	2017-11-20	[]	stat bag feel guil
932720459791196160	2017-11-20	[]	could skip black friday chao shop @hm
932703095297069056	2017-11-20	[]	email act excit get everyday
932693039977566214	2017-11-20	[]	calvin klein new ad say cre strategy
932677943272312833	2017-11-20	[]	noth lik buy someth act nee sup sal
932676668644306944	2017-11-20	[]	25% begin @urbandecay black friday sal
932670392120078336	2017-11-20	[]	thank @iamcardib search @louboutinworld heel 217%
932655288536182784	2017-11-20	[]	bet tim stock black friday week
932655000320462849	2017-11-20	[]	wrot footbal jersey afr nat @racked
932642487784624130	2017-11-20	[]	perform art us '90s aerob mov empow everyon 'diva domin moment'
932640187783499778	2017-11-20	[]	lik fash secret
932632641249140736	2017-11-20	[]	includ $15 swe
932621051254714375	2017-11-20	[]	act spend ton money
932617544925577217	2017-11-20	[]	socc jersey sport afr country disput bord
932601171344347137	2017-11-20	[]	coff fan
932460817869615104	2017-11-20	['#ama']	annnnd wrap thank hang us get
932460376872161280	2017-11-20	['#ama']	thrilled @dianaross reunit fanny pack lost @marshalls
932457629586284545	2017-11-20	['#ama', '#msrossxamas']	simply get bet dian ross
932449690402115584	2017-11-20	['#ama']	lik @traceeellisross aly sent anoth dimend forc us step styl gam
932447824469463040	2017-11-20	['#ama']	gre hat @niallofficial
932435897940930561	2017-11-20	[]	@ashes2lashes @patmcgrathreal
932435861425311746	2017-11-20	[]	hi kelly's makeup art pat mcgrath lab mat trant lipstick mcmenamy top touch balm cc
932431385339588609	2017-11-20	['#ama']	friend admit nev seen bodyguard
932415140061941760	2017-11-20	['#ama', '#thosevocalsthough']	sery though anyon suppos follow @kelly_clarkson @pink
932414739887554560	2017-11-20	['#ama', '#gagaxama']	lik tot import design
932411186691293186	2017-11-20	['#ama']	prad @yarashahidi she freakin perfect
932410214120329216	2017-11-20	['#riverd', '#ama']	giv kid damn award
932408168113610753	2017-11-20	['#ama']	
932404296192315393	2017-11-20	['#ama']	nobody wear pink lik @pink
932404135441326080	2017-11-20	['#ama', '#leg']	@bts_bighit sel everyth skinc toothpast
932402598719651840	2017-11-20	['#ama']	lov @ddlovato brought danic roem dat
932399332753592320	2017-11-20	['#ama']	stranger thing kid best i'm wear philip lim piec art
932399192085024774	2017-11-20	['#strangerthings', '#ama']	print print lead lad @gatenm123 @calebrmclaughl
932397584622194688	2017-11-19	['#ama']	lov @thegreatkhalid's @offwht belt smil definit best access
932395099421659142	2017-11-19	['#ama']	world folk dress plain black whit guy show silv freakin' bomb jacket @bts_twt
932392306287742977	2017-11-19	['#ama']	see @selenagomez's new blond hair immedy book salon appoint
932391781420986369	2017-11-19	['#ama']	damn @niallofficial on sharp dress man
932390729791557633	2017-11-19	['#ama']	dear @kelly_clarkson we'r gonn nee nam lipstick
932389710449795073	2017-11-19	['#dianaross', '#ama']	know pres gre
932386691280752641	2017-11-19	['#ama']	@traceeellisross
932384683740057601	2017-11-19	['#ama']	hey rack entertain edit @elanafishman let slip someth littl comfort
932367381032263680	2017-11-19	[]	ev wond luxury brand trump vot shop via @bof
932342969851551744	2017-11-19	[]	lifesav
932332057904189440	2017-11-19	['#rack']	hgg pick sint everyon nee sock on gift may wel col fun ment soft comfort
932324602109313024	2017-11-19	[]	black friday week guy week
932296414805110784	2017-11-19	[]	get wallet ready via @bravotv
932286600645509120	2017-11-19	[]	six month fre stuff look lik
932274267739189248	2017-11-19	[]	tip definit help avoid fut fin cris
932253629729443840	2017-11-19	[]	meet new weekend comp
932086781415104512	2017-11-19	[]	food poor black us good
932074954518073350	2017-11-19	[]	sery
932051298052124672	2017-11-19	[]	heck hap threadless
932029653769887745	2017-11-18	[]	want stay away anyth ov bulky cartoon
932022799803314176	2017-11-18	[]	@makebeauty_'s silky lipstick com bunch gorg shad sup moist perfect wint
932007508469624833	2017-11-18	[]	ready set shop
931985112358641665	2017-11-18	[]	certain styl every wom ars via @whowhatwear
931964978390847489	2017-11-18	[]	alway answ problem
931941071675842560	2017-11-18	[]	welcom
931932516344385537	2017-11-18	[]	seny edit @manymanywords assocy produc @rebexxxxa cert funny hum talk folk @unravelpodcast fash hist list
931916408832888832	2017-11-18	[]	along show person tast handb suggest econom prosp act soupcon child sec blanket via @bof
931894890803421185	2017-11-18	[]	new york pinup scen allow japanes immigr sug moon fal lov curv
931892754464038912	2017-11-18	[]	pup lov much
931727915221438469	2017-11-18	[]	cas mad week trip sephor yet
931715586664497154	2017-11-18	[]	warm cozy
931696962692194304	2017-11-18	[]	nev easy
931680605137289216	2017-11-18	[]	stop 'til get enough
931665197609168896	2017-11-17	[]	okay anyon id @elonmusk fantast jacket anyon @mayemusk perhap
931662234861867008	2017-11-17	[]	off trendset
931636078712446979	2017-11-17	[]	nev fox tight
931626145342283777	2017-11-17	[]	twit obsess @elonmusk fant jacket
931590585449926657	2017-11-17	['#tenyear']	@alyandaj whos new ep today agr low jean stay 2000s
931552359867715585	2017-11-17	[]	@totokaelo convert bank vault dress room cre ep pop nyc landmark
931545478184996864	2017-11-17	[]	abercromby roxy car
931537925069828097	2017-11-17	['#thegoodplac']	obsess tahan seem collect party dress us
931530374802542592	2017-11-17	[]	fre ship damn ap we'll pay nee
931522832957411335	2017-11-17	[]	search party nail young new york styl
931513000934043648	2017-11-17	[]	on week
931363263815675907	2017-11-17	[]	$10 mask might belov beauty produc internet
931349170593640448	2017-11-17	[]	real talk y'all
931332813944745984	2017-11-17	[]	eggpl involv
931318215820509185	2017-11-17	[]	jogwalk sound lik id form phys act com right plac
931311925799079936	2017-11-17	[]	pity purchas going sustain girl surv strength brand going allow us transform liv
931304377452761088	2017-11-16	[]	etsy's chang blur criter count handmad
931300940300238848	2017-11-16	['#projectrunway']	goal continu bridg gap mainstream modest ayan if
931287514182164480	2017-11-16	[]	ad bookmark tab risk
931285133151240192	2017-11-16	[]	fash brand fight sex traffick hir surv peopl risk via @rac
931273925165641728	2017-11-16	[]	bring best deal day every day
931266438085660673	2017-11-16	[]	@dressforsuccess learn @dressforsuccess
931266134086520832	2017-11-16	[]	yesterday sold remain swag project freeby tot $2 we'r don process @dressforsuccess
931256811755225088	2017-11-16	[]	expert off guess what's caus rip jersey via @sbnation
931245990614650880	2017-11-16	[]	thought don shop sephor week pul back
931243484446646272	2017-11-16	[]	hold brea get bikin back though
931229174479642625	2017-11-16	[]	today i'm get sup real @racked cost start busy
931213287345270784	2017-11-16	[]	brand giv money wom vuln hum traffick giv job hap next
931205737392590849	2017-11-16	[]	lit every singl guy struggles thing proport lik
931190641064923136	2017-11-16	[]	import straightforward privileg en car fash
931179817994776577	2017-11-16	[]	extrem brand
931177613007220738	2017-11-16	[]	stil cold la @amandamull's sil wint coat piec @racked wish on ultim
931167989956775936	2017-11-16	[]	real etsy shopown talk sit lik
931153129768411136	2017-11-16	[]	wear shirt wear pant pow mov
930999868549558272	2017-11-16	[]	good luck shop jewelry sect
930986530788667392	2017-11-16	[]	@aliciagao shop exclud tokyo
930970927319302146	2017-11-16	[]	good tim market @urbandecay palet
930963881186463744	2017-11-16	[]	y'all know say big big sho
930955828315684866	2017-11-16	[]	psa today last day shop sal
930941483565318144	2017-11-15	[]	tim stock cold weath bas
930923365027721216	2017-11-15	[]	amazon
930914080700928000	2017-11-15	[]	here's look lik insid sal
930913870713155584	2017-11-15	[]	sel six month fre stuff look lik profit don char
930906252892344321	2017-11-15	[]	accord @axios startup acquir p&amp;g cas $100 mil
930898320087805952	2017-11-15	['#wcw']	gorg @thedanieb &amp; @universalstand launch awesomesauc three collect via
930893504015986688	2017-11-15	[]	solid low opt look
930880203450134529	2017-11-15	[]	clueless micell wat read gre prim @cherylanneny via @
930864265816395778	2017-11-15	[]	dreamy dj inspir truest self
930850901031620609	2017-11-15	[]	@urbandecay @milkmakeup @blackopalbeauty @sokoglam ton
930843348277088261	2017-11-15	[]	hat start 25 rel skirt worn met bal basebal uniform del own
930828256017833985	2017-11-15	[]	ev @jw_anderson collab piec left sal
930815346054967298	2017-11-15	[]	gift proud wrap littl sad giv away
930807480862629889	2017-11-15	[]	beauty brand might lot work bal
930790741252517888	2017-11-15	[]	first step keep org
930752257573957632	2017-11-15	[]	activewear giant team apl
930637480382095360	2017-11-15	[]	dark 5pm know cozy season
930625905277378560	2017-11-15	[]	mandy moore's old makeup 'this us' tak 3 hour put anoth hour tak
930613070728237056	2017-11-15	[]	bas cap dram af
930595458778574851	2017-11-15	[]	tim retir old adida gym bag us sint colleg
930581110559576064	2017-11-14	[]	imagin act new raz head oft suppos
930566009458532352	2017-11-14	[]	beany feldstein real struggle lov nail art terr
930551414346039296	2017-11-14	[]	tomorrow's last day shop sephora's vib sal here's suggest
930534051353710597	2017-11-14	[]	swe dress tho
930514936505294851	2017-11-14	[]	throw everyth knew shop
930480965780156416	2017-11-14	[]	sleek on know start pack 10 minut left
930477193678999553	2017-11-14	[]	everyth cut versatil
930468336592392192	2017-11-14	[]	wom us tarot card chakr read giv on tattoo
930465859805614080	2017-11-14	[]	legit sav lot money try coupl strategies
930458314370113539	2017-11-14	['#thisis']	cher wig fun cher eyelash much @themandymoore
930450762962034689	2017-11-14	[]	fan @glossier new way shav
930443210140286977	2017-11-14	[]	com cap read ben mendelsohn damn ad
930428607280963584	2017-11-14	[]	hard deb merit real long swe elimin nee pant
930275351468675072	2017-11-14	[]	get rid pesky wint dry patch
930261252609335296	2017-11-14	[]	bikin brand rath unorthodox origin story
930244390626377728	2017-11-14	[]	includ origin pack swag receiv six month weigh pol bear
930230550371057664	2017-11-14	[]	com insid faucet
930214694731821058	2017-11-13	[]	hard tim fault beauty assist mak $30 year try pocket someth extr
930198589640286209	2017-11-13	[]	start list folk
930184496497881088	2017-11-13	[]	pajama embarrass wear front
930179826216046592	2017-11-13	[]	amaz @racked piec swag econom ak shit journ get sent
