id	created_at	hashtags	cleaned_text
1050815868316205056	2018-10-12	['#metheavenlybody']	show pot draw record crowd muse provid maj sourc incom mom fin uncertainty exact
1050800768872198144	2018-10-12	[]	long story short peopl fed west elm
1050785669683929088	2018-10-12	[]	stil nee get plac ag besid point @cherylanneny writ
1050769871640899585	2018-10-12	[]	kany lov mag hat repres masculin energy feel miss lif fail acknowledg real symbol whit rag rac viol
1050501131061919744	2018-10-11	[]	work complain rec wag hik would act hurt amazon annount rais pay
1050476131751612416	2018-10-11	[]	cvs receipt cough drop height smal child
1050462286870192130	2018-10-11	[]	lat 1980s ear 90s press increas link sneak streetwear you viol target black teen spec pav way dress cod uniform policy see today
1050386241357795328	2018-10-11	[]	beauty ceo bizar behavy spark leg act est laud min stakehold deciem
1050196788081295361	2018-10-11	[]	writ many essay biggest crit church provid antidot capit could auth @megogieblyn
1050181686992883715	2018-10-11	[]	am lov quick heal fix pil form
1050166588496842752	2018-10-10	[]	modern witch cre rit fost solid act heal post kavanaugh
1050151490726359043	2018-10-10	[]	brandon truax embrac interest incred afford skin car lov messy dram
1050143636296531969	2018-10-10	[]	we'v wond cvs receipt long @rtsugar investig cvs receipt pict feet 1
1050136390061576192	2018-10-10	[]	cr de la mer cr de la get sued blog fals advert
1050121290038697985	2018-10-10	[]	millen priorit own hom get marry kid accord new study
1050118058499551234	2018-10-10	[]	nat disast affect grocery shop habit
1050107807633219585	2018-10-10	[]	arizon wom found not bottom new bought purs walmart inm chin yingsh prison work 14 hour day allow rest noon read wrot way find travel chin
1050097887571521536	2018-10-10	[]	would lik buy hous someday neg money i'm alon
1050070503925448707	2018-10-10	[]	psycholog pre grocery stor run walmart stock strawberry pop hur
1050070053541109760	2018-10-10	['#beauty']	wrot la mer expend hyp moist sued mak fals claim
1049819336481927169	2018-10-10	[]	book whiskey teacup rees witherspoon detail rich whit lif southern act liv
1049804225985859584	2018-10-09	[]	tast
1049789112939663360	2018-10-09	[]	med tour ris phenomenon spark sol unins many ins am cross bord heal car
1049778828325908482	2018-10-09	[]	jenn lyon reinv j left she'll try hand mak cont
1049774051219177477	2018-10-09	[]	lacroix address new class lawsuit alleg brand claim nat contain numb art ingredy
1049758946767134724	2018-10-09	[]	on real know much ub driv mak fact lead get tip
1049744073433776128	2018-10-09	[]	good night's sleep luxury
1049408211554656257	2018-10-08	[]	perhap bet quest peopl enough money buy facebook gadget wheth act want
1049318105825124352	2018-10-08	[]	princess eugenie's wed week might big new story megh markle's could stil set trend
1048766109460127744	2018-10-07	[]	pith helmet end longstand symbol europ colon rul afric
1047992262519664640	2018-10-04	[]	youtub might sound lik they're quit mlms act might try get join anoth on
1047978315993235456	2018-10-04	[]	wom angry new direct belov fash brand
1047977831777624067	2018-10-04	[]	prim new bling ring that's rob hom celeb lik rihann yasiel puig christina mil
1047977162748309504	2018-10-04	[]	cranberry suppl help fight ut cranberry industry stil want think
1047953157215666178	2018-10-04	[]	wom sneakerhead brand lik nik pay at
1047924319240646657	2018-10-04	[]	last year toy us fil bankruptcy look lik company might dead
1047916764359585792	2018-10-04	[]	there's muse ded disgust food talk cur
1047911982064656384	2018-10-04	[]	icon hoot girl look embody conceiv long plac modern marketplac
1047906129668460546	2018-10-04	[]	import quest exact pamplemouss lacroix
1047846761799270401	2018-10-04	[]	strange hist whit hous gift shop noth act whit hous
1047603004491358209	2018-10-03	[]	kany west's outburt hurt brand prob
1047521192188497920	2018-10-03	[]	kidz bop cens pop song mak kid study show help
1047509574293606401	2018-10-03	[]	socy claim valu 'natural' com wom look dig littl deep tha
1047494462019129344	2018-10-03	[]	cas heard expery new shop burrow new direct consum couch brand op st
1047493031220404224	2018-10-03	[]	new stor burrow want noth sit back relax oh mayb buy on couch fut
1047456381023006720	2018-10-03	[]	cotton flound deep ug root americ
1047282594591756288	2018-10-03	[]	process mak fant broom
1047267503003639809	2018-10-02	[]	shar expert view cur stat gig econom might head
1047256104420474880	2018-10-02	[]	screen test bradley coop whip makeup wip drag lady gag fac forehead chin told complet op art
1047232556142395392	2018-10-02	[]	20 vagina promin display new york city app word mak peopl uncomfort
1046789586280562688	2018-10-01	[]	airbnb expand beyond tel stay tel
1046780875353075713	2018-10-01	[]	deb rev think transy spac understand on anoth
1045755212101767174	2018-09-28	[]	ev height mom nev escap thing buy
1045686511117717510	2018-09-28	[]	ide behind amazon's new stor sel produc 4 high rat mimick custom buy they're lov
1045444724620853248	2018-09-27	[]	ris retail fight dec pay predict schedules stabl country mil retail workforc
1045413519376752647	2018-09-27	[]	story frug rich peopl remind ultr lik everyon els also way just billionair weal show spend frivol
1045381810165874689	2018-09-27	[]	marth harbison 45 journ hobby bird cost per mon $60 gas pizz beer cost per year $2000 bird trip
1045368905705783296	2018-09-27	[]	sign sel pow beauty right
1045025080126910464	2018-09-26	[]	am larg understand transit work see nee priorit
1044945938182074368	2018-09-26	[]	favorit fash brand prob own mass conglom brand lik givenchy marc jacob fenty beauty nam
1044791168431677440	2018-09-26	[]	work earn fed minim wag $7 would work two 40 week afford distress dirty sneak
1044779843290910721	2018-09-26	[]	seem retro ad form boom right
1044749644666855424	2018-09-26	[]	much world's fash industry control two mass french conglom americ try catch
1044620911784206336	2018-09-25	[]	account feat ex wom gon addict new mom wom annoy husband going silv without ev giv second thought
1044543787756748801	2018-09-25	[]	company lik walmart lev strauss &amp; co lyft southwest airlin get enco am vot midterm elect
1044403865922273280	2018-09-25	[]	gend maintain ide men wom diff auth profess lis wad explain anyth undermin distinct real threat mal supery
1044348753442983936	2018-09-24	[]	@ww_us's new taglin wel work
1044327110612054016	2018-09-24	[]	brand lik glossy outdo voic keep try giv stick
1044289613689475074	2018-09-24	[]	brand lik oua glossy brandy melvil hero cosmet outdo voic milk makeup dripk includ stick pack
1044266712252731393	2018-09-24	[]	teen increas shop thrift stor thrifting cheap help stand crowd bet environ
1044246213007200256	2018-09-24	[]	men's makeup could thing 1 help break restrict gend norm 2 forc men fac someth wom know wel press liv unr beauty standard spend ev incom lipstick powd cream
1043670030305644545	2018-09-23	[]	ev bought sweatshirt pair sho hat celebr wor alon
1043531367231848448	2018-09-22	[]	millen increas turn ag oppos internet help plan vac
1043520867936784384	2018-09-22	[]	cult hist scumb hat @rebexxxxa cours
1043302105648259073	2018-09-22	[]	hat com sign much dud ev op
1043284489886224384	2018-09-21	[]	consum mov away industry giant johnson &amp; johnson instead focus nat brand lik honest company
1043262344262873088	2018-09-21	[]	condy war heat ent mayochup
1043251774491119616	2018-09-21	[]	reason bottl tylenol com seal
1043235169115680768	2018-09-21	[]	thank
1043223811968065536	2018-09-21	[]	pocket
1043151506168369155	2018-09-21	['#menswear']	ask god @sartoriallyinc @jiandeleon @sexualjumanji explain hist scumb hat
1043141396914290688	2018-09-21	[]	first feat @thegoods millen act us travel ag
1042974950397640704	2018-09-21	[]	thing lik banan slic eg sep jar op cruc peopl otherw limit temp perm impair
1042897043734192128	2018-09-20	[]	access dat big corp ultim
1042891494762328069	2018-09-20	[]	real nic tim mock friend @thegoods story absurd stuff buy bc lov celeb w
1042884857037111296	2018-09-20	[]	look cloth book drink we'll buy favorit celebr lik
1042880679611006976	2018-09-20	[]	vox's new sit @thegoods wrot expery cov luxury fash $100 stud loan debt
1042856482851708929	2018-09-20	[]	amazon scout let us brows produc im lik dislik summon ev produc
1042839559896268800	2018-09-20	[]	part larg push cruel food opt
1042819677058031616	2018-09-20	[]	watch movy big screen chang along way eat movy chang
1042798537841360897	2018-09-20	[]	intim detail refram lingery someth put simply delight oneself joy beauty gar
1042781624071417857	2018-09-20	[]	hey piec work produc lazy peopl dis @thegoods thank @ladypoete
1042582866821959680	2018-09-20	[]	heinz's mayochup exact sound lik set hit shelv fal
1042566005774606336	2018-09-20	[]	main lobst pound sed lobst wee boil effort cruel real
1042557705368424449	2018-09-19	[]	lord wor adida superst sneak mus video bought pair adida superst sneak
1042528256828690432	2018-09-19	[]	car adapt throughout hist saf comfort keep hum emot
1042483713421062149	2018-09-19	[]	bil cunningham's extraordin tal capt way describ hat
1042464211270492161	2018-09-19	[]	peopl us dat ap lik tind bumbl claim shel extr feat mak whol process suck less
1042455584648310784	2018-09-19	[]	think cauliflow belong pizz
1042455420357435392	2018-09-19	[]	cauliflow everywh lif
1042446819454705664	2018-09-19	[]	first @thegoods video museum
1042442195704307713	2018-09-19	[]	poss singl load laundry could releas hundr thousand fib cloth wat supply
1042290691445993473	2018-09-19	[]	peopl us zero get person quit regim doct via onlin visit company ship $129 quit kit
1042231048388661249	2018-09-19	[]	yusaku maezaw elon musk send moon get act hap know know
1042140932232044544	2018-09-18	[]	on woman's strange expery report luxury fash $50 bank account
1042134278417526784	2018-09-18	[]	want good sign newslet
1042060814650200064	2018-09-18	[]	hey i'm work video chem peel skinc acid i'd lov know expery
1042053618210299904	2018-09-18	[]	know font we'r talk
1041894581506166784	2018-09-18	[]	tradit dress cod pun margin stud disproport new ant ant dress cod could fix
1041882252794191873	2018-09-18	['#emmy']	les jones' suit perfect bal fest sob
1041876409956925441	2018-09-18	[]	tiffany had emmy dress parachut nod herit
1041875732073308160	2018-09-18	[]	emmy red carpet known dar four look welcom exceiv
1041857335906447361	2018-09-18	[]	on exampl trendy skin car serv spreads salon around world fast heal lead reg
1041826130695806976	2018-09-17	[]	rais hand ev tak receiv selfy fac
1041794673306689536	2018-09-17	[]	brand destroy produc way maintain exclud scarc prec detail common publ
1041774037574328327	2018-09-17	[]	ide instead seat going empty airlin mak noth avail first spac pay less ful pric upgrad
1041765422175989762	2018-09-17	[]	imagin could see mass transform len shop hist
1041734778817437699	2018-09-17	[]	got diptyqu tast yank candl budget
1041726059908030464	2018-09-17	[]	brit luxury brand burberry brought $3 bil revenu last year destroy $36 mil wor merchand
1041658594352136192	2018-09-17	[]	welcom good vox new sect cov buy buy mat
1040707688710189064	2018-09-14	[]	today @racked last day thank read work year team part good vox cov consum cult follow work @voxdotcom account becom good vox soon
1040690519679164416	2018-09-14	[]	silicon valley styl say cli us algorithm get dress
1040621730686017536	2018-09-14	[]	fac say kind fun stil remind view tough sery dud
1040361477776007168	2018-09-13	[]	lik com gay told onlin shop hist
1040322536955957250	2018-09-13	[]	ic cream delivery luxury bed engrav mimos spoon big money mad everyon stay
1040283166156701698	2018-09-13	[]	could ant ant dress cod help keep kid classroom
1039929427499642881	2018-09-12	[]	botox get facelift thank new dryb botox chain inject beauty websit
1039878829567889408	2018-09-12	[]	wag rov cash obsess pet without controversy
1039702563682172935	2018-09-12	[]	beauty industry try convint stop sel ant produc
1039634505961795584	2018-09-11	[]	institut lik crossfit soulcyc off stud chant los weight ton
1039592932381208578	2018-09-11	[]	pedialyt claim cur hangov pay influ becom popul morn pr
1039542125355040774	2018-09-11	[]	biggest problem turn produc lik fidget spin weight blanket tre symptom un
1038210378541486081	2018-09-07	[]	burberry latest brand stop sel fur
1038182206273990656	2018-09-07	[]	anoth thread today @turnbullsarah chat w @paraguarosada @johnsonthree trad negoty @nytim
1038115826031906816	2018-09-07	[]	lebron jam newest sho design wom wom via @sbnation
1037745947038703617	2018-09-06	[]	goop stil sel jad eg
1037729076381999111	2018-09-06	[]	hap @racked ask writ old model
1037702046273740801	2018-09-06	[]	company stuff sel wom want ent old wom want without aly young wom
1037324880453283842	2018-09-05	[]	bra girdl first spacesuit
1037064374157012994	2018-09-04	[]	unlik wok ad nik colin kaepernick campaign success act say someth
1036977224208080896	2018-09-04	[]	photograph big ev flash peren favorit brand publ
1035549030993092609	2018-08-31	[]	intens competit influ oft lead inappropry thing ord stand rememb hundr thousand follow sometim mil influ interchang
1035528490576211968	2018-08-31	[]	virt instagram mascot ike brazil heart
1035517310688284673	2018-08-31	[]	rep new brand nam sound lik gen neur network
1035186222128422912	2018-08-30	[]	clear @sensanders touch nerv com amazon us sil company act reply
1035150345301839880	2018-08-30	[]	real much plu vint
1034872883288387584	2018-08-29	[]	dyson new $500 gold hair dry explain
1034803833724121089	2018-08-29	[]	tim interest wan [preppy shoes] entir aspir vis wealthy northeastern whit cond
1034454343171358721	2018-08-28	['#am2dm']	@zoeschiffer explain effect instagram soc med gre outdo
1034453613328908299	2018-08-28	[]	morn @zoeschiffer @am2dm talk @racked story effect outdo influ
1034425994256543744	2018-08-28	[]	murd get etsy tre tru crim fan
1034103849324355586	2018-08-27	[]	boy i've lov before's costum ful '90s inspir stell outerwear thing worn pet kavinsky
1034096961861898242	2018-08-27	[]	first day school plenty stud across country tak look bunch students' teachers' first day outfit last year
1034093197788622849	2018-08-27	[]	outdo soc med influ ris rec year bring at environ issu foot traff wild
1033103300210642945	2018-08-24	[]	tru coconut oil simpl lik fat high cal prob fin mod
1033074154742996993	2018-08-24	[]	&amp; sundry feat @racked thank shar story @bani_amor navig intens gend wor
1033005566032060416	2018-08-24	[]	heav body met's popul fash exhibit tim
1032990933393006594	2018-08-24	[]	okay get suppos dress lik cher clueless
1032705419972628480	2018-08-23	[]	wrot hairc gend id @racked rel on hand hyp barbersh
1032658768356696064	2018-08-23	[]	hair part body way body mov ex publ spac becom polit restrict opt
1032354037902045184	2018-08-22	[]	michael coh mak $30 sel handb
1032313047942144010	2018-08-22	['#dol', '#dollyparton']	wrot souvenir dollywood @racked real fun god lov dol
1032296394860765184	2018-08-22	[]	dollywood amus park world them around wom mak rad ev dol parton cheery trademark butterf may seem rad
1031954195895730177	2018-08-21	[]	describ hair remind fulfil @rebexxxxa request pet kavinsky br
1031909368156053504	2018-08-21	[]	revisit upd on favorit essay @lkoturner famy get keep lost wed dress
1031644429063520256	2018-08-20	[]	coraline's stop costum design mak tiny cloth big screen h @racked
1031600730300444672	2018-08-20	[]	learn much stop costum design mak tiny cloth big screen
1031571578448949249	2018-08-20	[]	deborah cook stop costum design mak miny cloth
1030458179669434368	2018-08-17	[]	giv mak cheap els forget
1030076881968750592	2018-08-16	[]	coach tux brand want talk person problem
1029809594258911233	2018-08-15	[]	might surpr see marches crazy rich as here's mak perfect sens
1029764666095017986	2018-08-15	[]	believ melan us styl pun husband
1029453924485476352	2018-08-14	[]	fda approv digit bir control ap
1029397286651158528	2018-08-14	[]	latest furnit trend midcentury meowdern
1029122663212568576	2018-08-13	[]	suprem becam
1029081918938259457	2018-08-13	[]	brok season op insec lik many am iss econom insec moonlight lyft
1029067571578982401	2018-08-13	[]	ask iss rae biggest splurge sint star insec mild spoil first episod new season
1028040810367987712	2018-08-10	[]	kim jong un wor straw hat chil new propagand photo want know
1027946719538016256	2018-08-10	[]	tim year here's big thing wrot last fal sor recruit weird th
1027902770098126853	2018-08-10	[]	mattress firm slept innov wak casp op 200 stor
1027645004477603842	2018-08-09	[]	video pol alleg left bait truck fil nik sho black chicago neighb
1027644898705657856	2018-08-09	[]	teach turn crowdfund sit pay book supply field trip
1027590338834251777	2018-08-09	[]	makeup brand @winkylux lean hard instagram retail conceiv
1027540012328525824	2018-08-09	[]	meet melan trump dog fash chronicler breitbart
1027263185835974656	2018-08-08	[]	startup lik smiledirectclub candid co fight too nail orthodont est
1026548474647474177	2018-08-06	[]	might middl brick gympocalyps
1026505693413683201	2018-08-06	[]	remark harsh anyon whos car depend excit look kardash wors
1026437857941049345	2018-08-06	[]	manosph whol lif determin phys attract
1025048757916893184	2018-08-02	[]	on outcom paul manafort tri many photo fant cloth
1024741564680167426	2018-08-01	[]	rihann real bring back skinny eyebrow
1024675415850401793	2018-08-01	[]	octav spent going play beauty mog madam cj walk new netflix sery execut produc lebron jam
1024671256833150977	2018-08-01	[]	nee photo id buy wel steak diet cok
1024641026315743234	2018-08-01	[]	would fenty effect without madam c walk
1024625881506045952	2018-08-01	[]	would pay $1 3d body scan
1024395261324533760	2018-07-31	[]	lov @racked today on sid effect see mamm mia go becom obsess capt young
1024333885142982658	2018-07-31	[]	guid recr young donn amaz 70s wardrob mamm mia go
1024039446994399234	2018-07-30	[]	powerless fac airport retail
1023979208098361345	2018-07-30	[]	prob see tiny sunglass everywh lat
1023889705736327168	2018-07-30	[]	would let cloth company giv rec bas spot list dat
1022896923236360193	2018-07-27	[]	talk busy partn @stormydaniels new fragr bunch peopl sniff
1022199816590376964	2018-07-25	[]	pleas stop say fem celebr 40 look gre ag
1022149594598305792	2018-07-25	[]	sick see scoot everywh go get ready elect skat
1021851276731211786	2018-07-24	[]	il op weekend stunt shop us new east vil target stor
1021820402849460231	2018-07-24	[]	ivank trump fash brand controvers subject sint fath took off shut
1021496431557918721	2018-07-23	[]	many peopl wond mean behind bil joel wear star david perform last year spok
1021447358729596930	2018-07-23	[]	watch first trail amb heard big red wig
1021364336252604416	2018-07-23	[]	fearless beauty teach wom rik island hairstyl cut col skin car ey toward beauty school scholarships releas
1020386625094848512	2018-07-20	[]	show lik chor lin chang choreograph costum chang story
1020352749920276481	2018-07-20	[]	spok three model involv miam swim week cast controversy say
1020005423506690049	2018-07-19	[]	nik op new stor la ev get car shop
1020001592580374528	2018-07-19	[]	today ask man much pay haircut
1019997831141187585	2018-07-19	[]	beautyblend fam makeup spong company launch rang found already controvers
1019986484923904000	2018-07-19	[]	gymb cam back bankruptcy hip cloth par
1019942446078332928	2018-07-19	[]	aperol spritzes good market damn
1019693302197686273	2018-07-18	[]	despit cal boycot prim day amazon biggest shop day hist
1019654293840949248	2018-07-18	[]	ceo taskrabbit scrubbed someon dirty ov try understand work expery
1019552391644041216	2018-07-18	[]	brand cat young wom want wok femin friend
1019307325637742592	2018-07-17	[]	nic interview @nadranittle @racked tel act get good deal
1019284367707910145	2018-07-17	[]	real real brief hist croc heel
1019257950651801601	2018-07-17	[]	shop holiday lik prim day black friday might alway best deal
1019252105981452288	2018-07-17	[]	group black model say turn away miam swim week cast told black model nee
1019242838318616576	2018-07-17	[]	stranger thing teas mak nostalg clair drawst gap bag
1019205258470404101	2018-07-17	['#blackmodelsmat']	alleg rac bia miam swim week cast show
1019190002780078085	2018-07-17	[]	art intellig tel luxury good real fak
1018953808557281282	2018-07-16	[]	amazon prim day work europ striking lab condit
1018929521934917633	2018-07-16	[]	non retail off sal prim day
1018920562851287040	2018-07-16	[]	fin @eliza_pb unpack amazon turn prim day mass med mom
1018920366415253504	2018-07-16	[]	next @cherylanneny explain amazon com makeup bag
1018920132167553024	2018-07-16	[]	wait prim day start perhap lik read amazon first @chavielieber explain amazon com closet
1018900582130692096	2018-07-16	[]	best thing got dyson vacu awesom sav thing fir
1018133017435492352	2018-07-14	[]	bastil day longread
1017876320041066497	2018-07-13	[]	mean nud without cloth
1017861321528938496	2018-07-13	[]	let's tak look vog got modern
1017861274850463747	2018-07-13	[]	wom navy may let hair lit
1017851166590472193	2018-07-13	['#grabyourwallet']	boycot tak aim canad chain work
1017820966515339271	2018-07-13	[]	casp new nap stor innov caus concern plac lay head 45 minut
1017812160263618565	2018-07-13	[]	teen stil wear hol prov @eighthgrademov
1017770637920698368	2018-07-13	[]	goodwil mak bid young shop cur vint select stor
1017497428428238849	2018-07-12	[]	ear pierc sint celebr first birthday wom col fact mak complet unremark
1017491314898882560	2018-07-12	[]	fal merchand bleak
1017478530513457157	2018-07-12	[]	lady gaga's new beauty startup custom yet heavy invest via @recode
1017450842453049344	2018-07-12	[]	lov @erynloeb piec mean uncanny wed photo disembody gown hang ht
1017378099657347072	2018-07-12	[]	want pict wed dress without us
1017141837230985217	2018-07-11	[]	ye peopl keep coupl tattoo ev breakup ev justin bieb
1017126399189102593	2018-07-11	[]	world want know long act tak dissolv lip fil lik kyly jen
1017121627883147265	2018-07-11	[]	lat stag napit work sorry i'm sorry i'm try remov
1017107524108111874	2018-07-11	[]	also sint forb kyly cov fem billionair today remind wrot form
1017104986935889920	2018-07-11	['#waistcoatwednesday']	england fac croat know gare southg wear sign look here's popul styl unlik
1017102479769686031	2018-07-11	[]	kyly long hist wom beauty entrepr
1017054209710141440	2018-07-11	[]	gonn go @am2dm talk ye maintain gift reg mat occas
1017048375659810816	2018-07-11	[]	amazon turn prim day mass med mom
1017030827853697026	2018-07-11	[]	would pay $25 45 minut nap
1017028688683003904	2018-07-11	['#am2dm']	@alanna morn convint set gift reg deserv get
1017015732444565504	2018-07-11	[]	england man gare southg get lot at sign vest
1016753936735330305	2018-07-10	[]	today @jcrew drop collect @universalstand goe siz 5x
1016751426972913670	2018-07-10	[]	grow controversy cast storm portray dark origin x com
1016728770965843969	2018-07-10	[]	mean plast straws glass look dumb hel met straws glass look put togeth feel littl luxury
1016697495173455874	2018-07-10	[]	food shirt new band shirt via @eater
1016694805299191808	2018-07-10	[]	reg reserv peopl get marry
1016653324412772353	2018-07-10	[]	on study found 37 perc plu wom wear men activewear find opt wom brand
1016373947301072897	2018-07-09	[]	pleas tak import pol megh markl dress act col nah
1016290884600717312	2018-07-09	[]	tot leg tot lucr
1015359761854947333	2018-07-06	[]	megh markl yellow brandon maxwel dress first fash hit duchess
1015318743071772674	2018-07-06	[]	trump trad war mean aly on group support busy macy jcpenney walmart oppos tariff
1015230831760216064	2018-07-06	[]	sorry both com today soon say nic ear
1015203798233632768	2018-07-06	[]	mak fash peopl dis peopl mak fash everybody peopl lik mind process
1014958190545514496	2018-07-05	[]	scot pruit quit gre tim revisit fant lot tacticool pant
1014949543497158658	2018-07-05	[]	superhero movy long body divers problem
1014841353354858496	2018-07-05	[]	mist rog us sho mak pow point segreg
1014524231160233988	2018-07-04	[]	law wear americ flag cloth comply might think
1014478950532251648	2018-07-04	[]	ear sorry both sal due movy ant mess uh comply
1014254266599575553	2018-07-03	[]	david beckham play england three world cup sel hair pomad
1014200783171215360	2018-07-03	[]	beauty dram reunit form co nicol kiln
1014169406757273601	2018-07-03	[]	mad fast fash oxymoron on japanes company prep launch us
1013859879776346113	2018-07-02	[]	la lak on rat tail
1013851241305305088	2018-07-02	[]	not skinc company start market produc ant problem produc ar
1013844814645821441	2018-07-02	[]	ant skin car act peopl nee lik afford
1013805685748969473	2018-07-02	[]	interest ongo controversy surround schools dress cod read @nadrakare
1013803245343518720	2018-07-02	[]	latest dress cod controversy stud wear rip jean duc tap expos skin
1012759342817402880	2018-06-29	[]	vir tweet @angrymantv four mistak unknow hint hist link dust mask
1012742563860709382	2018-06-29	[]	vir tweet unknow hint link bra dust mask
1012705961977376772	2018-06-29	[]	cap week bde discuss mayb lik read david beckham
1012682177069355008	2018-06-29	[]	h&amp;m $4 bil wor cloth try get rid
1012667014966579201	2018-06-29	[]	sometim jonath @jvn @queereye tak 50 60 fan selfy singl day
1012382633542782980	2018-06-28	['#poolpatrolpaul']	beauty mlm rod field cut tie sold produc com soc med press
1012329870314147841	2018-06-28	['#migr']	insight tim piec @racked cloth serv funct lifelin famy
1012304618703998982	2018-06-28	[]	beckham transcend sport build fash luxury empir
1012083155736715266	2018-06-27	[]	alexandr ocasio red lipstick symbol chang
1012082573093343232	2018-06-27	"[""#meghanmarkle's"", '#duchessofsussex']"	shar thought transform artic @vox ea
1012044150831812608	2018-06-27	[]	world cup real win niger jersey
