id	created_at	hashtags	cleaned_text
1093233144810127360	2019-02-06	['#thestew', '#thecooky']	wrot many recip going vir instagram lat
1093229917628784642	2019-02-06	[]	flickr start delet photo mass chunk internet hist
1093201072838111238	2019-02-06	[]	paner op pay stor last on clos
1093198658533801985	2019-02-06	[]	recip goe vir instagram
1093179834887557121	2019-02-06	[]	ris star instagram evangel church
1092987109164662784	2019-02-06	[]	democr wom wear whit stat un
1092893975701278727	2019-02-05	[]	ike soon off furnit rent end own near
1092771980913324032	2019-02-05	[]	websit nee access peopl dis
1092520278146629632	2019-02-04	[]	fals eyelash boom aid nor kore
1092503832750370816	2019-02-04	[]	billionair stor hundr mil doll wor art superyacht
1092501414708948993	2019-02-04	[]	adam levin sup bowl shirt look lik furnit
1092401921808388098	2019-02-04	[]	declin fash week explain
1092295017824169984	2019-02-04	[]	sup bowl commerc real bad year huh
1092295016322609152	2019-02-04	[]	year sup bowl commerc show us tech gre
1092295014397427712	2019-02-04	[]	asmr mak sup bowl debut zoe kravitz michelob ultr commerc
1092264764699492354	2019-02-04	[]	aud sup bowl ad could weirdest night
1092264763202195456	2019-02-04	[]	year sup bowl ad domin nostalg
1092264761381789698	2019-02-04	[]	gam thrones took bud light sup bowl commerc
1091451796273418240	2019-02-01	[]	bibl diet fit plan catch
1091451790414016513	2019-02-01	[]	ub pric nyc go driv get wag hik
1091338539755859968	2019-02-01	[]	not design trend see everywh explain
1091336311989043203	2019-02-01	[]	best money ev spent
1091308275113619456	2019-02-01	[]	black market instagram account
1091081766729850881	2019-01-31	[]	rog ston wor underst suit court mad video
1091078256420364289	2019-01-31	[]	went @kcrw la yesterday talk zero mov list
1091040214229962752	2019-01-31	[]	everybody wear plaid scotland
1091037776341057541	2019-01-31	[]	lot fun track hist met chair liv every resta bar old hil
1091028777474379777	2019-01-31	[]	bit ic cream swip mascar makeup brand op pop caf
1091026647040577537	2019-01-31	[]	brand ref sup bowl big gam
1090990081853321216	2019-01-31	[]	met chair every resta
1090943544846618624	2019-01-31	[]	onlin shop company fig quit on plast bag
1090717030641254414	2019-01-30	[]	canad goos jacket becom stat symbol prim target robbery
1090698111624855552	2019-01-30	[]	sup bowl 2019 new england patriot vs los angel ram commerc halftim show biggest mom
1090674308307914752	2019-01-30	[]	marian williamson oprah spirit adv also run presid
1090665268286836742	2019-01-30	[]	facebook pay teen $20 mon access person dat
1090634006062907393	2019-01-30	[]	wed reg outd tradit going anywh
1090382889320173572	2019-01-29	[]	new report show keyless car easy ste prevy thought
1090337583660445698	2019-01-29	[]	new research say secondhand lego surpr valu
1090288554805202944	2019-01-29	[]	appl facetim eavesdrop bug turn
1090255939654037505	2019-01-29	[]	best $2 ev spent nyc ferry rid
1090030650210566145	2019-01-28	[]	amazon fac analys tech oft mistak dark wom men study show
1090020611685052419	2019-01-28	[]	car aoc skin car routin car respond crit
1089971408652955648	2019-01-28	[]	reject sup bowl ad highlight americ comply rel marijuan
1089864560503341057	2019-01-28	[]	zero mov com garb
1088937941001535489	2019-01-25	[]	whit castl becom valentin day din destin
1088890271411159041	2019-01-25	[]	mak sup bowl ad success ad exec explain
1088885101465866241	2019-01-25	[]	amazon ask company cre new prim brand
1088857320010977280	2019-01-25	[]	facebook know let kid rack hug gam bil par credit card
1088827249992876032	2019-01-25	[]	govern shutdown off caus flight delay
1088771811259617280	2019-01-25	[]	chang behavy 30 day
1088563045029371904	2019-01-24	[]	big brand lik h tid test reus pack
1088529058739249153	2019-01-24	[]	sup bowl sunday stad chick clos
1088499980921376768	2019-01-24	[]	buy sweetheart candy convers heart valentin day
1088499976735547392	2019-01-24	[]	girl scout cooky capt heart americ
1088204755271409664	2019-01-23	[]	@thegoods talk fed work miss second paycheck govern sh
1088195684640145409	2019-01-23	[]	want mak shutdown fed work turn gig econom
1088168523946491905	2019-01-23	[]	keep see design trend lik say paint hom dec font that's seem every new book reply tweet tel us &amp; mayb we'll littl investig not sery check latest column
1088115212677537792	2019-01-23	[]	appl predict us iphon flashlight world end
1088069697944334336	2019-01-23	[]	paint dec anoth aesthet effect gre recess
1087846969366769664	2019-01-22	[]	robot cartoon ey
1087824278928658434	2019-01-22	[]	covington cathol stud mag hat teen trend
1087797947872538624	2019-01-22	[]	long leonardo da vinc paint got drag trump conspir the
1087754507541463041	2019-01-22	[]	migr bril @hilarygp @racked story @voxdotcom today obvy reason teen boy mag hat
1087746236529156096	2019-01-22	[]	foc group stil much thing ev ag big dat @josephstromberg went bunch explain htt
1087706083307720704	2019-01-22	[]	foc group shap buy much real say us
1087417821708107776	2019-01-21	[]	brandon truax controvers found skinc company deciem died
1087416675404701696	2019-01-21	[]	deciem's brandon truax pass away execut confirm @cherylanneny
1087319468064362496	2019-01-21	['#sponcon']	bachel contest every outfit opportun
1086411944351936513	2019-01-18	[]	rihann becam on influ peopl fash
1086363056215601152	2019-01-18	[]	wom travel alon men
1086352931702669312	2019-01-18	[]	arian grand 7 ring vic thrill spend money nev
1086313933235998720	2019-01-18	[]	am learn lov ug fruit veget
1086308924536643586	2019-01-18	[]	scam everywh lov
1086000577090338817	2019-01-17	[]	horr celebr biograph kindl imposs explain
1085977850849701889	2019-01-17	[]	74 perc am know almost noth facebook ad target
1085977842125623296	2019-01-17	[]	cbd sup cannab compound explain
1085974085136457728	2019-01-17	[]	govern work stil sal due shutdown am busy help
1085970429989343232	2019-01-17	[]	tsa ag prom $500 bon work unpaid week receiv
1085955391316545537	2019-01-17	[]	10 kor skin car routin chang am skin car
1085954982585733121	2019-01-17	[]	hello @thegoods design column not back @kait_tiffany explain nant drew font '30s
1085909980702797824	2019-01-17	[]	healthy snack act good
1085887347374333953	2019-01-17	[]	font know old pulp novel new book
1085660835358302210	2019-01-16	[]	see 10 challeng everywh
1085660832946520070	2019-01-16	[]	moschino accus us cod word seren ref black shop
1085630593545760768	2019-01-16	[]	guid air travel govern shutdown
1085617920267468800	2019-01-16	[]	ful q&amp;a @glossier ceo emy weiss art sci beauty busy
1085616879622860800	2019-01-16	[]	sear form ceo prev liquid larg respons company bankruptcy
1085610756027109376	2019-01-16	[]	instal pay startup lik afterpay may help pay new cloth want could also lead
1085591563370139649	2019-01-16	[]	liv yosemit nat park hap sint shutdown
1085506028899389440	2019-01-16	[]	ide success peopl teach secret new masterclass sel $180
1085280838953123840	2019-01-15	[]	tre regul peopl lik influ key glossy success
1085268307442323457	2019-01-15	[]	gillet tox masculin ad annoy sex femin
1085260686282899460	2019-01-15	[]	govern shutdown disrupt peopl wed plan
1085237992606846978	2019-01-15	[]	controversy around trump fast food footbal feast explain
1085218462144831489	2019-01-15	[]	gillet us rul raz cam startup
1085149770858070016	2019-01-15	[]	best $104 ev spent ros gold trash
1084954643959083009	2019-01-14	[]	almost actress play cleopatr whit
1084948593524568064	2019-01-14	[]	outdo brand speak nat park govern shutdown good busy mov
1084916975548223488	2019-01-14	[]	starbuck begin instal needl dispos box bathroom
1084807397930094592	2019-01-14	[]	buy new purs startup want help pay could also get debt
1083850426175369217	2019-01-11	[]	transport expert see ub lyft fut rur commun stil us
1083808944722771969	2019-01-11	[]	spot person playl sal brand
1083795006584967169	2019-01-11	[]	marriot dat breach may biggest hist fac multipl class lawsuit
1083748561081323520	2019-01-11	[]	ev cloth mad plast wash pollut oc
1083720772697444352	2019-01-11	[]	retro piec exerc equip par giv
1083720768457007105	2019-01-11	[]	proact becam go meg endors deal celebr
1083720763910303744	2019-01-11	[]	flywheel soulcyc id cris
1083495596202303490	2019-01-10	[]	joshu tre nat park trash shutdown visit cut tre
1083486793889132550	2019-01-10	[]	trail littl show hollywood continu embrac nat hair
1083431434621280266	2019-01-10	[]	fed fund school lunch trump dairy salt
1083422504889270272	2019-01-10	[]	many fin independ adult stil par phon plan
1083143187374505985	2019-01-09	[]	gym convint new memb stay past janu
1083139400291287041	2019-01-09	[]	fed judg block new york latest attempt crack airbnb
1083125675572240385	2019-01-09	[]	museum park clos govern shutdown vac ruin
1083082775832551424	2019-01-09	[]	chees plat everywh right explain chees plat influ
1083056410622132224	2019-01-09	[]	jeff bezo wif mackenzy get divorc could affect amazon
1082785157369733121	2019-01-08	[]	smart baby bed stir controversy $1 pric tag par rent
1082736151885242368	2019-01-08	[]	four pin dram say twit company
1082407558290305024	2019-01-07	[]	gend fash elev men look gold glob
1082407555475873792	2019-01-07	[]	facebook took many cbd busy pag say mistak
1082400061928165377	2019-01-07	[]	build wal trump sacr airport sec govern shutdown
1082392534683447299	2019-01-07	[]	mastercard drop nam logo fut pay digit
1082377452452757504	2019-01-07	[]	bachel virgin abc shut big deal
1082345145394184192	2019-01-07	[]	fij wat girl would gre mem bottl wat someth celebr
1081349560255971328	2019-01-05	[]	popul youtub lik jak paul riceg promot shady gambl websit mil subscrib middl deb eth respons com leg young superf
1081331945542504448	2019-01-04	[]	star makeup art brand want maintain perceiv red carpet makeup look hap org
1081316844630360065	2019-01-04	[]	upd marriot hack affect estim mil guest passport numb also expos
1081301746457108480	2019-01-04	[]	company respons mak troph hundr award emmy mtv moon person gold glob
1081290534243594240	2019-01-04	[]	happy award season shock hard anyon beauty industry would go record talk get
1081290291989094400	2019-01-04	[]	$16 first class seat sold $675 er lik common think
1081289393967525889	2019-01-04	[]	carty lost trademark battl word lov
1081277244784500737	2019-01-04	[]	youtub star promot gambl kid answ peer
1081239363474866176	2019-01-04	[]	red carpet on big makeup ad
1080962009607344128	2019-01-03	[]	long food intery eat food peopl want know bathroom instagram
1080946910939176960	2019-01-03	[]	nat park across country fac sanit issu amid govern shutdown
1080931809754533888	2019-01-03	[]	bank happy foot bil fre flight din perk point credit card reward could head slowdown
1080921961872519168	2019-01-03	[]	tech company predict end rel us info sel stuff story expir
1080920096330010625	2019-01-03	[]	mayb upgrad phon fun cool anym
1080599620093276161	2019-01-02	[]	ap help stay top new year resolv substitut willpow
1080584521227980800	2019-01-02	[]	ford design soundproof kennel dog afraid firework
1080569422971056131	2019-01-02	[]	ide us sid esc stand saf believ everyon us esc stand could efficy
1080560258882228224	2019-01-02	[]	rel not difficult predict many vary play mak thing comply rel predict technolog already ex degr quest us
1080509024305664000	2019-01-02	[]	hemp leg mean cbd bound becom ev vis may becom import sci want study cbd effect
1080494773281144833	2019-01-02	[]	obsess fig develop bet habit @thegoods wrot world habit
1080237230990405632	2019-01-01	[]	biggest threat diamond might brid increas wil consid ston lik morganit
1080191932700200960	2019-01-01	[]	ev talk new pair sho seen instagram ad hour lat mean phon list
1080146634594410496	2019-01-01	[]	amazon rol delivery program amazon flex city work get benefit overtim compens ind job
1080118841655480320	2019-01-01	[]	commem end 2018 @thegoods team reflect best on purchas past 12 mo
1079859745131880448	2018-12-31	[]	decid unpack quest best brand med company consum play part const search best ev real satisfy
1079829547560914945	2018-12-31	[]	alex microwav $42 bundl stick fiv produc mad us say wait
1079814446187331584	2018-12-31	[]	tl;dr facebook fel j tank amazon took world
1079784252982599680	2018-12-31	[]	best 2018 list right ment yeast
1079763803808632834	2018-12-31	[]	last day year collect min essay @thegoods team best money spent 2018
1079391659048296448	2018-12-30	[]	am buy 6 bil card year many millen
1079029275041456129	2018-12-29	[]	2018 facebook fel j tank amazon took world
1078795229178802176	2018-12-28	[]	raf simon depart calvin klein repres const tend within fash industry want off fash merchand also sel larg custom bas
1078787681499340800	2018-12-28	[]	facebook almost definit list cel phon argu wors
1078780129604599813	2018-12-28	[]	stat crowdfund ev stud tackl grow problem stud lunch debt
1078765030001172481	2018-12-28	[]	am buy 6 bil card year many millen
1078757483378700289	2018-12-28	[]	$42 bundl stick $120 scrunchie stuff mad us good sit say wait
1078742383288901632	2018-12-28	[]	breakdown 2018's brand win los win dick sport good casp wework amazon los ivank trump brand facebook j burberry toy us
1078732816890896384	2018-12-28	[]	read @kait_tiffany peren deb wheth phon secret list spoil real
1078732411725336576	2018-12-28	[]	fash real loud hug party shift lit overnight shift gre recess econom complet influ decad design
1078108202288332800	2018-12-27	[]	amazon rol delivery program amazon flex city work get benefit overtim compens ind job
1078093102793908224	2018-12-27	[]	brand capit lack plan new year's ev
1078078653781737473	2018-12-27	[]	15 video on exhibit van lawsuit target cheap look van
1077942108818997249	2018-12-26	[]	democr may crumbl around us ban year delicy process food hap meat dairy
1077670317835911169	2018-12-25	[]	go trad joe without surround item lik turkey stuff potato chip
1077640118066802694	2018-12-25	[]	two kind santa profess santa guy red suit sant rick cours profess sant
1077609924283285505	2018-12-25	[]	weekend insid new york city christmas rent econom
1077579721486028800	2018-12-25	[]	secul way celebr christmas also tim shut christmas annount jew id saf environ rabb joshu el plaut auth kosh christmas
1077307932809674752	2018-12-24	[]	sometim search best becom less object commun find
1077277734437638144	2018-12-24	[]	ye light tre get intens
1077247530855997440	2018-12-24	[]	al doom miss find best
1076975741827346432	2018-12-23	[]	bantu knot cent workplac disput ross dress denv
1076960640537747456	2018-12-23	[]	2018 internet hand thing wor lot money
1076922891613089793	2018-12-23	[]	ev cooky tough 2018
1076915341937147904	2018-12-23	[]	ban plast straws sav oc anyway
1076904024996302849	2018-12-23	[]	fed court lawsuit fil friday mal model alleg photograph bruc web grop shoot abercromby &amp; fitch french vog oth
1076854946191106048	2018-12-23	[]	two fact determin sev win tee nat red win particul too enamel
1076522756085293057	2018-12-22	[]	big part reason indy bookst thriving way connect commun soc med mak easy ev
1076250965274177537	2018-12-21	[]	walk trad joe without see bag turkey stuff potato chip going anywh anytim soon
1076243415359254530	2018-12-21	[]	dress mad best list irrelev melan zar jacket mom cloth transcend act ev becam story 2018
1076235866346045440	2018-12-21	[]	secul way celebr christmas also tim shut christmas annount jew id saf environ rabb joshu el plaut auth kosh christmas
1076228315873038336	2018-12-21	[]	insid thriving threatened tumblr commun ded collect custom vint robot toy
1076216990711324672	2018-12-21	[]	blobby hom dec mak peopl feel feel
1076208101206970369	2018-12-21	[]	fre whatev michel obam told sarah jessic park ad real mess behind balenciag boot simply lik they're sel
1076144107746222080	2018-12-21	[]	i'm work story city impl new esc rul must us sid sta
1075865927277662210	2018-12-20	[]	insid mommy sci sketchy world breastfee suppl
1075858380231716864	2018-12-20	[]	amid stag new report facebook int shar unint leak priv inform us many feel urg quit platform altogeth easy sound
1075850828555083776	2018-12-20	[]	low dairy cam rul us chang
1075843283761299456	2018-12-20	[]	cov rachel mcadam high breast pump photo shoot fail ment real pump moth anyth glam
1075833687063871488	2018-12-20	[]	victim fak fre tri hard get scam
1075767786708688897	2018-12-20	[]	cult appropry deb chang bet
1075541294640881664	2018-12-20	[]	fan fred rog alway rememb trademark cardig penny marshal alway link sign curs lavern &amp; shirley
1075526193623920640	2018-12-19	[]	know best money ev spent spent
1075511091214585857	2018-12-19	[]	gist mem men gen presum liv apart empty ug dat ev car enough fix
1075503540745973770	2018-12-19	[]	gross sud okay cal fun
1075495992898793473	2018-12-19	[]	two fact determin sev win tee nat red win particul too enamel
1075478603566116864	2018-12-19	[]	instagram everyth good indy bookst
1075472464770158592	2018-12-19	[]	beyont bruno mar awkwafin nick minas many celeb accus cult appropry 2018 poc spok
1075471096344915969	2018-12-19	[]	penny marshal fan forev assocy monogram cloth wor lavern &amp; shirley
1075454580920643587	2018-12-19	[]	latest wav mem tak guy task terr apart
1075402225663516672	2018-12-19	[]	@thegoods @voxdotcom wrot instagram independ bookst
1075375201313935361	2018-12-19	[]	mad popul lex market campaign bow car seem lik someth would ex commerc ent giant car bow busy
1075194001601511424	2018-12-19	[]	amazon ask brand redesign produc pack that's easy ship ev look lik box win
1075178906808868865	2018-12-19	[]	execut beauty pr company said scold cov perceiv neg beauty nic year @cherylanneny
1075163801983569920	2018-12-18	[]	disney start crack meg flip limit merch ebay etsy
1075133606694084608	2018-12-18	[]	spirit may hat airlin americ success least on met carry country
1075124163029942272	2018-12-18	[]	what's going steph miller's hair
1075119189935964162	2018-12-18	[]	@thegoods found ginorm holiday car bow thing peopl act buy
1075073204740415493	2018-12-18	[]	today gree exploit continu mark busy mor bankrupt fail speak ag many refus tol sil
1074756119774486528	2018-12-17	[]	@rebexxxxa spent week sleep casp mattress brush tee quip toothbrush cook hello fresh meal kit wond
1074741017562075138	2018-12-17	[]	venezuel mak sens ep paid prank
1074733466976174080	2018-12-17	[]	certain brand wad polit sphere first tim find result alway predict
1074727681806266371	2018-12-17	[]	new report reut suggest smal amount asbesto lurk johnson &amp; johnson talc subst mak baby powd powdery going back 1970s
1074727157946048512	2018-12-17	[]	2018 year brand got polit kind
1074423927034732545	2018-12-16	[]	friend remind loc track const peopl sel
1074363528520314886	2018-12-16	[]	$3 bil shav industry disrupt sil
1074076638957178880	2018-12-15	[]	mayb spar button aspir design mak us believ someth real tru anym @aldenwicker
1074061537466335232	2018-12-15	[]	med company launch new recommend sit ded help find best item every categ sun
1074031342256513024	2018-12-15	[]	net pot com without risk least read instruct car us on
1073714250823163904	2018-12-14	[]	many produc today claim best stop buy we'r quest fig
1073684052228653058	2018-12-14	[]	city lot peopl spend on incom rent lik expery homeless cris accord new report
1073668956232151040	2018-12-14	[]	hemp leg mean cbd bound becom ev vis may becom import sci want study cbd effect
1073661402785685505	2018-12-14	[]	many light put christmas tre calc
1073660686977429506	2018-12-14	[]	want kind person us spar button latest @thegoods
1073658530647998464	2018-12-14	[]	weekend read story best everyth pack
1073655171341828099	2018-12-14	[]	young passeng car col seat usb port plan act ticket cheap
1073366963831726080	2018-12-14	[]	instead tre review sign someth good bad instead tre review guid spec produc pro con describ real peopl noth noth less @gabydvj
1073359412235001857	2018-12-13	[]	amazon much 2018 imposs not might miss
1073351865264418817	2018-12-13	[]	everyon pentagon report moonlight direct @barryjenkins want know nant pelos bought coat
1073344312476262401	2018-12-13	[]	week bad new car priv phys spac
1073336764796940289	2018-12-13	[]	ub lyft mov busy model innov company produc innov on autonom vehic ai success they'll nee go publ
1073329213090914304	2018-12-13	[]	accord amazon vic presid publ policy new york's amazon work mak av $17 $23 per hour receiv world benefit work annount plan form un
1073322532336533505	2018-12-13	[]	press layaway oft overlook way hurt low shop
1073315438388539392	2018-12-13	[]	lot opt sud mak ev triv decid seem import hap peopl want best psycholog barry schwartz
1073261268310638594	2018-12-13	[]	sometim search best becom less object commun find
1073018412144578560	2018-12-13	[]	start decemb 18 delt annount long allow emot support anim board flight long hour
1073002653402058754	2018-12-12	[]	glossy casp brooklin car vox report tri direct produc answ singl quest would act improv lif short answ ye long answ far comply
1072966825304965120	2018-12-12	[]	suitcas company rad went tot sold tot shut year
1072951724896268288	2018-12-12	[]	psycholog collect hopeless quest best
1072938549777915904	2018-12-12	[]	proct &amp; gambl acquir walk &amp; company cre bevel groom lin market men col form hair car lin market wom col
1072901336755261440	2018-12-12	[]	differin 0 cream gel den gross alph bet pad nar pur rady tint moist clin perfect rea
1072900518442348551	2018-12-12	[]	jump hg skinc bandwagon moist @belifusa's aqu bomb moist bomb cleans @glossier
1072897597705207808	2018-12-12	[]	holy grail dr jart ceramidin cream bior watery ess emm hardy morgin cleans balm de c de
1072894803506020355	2018-12-12	[]	would nod along @cherylanneny explain holy grail olaplex think larg fix
1072894549851340801	2018-12-12	[]	spirit piec would lik evangel hgs simpl cleans oil neutrogen h
1072893395352326145	2018-12-12	[]	@cherylanneny dug beauty lov obsess find holy grail produc want hear holy grail quot tweet tel us favorit beauty produc
1072893317996834817	2018-12-12	[]	car much best
1072868681435164673	2018-12-12	[]	week examin quest find best everyth
1072627088245575692	2018-12-11	[]	much tru innov poss raz yet expery ar extrem numb new shav tool
1072604445031063552	2018-12-11	[]	produc shop 70 turn
1072589309117718528	2018-12-11	[]	sit lik strategist wirecut buzzfee review claim ident best produc giv categ build trust
1072566918140305409	2018-12-11	[]	wann know produc best ask peopl shop 70 year
1072537434137743365	2018-12-11	[]	good morn happy publ day best everyth fantast pack @thegoods many pro
1072520297209847808	2018-12-11	[]	@thegoods extrem spicy pack pervas cult conceiv best wrot raz pat went
1072520245707984897	2018-12-11	[]	consum obsess ide best @thegoods put togeth whol pack new story p
1072492885193490432	2018-12-11	[]	obsess buy best vert everyth we'r unpack quest best week
1072492149877469185	2018-12-11	[]	week @thegoods publ story cult obsess buy sel best
1072302446993539072	2018-12-11	[]	69 wom died brain amoeb infect sci suspect got us net pot incorrect
1072287348040392705	2018-12-11	[]	four bas flav least fiv sweet sal sour bit umam
1072272248013127680	2018-12-10	[]	watch offscreen car wait vanderpump rul unfold fascin provid window way money fam influ work togeth 2018
1072257149126946816	2018-12-10	[]	year seem new ghost town follow shop wherev click ad bootleg hallmark sock
1072242049557118977	2018-12-10	[]	opin interview us publ transit
1071857011283775488	2018-12-09	[]	diy vagin bleach real dang
1071826812315942912	2018-12-09	[]	ev sint wom start hold polit off am men fix cloth
1071555024130457600	2018-12-09	[]	near 40 year sint art basel found numb art fair balloon 200 year art basel remain cream crop
1071547471610826752	2018-12-08	[]	millen valu auth busy embrac includ lik nev
1071524822352449536	2018-12-08	[]	third tim four year spot turn boy year list
1071494626119315456	2018-12-08	[]	think end lik 'let get ar end could feel al awak co @dipseastories gin gutierrez
1071464428762251265	2018-12-08	[]	bar bar grocery stor sold grocery could drink pint grocery stor could buy pound vidal on bar tim behind us
1071162438991704070	2018-12-07	[]	doug bernstein recal attend big trad show told real nic know everyon get tech unless guy start mak electron toy going go bankrupt turn tru
1071148291423760384	2018-12-07	[]	collect art basel hold excit contemp art on plac deal fair big expens hop reward hop sneak min celebrity's party
1071136024640671744	2018-12-07	[]	plac mov toward mak cannab govern industry there's on big quest tax revenu leg wee go on poss answ publ transport
1071133969805017088	2018-12-07	['#longread']	top week @sfchronicle @nytimes @thegoods @breakermag @topicstories
1070852894860075011	2018-12-07	[]	biggest threat diamond might brid increas wil consid ston lik morganit
1070845348271321088	2018-12-07	[]	accord report baby boom stop buy christmas tre millen kid grew millen adult buy tre nostalg
1070807597660409856	2018-12-06	[]	biggest quest fac spot com year wheth someth boy year list
1070800049360187392	2018-12-06	[]	controversy priyank chopr nick jona wed explain
1070790690408284160	2018-12-06	[]	many par today enjoy post famy soc med rec study focus dataf childr suggest post may problem think
1070779302302470144	2018-12-06	[]	wom body think quot right vulv aim alyss dweck gynecolog
1070762299659567104	2018-12-06	[]	porn real @dipseastories try instead get wom ready part sex
1070752078912352256	2018-12-06	[]	real issu deal trash long shap trash
1070701901858070530	2018-12-06	[]	karl lagerfeld becam chanel cre direct 1983 play direct rol market fur must elit chanel latest fash hous mov away fur
1070494282002231306	2018-12-06	[]	fact sev maj credit card network long requir sign chang real lot us stil sign lot receipt
1070487990554714113	2018-12-06	[]	mount evid certain plast harm heal start ev born
1070477925412147200	2018-12-06	['#sponcon']	chona wed explain
