id	created_at	hashtags	cleaned_text
970031306141831169	2018-03-03	['#osc']	fun fact bas ide star wor first
970011173683736576	2018-03-03	[]	bliss back new brand new pric new nam fatgirl slim cellulit cream
969967888617689088	2018-03-03	[]	17 year sint bjork wor swan osc
969698614028177418	2018-03-02	[]	peopl see want lik fun mak happy
969668416578768897	2018-03-02	[]	everyon predict dress star wear osc sunday wear dress
969648030512115712	2018-03-02	[]	rais hand ev person victim ___ lik french girl subject lin
969631925282525185	2018-03-02	[]	mat win sunday on thing agr short short @cmbynmovie
969618852408627200	2018-03-02	[]	hollywood actress pul success red carpet protest gold glob
969611303907049472	2018-03-02	[]	cam way mak red carpet suck less
969587633427963904	2018-03-02	[]	happy friday today bring hum dress panda
969581107053252609	2018-03-02	[]	protest costum allow peopl transcend id inhabit ideolog
969322384883826688	2018-03-01	[]	breast cant diagnos com thought wear surgery
969312440285528064	2018-03-01	['#academyaward']	first film broadcast photograph tel incomplet story
969306280694251520	2018-03-01	[]	burberry kim kardash
969273816248672256	2018-03-01	[]	hey brand funct item also cut
969248913759899648	2018-03-01	[]	littl said fat poverty feel much household enough
969246636139573249	2018-03-01	[]	talk poverty feel lik undress
969226826441740289	2018-03-01	[]	@breezeriley thank tak look
969223736397201408	2018-03-01	[]	anyon doubt badassery teen girl meet teen pat first bra
969222798798356487	2018-03-01	['#blackhistorymon']	know elizabe keckley enslav dressmak skil
969218711432384513	2018-03-01	[]	divers art com book fash got lot cool
968987932374814721	2018-02-28	[]	2018 stil many sport company forget fem athlet ex
968964073923731457	2018-02-28	[]	thought pray enough ceo @dicks sport good
968951944130674688	2018-02-28	[]	anoth mal model com forward bruc web story
968943640314875904	2018-02-28	[]	wild extend impact amazon everyday liv already freak hey might
968918337911652352	2018-02-28	[]	quick goodby not eic @brittaboutaleb
968903807966109701	2018-02-28	['#fash', '#beauty']	incred story @cherylanneny went pedy oncolog nurs &amp; journ @racked
968903374904193024	2018-02-28	[]	on macy stor nj bas test lab every macy
968884228359409667	2018-02-28	[]	mal model expend cog hyp wheel fash industry
968875202892521472	2018-02-28	[]	origin bliss found reminisc start 90s juggernaut
968856324070092802	2018-02-28	[]	start wear [kigurumi] guar going keep buy
968610947651833856	2018-02-27	[]	pretty much everyon agr want pay gar work liv wag act comply
968601888131354625	2018-02-27	[]	@fentybeauty innov black beauty entrepr
968589550451818497	2018-02-27	[]	predict algorithm mak liv easy also scary invas
968562880726659072	2018-02-27	[]	real feat lin perfect read next tim stuck long get point
968541993864491010	2018-02-27	[]	good lawy sometim mean cloth shop cli
968517489608019974	2018-02-27	[]	evergreen request mak wom cloth pocket
968493940587597824	2018-02-27	[]	would cost h&amp;m 1 perc $2 bil mad 2016 pay cambod work liv wag
968279009720123392	2018-02-27	['#thebachel']	fantasy suit tonight ak on day clos run tak instagram
968244533241700354	2018-02-26	[]	am thing bet born aristocr famy chos on
968210559178084352	2018-02-26	[]	happy monday wom us bas allow outsid
968195236769001472	2018-02-26	[]	co elizabe way talk fash hist @racked
968191957439844354	2018-02-26	['#blackhistorymon']	feat interview actress @glo_reuben play elizabe keckley 2012's lincoln; au
968188063078928384	2018-02-26	[]	gucc gav $500 fight gun control
968131549051879425	2018-02-26	[]	car coat driv sho becam driv forc fash
968124002085625856	2018-02-26	[]	mary tod lincoln dressmak elizabe keckley black wom un abl deal first lady mood
967896997905797123	2018-02-25	[]	lov beauty produc doubl duty
967866795897090054	2018-02-25	[]	@manymanywords wrot 7000 word hoody capit fash manufact real gre read prom
967836603380129792	2018-02-25	[]	oh fin brand launch plu siz cloth complain hard
967806402038255616	2018-02-25	[]	everyth ev wond spa mus know dying know pan flut whal sound com
967776203108114432	2018-02-25	[]	tweez built led light geni
967534609930924032	2018-02-24	[]	big brand stil standalon men's shop
967504412166926336	2018-02-24	[]	nat vaselin act wond
967474216554631170	2018-02-24	[]	would anyon lik play round many blanket scarv many
967444024545161216	2018-02-24	[]	we'r sorry tel fav skinc brand whol lott problem
967413826579718146	2018-02-24	[]	insid fascin lucr world facebook buy group
967202418181201921	2018-02-24	[]	everyone's favorit 90s hair access back
967126185103777795	2018-02-23	[]	bag big enough hold show on unfortun contest must carry slight big bag everyon els
967117485882429445	2018-02-23	[]	deciem found brandon truax email us lot yesterday
967108417000214534	2018-02-23	[]	ev wond un pool hipst wear aloh shirt tech bro wear hoody off quest
967105787674943488	2018-02-23	[]	j hop madewel get cool girl shop
967068736376246277	2018-02-23	[]	includ @manymanywords' magn piec am giant &amp; stat am manufact read immedy
967044382326173697	2018-02-23	[]	aloh shirt produc conflu cult influ island
966697096886870017	2018-02-22	[]	depress tak body away
966682002601730048	2018-02-22	[]	judg person socio posit cloth
966677240066043905	2018-02-22	[]	week dram deciem par company ordin co new
966334712645070848	2018-02-21	[]	androgyn cloth com long way stil avail larg body
966319611464560641	2018-02-21	[]	modest much skin show
966011298713604097	2018-02-20	[]	alex buy sock
966000113658327041	2018-02-20	[]	newest bag stuffy exclud
965989973148291074	2018-02-20	[]	new pet rock man pum ston
965987424005447681	2018-02-20	[]	best nat deod may already skinc stash
965970665823195136	2018-02-20	[]	seinfeld voic deal men stor latest via @racked
965964348228325381	2018-02-20	[]	am manufact die
965957221275328512	2018-02-20	[]	purpos standalon men stor serv mov toward genderless cloth
965730215967080448	2018-02-19	[]	lim crim becam hat beauty company internet
965690693992763397	2018-02-19	['#blackpanth']	audy wel charact screen
965617287578386432	2018-02-19	[]	3 that's
965617125682540547	2018-02-19	[]	2 agr many read us new addit convers settl on enjoy yog pant writ
965616890709241857	2018-02-19	[]	1 @racked also heard yog pant op weekend
965594848513404929	2018-02-19	[]	bhldn modclo dress unicorn could mak big buck facebook
965375386359083008	2018-02-19	[]	got fash q get adv facebook group
965345934107447303	2018-02-18	[]	fin stop search perfect soft
965314986099720193	2018-02-18	[]	talib rul strict rul men's hair beard post kab haircut becom symbol freedom
965284796283981824	2018-02-18	[]	everyth ev want know hair makeup get don olymp
965268926002216960	2018-02-18	[]	fash week stil mat ask indy design
964998897109102592	2018-02-17	[]	shop prescrib sunglass frust here's guid mak painless poss
964970460512444417	2018-02-17	[]	@adaripp get spark fig skat costum
964939505512824832	2018-02-17	[]	form @prabalgurung employ say crit appear pregn let go week daughter's bir via @voxdotcom
964908803849367552	2018-02-17	[]	black beauty brand rad
964877108681105411	2018-02-17	[]	@chavielieber talk sev @lululemon employ report tox boys' club work cult
964665708146720770	2018-02-17	['#blackpanth']	talk costum design @iamruthecarter design film's afrofut costum
964639710076424192	2018-02-16	[]	here's real thought tak @loltanisha fash week stil mat design
964634556757348352	2018-02-16	[]	nyfw tri find foot independ design commit ev
964552983676559360	2018-02-16	[]	ev not many tattoo skinny wom pinup fig mars' work challeng
964549540899680257	2018-02-16	[]	oh look latin enough ev mean latin country peopl look
964545425490444288	2018-02-16	[]	would surpr learn shop prescrib sunglass tot pain ass
964532135053987840	2018-02-16	[]	glam squad behind olymp gam mak sur carry lot lip balm
964507672916656128	2018-02-16	[]	bid mak best techn apparel outdo voic crowdsourc design process
964192843181957120	2018-02-15	[]	@mayemusk 69 supermodel everywh right hap @elonmusk's mom
964176784014151681	2018-02-15	[]	talk @racked olymp laundry skat costum els hockey gear definit nee wash
964174229393498112	2018-02-15	[]	@olympics look
964167932266807297	2018-02-15	[]	perfect ex perfect fabr
964152835775574016	2018-02-15	[]	laugh sammy sos bleach skin without know context
964145284703051776	2018-02-15	[]	pyeongchang play host near 3 athlet 15 volunt 6 broadcast personnel thousand off coach crew memb laundry
964137734934859776	2018-02-15	[]	strong hero fantasy tal us dud design want see rol
963847685877923841	2018-02-14	['#olymp']	meet design help @adaripp becom glamazon bitch ready runway
963834041777770496	2018-02-14	[]	decid com back matern leav real hot here's look lululemon's cur work cult result
963831732935053312	2018-02-14	[]	new alleg inappropry conduc lululemon corp headquart
963821371250888704	2018-02-14	[]	fash connect ancest also chang fut cheyney mcknight
963796899173228544	2018-02-14	[]	sup dup thrilled see feat post cant surgery cloth @racked go liv @manymanywords
963782893804847109	2018-02-14	[]	opt post wear breast cant paty ev
963776275017097216	2018-02-14	[]	kimono dress two job
963486964862332931	2018-02-13	[]	shop siz 16 26 @loft
963466574656081921	2018-02-13	[]	ev want wear blanket work scarf
963443156816728064	2018-02-13	[]	pay colleg four kid challeng
963435609623875586	2018-02-13	[]	best sheet mask lazy peopl
963430604581851137	2018-02-13	[]	talib forc men cut hair keep styl hair on turb becam form defy sil
963428056584122368	2018-02-13	[]	school program spec fig skat costum design get field
963420507063439361	2018-02-13	[]	want hairstyl leonardo dicaprio movy talib allow
963167865544339457	2018-02-12	[]	anyon ev ask quest start buy join @racked's facebook group
963144055369752576	2018-02-12	[]	join rack loung facebook chat thing fash beauty
963118385507852289	2018-02-12	[]	wear corset us lif
963117688859058176	2018-02-12	[]	dissect michel obam fash nat pastim
963101951494971393	2018-02-12	[]	headlin weekend proclaim banan clip back uh
963073220483145728	2018-02-12	[]	last nam spec neith
963058118300258305	2018-02-12	[]	sci mus hear spa ev instru wav crash beach
962823567879491587	2018-02-11	[]	watch good doct mak say damn @antonialthomas' skinc routin yeah us ask kind shar
962793375740104706	2018-02-11	[]	chines brand try ap custom chin op stor london app
962763177225158657	2018-02-11	['#nyfw']	delight hist celeb fash week
962732969080193025	2018-02-11	[]	work hedg fund dress part show work every day look lik object could bought sold trad lik commod
962706052864147457	2018-02-11	[]	school uniform sexy transform thank britney spear though nev assocy hit baby
962702766736072704	2018-02-11	[]	fash week stil ex
962461184732545026	2018-02-10	[]	troubl brew behind scen deciem par company ordin
962430985471082496	2018-02-10	[]	depart stor bas reason wom first allow go publ
962400776579624961	2018-02-10	[]	mal might struggling thing rememb stil hang
962371341440569344	2018-02-10	[]	lit nee licens profess put kimono
962370594405675009	2018-02-10	[]	feel lik every fam person's kid model day @eliza_pb took look
962341395037028353	2018-02-10	[]	com read story combin fishnet stock teach roland barth
962340391415500800	2018-02-10	[]	almost forgot old acn tre stil good 90s
962076580079120385	2018-02-09	[]	mak sur read whol thread read @marlenkomar's ter story
962068605360721922	2018-02-09	['#nyfw']	anoth good tim piec @amandamull fash week car plu siz custom
962040396963393538	2018-02-09	[]	@hannahorens @juliareinstein sur
962039442859945986	2018-02-09	[]	@juliareinstein @hannahorens ye pleas com join us thank shout @juliareinstein
962032134608257024	2018-02-09	['#blackpanth']	look @iamruthecarter cre fut lov let afric
962020495121006593	2018-02-09	[]	ask facebook group memb favorit fac mask whol lot opin
962016072210661376	2018-02-09	[]	justin timberlak merch pop strangely muse
962012478715584519	2018-02-09	[]	story behind beauty afrofut costum @theblackpanther
962009248451387394	2018-02-09	[]	17 rap gucc biggest stan say fellow teen fan
962003152613625856	2018-02-09	[]	talk execut form employ heck going deciem hom belov skinc brand ordin
961997978587291649	2018-02-09	[]	lifetim l return
961992970709938176	2018-02-09	[]	wrot @fiftyshades franch success sel thousand dress addit dildo
961986053430235137	2018-02-09	[]	lipstick design dress @fiftyshades franch boon retail
961978506006749189	2018-02-09	[]	merch bring us clos togeth
961970962165100544	2018-02-09	[]	turn century wom welcom mal spac ak publ cam depart stor
961963412489232386	2018-02-09	[]	happy olymp day deeply fascin look fig skat outfit
961736412239482881	2018-02-08	[]	got fash nee adv join facebook group edit help find look
961646332757856256	2018-02-08	[]	lingery che sheet sort wheth look bas bra gart belt
961644065862254592	2018-02-08	[]	every fit room ev
961636817794682880	2018-02-08	[]	may see chines brand soon
961633156146302977	2018-02-08	[]	look rich get rich exact latest luxury work money @racked
961623669377241089	2018-02-08	[]	money mad money wor felt lik impost
961608566233759745	2018-02-08	[]	jail crim commit dream get sup bowl ring mak ring fellow exon
961603542065799168	2018-02-08	['#nyfw']	model fin priv chang area mat much
961364441764941824	2018-02-07	[]	stil going
961335514853978119	2018-02-07	[]	shop direct @tiffanyyannetta answ fash qs reddit submit qu
961305178950520832	2018-02-07	[]	shop direct @tiffanyyannetta answ fash qs reddit submit quest she'll answ start 2
961282685896241152	2018-02-07	[]	stor g 1920s
961246177562898432	2018-02-07	[]	k fan import idol rolex buy rolex
961238632735674373	2018-02-07	[]	brit roy genit pierc know
961011928381435905	2018-02-06	[]	anoth attempt patagon sav planet
960980032901566464	2018-02-06	[]	ins thing ev writ dress lik real housew week becam monst ht
960959333646389248	2018-02-06	['#valentinesday']	follow @racked flipboard dark hist behind lingery reddit acn tre mor
960959298896584706	2018-02-06	[]	kardash end fash model begin mat on favorit week fascin f
960946957933006854	2018-02-06	[]	anim sacr whip bas valentin day routin
960945079765565440	2018-02-06	[]	tri dress lik real housew week here's hap
960923006473244672	2018-02-06	[]	@universalstand prov want peopl talk someth wor talk
960918676881985536	2018-02-06	[]	lov week's shop wherein @becagrimm spok mus recov larg self gend
960913991961927680	2018-02-06	[]	wind road desp lat web crawl ev lead skincareaddict subreddit
960906443917484032	2018-02-06	[]	think wom cloth purpos mad bought dispos every mon two month men cloth typ much sturdy
960890898711285760	2018-02-06	[]	seem every model day fam par
960883794323628032	2018-02-06	[]	ap chines custom go west
960640632686612480	2018-02-05	[]	short short shortest cal nam feat on 2017 best support perform courtesy pair
960640501987889152	2018-02-05	[]	thank much chat @racked
960557400410353664	2018-02-05	[]	valentin day origin lot bloody goat skin thong
960528960898650112	2018-02-05	['#thegooddoct']	keep ey breakout star @antonialthomas
960521404511866880	2018-02-05	[]	rememb rememb thing rememb
960234503598780417	2018-02-04	[]	look off @nfl fan jersey get mad
960201536235298816	2018-02-04	[]	nee talk sport apparel wom suck much
960166570252292096	2018-02-04	[]	perfum shop forc real us nos
960166064956039168	2018-02-04	[]	nfl sport leagu also apparel access company
959936288743927810	2018-02-03	[]	real reason nas cre makeup fem astronaut
959906592534667264	2018-02-03	[]	here's act mak bet box glov wom hint mak smal pink
959901811040751622	2018-02-03	[]	nfl play long hair there's hug risk hair get pul
959871109075267584	2018-02-03	[]	prescrib pregn salv millen matern market soc med ap book big pregn ens univers look good feel good tru everyon though
959837135011504128	2018-02-03	['#millennialmoney']	list @racked seny edit @alanna talk money habit shop @shannahgame podcast
959804178423001088	2018-02-03	[]	stuff @clawandco stor put smil fac
959803680265416704	2018-02-03	[]	plain old chapstick enough get wint tim talk lip exfo
959600073675075588	2018-02-03	[]	@kaepernick7 quiet mak polit stat cloth
959574810748694528	2018-02-02	[]	long hist wom clu right @stephiegrob @racked
959568113023856640	2018-02-02	[]	ye skinc act work
959456890672599041	2018-02-02	[]	lip balm job
959449338962415616	2018-02-02	[]	hey rememb @jtimberlake play mal model astronom @disneychannel
959439652255092736	2018-02-02	['#ootd']	nfl lifestyl brand complet influ pic recip video
959237434046341120	2018-02-02	['#metoo']	kat upton cal guess cre direct paul marciano mom
959230135193935872	2018-02-02	[]	$8 @elfcosmetics moist chang teen's acn skin peopl freak via @allure_magazine
959222335856304128	2018-02-02	[]	sery though women's sport apparel kind suck
959199689710161922	2018-02-01	[]	shop onlin riley ros forever21's new beauty brand
959124831106199553	2018-02-01	['#metoo']	kat upton mom cal guess cre direct paul marciano
959116905821872128	2018-02-01	[]	perfum stor smel world's rarest fragr hors poop
959109901720150018	2018-02-01	[]	produc exceiv sad stor select candy cur avail onlin
959104835328061440	2018-02-01	['#nfl']	anyon not many play rock long hair look good there's on problem they're somet
959079403337736192	2018-02-01	[]	could ask two thing sup bowl sunday would 1 eagl win 2 someth wear norm good bedazzl pink
959071855377338370	2018-02-01	[]	long hair car
958808394755952640	2018-01-31	[]	off @floriehutch's campaign ballet flat emoj approv wear flat here's repo
958768412045561857	2018-01-31	[]	rememb tim kim kardash forc dress lik par hilton mid
958758577413509120	2018-01-31	[]	what's favorit fac mask we'r discuss rack loung facebook com join us
958758459264176129	2018-01-31	[]	peopl see person col dress lik real know
958749550210056194	2018-01-31	[]	@dandywellington definit dap
958724568029462529	2018-01-31	[]	far concern might wel chang nam heath
958709466668683265	2018-01-31	[]	saw nas makeup kit lik sery hel context
958701921317081089	2018-01-31	[]	mak feel pow abl channel past
958520249837670400	2018-01-31	['#sotu']	talk @reploisfrankel @replawrence congresswom they're wear black tonight's
958519550647169024	2018-01-31	[]	wond wom sotu black ask
958508507095019521	2018-01-31	['#sotu']	talk @reploisfrankel @replawrence congresswom they're wear black tonight's
958459818452312064	2018-01-30	[]	$10 ser ordin already sold sephor thank kim kardash
958458936356737025	2018-01-30	[]	ev com skinc hear
958437614536839170	2018-01-30	[]	act skinc work
958403851014561793	2018-01-30	[]	last year wrot beauty skinc sacr commun rit charact mut fem generos read
958401452933877761	2018-01-30	[]	j madewel extend denim launch without maj bungl
958384516359491586	2018-01-30	[]	ear pierc consid taboo throughout ear 20th century app show lack mor charact
958384321307422725	2018-01-30	['#sotu']	congresswom wear black tonight's
958377276005146625	2018-01-30	[]	on belov produc vint beauty brand surpr modern
958369726173990912	2018-01-30	[]	sav money stil look lik hum travel accord flight attend
958354174839808000	2018-01-30	[]	wear dress two
958352978179653635	2018-01-30	[]	instagram millen wom bra bra yog pant cal meal delivery box goop produc bra
958347080459833344	2018-01-30	[]	many bra
958344469111279618	2018-01-30	[]	everyth nee know cult favorit skinc brand ordin
958339529257242626	2018-01-30	[]	tak look insid @rupaulsdragcon
958145991793938434	2018-01-30	[]	east afric ban import us cloth act help boost loc design
958129633865682944	2018-01-30	[]	whit ros strongest stat grammy last night
958113780172509184	2018-01-29	[]	many women's cloth lat pearl
958047905574801408	2018-01-29	[]	best pajama wor spend $$ accord smart read
958036125200867329	2018-01-29	[]	many ripoff mak trend
957984691612737536	2018-01-29	[]	without right fit might break wrist
957977137310523392	2018-01-29	[]	chanel 2 herm birkin fend baguet
957828238943948800	2018-01-29	['#grammy']	ye whit ros @kesharose pow perform mad far stronger stat
957806008000229376	2018-01-29	['#grammy']	tru behind rainbow col @kesharose wear lit ident on
957794574252027905	2018-01-29	['#grammy']	@iamcardib shop finess
957781317218861057	2018-01-29	['#grammy']	@littlebigtown's @karenfairchild admit littl styl
957780384028258307	2018-01-29	[]	we'r glad @nickjonas 'ed hardy phas
957775958727122944	2018-01-29	['#grammy']	@ladygaga alway bring perform
957768193849864192	2018-01-29	['#grammy']	forget @beyonce's 2017 perform refresh last year's
957758121627275265	2018-01-28	['#grammy']	cours @iamcardib wor red bottom
957757250516512768	2018-01-28	['#grammy']	alway plac polit stat
957745482264170496	2018-01-28	['#grammy']	ready
957719945789558787	2018-01-28	[]	everybody retail flinch point
957659540924887040	2018-01-28	[]	$15 fac oil hero go bag makeup remov moist
957629355840094208	2018-01-28	['#grammys2018']	polit fash stat art mak tonight
957628343947595776	2018-01-28	[]	ev turn back sap
957357546825662464	2018-01-27	[]	1920s makeov sav wom dea penal
957327348822458368	2018-01-27	[]	sorry ug nee heel
957327347530612736	2018-01-27	[]	off reason exfo
957299937754071040	2018-01-27	[]	here's @metmuseum preserv century fash lik hummingbird ear 1865
957297158843129856	2018-01-27	[]	dry wint skin gonn fix
957266949448216577	2018-01-27	[]	we'r honest shock $10 sold yet
957265707540140038	2018-01-27	[]	sleep beauty want
957025367205740551	2018-01-26	[]	ye dress lik favorit vint styl blog
956989278978002944	2018-01-26	['#grammys2018']	ess pre @elanafishman
956970995914629125	2018-01-26	['#grammy']	red carpet protest fair untrod territ osc glob
956939368505241600	2018-01-26	[]	gre suggest
956937538303705088	2018-01-26	[]	hair col dog thing saf
956927724051947521	2018-01-26	[]	cas want reason go @target
956912624846999552	2018-01-26	[]	definit guid buy vint cloth access beauty produc onlin
956897527693037569	2018-01-26	[]	prosecut damn evid sabell nitt ug
956889973126516736	2018-01-26	[]	sneak lov parad
956706505998270464	2018-01-26	[]	struggle real tal wom try find cloth fit wel
956685618590900225	2018-01-26	[]	slozy new aesthet
956670775670525952	2018-01-25	[]	ye thing pretty funct
956643004940476416	2018-01-25	[]	kim kardash recommend ser expect abl get hand
956601611777921024	2018-01-25	[]	pearl barf thing terr
956535138447515648	2018-01-25	[]	us am cloth chines fact
956527587634941955	2018-01-25	[]	look stock cryst
956338334384697346	2018-01-25	[]	'grown quiet champ modest styl
956315683096317952	2018-01-25	['#sotu']	@reploisfrankel congresswom talk they're wear black
956273243614339072	2018-01-24	[]	everyth nee know belov @uniqlousa jw anderson spring collab
956246506444673025	2018-01-24	[]	congresswom wear black red pin sotu symbol cho
956245595148218368	2018-01-24	['#grown']	@yarashahidi styl cov sup modern
956237619234508800	2018-01-24	[]	mess hotel work get jump waitress get pinch wom farm may assault boss
956212962854924288	2018-01-24	[]	'made italy' act look lik
956195398976200704	2018-01-24	[]	black person work lot whit area us sup trust anyway
956172752465129472	2018-01-24	[]	lik shop tal wom
956165202516602881	2018-01-24	[]	am wom try act lik french wom sint least 1893
955981227856576512	2018-01-24	[]	lot whatev chang lif
955965877274533888	2018-01-24	[]	madewel j crew annount denim siz there's stil room improv
955950524263624705	2018-01-23	[]	leg group press off govern eth investig ivank trump's continu tie fash brand
955927002917277697	2018-01-23	[]	ivank trump wor ivank trump item 68 perc soc med post off govern ev
955914425558593536	2018-01-23	['#cmbyn']	deserv best short osc lik lit
955889633283465216	2018-01-23	[]	ev high res sit fak issu
955886012768686085	2018-01-23	[]	accord brand extend cov wom siz 20 styl includ
955870252864241664	2018-01-23	[]	read @nadrakareem hist black beauty brand
955859451579310081	2018-01-23	[]	sound whit skat yellow dress music's surpr impact fig skat fash
955840562485252096	2018-01-23	[]	best plac shop new pair black skinny jean tot worn go pair
955830410814152704	2018-01-23	[]	first makeup company black wom overton start way 1898 black wom flock get tr
955825464198692864	2018-01-23	[]	whatev produc lif
955817914577440769	2018-01-23	[]	giann versac shot spic world cameo short murd
955810364570128384	2018-01-23	[]	fenty 100 year black makeup brand
955606010709905409	2018-01-23	[]	turn contest bachel gre launch pad car instagram influ
955590910884171778	2018-01-23	[]	2018's bachel contest rank going top
955565404285554688	2018-01-22	[]	man get job
955560716148314112	2018-01-22	[]	shop peopl expery lik on worst day liv
955555670119669762	2018-01-22	[]	vis symbol wom march chang many wom col continu feel march real
955476062716203008	2018-01-22	[]	icym read @hilarygp's origin 2017 story thinx's problem company cult
955447974234087424	2018-01-22	[]	thinx overha cult brand er
955220967986364417	2018-01-21	[]	nik nfl decid mak gear footbal fan lov
955183219577688065	2018-01-21	[]	colin kaepernick mak quiet polit stat cloth
955125809026547712	2018-01-21	[]	model siz 14
955122835449569282	2018-01-21	[]	california's new marijuan law could mean hemp cloth industry
955092623873622016	2018-01-21	[]	driv man sleep outsid walmart spread wood stick hors nintendo
955078795073114120	2018-01-21	[]	fin feel saf masculin
954866132518948865	2018-01-21	[]	boot surv mediev sword definit handl snowstorm
954820835918819328	2018-01-20	[]	beauty produc nee day minut get door
954796419478577152	2018-01-20	[]	leav fix dam wint hair via @allure_magazine
954766644991152130	2018-01-20	[]	latex cloth sexy sustain
954760447864979457	2018-01-20	[]	stock photograph sur weird idea shop bag
954731253546307584	2018-01-20	[]	ev thought look ins messy
954730237564133377	2018-01-20	[]	rent jewelry hap los
954473038799626240	2018-01-19	[]	phantom thread daniel lew play fash design nat help choos film's costum
954433000334417921	2018-01-19	[]	blog friday rack
