id	created_at	hashtags	cleaned_text
788624588334886913	2016-10-19	[]	can't believ story year old already defo favourit high fiv @wgarrettjruk
788457779707150336	2016-10-18	[]	@pointshootthink
788449082666876932	2016-10-18	[]	tub read @stylistmagazine @shellyvella
788449042065940481	2016-10-18	[]	@annaistweeting_ @stylistmagazine xxx
788436740684050432	2016-10-18	[]	fresh cle glowy skin want know @abimfox 'a secret apart glory genet
788343672370782209	2016-10-18	['#crueltyfr']	today's post talk on favourit nat beauty brand @sukin_hq
788075712406294528	2016-10-17	[]	@wendy_mccomb sorry miss wait sup sunny autumn morn
788075608844664832	2016-10-17	[]	@hendysophie @ugguk @petauk real real
788075433803776000	2016-10-17	['#jonesbootmak']	thank @shellyvella lov writ feat ros pink velv
788067102527807489	2016-10-17	['#stok']	lov surpr @cosmopolitanuk
787988621462802432	2016-10-17	['#still', '#styl', '#veg']	nought cross sort @coconeill mak brush
787986304264966144	2016-10-17	[]	i'll bus much hank on bad boy @babsi6381
787633110993215488	2016-10-16	[]	today ins beauty sky rain jennyzarin &amp; lofty
787546019135381504	2016-10-16	['#bts', '#shopwi']	seen distress video proc sheepskin @ugguk ug act footwear @petauk
787541925511499776	2016-10-16	['#whisk']	anoth dino portrait sery on he's think kal
787405286646620160	2016-10-15	[]	sneak peek beauty littl story @lasheslonging @abimfox
787403047366430720	2016-10-15	['#5aday']	anoth on favourit @korresuk wild ros sleep fac moist
787324454040895490	2016-10-15	['#georgiaokeeff', '#thestylishstuff', '#okeef']	spot inspir piec feat @shellyvella
787317823689351168	2016-10-15	[]	dino get fuss repriev brother's zeal erm affect send
787008820757364737	2016-10-14	['#bts', '#thestylishstuff']	today's shoot @lasheslonging @abimfox
786866657050460160	2016-10-14	['#thestylishstuff']	bas today ye beauty im mad jigsaw
786819029692547072	2016-10-14	['#sorrynotsorry']	muahahahahahanahaah
786815315107655680	2016-10-14	[]	gorg bright &amp; beauty off brand @tracepublicity press day yesterday
786606172878929921	2016-10-13	[]	bravo beauty team @tracepublicity join forc @wah_foundation_
786594663339745280	2016-10-13	[]	i'm suck stun scarf espec mad @lilyandlioneluk b sold
786472939554123776	2016-10-13	['#tbt', '#thestylishstuff']	exact tim last year feat @entwistlejewels
786307614606958592	2016-10-12	['#nat', '#crueltyfr', '#thestylishstuff']	on fiv skinc feat today's post
786285407675613184	2016-10-12	[]	littl bit delay happy birthday us celebr verit pass parcel
786272114084941824	2016-10-12	['#styledbym', '#coachcollect']	@thewhitmore coach @youmagsocial @randbofficial
785804507770982401	2016-10-11	['#bekind', '#regram']	good word tru word @sophiedearden
785477430802780161	2016-10-10	[]	littl cov help mak @thewhitmore styl @youmagsocial
785212262864850944	2016-10-09	[]	favourit @thewhitmore @youmagsocial shoot today feat @toga_archives
785178944530214912	2016-10-09	[]	today's @youmagsocial @thewhitmore styl @pinko @jimmychoo @sophiedearden
784422378235387904	2016-10-07	[]	bravo @johannaortizg simpl favourit tee pair stat ear 'a'line skirt
784301580099072000	2016-10-07	['#newscientistl']	icym act held die show anim test gam
784296587442827264	2016-10-07	['#thestylishstuff']	bloomin lov shoot mood board
784153975201366017	2016-10-06	[]	victor__alfaro victoralfarostudio tak streets bring us ss17 look
784120343799660545	2016-10-06	[]	first thing said i'd resign last year book trip ind fin ing
784115931895177216	2016-10-06	[]	on left ou je dig big tim on right lust list queu
784024510412521472	2016-10-06	['#sneakpeek']	via @youmagsocial beauty ins gorg leg @thewhitmore
783937117843955713	2016-10-06	['#thestylishstuff', '#fiveaday']	com week produc on can't liv
783934697449684993	2016-10-06	[]	yesterday @libertylndngirl @jonesbootmaker 's sarahdavies2000 discuss
783680581968199680	2016-10-05	[]	video clev pow film
783662633346039808	2016-10-05	['#ss17', '#thestylishstuff']	gold mom @zadigetvoltaire ou je dig rol coachell
783583659035074560	2016-10-05	[]	many dress hom would marry sho nano second bravo @jonesbootmaker
783558014045396992	2016-10-05	['#thestylishstuff', '#clickthelinkinmybio', '#thefirstpost']	happy birthday year old today
783422608633135104	2016-10-04	['#thestylishstuff']	big fat ye pleas @zadigetvoltaire
783391481809735680	2016-10-04	['#thestylishstuff']	@kenzo giv good bin bag chic
783389154012983297	2016-10-04	[]	@barnardos ad amaz pow humbl
783222657516990464	2016-10-04	['#projectgreen']	littl nostalg today amaz opportun giv flex
782889478163759104	2016-10-03	[]	help anyon teeny littl pre model could urg loan sold europ
782685765633441792	2016-10-02	['#celin']	everyth
782627091716210692	2016-10-02	[]	eat green
782251135134490624	2016-10-01	['#horsesofinstagram']	got soak today glory jennyzarin &amp; lofty big field
782105417807699968	2016-10-01	['#bekind']	here's rhino help baby zebr get sticky situ happy saturday
781908346672734208	2016-09-30	[]	stil perfect loud jd &amp; cok i'm com
781899788987936769	2016-09-30	[]	last day ent fant @shellyvella styl room head blog detail
781813042925408256	2016-09-30	['#bohem', '#clickthelinkinmybio']	miss post styl hom today last
781753960679997440	2016-09-30	[]	sur fash journo outfit porn @carven_paris
781746581016117248	2016-09-30	['#fbf']	shoot off @tracepublicity today's birthday girl @alexandralunt
781620459876052992	2016-09-29	['#thestylishstuff']	flor wallpap print thing wallflow infact
781612240269152256	2016-09-29	[]	seem vint flor get oh silv sho invest paid
781610675244236800	2016-09-29	[]	ad sid stripes zip track top basebal tee sloppy sport sox basebal hat
781608599286116352	2016-09-29	[]	@teacakebiscuits ye indee go search
781608492763340800	2016-09-29	[]	@jemweb thank can't seem find on i've found onlin
781568568911618048	2016-09-29	['#asktwit']	anyon know lay hand teeny littl climb lik oh &amp; astronaut
781552585123717120	2016-09-29	[]	there's chloe wear flor print wear dear sant
781547087922094081	2016-09-29	['#relax']	day nee @aromaassoc oil oth
781546843440373760	2016-09-29	[]	gazet mak hous hom last chant get @shellyvella styl pad
781219015754649601	2016-09-28	[]	stil tim ent comp @shellyvella head websit go bts hom
781189904084664320	2016-09-28	['#thestylishstuff']	simpl maisonmargiel
781189638283231232	2016-09-28	['#thestylishstuff']	simpl maisonmargiel
781016535569666048	2016-09-28	[]	i'm @stylistmagazine week nat food stor haunt tim stock
780857096367640578	2016-09-27	['#crueltyfr', '#pur']	littl gem plop lilac cot letterbox today off
780811986179325953	2016-09-27	[]	insert capt
780466496111869952	2016-09-26	['#vintagevell']	hung @theraleighhotel day lov retro bathroom
780462585703436288	2016-09-26	[]	fant prolong sunshin feel littl long @emiliopucci show mellow yellow
780142500359143424	2016-09-25	[]	oh @etroofficial nev disappoint
780140972067942400	2016-09-25	[]	forrestlesssleep new main milanes squeez gim
779943742463770628	2016-09-25	[]	happy sunday
779786457959567361	2016-09-24	[]	rabbit whisp gtar71 &amp; dino zen mod
779247329731833856	2016-09-23	[]	new addit chez moi anoth uncomfort cush gtar71 loung vint
779243390097588224	2016-09-23	[]	wear on wear fiv necklac today's fix includ wel travel charm
779038129357516800	2016-09-22	[]	@shellyvella fash brand koopl agr stop sel fur
779038111661711360	2016-09-22	[]	@petauk bril xx
779034866763587584	2016-09-22	[]	going bal ad cool slog tee pil eclect
779033349994254337	2016-09-22	[]	look littl compact pur lov discov tonit debenhamsprteam
778981163763396608	2016-09-22	['#furfr']	bravo @thekoopleshof perfect eth cho @petauk
778922498830237696	2016-09-22	['#thestylishstuff', '#shyselfy']	duty sid stripe sar scarf job don
778663788971163648	2016-09-21	[]	heart stop googl hel internet search look
778580086819880960	2016-09-21	['#rocknrol', '#bohem']	alway fash milit styl jacket lay
778568164825296896	2016-09-21	['#inspo', '#loudouillon', '#rocknrollboho']	sameera_azeem
778486288227917824	2016-09-21	[]	fish friend
778351458798407680	2016-09-20	['#thestylishstuff']	wel hello @sidneigum new rad welcom
778345517088645120	2016-09-20	[]	obsess @venus_mariatash sint discov littl bout nyc
778339752139456512	2016-09-20	['#albertaferrett']	fal lov blush pink velvet pj suit left
778338303733035009	2016-09-20	[]	@diysos lik lottery win deserv inspir individ @mrnickknowles thank
778283497307901952	2016-09-20	['#joinl']	key piec collect zar beauty
778125535100735488	2016-09-20	[]	betwixt season piec belt bliss meet andotherst kimono coat lik
777995366050521088	2016-09-19	[]	carrot top
777948783074222080	2016-09-19	['#coconutchocol']	veggy veg simply lov chocol coconut hearty recommend incred thank @alpro
777933330633424896	2016-09-19	['#clickthelinkinmybio']	fiv piec i'd lov wardrob
777930834267541505	2016-09-19	[]	@saireysmile @thelastleg @paralympicsgb amaz xx
777923161220378625	2016-09-19	[]	lfw com rain giv tim unleash autumn wardrob today's post
777797500023533568	2016-09-19	['#thestylishstuff']	belstaff bab want high fiv real way cloth
777583644588249089	2016-09-18	[]	@cynicalkind clear disagr go for
777580794818813952	2016-09-18	['#thestylishstuff']	gard earth delight chez @markuslupfer
777578226717786113	2016-09-18	['#hs2']	@cynicalkind @bbccountryfile eq abhor ye massacr
777568816503095297	2016-09-18	['#hs2']	dear @bbccountryfile show beauty chiltern countrysid massacr
777410311171309568	2016-09-18	[]	priz capt joy first flush spring go @simone_rocha_
777236014402273282	2016-09-17	['#isitok', '#inspir', '#honest', '#bloodyfunny']	thank @thelastleg tear best show tv anoth four year
777132718475841536	2016-09-17	[]	dino giv sery contempl zen bunny
777102624063688704	2016-09-17	[]	simply want nee stetson obv ralphla unleash myriad
777095886136610816	2016-09-17	['#thestylishstuff', '#lfw']	ye ye zoejordanstudio put lux good sport
777058138436542464	2016-09-17	['#seebychlo']	wish sum play pied pip credit
776888281342574592	2016-09-16	[]	bit lov zar sid striped trous they've becom best buddy @nike
776880853280362497	2016-09-16	['#lfw']	underway catwalk london show skimpy littl cre
776804783906848769	2016-09-16	['#lfw']	wel hello mult lay beauty got neck dress ready thank @essentiallr
776793187558055937	2016-09-16	['#vintagevell', '#miam']	littl la bel @cloutierkim shot benriggottphoto
776677828091899904	2016-09-16	['#thestylishstuff']	got fest blu week endeavo bring vib hom ye we'r
776518719002542080	2016-09-15	[]	capt ricktruscot 's beauty film liv @nancyberendsen feat littl fluid
776513963056099328	2016-09-15	['#thegreenproject']	here's naughty littl someth ricktruscot work onlin
776385285118648320	2016-09-15	[]	meet dino broth chewy latest resid cot
776352868077015040	2016-09-15	['#thebohemianmus']	mus jennyzarin @karenacallen
776349836710936577	2016-09-15	['#thebohemianmus']	idea jennyzarin @karenacallen
776325414939664384	2016-09-15	['#nyfw']	morn i'm develop pass print blous lac insert
776062846325121024	2016-09-14	['#vintagevell']	back @wgarrettjruk channel spirit jan &amp; serg cosmo
776014887763992576	2016-09-14	[]	quit sur littl collect snuck pretty rock'n'roll hippy chick
776009994131140608	2016-09-14	[]	let count way ye on necklac perfect peopl lik
775955818160070657	2016-09-14	['#projectgreen', '#nyfw']	got soft spot fash forest espec here's
775949889784074240	2016-09-14	[]	nee beauty man sleev tattoo sery nee arm photograph purpos
775798253019332608	2016-09-13	['#thestylishstuff']	thank freepeopleuk gre blog piec today feat
775789617241026561	2016-09-13	[]	stop press collect i'll sav hard earn beauty cur
775778928837398529	2016-09-13	['#paralympicsrio2016']	@clarebalding nat treas may rain tom toy
775752769429012480	2016-09-13	[]	dear @wesgordon nail everyth lov fash plu giv fix
775711984721494016	2016-09-13	[]	whenev nee flight fant div book gorg pres
775698836459253760	2016-09-13	[]	chuff feat wond @freepeople blog
775698646226599937	2016-09-13	[]	divin im prohibit blouson @shellyvella styl stuff com soon
775698628505661440	2016-09-13	[]	ent exclud comp w @shellyvella yet find win room styl lady
775438025228771328	2016-09-12	['#iwouldificould', '#nyfw']	lov ruffl hip prob much @31philliplim
775423654536572928	2016-09-12	['#nyfw16']	happy see @tracy_reese sent pow mess embrac divers
775365205974974464	2016-09-12	['#shellyvell', '#veg']	introduc stud shop numb four bag collab
775319651739983872	2016-09-12	[]	wish real lif swan bear lux lac knick would stop cas vell naughty
775298273284349952	2016-09-12	['#bohem', '#intery', '#thestylishstuff']	perk monday today's post excit
775296497181155329	2016-09-12	['#lustl']	ut beauty shellbellecout good fram tak
775253572678193152	2016-09-12	['#shellyvell', '#thestylishstuff', '#clicklinkinbio']	fant styl room info &amp; @decologyuk collab'
775241138773094400	2016-09-12	['#thestylishstuff']	fant littl nos around cas vell today's post celebr collab
775094100316024832	2016-09-11	[]	littl hous prairy girl goe street us bravo adetach lov collect
775086760602796033	2016-09-11	[]	mus ey @ryanrocheny kind peachy hue suit red head skin
775056494769348608	2016-09-11	[]	overwhelm collect high fiv victor coolest
775031229766856706	2016-09-11	['#prophet']	
774724950703927296	2016-09-10	[]	fair say i'm obsess styl hom environ styl fash
774719211813961728	2016-09-10	['#vintagevell', '#nyc']	wel hello friday repost @shellyvella repostap back
774719181648453633	2016-09-10	['#styl', '#fash', '#takeov']	@shellyvella can't wait get start littl project
774662344924332033	2016-09-10	['#thestylishstuff']	work excit link @decologyuk monday's post cur
774299540753113088	2016-09-09	[]	on dearest friend jennyzarin launch new websit blow brain
774010613093830656	2016-09-08	[]	remind see suspicy behavio pleas report
774010210977509377	2016-09-08	['#modernr']	@johnlewisretail launch collect stor today read
773998761907523584	2016-09-08	[]	wolfgang2242's photo pur gold
773835437299359745	2016-09-08	[]	hurray anoth on pinch mom i've join forc @labante_london
773599132359467009	2016-09-07	['#paralymp']	welcom back @thelastleg miss let awesom com
773595418659844096	2016-09-07	['#vintagevell', '#nyc', '#bohem', '#clickthelinkinmybio']	back day erezsab
773583892297158656	2016-09-07	['#animalhono']	gre see @thewhitmore embrac sv styl look award tonit
773527958044762116	2016-09-07	['#fash', '#thestylishstuff']	miss @shellyvella cosmo checkout new onlin magazin week's issu lux
773525657737392128	2016-09-07	['#modernr', '#thestylishstuff', '#clickthelinkinmybio']	ment latest post gem
773256535929720833	2016-09-06	[]	bravo clev friend annastathak lov pict @sundays_london
773207613140037632	2016-09-06	['#olympuspenepl7', '#clickthelinkinmybio', '#photograph', '#styl']	flex @olympusuk
773177709577003008	2016-09-06	['#clickthelinkinmybio']	high london johnlewisretail rooftop gard
773172384945827840	2016-09-06	[]	@wendycarrig thank wendy xxxx
773131787195314177	2016-09-06	['#modernr']	today's post celebr immin launch thursday johnlewisretail
773093715892137984	2016-09-06	[]	sad hear pass legend hair car guru @philip_kingsley
772830346660417537	2016-09-05	[]	tip top day geoffreyw @timcrespinhair rubyham
772777376577183744	2016-09-05	[]	yep mak perfect c rubyham ev martinelervik @milkmanagement
772735713934774272	2016-09-05	['#bts']	joshuasanderss dar @harveynichols
772689222083969024	2016-09-05	[]	sur izzy got memo cool sit lik
772546684530417664	2016-09-04	['#vintagevell']	night @cloutierkim benriggottphoto lisavalencia1 on miam arch
772527890537844736	2016-09-04	[]	mean
772496735348359168	2016-09-04	['#horsesofinstagram']	travel prophet
771757058202988544	2016-09-02	['#thestylishstuff']	maj mak crush pur mak blush @ritueldefille
771703628830744576	2016-09-02	['#thestylishstuff', '#clickthelinkinmybio']	miss gem stil first read
771640320018649091	2016-09-02	['#themusicsavedm']	thank @thewhitmore @daisy_jewellery beauty pend
771376832188977152	2016-09-01	['#bts']	hang beauty today @thewhitmore
771310008038400000	2016-09-01	[]	work on fav today found blushy pink @toga_archives beaut
771253512319578112	2016-09-01	[]	loc shoot today here's on arch origin story lurk
770993943219757056	2016-08-31	[]	lif giv bag beauty bloom metaph speak
770875848769544192	2016-08-31	['#thepool']	wom vil first get old get plast surgery @thepooluk @salihughes
770665221082013696	2016-08-30	[]	fant littl saunt dappl light deer fil forest check
770564465989447684	2016-08-30	[]	@caryn_franklin cal away
770302563069595648	2016-08-29	['#savetherhino']	prop booty
770167438373744640	2016-08-29	['#thepool']	gre read stop follow thin beauty whit wom instagram @thepooluk
769810427110981632	2016-08-28	['#thestylishstuff']	found anoth spirit anim pot world
769627891126657025	2016-08-27	[]	beauty mum sunday school lov pic
769586804790026241	2016-08-27	[]	@caryn_franklin oh ye indee send mobl dm
769425284911210496	2016-08-27	[]	test drov fac masqu morn mass impress ric grain gent exfo
769171776991535105	2016-08-26	[]	@johnno663 cours sunshin
769124482250379264	2016-08-26	['#thestylishstuff']	may every day off coconut ful exot fru tre
769098170592821248	2016-08-26	['#thestylishstuff', '#crueltyfr', '#clickthelinkinmybio']	today's post beauty
769085694945943552	2016-08-26	['#crueltyfreecosmet']	clos littl hippy heart import subject
768875548869332992	2016-08-25	['#thestylishstuff']	lov @lisagoody cam countrysid spec shoot
768699986607562752	2016-08-25	[]	@nolahoney good tip not discrep model stil lif shot
768699838255001600	2016-08-25	['#thepool']	lov cout leg sery @thepooluk
768506878565445633	2016-08-24	[]	av wednesday ev
768369473980080128	2016-08-24	['#crueltyfr', '#beauty', '#bts', '#comingsoon']	yesterday upon head natashakasatkina555
768118257219842049	2016-08-23	['#thestylishstuff']	took behind scen today 's day frithsd
768045165089005568	2016-08-23	['#bts']	play forest today natashakasatkina555
767971324593602560	2016-08-23	[]	belov boho max bat @converse mickey swe milit jacket last
767968609821986818	2016-08-23	['#regram', '#nat', '#fash']	beauty camer @lachlan_bailey inspir day
767831836496171008	2016-08-22	[]	@luciekerley @canva @instasize investig thank tip lucy pointless chang
767825100246769665	2016-08-22	[]	dear @instasize thank absolv ruin gre ap remov text facil kil ap
767814697877897216	2016-08-22	['#thestylishstuff']	oh ye peopl i've dress shop favourit kind flo
767813469001375745	2016-08-22	[]	today's post best boho dress buy
767812897976229888	2016-08-22	['#asktwit']	anyon know text set instas gon pan
767126202368794624	2016-08-20	['#thestylishstuff']	mood board mak crav rav
767071940725145600	2016-08-20	[]	aaah last belov @alfordarmshp1 reop long sum wait
766914743877730304	2016-08-20	['#bohem', '#thestylishstuff']	plot oh pretty thing
766908187148709888	2016-08-20	['#thestylishstuff']	up boho gam weekend work excit post
766706879380807680	2016-08-19	[]	he's handsom dud although cat going quit miff tardy
766676836252352513	2016-08-19	[]	may sky turn back blu weekend sun shin thank @fullerton_fash week
766408083648176129	2016-08-18	[]	on favourit inst account wolfgang2242 alongsid @thisispumpkin check
766336261263089664	2016-08-18	[]	rememb mom capt mean streets nyc theoriginalgangst look lik
766250291092189184	2016-08-18	['#thestylishstuff', '#bohem', '#floatingmybo', '#fash']	predict moi half
766224847395512320	2016-08-18	[]	week i've @stylistmagazine cov lov @fullerton_fash whilst
765984694366330880	2016-08-17	['#thestylishstuff']	sunshin bohem flo fod
765805996379889664	2016-08-17	[]	jacket com piec wardrob patch embroid trim cam
765627857884344321	2016-08-16	[]	ar hom unexpect littl box pur joy on favourit
765442629664403456	2016-08-16	[]	rol bad boy sort sleev nee styl thank
765262888571432960	2016-08-15	['#crueltyfr', '#regram']	tru every singl way legend @jjmakeup
764923096696578048	2016-08-14	[]	thank jennyzarin beauty pict sum tonite's rid big field
764841204106264576	2016-08-14	['#thestylishstuff']	regul loung wear @ellandcee meet @adidasoriginals mag hap
764840276116512768	2016-08-14	[]	
764840059099021312	2016-08-14	['#mimiholliday', '#luxurylingery', '#sundayfunday', '#weekend', '#lov']	sunday vib toff com soon @shellyvella ht
764552706656768000	2016-08-13	['#catsofinstagram', '#burmeseofinstagram']	chi bear he's boss hous
764547912462467072	2016-08-13	['#burmes', '#catsofinstagram']	izzy angel alway beauty
764400905613635585	2016-08-13	[]	long tim lov affair @ghost_fashion brodery angla blous bar
764381542986678272	2016-08-13	['#thestylishstuff']	on stor six gre pair sho check simply
764098457464344576	2016-08-12	[]	@emmalouisemaw thank emm xx
764098372894461952	2016-08-12	['#interview', '#fridayfeel', '#travel']	check interview fab tal fash direct @shellyvella htt
764087025209192450	2016-08-12	['#thestylishstuff']	today's there's littl lov affair going rath lush
764010738830548992	2016-08-12	[]	lov sho lik get styl valu comfort on perfect pack today's post
763688511073640448	2016-08-11	['#lamb']	aaaaah perfect @laurenlaverne @bbc6music
763642724897751040	2016-08-11	['#thestylishstuff']	com friday's on stor six pair sho simply nail
763334353388789761	2016-08-10	['#styleyecon']	bit smit new marcjacobsbeauty palet bronz eyeshadow
763290599265107968	2016-08-10	[]	morn
763075389279395840	2016-08-09	['#thestylishstuff', '#clickthelinkinmybio']	yup big pant thing today's post liv
763065950967066624	2016-08-09	[]	nod olymp lov lingery today's post celebr beauty
761955893399396357	2016-08-06	[]	
761884795060293632	2016-08-06	[]	@shellyvella @tvkev @henriettak @streetworker01 pleas could promot stubbington anim shelt thank
761835527838523392	2016-08-06	['#thestylishstuff']	week's post tak peek insid tard lik bungalow that's giv
761605835667730433	2016-08-05	['#thestylishstuff']	un peek itsmoniquedun @wgarrettjruk today hair
761528431217668096	2016-08-05	[]	beauty beauty lac shellbellecout ton taut tummy @elle_dowling
761493346221170688	2016-08-05	[]	morn
761448578778816512	2016-08-05	[]	necklac wear every day fact on tak eleph
761303128918650880	2016-08-04	[]	technolog
761276598930837504	2016-08-04	['#thestylishstuff']	today's post bit spesh got nosey around &amp; check chic
760935349132652544	2016-08-03	[]	bb fundra facebook pag pleas rt &amp; don @tvkev @henriettak @shellyvella money
760783167678808065	2016-08-03	[]	mov day par
760556780371976192	2016-08-02	['#freakyf']	mom real precy @virginatlantic memb slip good girl gold silv
760520038768078848	2016-08-02	[]	i'm act hank sid striped track pant forg waistband
760488444032344064	2016-08-02	['#thestylishstuff']	bit favourit post retro denim fav tee shirt
760398169381494784	2016-08-02	['#regram']	muahahahah thought count @chloegrayling
760155572645797888	2016-08-01	[]	uk brand drop hear cruel behind feath item
760083669600141312	2016-08-01	['#techtrauma']	on grumpy fac bet penelop
759502377573580800	2016-07-30	[]	@soldierstale ashridg nat trust est tr gorg
759408932414713860	2016-07-30	[]	om
759372739677413376	2016-07-30	[]	
759144210448715776	2016-07-29	['#doubleser']	rainbow patch rejeuv ev two @clarins_uk
759022159943634944	2016-07-29	[]	beauty littl dog nee hom photo
759016924445446144	2016-07-29	[]	littl weekend styl inspir courtesy @shellyvella feat ramon @donnaida
758985825350619136	2016-07-29	['#thestylishstuff']	shop shoot yet head afford
758941897595289600	2016-07-29	['#regram']	oh ye friday sery booty @beautyshortlist
758928532693131265	2016-07-29	[]	@jaymclaughlin's photo
758912376007643136	2016-07-29	['#posit']	crazy topsy turvy world on way
758767110533283846	2016-07-28	['#thestylishstuff']	mood ear year @lewishayward @rebeccamcm_mua ad &amp;
758627401022709760	2016-07-28	['#jdfitwithfashion']	haut kick jdwomen pha_med
758614168194916352	2016-07-28	[]	@francesprescott liv
758353387780014080	2016-07-27	['#jdfitwithfashion']	@phaconsumer team @jdsportsfashion press day big thx @gizzierskine &amp; @shellyvella
758332307732324352	2016-07-27	[]	littl rooftop dat @dowerandhall yesterday perv shiny new collect
758272596953759744	2016-07-27	['#stylishstuff']	beauty new shoot @shellyvella @wendycarrig @francesprescott @models_1 @
758246032035708928	2016-07-27	['#thestylishstuff']	blu mood today blu denim blu eyeshadow blu nail pol
758242617675112448	2016-07-27	['#jdfitwithfashion']	seem first cho wear jdwomen ev bang
758231126536224768	2016-07-27	['#jdfitwithfashion']	liv direct jdwomen ev i've cur fash
758174412839477248	2016-07-27	['#thestylishstuff', '#clickthelinkinmybio']	sum denim must hav liv go via menu
758047250778091520	2016-07-26	[]	lov denim fant littl light 70's styl week's post
757989711839240192	2016-07-26	['#thestylishstuff']	photograph beauty martinelervik today seen wear
757955542878973952	2016-07-26	['#jeansforg']	thank much fab judg @shellyvella look amaz tee
757954685676421120	2016-07-26	[]	sneaky peek today's shoot stun beauty
757897908909907969	2016-07-26	[]	harvest mic squirrel turtl dov curlew new favourit ros
757652950168797185	2016-07-25	[]	meet instagram account on coolest styl peopl know nicolastlou
757625574680649728	2016-07-25	[]	thank judg @jeansforgenes here's win tee
757568257683578881	2016-07-25	[]	year tak lunch break seem pop round jennyzarin freel
757520949310881792	2016-07-25	[]	dear @jdsportsfashion temptress
756959340309975041	2016-07-23	[]	mem cam facebook fee tonit year sint collab
756774250586013696	2016-07-23	['#carwash']	buy mean real thing right wildfoxcoutureuk aso @paigedenim
756589629936205826	2016-07-22	['#thestylishstuff']	@wildfoxcouture tee dream avail aso com soon
756376901657227264	2016-07-22	[]	@wendycarrig midst magn bloom @jesslucyharris 's gard yesterday
756224149476020224	2016-07-21	['#thestylishstuff']	thursday's child chil retro denim sneak peek next week's post
756107226625011712	2016-07-21	['#thestylishstuff']	shoot rath beauty loc today @jesslucyharris
755995799188832256	2016-07-21	['#thestylishstuff', '#nostalg', '#denim', '#childhoodtshirt']	watch spac fut post
