id	created_at	hashtags	cleaned_text
1092852014504132608	2019-02-05	[]	on got away last sunday @youmagsocial main fash feat la bel janeaudedevil @lv_jenkins chambray blous enough ruffl nod trend yet remain
1092046712732999681	2019-02-03	['#tapforteam']	today @youmagsocial check fash story celebr cloth underst yet sexy; wardrob must worn right simply exud feminin
1089903020924649474	2019-01-28	[]	last leg hid away undernea lay knit coat top miam dress lin yep ullajohnson beaut say
1089208940464955392	2019-01-26	['#jlswim']	pack excit miam bound lov team @johnlewisretail ee @hula_hannah sun sea shoot swimwear oc
1087614640295739392	2019-01-22	['#alibab']	maj tun @laurenlaverne @bbc6music
1087427285416849414	2019-01-21	['#tapforcredit']	anoth littl tast weekend @youmagsocial main fash boy good look spruce weekend wear
1086614031706804224	2019-01-19	[]	littl behind scen vid weekend @youmagsocial man fash story big thank photograph video direct @jrowley1 tip top crew; @rubymakeup
1086348154734346240	2019-01-18	[]	weekend @youmagsocial wear trous kind affair ye talk trousers; tail denim peg top swing wid leg also
1084368703419023360	2019-01-13	[]	moody blu night whit satin [original footage] 1967 via @youtube
1084184149152407558	2019-01-12	['#dontmissout']	miss tomorrow @youmagsocial gorg knits; bril beauty bargains; delicy speedy past dish plu ton gre cont thank team
1084090493401587712	2019-01-12	[]	week @youmagsocial tak trip wild norfolk test driv best cosy wint knitwear think clot cream warm beig ton slouchy room cut
1083118275968540672	2019-01-09	[]	act foot com hom pub get bed
1082660456001605632	2019-01-08	['#veg', '#youmagazin', '#thestylishstuff']	bravo @lv_jenkins lov heel definit lust list onlin buy thursday
1082545366921297920	2019-01-08	[]	start day look beauty piec artwork amaz charliemackesy dream wal
1082365156347252738	2019-01-07	['#tapforteam']	on got away weekend @youmagsocial lux loung story @stellamccartney del slip teddy bear card
1081954873682341889	2019-01-06	[]	today @youmagsocial celebr luxury loung wear good worn chil chez model beauty @riannehaspels photograph
1081458412435705856	2019-01-05	[]	@acute_tweetment ad
1080512593595428865	2019-01-02	[]	happy new year wel mayb fox pleas rt
1080511160942804992	2019-01-02	[]	zoo right geoff first day we'll start easy pop panda &amp; squirt medicin mou
1078047437745516547	2018-12-26	[]	imagin smoo cat
1077905453294718976	2018-12-26	[]	said donn see embarrass
1077903439366103040	2018-12-26	[]	thank friend al rath en point tee read girl anim show red head eleph dog donkey head psychedel hippy sunr
1077196496049704960	2018-12-24	[]	wel grudg
1076970161578692610	2018-12-23	['#shadwel']	firefight rescu cat flat fir march gav oxyg colleagu @rspca_officia
1076386606825656321	2018-12-22	[]	sometim instagram throws wond smal label hitherto unknown on @madebyriley mak cool sport lux piec red hoody mad
1076034281741402112	2018-12-21	[]	oh good @jo_elvin brok car long miss avoid sid camer weekend issu @youmagsocial feat
1075351579816062976	2018-12-19	[]	wel mad day heartfelt thank @larkandberry camerontewson happy lov includ @youmagsocial jewellery story
1074754461480951808	2018-12-17	[]	@hs2ltd evil corrupt pointless thiev
1074244724809261056	2018-12-16	['#mor', '#tapforteam', '#swipeleft']	heartland territ jewellery weekend @youmagsocial london unit kingdom
1073498036356100096	2018-12-14	['#bts']	on favourit shot weekend forthcom @youmagsocial jewellery story beauty ful afford buy perfect tim christmas thank
1072981562541686786	2018-12-12	[]	also shel sery though stuck ide beauty thought christmas gift @agmonroe flor alphabet necklac direct support
1071844515965755393	2018-12-09	[]	
1071529713967992832	2018-12-08	[]	alpaca alarm hedgehog new favourit thing
1071339537509568512	2018-12-08	[]	miss tomorrow issu @youmagsocial gen spec front lov lass @dani_masdyer funny sweet wel absolv joy work
1071110602808942592	2018-12-07	[]	on got away sunday forthcom main fash @youmagsocial extol virtu jumpsuit on piec wond tak work party lik
1070234636553338880	2018-12-05	['#leavefurtopur']	think could lov penelopecruzof petauk @peta woof squeak growl etc
1068854710814298113	2018-12-01	['#veg']	ye someth smil purs piec bring littl shim wardrob boot friend week @youmagsocial endeavo find
1068808813531275265	2018-12-01	[]	sneak peek tomorrow main fash story @youmagsocial hero best cloth buy supermarket ye read right cloth lik shop tim
1067179823192334336	2018-11-26	[]	@lucy_coghlan find perfect lux bolthol norfolk cal @youmagsocial country pil day every room art chos flow plac
1066779636846211072	2018-11-25	[]	boudoir feel chil sunday
1065692858408202240	2018-11-22	[]	oh everyon would consid littl lif din
1065154446982823936	2018-11-21	['#plantbas', '#artydelicy', '#shutupand']	mean thank @warehouseuk redchurch cecconisshoreditch shoreditch
1064458865289424896	2018-11-19	[]	fal head heel folky bohem velvet kimono @fcuk honest black wool vert many year ago lov wear
1064174515242975233	2018-11-18	['#checkyouout']	anoth teas today @youmagsocial ilabic wear tommyhilfig story thank team tomcorbettnyc @bduprey @bradleyirion @lucy_coghlan @joaannne new
1063911106983460864	2018-11-17	[]	jet nyc photograph week @youmagsocial fash story celebr modern versatil check trend sold nev test driv
1063835207965569024	2018-11-17	[]	cut fact overload
1062048787995054080	2018-11-12	[]	pretty littl thing maggie_jablonski rath luscy zar cashm body photograph @youmagsocial @egibsonphoto styl &amp; art direct cast @lucy_coghlan mark
1061668946049490944	2018-11-11	[]	lush cashm put christmas list week @youmagsocial feat beauty maggie_jablonski photograph @egibsonphoto thank @mioknyc @robinschoenmu
1061543719319539712	2018-11-11	[]	
1061184582056271873	2018-11-10	['#lilyandlionelgirl']	lov includ campaign happy birthday @lilyandlionel ðŸŽˆ
1060249130759544832	2018-11-07	[]	first tim catwalk liv nam
1059896600326258690	2018-11-06	[]	dear @mungomaud hearty thank bear shy roo beauty new toy ad bear lov on littl green
1059493518320660503	2018-11-05	[]	don liv crazy comput lifestyl us deeply edg 24 littl medit why troubleshoot way
1059350326669541376	2018-11-05	['#thestylishstuff']	today post talk stress advers effect day day nat wel guru @jogbliving pen word wisdom
1057916731233128450	2018-11-01	[]	every year pres milit men wom marylebon mak day beauty way greet morn commut @poppylegion @chilternrailways
1057733844995112963	2018-10-31	['#veg', '#crueltyfr']	dear @garnieruk ye gre produc
1057603868845113345	2018-10-31	['#naughtyshel']	fin tre sav teeny tiny littl bee @agmonroe nestl @missomalondon spik ind eleph find sav
1056984685451063301	2018-10-29	[]	modern class indee bravo @jaegerofficial back bang sery wel mad lux cloth wardrob longev fun nyc bridg dawn
1055889346665086978	2018-10-26	[]	weekend issu @youmagsocial anoth feast fash feat food fab beauty adv littl teas mak sur pick cop sunday morn lov
1055887713944006657	2018-10-26	['#veg', '#winterboot']	excit bad boy week @matt_and_nat ar chez moi today lat night shop begin week
1055712058866581504	2018-10-26	[]	tim
1053550807382147072	2018-10-20	[]	daydream return spellbind plac norway trip @boundperfect last year sup tal @jrowley1 lisavalencia1 solveiglund part work
1052618077802762240	2018-10-17	[]	sery chiltern last night chuck chalfont tonit zero serv ev both reply annount shambol
1052273525543788544	2018-10-16	[]	thought sit lug rack bad enough @chilternrailway yet chuck train chalfont enjoy dir serv commun 8pm joy
1052272851749937153	2018-10-16	['#watchthisspac']	wel hello london today shoot @youmagsocial @corinthialondon someon rath lov
1051495760938889216	2018-10-14	[]	best thing seen long tim
1049808585025355779	2018-10-09	['#vintagevell']	kil heel blu ski miam @jennifermassaux @bduprey
1048928884039852034	2018-10-07	[]	
1047013626874408960	2018-10-02	['#sequin', '#camoufl']	alway on shoot tempt wear striped sneak forget mus mov beoplay_store headphon
1046857040893829125	2018-10-01	[]	lov del littl beauty onehundredst hand mad hand screen print stress much inexpend kimono impress
1046378590483476480	2018-09-30	[]	today main fash @youmagsocial high fiv myriad way wear pencil skirt look gre short tal curvy slim wom look hem length
1046377894065442816	2018-09-30	[]	@hportas @youmagsocial @jo_elvin thank @hportas
1045997787735715841	2018-09-29	[]	everyth prophet
1045945619666407424	2018-09-29	[]	anoth beauty got away @youmagsocial pencil ready story lov titl goe skirt @currentelliott shirt @equipment_fr boot @duneprteam sunny
1045939557416554497	2018-09-29	[]	on got away weekend @youmagsocial celebr virtu pencil skirt wardrob piec com myriad styl @altuzarrastudio beauty worn
1045360637168287744	2018-09-27	['#stan', '#williammor']	@fcuk skirt wardrob ad vint @schuhpr oh kettnerstownh wallpap
1045234663680356352	2018-09-27	['#kensington', '#cheryl']	day blow dry yesterday rath wond @danielgalvinldn honest mad feel gre someth akin say
1044678447971409921	2018-09-25	[]	beauty prophet
1044491536153677825	2018-09-25	[]	suit quit revel found men depart @lv_jenkins fit beauty boast lux purpl satin lin glossy rev coll fin satin
1043944170677829633	2018-09-23	[]	
1043927360922255360	2018-09-23	[]	@shopatbluebird flick artwork avoid direct ey contact camer wear @me_and_em blous @isabelmarant trous shop bluebird
1043908718642057218	2018-09-23	[]	lov shot beauty @riannehaspels today @youmagsocial top team beauty loc blous @joie_clothing trous @sandroparis bag @manuatelier photograph
1043570403590000641	2018-09-22	[]	dress dream @acurrentaffair
1043504510751199232	2018-09-22	[]	yep sneaky peek tomorrow main fash @youmagsocial @jo_elvin said lik man delmont mom read dead proud on
1043460680995749888	2018-09-22	[]	on shot got away sunday rom ton within @youmagsocial fash pag lot delicy blush lat hue cours beauty wear
1043226775705112577	2018-09-21	[]	littl shoot @rexindranath @youmagsocial see ful story sunday issu bas fess spend much tim pj bottom stint
1042831850169946113	2018-09-20	[]	@chilternrailway supply tax bus chorleywood chuck us train wait 30 minut plu mak annount poor
1042826967165358081	2018-09-20	[]	@chilternrailway stand cold platform chorleywood warm train sit non us go anywh let us comfort
1041955514610065408	2018-09-18	['#fashiondirectorscut']	wear lux vary @burberry @youmagsocial
1041250976248852481	2018-09-16	[]	today @youmagsocial chock ful fab fash includ trend must haves; liz jon fash triumph disast littl fash story mad
1040966189072232448	2018-09-15	['#fashiondirectorscut']	want @markuslupfer wom pastel pref shimmery sequin sporty striped @youmagsocial
1040917025948946434	2018-09-15	['#swoon']	alicearch
1040876440722583552	2018-09-15	['#madebym']	cas today show nee hum glitterbal wear favourit camoufl jacket @lv_jenkins perfect whit shirt sery crush skirt @fcuk
1040709210114162689	2018-09-14	[]	classy simpl trench wrap knot waist; delicy slith pencil skirt edg lac worn sport lux bomber; del blush ton
1040653598697369605	2018-09-14	[]	weekend first off issu @youmagsocial pleas work legend exud confid styl
1039610190860111872	2018-09-11	[]	dear @stuartvevers thank mak sweatshirt want sint year old absolv perfect slip dress right coach alway ad lust
1039518697294127105	2018-09-11	['#fashiondirectorscut', '#justthewayyoulikeit', '#nyfw']	oh @zimmermann_ cut volum colo palet print perfect
1038517341041119232	2018-09-08	['#lfw', '#itmat', '#fact']	bravo @bfc stat bravo petauk @palomafaith gentl persuas room cruel fash
1037072341132619778	2018-09-04	[]	tot rel
1036520802018095104	2018-09-03	['#natural']	on latest shot @agmonroe launch collect shot febru word lie hand almost froz camer poor
1034894465465339904	2018-08-29	[]	tru logo tee thought vis job pour look book select must hav shoot day day thank @barbourint
1034886027364556800	2018-08-29	[]	thank @barbourint allow work latest collect exclud shoot websit @missbobene lisavalencia1 talk candid
1034128327861329920	2018-08-27	[]	go wood today
1033768398428229633	2018-08-26	[]	cut overload tru hop mak day bet
1033358965969760257	2018-08-25	[]	
1030568590548893696	2018-08-17	['#bts']	two trend capt on cool shot @fannyadamss feat @rexindranath rock leopard print tru hot chocol
1029087135146622977	2018-08-13	[]	dear @converse mass glob company pretty poor websit act work stock two day someon shop paid
1026904257843355649	2018-08-07	[]	stil embrac heatwav discov gold daz sum @shellyvella feat yuzu pink
1026571864305328128	2018-08-06	['#thestylishstuff', '#crueltyfr', '#nat']	new post liv celebr beauty jewellery @escapejewellery hero beauty produc art direct
1026116070698938369	2018-08-05	['#comingsoon', '#thestylishstuff', '#watchthisspac']	week high fiv new nat skinc kid block showcas beauty jewellery @escapejewellery art
1025695178760364032	2018-08-04	['#milliejackson', '#icry']	@bbc6music tun
1023322356452917253	2018-07-28	[]	oat milk hot choc; favourit book spritz @amlybotanicals beauty sleep mist swift follow sleep tight rejuv fac balm light mass skin
1023093201371115520	2018-07-28	[]	
1022952329887277056	2018-07-27	[]	@popularpups @hollycooop
1022915681484910593	2018-07-27	['#thestylishstuff', '#and']	new post pra johnlewispr littl boho guil pleas also rath gre mak pick @becca_cosmetics @francesprescott
1022841307910348800	2018-07-27	['#thestylishstuff', '#and']	today post celebr gorg la vib beauty johnlewispr collect 70 mustard hued blous lush red velvet shop
1022531034750050305	2018-07-26	[]	man remov train next train
1022397821889261568	2018-07-26	['#and']	honest nev real want jumpsuit miss party consid bit faff howev littl beauty johnlewispr
1021828222479216645	2018-07-24	['#thestylishstuff']	sneaky peek today shoot brazil beauty @lh_vic @selectmodelmgmt hid harsh ray johnlewispr rooftop wear @johnlewisretail
1021642635151327232	2018-07-24	['#thestylishstuff']	shoot johnlewispr rooftop today anticip sery scorch min oblig sunscreen tint moist hat wear
1021512007672061953	2018-07-23	[]	ad baby eleph get dizzy chas bird
1021510873079271425	2018-07-23	['#regram', '#bekind']	@petauk
1021414463671500800	2018-07-23	[]	@saschacamilli @by_blanch @beyondskintweet @nr_rapisardi @matt_and_nat @bhavastudio @insectashoes thank xx
1021390600715886597	2018-07-23	['#veg', '#thankyou']	miss sourc best styl sho thought feel fre ping way @saschacamilli
1021320156495171584	2018-07-23	[]	standard look someth spec cas perfect trous get back ful tim work stride get distract norm
1020958784347410433	2018-07-22	[]	@yupthatexist @bduprey
1020785441736306688	2018-07-21	[]	sometim stop tak stock everyth real many hurdl overcom near 12 year ago prophet cam lif definit lov first sight
1019670591937417221	2018-07-18	['#dog', '#deaf']	deaf blok sign 'walkies' deaf dog lov 10 credit jakela via reddit
1019670563030208512	2018-07-18	[]	rocky sheepdog puppy herd entir flock own kitch 'border col puppy rocky proud led nin sheep int
1019670152554704897	2018-07-18	[]	@shellyvella set join @youmagsocial
1019623975809363968	2018-07-18	[]	gorg afternoon surround beauty rescu pup delicy doggy hum tea tre ye shar dog veg peanut but cooky high fiv
1019257594635083778	2018-07-17	[]	pleas read &amp; shar seem memb appal hunt commun get away gbh bbc n
1018857749525000192	2018-07-16	[]	sort idea spawn clev sculpt littl met dress spot gre missend alphabetsoupgm today imagin favourit piec cloth immort
1018819563415310337	2018-07-16	[]	pleas join i've sign petit bear gryl stop bear gryl exploit marin anim adv park
1017873519995248640	2018-07-13	['#thestylishstuff']	cal red head seek nat hair colo expery check latest blog post joy kick chem ens hair
1017735774643597314	2018-07-13	[]	brit brand @barbour latest join grow list company ditch mohair thank
1017735758474633216	2018-07-13	['#fridaythe13th']	black cat less lik adopt shelt rt show
1016985997890879488	2018-07-11	[]	see rath clev colo alchem claredrawbs7 @harissalon today part two reintroduc joy non hair colo clar introduc via
1016774366980378625	2018-07-10	[]	work goe proud punch uniform fact get work alongsid real lif @dwfirerescue fir
1016773444002832386	2018-07-10	[]	
1015296624569012225	2018-07-06	['#volume2']	littl clos tee on favourit smal eth company @rapanuiclothing feat @boundperfect photograph jennyzarin mak
1015289166572195840	2018-07-06	[]	thank fav styl journo @shellyvella bril shot best sel stevy max dress
1015289132208263168	2018-07-06	[]	chuff lov post fee fab @shellyvella respect hug smal
1015289104144138243	2018-07-06	[]	joy see first visit on favourit beauty destin @beingcontent lov @shellyvella
1015288166260101120	2018-07-06	[]	peopl nee put bag seat look real indign ask sit
1014971606865760259	2018-07-05	['#nat', '#crueltyfr']	tre visit @beingcontent bulstrod street w1 today recommend @rebeccamcm_mua mecc beauty delight canvass
1014809854656032768	2018-07-05	['#penf']	flex littl @olympusuk rec mak sery pict celebr ten year icon @agmonroe bee found black eld ye bee
1014457283001180161	2018-07-04	['#justadds']	pj top pretty stay hom flor print pj top soft lac bra @bouxavenue jean @currentelliott jewellery @accessorize
1014456249960853505	2018-07-04	['#zforaccess']	tak on pretty piec lingery ie gorg @bouxavenue body pair favourit fit jean @currentelliott pil jewellery @accessorize
1014246458709725189	2018-07-03	[]	@hedgehogsociety
1014035620082143233	2018-07-03	[]	sur heard yulin chines dog cat meat eat fest pict real ev incred upset im
1012432788514058240	2018-06-28	[]	shel vell join magazin fash direct @youmagsocial @shellyvella
1012432728434802690	2018-06-28	['#sustainablefash', '#photograph']	mor fibr story @shellyvella jenny sarinz vol avail ord fr
1012100360939474944	2018-06-27	['#iammichaeldowd']	whilst pow seek swerv respons grenfel tragedy foc blam emerg serv most retweet tweet wish half brav incred selfless firefight
1012098860305567755	2018-06-27	['#iammichaeldowd']	
1012098118568022016	2018-06-27	[]	shal blam govern lack reg shal blam contract meet reg shal blam cheap
1011982698250981377	2018-06-27	['#thestylishstuff']	@luckylisat mom shop sum frock on photograph florencero last year slip shop net
1011931424868446208	2018-06-27	['#iammichaeldowd']	
1011910622777405440	2018-06-27	['#iammichaeldowd']	bravest man know proud cal broth
1011910374268993536	2018-06-27	[]	firefight 30yrs serv wm michael dowd fac imposs task grenfel inferno brav le
1011910282283831296	2018-06-27	[]	dar quest abl profess act man tak long hard look themselv
1011910226449260545	2018-06-27	[]	mik dowd along every firefight attend grenfel show hero profess throughout &amp; fbu stand
1010796855024865280	2018-06-24	['#thestylishstuff']	might slouchy trous tee right head look lik @bhenriett @ellandcee photograph nee trip
1009755955184013312	2018-06-21	[]	roo resist wak
1009487485376827392	2018-06-20	[]	dress ye velv smoo
1009334144051052544	2018-06-20	[]	sid stripe jean iden_denim
1008611837942870016	2018-06-18	[]	high fiv high street stor mak
1008460012497375233	2018-06-17	[]	let count way lov ear
1008359321489625090	2018-06-17	[]	palm oil destroy rainforest pleas join &amp; tel eu drop biofuel sav orangut tig tel
1007607818214490112	2018-06-15	[]	sum lov indee sneak peek
1007607036924719104	2018-06-15	['#bts']	shoot wond @agmonroe
1006980449820766208	2018-06-13	[]	oh beauty off team
1006777948958060546	2018-06-13	['#thestylishstuff']	reflect new post
1006624353075777536	2018-06-12	['#thestylishstuff']	today post
1006505243188842496	2018-06-12	[]	day fil colo thank
1005454100635545600	2018-06-09	[]	mad day yesterday gon got new job
1005127165095174146	2018-06-08	[]	excit annount appoint
1003971218595241984	2018-06-05	[]	lov fash illust feel
1003275514885308416	2018-06-03	[]	thank emmaelwickb shar
1002910736690176000	2018-06-02	[]	saturday
1002467598968254465	2018-06-01	[]	poor badg tory learn murd anim vot win good quest everyth b
1002467348912181248	2018-06-01	[]	perfect bound @boundperfect volume launch today four gre cov four gre photograph andrew macpherson @amacfl
1002460106691416064	2018-06-01	['#volume2']	anoth preview gorg
1002244827231195136	2018-05-31	[]	kind dreamy stat mind must frankincens lov chum post @shellyvella beauty websit
1002211894164410368	2018-05-31	[]	honest real good day
1002137026546761729	2018-05-31	[]	celebr launch @boundperfect
1001578538036809730	2018-05-29	['#volume2']	@boundperfect print
1001536294701367298	2018-05-29	['#thestylishstuff']	new post sing pra
1001404157423706112	2018-05-29	[]	@francesprescott @junglepersian
1001101779562565632	2018-05-28	[]	
1000487525016842240	2018-05-26	[]	flash back sunny day shoot john
999946111413637120	2018-05-25	['#fbf']	gorg trip wond peopl
999687461545627648	2018-05-24	['#thestylishstuff']	check arch post
999584630671118336	2018-05-24	[]	found beauty new shoot loc
998853784158769152	2018-05-22	[]	@tangerinedaily @tfl @citymapper thank much
998467094193889280	2018-05-21	['#rip']	bil gold legend graph design mast icon film post
998268126461644800	2018-05-20	['#tribalm']	sun shon team today
998158767253610496	2018-05-20	[]	bathroom cutest littl crew
997458332242923520	2018-05-18	[]	sery @tfl rout plan ap send absolv wild goos chas adv get harrow hil ev jubl lin train simpl going straight marylebon grumpy fac
997247738491252737	2018-05-17	[]	hono
997105216775340033	2018-05-17	[]	gorg grass snak rescu pond net bril condit &amp; quit good siz lucky vet
996800937204338688	2018-05-16	['#pangolin', '#mostw']	ok yesterday learnt persecut via @bbctwo program heartbreak yet anoth beleagu specy hunt extinct as afric @pangolinsg @projectpangolin @savepangolins help
996467826339860481	2018-05-15	[]	ok red carpet styl real thing may know
996356474736693248	2018-05-15	['#thestylishstuff']	today post celebr tim hono lov
995717745764421632	2018-05-13	['#baft', '#nomin']	introduc beauty
995651203206991872	2018-05-13	[]	tre stun print @mrdanhillier today
995424738746028032	2018-05-12	['#thestylishstuff']	pretty littl wal art thing @bigskygtmiss
995197775351558144	2018-05-12	[]	bought pair eco friend pal blu denim jean week
994282835648417798	2018-05-09	[]	wond beauty edit friend know
994279359304405002	2018-05-09	[]	know someth fresh pur keep
994165310289858562	2018-05-09	[]	@charlotteswebuk com sooooon xx
994165270783627264	2018-05-09	[]	wond fash styl @shellyvella styl stuff blog feat bangl instagram fee last
994165198654201861	2018-05-09	['#modernmus', '#styl']	continu interview sery turn superst @shellyvella shel spent 15 year @
994147581474164737	2018-05-09	[]	thank wond emmawallacedesign includ
993937059797786624	2018-05-08	[]	beauty thing someon list cat blanchet opt
993821775644553216	2018-05-08	['#thestylishstuff']	wel littl post last week definit
993431778353471489	2018-05-07	[]	
992023174178050050	2018-05-03	['#nothroughroad', '#spee']	@tvp_aylesbury might find gre way mak shed load cash set spee trap artic lorry sent @aylesburyvale prevy green end street aston clinton
991922311849750528	2018-05-03	[]	let fac weath sery schizophrenic last mon
991799255261237250	2018-05-02	[]	nev on hold back excess jewellery wear habit
991778542513016832	2018-05-02	['#penf', '#swip']	bear giv lov littl mom
991650047518486528	2018-05-02	[]	quit lik sit kne watch understand
991602555632406528	2018-05-02	[]	rememb ye good old fash polaroid
991384291769757702	2018-05-01	[]	two real good thing hap diet on week first
989980660898193408	2018-04-27	[]	alway class alway modern mak humbl whit shirt play pract
989404851070173184	2018-04-26	[]	turn temp dial notch pleas
989123190080327680	2018-04-25	[]	fan @tropicskincare sint first tri sup green nutry boost ser
988497643025428483	2018-04-23	[]	littl mont pict mad @agmonroe celebr exquisit wed
987739823904616450	2018-04-21	[]	absolv perfect day rid jennyzarin prophet &amp; lofty sunshin first alfordarm
987586233189613568	2018-04-21	[]	pench pot pack tout la johnny cash continu @demamielskin
986699410464649216	2018-04-18	[]	advert back 80s mean much air cinema chang publ
986692141589123072	2018-04-18	[]	ok tru littl obsess good reason today post celebr
986593834212757505	2018-04-18	[]	know creak old rememb tim someth sham contempt would mean minister's resignat
986592232085098496	2018-04-18	['#fashionedfromn']	poss perfect tim exhibit today preview @v_and_a
986339745843335169	2018-04-17	['#thebridg', '#bbc2']	sery com tonit tre preview episod plu q&amp;a cast @bfi @endemolshineuk disappoint
985127054915010560	2018-04-14	[]	feel lik gallop hot beach jenny zarin contribut photograph pb next issu may ht
984947138869235712	2018-04-14	[]	fant flut think @grandnational fest cruel hors liv threatened ev
984904600644812802	2018-04-13	[]	rip lead keny conserv dswt found sad pass
984831010826317825	2018-04-13	[]	excit preview im new collect daughterofabohem soon launch
984706404534685702	2018-04-13	[]	read ful honest piec genuin smart wom
983813286570455044	2018-04-10	[]	thank darrenhowel beauty press day pressy bloom beauty
983791642170806272	2018-04-10	[]	want giv littl shout antidotesworld gorg littl tee produc
983739721854672897	2018-04-10	['#volunt']	volunt nee look fost car look orph baby wild mam hom
983387830184529920	2018-04-09	[]	introduc beauty annafriel bohem al @ghost_fashion
982533856749326336	2018-04-07	[]	beauty soul @jordanrakei @maryannehobbs @bbc6music
982385858904055809	2018-04-06	[]	amsterdam may becom next city ban fur ev clos tip point thank everyon pro
982385788393607168	2018-04-06	[]	@cheycheytozzi sooo good cheyen
981920624795779072	2018-04-05	[]	
981854284424843264	2018-04-05	['#embracingm', '#feelgood']	what's 1000 tui vouch ent
981852195913166848	2018-04-05	['#corrupt', '#greedy']	@aylesburyvale council lik janet blak consid invest develop destroy landscap noth don
981850941774327808	2018-04-05	[]	council janet blak neil blak resign aylesbury val district council
981826124463443968	2018-04-05	[]	confess blush numb honest say chuck
981645514767822849	2018-04-04	['#vintagevell', '#thestylishstuff']	throwback simpl cut cle whit studio
