id	created_at	hashtags	cleaned_text
1093215755036962818	2019-02-06	[]	@dollyalderton mak cas solo travel 2019
1093207960354992128	2019-02-06	[]	pac dai lif increas breakneck spee decel might lifestyl trend
1093199646359470081	2019-02-06	[]	new year's resolv already dist mem get back track edit lifestyl ap know 2019
1093193118294462464	2019-02-06	['#beautyboss']	@sarahjossel swear glow diy skin peel
1093184547037028352	2019-02-06	[]	mak juny mal field @friezeartfair's @victoriasiddall tackl car quest
1093179011071705094	2019-02-06	[]	@joanjulietbuck form edit french vog pen mov piec quest cur psorias
1093170208167153664	2019-02-06	['#stylebaromet']	kat boswor circ blu crush maj styl inspir find els going
1093162657107136513	2019-02-06	[]	carl fernandez pedro rey cre surpr welcom concret hom mexico look around
1093155353414549504	2019-02-06	[]	almost frust sed pac read aloud ton @pinsykes
1093147808650182656	2019-02-06	[]	end job devast end rel @lottejeffs writ car grief mov los job lov
1093139252899135488	2019-02-06	[]	edit @sundaytimeslc self yog deny could six week om chang mind
1093135442508165120	2019-02-06	[]	origin cast four wed fun reunit first tim 25 year film's direct richard curt writ short film red nos day 2019 set premy march 15 maj
1093132456625082369	2019-02-06	[]	wear wint denim styl piec shop
1093116614965411841	2019-02-06	[]	97 ir apfel sign on world's promin model ag @imgmodels join lik gig hadid kar kloss icon
1093111798423797760	2019-02-06	[]	soo @tyrabanks op them park cal modelland bid bring model mass via interact entertain retail din spec ev far 2019
1093108649357119488	2019-02-06	[]	angel ahrendt vic retail appl form burberry chief execut step fiv year tech company
1093106957576269825	2019-02-06	[]	brit label @palmer_harding relaunch menswear nin caps collect @matchesfashion
1093100746474774528	2019-02-06	[]	stat belt easy chic way upd look perus pick best
1093091027106349056	2019-02-06	[]	unicod approv 200 new emod includ guid dog wheelchair sloth waffl good thing
1093086504707072002	2019-02-06	[]	legend form edit french vog @joanjulietbuck recal quest cur psorias
1093081875172769792	2019-02-06	[]	biscuit chocol cream coff @janemcfarland pick favourit piec winter's mouthw hue
1093076334799142913	2019-02-06	[]	relax expl style's resid astrolog @vonstrunckel star week ahead
1093071812253097986	2019-02-06	[]	import network support outsid work @victoriasiddall
1093067778477703168	2019-02-06	[]	ultr nomad eschew mat belong caps wardrob nonstop travel meet new 1%
1092876277231599617	2019-02-05	[]	sci sooth sunday night bing produc nee whatev skinc styl
1092868715589369857	2019-02-05	[]	abs sunshin @claudiawinkle found dazzl cap elev mood
1092861167029157888	2019-02-05	['#beautyboss']	get rady skin wint @sarahjossel shar favourit glow produc
1092853617965580289	2019-02-05	[]	heterosex lack men around kid don wel found on tee @viv_albertine lat lif dat
1092845814643412995	2019-02-05	[]	masterclass denim dress aust supermodel gemm ward
1092838265475026944	2019-02-05	[]	carl fernandez pedro rey cre surpr welcom concret hom mexico look around
1092830713223745538	2019-02-05	[]	fantast produc cost fiv che wint hair end glow review @indiaknight
1092822919535833088	2019-02-05	[]	surv kel com uk @afuahirsch discuss ag pattern fail protect black girl wom
1092815379120963589	2019-02-05	[]	pivot new car without los moment accord @tanni_gt
1092806810266935296	2019-02-05	[]	us effect ang produc galv emot @pinsykes discuss femin pow rag
1092800267043684357	2019-02-05	['#mettoo']	meet famy leg forefront revolv
1092791964754419712	2019-02-05	[]	best check piec buy styl
1092785169231200259	2019-02-05	[]	twenty favourit method self imagin horr thing peopl say behind back @dollyalderton lifetim peopl pleas fin
1092776614734282753	2019-02-05	[]	strong stabl play saf delv insid wardrob westminst
1092770065211113472	2019-02-05	['#stylebaromet']	bianc jag styl icon du jour find els going
1092763023582863360	2019-02-05	[]	meet duo behind @motherdenim cult jean brand lov gig hadid megh markl
1092753823997853696	2019-02-05	[]	soo @beyonce's mak art sir john confirm he's launch mak rang tot hap said rec interview two licens deal mak us look lik bey we'r
1092750939591766018	2019-02-05	[]	@yoox sel cur select franc sozzani's wardrob febru 11 397 gar 190 access sold rais money lat editor's eponym char
1092746625020280833	2019-02-05	[]	@farfetch becom latest retail ban sal fur join lik @burberry @netaporter ban effect decemb
1092745212517105669	2019-02-05	[]	@toofaced releas powd vert popul born way found co @jerrodblandino post sneak peek instagram weekend
1092738482240393216	2019-02-05	[]	relax declut expl read horoscop week ahead
1092726067612303361	2019-02-05	[]	joan juliet buck form edit french vog quest cur psorias
1092720237382959104	2019-02-05	[]	best denim high street welcom
1092714543472619523	2019-02-05	[]	back sarah jessic park rev carry bradshaw second tim year star @fendi's new campaign brand icon baguet bag
1092518735104131072	2019-02-04	[]	would lik rememb person want fre peopl would also fre ros park would 106 today
1092513629545644032	2019-02-04	[]	talk story past sev day
1092506333084045312	2019-02-04	[]	stat belt easy way upd look perus pick best
1092498527496949761	2019-02-04	[]	nin trend know the fash conscy man
1092491734175629312	2019-02-04	[]	feel fear feel lik voic back
1092483429676003329	2019-02-04	['#wardrobemistress']	beig bas @janemcfarland show styl new fawn
1092475491091664897	2019-02-04	[]	fulfil 2019 goal edit best heal lifestyl ap
1092468091320221703	2019-02-04	[]	stuck wint rut @claudiawinkle found dazzl cap lift spirit
1092452979695865856	2019-02-04	[]	day lif form educ secret @justinegreening
1092446185191886852	2019-02-04	[]	black girl stil seen less innoc whit peer @afuahirsch reflect kel ag pattern fail protect black wom girl
1092437890741817344	2019-02-04	['#beautyboss']	@sarahjossel pick favourit glow produc tir janu skin
1092422210923442177	2019-02-04	[]	stay chic cold season
1092416238540779520	2019-02-04	[]	aust supermodel gemm ward model new laid denim mood
1092407932988375041	2019-02-04	[]	find three planet trend set affect everybody @vonstrunckel's star year ahead
1092401138421370880	2019-02-04	[]	on moth tel heartbreak tru story xanax son
1092392578325061632	2019-02-04	[]	four way wear stat belt best on run buy right
1092385786018873344	2019-02-04	[]	best denim high street welcom
1092378490584866817	2019-02-04	[]	meet ultr nomad eschew mat belong caps wardrob nonstop travel
1092372191105159168	2019-02-04	[]	sad typ feminin anxy blam press perfect via dispens patriarch gold star @dollyalderton
1092369137828020224	2019-02-04	['#watctop100', '#pipel']	nomin op ris star award nomin amaz wom today nomin
1092363139335835648	2019-02-04	[]	joan juliet buck form edit french vog quest cur psorias
1092353570710671360	2019-02-04	[]	import network support outsid work @victoriasiddall
1092347531848310784	2019-02-04	[]	relax declut expl @vonstrunckel star week ahead
1092337966603796480	2019-02-04	[]	mak juny mal field @friezeartfair's @victoriasiddall tackl car quest
1092327901268271104	2019-02-04	[]	pow planet act mean week
1092174641555275777	2019-02-03	[]	think biscuit chocol cream cinnamon coff
1092144442931331075	2019-02-03	[]	pap lycr talk wom fre run howev pleas fact half
1092121543163998209	2019-02-03	[]	bottom lin fantast produc cost fiv che wint hair end without look lik don anyth obvy run walk grab @indiaknight's hair produc pick @joshwoodcolour
1092109208818978817	2019-02-03	[]	lov interview 'de nomadism' @theststyle week expery less thing
1092099145572204544	2019-02-03	['#beautyboss']	secret fresh lumin skin there's megawat highlight sight @sarahjossel
1092091594361180162	2019-02-03	[]	week's @theststyle column peopl pleas
1092080274584813568	2019-02-03	[]	legend form edit french vog @joanjulietbuck recal quest cur psorias sev could long walk end street
1092078069643427842	2019-02-03	[]	first piec @theststyle @laraprendergast tackl westminst fash
1092077108136955905	2019-02-03	[]	@afuahirsch confront ag pattern fail protect black wom girl
1092070204211953666	2019-02-03	['#muterkel', '#metoo']	new docu air uk week aim giv voic black wom sil long @lfpullman
1092065177502183424	2019-02-03	[]	week ago crumbl ruin brexit negoty mps receiv booklet giv upd guid wear @laraprendergast thought
1092053847441326081	2019-02-03	[]	nee adult respons lik mortg mat belong 9 meet ultr nomad
1092041763605413888	2019-02-03	[]	'just pres object enough know world end fun again' @claudiawinkle ban janu feel tim
1092031194374520832	2019-02-03	[]	high street bril denim least 45 jean weekday
1092024904675926017	2019-02-03	[]	meet @motherdenim brand trust @gigihadid worn megh first pub appear print harry
1092017606209478656	2019-02-03	['#wardrobemistress']	here's beig right accord @janemcfarland
1092009804451713025	2019-02-03	[]	four way wear stat belt best on run buy right
1092000996052619266	2019-02-03	[]	biggest styl story week new zar logo c dion biop frank terr adv pol
1091992945253863424	2019-02-03	[]	column @dollyalderton don peopl sad typ feminin anxy blam press perfect via dispens patriarch gold star
1091975578708832256	2019-02-03	[]	denim effortless vint vib season icon aust supermodel gemm ward model new mood
1091965513809489920	2019-02-03	[]	edit @sundaytimeslc say tim chang evolv cas blend work lif denim becom 24 wardrob stapl ag
1091788858050662401	2019-02-02	[]	on moth tel heartbreak tru story xanax son
1091779790598823936	2019-02-02	[]	find three planet trend set affect everybody @vonstrunckel's star year ahead
1091767456790708224	2019-02-02	[]	minim grey scand vib ovah
1091750851549581312	2019-02-02	['#beautyboss']	@sarahjossel swear glow diy skin peel
1091743555905818625	2019-02-02	[]	emot kept hard
1091736000152375296	2019-02-02	[]	saud walk door salon might wel diff dimend @louiseelisabet
1091728197169922049	2019-02-02	[]	foc declut everyth @vonstrunckel
1091723415810121733	2019-02-02	[]	com middl ag beauty rut much clich waterfal cardig hap say @indiaknight
1091713102012387328	2019-02-02	[]	mad want buy thing afford mad feel lik lazy comparison peopl tim mad feel low
1091708319578886145	2019-02-02	[]	anthropolog guid rub men internet @dollyalderton
1091701526643527680	2019-02-02	[]	welcom sapph cinem revolv
1091693977177374720	2019-02-02	[]	rec @pornhub survey say third watch gay mal porn fem attract
1091690701304356864	2019-02-02	[]	let complet uncomfort honest sustain jewellery nat bedfellow
1091683155512385536	2019-02-02	[]	hist ls hilton unpack hist pencil skirt 1950s film star boardroom brok
1091668304538845184	2019-02-02	[]	everyon goodlook girl bab men look lik jes
1091656478962917376	2019-02-02	[]	heal spa without woo woo wel fact @lauratkinson spent bliss day meadow
1091648931300286465	2019-02-02	['#wardrobemistress']	shop on thing janu let boilersuit comfy cosy easy @janemcfarland pick favourit
1091642634148425728	2019-02-02	[]	list mak fin art could chang lif accord bestsel french book
1091635842144194560	2019-02-02	[]	new year's resolv already dist mem get back track edit lifestyl ap know 2019
1091631310303567872	2019-02-02	[]	kik layn star barry jenkins' osc new film near gav hollywood talk stay ground import repres screen
1091617972119134208	2019-02-02	[]	cho mak first hour morn determin wheth produc peac mind rest day
1091418915471847425	2019-02-01	['#beautyboss']	try @sarahjossel's easy ev look nev believ much cost
1091412119386505217	2019-02-01	[]	head four easy hairstyl elev look sav much tim
1091404819657621506	2019-02-01	[]	fash art alway lov affair show ful wed
1091396264795824131	2019-02-01	[]	tim stop pand in inf say @dollyalderton
1091388967818350597	2019-02-01	[]	see way const maintain lif enjoy
1091366074333966336	2019-02-01	[]	want spend tim peopl diff perspect thing diff story learn @libbypagewrites
1091358515451650048	2019-02-01	[]	would try 7 hair transpl writ visit london clin get barnet back
1091350711214981120	2019-02-01	[]	everyth pink tast good look soc med ruin food
1091342408267239426	2019-02-01	[]	'purpose' gen buzzword du jour
1091335868516839426	2019-02-01	[]	hist ls hilton unpack hist pencil skirt 1950s film star boardroom brok
1091328060551557120	2019-02-01	[]	four wom get root hair dilemma
1091313781886631936	2019-02-01	[]	first ev veg fash week kick la today event's cur emmanuel riend said hop show cruel new luxury
1091313217295523840	2019-02-01	[]	swear good ev help man pain hurrah
1091310978694873088	2019-02-01	[]	gossip girl remak might card accord rec interview presid @thecw rev discuss ongo cross fing toe
1091308299394387968	2019-02-01	[]	soo app fij wat girl suing @fijiwater unauth us lik brand respond say lawsuit frivol entir without merit dramaa
1091306539544182784	2019-02-01	[]	@olehenriksen cult skinc brand left uk 18 month ago relaunch boot today get pay day beauty fix hun
1091305672136773633	2019-02-01	[]	sunday denim spec new brand nee know best jean high street gemm ward model new denim mood plu stat belt styl beig wint best glow produc rev dul janu skin
1091298118212173827	2019-02-01	[]	slath lip stuff addict wint choos balm wis
1091281759508021248	2019-02-01	[]	tony riddl us chair comfort eat stay dark meet 'rewilding' expert who's champ return nat
1091266709862928385	2019-02-01	['#thetesta']	@margaretatwood rev omin cov sequel handmaid's tal design @noma_bar releas septemb 10
1091264457999876097	2019-02-01	[]	flawless skin fiv minut easy beauty routin sav much tim
1091255585071353857	2019-02-01	[]	cho mak first hour morn determin wheth produc peac mind rest day
1091064073100365824	2019-01-31	[]	'fluffing' bakuchiol
1091055522772668417	2019-01-31	[]	work missy elliot print releas much alb spok rap @lizzo ahead releas
1091048984355971074	2019-01-31	[]	spirit edit @sundaytimeslc tri hand yog convert
1091042430890270732	2019-01-31	[]	kik layn star barry jenkins' osc new film talk stay ground import repres screen
1091033882206576644	2019-01-31	[]	expery chalet al fresco bar 'studio 54 slopes' insider's guid apr scen
1091027329713926146	2019-01-31	[]	speedo superdrug lemon cok @jeremyclarkson tri relax @gainsboroughspa
1090995376516149249	2019-01-31	['#beautyboss']	@sarahjossel swear glow diy skin peel
1090988584822362112	2019-01-31	[]	nutrit want put diet cult bed new book champ healthy intuit approach eat
1090981278831263744	2019-01-31	[]	tony riddl us chair comfort eat stay dark meet 'rewilding' who's return nat
1090973224626724864	2019-01-31	[]	column @indiaknight jump @fentybeauty bandwagon good thing say
1090966182222536705	2019-01-31	[]	break styl rut try new look say @janemcfarland
1090959641784274944	2019-01-31	[]	celin dion biop work peopl film titl pow lov slat releas 2020 star valery lemercy titl rol cry
1090947216125104133	2019-01-31	[]	bubbleg pink beauty god @glossier extend perfect skin tint rang 12 shad yaaass
1090945683723554816	2019-01-31	[]	@karllagerfeld tap carin roitfeld perm collab eponym label launch 'the edit carin roitfeld' rang wardrob stapl set releas septemb
1090944213691314176	2019-01-31	[]	@loccitane_uk launch delivery serv london rol across uk ear 2019 last min skin savio ahoy
1090942905878003713	2019-01-31	[]	par annount off plan becom glob capit sustain fash 2024 fiv in titl 'paris good fashion' aim est eco pract across industry
1090941358272057344	2019-01-31	[]	@uniqlo_uk's latest collect reimagin wardrob class rich hue earthy ton 'uniqlo u' launch today
1090913082744938496	2019-01-31	[]	new year's resolv already dist mem get back track edit lifestyl ap know 2019
1090904523034497025	2019-01-31	[]	list mak fin art could chang lif accord bestsel french book
1090897979853160449	2019-01-31	[]	left 2018 feel overwork drain energy decel trend nee get behind
1090891433475747840	2019-01-31	[]	column @dollyalderton mak convint cas solo travel 2019
1090883382261760000	2019-01-31	[]	beauty column @indiaknight review old favourit 5
1090697667691180032	2019-01-30	['#wardrobemistress']	shop on thing janu let boilersuit comfy cosy easy @janemcfarland pick favourit
1090690369719812096	2019-01-30	[]	poss happy divorc uk's top divorc lawy certain think
1090682335060770817	2019-01-30	[]	find three planet trend set affect everybody @vonstrunckel's star year ahead
1090682063009779713	2019-01-30	[]	count grey rainy day style's edit bold bright trous suit
1090675010287689728	2019-01-30	[]	step lead posit import set bound
1090667467507159040	2019-01-30	[]	heal spa without woo woo wel fact @lauratkinson spent bliss day meadow
1090659914131881984	2019-01-30	[]	i'm addict success dam marry @lisa_m_borders @timesupnow answ car quest
1090652373402480640	2019-01-30	[]	get insid look wond eclect par hom fash design alex mabil
1090644596730855425	2019-01-30	[]	get wardrob diet exerc regim ord style's edit lifestyl ap know 2019
1090637785076297729	2019-01-30	[]	soo @mountainwhouse launch first ev design collab @kitneale 26 'karabina collection' celebr gre outdo launch march 27 random trendy lik
1090630212319170565	2019-01-30	[]	soon found feel mov certain sent stop paus thought @pinsykes
1090614398618619907	2019-01-30	[]	welcom sapph cinem revolv
1090606056731013120	2019-01-30	[]	anthropolog guid rub men internet @dollyalderton
1090606056609325056	2019-01-30	[]	com middl ag beauty rut much clich waterfal cardig hap say @indiaknight
1090599264558948352	2019-01-30	[]	see way const maintain lif enjoy
1090591206608957440	2019-01-30	[]	tim stop pand in inf
1090584557533970433	2019-01-30	[]	tulip siddiq mp hampstead &amp; kilburn cur matern leav becom first mp hist vot proxy
1090583269756882944	2019-01-30	[]	gwyne paltrow sued reckless ski alleg break man's rib crash utah resort yik
1090581442248261632	2019-01-30	[]	avon somerset pol receiv backlash adv wom avoid harass exerc run group enlight
1090579865273843712	2019-01-30	[]	justin bieb join slew celeb fash design new label drew hous beig millen
1090578344620576768	2019-01-30	[]	high street retail zar unveil new logo everyon keen thought
1090577998816804864	2019-01-30	['#styletodol']	stun first look @v_and_a's blockbust exhibit christian dior design dream op publ saturday
1090565538135375874	2019-01-30	[]	break styl rut try new look say @janemcfarland
1090560503888384000	2019-01-30	[]	fash art alway lov affair show ful wed
1090555977370423296	2019-01-30	['#bless', '#namast']	plac world soul besieg selfy fak zen upload instagram though @sarahjossel escap @rancholapuerta
1090550438359748608	2019-01-30	[]	precy gemston nee jewellery box
1090546916314755073	2019-01-30	[]	ear would @davidwalliams spa sur thrusting swag macho fig would seen dead towel rob match slip @bulgarihotels
1090539627214196736	2019-01-30	['#wardrobemistress']	easy whatev weath @janemcfarland pick favourit boil suit shop
1090537857951940608	2019-01-30	[]	taup revolv com @claudiawinkle wait op arm
1090536092334460928	2019-01-30	[]	cre inv doer tim secret socy produc peopl encount past fiv morn @dollyalderton
1090533832317640706	2019-01-30	[]	know ful wel prob tim giv chant fulfil child robinson cruso fantasy go ful fer @dollyalderton @bawahisland
1090328225778155526	2019-01-29	[]	column @indiaknight jump @fentybeauty bandwagon good thing say
1090319938030583816	2019-01-29	[]	rec @pornhub survey say third watch gay mal porn fem attract
1090312393962516481	2019-01-29	[]	tony riddl us chair comfort eat stay dark meet 'rewilding' who's return nat
1090304320615141377	2019-01-29	[]	bril gal cur art champ new fem gaz art world
1090297311576686592	2019-01-29	[]	nutrit want put diet cult bed new book champ healthy intuit approach eat
1090289976493989889	2019-01-29	[]	hi hair produc mak beauty routin much easy
1090282425014517760	2019-01-29	[]	biscuit dark cream taup mushroom fawn com toward us four horsem apocalyps @claudiawinkle
1090274872968663040	2019-01-29	[]	lady vig rub felt lik salt skin coat oil 'this thought 'is lik chick despit veg say bad @jeremyclarkson review @gainsbathspa
1090266821658259458	2019-01-29	[]	foc declut everyth @vonstrunckel
1090260032527118336	2019-01-29	['#beautyboss']	@sarahjossel swear glow diy skin peel
1090252013127061504	2019-01-29	[]	heal spa without woo woo wel fact @lauratkinson spent bliss day meadow
1090243815800274944	2019-01-29	[]	carry bradshaw back replac sign cosmo stell yep sarah jessic park rev icon charact new @stellaartois campaign partn char @water good caus eh
1090232348510208001	2019-01-29	[]	mak friend competit workplac stephany phair cso @farfetch answ car quest
1090227311197208577	2019-01-29	[]	minim grey scand vib ovah
1090221034077343744	2019-01-29	[]	count grey rainy day style's edit bold bright trous suit
1090215224345575424	2019-01-29	[]	@balenciaga @farfetch launch caps collect caus vary piec rang today draw at endang specy hous also pledg don @iucn
1090206170269261829	2019-01-29	[]	wom lik depict lik car aspir advert new research found study 2 advert worldwid also found 98 per cent peopl target baby laundry household cle produc wom yawnn
1090202406741311488	2019-01-29	[]	find three planet trend set affect everybody @vonstrunckel's star year ahead
1090184347259494400	2019-01-29	[]	kensington palac ap instagram sex rac com aim duchess cambridg sussex palac said worst stuff kat fan megh fan soc med us try pit pair
1090178254722478081	2019-01-29	['#stylebaromet']	hipst bar snack french heel what's goss week's
1090171799378251776	2019-01-29	[]	@margotrobbie teas harley quinn's new look upcom film bird prey set releas febru 2020
1090164649121722368	2019-01-29	[]	ask country's top divorc lawy am split
1090160370642227200	2019-01-29	[]	styl report fit strategies bet ment heal
1089978169577431040	2019-01-28	[]	@celinedion tim
1089967354279313408	2019-01-28	[]	i'm addict success dam marry @lisa_m_borders @timesupnow answ car quest
1089961813805027339	2019-01-28	['#stylebaromet']	waistco flood runway we'r pretty sur @garethsouthgate singl respons
1089955016906031104	2019-01-28	[]	week ear ris taught new start alway avail @dollyalderton
1089946729565306887	2019-01-28	[]	decad deadlin par @sundaytimeslc sought reliev ayurv ret sri lank learn
1089939665556254720	2019-01-28	[]	2019 answ mind
1089931865845309442	2019-01-28	[]	rec study @yale found adult tend tak girl pain less sery ear mon @lucyfoleytweets wrot expery debilit chronic pain
1089924322045714432	2019-01-28	[]	fash edit resid foody @flossiesaunders lay styl tabl
1089916262271070210	2019-01-28	[]	greg welcom broad church on cathol not guilt left door
1089908585444794368	2019-01-28	[]	speedo superdrug lemon cok @jeremyclarkson tri relax @gainsboroughspa
1089903182820585473	2019-01-28	[]	count grey rainy day edit bold bright trous suit
1089893619048300545	2019-01-28	['#beautyboss']	@sarahjossel choos favourit fac peel exfo hydr smoo skin
1089883798077169664	2019-01-28	[]	stick new year's resolv edit best exerc fash food ap
1089877201540005889	2019-01-28	[]	icym @celiakrithariot's par cout show includ brid veil lift hel balloon tot cas
1089875045512609793	2019-01-28	['#wardrobemistress']	comfort cosy oh wear @janemcfarland pick best boil suit shop
1089864672612884480	2019-01-28	[]	@jeremyclarkson visit spa girlfriend lis hog deal moan
1089864480371154944	2019-01-28	[]	beig dress simply unavoid 2019 tim embrac taup say @claudiawinkle
1089853627802546176	2019-01-28	[]	reward card cult follow internet veg saus rol dollop hipst appropry lif
1089847053629444102	2019-01-28	['#stylebaromet']	quit frank obsess @netflix's latest real tv off
1089843781782986752	2019-01-28	[]	find zen without faff travel
1089830200030973958	2019-01-28	[]	find three planet trend set affect everybody @vonstrunckel's star year ahead
1089821887402790912	2019-01-28	[]	minim grey scand vib fussy print bold colo
1089810823311212544	2019-01-28	[]	mak friend competit workplac stephany phair chief strategy off @farfetch answ work dilemma quest
1089806790353670145	2019-01-28	[]	tre good night sleep lik luxury ask edit @sundaytimeslc
1089802542631059456	2019-01-28	[]	big chang rearrang world around @vonstrunckel
1089603446993551360	2019-01-27	[]	know ful wel prob tim giv chant fulfil child robinson cruso fantasy go ful fer @dollyalderton @bawahisland
1089599022770372608	2019-01-27	[]	hap @jeremyclarkson tri wat therapy @gainsboroughspa
1089592124461535234	2019-01-27	[]	taup revolv com @claudiawinkle wait op arm
1089584576211636224	2019-01-27	[]	funny good night sleep consid someth spec tre holy grail relax fact someth hap every night mat cours @sundaytimeslc
1089577787441188865	2019-01-27	['#wardrobemistress']	easy whatev weath @janemcfarland pick favourit boil suit shop
1089569221510656000	2019-01-27	[]	interact medit sound alt on exhibit want miss
1089561421707464704	2019-01-27	['#beautyboss']	secret glow complect @sarahjossel think
1089555883393208325	2019-01-27	[]	season's styl suit bold bright
1089539025092993025	2019-01-27	[]	find zen without faff travel
1089533490234822657	2019-01-27	[]	ear would @davidwalliams spa sur thrusting swag macho fig would seen dead towel rob match slip @bulgarihotels
1089525936234684416	2019-01-27	[]	bet test ful relax wak mass snor loud @lauratkinson chil cotswold @thyme_england
1089516625114603521	2019-01-27	[]	precy gemston nee jewellery box
1089509075828858880	2019-01-27	[]	lady vig rub felt lik salt skin coat oil 'this thought 'is lik chick despit veg say bad @jeremyclarkson review @gainsbathspa
1089502032178876416	2019-01-27	[]	minim grey scand vib ovah
1089489446741905410	2019-01-27	[]	cre inv doer tim secret socy produc peopl encount past fiv morn @dollyalderton
1089482400994902017	2019-01-27	[]	@fentybeauty found cont com includ 50 skin shad mak want stand desk che @indiaknight
1089473089518424066	2019-01-27	['#bless', '#namast']	plac world soul besieg selfy fak zen upload instagram though @sarahjossel escap @rancholapuerta
1089466545011609600	2019-01-27	[]	chain 99% aw among brit pop singl popul din brand nat @greggsofficial mean hel lot hel lot peopl
