id	created_at	hashtags	cleaned_text
1064105939937255424	2018-11-18	[]	'i know feel warm ap body middl night know hold sleep sing lullaby read bedtim story' @dollyalderton
1064096377125433344	2018-11-18	[]	meet la witch shot fam suppos cast spel donald trump
1064096118915694592	2018-11-18	[]	today exclud photograph grandp wal capt roy photograph @chrisjack_getty @thestma
1064089078847741952	2018-11-18	['#beautyboss']	@sarahjossel rev sev beauty secret everybody know
1064081025687580675	2018-11-18	['#wardrobemistress']	best party top wear accord @janemcfarland
1064071713015701504	2018-11-18	[]	ineq hom nee stop get don think @gemmahartley
1064061646405017600	2018-11-18	[]	'attitudes shift ultim wom much fair' @sundaytimeslc
1063926009362305031	2018-11-17	[]	'the nar grow old eq bor cloth seem ant conceiv 2018'
1063908385261801475	2018-11-17	[]	beauty direct rev fiv key produc us hydr retinol
1063878188986707968	2018-11-17	[]	estim 50 peopl uk bpd much frequ diagnos wom
1063855289890426880	2018-11-17	[]	wait
1063845470899003392	2018-11-17	[]	retinol pod work wond
1063834400885022723	2018-11-17	[]	best boot buy autumn
1063827855723978753	2018-11-17	[]	joy
1063821818673463296	2018-11-17	[]	ten heal suppl wel crowd swear
1063814016915656705	2018-11-17	[]	much real know hormon
1063806464949669888	2018-11-17	[]	us retinol
1063795139796234242	2018-11-17	[]	talk dream tabl set emil wickstead sabin getty
1063787589612777478	2018-11-17	[]	could sport help boardroom
1063775512563191811	2018-11-17	[]	'it tak believ know asset bring un perspect fash industry'
1063726688251650055	2018-11-17	[]	brunch chang bet
1063709324286091265	2018-11-17	[]	man help shap brit men dress today @ljday
1063699260980559872	2018-11-17	[]	would try microneedl fac shrink por fight adult acn
1063563619798081536	2018-11-16	[]	writ coupl list could transform lif real
1063545999795339270	2018-11-16	[]	best knitwear buy wear
1063515799095255041	2018-11-16	[]	peopl bpd already impuls internet lik stick addict plac drug everywh
1063502965066080257	2018-11-16	[]	hen dos aw
1063492897545363456	2018-11-16	[]	exact emot botox
1063483096027271169	2018-11-16	[]	tri velvet lipstick wel
1063473697271492608	2018-11-16	[]	hot brush chang lif we'r exag littl
1063458498409828352	2018-11-16	[]	suppos mov los job lov
1063401585143881728	2018-11-16	[]	sunday sask de brauw model season easy trend discuss art tru pass plu 48 lust list beauty christmas gift exclud extract @gemmahartley's new book emot labo ineq hom
1063394737372241920	2018-11-16	['#metoo']	hug congr column @indiaknight whos piec sex flirt post- com piec year award 2018 com award
1063160971584331777	2018-11-15	[]	@travon's comedy @faviken's bak guid cult cool autumn
1063153426316574721	2018-11-15	[]	monzo orang thing definit wear
1063144889892962304	2018-11-15	[]	keen believ improb expl friend sar giv neat band wrist @amancalledmark best friend's diagnos borderlin person disord threw thing sharp foc
1063130279752204289	2018-11-15	[]	person train last year lif coach rebrand on everyth
1063128469507358721	2018-11-15	[]	stormzy confirm first headlin @glastofest 2019 must get ticket
1063123482068901891	2018-11-15	[]	sup spec blondy blu what's hot styl baromet week
1063116179735232513	2018-11-15	[]	upgrad party look flash hot met best metal piec high street
1063100319918374912	2018-11-15	[]	book claim swear good tbh we'r already convint
1063091507115241474	2018-11-15	[]	column @dollyalderton relax don pub party lat night dant
1063059070880497665	2018-11-15	['#fashionaward']	legend photograph mert marc hono isabell blow award fash cre 2018 @bfc
1063022099969777665	2018-11-15	[]	brexit secret resign morn say could good conscy support theres may propos ag
1062993883993387009	2018-11-15	[]	john lew christmas ad land two minut film tel story elton john piano start pres day tak view back child receiv gift chang cours lif cry
1062988989278380033	2018-11-15	[]	avoid prom week taur read horoscop ful
1062806877908680704	2018-11-14	[]	pop star @cherylofficial back new singl new outlook
1062801600035651584	2018-11-14	[]	brow botox review on inject tre year skept eyebrow rais
1062793799930466304	2018-11-14	['#beautyboss']	see @sarahjossel cre easy autumn look
1062786503816962048	2018-11-14	[]	style's guid dress work cold month
1062778951980978181	2018-11-14	[]	deal anxy millen employ @alexiainge @cultbeauty respond work dilemm
1062771150508429312	2018-11-14	[]	jewellery design lil von trap mak beauty eth piec lov
1062756199114924032	2018-11-14	['#beautyboss']	bril @sarahjossel went @thismorning talk thing k
1062681334575960065	2018-11-14	['#stylebaromet']	sup spec zebr print 1970s ey shadow what's going week
1062671329730719745	2018-11-14	[]	cbd oil new wel wond drug du jour real reduc anxy stress level on writ tri mon
1062654130886467584	2018-11-14	[]	easy tak class ponytail sav much tim morn
1062652270683324416	2018-11-14	[]	gam thrones return april 2019 confirm dril peopl
1062651505260535808	2018-11-14	[]	ralph laur recogn knight serv fash mak first am design receiv hono ceremony tak plac 2019
1062649214570766336	2018-11-14	[]	last chant @wrapuplondon collect unw coat tub stat across capit don vuln peopl end today
1062647604545290240	2018-11-14	[]	thought approach list could chang lif accord best sel french book
1062639040804122624	2018-11-14	['#beautyboss']	perk skin @sarahjossel's fiv minut morn beauty routin
1062635691497189376	2018-11-14	['#kbeauty']	way @thismorning talk @rochellehumes @schofe sheet mask cush blush cc cream
1062632235227078657	2018-11-14	[]	journ @lfpullman reinv look new job statesid
1062624181597155328	2018-11-14	[]	handb mak conveny covet we'v got back
1062616379491266560	2018-11-14	[]	capricorn tim start ask quest read horoscop ful
1062435435899707393	2018-11-13	['#beautyboss']	@sarahjossel's pick velvet lipstick mak mou wat
1062428142437089287	2018-11-13	[]	act think emot mat baby gen ag @alexiainge @cultbeauty millen employ
1062421351095513088	2018-11-13	['#stylebaromet']	bril new tv show nee know week's
1062413795178483713	2018-11-13	[]	upd wint bas flash metal
1062405743670947841	2018-11-13	['#beautyboss']	wav goodby bar sun kiss glow season cov @sarahjossel shar autumn mak tip
1062398448694116352	2018-11-13	[]	mast art off wint dress style's ess edit
1062391155747446785	2018-11-13	[]	deal lat friend accord ev honest @mrsmillsst
1062383321320169472	2018-11-13	[]	@gucci expand onlin diy serv includ knitwear person assort alphabet patch tr cut
1062309580972179456	2018-11-13	[]	12 fem chief execut among britain 350 lead list company year @ha_review found on four firm stil on wom board
1062303160625192960	2018-11-13	[]	@jpgaultier latest design go fur fre stat way anim kil absolv depl french televid interview
1062301339596873728	2018-11-13	[]	@artisbrush launch world expend mak brush cool 25 three whit gold brush mad encrust diff precy ston cas
1062297813604855808	2018-11-13	[]	oft wom busy think caus situ speak @maryportas workplac bul
1062284444885811200	2018-11-13	[]	avoid prom week taur read horoscop ful
1062277901612171264	2018-11-13	[]	cbd oil new wel wond drug du jour real reduc anxy stress level on writ tri mon
1062270098671656960	2018-11-13	[]	comfort cosy off appropry best wint workwear buy
1062262293822619648	2018-11-13	[]	wheth team bath team show luxury new produc nee morn
1062254002241449989	2018-11-13	[]	detail everyth child chicago tim america's first lady @michelleobama much memoir becom today
1062073307015639043	2018-11-12	[]	belt coat flat silhouet season best every budget
1062067017187033088	2018-11-12	[]	afraid mov sideway ord mov @carlabuzasi @wgsn jump job
1062057705190383616	2018-11-12	[]	bold styl inspir season ahead
1062050152385597440	2018-11-12	[]	hap @deccajourno met @cherylofficial pop star's first maj interview four year
1062043113638780928	2018-11-12	[]	tim channel hamburgl peopl @claudiawinkle balaclav trend
1062034552112193536	2018-11-12	[]	rainbow cutlery pretty flow @flossiesaunders' tabl set inject much colo autumn
1062028026588860416	2018-11-12	[]	los job lov feel devast breakup @lottejeffs reflect expery car grief
1062021600588058624	2018-11-12	['#tfact']	@aledellacqua eleg new collect tod's launch today yum
1062018688776310784	2018-11-12	['#wardrobemistress']	corduroy back fash map unleash in geograph teach say @janemcfarland
1062012422343589888	2018-11-12	[]	hap styl gav two bad dress men complet wardrob refresh
1061997494094172160	2018-11-12	[]	@wrapuplondon launch tub stat across capit today don unw coat wednesday giv vuln peopl city go
1061994586665553920	2018-11-12	[]	teas arm select first hed slim handb celin go sal today get lin peopl
1061986711071277057	2018-11-12	[]	@missyelliot becom first fem rap nomin induc songwrit hal fam
1061963847203016705	2018-11-12	[]	thank @deccajourno real enjoy chat thank @sundaytimeslc kind word h
1061947166430781440	2018-11-12	[]	@kylieminogue headlin hampton court fest next jun ticket going sal novemb 16 reg bbs
1061921811594665984	2018-11-12	[]	jewellery design lil von trap mak beauty eth piec lov
1061914256038420481	2018-11-12	[]	deal millen employ @alexiainge @cultbeauty respond work dilemm
1061906766861123584	2018-11-12	[]	wheth team bath team show new pamp produc nee morn routin
1061898649817485312	2018-11-12	[]	deal on friend who's alway lat style's resid agony aunt @mrsmillsst nev sug coat
1061889591295258624	2018-11-12	[]	scorpio tim tak plung resid astrolog shelley @vonstrunckel myst insight week
1061686754649034752	2018-11-11	[]	style's guid dress work wint month
1061680463016837120	2018-11-11	[]	tim channel hamburgl say @claudiawinkle
1061671406918868993	2018-11-11	['#beautyboss']	see @sarahjossel cre easy autumn look
1061666116576133124	2018-11-11	['#stylebaromet']	bril new tv show nee know week's
1061658572680060932	2018-11-11	[]	act think emot mat baby gen ag @alexiainge @cultbeauty millen employ
1061643218817859590	2018-11-11	['#beautyboss']	@sarahjossel's pick velvet lipstick sery mouthw
1061635159802462209	2018-11-11	[]	brow botox review on inject tre year skept eyebrow rais
1061628365696913409	2018-11-11	[]	column @dollyalderton rethink mean relax prov difficult task
1061621319224168448	2018-11-11	[]	pop star @cherylofficial back new singl new outlook
1061613769099538433	2018-11-11	[]	column @indiaknight found subtl cheek tint bar glow
1061604969349046273	2018-11-11	['#wardrobemistress']	jan mcfarland pick favourit corduroy piec right
1061590871097925632	2018-11-11	[]	hap styl gav two men complet wardrob reboot
1061581556538589184	2018-11-11	[]	embrac bold colo wint
1061575020940591109	2018-11-11	[]	mov los job lov @lottejeffs reflect expery car grief
1061567216188039168	2018-11-11	[]	wheth team bath team show produc nee morn routin
1061559412744163328	2018-11-11	[]	comfort cosy off appropry best wint workwear buy
1061550856972234752	2018-11-11	['#stylebaromet']	sup spec going street styl wear sery wel
1061550355878760449	2018-11-11	[]	four year away spotlight on year therapy beauty baby boy @cherylofficial fin found sens peac @deccajourno spok pop star first maj interview sint 2014
1061545327067623424	2018-11-11	[]	put away scarv hat wint us two item nee on @claudiawinkle balaclav trend
1061529968763650048	2018-11-11	[]	ahead pop star's first interview four year @sundaytimeslc talk @cherylofficial fam ment heal
1061322858775961605	2018-11-10	['#stylebaromet']	got digit peopl
1061313789814018048	2018-11-10	[]	hap @retrouvius @bellafreud join forc luxury @thisistvc penth
1061268246496792577	2018-11-10	[]	parody everyon @kimkardashian @ritaora hap met fearless instagram com @celestebarber_
1061242833582149633	2018-11-10	[]	afraid mov sideway ord mov @carlabuzasi @wgsn jump job
1061223208609869824	2018-11-10	[]	oft wom busy think caus situ speak @maryportas workplac bul
1061198538045116416	2018-11-10	[]	cbd oil new wel wond drug du jour real reduc anxy stress level on writ tri mon
1061162545883557888	2018-11-10	[]	ad glycol acid skinc regim
1060956689338429441	2018-11-09	[]	threw party celebr big art issu here's went @editionlondon
1060948384008323074	2018-11-09	['#wardrobemistress']	wear sequin way @janemcfarland
1060941095234867201	2018-11-09	[]	endless dms whatsap voic not whol gen forgot commun irl
1060933299558903818	2018-11-09	['#beautyboss']	build simpl mak look autumn us @sarahjossel's favourit produc right
1060925501181714432	2018-11-09	[]	rainbow cutlery pretty flow @flossiesaunders' tabl set inject much colo autumn
1060916683437694976	2018-11-09	[]	they're littl bit char chaplin @claudiawinkle sery trous
1060910643572809728	2018-11-09	[]	hydr hairspray high hair tool @phoebejmcd autumn hairc upd
1060901828903231488	2018-11-09	[]	wrap wint best belt coat every budget
1060895792842661892	2018-11-09	[]	mean self mut someth clos self @dollyalderton think reach peak self car
1060886483526131712	2018-11-09	[]	party season cal handb mak conveny covet here's ess edit
1060886047016566785	2018-11-09	[]	@cherylworldnet @cherylofficial ye avail sunday
1060879955310055424	2018-11-09	[]	forget produc plac conspicu logo immers expery chang way luxury brand advert
1060872649457446913	2018-11-09	[]	achiev perfect chic red lip accord french mak art @violette_fr
1060859857912430592	2018-11-09	[]	@idriselba's new luxury cocktail bar parrot op london today prom bespok drink liv mus chauff car serv cas
1060856930846023680	2018-11-09	[]	there's someth right ezr mil @moncler fantast beast premy
1060849668647776256	2018-11-09	[]	launch op nee know fash week
1060804403307970560	2018-11-09	[]	sunday exclud shoot first maj interview @cherylofficial four year plu deal car grief embrac bold colo wint @dollyalderton expl mean relax tir hedon
1060623510408695808	2018-11-08	[]	cheekbon defin crow's feet eras latest high tech beauty
1060615195368869890	2018-11-08	[]	styl contribut includ @claudiawinkle john niv rememb wildest night
1060599593052844032	2018-11-08	['#stylebaromet']	mak lik debby harry season's coolest shad
1060593807270559745	2018-11-08	['#satc']	writ @dollyalderton reflect import lesson lov lif gle samanth co
1060585751728005122	2018-11-08	[]	star @blackishabc on outspok wom hollywood @traceeellisross talk hit stride solo mid forty
1060578474837135360	2018-11-08	[]	could learn thing two @dollyalderton's teen diary
1060570904697147394	2018-11-08	[]	endless dms whatsap voic not forgot commun irl
1060563101001621504	2018-11-08	[]	fash direct @janemcfarland new brand know
1060554789417902080	2018-11-08	[]	on uk's popul cleans avail body wash form
1060547782497484800	2018-11-08	[]	pop's next superst @rinasawayama op study cambridg grow singl mum
1060539398004097030	2018-11-08	[]	stay calm keep op mind capricorn @vonstrunckel horoscop week
1060537216752066561	2018-11-08	['#beautyboss']	build simpl mak look autumn us @sarahjossel's favourit produc right
1060532899886387202	2018-11-08	[]	giant bean bag ted talk @cartier watch common chang afoot luxury industry
1060527594037301249	2018-11-08	[]	amp glam edit best metal piec party season
1060517114736451585	2018-11-08	[]	@hunterboots limit edit collect @disney launch today lik party feet
1060507957190950912	2018-11-08	[]	mak list could chang lif accord french best
1060499955138338816	2018-11-08	[]	wom swear happy
1060489694780235776	2018-11-08	[]	emm thompson hono print william buckingham palac serv dram yesterday big dam energy
1060488081336348672	2018-11-08	[]	solv hair problem wheth dul dry frizzy oi flat puffy
1060461252441505793	2018-11-08	[]	thank @theststyle send glamo new correspond @lfpullman new york styl
1060280082978275335	2018-11-07	[]	new us repres pav way progress fut
1060262375549534208	2018-11-07	[]	new wellb craz shak body beat stress would @fleurbritten tri @gailschock
1060246029642223616	2018-11-07	['#beautyboss']	@sarahjossel mast art nonch cool @isamayaffrench's smoky ey tut
1060231680164794368	2018-11-07	[]	guid cult autumn @travon's comedy @faviken's bak whol load book curl
1060217331228569604	2018-11-07	[]	four easy hairstyl elev look tim
1060200711881928706	2018-11-07	[]	want know mak look lik set @indiaknight found tru light mir nee
1060193418196987904	2018-11-07	[]	embrac colo season fash edit @flossiesaunders' guid lay styl tabl autumn
1060186115108417536	2018-11-07	[]	unknown us run three bar tab fash pack party
1060178319214329856	2018-11-07	[]	mean self mut someth clos self @dollyalderton think reach peak self car
1060171824653320192	2018-11-07	[]	cbd oil new wel wond drug du jour real reduc anxy stress level @fleurbritten tri mon
1060167224248426496	2018-11-07	[]	wrap best belt coat every budget
1060106326251134976	2018-11-07	[]	hug congr column @dollyalderton whos book everyth know lov shortl @waterstones book year award janu styl got first look
1060101861519319041	2018-11-07	[]	29 @ocasio2018 becam youngest wom ev elect us congress hist democr candid congress rac new york 14th district 74 per cent vot
1059900228625674241	2018-11-06	[]	@claudiawinkle swear instagram
1059884386148069382	2018-11-06	[]	ad glycol acid skinc regim
1059875739896631296	2018-11-06	[]	they're littl bit char chaplin @claudiawinkle say put
1059869783771017216	2018-11-06	[]	keep op mind scorpio @vonstrunckel horoscop week
1059862337623076865	2018-11-06	[]	puff jacket princess di kim k
1059854191152250880	2018-11-06	[]	afraid mov sideway ord mov @carlabuzasi @wgsn jump job
1059844118661206016	2018-11-06	[]	parody everyon @kimkardashian @ritaora hap met fearless instagram com @celestebarber_
1059829019909197824	2018-11-06	['#beautyboss']	refil beauty produc good environ bank bal @sarahjossel choos favourit
1059823728492756993	2018-11-06	[]	claud winklem swear instagram
1059807872178184192	2018-11-06	[]	hap @retrouvius @bellafreud join forc luxury @thisistvc penth
1059799313923166208	2018-11-06	[]	pop's next superst @rinasawayama op perform study cambridg grow singl mum
1059793018721591296	2018-11-06	[]	fash edit resid foody @flossiesaunders lay styl tabl autumn
1059789266392354816	2018-11-06	[]	achiev perfect chic red lip accord french mak art @violette_fr
1059782211262734337	2018-11-06	['#stylebaromet']	got digit
1059781231125151744	2018-11-06	[]	forget produc plac conspicu logo immers expery chang way luxury brand advert
1059774151987261441	2018-11-06	['#beautyboss']	get hand styl ind knight @sarahjossel box @latestinbeauty favourit produc tri test styl
1059766356642590720	2018-11-06	[]	styl metal lik pro party season
1059764704137093120	2018-11-06	[]	oft wom busy think caus situ speak @maryportas workplac bul
1059763179528577024	2018-11-06	[]	thirty flirty thriving happy birthday emm ston
1059762817748922368	2018-11-06	[]	onlin retail @yoox launch brand yoox us art intellig digit cont custom feedback purchas trend inspir high tech
1059759818838368256	2018-11-06	[]	big congr kerby jean @pyermoss award cfda fash fund 2018
1059753813148659712	2018-11-06	[]	on uk favourit cleans com body wash @indiaknight fan
1059744204191121408	2018-11-06	[]	@lfpullman reinv look new job statesid
1059737661555044354	2018-11-06	[]	party season cal handb mak conveny covet here's ess edit
1059732883563339776	2018-11-06	[]	launch op nee know fash week
1059729357307031552	2018-11-06	[]	@idriselba crown peopl sexiest man al nev agree someth hearty
1059728644938088449	2018-11-06	['#beautyboss']	perk skin @sarahjossel's fiv minut morn beauty routin
1059536338909888520	2018-11-05	[]	thought approach list could chang lif accord best sel french book
1059529552953794560	2018-11-05	[]	four easy hairstyl elev look tim
1059520993180426240	2018-11-05	[]	wrap best belt coat every budget
1059515200381091840	2018-11-05	[]	mean self mut someth clos self @dollyalderton think reach peak self car
1059506382582493184	2018-11-05	[]	hydr hairspray high hair tool @phoebejmcd ess hairc upd
1059499347841351680	2018-11-05	[]	unknown us run three bar tab fash pack party
1059492062549237760	2018-11-05	['#stylebaromet']	find conscy party going week's
1059486847678758912	2018-11-05	['#beautyboss']	get hand styl ind knight @sarahjossel box @latestinbeauty favourit produc tri test styl
1059484251987632131	2018-11-05	[]	they're littl bit char chaplin @claudiawinkle sery trous
1059476759354269696	2018-11-05	['#beautyboss']	achiev perfect chic red lip accord french mak art @violette_fr @sarahjossel
1059467136505135107	2018-11-05	[]	styl metal lik pro party season
1059463595199750144	2018-11-05	[]	@spicegirls san posh confirm six uk tour dat jun 2019 ticket go sal saturday 10 get ready sery queu
1059454047449702400	2018-11-05	['#wardrobemistress']	tak grown approach glit glamo season subtl flash sequin @janemcfarland show us
1059445746997608448	2018-11-05	[]	meet @rinasawayama 28 pop sens tip next lady gag
1059438440448778241	2018-11-05	['#swoty']	@dinaashersmith fastest fem sprinter brit hist new sunday tim sportswom year met
1059430895868919808	2018-11-05	['#stylebaromet']	got digit
1059415088506044417	2018-11-05	[]	year's @bfc fash award co @therealalekwek @jackwhitehall cannot wait
1059407626440765440	2018-11-05	[]	onlin retail @asos waiv bonus top boss first tim four year company fail meet set target
1059399655954546688	2018-11-05	[]	big spic girl annount com today 3pm @emmabunton rev radio interview morn pray tour detail
1059390875246178304	2018-11-05	[]	launch op nee know fash week
1059384335688744960	2018-11-05	[]	immers expery chang luxury industry
1059379049720627201	2018-11-05	[]	embrac colo season fash edit @flossiesaunders' guid lay styl tabl autumn
1059372254272933890	2018-11-05	[]	oft wom busy think caus situ speak @maryportas workplac bul
1059366755393593344	2018-11-05	[]	column @me_and_em excel trous situ
1059364030060642304	2018-11-05	[]	keep op mind scorpio @vonstrunckel horoscop week
1059177222307790848	2018-11-04	[]	ev us best produc techn could issu
1059167148399058944	2018-11-04	[]	colo metal includ 35 skirt nee buy right
1059144245284618240	2018-11-04	['#foodwithflossy']	gorg season tabl set brunch din @flossiesaunders
1059134439031226371	2018-11-04	[]	pop's next superst @rinasawayama op perform study cambridg grow singl mum
1059131917143101440	2018-11-04	[]	@lfpullman becam new york correspond @thesundaytimes giv manhat makeov
1059121851031605249	2018-11-04	[]	body wash rush buy
1059113041739030529	2018-11-04	[]	'self mut someth clos self
1059102973383585792	2018-11-04	[]	hap @retrouvius @bellafreud join forc luxury @thisistvc penth spoil cre 4 mil star
1059092909478371330	2018-11-04	[]	threw party celebr big art issu here's went @editionlondon
1059084349541376000	2018-11-04	[]	11% us us hair produc year ago on try
1059076547762704384	2018-11-04	['#wardrobemistress']	wear sequin way @janemcfarland
1059072161351122945	2018-11-04	[]	i'm hungov fac @theststyle @thesundaytimes
1059064471216361473	2018-11-04	[]	tak throw best party ev ask @claudiawinkle record exec john niv oth know
1059053899007569920	2018-11-04	[]	party season cal handb mak conveny covet
1059047608503672832	2018-11-04	[]	'sometimes think lif meas party on on thrown melancho mom numb gre party left mak mark on' @sundaytimeslc
1059040312352489472	2018-11-04	[]	they're littl bit char chaplin @claudiawinkle say put
1059032508694740992	2018-11-04	['#intery', '#foodwithflossy']	nobody tablescap quit lik @flossiesaunders
1059026801685606405	2018-11-04	[]	blam men lik unfair pend system say money edit @jimconey
1059022945555808256	2018-11-04	[]	@rinasawayama pop star karaok queen season's best party piec
1059019165787439104	2018-11-04	['#swoty']	today @thesundaytimes four pag incred sportswom interview win
1059015647265542145	2018-11-04	[]	wear metal best shiny piec buy
1059007593656602624	2018-11-04	['#beautyboss']	tak mak right way accord @sarahjossel
1058998284688285696	2018-11-04	[]	on uk favourit cleans com body wash @indiaknight fan
1058988218564120577	2018-11-04	[]	self tim stop pand in inf say @dollyalderton
1058781861432958976	2018-11-03	[]	could help comparison coach menst ment gut coach
1058772041426485249	2018-11-03	[]	could 'good bacteria' work wond skin
1058760970934345729	2018-11-03	[]	3 sq ft amaz form wareh carnaby street
1058754466059640835	2018-11-03	[]	workplac warry work
1058748388194377734	2018-11-03	[]	'acupuncture ap trig repair mod boost collagen' @amy_abrahams
1058740585346072576	2018-11-03	[]	const red fac might on 10% peopl suff rosace
1058733035749806080	2018-11-03	[]	suppos thought count uhh
1058721711514927104	2018-11-03	[]	what's fragr collect @indiaknight shar fiv favourit
1058714163508400128	2018-11-03	[]	bread back
1058699266196152320	2018-11-03	[]	wear cardig refusenik @dollyalderton
1058662574852575233	2018-11-03	[]	omg i'm cov @theststyle weekend rt shook thank team rin pixel mak
1058653258007371776	2018-11-03	[]	ad glycol acid skinc regim
1058635894767448065	2018-11-03	[]	men lik promot wom @rosamundurwin expl less gend promot gap
1058625829398343685	2018-11-03	[]	claud winklem swear instagram
1058456779191926785	2018-11-02	[]	happy birthday @karamobrown jun sat fab fiv
1058384078196629504	2018-11-02	[]	@gwynethpaltrow fin shar glimps wed brad falchuck feat stun wed dress @maisonvalentino
1058380678625148930	2018-11-02	[]	sportswom year honest expect load fab perform year
1058354299753955330	2018-11-02	[]	styl belt coat season ahead
1058349562312773633	2018-11-02	[]	annount @michelleobama chimamand ngoz adich hold liv talk southbank cent decemb 3 celebr releas obam much memoir becom ticket go sal novemb 8
1058345856095666176	2018-11-02	[]	10 meghan's chicest look talk tour year
1058339450500104192	2018-11-02	['#beautyboss']	refil beauty produc good environ bank bal @sarahjossel choos favourit
1058335058589822976	2018-11-02	[]	@juliannehough play not jol @netflix sery bas dol parton mus rev
1058328132158152704	2018-11-02	[]	sunday meet pop's new sens @formichetti's mus @rinasawayama model season's biggest party look plu champagn pop high sequin host best party ev week issu ultim guid going
