id	created_at	hashtags	cleaned_text
1079460866817486848	2018-12-30	[]	'so get mess go stor grab bunch pringl doughnut ord pizz go town
1079437966580293633	2018-12-30	[]	'i found al anoth wom also work intern depart co help us improv promot nee somebody onside'
1079428907173068800	2018-12-30	[]	tim energy pres much bet half speak @fleurbritten sunday tim
1079425652720320514	2018-12-30	[]	new year ev demand glitz glamo
1079415568518631424	2018-12-30	[]	look back year
1079407516281393153	2018-12-30	[]	lik thank ment revolv piec @dollyalderton mazel freedom fr
1079402989323018240	2018-12-30	[]	beauty col real good hair oil
1079396695413276672	2018-12-30	[]	pract hik boot makeov here's wear
1079386629062737921	2018-12-30	[]	'i dam colo knack hair sort perfectly' @indiaknight
1079381844632719360	2018-12-30	[]	1000 sick told lov body import acceiv certain way know
1079381593817534464	2018-12-30	['#justeatit']	'we condit think ord wom control body microm weight delib mov patriarch socy keep us smal slight subdu slight hungry'
1079370269444239362	2018-12-30	[]	hollywood train david higgin urg tak 21 minut undo dam caus desk day
1079358189504737281	2018-12-30	[]	tis season cosy mean forgo feel styl process
1079347619716046848	2018-12-30	[]	lif admin daunt therapeut ev lif
1079346616375697409	2018-12-30	[]	today @theststyle interview @laurathomasphd tru lif new book eat tr
1079341330227171329	2018-12-30	[]	struggs funt sheesh 'thrilled announce' biggest hit miss 2018
1079334030317883393	2018-12-30	['#beautyboss']	here's everyth @sarahjossel learnt year know
1079326228098760704	2018-12-30	[]	writ reform party girl ros ast learnt fun without alcohol three moth giv honest account comply rel par alcohol
1079322453569081349	2018-12-30	[]	ind knight gre megh duchess sussex know mind prov princess long
1079317423373856768	2018-12-30	[]	'this year decid on resolv giv resolv fail keep past decade' @dollyalderton
1079312386685845504	2018-12-30	[]	exclud interview rob delaney op grief dea two son henry interview @deccaj
1079309368758276096	2018-12-30	[]	think stay year @claudiawinkle
1079306903187013632	2018-12-30	[]	wel larg collect teddy bear tidy wimbledon hom mongrel cal rabbit inherit com jimmy edward unev numb guest din whitfield would set chair rabbit
1079292004889178113	2018-12-30	[]	eat might book chang think food diet @dollyalderton interview auth nutrit @laurathomasphd
1079281938517626880	2018-12-30	[]	'over year read thousand word rel eat lad unnecess guilt tak way much headspace' @sundaytimeslc
1079124938336976896	2018-12-29	[]	rip jun whitfield amaz car alway joy watch absolv fab on dear
1079120071761514496	2018-12-29	[]	sad hear absolv fab dam jun whitfield pass away ag 93
1079098481279725575	2018-12-29	[]	ghost real us
1079048176429084673	2018-12-29	[]	wel know could list rememb everyth going abl tak trash yet fix sink anyth lik
1079026757733363713	2018-12-29	[]	self kick here's conqu fear publ speak accord new book room
1078995800708075520	2018-12-29	[]	wint wind cheek dry bump contend
1078994814023143424	2018-12-29	[]	sunday @dollyalderton introduc new book @laurathomasphd evisc diet cult tak intuit
1078955033092251648	2018-12-29	[]	forget interv train latest fit techn borrow top athlet
1078929614951665664	2018-12-29	[]	start nev mindset
1078703373615054849	2018-12-28	[]	fiv year togeth stil mak smil hear partn doorstep morn mut card card cash key pat pocket
1078656816459014144	2018-12-28	[]	com middl ag beauty rut much clich waterfal cardig thing act hap everybody
1078633414343999489	2018-12-28	[]	medit cam pil sur would feel lik gift etern paty immun anxy
1078621856830230529	2018-12-28	[]	sunday @dollyalderton introduc new book @laurathomasphd evisc diet cult tak intuit approach eat plu lif admin prop 21 minut mov undo dam caus stuck behind desk
1078592650310311936	2018-12-28	[]	incel involunt celib commun onlin hotb misogyny ang nee worry group lon young men
1078584591542378496	2018-12-28	[]	perhap think wheth nee slow littl dist work
1078567227891298304	2018-12-28	[]	tony riddl us chair eat process food stay dark ev us western toilet
1078557162996199424	2018-12-28	[]	meet 21st century witch curs donald trump
1078403902368874496	2018-12-27	[]	want bet brow minim fuss
1078373706878074882	2018-12-27	[]	bad teen skin menopaus plenty stag
1078350801695846400	2018-12-27	[]	promot gap less eq ug sist pay gap
1078340989046190081	2018-12-27	[]	cho mak first hour morn determin wheth produc peac mind rest day
1078312170608312331	2018-12-27	[]	could find happy fac fit fear
1078271025945694209	2018-12-27	[]	couples' counsel miss chang way think affair could infidel sav marry
1078263481202298886	2018-12-27	[]	last minut party pan access nee rev outfit
1078234784617431041	2018-12-27	[]	glossy instagram inspo real story 10 smal unsexy step toward goal
1078215416831463425	2018-12-27	[]	job interview first dat @louiseredknapp adv dress life's big transit
1078208459118727168	2018-12-27	[]	beauty brand rad already
1078199055724019712	2018-12-27	[]	skin nee sery post tlc produc try whatev regim
1077976593073668096	2018-12-26	[]	deal heat dam going grey grad grow bob four wom shar hair secret
1077974582525652992	2018-12-26	[]	negoty pay ris giv honest feedback week car quest answ diff fem lead see best adv 2018 column
1077960740420624386	2018-12-26	[]	glow lik pro season style's pick best tan serum mist lot wint
1077945390366904320	2018-12-26	[]	2018's const cyc busy might tim decel accord expert
1077930540077072384	2018-12-26	[]	three new fac mak skin smil wint
1077912422055374848	2018-12-26	[]	cle brush ess part skinc routin effect
1077901094762803200	2018-12-26	[]	noth say wint lux quit lik best velvet piec high street
1077897826040983552	2018-12-26	[]	hair access mad glit comeback tim party season get inspir
1077887500159463425	2018-12-26	[]	tru every famy on way anoth bit mess @dollyalderton
1077883728511332354	2018-12-26	[]	fashion's finest tackl new year's ev dress year
1077872157865230340	2018-12-26	['#beautyboss']	@drewbarrymore talk fil desert island beauty mak brand @flowerbeauty avail exclud @superdrug @sarahjossel
1077866865307934721	2018-12-26	[]	shop sal lik insid style's pick best onlin discount right
1077856800442118144	2018-12-26	['#beautyboss']	best beauty found high street stor shop @sarahjossel's pick
1077845983919329280	2018-12-26	['#wardrobemistress']	shop snuggest styl faux fur coat high street chos @janemcfarland
1077640630187278336	2018-12-25	['#stylebaromet']	season rod stewart party dress sery
1077626791597096960	2018-12-25	[]	many peopl pot snog @dollyalderton decemb without doubt best mon singl
1077615712343076864	2018-12-25	[]	flo gown slick suit fest jump sight fash crowd dress fest season
1077600865970720768	2018-12-25	[]	going new year's ev sev ess mak sur best dress guest
1077580232159363073	2018-12-25	[]	what's star fin week 2018
1077556070871195648	2018-12-25	[]	leav man hom christmas bet everyon say @dollyalderton
1077550797750194176	2018-12-25	['#wardrobemistress']	elev suit crisp whit tux @janemcfarland altern black tie dress
1077537953759588352	2018-12-25	[]	everyth turn glit soon decemb hit best brown mak smokey smould wint look
1077525365478838277	2018-12-25	[]	somehow fel lov @heawood recal answ hous swap ad ear thirty chang lif forev
1077521091957084160	2018-12-25	[]	convers definit want avoid christmas thank us lat
1077509765490716672	2018-12-25	['#beautyboss']	stay lipstick glow highlight @sarahjossel got look @drewbarrymore's mak brand @flowerbeauty avail exclud @superdrug
1077505491876618240	2018-12-25	[]	column @dollyalderton pen mov reflect press pict perfect famy christmas
1077496172254806016	2018-12-25	[]	edit @sundaytimeslc prep fin leg party season reluct seem
1077490137876058113	2018-12-25	[]	cov star keir knightley speak candid friend @scarcurtis famy friend new film colet
1077480824826748935	2018-12-25	[]	tin brown eckhart tol guid entertain christmas
1077474282614243328	2018-12-25	[]	comfort read christmas swim culin indulg styl contribut reflect fest famy tradit
1077316737253691392	2018-12-24	[]	interview on hero on incred kind thought peopl know cov week @
1077286539951042566	2018-12-24	[]	breathwork real breath high
1077263640783454208	2018-12-24	['#keiraknightley']	camer party think party
1077253833200467968	2018-12-24	[]	@claudiawinkle us hop there's pair ug tre
1077224979601768450	2018-12-24	[]	much season self don year
1077222627461218304	2018-12-24	[]	fash crowd dress new year's ev
1077208280324280321	2018-12-24	[]	elast trous christmas @claudiawinkle found dream pair
1077201234220720129	2018-12-24	['#beautyboss']	qual produc afford pric @sarahjossel pick favourit high street beauty brand
1077198482300198912	2018-12-24	[]	party pyjama relax altern high dress season @janemcfarland pick favourit set
1077195943580262400	2018-12-24	[]	column @marksandspencer
1077193433465450497	2018-12-24	[]	last minut shop forget ssg season self gift duh
1077191414570725376	2018-12-24	[]	going new year's ev sev ess mak sur best dress guest
1077183862470569990	2018-12-24	[]	sery list interview icon 1980s throwback christmas entertain sort @scarroserussell
1077178835337179137	2018-12-24	[]	fash crowd dress new year's ev
1077173047252144129	2018-12-24	[]	nee last minut gift inspir we'v got
1077160731655704581	2018-12-24	[]	famy keep teen sweet christmas
1077159398768893953	2018-12-24	[]	year beauty trend season glit bomb modern tak old class
1077143105483296768	2018-12-24	[]	would suggest incorp retinol skinc routin lat twenty ear thirty col level known drop 1% year ag 25
1077135042139357184	2018-12-24	[]	today @theststyle on want writ long tim famy
1077127345612439553	2018-12-24	[]	what's star fin week 2018
1077117675229335552	2018-12-24	[]	gross accord on survey 34% brush test contain dang high level bacter two 35 bacter av lav brush
1077107611684798467	2018-12-24	[]	thank generos read ap rais 290 @crisis_uk far help us rais
1076923153329328129	2018-12-23	['#beautyboss']	@drewbarrymore talk fil desert island beauty ess mak brand @flowerbeauty avail exclud @superdrug @sarahjossel
1076901755458371586	2018-12-23	[]	man find bril friend group priv night day day night unless film
1076891944821899264	2018-12-23	[]	edit @sundaytimeslc prep fin leg party season reluct seem
1076872062730452992	2018-12-23	[]	negoty pay ris giv honest feedback week car quest answ diff fem lead see best adv 2018 column
1076855958884765697	2018-12-23	[]	oxyg new ayahuasc @spicerlife report new wel trend turn breath psychedel drug
1076832806142136320	2018-12-23	['#beautyboss']	best beauty found high street stor shop @sarahjossel's pick best
1076825257397358592	2018-12-23	['#beautyboss']	stay lipstick glow highlight @sarahjossel got look @drewbarrymore's mak brand @flowerbeauty avail exclud @superdrug
1076818205480488960	2018-12-23	[]	thank us lat
1076810907316113408	2018-12-23	[]	try on riff black tie
1076797314910617601	2018-12-23	[]	stil wond wear new year's ev
1076788512446431232	2018-12-23	[]	cov star keir knightley speak candid friend @scarcurtis battl ptsd new film colet
1076779950341083137	2018-12-23	[]	ultim want win thing want mak film
1076772653237702656	2018-12-23	[]	left real last minut gift run buy today they'll nev know
1076764599897198592	2018-12-23	['#beautyboss']	high beauty hap say @sarahjossel
1076755289448296448	2018-12-23	[]	tru every famy on way anoth bit mess trust fascin peopl famy vulg nosy don research year @dollyalderton
1076745222695145472	2018-12-23	[]	elast trous christmas @claudiawinkle know what's
1076591964143996928	2018-12-22	[]	sev peopl nee avoid christmas
1076561763980795904	2018-12-22	[]	bor glit already try brown party mak
1076538623498035206	2018-12-22	[]	sev last minut ess guar best guest party season
1076511446517907456	2018-12-22	[]	nee slow els burn
1076497588633899009	2018-12-22	[]	styl contribut christmas
1076478726135783425	2018-12-22	[]	here's watch list read christmas
1076462620176252928	2018-12-22	[]	win christmas gift accord queen christmas @claudiawinkle
1076448018889691136	2018-12-22	[]	answ hous swap advert ear thirty chang lif
1076433677775765504	2018-12-22	[]	leav man hom christmas bet everyon say @dollyalderton
1076417315095355392	2018-12-22	['#wardrobemistress']	shop snuggest styl faux fur coat high street chos @janemcfarland
1076402974329573376	2018-12-22	[]	sleek sportswear modern util spirit trend resort 2019 collect
1076387116861571072	2018-12-22	[]	job interview first dat @louiseredknapp adv dress life's big transit
1076154447011725312	2018-12-21	[]	2018 gav us styl inspir unexpect plac
1076153332069294085	2018-12-21	['#beautyboss']	party season mean sequin sparkl brown mak smoky smould altern @sarahjossel
1076145782443704320	2018-12-21	[]	best christmas gift every budget accord @claudiawinkle
1076135967969431552	2018-12-21	['#wardrobemistress']	coat season's import invest piec tak not @janemcfarland's pick best
1076130432318619648	2018-12-21	[]	gre particul sapph cinem mom rich story told away lesb dram clich @lottejeffs
1076121363444830209	2018-12-21	[]	comfort flat vary
1076115331863769093	2018-12-21	['#stylebaromet']	liz hurley fash rad find week's
1076108282224435200	2018-12-21	[]	top mix match styl velvet
1076101232706625537	2018-12-21	[]	shop sal lik insid style's pick best onlin discount right
1076092679858110464	2018-12-21	[]	iv drip prom inst rev boozy night dark sid much wel trend
1076085898163433472	2018-12-21	[]	sunday anoth styl exclud keir knightley talk friend @scarcurtis movy moth harsh real fam plu last minut gift list wear nye styl suit party season
1076058468195409920	2018-12-21	[]	stand lanct mistleto 20 red sequin dress @dollyalderton decemb decid best mon singl
1076058467348217856	2018-12-21	[]	column @indiaknight found perfect stock fil beauty junky lif
1076055185741529088	2018-12-21	[]	hotb misogyny group lon young men writ went undercov 'involuntary celibates'
1076051151378935808	2018-12-21	[]	last minut outfit access nee see party season
1076046380999806976	2018-12-21	['#beautyboss']	morn skinc routin tak less fiv minut 'cause deserv tim bed @sarahjossel
1076039836216238080	2018-12-21	[]	glow lik pro season style's pick best tan serum mist lot wint
1076035714888933376	2018-12-21	[]	quick quest hip charad @versace mus meg model ima hammam
1075852090256355328	2018-12-20	[]	convers avoid off party get tout suit
1075845194652762112	2018-12-20	[]	cyc short logoman trend defin 2018
1075828693413572610	2018-12-20	[]	22 ima ham redefin mean sexy spok model every wom lov
1075820385998905344	2018-12-20	[]	wear 'busy' lik badg hono might tim decel
1075813340579008513	2018-12-20	[]	three new fac mak skin smil wint
1075806289610072065	2018-12-20	[]	iv drip prom inst rev boozy night dark sid much wel trend
1075798503606140928	2018-12-20	[]	shop sal lik insid style's pick best onlin discount right
1075791705075580929	2018-12-20	[]	new raft film chang way gay fem expery repres screen
1075783647557492736	2018-12-20	['#wardrobemistress']	shop styl faux fur coat high street chos @janemcfarland
1075759485451415553	2018-12-20	[]	iv drip prom inst rev boozy night dark sid much wel trend
1075753193945161728	2018-12-20	[]	revers heat dam grow bob four wom shar hair secret
1075746902002552837	2018-12-20	[]	last minut party pan access nee rev outfit
1075737835565735936	2018-12-20	[]	glow lik pro season style's hassl guid tan wint
1075722746229866496	2018-12-20	[]	sorry break lip balm may harm good
1075715692203266048	2018-12-20	[]	@afuahirsch @sam__flowers @deccajourno try three new fac mak skin smil
1075706632741490688	2018-12-20	[]	top mix match styl velvet party season
1075693048896598016	2018-12-20	[]	ear ris lik success profess @benjaminspall @michaxndr discuss art morn routin
1075691538431336448	2018-12-20	[]	styl guru @alexa_chung shar fash rul
1075686751329533952	2018-12-20	[]	somehow fel lov @heawood recal answ hous swap ad ear thirty chang lif forev
1075677439295152129	2018-12-20	[]	burnout particul affect wom unsurpr many doubl duty run hom alongsid car here's slow
1075669392170672128	2018-12-20	['#beautyboss']	best mak brush cle effect @sarahjossel
1075663851436343297	2018-12-20	[]	job interview first dat @louiseredknapp adv dress life's big transit
1075467056806531073	2018-12-19	[]	last minut party pan access nee rev outfit
1075458755087794176	2018-12-19	[]	deal heat dam going grey grad grow bob four wom shar hair secret
1075451711504990209	2018-12-19	[]	styl contribut includ @dollyalderton @claudiawinkle shar christmas tradit
1075442899796586497	2018-12-19	[]	mak ey pop style's guid fak lash party season
1075436117317562368	2018-12-19	[]	handl reject grac workplac accord profess dam jan frant first fem direct brit antarct survey
1075426788258533376	2018-12-19	[]	somehow fel lov @heawood recal answ hous swap ad ear thirty chang lif forev
1075420756778106883	2018-12-19	[]	perhap princip form sex educ gen young wom @dollyalderton
1075411947263266817	2018-12-19	[]	iv drip prom inst rev boozy night dark sid much wel trend
1075407209163575301	2018-12-19	[]	new study @vouchercodesuk found stereotyp gend rol rif christmas 10 wom respons buy wrap pres four fiv respons dec tre org act
1075403243168194560	2018-12-19	[]	sleek sportswear modern util spirit trend resort 2019 collect
1075382247891574784	2018-12-19	['#wardrobemistress']	shop styl faux fur coat high street chos @janemcfarland
1075381740594704384	2018-12-19	[]	top mix match styl velvet party season
1075376455012499456	2018-12-19	[]	style's guid cult christmas
1075371502353166339	2018-12-19	[]	stun portrait stormzy moth abigail photograph oliv ros ad @npglondon's perm collect
1075361105537654784	2018-12-19	[]	what's star week find @vonstrunckel horoscop
1075356577379639296	2018-12-19	[]	@claudiawinkle sint apolog fal lov @uggs
1075349026512330754	2018-12-19	[]	slow tim poor overwork
1075345251911516160	2018-12-19	[]	@afuahirsch @sam__flowers @deccajourno try three new fac mak skin smil
1075340723573141505	2018-12-19	[]	sorry break lip balm may harm good
1075336948011667457	2018-12-19	[]	glow lik pro season style's hassl guid tan wint
1075331345453330433	2018-12-19	[]	@kylieminogue confirm legend slot glastonbury 2019 much ye
1075330405182652416	2018-12-19	[]	shop sal lik insid best onlin discount right
1075325874759761925	2018-12-19	[]	ear ris lik success profess @benjaminspall @michaxndr discuss art morn routin
1075322855330627584	2018-12-19	[]	form edit brit vog @ashulman2 reflect lif sint mad decid leav
1075319081425883136	2018-12-19	[]	new raft film chang way gay fem expery repres screen
1075315307101777920	2018-12-19	['#beautyboss']	best mak brush cle effect @sarahjossel
1075310525104435202	2018-12-19	[]	women's footbal fastest sport uk sint ear 2000s tak long play get profess sal
1075306296226799616	2018-12-19	[]	somehow fel lov @heawood recal answ hous swap ad ear thirty chang lif forev
1075102398748733441	2018-12-18	[]	burnout particul affect wom unsurpr many doubl duty run hom alongsid car here's slow
1075070097415376898	2018-12-18	[]	imagin workout condit mind much body
1075052867155841024	2018-12-18	[]	shop sal lik insid best onlin discount right
1075033104165810176	2018-12-18	[]	@gucci welcom first stud ecol de l'amour school flor train peopl craftsm produc skil key brand's herit
1075005292889415680	2018-12-18	[]	easy rel right we'd lik admit
1074993954284859393	2018-12-18	[]	new 4 com sery spun @glownetflix launch march it'll second glow feat pap
1074985137862004736	2018-12-18	[]	10 new shad @rihanna's @fentybeauty mattemoisel lipstick way they'll sal decemb 27th suspect christmas money disappear quick
1074976995115716608	2018-12-18	[]	prad going set divers council rac accus follow window display learn bet prom
1074749325840998400	2018-12-17	[]	hassl guid tan wint
1074741385683705858	2018-12-17	[]	hereby decl 2018 year @ladygaga
1074733724082810880	2018-12-17	[]	styl guru @alexa_chung shar fash rul
1074726433052860419	2018-12-17	[]	everyth nee know fak lash party season
1074720660218437633	2018-12-17	[]	lip balm may harm good
1074711571811762176	2018-12-17	[]	on tru relax gath fem friend partn least poor boyfriend
1074702767539871744	2018-12-17	[]	tackl year's sal lik pro edit best onlin discount
1074697484646141952	2018-12-17	[]	iv drip prom inst rev boozy night dark sid much wel trend
1074689186739970048	2018-12-17	[]	three new fac mak skin smil
1074681387603689474	2018-12-17	['#beautyboss']	cle mak brush effect @sarahjossel
1074671819590983680	2018-12-17	[]	new raft film chang way gay fem expery repres screen
1074666538249138176	2018-12-17	[]	we'v found best discount onlin right shop pleas thank us lat
1074655967365742592	2018-12-17	[]	top mix match styl velvet
1074650681422827521	2018-12-17	['#stylebaromet']	liz hurley fash rad find week's
1074642120630304769	2018-12-17	[]	@claudiawinkle sint apolog fal lov @uggs
1074628460465795072	2018-12-17	[]	tim poor overwork might tim decel
1074604273177190400	2018-12-17	['#sportsperson']	hug congr england women's netbal team award greatest sport mom team year year award
1074599875948494848	2018-12-17	[]	what's star week find @vonstrunckel horoscop
1074405283462561792	2018-12-16	[]	christmas mean friend com togeth plu ask @dollyalderton
1074364533987270657	2018-12-16	[]	burnout particul affect wom unsurpr many doubl duty run hom alongsid car
1074352221633028097	2018-12-16	[]	sleek sportswear modern util inspir 2019
1074342144322736128	2018-12-16	[]	wear christmas party outfit straight work mass 'a thing'
1074333453255172098	2018-12-16	[]	wait list tre
1074323264284098560	2018-12-16	[]	'instant revival' iv tre hangov act work @rosamundurwin investig
1074313197941899269	2018-12-16	[]	tim stop wear 'busy' lik badg hono
1074304640324419584	2018-12-16	[]	lif short queu frank here's prop
1074296838172352512	2018-12-16	[]	ev wond @claudiawinkle @dollyalderton @scarcurtis spend christmas
1074284760845963265	2018-12-16	[]	best book tv podcast get christmas ft @armchairexppod @wonderymedia
1074274190075879424	2018-12-16	[]	comfort flat vary gre day night
1074267897428668417	2018-12-16	['#beautyboss']	could bacter mak brush av toilet brush @sarahjossel run best new brush buy cle prop
1074260598890864642	2018-12-16	[]	gre particul sapph cinem mom rich story told away lesb dram clich @lottejeffs
1074252798752161792	2018-12-16	[]	many luxury fash hous commit fur fash faux nev look bet
1074243239769726976	2018-12-16	[]	alway thought bottom barrel oft jok rath blist freez ankl wrong i'm sorry @claudiawinkle
1074235938165964800	2018-12-16	[]	'a perfect mascar party season'
1074227883076411392	2018-12-16	[]	tim 'partners welcom christmas party left plu hom @dollyalderton
1074218572187136006	2018-12-16	[]	lucky learn slow coach colleagu learnt much hard way breakdown ev lif il cris catalyst reassess lifestyl @sundaytimeslc
1074055248464003078	2018-12-15	[]	'i ev on par alway alway enough'
1074025048602746881	2018-12-15	[]	'self born sec independ well'
1074002153151348737	2018-12-15	[]	beauty rut clich thing act hap everybody here's step @indiaknight overcom
1073992341097250816	2018-12-15	[]	much real know hormon
1073981259192418305	2018-12-15	[]	sex city teach dat
1073974716795371528	2018-12-15	['#beautyboss']	gre bright giv good glow @sarahjossel
1073968675449761792	2018-12-15	[]	cloth giv confid choos right piec com find confid bit catch @louiseredknapp
1073960877991313409	2018-12-15	[]	promot gap prev pay gap rar talk
1073953325698220038	2018-12-15	[]	swear good
1073942005355565056	2018-12-15	['#beautyboss']	@sarahjossel rev sev beauty secret everybody know
1073934452542328833	2018-12-15	[]	bold beauty whatev ag
1073922371155836930	2018-12-15	[]	relax don pub party lat night dant
1073873551210483712	2018-12-15	[]	lip keep cyc dry
1073856186506719232	2018-12-15	[]	feel lik wardrob clear right way
1073850157463207937	2018-12-15	['#guccitimepiec']	gucc dazzl new timepiec tim party season see ful collect
1073654128226787330	2018-12-14	['#beautyboss']	head every produc us cre look cost less 10 real @sarahjossel
1073647075366236161	2018-12-14	[]	stand lanct mistleto 20 red sequin dress @dollyalderton decemb decid best mon singl
1073639080599150594	2018-12-14	[]	play hip charad coolest model mom ima hammam
1073617115595321344	2018-12-14	['#wardrobemistress']	coat season's import invest piec tak not @janemcfarland's pick best
1073608824869871617	2018-12-14	[]	stil got tim peopl
1073600254178668545	2018-12-14	[]	column @indiaknight found perfect stock fil beauty junky lif
1073593745411579905	2018-12-14	['#beautyboss']	party season mean sequin sparkl brown mak smoky smould altern @sarahjossel
1073586165129850881	2018-12-14	[]	best christmas gift every budget accord @claudiawinkle
1073575874107244545	2018-12-14	['#stylebaromet']	friend fash high hair access what's going week
1073548589383737344	2018-12-14	[]	sunday shop sal lik insid edit best onlin discount plu faux fur coat wear velvet @dollyalderton plu style's nee guid cult christmas
1073533813857366016	2018-12-14	[]	hotb misogyny group lon young men writ went undercov 'involuntary celibates'
1073529289667215360	2018-12-14	[]	ear ris lik success profess @benjaminspall @michaxndr discuss art morn routin
1073526015132094465	2018-12-14	[]	glow lik pro season style's pick best tan serum mist lot wint
1073521740570157056	2018-12-14	[]	magnet falsy lvl lift fak eyelash sery makeov everyth nee know party season
1073518718762799104	2018-12-14	[]	heat dam going grey grad four wom get root hair dilemma
1073514426823819265	2018-12-14	[]	today mark 100 year sint first uk wom head pol legisl allow wom 30 met minim property qual vot pass febru 1918 first opportun gen elect decemb 14
1073506701171675136	2018-12-14	['#christmasjumperday']	happy kid wear
1073310594667896832	2018-12-13	[]	sum light she formula tim found clout
1073303300454387712	2018-12-13	[]	cyc short logoman bodycon dress edit assist @clarastrunck got @kyliejenner tre
