id	created_at	hashtags	cleaned_text
1049951339315437568	2018-10-10	['#worldmentalhealthday']	@bumble @hnpapp launch new in champ ment wellb bee mindful bring togeth eight lead wom short film aim redefin success norm lif challeng
1049948410554527744	2018-10-10	['#worldmentalhealthday']	exerc ment heal go hand hand style's @fleurbritten investig fit trend best nurt posit mindset
1049939970499203072	2018-10-10	[]	chang weath cal lay chic trench coat styl solv
1049934822020435968	2018-10-10	[]	2019 met gal them annount camp not fash harry styl lady gag seren william act celebr co bring
1049925757491929089	2018-10-10	['#worldmentalhealthday']	march 2017 @zaynmalik op styl struggle anxy eat disord
1049723175238623237	2018-10-09	[]	accord @indiaknight wom swear happy
1049715626443505664	2018-10-09	['#beautyboss']	limb deserv lov @sarahjossel sav day best moist exfo buy
1049706569703858176	2018-10-09	[]	hap @dollyalderton went brunch man ghost
1049698264340140038	2018-10-09	[]	hap wheb @janemcfarland met king kitsch @itsjeremyscott
1049691370548617216	2018-10-09	[]	bout dat fatigu @divyablabla wond let moth tak rein way forward
1049682910750625792	2018-10-09	[]	icym jamy dorn spok exclud styl real fam baby numb three
1049676128196145152	2018-10-09	[]	mak import decid read @vonstrunckel's insight horoscop week
1049668827263438854	2018-10-09	['#wardrobemistress']	leath coat surpr piec autumn wardrob nee @janemcfarland shar favourit expert styl tip
1049661281815400449	2018-10-09	[]	nee abl feel comfort jul pierc @bofaml com gay work
1049653720076754944	2018-10-09	[]	four bed cliffsid view plenty priv world's sexiest bedroom accord new book @smithhotels
1049646434704752640	2018-10-09	[]	mapo tofu hash brown marmalad martin brunch got bouj we'r
1049631155195121664	2018-10-09	[]	duk duchess cambridg ar first glob min ment heal summit today ahead
1049622645103321089	2018-10-09	[]	@jcrew's exclud collab demy lee lik autumn bottl brim chunky knit cosy access launch today
1049618491047854081	2018-10-09	[]	trench coat season ar ful forc shop pick best
1049616995136786433	2018-10-09	['#tuesdaythought']	saoirs ronan's adv teen self rel
1049611434991202304	2018-10-09	['#stylebaromet']	spok annoy internet phrase nee go find els going week
1049608923228110853	2018-10-09	[]	happy 22 @bellahadid throwback april 2017 cov story world's coolest model
1049600870592200704	2018-10-09	[]	wom angry @pinsykes tel har rag good
1049596049667559425	2018-10-09	[]	kany west set meet donald trump thursday discuss manufact chicago job prospect form convict 2018
1049593569814679554	2018-10-09	[]	three wom fifty ag help refin sens styl
1049589294376124416	2018-10-09	[]	gemin tim tackl issu head @vonstrunckel horoscop week
1049585779222167552	2018-10-09	[]	could @gwynethpaltrow's goop guid sex rev rel
1049581495126544384	2018-10-09	[]	embrac new season workwear soft silhouet relax tail
1049576363697553409	2018-10-09	[]	competit sport may key progress car here's
1049563584605376513	2018-10-09	[]	four bed cliffsid view plenty priv get exclud look new book @smithhotels world's sexiest bedroom avail preord today
1049376137875546114	2018-10-08	[]	raspberry pink coat set piec season nev guess
1049367580253868034	2018-10-08	['#beautyboss']	autumn may upon us body stil deserv tlc try moist exfo @sarahjossel
1049360031278387200	2018-10-08	[]	@lafressange combin fle market treas upsc design cre eleg par hom
1049353237512511492	2018-10-08	[]	mapo tofu hash brown marmalad martin brunch got bouj we'r
1049344695653027841	2018-10-08	[]	@queereye's fab fiv mom becam friend ut heartwarm
1049337632021471232	2018-10-08	[]	fem ceo workplac eq campaign nee know
1049329366881189889	2018-10-08	[]	@johnlegend shar unseen pic daught lun they're cut cannot deal
1049322299151855617	2018-10-08	[]	writ @divyablabla bout dat fatigu consid arrang marry
1049314999464865792	2018-10-08	[]	jamy dorn speak exclud styl famy fam baby numb three
1049307200143941634	2018-10-08	['#wardrobemistress']	retro shad back fash map @janemcfarland sag styl tip
1049299381340581889	2018-10-08	[]	boyfriend brexit commut conundrum @mrsmillsst answ quest
1049292107784101893	2018-10-08	[]	saoirs ronan's mov adv teen self reson everyon
1049283691963437062	2018-10-08	['#stylebaromet']	turbo wel decid com rain shin find els going
1049281508492673024	2018-10-08	[]	@barbie launch new dol bas jody whittak doct avail onlin today maj
1049274733999677440	2018-10-08	[]	us effect ang produc galv emot @pinsykes discuss femin pow rag
1049263075688419328	2018-10-08	['#metoo']	would bridget jon mak mr tit pervert 2018 hel field rev lit heroin discuss femin wom today
1049254649075785728	2018-10-08	[]	@gigihadid rev fac @hm upcom collect @moschino week issu met man behind @itsjeremyscott
1049247628532305920	2018-10-08	[]	@burberry @kingscollegelon launch bril new in young peopl yorkshir burberry inspir provid eight schools art aim assess cre learn benefit stud
1049238927041814528	2018-10-08	[]	four bed cliffsid view plenty priv world's sexiest bedroom accord new book @smithhotels
1049229928129081344	2018-10-08	[]	best trench coat high street modern tak wardrob stapl happy shop
1049223131381092352	2018-10-08	[]	mov christian grey spok jamy dorn famy fam emot project yet
1049218350973427712	2018-10-08	['#wardrobemistress']	leath coat surpr wear trend get stuck season @janemcfarland shar favourit high street
1049212057772548096	2018-10-08	[]	nee abl feel comfort jul pierc bank americ merril lynch com gay work
1049208278452985857	2018-10-08	['#stylebaromet']	funky coast homew must find get week's
1049202562401030144	2018-10-08	[]	scorpio tim say ye @vonstrunckel horoscop week
1048996632522645504	2018-10-07	['#beautyboss']	limb nee littl extr lov autumn @sarahjossel found best body moist exfo includ mirac produc that's 5
1048987577959809024	2018-10-07	[]	would let moth choos husband on writ expl arrang marry chang 2018
1048985818864504833	2018-10-07	[]	jamy dorn speak exclud styl famy fam baby numb three
1048972225934774272	2018-10-07	[]	raspberry pink coat john lew sold day fash direct @janemcfarland ask what's hyp
1048962162113351682	2018-10-07	[]	ok angry wom world giv lot angry two new book champ femin pow rag
1048951583835402244	2018-10-07	['#wardrobemistress']	leath wor invest best piec buy styl accord @janemcfarland
1048945291754438666	2018-10-07	['#stylebaromet']	find what's hot what's week's
1048936237199966208	2018-10-07	[]	@claudiawinkle strong opin @gucci's latest fash expery
1048925158076035073	2018-10-07	[]	spok exclud jamy dorn ak guy hollywood ahead new film priv war
1048922140387540993	2018-10-07	[]	bout dat fatigu @divyablabla wond let moth tak rein way forward arrang marry digit makeov
1048912576493572097	2018-10-07	[]	styl meet king kitsch @itsjeremyscott ahead @hm @moschino collab
1048906536343486464	2018-10-07	[]	nee abl feel comfort @julespierceferg com gay work
1048895967272095744	2018-10-07	[]	insid look world's sexiest bedroom
1048894459180724230	2018-10-07	[]	new tre claim ban dark spot wrinkl unev skin text hand result wor bru
1048884136809844736	2018-10-07	[]	@indiaknight found org skinc rang act work pra
1048876087139287040	2018-10-07	[]	tir told calm dear @pinsykes look har fem fury good
1048865519519129600	2018-10-07	[]	kne boot autumn ess best high street styl modern way
1048860511360749570	2018-10-07	[]	nar grow old eq bor cloth nee go away three trailblaz wom explain styl evolv
1048855447938191360	2018-10-07	[]	avo toast bouj new brunch know marmalad martin anyon
1048850920619036672	2018-10-07	[]	@indiaknight fal lov new nat org lin multipurpos produc think lov
1048849847942565888	2018-10-07	[]	vot op cast vot sunday tim sportswom year award chant win
1048846388157718528	2018-10-07	[]	jamy dorn mad hollywood ahead anticip biop year speak exclud @scarroserussell he's happiest hom cotswold
1048836577185738752	2018-10-07	[]	sometim ghost phas think not rel radio slow turn volum @dollyalderton tel ghost story
1048830305078038528	2018-10-07	[]	chang way dress ag @sundaytimeslc talk lat styl
1048652620460687361	2018-10-06	['#beautyboss']	rethink fragr autumn @sarahjossel's favourit
1048637819164536835	2018-10-06	[]	microneedl solv adult acn problem skin assist beauty edit @phoebejmcd giv go
1048620910268370945	2018-10-06	[]	men hypocrit resid agony aunt @mrsmillsst nev sug coat
1048604061866610688	2018-10-06	[]	stay season yay book tv show film nee tid
1048589204228378626	2018-10-06	[]	four wom diff stag lif discuss hormon affect
1048575361896931328	2018-10-06	[]	best trench coat high street right happy shop
1048559002601308160	2018-10-06	['#metoo']	would bridget jon mak mr tit pervert 2018 hel field rev lit heroin discuss femin wom today
1048543653453594624	2018-10-06	[]	promot gap mat @rosamundurwin investig pay gap's less known eq ug sist
1048536105572810752	2018-10-06	[]	recal tim drast disobey par bar il ear pierc edit assist @clarastrunck mak cas germ par
1048514209003311104	2018-10-06	[]	think microblad put sem eyebrow tattoo test
1048498857674465281	2018-10-06	[]	aa gill's daught @floraegill hono lat fath cre way
1048483256293888002	2018-10-06	[]	femin simpl wom eq men every are lif tru via edit @sundaytimeslc
1048468912340393984	2018-10-06	[]	almost non world best brightest leav morn chant perfect art morn routin accord enlight book @benjaminspall @michaxndr
1048275387317411843	2018-10-05	['#metoo']	april cov star @zoekravitz got real hollywood mov put happy first
1048265576219652097	2018-10-05	['#metoo']	year hel field rev lit heroin bridget jon discuss femin wom today
1048256887039385603	2018-10-05	['#beautyboss']	head smould mak look cre us produc 10 here's @sarahjossel
1048249215795777536	2018-10-05	[]	stay season yay book tv show film nee tid
1048247732673159168	2018-10-05	[]	@mindykaling @rwitherspoon @oprah wom inspir inspir thing watch today
1048244680914358272	2018-10-05	['#metoo']	@tinder co adapt er year sint first weinstein alleg brok
1048242168178114562	2018-10-05	['#wardrobemistress']	caramel nutell camel oh season's hottest shad brown get right @janemcfarland sart know
1048232063046995968	2018-10-05	[]	year sint weinstein alleg first brok ls hilton interrog gend dynam pow
1048226683403296769	2018-10-05	[]	secret soft shiny hair beauty guru @indiaknight found answ least expect
1048225855586099201	2018-10-05	['#beautyboss', '#ad']	@sarahjossel put new glow produc @lauramercier test watch ful styl play
1048221029255004162	2018-10-05	[]	best new menswear buy boy liv
1048205676890284034	2018-10-05	[]	cre sustain fash econom requir effort brand consum here's mak diff
1048197080542527488	2018-10-05	[]	sunday jamy dorn op famy rel @dollyalderton sit man ghost @pinsykes sick told calm dear three wom fifty expl styl evolv
1048196628136562689	2018-10-05	[]	hallelujah chunky knit season almost upon us pleas high street off
1048189825529073665	2018-10-05	[]	embrac new season workwear soft silhouet relax tail
1048181303701622785	2018-10-05	[]	best trench coat high street right happy shop
1048174472426115072	2018-10-05	[]	see gay rel [in publ way] import refresh @samsmith talk mus fam break
1048139827160473601	2018-10-05	[]	@instagram showcas favourit brand shiny new pop cov gard two day shop piec @rixo_london carry elizabe jewellery go
1047925076572721153	2018-10-04	[]	angry pay gap angry men biolog clock ev angry she injust men go hen dos @dollyalderton say
1047915271615385602	2018-10-04	[]	@mindykaling @rwitherspoon @oprah wom inspir inspir thing watch today
1047909748899811331	2018-10-04	[]	soo @margotrobbie celebr wed unconv way
1047902684072878080	2018-10-04	[]	microneedl solv adult acn problem skin assist beauty edit @phoebejmcd giv go
1047894552529526785	2018-10-04	['#beautyboss']	nee new scent autumn @sarahjossel's favourit
1047888333400150016	2018-10-04	[]	told cre hotel suit feel could spok @pandrewdesign brit design breath new lif @ferragamo
1047881291578916864	2018-10-04	[]	stay sleek modern roundup best watch buy
1047871986309980160	2018-10-04	[]	men hypocrit @mrsmillsst tel
1047865191415910406	2018-10-04	[]	edit @sundaytimeslc femin eq bridget jon baromet far we'v com
1047840025138876416	2018-10-04	[]	unseen memoir bil cunningham pion street styl fash photograph prob on peopl rihann would lin photo goe sal today
1047835508242624512	2018-10-04	[]	@hm's whims new collect tak inspir brit design william mor brim rich fabr flor print mor &amp; co collab launch stor onlin today yum
1047835487782809601	2018-10-04	[]	@liyakebede season's boldest look autumn styl inspir nee
1047831539306905600	2018-10-04	[]	@nigella_lawson celebr brand 20th annivers edit first book eat throwing back 2003 shoot culin queen
1047828188792020992	2018-10-04	['#nationalpoetryday']	tru via @nktgill
1047826679400484865	2018-10-04	[]	show ruin hair @indiaknight mak strong cas wat soft
1047818957674221568	2018-10-04	[]	new ad @britneyspears's upcom perfum prerog latex od noughty britney know lov maj
1047817344549097472	2018-10-04	['#styletodol']	new exhibit @theunitlondon celebr britain lead fem art 21st century wom op today showcas work hel beard ann freem bentl
1047815075862630400	2018-10-04	[]	best quiz ev quot party conf speech fifty shad pretty pain let's hon
1047814096513585152	2018-10-04	['#metoo']	hap auth hel field rev icon bridget jon discuss femin wom today
1047809314029785089	2018-10-04	['#thursdaythought']	six lead wom shar best car adv they've ev giv @sundaytimeslc
1047804531252350976	2018-10-04	[]	competit sport may key progress car here's
1047797749754806272	2018-10-04	[]	mididress versatil autumn styl hero nee wardrob
1047796157521510400	2018-10-04	[]	week's cov star dakot johnson hono tak quiz lin clunky erot fifty
1047791949363732480	2018-10-04	['#nationalpoetryday']	happy @rupikaur_
1047788925799084032	2018-10-04	[]	austral becam innov plac beauty
1047780114027749376	2018-10-04	[]	lou trot nam new cre direct @lacoste mak first wom head sportswear brand 85 hist ya
1047778731228585984	2018-10-04	[]	@dvf becom latest design stand anim cruel 2019 onward brand ban exot skin mohair angor fur collect
1047774402010648576	2018-10-04	[]	@lafressange combin fle market treas upsc design cre eleg par hom
1047769803090477057	2018-10-04	[]	slouchy tail undon styl menswear edit pur autumn bliss
1047763510837633025	2018-10-04	['#thursdaythought']	par provid young girl best found lead @melindagates @sherylsandberg shar thought
1047758483154776064	2018-10-04	[]	put situ expos thing scar @tanni_gt pivot new car
1047752436222492673	2018-10-04	['#nationalpoetryday']	food thought @nayyirahwaheed
1047749090153582593	2018-10-04	[]	@blackishabc star @traceeellisross wom inspir incred way celebr 40th
1047565962210414595	2018-10-03	[]	match becom tow inferno step ear kathryn jacob ob answ work dilemma
1047554886873878529	2018-10-03	[]	select chunky knit mak almost happy sum
1047548602116182016	2018-10-03	[]	forget millen pink sug new shad obsess
1047541046232698884	2018-10-03	[]	par divorc mad believ lov ev @samsmith get real famy break fight rom
1047533023951036417	2018-10-03	[]	shop dd lingery nightm brand chang thing
1047526194600726528	2018-10-03	[]	@dollyalderton lot say humy hen dos
1047517382292504577	2018-10-03	[]	shan twain boot lust accord @claudiawinkle
1047510084115472384	2018-10-03	['#fdwp']	contribut edit @scarcurtis introduc new book incred cast wom contribut
1047504045735378950	2018-10-03	[]	modern bohem @liyakebede show us wear autumn's brightest trend
1047488068482211840	2018-10-03	[]	paint chines art zao wou sold $65 mil auct @sothebys hong kong mak expend paint ev sold as art
1047487025606270979	2018-10-03	[]	@blackmirror report work interact episod allow view choos end wel black mir
1047485926820274177	2018-10-03	[]	av wom think quit job 17 tim year interest new study assocy account techn found
1047467470515261440	2018-10-03	[]	chic duk duchess sussex visit namesak county afternoon
1047461016899145729	2018-10-03	['#wednesdaywisdom']	equip young wom lead rol accord @melindagates @sherylsandberg
1047454485931601920	2018-10-03	[]	mak decid consult @vonstrunckel's insight horoscop week
1047444758719877121	2018-10-03	[]	avocado bae ak @antoni @queereye off op first resta vil den new york fast affair serv rang heal conscy high instagram meal cours
1047443046025945088	2018-10-03	[]	first tim leg hist maj panel hear cas uk suprem court three wom on man set rul cas concern right child ment heal issu today
1047437366460370944	2018-10-03	['#wednesdaywisdom']	divorc look lik 2018 perceiv famy unit shift @indiaknight reflect
1047435097211899904	2018-10-03	[]	turn grief anxy il stop track look fit nurt ment heal
1047429478761332738	2018-10-03	[]	corduroy tak cent stag season we'v pick best piec high street
1047422756961341440	2018-10-03	[]	austral becom innov plac beauty @emmastrenner expl new wav plant veg produc nee know
1047415237513756672	2018-10-03	[]	could competit sport help get promot pro athlet certain think
1047406990853644288	2018-10-03	[]	mididress versatil autumn styl hero nee wardrob
1047404310118748160	2018-10-03	['#october3rd']	tim year
1047403209663426560	2018-10-03	[]	big congr @zoetheball set becom first fem host @bbcradio2 breakfast show replac chris ev new year
1047385780774158336	2018-10-03	['#beautyboss']	drunk eleph launch uk fin read @sarahjossel guid skinc brand act work
1047190992347189249	2018-10-02	[]	salv @ferragamo back cre form thank smal part @pandrewdesign sat brit design
1047184952889171969	2018-10-02	[]	play competit sport help get promot
1047177394048716800	2018-10-02	[]	guid cult autumn @travon's comedy @faviken's bak whol load book curl
1047169604286644231	2018-10-02	[]	show ruin hair @indiaknight mak strong cas wat soft
1047162060499558401	2018-10-02	[]	insight read @louiseelisabet tak us insid world arab beauty salon
1047156520323092481	2018-10-02	[]	angry pay gap angry men biolog clock ev angry she injust men go hen dos @dollyalderton say
1047147200965431296	2018-10-02	[]	new bree divorc wom happy empow thrilled singl
1047140671553978368	2018-10-02	[]	stat coat see aw18
1047131857509322752	2018-10-02	['#beautyboss']	secret glowy rady skin accord @kimkardashian's mak art @makeupbymario @sarahjossel
1047125548936454144	2018-10-02	[]	duchess cambridg return matern leav visit paddington recr ground london
1047117768552796161	2018-10-02	[]	new celeb second shop enco sustain approach fash @methoduk slow fash stor op octob 16 17 shoreditch invit don unw cloth old gar custom right thing peopl
1047110505037475840	2018-10-02	[]	twee check corduroy reimagin 2018 result tru swoon
1047109211627433985	2018-10-02	['#worldballetday']	we'r throwing back convers mary hel bow form prim ballerin who's get point
1047099042570874880	2018-10-02	[]	near quart 16 year old would pict wear piec cloth 1 tim soc med throwing new research @methoduk found depress
1047087730390392832	2018-10-02	[]	book exhibit film nee see autumn welcom
1047075729941434368	2018-10-02	['#warrobemistress']	camel buttery hue set domin autumn wardrob @janemcfarland schools us wear wel
1047068572239966208	2018-10-02	['#pfw']	baywatch mak fash @pamfoundation tak stroll @chanel pres
1047064301234790401	2018-10-02	['#pfw']	soo @chanel cre act beach insid grand pala ss19 pres
1047061174334971906	2018-10-02	[]	easy mididress revamp look autumn
1047048818380955648	2018-10-02	['#beautyboss']	morn beauty routin tak less fiv minut caus deserv tim bed @sarahjossel
1047045279319564288	2018-10-02	[]	simpl hom improv could mak hair much soft
1047041116804124673	2018-10-02	[]	read horoscop week
1047033957181792256	2018-10-02	[]	austral becom innov plac beauty @emmastrenner expl new wav plant veg produc nee know
1047030693275082752	2018-10-02	['#beautyboss']	feel bit wors wear @sarahjossel's 5 tut ban dark circ easy
1047027412226183168	2018-10-02	[]	femin look lik today edit @sundaytimeslc reflect f 2018
1047022039071174656	2018-10-02	['#styletodol']	exhibit paint sculpt ceram lyd corbet ak picasso mus op @mallgalleries london today
1046838165305212928	2018-10-01	['#metoo']	auth hel field rev icon bridget jon discuss femin wom today
1046828606536728576	2018-10-01	['#beautyboss']	secret glowy rady skin accord @kimkardashian's mak art @makeupbymario @sarahjossel
1046822311461048325	2018-10-01	[]	column @dollyalderton tak hor hen dos
1046813282076700673	2018-10-01	['#beautyboss']	4 blush @sarahjossel ut obsess
1046807973094457349	2018-10-01	[]	versatil mididress revamp look
1046800917817937920	2018-10-01	['#beautyboss']	new season new scent @sarahjossel pick favourit autumn fragr
1046792268575911936	2018-10-01	[]	could competit sport get promot @fleurbritten investig play giv adv boardroom
1046781245089304581	2018-10-01	[]	par provid young girl best found lead @melindagates @sherylsandberg shar thought
1046761238829694977	2018-10-01	[]	@liyakebede season's boldest look autumn styl inspir nee
1046761183171293184	2018-10-01	[]	best bag season stat shop pick best
1046748348508774400	2018-10-01	['#ocdtob']	learn someth wrot ocd @theststyle resourc try @ocduk @oc
1046748076541661184	2018-10-01	[]	salv @ferragamo back cre form thank smal part @pandrewdesign sat brit design
1046742036446089217	2018-10-01	[]	hono breast cant aw mon @girlstolelondon don 25% process tit tee breast cant char get shop
1046737003172286465	2018-10-01	[]	icon childr charact matild back 30 year @roald_dahl book publ illust sir quentin blak reimagin heroin vary car world travel ceo brit libr many feel
1046731711483179008	2018-10-01	[]	sleek watch every occas swoon
1046728192625717251	2018-10-01	[]	mak decid consult @vonstrunckel's insight horoscop week
1046722400946180098	2018-10-01	['#metoo']	bridget jon read diary 2018 auth hel field rev icon charact discuss femin wom today
1046716883729289216	2018-10-01	[]	@scarcurtis's new collect essay joy celebr femin intersect reflect road publ
1046706342453542913	2018-10-01	[]	@sadiqkhan annount new in celebr london unseen wom octob 18 28 artwork across capit spotlight wom inc east london suffraget wom built waterloo bridg
1046702535078285312	2018-10-01	[]	tan bag access season best high street
1046692961541660672	2018-10-01	[]	nee new book best exhibit film complet cult guid autumn welcom
1046689937251348480	2018-10-01	['#warrobemistress']	camel buttery shad set domin wardrob autumn @janemcfarland schools us wear wel
1046683012778389504	2018-10-01	[]	pair $17 mil stiletto gon sal duba cre jad duba @passionjeweller sho mad gold leath silk embel 236 diamond set whit gold word
1046678110790471680	2018-10-01	[]	show ruin hair @indiaknight mak strong cas wat soft
1046671678728806400	2018-10-01	[]	every day far we'r concern
1046667039505559552	2018-10-01	[]	mak decid consult @vonstrunckel's insight horoscop week
1046661997335646208	2018-10-01	['#styleleadingwom']	juggl famy work easy peopl mak sound
1046451264471662592	2018-09-30	[]	@abrowntable @edentravels @innatelyn8 @woollardjessica @susannahotter @quadrillefood go
1046445573191192576	2018-09-30	[]	'hen dos along menstru childbir high heel sport bra smear test cystit on pain real wom @dollyalderton
1046444685517090816	2018-09-30	[]	via @theststyle tim felt lik femin anoth intimid thing suppos along
1046435756208721920	2018-09-30	[]	access trend know
1046435000873299968	2018-09-30	[]	week's @theststyle column hen dos friend @ed_cripps get marry
1046423175465193472	2018-09-30	['#stylebaromet']	anklet sock act thing near naff sound
1046414413035700224	2018-09-30	[]	could microneedl fac solv por problem
1046404309611614208	2018-09-30	['#beautyboss']	season shift sum scent going cut @sarahjossel mak cas autumn fragr shop
1046394232532094980	2018-09-30	[]	meet paul andrew brit bring chang @ferragamo @janemcfarland
1046393725470093313	2018-09-30	[]	rec becam world champ fif tim easy rid @redbull mountain bik @rach
1046385677334716417	2018-09-30	[]	excit produc beauty com austral right sery eco cred
1046377874704535552	2018-09-30	['#swoty']	fem athlet mak win entrepr pick hockey stick
1046376631458299905	2018-09-30	['#metoo']	bridget jon er hel field exclud @theststyle today @louisamcg
1046365796312723456	2018-09-30	[]	guid cult autumn @travon's comedy @faviken's bak whol load book curl
1046355225085444096	2018-09-30	['#wardrobemistress']	caramel coff chestnut show wear camel wel @janemcfarland
1046355015764447233	2018-09-30	[]	comedy blackboard wait wait bil @marinaoloughlin @gilescoren rev restaur
1046348933147045893	2018-09-30	[]	modern bohem @liyakebede show us wear autumn's brightest trend
1046341635615928320	2018-09-30	[]	season's bag new bag click away
1046333833392672768	2018-09-30	['#fdwp']	mean act 2018 @scarcurtis introduc new book amaz cast wom contribut
1046324272011116544	2018-09-30	[]	shan twain may onto someth say @claudiawinkle going want boot
1046316973414658048	2018-09-30	[]	diff wat soft mad @indiaknight's hair big surpr
1046308920288055296	2018-09-30	[]	@dollyalderton lot say humy hen dos 'more heteronorm michael bubl alb volkswagen'
1046299609025449984	2018-09-30	['#metoo']	would bridget jon deal mr tit pervert 2018 post
1046289542389673984	2018-09-30	[]	bridget jon baromet far we'v com say @sundaytimeslc
1046175754139193344	2018-09-29	[]	bridget jon back reread old diary exclud styl put without ev know right put
1046162591087759361	2018-09-29	[]	pap tomorrow @thesundaytimes includ @theststyle exclud bridget jon
1046115652078112768	2018-09-29	[]	shop dd lingery nightm we'v got back lit metaph
1046099046279139332	2018-09-29	[]	par provid young girl best found lead @melindagates @sherylsandberg shar thought
1046083709940781056	2018-09-29	[]	mididress go gar autumn dress perus pick best
1046069850735546374	2018-09-29	['#recyclingweek']	circul fash econom join read guid
1046054507635978243	2018-09-29	[]	twee check corduroy reimagin 2018 result tru swoon
1046037654125662208	2018-09-29	[]	wom middl east beauty salon plac sanctu comp @louiseelisabet tak us insid
