id	created_at	hashtags	cleaned_text
841665285669101568	2017-03-14	['#spring2017', '#thisisboss']	light meet col boss campaign
841257560908881921	2017-03-13	['#thisisboss', '#spring2017']	prep perfect shot spring 2017 campaign
840834778777632768	2017-03-12	['#thisisboss']	light dark new leath access boss
840532775518191616	2017-03-11	['#spring2017', '#thisisboss']	fin touch boss campaign shoot
840215699872071680	2017-03-10	['#spring2017', '#thisisboss']	relax mom set boss womenswear
840191504152952834	2017-03-10	['#spring2017', '#thisisboss']	glimps behind scen boss campaign shoot
839853313625505792	2017-03-09	['#spring2017', '#thisisboss']	laid sum styl boss womenswear
839810809458917376	2017-03-09	['#spring2017', '#thisisboss']	next ready boss womenswear
839490924631609344	2017-03-08	['#spring2017', '#thisisboss']	easy modern eleg boss womenswear
839462451896856578	2017-03-08	['#fcbpsg', '#suitedbyboss', '#bosssport']	ahead tonight match @javi_pastore @tsilva3 @lucasmoura7 wear boss cre look tail
839445627826126849	2017-03-08	['#spring2017', '#thisisboss']	ton ton
839128544538058753	2017-03-07	['#thisisboss', '#spring2017']	new opt sunglass boss
839083240006676481	2017-03-07	['#spring2017', '#thisisboss']	ton ton new shad
838804381835251712	2017-03-06	['#thisisboss', '#spring2017']	modern neut dress discov new collect
838759952759959553	2017-03-06	['#spring2017', '#thisisboss']	lux leath lightweight tail collect discov
838358473582616576	2017-03-05	['#thisisboss']	elect blu dress boss runway edit shop collect
837996150741336065	2017-03-04	['#thisisboss', '#spring2017']	vibr technicol runway fin new boss bespok soft discov
837694283440271360	2017-03-03	['#thisisboss', '#spring2017']	soft perfect undon tail boss runway edit discov
837633689005674501	2017-03-03	['#thisisboss', '#spring2017']	vivid poppy red dress new boss runway edit avail shop
837331745892511746	2017-03-02	[]	detail boss womenswear spring 2017 runway collect avail
837277511813849088	2017-03-02	['#thisisboss', '#spring2017']	runway edit shop spring 2017 collect runway
837018032929136640	2017-03-01	[]	alex back he's endeavo quay alongsid @hugoboss post @vendeeglobe refit see alex h
836620998174728192	2017-02-28	['#bosssport', '#f1']	exceiv engin detail boss merc collect discov
836553293254037504	2017-02-28	['#bosssport', '#f1']	ey @nico_rosberg boss merc collect discov
836226359349346304	2017-02-27	['#bosssport', '#f1']	@nico_rosberg show dynam detail boss merc collect discov
836202797272039429	2017-02-27	['#bosssport', '#f1']	inspir rac track new boss merc collect shop
836178435076734984	2017-02-27	['#vfosc']	@renner4real wear bespok three tuxedo boss party expl eveningwear
836176494552580096	2017-02-27	['#vfosc']	bespok boss van fair osc party @edgarramirez25 look sharp discov eveningwear
836141920837644288	2017-02-27	['#osc']	ready party bespok boss tuxedo @miles_teller van fair osc party expl eveningwear
836097682443743232	2017-02-27	['#osc', '#suitedbyboss']	tim @renner4real wear boss tuxedo red carpet expl eveningwear
835738662734278657	2017-02-26	['#spiritaward', '#suitedbyboss']	@edgarramirez25 @miles_teller appear boss suit expl eveningwear
835467225633075202	2017-02-25	['#bosssport']	engin design sleek styl boss merc collect worn @lewishamilton
835149022931398656	2017-02-24	['#thisisboss', '#spring2017']	impecc season new collect boss discov
835087557759234048	2017-02-24	['#thisisboss', '#spring2017']	tim new season styl expl new boss menswear collect
834818587231662081	2017-02-23	['#thisisboss', '#spring2017']	sharp styl soph next discov collect
834753254026309632	2017-02-23	['#thisisboss', '#spring2017']	shad red discov new access boss womenswear collect
834438313876525057	2017-02-22	[]	effortless styl ess piec boss wardrob stapl collect worn @nico_rosberg shop
834377637288087552	2017-02-22	['#thisisboss']	everyth nee impecc styl on plac shop boss wardrob stapl collect
834084781755334656	2017-02-21	['#thiisboss']	ess design don right boss wardrob stapl collect shop
834011080556998657	2017-02-21	['#thisisboss']	styl mad easy @nico_rosberg boss wardrob stapl collect shop
833720366707122176	2017-02-20	['#suitedbyboss']	boss wardrob stapl collect worn @nico_rosberg
833681405603373056	2017-02-20	['#suitedbyboss']	congrat @rmbaloncesto vict cop del rey
833664051540537345	2017-02-20	['#thisisboss']	shop ess boss wardrob stapl collect everyth goe togeth effortless
833295987879784448	2017-02-19	['#thisisboss', '#spring2017']	light stripes act innov look spring boss womenswear
833003622652850177	2017-02-18	['#thisisboss', '#spring2017']	sharp lin crisp detail new season discov impecc styl spring
832650889311576065	2017-02-17	['#thisisboss', '#spring2017']	step spring new collect boss discov
832628088508866560	2017-02-17	['#thisisboss', '#spring2017']	new perspect new season discov collect
832258351043997696	2017-02-16	['#thisisboss']	prep everyth boss expl collect
832182774178078721	2017-02-16	['#spring2017', '#thisisboss']	alway ready on mood next discov collect
831897787864403969	2017-02-15	['#bosssport']	congrat @alexthomson99 receiv liontrust sport hero award via @telegraphsport
831865724272402432	2017-02-15	['#spring2017', '#thisisboss']	collect ready anyth discov
831835482229071872	2017-02-15	['#thisisboss', '#spring2017']	step new collect discov
831551424387493888	2017-02-14	[]	gre day @hugoboss today
831533532610572289	2017-02-14	['#theojam', '#annaew', '#bossthesc', '#thisisboss']	expl pow valentine's day find
831500920991027201	2017-02-14	['#getclos', '#thisisboss']	happy valentine's day @hugoboss discov fragr id gift
831442895169138688	2017-02-14	['#bossthesc', '#getclos', '#thisisboss']	affect gift lov on discov
831186263071797248	2017-02-13	['#theojam', '#bossthesc', '#getclos', '#thisisboss']	sens ent fragr expl gift valentine's day
831171135387561984	2017-02-13	['#bossthesc', '#getclos', '#thisisboss']	stim every sens find valentine's day gift
831156022429380608	2017-02-13	[]	start attract first see someon start journey discov
831079184986468352	2017-02-13	['#vb77']	ear start tak stuttgart next coupl day visit @daimler @hugoboss @mercedesamgf1
830864736065617921	2017-02-12	['#annaew', '#theojam', '#bossthesc', '#getclos']	capt irresist fragr shop
830850880115179524	2017-02-12	['#bossthesc', '#fragr']	not honey peach del frees roast coco bean shop
830369282093625348	2017-02-11	['#bossthesc', '#getclos', '#fragr']	consid capt fragr gift shop
830199961862160388	2017-02-10	['#berlin']	berlin @hugoboss
830103615587119106	2017-02-10	['#bossthesc', '#theojam', '#annaew', '#getclos']	capt every sens valentine's day shop
830094895138402306	2017-02-10	['#fragr']	boss scent capt fragr gift valentine's day shop
830011972112494593	2017-02-10	['#esqmav']	look insid styl party @hugoboss
830011545799241728	2017-02-10	[]	al starg und die sch rob vom rot teppich berlin @berlinale @tonigarrn @hugob
829976092517752833	2017-02-10	['#berlinale2017']	@tonigarrn remind us lov europ film fest glamo @hugoboss
829975824258498560	2017-02-10	['#berlin', '#thisisboss']	germ model @tonigarrn look stun custom boss gown red carpet
829792550248730625	2017-02-09	['#berin', '#nofilt']	und nu ab in kleid @hugoboss
829765659743678469	2017-02-09	['#suitedbyboss']	latest cov @esquire @jkcorden wear boss discuss maverick stat
829763732616183808	2017-02-09	['#suitedbyboss', '#esqmav']	celebr hollywood's maverick @esquire last night party attend @edgarramirez25 boss
829763375651491840	2017-02-09	['#suitedbyboss', '#esqmav']	party @esquire last night la @lievschreiber wor boss menswear
829663803050754048	2017-02-09	['#bosssport', '#thisisboss']	gre day @hugoboss yesterday
829614661922340865	2017-02-09	['#bosssport']	yesterday proud welcom @alexthomson99 hugo boss hq record journey around world
829371118112878592	2017-02-08	[]	boss @bloglovin
829046030041808896	2017-02-07	['#thisisboss', '#spons']	get ready new golf season @hugoboss @h1golfclub
827932666548846592	2017-02-04	[]	see @hugoboss reinv menswear aw17 show
827484834134183936	2017-02-03	['#thisisboss', '#nyfwm']	boss menswear show took plac new york city week
827281556829974530	2017-02-02	['#thisisboss', '#nyfwm']	glimps on innov outerwear piec boss menswear show
827276896215920640	2017-02-02	['#thisisboss', '#nyfwm']	clos boss model backst show
827274421509369860	2017-02-02	['#thisisboss', '#nyfwm']	mom backst boss menswear show
827265899409190914	2017-02-02	['#thisisboss', '#nyfwm']	chunky fast protect fabr boss menswear show design travel man
827264889240444928	2017-02-02	['#thisisboss', '#nyfwm']	boss tail worn modern way
827264298858668032	2017-02-02	['#thisisboss', '#nyfwm']	piec show tail prec model wor
827256343627042820	2017-02-02	['#thisisboss', '#nyfwm']	prec cut eleg detail boss menswear show
827255383928352769	2017-02-02	['#thisisboss', '#nyfwm']	boss menswear show pres collect contrast expert tail alongsid relax piec
827254741474226176	2017-02-02	['#thisisboss', '#nyfwm']	model prep tak runway boss menswear show
827241920581730305	2017-02-02	['#thisisboss', '#nyfwm']	favorit look boss menswear fal 2017 show
827237801993334785	2017-02-02	['#thisisboss', '#nyfwm']	ess mom boss menswear show nyc
827142848759918593	2017-02-02	['#thisisboss', '#nyfwm']	three word would us describ boss menswear show
827140431490273281	2017-02-02	['#thisisboss', '#nyfwm']	@zacharyquinto @matthewzorpas discuss favourit piec show
827137158553202689	2017-02-02	['#thisisboss', '#nyfwm']	guest discuss boss menswear show
827132465991000064	2017-02-02	[]	@hugoboss fal menswear collect ingo wilt acc observ appropry silhouet 2017
826820685003620353	2017-02-01	['#bofw']	tak look latest @hugoboss menswear 2017 collect think
826797432814043136	2017-02-01	['#thisisboss', '#nyfwm']	boss instagram takeov @onedapperstreet enjoy afterparty show
826796909285273600	2017-02-01	['#suitedbyboss', '#thisisboss']	act @miles_teller @zacharyquinto boss suit menswear show last night
826796555353088006	2017-02-01	['#suitedbyboss', '#nyfwm']	styl star @giottocalendoli snap boss menswear show nyc
826796158970388480	2017-02-01	['#thisisboss', '#nyfwm']	boss execut team photograph fal 2017 menswear show
826784332916387841	2017-02-01	[]	backst @hugoboss last night @nickdelieto
826784254168293377	2017-02-01	['#aw17']	new york fash week men's last night @hugoboss' show neck
826696193413623808	2017-02-01	['#thisisboss', '#nyfwm']	guest celebr boss menswear fal 2017 fash show new york
826694842793226240	2017-02-01	['#suitedbyboss', '#nyfwm']	boss boss @matthewzorpas attend show part new york fash week men's
826692632311169025	2017-02-01	['#suitedbyboss', '#nyfwm']	look sharp boss show nyc @edgarramirez25
826692324314972160	2017-02-01	['#suitedbyboss', '#nyfwm']	am act @miles_teller boss menswear show
826691849981145088	2017-02-01	['#thisisboss', '#nyfwm']	guest show includ @miles_teller mil mcmillan @zacharyquinto @edgarramirez25
826679126991990785	2017-02-01	[]	hugo boss aw17 @hugoboss
826646574344212481	2017-02-01	['#thisisboss', '#nyfwm']	ready journey boss show design travel man
826646242159579136	2017-02-01	['#thisisboss', '#nyfwm']	design man mov inspir naut them boss menswear show took plac new york
826645904639696896	2017-02-01	['#thisisboss', '#nyfwm']	perform piec fin mat masculin collect boss menswear
826645572274696192	2017-02-01	['#thisisboss', '#nyfwm']	modern lay boss menswear show
826645397456171009	2017-02-01	['#thisisboss', '#nyfwm']	wanderlust @hugoboss
826645105264062464	2017-02-01	['#thisisboss', '#nyfwm']	first look boss menswear runway
826574848205787137	2017-01-31	['#thisisboss']	@onedapperstreet tak instagram story exclud look boss show follow
826510078341685248	2017-01-31	['#fall2017', '#thisisboss']	tonight @onedapperstreet tak instagram rev view show follow
826458287197544448	2017-01-31	['#thisisboss', '#nyfwm', '#fall2017']	almost follow us instagram see boss menswear show
826255661361197057	2017-01-31	['#thisisboss', '#nyfwm', '#fall2017']	craft collect ready runway follow journey see show
826075144787521536	2017-01-30	['#thisisboss', '#nyfwm']	on day go follow story boss menswear fal 2017 collect
825699274679795713	2017-01-29	['#thisisboss', '#nyfwm']	boss menswear show tak plac tuesday nyc
824648131610488833	2017-01-26	['#thisisboss']	modern black tie boss menswear
824617936924995584	2017-01-26	['#thisisboss']	sharp look ev attitud boss menswear
824579562663243776	2017-01-26	['#thisisboss']	christina ricc wear boss womenswear premy new sery z begin everyth
824349278608957440	2017-01-25	['#bosssport']	back land boss styl @alexthomson99 discov
824320306894557184	2017-01-25	['#suitedbyboss', '#bosssport']	tim duty boss @alexthomson99
823923402654158849	2017-01-24	['#thisisboss']	innov new shap fresh hue
823862949068447744	2017-01-24	['#thisisboss']	timeless tail fresh attitud
823594934875738112	2017-01-23	['#thisisboss']	tail easy attitud
823579035791806464	2017-01-23	['#thisisboss']	new col upd sportswear tail
823560647736754177	2017-01-23	['#vg2016', '#bosssport']	highlight unforget ev @alexthomson99 complet record solo sail around world
823085323932401664	2017-01-22	['#vg2016', '#bosssport']	join us 11am cet facebook liv q&amp;a @alexthomson99 hear record journey
822836594168201218	2017-01-21	['#vg2016', '#bosssport']	join us tomorrow 11am cet facebook liv q&amp;a @alexthomson99 hear record journey
822769207238598656	2017-01-21	['#vg2016', '#bosssport']	celebr @alexthomson99 complet 25 mil solo odyssey discov story
822462054783131649	2017-01-20	['#vg2016', '#bosssport']	welcom record @alexthomson99 ar hom 74 day sea @vendeeglobe
822439514601824256	2017-01-20	['#vg2016', '#bosssport']	scen @alexthomson99 ar back frant extraordin fin @vendeeglobe
822392560999989248	2017-01-20	['#bosssport', '#f1', '#n1co']	yesterday proud welcom 2016 fia formul on world champ @nico_rosberg hugo boss hq
822373616725553153	2017-01-20	['#vg2016', '#blackisback', '#oceanmast']	superst @alexthomson99with wif kat &amp; team
822351113462628354	2017-01-20	[]	proud congrat @alexthomson99 record achiev complet @vendeeglobe
822347322805862401	2017-01-20	[]	watch liv @alexthomson99 complet @vendeeglobe via @dailymotionde
822085995780710402	2017-01-19	['#vg2016', '#bosssport']	incred journey @alexthomson99 near fin lin @vendeeglobe
822050033944104960	2017-01-19	[]	rout predict ear morn fin follow @alexthomson99 onboard @hugoboss head can hom 09 ut
822013627494436864	2017-01-19	['#bosssport']	@alexthomson99 hour away fin lin @vendeeglobe circumnavig glob singl
821749031873327104	2017-01-18	['#thisisboss']	study blu pre 2017 collect
821728526307049472	2017-01-18	['#vg2016']	gosport sail @alexthomson99 narrow gap @vendeeglobe fightback
821703712863158272	2017-01-18	['#thisisboss']	prec shap modern pattern pre 2017 collect
821684483560710145	2017-01-18	['#vg2016', '#sailsurvivesuccess', '#mb', '#bosssport', '#thisisboss']	everyth set on ep @vendeeglobe hist
821386647476391936	2017-01-17	['#suitedbyboss']	ready anyth boss tail
821339899726938112	2017-01-17	['#bosssport', '#f1', '#gobo77as']	excit welcom @valtteribottas wish much success @mercedesamgf1 team
821326230620291072	2017-01-17	[]	look ahead styl new season discov
821024253097054208	2017-01-16	['#thisisboss']	contrast don right ess piec boss womenswear
820963836106653696	2017-01-16	['#thisisboss']	geomet print pop colo boss pre 2017
820935780168331264	2017-01-16	[]	@alexthomson99 brok world 24 hour dist record sail 536 mil beat prevy record set @francoi
820239069804269568	2017-01-14	['#thisisboss']	foc new season confid shap graph lin
819876681137557509	2017-01-13	['#thisisboss']	confid coordin boss access discov onlin
819641323783340032	2017-01-12	['#thisisboss']	light fre shot col new boss womenswear campaign star frederikk sofy
819606426523996160	2017-01-12	['#thisisboss']	first look introduc new spring 2017 campaign boss menswear
819574726695628802	2017-01-12	['#thisisboss']	soft shap shad contemp look
819514290759561217	2017-01-12	[]	effortless styl mak impact pre 2017 collect boss discov
819489278812180480	2017-01-12	['#suitedbyboss']	jeremy ren stand styl wear boss eveningwear premy found
819212389497217024	2017-01-11	['#thisisboss']	combin soft shap sharp access boss pre 2017 collect
819175743620075520	2017-01-11	['#thisisboss']	queen letiz spain step wear boss coat suit bag yesterday madrid
819151912821891073	2017-01-11	['#thisisboss']	easy outerwear monochrom cool combin boss pre 2017 collect
819132776209268736	2017-01-11	[]	actress @itsgabrielleu chos spring 2017 collect boss good morn americ thoma kik
819089576329445376	2017-01-11	['#prep', '#hugoboss']	calm storm @studiobaby
818849918999613441	2017-01-10	['#thisisboss']	keep perfect tim impecc boss watch discov
818789531704930305	2017-01-10	['#thisisboss']	pattern print text expl chevron design new boss womenswear collect
818427133148033026	2017-01-09	['#thisisboss']	modern cut access match boss pre collect avail discov
818412178869022721	2017-01-09	[]	jeremy ren chris hemswor step red carpet boss tuxedo gold glob
817702353390292992	2017-01-07	['#thisisboss']	bold blu outerwear access boss menswear
817339961875644416	2017-01-06	['#thisisboss']	new outerwear shin shad blu
817038027063033857	2017-01-05	['#thisisboss']	styl meet perform innov outerwear new season
816977577688449024	2017-01-05	['#thisisboss']	refresh ready 2017 sart styl boss
816675596377800705	2017-01-04	[]	sharp styl modern gentlem discov
816615206985965568	2017-01-04	['#thisisboss']	sporty look sart blu boss menswear pre 2017
816252814758289408	2017-01-03	['#thisisboss']	sharp suit sporty outerwear new boss pre collect discov
815875320540590080	2017-01-02	['#thisisboss']	energ sart grey shot colo
815511665768689664	2017-01-01	['#thisisboss', '#yourtimetoshin']	happy new year follow wish wond 2017
815331481199394816	2016-12-31	['#thisisboss', '#yourtimetoshin']	midnight mom welcom 2017
814786891144794112	2016-12-30	['#yourtimetoshin', '#holiday2016']	@weworewhat look ahead new year boss
814062138012512256	2016-12-28	['#yourtimetoshin', '#holiday2016']	sharp tail meet ev eleg @weworewhat aaron baum ready night ahead
813337337262280705	2016-12-26	['#yourtimetoshin', '#bosswatch']	tim get ready party
812974951779078144	2016-12-25	['#yourtimetoshin', '#holiday2016']	aaron baum op boss gift @weworewhat
812612566606196741	2016-12-24	['#yourtimetoshin', '#holiday2016']	wish wond fest weekend lov on
812250191747104768	2016-12-23	['#yourtimetoshin', '#holiday2916']	ad fin touch @weworewhat ready fest celebr
811887806486220800	2016-12-22	['#yourtimetoshin', '#holiday2016']	shop styl @weworewhat look perfect fest gift boss new york city
811179381645144064	2016-12-20	['#yourtimetoshin']	holiday com discov impecc boss collect every mom season
810877431082983424	2016-12-19	['#yourtimetoshin', '#holiday2016']	look last gift discov beauty boss access she'll lov
810844258542436352	2016-12-19	[]	rock greatest ev motorsport gott look point @lewishamilton @nico_rosber
810817046371921921	2016-12-19	['#yourtimetoshin', '#suitedbyboss']	@oliver_cheshire show styl cred boss tail
810454600813670400	2016-12-18	['#suitedbyboss', '#yourtimetoshin']	step @oliver_cheshire london
810454594379624448	2016-12-18	['#yourtimetoshin', '#holiday2016']	invit say smart cas ad col shirt sharp black suit touch flair
810152637530185729	2016-12-17	['#yourtimetoshin', '#holiday2016']	@oliver_cheshire show us wear boss black tie look
810092211920457728	2016-12-17	['#suitedbyboss', '#yourtimetoshin']	sharp form look impecc execut @oliver_cheshire
809834052106784768	2016-12-16	['#bosssport', '#golf']	hug congrat @henrikstenson nam 2016 europ tour golf year michael mun
809790296783323136	2016-12-16	['#suitedbyboss', '#yourtimetoshin']	crack form dress cod @oliver_cheshire london
809729831201976320	2016-12-16	['#yourtimetoshin', '#holiday']	celebr season ultim eveningwear look
809427864189739008	2016-12-15	['#yourtimetoshin', '#holiday2016']	gift inspir boss
809367429402927104	2016-12-15	['#yourtimetoshin', '#holiday2016']	ring new year styl beauty boss womenswear discov
809005068989054976	2016-12-14	['#yourtimetoshin', '#bossthesc', '#bosswatch']	fin touch mak diff discov
808642665017266176	2016-12-13	['#yourtimetoshin', '#holiday2016']	impecc dress biggest night year
808307752175079424	2016-12-12	['#thisisboss', '#criticscho']	jeremy ren &amp; tatian maslany wow boss @criticschoice award californ
808280265768345600	2016-12-12	['#yourtimetoshin', '#holiday2016']	bossbot help find perfect fest gift
807978298231771136	2016-12-11	['#yourtimetoshin', '#holiday2016']	mak search perfect gift littl easy boss
807917880591253504	2016-12-11	['#yourtimetoshin', '#holiday2016']	midnight silk night cal littl bit
807555518797463552	2016-12-10	['#yourtimetoshin', '#bosswatch', '#bossthesc']	amp glamo boss access
807193105967386624	2016-12-09	['#yourtimetoshin', '#holiday2016']	tak spotlight beauty boss womenswear discov
806891177421086720	2016-12-08	['#yourtimetoshin', '#holiday2016']	day night access nee fest season
806860936870928384	2016-12-08	['#yourtimetoshin', '#holiday2016']	sharp sart styl ev year
806815617848209409	2016-12-08	['#yourtimetoshin', '#bossbespokeb']	smal beauty shap favorit
806530231590912000	2016-12-07	['#vg2016', '#bosssport']	watch week highlight alex thomson vend glob journey aboard hugo boss
806513651590926337	2016-12-07	['#yourtimetoshin']	perfect fin touch discov boss access fragr
806453251138691072	2016-12-07	['#yourtimetoshin', '#holiday2016']	party season night await
806166404286140417	2016-12-06	['#yourtimetoshin', '#holiday2016']	look perfect gift
806105940118249472	2016-12-06	['#yourtimetoshin', '#holiday2016']	ad littl shin holiday season discov
806089616721907712	2016-12-06	['#thisisboss']	queen letiz spain wear tail boss jacket leath skirt timeless boss bespok bag san sebast yesterday
805803967938605056	2016-12-05	['#holiday2016', '#yourtimetoshin']	look good every mom fest season boss
805761895206506497	2016-12-05	[]	liv today instagram story channel expl new york @iamgalla follow
805743576965468160	2016-12-05	['#yourtimetoshin']	gift man styl
805441604802621440	2016-12-04	['#yourtimetoshin', '#holiday2016']	espec
805381171433476096	2016-12-04	['#yourtimetoshin', '#bossthesc', '#bosswatch']	impecc gift
805079205813698560	2016-12-03	['#yourtimetoshin', '#holiday2016']	clos luxury stapl clutch forev leath &amp; feminin bow sand
805018779851755520	2016-12-03	['#yourtimetoshin']	stand crowd boss discov
804745534846226432	2016-12-02	['#bosssport']	@nico_rosberg proud work child world champ win wish best
804743406694072320	2016-12-02	['#bosssport']	climb mountain peak @nico_rosberg retir f1
804716811446984704	2016-12-02	['#yourtimetoshin', '#bossthesc', '#bosseyewear']	gorg gift fest season
804656423758020608	2016-12-02	['#yourtimetoshin']	relax attitud plu access match discov
804399824263118848	2016-12-01	['#vg2016']	new twist thomson tak back top spot
804384657441583104	2016-12-01	['#yourtimetoshin', '#holiday2016']	gift man styl
804332513543868416	2016-12-01	['#yourtimetoshin', '#holiday2016']	mak holiday hom extr spec discov
803982758154539009	2016-11-30	['#yourtimetoshin', '#holiday2016']	dress styl boss
803969593714810884	2016-11-30	['#yourtimetoshin']	perfect bal eas eleg holiday hom discov
803919759678926848	2016-11-30	['#thisisboss', '#fall2016']	forev eleg queen letiz spain step portug wear boss womenswear
803651258598887425	2016-11-29	['#yourtimetoshin']	look complet bring littl bit extr tabl holiday season boss
803632008526106625	2016-11-29	['#yourtimetoshin']	mak holiday hom extr spec relax look boss
803286137716490240	2016-11-28	['#suitedbyboss', '#bosssport']	f1 world champ @nico_rosberg step styl
803275905745485825	2016-11-28	['#suitedbyboss', '#bosssport']	relax eleg @lewishamilton wear boss mil
803269856019775488	2016-11-28	['#suitedbyboss', '#bosssport']	look win @nico_rosberg
803192989413679105	2016-11-28	['#n1co']	congr @mercedesamgf1 driv @nico_rosberg becom 2016 f1 world driv champ shop
802486671681998850	2016-11-26	['#yourtimetoshin', '#holiday2016']	covet gift discov
802155946306891776	2016-11-25	['#yourtimetoshin', '#holiday2016']	com away wish best holiday weekend
802119621155389440	2016-11-25	['#yourtimetoshin', '#holiday2016']	hom holiday styl discov
802070662982598656	2016-11-25	['#thisisboss']	kat middleton wor boss pump tea party @nhm_london
801821852784062464	2016-11-24	['#suitedbyboss']	three favorit act red carpet lik styl @gerardbutler @zacharyquinto &amp; @aaroneckhart
801742267694333952	2016-11-24	['#suitedbyboss', '#hommesgq2016']	congrat @antogriezmann vot @gq_france sportsm year 2016
801474338155352064	2016-11-23	['#yourtimetoshin']	win win year @nico_rosberg @lewishamilton @mercedesamgf1 congrat amaz result
801393573010751488	2016-11-23	['#bossthesc', '#fragr']	maxim pow wear puls point around body
801374750257844224	2016-11-23	['#bossthesc', '#fragr']	ankl enh puls point
801142748590051328	2016-11-22	['#vg2016', '#yourtimetoshin', '#bosssport']	2016 incred @alexthomson99 &amp; yet he's lead hugo boss
801104896674111489	2016-11-22	['#bossthesc', '#thisisboss', '#fragr']	spray onto puls point bicep ultim pow seduc
801068985332613120	2016-11-22	[]	@talkingpj hugo boss onlin stor del within uk mainland northern ireland
801012099107405824	2016-11-22	['#bossthesc', '#fragr']	maxim pow spraying onto bicep unexpect puls point
800734203411333120	2016-11-21	['#yourtimetoshin', '#bosssport']	amaz year golf ambassad congr @alex_noren @henrikstenson &amp; ashun wu gre result
800713399709511681	2016-11-21	['#bosssport', '#f1']	alway sharp @lewishamilton wear boss mil
800704971079618561	2016-11-21	['#f1', '#thisisboss', '#bosssport']	star @lewishamilton tak easy new fal collect
800343255867006977	2016-11-20	['#thisisboss', '#yourtimetoshin']	red alert new ar
800334069448015872	2016-11-20	['#racetoduba', '#bosssport', '#golf']	top gam congrat @henrikstenson second titl
