id	created_at	hashtags	cleaned_text
1091358382735339521	2019-02-01	['#thenextboss']	new boss spring campaign ar season introduc relax californ tail outerwear cre bright day ahead
1090959166292733952	2019-01-31	['#theberlinway', '#iamhugo']	berlin stat mind new season com new cast charact lens fash photograph col schorr spring 2019 campaign inspir sum spent germ capit discov
1090263337768648705	2019-01-29	['#suitedbyboss']	liam hemswor wor boss g us los angel gal californ
1088793626497343488	2019-01-25	[]	queen letiz spain chos wear boss attend audy zarzuel palac madrid
1088718191944257537	2019-01-25	[]	@hugoboss introduc cas sportswear styl ap young audy invest heavy onlin off
1087604147753381888	2019-01-22	[]	hugo boss achiev sal earn target 2018 accel sal grow four quart see prelimin result publ today
1086186461148266496	2019-01-18	['#thisisboss']	pleas annount act mark chao becom new fac boss gre chin also star new campaign shot renown chines photograph yu cong
1085949973957492737	2019-01-17	[]	impart knowledg ess sustain develop work support man without bord found within corp volunt program strengthening develop country shar man knowledg joint goal
1085220607480872960	2019-01-15	['#marrakesheprix', '#raceahead', '#bosssport']	congrat formul driv boss ambassad @thereal_jda win @fiaformulae last saturday set standard com season
1085147610686484485	2019-01-15	[]	we'r look forward join discuss neonyt berlin today talk circul fash posit impact sustain challeng industry fac regard find
1084853225398784004	2019-01-14	[]	real valu peopl bring entrepr spirit rol interview busy fash hugo boss ceo mark lang emphas empow in key success
1079905150448226304	2019-01-01	[]	hugo boss wish happy new year best 2019
1078651815741206528	2018-12-28	['#holiday2018']	get ready new year's ev favorit party look discov
1078319634141474827	2018-12-27	['#bossxjeremyvil']	real im fut self aspir get know @jeremyville art behind collect rev cre inspir story collab read
1076115109217427456	2018-12-21	['#suitedbyboss']	congrat @anthonyfjoshua receiv ob serv sport box fac boss stretch tail wor custom boss mad meas suit yesterday's investit ceremony buckingham palac
1075782926707548168	2018-12-20	['#foreverychild', '#hugoboss']	hugo boss commit prom fut childr support @unicef many year join us help childr nee good educ set found eq opportun fair chant lif
1075420610103148544	2018-12-19	['#bossxjeremyvil', '#holiday2018']	vying spotlight meet ful cast charact tak star rol holiday campaign collect cre collab art jeremyvil discov
1075367693669130240	2018-12-19	['#abbformula', '#bosssport', '#raceahead']	excit fif season @fiaformulae kick riyadh saturday boss driv jean vergn jerom start season styl tak second third plac act rac
1075065697963728897	2018-12-18	['#withrefug', '#unhcr']	hugo boss commit support cris situ worldwid togeth org @refugees @unoflucht provid cloth refug ecuad wint help tim nee discov
1073570836655661058	2018-12-14	[]	jingl bel jingl bel christmas approach hugo boss ceo mark lang look back success 12 month wrap gift fellow board memb thank employ commit past year watch video
1073222058232823808	2018-12-13	['#abbformula', '#riyadheprix', '#bosssport', '#raceahead']	day go new season begin tak plac diriyah weekend boss driv look start season styl tak anoth look highlight season
1072847274315735040	2018-12-12	[]	man hugo boss word @drapers sint becom ceo hugo boss 2016 mark lang reconfig brand fut read ful interview
1072500389029797891	2018-12-11	[]	pict last week shoot @hugoboss @esquirees
1072132602755043328	2018-12-10	['#climateact', '#cop24']	hugo boss commit work togeth industry play address clim protect fash valu chain theref sign fash industry chart took stag today's launch ev katow
1070293363750883328	2018-12-05	[]	on click away hugo boss corp websit liv new design expl inform sustain act company's strategy hear employ watch video much visit
1068548882265559041	2018-11-30	['#bosssport', '#thisisboss']	look back yesterday's q&amp;a sess @tonikroos boss stor madrid guest happy meet @realmadrid star fac challeng gam tabl socc
1068184168616538112	2018-11-29	['#mjonthewal', '#bossxmichaeljackson']	celebr exhibit op @grandpalaisrmn par host exclud din @hoteldecrillon visit excit exhibit second part tour &amp; expery art hom king pop
1067825480022155265	2018-11-28	['#textilbuendn']	second day stakehold dialog top includ busy eth int just agend look forward workshop repres germ @peta @debijenkorf among oth togeth employ
1067478183060992000	2018-11-27	[]	thank claud lang chairwom gen stiftung found utop op keynot int just year hugo boss stakehold dialog look forward fruit exchang tomorrow
1067093416985513984	2018-11-26	['#circulardesign', '#thinkcircul']	last week conduc two train coop @circularfsystem employ involv design develop sourc read commit circul fash design
1065938036955836416	2018-11-23	['#mjonthewal', '#bossxmichaeljackson', '#bossart']	miss op today @grandpalaisrmn spons boss exhibit first display @npglondon mov par febru 14 2019 thriller black whit graham dolphin 2017 graham dolphin
1065243494170546176	2018-11-21	['#rdr2018', '#bosssport']	look back excit rac @atracing99 hugo boss yacht la mark thomson fin rac onboard cur hugo boss boat sum 2019 unveil new rac yacht hop win 2020 vend glob
1065152856922025986	2018-11-21	[]	andrea streubig direct glob sustain tak part @exchainge's panel discuss @hypermotionfair frankfurt particip elab improv log process hent sustain perform
1063780484910641152	2018-11-17	['#bosssport', '#rdr2018', '#alexthomsonrac']	congrat boss ambassad solo sail @atracing99 becom third rout du rhum destin guadeloup hugo boss yacht imoca60 class crown fin last trip cur hugo boss boat
1063371463149768705	2018-11-16	[]	highlight hugo boss invest day 2018 read
1062958629949603840	2018-11-15	[]	hugo boss host invest day london today stay tun follow liv webcast start 10am cet
1061257182497271809	2018-11-10	[]	look forward hugo boss invest day london nov 15 man board provid upd company strategic pri disclos med fin ambit ev
1060840625107480576	2018-11-09	['#suitedbyboss', '#gqaward']	congrat brit act boss eyewear ambassad henry cavil receiv movy intern 2018 award @gq_germany men year award berlin last night henry wear bespok boss shawl coll tuxedo navy blu
1060537244493197312	2018-11-08	['#porsch']	sign mult coop agr @hugoboss off cloth partn metz
1060459305407700992	2018-11-08	[]	hugo boss porsch two glob play shar reg root join forc fut begin next year coop porsch cent among thing common involv formul rac read
1059695838803386368	2018-11-06	[]	ceo mark lang challeng market environ meant third quart easy see third quart result publ today
1059480839992557568	2018-11-05	['#rdr2018', '#bosssport']	yesterday 123 skip across six diff class depart saint on fam french solo offsh rac boss ambassad @atracing99 on 20 imoc skip set start lin
1057286031853023232	2018-10-30	[]	continu reduc carbon footprint germ brand support clim act train textil fact vietnam org amongst oth @globalcompactde @wwf_deutschland conduc intern csr consult @systainconsult
1056908547689050112	2018-10-29	['#thisisboss']	megh duchess sussex wor burgundy jersey dress boss womenswear pre 2019 collect autumn tour austral
1055148080004120576	2018-10-24	['#bosssport', '#alexthomsonrac', '#rdr2018']	day rout du rhum destin guadeloup st malo today rac vil op look forward off rac start nov @atracing99 st malo com meet us
1054386966253293568	2018-10-22	['#bosssport']	round sail alex thomson meet boss ambassad nico rosberg aboard hugo boss yacht new york discov
1053631976714919936	2018-10-20	['#bosssport', '#rdr2018']	two week boss skip @atracing99 set rac rout du rhum first tim aboard hugo boss yacht discov alex thomson prep upcom voy
1053317932455882752	2018-10-19	['#bossthesc', '#augmentedsens']	london cal fragr ambassad jamy dorn birgit kos press launch ev wednesday night
1053141972381163521	2018-10-19	['#hugobosspr', '#bossart']	thrilled annount simon leigh win 2018 delight hand priz remark art mark lang ceo hugo boss richard armstrong direct @guggenheim muse nyc
1052955213877805056	2018-10-18	['#hugobosspr']	ev hugo boss priz 2018 award @guggenheim nyc 12th tim art nomin bouchr khalil simon leigh teres margol emek ogboh frant stark &amp; wu tsang look forward excit inspir ev
1052484420018425858	2018-10-17	['#suitedbyboss']	print harry duk sussex wor boss attend welcom ev admiral hous sydney austral wif megh duchess sussex
1052212624719564800	2018-10-16	['#rdr2018', '#bosssport']	countdown rout du rhum 2018 begin novemb 4 first tim hugo boss skip @atracing99 compet 3 naut mil transatl rac tak plac every four year
1051895536985333760	2018-10-15	['#bossxmichaeljackson']	rev artwork thriller boss black graham dolphin slo squ boss stor london tak icon whit suit canva brit art custom handwrit song lyr king pop
1051850276724912134	2018-10-15	['#bosssport']	alex meet nico follow boss ambassad alex thomson nico rosberg journey nyc world sail motorsport com togeth two sportsm shar un expery look fut discov
1047864009184108544	2018-10-04	['#hugobosspr']	two week hugo boss priz award @guggenheim nyc art nomin hugo boss priz 2018 bouchr khalil simon leigh teres margol emek ogboh frant stark wu tsang discov
1046752439825772546	2018-10-01	['#rdr2018']	hear skip off rout du rhum press conf par includ boss athlet alex thomson first tim alex tak part rac frant guadeloup begin novemb 4th aboard hugo boss yacht
1044964827393744896	2018-09-26	['#bossart']	octob 18 hugo boss solomon r guggenheim muse award hugo boss priz 12th tim @guggenheim seek hon innov influ art within landscap contemp art discov
1043515439274328068	2018-09-22	['#thenextboss']	behind scen step set new york young cre tal est &amp; ris wear boss fal 2018 collect took city's streets got expery boss sport formul &amp; sail hugo boss yacht
1043424709323313153	2018-09-22	['#iamhugo']	ask answ thousand vot cast instagram choos fin design first interact hugo collect spring 2019 four produc select follow avail onlin select stor decemb
1043137826768867330	2018-09-21	['#thisisboss']	wednesday night guest @thepberg @flodavidfitz &amp; @esthersedlaczek attend off op new boss stor f h munich stor off interact shop expery digit display showcas latest collect
1042789573116358658	2018-09-20	['#worldchildrensday']	today 145 country worldwid every child deserv prom fut hugo boss commit educ childr support @unicef
1041718455492206592	2018-09-17	[]	last week hugo boss particip sustain textil school 2018 ev chemnitz keynot @sustexschool giv expert org &amp; company textil fash industry worldwid platform discuss joint effort sustain supply chain
1041643307665768448	2018-09-17	['#californiabreez', '#thisisboss']	backst front row tak look act boss menswear womenswear show new york fash week
1040253842124931072	2018-09-13	[]	proud annount hugo boss includ dow jon sustain index world second consecut year on four textil apparel luxury company worldwid feat
1039884008010567680	2018-09-12	['#californiabreez', '#thisisboss']	light camer act see men's women's look spring 2019 unveil new york fash week runway discov boss show
1039483728190291970	2018-09-11	['#californiabreez', '#thisisboss']	jamy dorn @robertsemma hugo boss ceo mark lang wif andre @henrygolding @livvlo among guest spring 2019 show new york fash week
1038875952992808961	2018-09-09	['#californiabreez', '#thisisboss']	watch liv tun boss spring 2019 fash show today 10pm cest
1038683445143060480	2018-09-09	['#vdmnightfever', '#bossart']	today fin day night fev design club cult 1960 today @vdm_news spons hugo boss miss last chant see un exhibit vitr design muse photo mark niederman
1037898262940975104	2018-09-07	['#californiabreez', '#thisisboss']	sunday boss spring 2019 runway collect rev new york fash week fash show entitl californ breez watch ev liv septemb 10pm cest
1037747276460916742	2018-09-06	['#mjonthewal', '#bossart']	exhibit @npglondon com mak michael jackson strong influ cult ev day spok dr nichola cullin cur &amp; direct nat portrait gallery
1037736590381133824	2018-09-06	[]	hon michael jackson diamond celebr &amp; michael trailblaz leg mus &amp; fash @hugoboss rele
1037722379667959809	2018-09-06	['#bossxgqaward', '#suitedbyboss']	last night gq hon men wom who've influ cult landscap term styl polit entertain sport 2018 men year ceremony congrat john legend win hugo boss styl man award
1037344901552254976	2018-09-05	['#bossxgqaward', '#suitedbyboss', '#manoftoday']	brit gq styl groom direct @teovandenbroeke help model fash com @jackguinness choos outfit ahead gq men year award tonight
1036992342144638976	2018-09-04	['#michaeljackson', '#bossart']	miss exhibit michael jackson wal @npglondon spons boss expl influ lead nam contemp art span sev gen art across med
1036629914349232128	2018-09-03	[]	hugo boss roadmap 2018 sustain supply chain publ partn sustain textil roadmap outlin goal area soc standard chem environ protect nat fib
1036176915529252865	2018-09-02	['#vdmnightfever']	new york parad gar custom sound system set new standard sound design mak stag ear gig star lik madonn grac jon discov show bil bernstein david hil gallery london
1035905137519120385	2018-09-01	['#michaeljackson']	coop art graham dolphin develop exclud artwork boss collect feat thriller alb cov writ stat fan collect art &amp; pres dolphin sign styl
1035542781601579008	2018-08-31	['#bossxmichaeljackson']	complet celebr michael jackson releas three off depict king pop unisex feat spec mom michael jackson's car dant mov icon im
1035180382373597184	2018-08-30	['#michaeljackson', '#bossxmichaeljackson', '#kingofpop', '#bossart']	put tal word maj sourc inspir brit art graham dolphin bas joint admir king pop boss @gmdolphin embark collab
1034818054780215296	2018-08-29	['#bossxmichaeljackson']	suit king pop year michael jackson's diamond birthday celebr unforget mom mus hist 1982 releas gam alb thriller select whit boss suit wear cov art
1034772671609765888	2018-08-29	['#bossxmichaeljackson', '#michaeljacksonday']	happy birthday michael jackson mark king pop's diamond birthday celebr icon mom mus legend's thriller alb cov wor whit boss suit discov
1034455606315216896	2018-08-28	[]	hon michael jackson cre new edit icon thriller suit limit 100 piec new edit ref original's silhouet fabr detail throughout entir craft headquart germany
1034093223109525505	2018-08-27	['#abbformula', '#jev25', '#bosssport']	party yacht plan rac car watch access docu expery 72 hour 2017 ab fia formul champ boss driv @jeanericvergne right amaz titl vict
1032960766847082496	2018-08-24	['#iamhugo', '#hugoboss']	first standalon hugo stor uk op westfield london whit city intery design lin hugo's progress approach includ flash brand's sign red throughout
1032240535665356801	2018-08-22	['#bossxmichaeljackson']	michael jackson's 1982 thriller alb legend littl fact king pop wor whit boss suit cov hon diamond birthday celebr mus geni styl revamp suit
1029019857843453952	2018-08-13	['#suitedbyboss']	un heavyweight world champ anthony joshu fac boss stretch tail collect discov
1028189288058388480	2018-08-11	['#vdmnightfever', '#bossart']	brainchild it group studio65 intery flash back club mir design firm's rad approach combin furnit light sound highlight exhibit spons hugo boss paolo muss sart
1027917515769274369	2018-08-10	[]	influ fab hart met bart de back cre direct hugo menswear learn first hugo interact collect chos instagram follow hear list custom import us ful interview
1027223135437774848	2018-08-08	['#willkommeninberlin']	meet cast young cre includ @anwarhadid hugo fal 2018 campaign photograph am col schorr join us journey germ capit pay hom un energy spirit
1027207904665849856	2018-08-08	['#thenextboss']	ambit precid styl fal introduc shot acclaim photograph david sim campaign repres bold new direct boss menswear &amp; womenswear
1025371726560075777	2018-08-03	[]	know on thing common @alexthomson99 champ wear boss hono meet fastest
1025063703564115968	2018-08-02	['#bossthesc']	unveil jamy dorn birgit kos step spotlight fac latest boss scent fragr
1024893439744258048	2018-08-02	[]	ceo mark lang sal grow second quart speak see second quart result publ today
1024308742916005888	2018-07-31	[]	hugo boss act are chem man year 2017 becam contribut zdhc roadmap zero program caus within textil industry inform @zerodhc visit
1022817393389850624	2018-07-27	['#welcomehom', '#alexthomsonrac', '#thisisboss', '#sail', '#haslarmarin']	breath boy back
1022138739424784384	2018-07-25	[]	6th an hugo boss supply exchang meet tak plac week berlin ten strategic supply join us germ capit shar knowledg expery ord fost transp joint develop read
1020322457540964353	2018-07-20	['#vdmnightfever', '#bossart']	design japanes architect arat isozak pallad plac new york's cool divers crowd get glimps inspir 80s club exhibit spons hugo boss timothy hursley garvey gallery new york
1020241192376729601	2018-07-20	[]	gre board
1019970062848090117	2018-07-19	['#bosssport', '#theop']	ready good luck boss golf @henrikstenson @mkaymer59 @byeonghunan @seancrocker11
1019597714525335553	2018-07-18	[]	pleas sign tamil nadu mult in in germ textil partn aim improv textil industry work condit southern ind stat nam togeth ngo retail
1019235292878798856	2018-07-17	['#bosssport']	golf's oldest prestigy champ @theopen return carnousty scotland 147th edit july 19 follow golf @henrikstenson @mkaymer59 @byeonghunan @seancrocker11 play on world challeng cours
1018881819217760256	2018-07-16	['#bosssport', '#nyceprix', '#abbformula']	hug congrat boss driv @jeanericvergne win first formul world champ rac fin new york city fellow boss driv @lucasdigrassi mad mark com second plac
1018862606042390530	2018-07-16	['#missionimposs', '#suitedbyboss']	act henry cavil step onto red carpet premy london wear boss mad meas suit
1018163228893851651	2018-07-14	['#nyceprix', '#bosssport', '#elect', '#abbformula']	rac weekend new york see @fiaformulae light big appl today 9 cest sunday 9 cest reach season fin watch today's rac
1017680127243706368	2018-07-13	['#suitedbyboss']	introduc joseph schooling singap swim olymp gold med fac wash suit campaign
1017423370961338368	2018-07-12	['#zeitmagazinvog']	brand mak strong stat stor e hugo boss ceo mark lang germ zeitmagazin &amp; vog conf
1017306615018553348	2018-07-12	[]	fantast ev boss stor columb circ new york last night hug thank @tedstaffordgq
1017013579692871680	2018-07-11	['#inspir', '#nostalg', '#ep']	hold clos back see show
1016722178623098881	2018-07-10	['#nyceprix']	skip alex thomson ar new york hugo boss boat sunday today boss stor columb circ q&amp;a sess meet nico rosberg formul driv tracksid july 14th
1016336372955664384	2018-07-09	['#hugoxberlin', '#iamhugo']	fin prep runway catch act hugo spring 2019 fash show berlin fash week
1014886706850365440	2018-07-05	['#hugoxberlin', '#iamhugo']	watch spring 2019 show today 9 cest liv berlin's motorwerk head hugo instagram channel go behind scen show
1014534755268743168	2018-07-04	[]	hugo boss support germ art tino sehgal's latest work @kunstmuseum stuttgart segh off un approach perform art soc interact dant voc key el expery work 28 july wolfgang tillm
1014512158263033856	2018-07-04	['#hugoxberlin', '#iamhugo']	tomorrow berlin fash week watch hugo spring 2019 show liv 9 cest
1014404821200207872	2018-07-04	['#bossxmichaeljackson', '#bossart', '#mjonthewal']	step insid priv view michael jackson wal exhibit npg london attend guest includ adry brody mark ronson exhibit op til octob 21 2018 spons hugo boss
1014162831040581633	2018-07-03	[]	congrat invest rel team win twic 30th edit ir magazin award london hundr fin analyst institut invest cast vot best work field europ
1014070795973226496	2018-07-03	['#thisisboss', '#iamhugo']	impecc modern wardrob boss fash attitud hugo expl two un brand world
1013693799481073664	2018-07-02	['#vdmnightfever']	1980s europ equ new york studio 54 les bain douch par un set old publ bath drew celebr world div exclud club spons hugo boss foc kan
1012363719316246531	2018-06-28	[]	sport hum endeav adv say skip boss brand ambassad alex thomson pass sail interview canad men lifestyl magazin sharp read complet interview
1012287015264575489	2018-06-28	['#bossxmichaeljackson', '#mjonthewal']	boss priv view michael jackson wal @npglondon attract crowd includ @adrienbrody @jamiebower @erin_o_connor @brooklynbeckham hugo boss cbo ingo wilt &amp; adry brody
1012230562172620800	2018-06-28	[]	@llamabusiness thank tweet kind word thank loy expery boss cli regard boss custom serv
1012228952390332416	2018-06-28	[]	@obadcock @hugobossservice thank feedback mr badcock tak liberty explain reason kind review inbox thank boss custom serv
1012027037421330432	2018-06-27	['#hugoboss']	check sneak peek michael jackson wal courtesy priv view op thursday b
1011966774340964354	2018-06-27	"[""#michaeljackson's""]"	sign wid acknowledg com mus mus video dant choreograph &amp; fash b
1011625151769636864	2018-06-26	['#sustainablecotton', '#bcicottonconf']	hugo boss tak stag bci 2018 glob cotton conf brussel particip ev start today part commit develop
1011511803409551361	2018-06-26	[]	@marksarson1 thank tweet right withdraw may refus delivery un cancel ord plac acceiv confirm due techn restrain includ prepaid return label insid parcel regard boss
1011175684964745217	2018-06-25	[]	part tour nor americ alex visit boss stor tak part liv q&amp;as front guest ev
1010900372569841664	2018-06-24	[]	introduc new boss denim sweatshirt design environ mind recyc org yarn reduc us wat eco tre feat cre new caps collect find
1010537981780766720	2018-06-23	['#mjonthewal', '#bossxmichaeljackson', '#bossart']	story legend jun 28 octob 21 2018 spons michael jackson wal london's @npg first exhibit expl influ king pop contemp art im david lachapel
1010137845451796480	2018-06-22	['#charlinevonheyl', '#bossart']	hugo boss spons snak ey solo exhibit @deichtorhallen cent hamburg today septemb 23 art rank among lead paint tim charlin von heyl daydrink 2016
1010070106385231872	2018-06-22	['#charlinevonheyl']	look back highlight wednesday snak ey preview ev @deichtorhallen pres 60 germ art striking work exhibit op today run septemb yv cfo hugo boss ag art charlin von heyl
1009772997907906560	2018-06-21	['#bmwinternationalopen', '#bosssport']	host top golf step onto green boss sint golf spons program beg 1985 follow golf pro @mkaymer59 @tomdetry @haydnporteous @mikkoilonen @schwab_matth tee 30th cologn
1009456077992148992	2018-06-20	['#withrefug']	today world refug day part commit peopl nee help refug metz reg integr support germ in wir zusam
1008760017279827968	2018-06-18	['#bossart', '#charlinevonheyl']	op friday exhibit snak ey pres groundbreak work charlin von heyl support hugo boss exhibit @deichtorhallen hamburg focus artist's paint sint 2005
1008356105188077568	2018-06-17	['#bosssport', '#diemannschaft', '#redefiningsuccess']	ey @dfb_team today tak pitch off fash outfit germ nat team wish good luck upcom challeng
1007183676537335808	2018-06-14	['#alexthomsonrac', '#thisisboss', '#sail', '#toronto']	far toronto amaz philip fal
1007178624808595459	2018-06-14	['#thisisboss']	new boss stor munich theatinerstr op yesterday span three flo 430 squ met stor showcas latest boss collect intery conceiv digit feat includ interact furnit adin hub
1006871862784155648	2018-06-13	['#redefiningsuccess', '#bosssport']	ar russ suit @hugoboss @dfb_team
1006565873040019458	2018-06-12	['#redefiningsuccess']	los desir win soon titl star play mat hummel talk driv rep success watch interview germ team play ahead first match
1006507289660964864	2018-06-12	['#zuricheprix', '#bosssport', '#elect']	first tim 60 year switzerland back intern motorsport calend thank @fiaformulae @lucasdigrassi @thereal_jda tak 1st 3rd plac brought un energy city's heart
1005464718872494080	2018-06-09	['#manoftoday', '#suitedbyboss']	look back big ev @chrishemsworth step insid stor op celebr marin bay sand singap act fac boss bottl
1005102344676130816	2018-06-08	['#thisisboss']	tak look highlight fash show singap marin bay sand front row includ act @chrishemsworth sebast stan swim @joschooling
1004758804775358464	2018-06-07	['#vdmnightfever']	new york's legend studio 54 fam hedon star guest list exhibit spons hugo boss off nev glimps insid icon 70s night club photo bil bernstein david hil gallery london
1004014993682018304	2018-06-05	['#worldenvironmentday']	today reduc impact planet striving sint fal collect 2017 sol us pad mad minim 60% recyc mat learn sustain
1003540318288007168	2018-06-04	[]	@gregory_scepi thank interest sunglass pleas find link uk webhop boss serv
1003539455368712192	2018-06-04	[]	@xiuqinchen1 thank tweet glad acceiv return unworn unwash unalt item refund within return window detail may find
1002973150680776705	2018-06-02	['#bosssport', '#alexthomsonrac']	hello mont boss brand ambassad round sail alex thomson ar canad city set sail head toronto fin wind way boston new york
1001372656799645696	2018-05-29	['#bosseyewear', '#sharpenyourfoc']	brit act henry cavil known rol world's fam superhero fac new campaign discov
1001100845289693187	2018-05-28	['#suitedbyboss']	men mom act sebast stan chief brand off ingo wilt swim @joschooling act @chrishemsworth singap show dress boss tail
1001085959461470208	2018-05-28	['#thisisboss']	tak look behind scen exclud fash show celebr reop boss stor marin bay sand singap last weekend
1001059277723795457	2018-05-28	['#bosssport']	amaz match congrat boss ambassad @tonikroos team's vict saturday
1001011717944393728	2018-05-28	['#suitedbyboss', '#bosssport', '#champ13ns']	champ third tim row congrat boss team @realmadrid saturday's vict
1000026818341060609	2018-05-25	['#thisisboss']	introduc new partn @joschooling record gold medal last olymp gam swim rev first singap boss ambassad discov
999670129087533057	2018-05-24	['#champ10ns', '#suitedbyboss', '#bosssport']	hist mad congrat basketbal @rmbaloncesto 10th euroleagu vict
