id	created_at	hashtags	cleaned_text
706819816154341376	2016-03-07	['#skywalk', '#bosssport', '#thisisboss']	trilog stunt @alexthomson99 soon complet
706416961799004160	2016-03-06	[]	formul season start check boss merc collect
706177447088300032	2016-03-05	['#bosssport', '#golf']	streets new york city miam @mkaymer59 ready compet @cadillacchamp
706109781417836549	2016-03-05	['#thisisboss']	naut jacket unit form &amp; funct boss menswear
706043557585547264	2016-03-05	['#bosssport', '#matshummel', '#bvbfcb']	germ clasico bayern vs dortmund who's going win
705906025912803328	2016-03-05	['#houseofcard', '#thisisboss']	he's back frank underwood wear boss mad meas @netflix today
705781932592918528	2016-03-04	['#martinkaym', '#thisisboss', '#bosssport']	ready act we'r excit boss ambassad @cadillacchamp
705747476771446784	2016-03-04	['#thisisboss']	sportswear jacket naut col tak cent stag
705431822608556036	2016-03-03	['#annaew', '#thisisboss']	look forward wear eleg new boss eyewear
705423002305957888	2016-03-03	['#henrikstenson', '#thisisboss', '#bosssport']	best luck @cadillacchamp today
705102986922598401	2016-03-02	['#bossbespokeb', '#thisisboss', '#springsummer2016']	soft pastel addit famy
705042542400770048	2016-03-02	['#thisisboss']	eleg luxury stapl clutch rework soft lemon yellow spring
704966912590139393	2016-03-02	['#bossbottl', '#londonhasfal', '#manoftoday']	fragr ambassad @gerardbutler wear boss premy last night
704719232936890369	2016-03-01	['#clementchabernaud', '#springsummer2016', '#thisisboss']	wear bold pattern &amp; col
704708536052359168	2016-03-01	['#springsummer2016', '#clementchabernaud', '#thisisboss']	behind scen campaign &amp; @annaewers
704677110003208192	2016-03-01	['#thebigshort', '#academyaward']	screenwriter charl randolph wear boss pick osc
704392145948561408	2016-02-29	['#thisisboss']	discov story boss sign bag
704325467713761283	2016-02-29	['#thisisboss']	boss sign bag mad hand flor
703937820197593088	2016-02-28	['#thisisboss']	modern design meet it craftsm boss sign bag
703869094181744640	2016-02-28	['#rooneymar', '#spiritaward', '#thisisboss']	academy award nomin black&amp;white ple twee dress she panel
703613182330413056	2016-02-27	['#thisisboss']	discov boss sign bag design form funct mind
703205444941160448	2016-02-26	['#thisisboss']	introduc new boss sign bag design modern man
702927655788802048	2016-02-25	['#europaleagu', '#bosssport', '#fcpbvb']	gam chang good luck tonight's match @matshummels
702479000866824193	2016-02-24	['#ellestyleaward', '#thisisboss']	ton garrn beauty fring tail last night
702437980636651521	2016-02-24	['#bossfashionshow']	would lov buy wom orang coat @andre_hamann
702412813122277376	2016-02-24	['#abffaward', '#styl']	krew dress @hugoboss sho @gianvito_rossi clutch @judithleiberny @erinwalshnyc
702139160434446337	2016-02-23	['#bossfashionshow', '#nyfw']	bold col new season seen
701803383091499008	2016-02-22	['#thisisboss']	@miraduma lov minim look boss womenswear
701769855595372544	2016-02-22	['#bossbespok', '#abff', '#thisisboss']	scandal's @kerrywashington look beauty gown award
701737367233830913	2016-02-22	['#fallwinter2016', '#thisisboss']	chic black met shot bold &amp; soft col runway
701448838771564550	2016-02-21	['#bossfashionshow', '#thisisboss']	fab @evachen212 new york
701405806189793280	2016-02-21	['#bossfashionshow', '#thisisboss']	styl star gath see new collect rev
701363767561560064	2016-02-21	['#nyfw', '#thisisboss']	flow feminin silhouet new look boss womenswear runway
701031106003542017	2016-02-20	['#bossbespokeb', '#bossfashionshow', '#thisisboss']	ready look new interpret
700966863845593088	2016-02-20	['#pernilleteisbaek', '#thisisboss']	thought collect tru amaz
700715464461254661	2016-02-19	['#fallwinter2016', '#thisisboss']	new runway collect art direct jason wu
700652085310697473	2016-02-19	['#jasonwu', '#thisisboss']	lot curvilinear lin defin woman's body new boss collect
700604688731914241	2016-02-19	['#bossfashionshow', '#nyfw', '#thisisboss']	act backst
700437830288470016	2016-02-18	['#bossfashionshow', '#thisisboss', '#nyfw']	glimps bauha set
700408824373575680	2016-02-18	['#thisisboss']	would look good wif @marianodivaio favorit dress boss show
700378412016394240	2016-02-18	['#bossfashionshow', '#thisisboss']	chic eleg underst cool @emrata
700351568248467456	2016-02-18	['#nyfw', '#bofw']	uptown girl @hugoboss wom read ful show review
700333464839712768	2016-02-18	['#bossfashionshow', '#thisisboss', '#nyfw']	front row act new york
700312093036277760	2016-02-18	[]	boss appl sauc dilon backst hugo boss
700305786325614592	2016-02-18	['#thisisboss']	curv lin defin feminin new look fal 2016
700167906047430661	2016-02-18	['#thisisboss']	head @hugoboss show right com periscop see show
700167863278137345	2016-02-18	['#thisisboss', '#mdvaroundtheworld']	second shot today's fash show @hugoboss
700077715123216388	2016-02-17	['#fw16', '#boss', '#saksattheshow']	view eleg architect jason wu's @hugoboss collect
700076904532078593	2016-02-17	['#nyfw']	spot @kyliejenner @emrata front row @hugoboss
700076804640473089	2016-02-17	['#rtw', '#bossfashionshow']	black first look op @hugoboss fal 2016 show
700076739578482688	2016-02-17	['#bru', '#fash', '#bossfashionshow', '#thisisboss']	modern touch set ton @hugoboss @skiptotheru
700034462629949444	2016-02-17	['#periscop', '#bossfashionshow']	liv auf liv
700032007531798528	2016-02-17	['#bossfash', '#thisisboss', '#nyfw']	almost tim watch show liv 2 est
700022341531729920	2016-02-17	['#bossfashionshow', '#thisisboss']	backst boss star makeup art @patmcgrathreal cre beauty look
699941486796894212	2016-02-17	['#bossfashionshow', '#thisisboss', '#nyfw']	we'r way see new collect rev liv 2 est
699776588519448576	2016-02-17	['#bossfashionshow', '#thisisboss', '#nyfw']	liv periscop febru 17 2 est
699746977156874241	2016-02-17	['#bossfashionshow', '#nyfw']	night watch tomorrow feb 17 2 est
699696746776174593	2016-02-16	['#nyfw', '#bossfashionshow', '#thisisboss']	dress boss beauty kik kang head &amp; tomorrow
699599962649313280	2016-02-16	['#bossfashionshow', '#nyfw']	rev tomorrow febru 17 2 est watch liv
699339220062748672	2016-02-15	['#bossfashionshow', '#thisisboss', '#nyfw']	invit watch liv wednesday
699316760722276352	2016-02-15	['#bossfashionshow', '#nyfw', '#thisisboss']	two day watch liv 2 est
699290534683271168	2016-02-15	['#bossfashionshow', '#thisisboss', '#nyfw']	hello freez nyc we'r start countdown feb 17th
698747641967046656	2016-02-14	['#bosssport']	get ready tee boss ambassad martin kaym set play maybank champ malays
698135185263620096	2016-02-12	['#dianekrug', '#thisisboss']	wear sleek boss tuxedo celebr op joshu jackson's new play
698090111792193536	2016-02-12	['#thisisboss']	mak ent model ton garrn wear custom boss gown berlin op gal
697829381432066049	2016-02-11	['#thisisboss', '#bosssport']	styl &amp; golf cours martin kaym wear boss new york
697775941741838336	2016-02-11	['#thisisboss']	discov boss conceiv stor feat mad meas @kempinski 'das tirol' feb 15
697737451520057346	2016-02-11	['#annaew', '#thisisboss', '#behindthesc']	set new campaign shoot
697469062784425985	2016-02-10	[]	ready season golf pro @henrikstenson streets new york city
697402627617906688	2016-02-10	['#springsummer2016', '#thisisboss']	new boss eyewear avail
697106288719896576	2016-02-09	['#bosssport', '#vfbbvb', '#dfbpokal']	goal sight dfb cup watch @matshummels play tonight
697028138182778880	2016-02-09	['#thisisboss', '#springsummer2016']	sign tail reinterpret bold flam red
696713320624209921	2016-02-08	['#thisisboss', '#springsummer2016']	new boss sunglass worn @annaewers new york
696266567244455936	2016-02-07	['#springsummer2016', '#thisisboss']	bold modern timepiec
696010307043532800	2016-02-06	['#springsummer2016', '#thisisboss']	feminin timepiec collect worn @annaewers
695895157582000128	2016-02-06	['#roadtovend', '#bosssport', '#sail']	vend glob year month go follow @alexthomson99's person
695616932666613760	2016-02-05	['#thisisboss']	perfect gift valentine's day
695562091940487169	2016-02-05	['#thisisboss', '#springsummer2016']	bold tail it access
695323569828552704	2016-02-04	['#bossthesc', '#theojam']	ready valentine's day
695279579737497600	2016-02-04	['#thisisboss', '#bosssport']	for @alex_noren lead pack first day @omegaddc
695231160713084928	2016-02-04	['#springsummer2016', '#thisisboss']	ann ew wear soft tail &amp; new munich bag
694855719208763393	2016-02-03	['#thisisboss', '#springsummer2016']	tail meet sportswear
694514177675784193	2016-02-02	['#springsummer2016', '#clementchabernaud']	tim set campaign
694443296974884864	2016-02-02	[]	@triciacrane1950 sorry hear expery pleas email us we'r happy help
694187797012430848	2016-02-01	['#homeland', '#thisisboss']	star alexand fehl wear boss tail @sagawards
694165294416293889	2016-02-01	['#springsummer2016', '#thisisboss']	beauty @annaewers flow dress shot @inezandvinoodh
693706633059368960	2016-01-31	['#thisisboss', '#springsummer2016']	see new boss eyewear campaign star act eddy peng
693402997339099136	2016-01-30	['#theojam', '#bossthesc']	boss man fac seduc new fragr men
693120496964124672	2016-01-29	['#thisisboss', '#springsummer2016']	new boss eyewear campaign star act eddy peng
693077961721933824	2016-01-29	['#springsummer2016', '#thisisboss', '#behindthesc']	shoot campaign @annaewers montauk new york
693046645236355072	2016-01-29	['#springsummer2016', '#thisisboss']	beauty @annaewers flow micro dress new campaign
692733988906110976	2016-01-28	['#behindthesc']	glimps new boss eyewear campaign star act eddy peng
692686335073730560	2016-01-28	['#springsummer2016', '#thisisboss', '#behindthesc']	capt campaign star @cchabernaud
692643221831286784	2016-01-28	['#thisisboss', '#springsummer2016']	new boss womenswear campaign film star beauty @annaewers
692292314572660736	2016-01-27	['#springsummer2016', '#thisisboss', '#clementchabernaud']	art tail bold look new campaign
692253187802165248	2016-01-27	['#thisisboss']	we'r celebr 1m @instagram follow join us
692034096613191680	2016-01-26	['#kevintrap', '#gqmoty', '#thisisboss']	@psg_inside wear boss tail award last night
691955663405215744	2016-01-26	['#clementchabernaud', '#springsummer2016', '#behindthesc']	perfect tail set new campaign
691589886793682944	2016-01-25	['#springsummer2016', '#clementchabernaud']	new outerwear boss collect worn
691176068284289024	2016-01-24	['#clementchabernaud', '#thisisboss']	new boss menswear campaign film starr
690842344166273024	2016-01-23	['#bosssport']	get ready kick socc season begin 2016 ev year @matshummels
690819195873943552	2016-01-23	['#springsummer2016', '#thisisboss', '#bossbespokeb']	capt gorg @annaewers new campaign
690544093064224768	2016-01-22	['#springsummer2016', '#thisisboss']	beauty @annaewers campaign shot @inezandvinoodh
690525181270462464	2016-01-22	['#cl']	exclud look behind scen new boss campaign star
690212718612238337	2016-01-21	['#ashtonkutch', '#theranchnetflix', '#thisisboss']	wear boss introduc new show californ
690192006937710592	2016-01-21	[]	showtim @hugoboss
690183327630901248	2016-01-21	['#springsummer2016', '#clementchabernaud']	glimps new film star @annaewers
690149571218018304	2016-01-21	['#springsummer2016', '#clementchabernaud']	deep navy tail new campaign star
690122072220020736	2016-01-21	['#adgolfchamp', '#bosssport']	@henrikstenson get bal rol
689831420877996032	2016-01-20	['#springsummer2016', '#thisisboss', '#bossbespokeb']	introduc new campaign star @annaewers
689453636942823428	2016-01-19	['#thisisboss', '#resort2016']	embroid whit dress fresh spring look
689050402269061120	2016-01-18	['#eurasiacup', '#bosssport']	congrat golf @vdubush &amp; team europ win
688394190733062145	2016-01-16	['#thisisboss', '#resort2016']	precid tail dress day night eleg
687998470372855808	2016-01-15	['#thisisboss']	slim fit sharp cut contemp tak tuxedo
687961432831430656	2016-01-15	['#resort2016', '#thisisboss']	soft shad cle light hue collect
687664025862303744	2016-01-14	['#wuashun', '#eurasiacup', '#bosssport']	team europ vs team as good luck @vdubush ben
687643179387105280	2016-01-14	['#thisisboss']	combin leath sued sharp new season look
687226483975303168	2016-01-13	['#menswear', '#thisisboss']	new feat bold architect grid print
687226063907360768	2016-01-13	['#resort2016', '#thisisboss']	new look collect
686936991326404608	2016-01-12	['#resort2016', '#thisisboss']	new look collect
686899291030466560	2016-01-12	['#thisisboss', '#resort2016']	jacquard wav design mov within precid tail lin
686526849409744896	2016-01-11	['#thisisboss']	modern upd sharp slim tak class tuxedo
685491586592038912	2016-01-08	['#thisisboss', '#resort2016']	soft contrast col block spring shad
685482143569547264	2016-01-08	['#prefall2016', '#annaew', '#thisisboss']	first look boss womenswear collect worn
685463844957892608	2016-01-08	['#wuashun', '#eurasiacup']	congr becom first chines golf select @eurasiacupgolf as team
685109208384159744	2016-01-07	['#thisisboss']	choos modern tail look bold leath cle contrast sep
685065792363311104	2016-01-07	['#joelmeacock', '#thisisboss']	new collect sharp tail look boss worn
684657740321521664	2016-01-06	['#thisisboss']	expert craft new lux tak field jacket soft napp leath
684397848134303744	2016-01-05	['#thisisboss']	city styl model @oliver_cheshire wear boss menswear london
684276261175312384	2016-01-05	['#thisisboss', '#resort2016']	invert lapel &amp; cufflink clos rework tail blaz
683916683229134848	2016-01-04	['#thisisboss']	duty brit model @oliver_cheshire wear boss menswear london
682882662034489344	2016-01-01	['#thisisboss', '#happynewyear']	happy 2016 follow
682527038016765952	2015-12-31	['#thisisboss', '#holiday2015']	ready bring new year
682268796527198208	2015-12-30	['#nye', '#thisisboss']	mak ent wint whit
681507613431959552	2015-12-28	['#thisisboss']	new season leath
681161537952808961	2015-12-27	['#nye', '#thisisboss']	impecc look
680483274041487360	2015-12-25	['#thisisboss', '#holiday2015']	happy holiday
680437997708439552	2015-12-25	['#bossthesc']	seduc on lov holiday season
679928742140112896	2015-12-24	['#holiday2015']	mom mag watch boss holiday campaign film star cl chabernaud soph ahrend
679740959270289408	2015-12-23	['#holiday2015', '#thisisboss']	ultim ev look boss holiday campaign
679693825242214400	2015-12-23	['#thisisboss']	mak impact cle dress beauty craft accesss boss
679306763473182720	2015-12-22	['#thisisboss', '#holiday2015']	complet impecc ev look eleg sand
679291378795421696	2015-12-22	['#bossthesc']	set kristin baz
678959964870848512	2015-12-21	['#thisisboss', '#holiday2015']	mak ent discov impecc eveningwear boss
678714816157097984	2015-12-20	['#bosssport']	impecc dress congr @janfrodeno win athlet year
678479881857036288	2015-12-20	['#bossthesc']	new film feat @kayture mak man seduc
677922732240187392	2015-12-18	['#bossthesc', '#holiday2015']	look gift inspir discov seduc new fragr
677874843359031296	2015-12-18	['#bossmavy', '#holiday2015']	inspir modern cact flow accord perfect gift
677869905891356672	2015-12-18	['#holiday2015']	alway dress christmas @lookdepernille read
677839577659387904	2015-12-18	['#springsummer2016', '#thisisboss']	first look new campaign shot @inezandvinoodh star @cchabernaud
677835931332792320	2015-12-18	['#springsummer2016', '#thisisboss']	beauty ann ew star new campaign shot @inezandvinoodh
677585404321800196	2015-12-17	['#thisisboss', '#holiday2015']	mom mag expl fest gift boss collect season
677521319609651201	2015-12-17	['#hyg', '#holiday2015']	christmas copenh defin @lookdepernille read
677492295860637696	2015-12-17	['#thisisboss']	look stock fil shop boss bodywear onlin stor
677128602153050113	2015-12-16	[]	happy birthday &amp; congr @matshummels gre gam &amp; goal sunday good luck tonight's match
676790221585973248	2015-12-15	['#holiday2015', '#thisisboss']	step perfect cut tail ultim fest ev
676771428117647361	2015-12-15	['#holiday2015']	gift discov fragr &amp; access
676717111285309440	2015-12-15	['#holiday2015']	model @andre_hamann wear boss berlin read story
676449091941965825	2015-12-14	['#holiday2015', '#thisisboss']	ev ulitm access refin look
676444799642247168	2015-12-14	['#thisisboss', '#efa2015']	act daniel br wear boss @eurofilmawards berlin
676411255259799552	2015-12-14	['#holiday2015']	mak year unforget expl gift handcraft bag
676371130232479744	2015-12-14	[]	effortless styl tail whit shirt giv new feminin attitud
676094418374496256	2015-12-13	['#par']	day alway eleg @lookdepernille discov
676084045286125568	2015-12-13	['#thisisboss']	gentlem sharp modern look boss collect
675627986935246848	2015-12-12	['#asklew']	
675627769166974976	2015-12-12	['#asklew']	@leethegod1975
675627595174690816	2015-12-12	['#asklew']	@tomgreeny1993
675627227548094464	2015-12-12	['#asklew']	@f1sban
675627024493449216	2015-12-12	['#asklew']	@atomicbjg
675626926627753984	2015-12-12	['#asklew']	@ritarossi_46
675626852992552960	2015-12-12	['#asklew']	@cjdaniels77
675626423684567040	2015-12-12	['#asklew']	@afedchishin
675626088635191296	2015-12-12	['#asklew']	@dembelllend
675625988705792001	2015-12-12	['#asklew']	@jessicakelsey3
675625750452690944	2015-12-12	['#asklew']	@cherylssoldier1
675625474811404288	2015-12-12	['#asklew']	@lambertbitchxx
675625308192686080	2015-12-12	['#asklew']	@atniehaus
675624836476092416	2015-12-12	['#asklew']	@cardman2142
675624727818432512	2015-12-12	['#asklew']	@trainee_hellcat
675624413707018240	2015-12-12	['#asklew']	@richstreets16
675624094793117696	2015-12-12	['#asklew']	@matteagles
675623940115550208	2015-12-12	['#asklew']	@bottybecca
675623679041126401	2015-12-12	['#asklew']	@keithgarcia02
675623218938556416	2015-12-12	['#asklew']	
675557391631544320	2015-12-12	['#asklew']	last chant tweet us q's world champ @lewishamilton today q&amp;a 10 gmt
675357149829165056	2015-12-11	['#holiday2015']	sart leath complet sharp look fest season
675325957792768000	2015-12-11	['#asklew']	quest world champ @lewishamilton submit qs us saturday q&amp;a
675311481899065344	2015-12-11	['#thisisboss', '#holiday2015']	model @andre_hamann christmas berlin
675188694542864384	2015-12-11	['#asklew']	quest world champ @lewishamilton submit qs us saturday q&amp;a
674983703622385664	2015-12-10	['#holiday2015']	spec someth new eyewear boss collect
674962028784668672	2015-12-10	['#asklew']	quest world champ @lewishamilton tweet us us liv q&amp;a saturday 10 gmt
674945246346813440	2015-12-10	['#thisisboss']	dap @teoesquire @george_north talk styl slo street stor last night
674939337264492544	2015-12-10	['#bossbespokeb', '#resort2016', '#thisisboss']	new season new colo discov
674831702582280192	2015-12-10	['#f1', '#asklew']	season yet ask world champ @lewishamilton anyth ev want know
674675108515086336	2015-12-09	['#thisisboss']	new avy chronograph boss timepiec collect
674629840415264768	2015-12-09	[]	sportswear edg geomet quilt giv new attitud sharp tail jacket
674609862245023744	2015-12-09	['#asklew']	submit quest world champ @lewishamilton get answ q&amp;a saturday
674598700350578688	2015-12-09	['#asklew']	world champ @lewishamilton answ quest sat want know
674467965207764992	2015-12-09	['#asklew']	submit quest world champ @lewishamilton get answ q&amp;a saturday
674281167563169792	2015-12-08	['#holiday2015']	mak fest season extr spec gift boss collect
674258130495283200	2015-12-08	['#asklew']	quest world champ @lewishamilton tweet us q&amp;a dec 12 9 gmt
674235868912214017	2015-12-08	['#resort2016', '#thisisboss']	graph contrast discov new coat boss collect
674205634078863360	2015-12-08	['#resort2016', '#losangel']	look chic cle @aimeesong wear
674107499180638208	2015-12-08	['#asklew']	quest world champ @lewishamilton tweet us q&amp;a dec 12 9 gmt
673932895069843456	2015-12-07	['#resort2016', '#thisisboss']	new feminin cle modern tail soft fresh spring hue collect
673870959376474112	2015-12-07	['#holiday2015']	craft leath access expl boss gift collect
673818707936825344	2015-12-07	['#holiday2015']	london amaz plac walk around tak sight @oliver_cheshire
673743542695698433	2015-12-07	['#asklew']	want ask world champ @lewishamilton quest tweet us us liv q&amp;a dec 12
673582897186631685	2015-12-06	['#thisisboss', '#holiday2015']	perfect sued pump eleg flat boss access collect
673522469760839680	2015-12-06	['#thisisboss']	ev eleg step perfect tail piec night fal
673520777728270336	2015-12-06	[]	there's stil tim on last bit @henrikstenson mag
673177863286296576	2015-12-05	['#thisisboss', '#bosssport']	styl pitch @matshummels act tonight
673146138816552960	2015-12-05	['#par']	boss stor @lookdepernille discov
673040776683757568	2015-12-05	['#par', '#bossbespokeb']	mov @lookdepernille
672801698168094720	2015-12-04	['#bossbespokeb']	expl par @lookdepernille &amp; discov
672787979975450624	2015-12-04	['#par', '#bossbespokeb']	city light @lookdepernille
672759125584007169	2015-12-04	['#par', '#bossbespokeb']	icon styl @lookdepernille photograph person
672509472460423168	2015-12-03	['#resort2016', '#thisisboss']	exclud look behind scen shoot art direct jason wu
672458879184293888	2015-12-03	['#holiday2015']	inspir fest season discov eleg gift
672086725125124096	2015-12-02	['#thisisboss', '#holiday2015']	ultim night discov new eveningwear boss
672055940368191489	2015-12-02	['#bossbespokeb', '#resort2016']	new season col reimagin
671823072660467712	2015-12-01	[]	check interview
671726571326218240	2015-12-01	['#thisisboss']	new season look
671711689059008512	2015-12-01	['#holiday2015']	ad sparkl fest ev boss jewellery expl gift
671357027122290689	2015-11-30	['#holiday2015']	there's plac lik london christmas @oliver_cheshire read
671317198317703168	2015-11-30	['#thisisboss']	feminin tail fin sign at detail
671277114763714560	2015-11-30	['#abudhabigp']	gre fin amaz season congrat @mercedesamgf1 driv @nico_rosberg
670963756764168192	2015-11-29	['#thisisboss']	berlin ful gre plac every part city got energy @andre_hamann
670858710156210176	2015-11-29	['#holiday2015']	look gift inspir discov select leath bag
670640767380099072	2015-11-28	['#holiday2015', '#thisisboss']	tim celebr @andre_hamann wear new boss timepiec berlin
670515206439702528	2015-11-28	['#thisisboss']	weekend styl sharp fin
670285194537078784	2015-11-27	['#f1', '#thisisboss', '#bosssport']	rel world tour @mercedesamgf1 driv @lewishamilton &amp; @nico_rosberg
670222433329283072	2015-11-27	['#resort2016']	soft col org shap
670187049006309377	2015-11-27	['#thisisboss']	bold geomet pattern upd class trench
669920838850846720	2015-11-26	['#moty']	psg coach laur blant &amp; play @ecavaniofficial @tsilva3 receiv hugo boss award @gq_france
669900118041239553	2015-11-26	['#hbaa2015', '#bossart']	congrat art mar taniguch win 2015 hugo boss as art award
669838983124381697	2015-11-26	['#thisisboss']	techn fabr meet soft jersey piec
669557933773037568	2015-11-25	['#berlin', '#thisisboss', '#holiday2015']	night await @andre_hamann wear boss photo @sandrasemburg
669542462273232896	2015-11-25	['#berlin', '#thisisboss', '#holiday2015']	expl @andre_hamann photo @sandrasemburg
669516913584771072	2015-11-25	['#thisisboss', '#holiday2015']	mak impact flo gown fest season
669245625456836608	2015-11-24	['#thisisboss']	architect city lin inspir new collect boss menswear
669184711227514880	2015-11-24	['#thisisboss']	lightweight text fabr defin next season's tail piec
669139854052229120	2015-11-24	['#thisisboss', '#holiday2015']	beauty tail piec mak fest night sparkl
668848024634937344	2015-11-23	['#thisisboss']	timeless tail modern edg
668838475341430784	2015-11-23	['#thisisboss', '#resort2016']	pair vest straight pant cre flat lin daniel bernstein
668813875844923392	2015-11-23	['#nyc', '#bossbespokeb']	@weworewhat person
668792022388580353	2015-11-23	['#thisisboss', '#resort2016']	red red bet way mak impact
668489766711730176	2015-11-22	['#thisisboss', '#holiday2015']	perfect tuxedo
668001505438494720	2015-11-21	['#resort2016', '#thisisboss']	bold beauty look collect
667709928644190208	2015-11-20	['#lbd', '#thisisboss']	perfect fest season
667685548799213568	2015-11-20	['#thisisboss']	ev tail mak impact
667425163630264320	2015-11-19	['#thisisboss']	step new season pre collect boss menswear
667368266151628805	2015-11-19	['#thisisboss']	sign intery detail boss menswear
667027865410674689	2015-11-18	['#bossbespokeb', '#thisisboss']	craft flor
667010164973805568	2015-11-18	['#holiday2015', '#thisisboss']	first look new boss campaign
666628024536801280	2015-11-17	[]	new sign timepiec collect craft switzerland discov watch
665208900426317824	2015-11-13	['#matshummel', '#frag']	watch frant vs germany tonight excit see &amp; @dfb_team act tonight
665198790614364160	2015-11-13	['#f1', '#brazilgp']	last night town look sup suav downtown paulo @hugoboss
665153011136745473	2015-11-13	[]	happy day @hugoboss gre group @henrikstenson und @wuashun solid 2nd round forward ro
665152889027993600	2015-11-13	[]	@mkaymer59 @henrikstenson fing cross good luck us
665137659648569344	2015-11-13	[]	underst gray chic altern black timeless access
664873122387095552	2015-11-12	['#thisisboss', '#bosssport']	fin result @matshummels cur cov galam
664828739130368000	2015-11-12	['#thisisboss', '#paint']	get messy @matshummels shoot latest issu galam
664760655283683328	2015-11-12	['#itsalldesign', '#thisisboss']	insid bauha @vdm_news spons @hugoboss &amp; feat boss womenswear design
664471725627846656	2015-11-11	['#bauha']	beauty also funct boss womenswear art direct jason wu inspir
664454522069229568	2015-11-11	[]	par @hugoboss
664442744711041025	2015-11-11	[]	for bmw mast tee shangha good luck @henrikstenson @martinkaymer59 ben wu ashun &amp; @vdubush
664440570509697024	2015-11-11	['#bauha', '#thisisboss']	graph lin bold col mov inspir boss womenswear season season
664127623107321857	2015-11-10	['#bauha']	want cre thing last boss womenswear art direct jason wu inspir
664096445776179200	2015-11-10	['#bauha', '#thisisboss']	inspir icon shap col mot reimagin runway
664046587837030401	2015-11-10	['#bauha', '#thisisboss']	favourit boss piec styl
