id	created_at	hashtags	cleaned_text
1021315239781036039	2018-07-23	[]	happy monday enjoy 15% @muradskincareuk august mary clair think tim tre
1021289572347637762	2018-07-23	[]	meet pukka lov island nadir modern masculin begin sup next phas wond mat farquharson ann whiteh
1021276110183714816	2018-07-23	[]	obam said men get nerv lat say
1021115985712091136	2018-07-22	[]	fash influ tak yellow trend
1021110139443695618	2018-07-22	[]	miss opportun get 15% @muradskincareuk august mary clair off detail
1021015190756831232	2018-07-22	[]	beauty byt an weird sandwich lov moist shar stag ed she
1020863018278817793	2018-07-22	[]	millen guid 72 hour spain od
1020712519374131201	2018-07-21	[]	get pol skin @muradskincareuk exfo cleans wor 10 fre august mary clair pick today
1020706944678596608	2018-07-21	[]	definit guid best beauty produc spot lov island
1020551281415524352	2018-07-21	[]	first pic helen bonham cart princess margaret absolv point
1020406569224134656	2018-07-20	[]	thing know wom rugby
1020402292720390152	2018-07-20	[]	thing know wom rugby
1020368249957986304	2018-07-20	[]	skinc regim nee upd miss 15% @muradskincareuk august mary clair info
1020355386891816960	2018-07-20	[]	sand fiv way enjoy tobago sunbath
1020349381537480704	2018-07-20	[]	wond ser lik buffet ess ingredy skin
1020332783527342086	2018-07-20	[]	best tip fabl beauty rit panel
1020300164597272576	2018-07-20	[]	georg opin controvers lov island kiss chang watch foot
1020299335592919040	2018-07-20	[]	sum top sel sho real surpr
1020299307050680325	2018-07-20	[]	georg opin controvers lov island kiss chang watch foot
1020289648030113794	2018-07-20	[]	ridic easy exerc trim waist tight ab ton ars
1020283211107241984	2018-07-20	[]	touch reason princess dian wor eng ring divorc
1020276943474831362	2018-07-20	[]	surpr detail miss print lou christening photo
1020267404537094144	2018-07-20	[]	donald trump mad jok ivank trump surnam everyon confus
1020266335836635138	2018-07-20	[]	print charl self fan surpr uk tv show
1020261412587831299	2018-07-20	[]	print charl self fan surpr uk tv show
1020258015012794370	2018-07-20	[]	donald trump mad jok ivank trump surnam everyon confus
1020258006276104192	2018-07-20	[]	look lik print william tak kat holiday nee
1020255312954224640	2018-07-20	[]	look lik print william tak kat holiday nee
1020229525454630917	2018-07-20	[]	trail new docu
1020190579580440576	2018-07-20	[]	meet pukka ann mat discuss hairless wond mal lov island body
1020138735084744704	2018-07-20	[]	fash insid guid pack perfect holiday outfit
1020046886324129793	2018-07-19	[]	dior brought back carry bradshaw favourit bag
1020028736794656769	2018-07-19	['#womankind']	@esteelalonde rev beauty blog tip panel alway interest someth diff
1020028522419687429	2018-07-19	['#womenkind']	@dranjalimahto panel 80% sign ag sun
1020028078695829504	2018-07-19	['#womankind']	@fiona_beautyed panel good skinc routin find good &amp; us consist
1020017568076136451	2018-07-19	[]	skinc ingredy debunk hel word mean
1020015552314605568	2018-07-19	['#womankind']	hug thank incred panel @esteelalonde @dranjalimahto @fiona_beautyed @fabledbeauty panel tonight
1019986741359341568	2018-07-19	[]	fash insid guid pack perfect holiday outfit
1019986731834081280	2018-07-19	[]	dye hair lik profess hom
1019984752110129153	2018-07-19	[]	peopl get sery aggy beautyblend
1019969771318792192	2018-07-19	[]	lov island coupl real walk vill
1019959666997190657	2018-07-19	[]	dye hair lik profess hom
1019954198576705537	2018-07-19	[]	obam said men get nerv lat say
1019950576933724162	2018-07-19	[]	femin internet ex pretty incred
1019945887533969409	2018-07-19	[]	fash influ tak yellow trend
1019939215050792962	2018-07-19	[]	anoth world brokeback mountain cast brad pit leonardo dicaprio
1019935910530449408	2018-07-19	[]	kat upton mad import annount instagram
1019932973246935041	2018-07-19	[]	everyon talk melan trump fac met vladimir putin
1019927411822026752	2018-07-19	[]	tri kim kardash diet two week result expect
1019918973683490817	2018-07-19	[]	peopl get sery aggy beautyblend
1019917023562919937	2018-07-19	[]	141 athlet sex assault man show us cour real look lik
1019910006702067713	2018-07-19	[]	megh markl half launch hug accus duchess
1019905606034116608	2018-07-19	[]	lucky fre @muradskincareuk exfo cleans wor 10 august mary clair pick cop today
1019904363886776320	2018-07-19	[]	megh markl app find roy protocol difficult understand
1019902717660020738	2018-07-19	[]	megh markl half launch hug accus duchess
1019894566869118976	2018-07-19	[]	meet pukka ann mat discuss hairless wond mal lov island body
1019894561038979073	2018-07-19	[]	megh markl app find roy protocol difficult understand
1019892459529269249	2018-07-19	[]	princess eugeny follow print harry sweet wed detail
1019881673616429056	2018-07-19	[]	destiny child michel william proud happy healthy sought profess help depress
1019787659210878976	2018-07-19	[]	donald trump mad strange fals claim queen mak look bet
1019699469804298241	2018-07-18	[]	queen wear brooch secret trol trump
1019625599936102406	2018-07-18	[]	body brush key bet skin text
1019623366330761216	2018-07-18	[]	best book read sum bestsel rom ep
1019623349952045056	2018-07-18	[]	definit guid best beauty produc spot lov island
1019593765382709248	2018-07-18	[]	miss univers gre britain crown first black queen ev
1019583330717663233	2018-07-18	[]	miss chant get hand 15% @muradskincareuk august mary clair off detail
1019582615408467969	2018-07-18	[]	miss univers gre britain crown first black queen ev
1019582607871209472	2018-07-18	[]	everyon talk kat middleton push pres print william
1019582593140846605	2018-07-18	[]	off world instagram train
1019581180889518080	2018-07-18	[]	everyon talk kat middleton push pres print william
1019565976889618432	2018-07-18	[]	dear dol overbear moth ruin rel
1019563924952436736	2018-07-18	[]	dear dol overbear moth ruin rel
1019561181495914496	2018-07-18	[]	'dear dol moth ruin rel
1019549503630655489	2018-07-18	[]	millen guid 72 hour spain od
1019541445160718336	2018-07-18	[]	big accord celeb mak art
1019539299694329856	2018-07-18	[]	destiny child michel william proud happy healthy sought profess help depress
1019532758190841856	2018-07-18	[]	katy perry rev battl situ depress alb underperform last year
1019531253266042881	2018-07-18	[]	katy perry rev battl situ depress alb underperform last year
1019436541695979521	2018-07-18	[]	three sent emod donald trump
1019335511348072448	2018-07-17	[]	donald trump break protocol shak hand queen
1019272780385259521	2018-07-17	[]	rady @muradskincareuk exfo cleans wor 10 fre august mary clair pick today
1019271075518140417	2018-07-17	[]	aw18 trend report look wear autumn
1019268416748679168	2018-07-17	[]	aw18 trend report look wear autumn
1019260227122630656	2018-07-17	[]	childr cloth cool wish cam adult siz
1019260216905363457	2018-07-17	[]	micro trend solv sum workwear problem
1019258997772292098	2018-07-17	[]	childr cloth cool wish cam adult siz
1019230129074196480	2018-07-17	[]	sum best dress everyon stat back
1019211647137796097	2018-07-17	[]	hil clinton snub trump meet putin four simpl word
1019210520149323776	2018-07-17	[]	hil clinton snub trump meet putin four simpl word
1019196395448827909	2018-07-17	[]	princess charlot net wor 1 bil broth
1019194554182918149	2018-07-17	[]	sum best dress everyon stat back
1019194544636608512	2018-07-17	[]	princess charlot net wor 1 bil broth
1019194529503576064	2018-07-17	[]	last plan perfect selfy smil
1019169862529138688	2018-07-17	[]	three sent emod donald trump
1019161552396566528	2018-07-17	[]	emy ratajkowsk un two eng ring rais propos bar
1019135205536337920	2018-07-17	[]	prettiest sum dress liv without
1018997518137425921	2018-07-16	[]	print william print charl refus meet donald trump
1018891329709932546	2018-07-16	[]	emy ratajkowsk un two eng ring rais propos bar
1018886234373058561	2018-07-16	[]	amaz 15% @muradskincareuk await august mary clair off detail
1018869521870827520	2018-07-16	[]	megh markl dad warn daught terr new rol
1018863855470907394	2018-07-16	[]	lea michel hono cory montei fif annivers pass
1018859725113450497	2018-07-16	[]	tub stat nam england footbal man gare southg
1018855827225042945	2018-07-16	[]	tub stat nam england footbal man gare southg
1018855796988260353	2018-07-16	[]	scarlet johansson long play tran charact backlash
1018853460152913921	2018-07-16	[]	scarlet johansson long play tran charact backlash
1018846710829912069	2018-07-16	[]	look crown queen liz 2 fin
1018840489368399873	2018-07-16	[]	vagin skinc lin off don
1018839597956993027	2018-07-16	[]	print william print charl refus meet donald trump
1018831653530042368	2018-07-16	[]	vagin skinc lin off don
1018831634785693696	2018-07-16	[]	look crown queen liz 2 fin
1018815307157143554	2018-07-16	[]	lov island secret mess pass around cast
1018815283920699392	2018-07-16	[]	see aw lot topshop bag instagram
1018814972288217088	2018-07-16	[]	lov island secret mess pass around cast
1018807221528825857	2018-07-16	[]	pronount versac wrong whol tim
1018807000631824384	2018-07-16	[]	see aw lot topshop bag instagram
1018800892093652992	2018-07-16	[]	pronount versac wrong whol tim
1018798740235153408	2018-07-16	[]	print lou off christening photo sweetest thing see today
1018795418862440449	2018-07-16	[]	print lou off christening photo sweetest thing see today
1018729892488282112	2018-07-16	[]	lip fil feel lik
1018598391293595649	2018-07-15	[]	best ev sho quot favourit fash icon
1018562855325655040	2018-07-15	[]	sum nee glow skin achiev @muradskincareuk exfo cleans wor 10 fre month's issu
1018560587369013250	2018-07-15	[]	check highlight last @fabledbeauty ev book plac next tim panel includ sup influ @esteelalonde go dermatolog @dranjalimahto ticket video
1018488479943098368	2018-07-15	[]	not queen alway wear pearl necklac
1018406825266503680	2018-07-15	['#womankind']	enjoy 20% purchas next @fabledbeauty talk shop ev plu tak hom goody bag wor 30 ticket info
1018355974174896128	2018-07-15	[]	alert got three day shop cool la brand irl
1018212801842765824	2018-07-14	[]	new zar sal sect right world
1018180842378719237	2018-07-14	[]	enjoy 15% @muradskincareuk august mary clair think tim tre
1018152153339351041	2018-07-14	[]	@esteelalonde speak next @fabledbeauty ev maxim beauty rit look feel best ticket info miss
1018115589917863936	2018-07-14	[]	wed guest dress every shap styl budget
1018061298289008640	2018-07-14	[]	check highlight last @fabledbeauty ev book plac next tim panel includ sup influ @esteelalonde go dermatolog @dranjalimahto ticket video
1017987551729242113	2018-07-14	[]	olaplex hair tre work
1017856197553213442	2018-07-13	[]	miss next @fabledbeauty shop ev sup influ @esteelalonde go dermatolog @dranjalimahto mary clair seny beauty edit @fiona_beautyed host deputy edit @andreacanwrite ticket info
1017848397531770880	2018-07-13	[]	best found got cov hero formula
1017847898405507072	2018-07-13	[]	best found got cov hero formula
1017801984651485189	2018-07-13	[]	amazon prim day 2018 best deal watch
1017799080641040384	2018-07-13	[]	amazon prim day 2018 best deal watch
1017756668292157441	2018-07-13	[]	on thing lov island contest ban bring vill
1017751050307162112	2018-07-13	[]	app ivank trump cyc dark avoid trump protest
1017748883307261952	2018-07-13	[]	on thing lov island contest ban bring vill
1017748866957959168	2018-07-13	[]	lip fil feel lik
1017744650780729345	2018-07-13	[]	pregn tip pipp middleton got seren william
1017740706125832192	2018-07-13	[]	view fury samir franky night lov island hideaway edit
1017740689583439872	2018-07-13	[]	donald trump quot explain uk mak presid welcom
1017738413745803264	2018-07-13	[]	print harry tel brut jok print charl funniest thing see today
1017722497498796032	2018-07-13	[]	melan trump try send mess outfit palac
1017716858898800640	2018-07-13	[]	view fury samir franky night lov island hideaway edit
1017715791347630080	2018-07-13	[]	wait many peopl try break lov island vill every day
1017706462272000000	2018-07-13	[]	grab fre @muradskincareuk exfo cleans month's issu miss go get cop august issu they're gon
1017705425863675904	2018-07-13	[]	henry cavil apolog com post flirt
1017699601703473157	2018-07-13	[]	sorry bbc act reduc gend pay gap good enough
1017698155717066752	2018-07-13	['#womankind']	tak hom meg beauty haul wor 30 third @fabledbeauty talk beauty ev ticket sel fast
1017600069770588160	2018-07-13	[]	influ got bit shark try tak perfect instagram pic
1017520491421229056	2018-07-12	[]	samir op vill lif chos leav lov island
1017456680706236416	2018-07-12	[]	best hair mask dry dam brittl hair
1017450208412696576	2018-07-12	[]	wait many peopl try break lov island vill every day
1017442909950496768	2018-07-12	[]	megh markl showcas hid tal ireland
1017437242325811202	2018-07-12	[]	best hair mask dry dam brittl hair
1017437206636425217	2018-07-12	[]	awesom altern wed dress non brid
1017435515912642562	2018-07-12	[]	awesom altern wed dress non brid
1017420491894616064	2018-07-12	[]	print harry jok tel toddl pul megh hair sweetest thing see today
1017420375972569088	2018-07-12	[]	print harry jok tel toddl pul megh hair sweetest thing see today
1017412277832593421	2018-07-12	[]	melasm man
1017412203291394048	2018-07-12	[]	wed guest dress every shap styl budget
1017386873558306817	2018-07-12	[]	island mad shock decid leav lov island vill
1017385643289088000	2018-07-12	[]	island mad shock decid leav lov island vill
1017385636288819200	2018-07-12	[]	influ got bit shark try tak perfect instagram pic
1017385604353425408	2018-07-12	[]	melasm man
1017377558159978497	2018-07-12	[]	enough posit think surpr pow posit drink
1017377547607130113	2018-07-12	[]	check mol prop sum accord expert
1017356774414995457	2018-07-12	[]	surpr thing megh markl chang sint becom roy
1017355421391171585	2018-07-12	['#womankind']	next @fabledbeauty ev on week away miss panel discuss @esteelalonde go dermatolog @dranjalimahto mc seny beauty edit plu deputy edit @andreacanwrite ticket
1017352816929562624	2018-07-12	[]	surpr thing megh markl chang sint becom roy
1017351604813680640	2018-07-12	[]	print william mad emot stat world cup
1017346303628578816	2018-07-12	[]	best moist dry skin giv softest complect
1017345331196039170	2018-07-12	[]	miss opportun get 15% @muradskincareuk august mary clair off detail
1017238507981557762	2018-07-12	[]	nail art tool inspo could nee
1017133149833310209	2018-07-11	[]	fash edit celebr fight fash brand
1017103486327148544	2018-07-11	['#womankind']	got ticket @fabledbeauty ev yet tak hom goody bag wor 30 plu enjoy 20% discount night ticket
1017073077664940032	2018-07-11	[]	lov island girl allow funny
1017073045091938305	2018-07-11	[]	styl swimwear 100% elev holiday wardrob
1017072398837932032	2018-07-11	[]	lov island girl allow funny
1017056953225265157	2018-07-11	[]	nail art tool inspo could nee
1017048893417127936	2018-07-11	[]	four foolproof way step beauty gam sum
1017044541046755331	2018-07-11	[]	four foolproof way step beauty gam sum
1017008937722437634	2018-07-11	[]	four foolproof way step beauty gam sum via @youtube
1017008121699434498	2018-07-11	[]	megh markl roy wear brooch raf cent
1017003917140545536	2018-07-11	[]	megh markl roy wear brooch raf cent
1016999809411006465	2018-07-11	[]	print harry megh markl liv best liv dublin
1016997999052980225	2018-07-11	[]	print harry megh markl liv best liv dublin
1016991508740730880	2018-07-11	[]	print harry respons footbal com hom us today
1016991496069738497	2018-07-11	[]	kat middleton catch print william laugh church funniest thing see today
1016991489648291840	2018-07-11	[]	lov island star soph gradon boyfriend trag found dead
1016990688553119746	2018-07-11	[]	princess charlot said sassiest thing photograph lou christening
1016986717071527936	2018-07-11	[]	wow @muradskincareuk produc perfect exfo cleans fre month's issu pick today
1016979095639547904	2018-07-11	[]	surpr beauty hack learnt lov island jack
1016972374724497408	2018-07-11	[]	nee stock sum beauty ess join us third @fabledbeauty ev enjoy 20% plu tak hom goody bag wor 30 ticket
1016970995901587456	2018-07-11	[]	print harry respons footbal com hom us today
1016963592317530112	2018-07-11	[]	kat middleton catch print william laugh church funniest thing see today
1016951906743341056	2018-07-11	[]	lov island star soph gradon boyfriend trag found dead
1016841336501211136	2018-07-11	[]	shop best train high street right
1016807599763804161	2018-07-10	[]	thing every wannab wel guru nee
1016766105942220800	2018-07-10	[]	carolin flack abs lov island vill
1016727513811378177	2018-07-10	['#womankind']	miss influ @esteelalonde go dermatolog @dranjalimahto mc seny beauty ed @fiona_beautyed deputy ed @andreacanwrite next @fabledbeauty ev plu tak hom goody bag wor 30 ticket
1016727403308216321	2018-07-10	[]	char mak dram return lov island vill
1016711666514345984	2018-07-10	[]	carolin flack abs lov island vill
1016703417031503873	2018-07-10	[]	shop best train high street right
1016700097911050241	2018-07-10	[]	megh markl nephew get mtv real show
1016695060006440960	2018-07-10	[]	megh markl nephew get mtv real show
1016678446863409152	2018-07-10	[]	kyly jen mad drast chang lip
1016678124346458112	2018-07-10	[]	not queen alway wear pearl necklac
1016672089355546624	2018-07-10	[]	princess charlot new hairstyl look almost unrecogn
1016665601320935427	2018-07-10	[]	megh markl wor ol green christening
1016661076056739840	2018-07-10	[]	princess charlot new hairstyl look almost unrecogn
1016659830453555200	2018-07-10	[]	print harry megh markl wed thank let pinterest worthy
1016644724994670594	2018-07-10	[]	print harry got nephew print lou sweetest christening gift
1016642328063365126	2018-07-10	[]	print harry got nephew print lou sweetest christening gift
1016636839455809536	2018-07-10	[]	georg clooney rush hospit hor car crash
1016636421937889280	2018-07-10	[]	georg clooney rush hospit hor car crash
1016628138053271552	2018-07-10	[]	kat middleton alway wear whit christenings
1016628125495582721	2018-07-10	[]	princess eugeny list bridesmaid annount
1016628112212148224	2018-07-10	[]	two city nee expl ultim auth am expery
1016619801186365441	2018-07-10	[]	skinc regim nee upd miss 15% @muradskincareuk august mary clair info
1016617626368401409	2018-07-10	[]	egypt spa hotel rank high travel hit list right
1016581551788908544	2018-07-10	[]	join us ev bubbl shop panel discuss brand new @fabledbeauty ev sery plu goody bag wor 30 ticket info
1016564184002236416	2018-07-10	[]	fin first glimps three print lou
1016457661867593733	2018-07-09	[]	kat middleton alway wear whit christenings
1016399386442649600	2018-07-09	[]	aso sel wheelchair jumpsuit
1016381228277272582	2018-07-09	['#womankind']	tak hom meg beauty haul wor 30 third @fabledbeauty talk beauty ev ticket sel fast
1016359837771460609	2018-07-09	[]	sign job mak il
1016352119979499520	2018-07-09	[]	princess eugeny list bridesmaid annount
1016346730089123840	2018-07-09	[]	sign job mak il
1016341227489382401	2018-07-09	[]	get confid less makeup sum @muradskincareuk exfo cleans wor 10 absolv fre mary clair august issu pick today
1016331679667929089	2018-07-09	[]	best shampoo hair get real greasy
1016331656746053633	2018-07-09	[]	best moist dry skin giv softest complect
1016330625635188736	2018-07-09	[]	best shampoo hair get real greasy
1016323122159468545	2018-07-09	[]	best ev sho quot favourit fash icon
1016316821870399488	2018-07-09	[]	queen print philip attend print lou christening
1016314803642462213	2018-07-09	[]	queen print philip attend print lou christening
1016289895034179584	2018-07-09	[]	chrissy teig shut wom trol breastfee photo
1016288027084251138	2018-07-09	[]	chrissy teig shut wom trol breastfee photo
1016281584821891072	2018-07-09	[]	best high street wed dress favourit stor right
1016280324479815680	2018-07-09	[]	best high street wed dress favourit stor right
1016274601352024069	2018-07-09	[]	hailey baldwin eng justin bieb ring fab
1016273271614930949	2018-07-09	[]	aso sel wheelchair jumpsuit
1016268673705742336	2018-07-09	[]	best spot tre zap zit go
1016264985524072448	2018-07-09	[]	hailey baldwin eng justin bieb ring fab
1016264978813239296	2018-07-09	[]	best spot tre zap zit go
1016264969610977280	2018-07-09	[]	lov island iain stirl going solv georg dram
1016263010049036288	2018-07-09	[]	lov island iain stirl going solv georg dram
1016257481297793025	2018-07-09	[]	nev spray perfum hair
1016188229316423686	2018-07-09	[]	canad prim min justin trudeau respond grop alleg
1016085165817389061	2018-07-08	[]	57 fash quot liv every singl day
1016045530915500038	2018-07-08	[]	nee stock sum beauty ess join us third @fabledbeauty ev enjoy 20% plu tak hom goody bag wor 30 ticket
1015959392632627201	2018-07-08	[]	gut tel
1015864323342831623	2018-07-08	['#womankind']	enjoy 20% purchas next @fabledbeauty talk shop ev plu tak hom goody bag wor 30 ticket info
1015825076422348801	2018-07-08	[]	15% murad
1015715209913217025	2018-07-07	[]	57 fash quot liv every singl day
1015625751180251136	2018-07-07	[]	@esteelalonde speak next @fabledbeauty ev maxim beauty rit look feel best ticket info miss
1015605917004550146	2018-07-07	[]	hot list new favourit stor onlin week
1015578443298299905	2018-07-07	[]	dul dry skin @muradskincareuk cleans find fre month's issu
1015528005471559681	2018-07-07	[]	mak avocado last long
1015519550140567552	2018-07-07	[]	check highlight last @fabledbeauty ev book plac next tim panel includ sup influ @esteelalonde go dermatolog @dranjalimahto ticket video
1015468289852665856	2018-07-07	[]	best sheet mask giv inst skin boost
1015345658637807616	2018-07-06	[]	sint megh harry got eng roy cloth budget gon 1
1015313201842544640	2018-07-06	[]	miss next @fabledbeauty shop ev sup influ @esteelalonde go dermatolog @dranjalimahto mary clair seny beauty edit @fiona_beautyed host deputy edit @andreacanwrite ticket info
1015289678138920960	2018-07-06	[]	turn rihann pretty fam doppelgang
1015273439874179074	2018-07-06	[]	marc cain ss19 collect giv maj holiday vib
1015264887461720066	2018-07-06	[]	best fac ser transform skin
1015256583649914882	2018-07-06	[]	wed sho every fash brid lov
1015241797784756224	2018-07-06	[]	wed sho every fash brid lov
1015234643707269120	2018-07-06	[]	margot robby respond claim look lik meg lov island
1015213571452465152	2018-07-06	[]	nev spray perfum hair
1015208195290226688	2018-07-06	[]	ven william lov stalk seren william
1015205496297422848	2018-07-06	[]	forget thought knew lov island bracelet ey
1015202464960741376	2018-07-06	[]	forget thought knew lov island bracelet ey
1015193170840301570	2018-07-06	[]	everyon buy zar dress right
1015190685576658944	2018-07-06	[]	turn rihann pretty fam doppelgang
1015187715032342533	2018-07-06	[]	megh markl inspir am clooney
1015182339473735680	2018-07-06	[]	harry megh pda publ ev off back
1015182303805526017	2018-07-06	[]	harry megh pda publ ev off back
1015173779184586753	2018-07-06	['#womankind']	tak hom meg beauty haul wor 30 third @fabledbeauty talk beauty ev ticket sel fast
1015173396395511810	2018-07-06	[]	person thing megh markl chang sint becom roy
1015172906656174081	2018-07-06	[]	person thing megh markl chang sint becom roy
1015165384935104512	2018-07-06	[]	queen legit hid behind bush avoid awkward run
1015157172710195200	2018-07-06	[]	queen us jewellery send staff secret sign
1015138229044039680	2018-07-06	[]	danny dyer going lov island vill meet fut son jack
1015073442649997312	2018-07-06	[]	bod dress stil avail sal
1014966763337940997	2018-07-05	[]	much megh markl wardrob wor
1014902002281676801	2018-07-05	[]	print william harry ban world cup
1014893685618573312	2018-07-05	[]	much megh markl wardrob wor
1014874653750415360	2018-07-05	[]	popul baby nam 2018 definit surpr
1014853913722449920	2018-07-05	[]	august mary clair fre @muradskincareuk exfo cleans wor 10 perfect travel siz
1014850872650723333	2018-07-05	[]	david victor beckham celebr annivers loveliest way
1014850309233913856	2018-07-05	[]	david victor beckham celebr annivers loveliest way
1014845070208626690	2018-07-05	[]	act law cal baby on nam
1014840146167033856	2018-07-05	['#whov', '#13thdoctor', '#drwhoseason11']	excit new we'r interview want know lik ask jody whittak let us know best qs
1014838841801367552	2018-07-05	[]	two dump lov island contest shar dat night
1014833286126931968	2018-07-05	[]	new mak skinc hair produc lov mon
1014829676378968066	2018-07-05	['#tbt', '#futureshapersl', '#beautygo']	amaz goody bag ev @neutrogena @iamscentered @ogxbeauty @klorane_uki @schwarzkopfpro @soapandglory @coverfx @hippeas_snacks @kikomilanouk @headmastersuk @livingproofuk @microscooters @spsystempro @cwhairlondon
1014826351679942656	2018-07-05	[]	emod megh markl us describ wed day
1014825644142678017	2018-07-05	[]	kat middleton allow run marathon
1014820976767459328	2018-07-05	[]	kat middleton allow run marathon
1014811755850190850	2018-07-05	[]	best cont hid dark circ blem
1014808122379177986	2018-07-05	['#womankind']	next @fabledbeauty ev two week away miss panel discuss @esteelalonde go dermatolog @dranjalimahto mc seny beauty edit plu deputy edit @andreacanwrite ticket
1014765114912858112	2018-07-05	[]	lov island 2015 coupl
1014694827857010690	2018-07-05	[]	sho pack holiday accord expert
1014638008551735296	2018-07-04	[]	find right bra siz
1014631449843073024	2018-07-04	[]	proof girl gang secret success busy
1014624786192977923	2018-07-04	[]	meet pukka new column talk feel half
1014618289052573697	2018-07-04	[]	print harry want hold hand megh markl
1014611930978443265	2018-07-04	[]	trump misspelt stat excel writ skil got trol jk rowl
1014605297317564416	2018-07-04	[]	eyelash grow serum act
1014598270851706882	2018-07-04	[]	11 tim fel complet lov lov island georg
1014592743966945281	2018-07-04	[]	duk duchess cambridg chos print lou god par
1014591185783001089	2018-07-04	[]	vaness kirby rev text helen bonham cart sent set crown
1014582347923099648	2018-07-04	[]	six haut cout fash week gown megh markl wear
