id	created_at	hashtags	cleaned_text
1047867969080946688	2018-10-04	[]	real ros last entir year witchcraft
1047848924978008064	2018-10-04	[]	saus dog cak mad birthday party much cut
1047843082203361280	2018-10-04	[]	saus dog cak mad birthday party much cut
1047843060518871041	2018-10-04	[]	obama celebr annivers cutest way
1047836362290995200	2018-10-04	[]	ex kat middleton mad print william jeal
1047834741129371649	2018-10-04	[]	ex kat middleton mad print william jeal
1047830986304704512	2018-10-04	[]	would watch sex city without kim cattral sjp imagin
1047825211683426304	2018-10-04	[]	megh markl dog femin follow find hil
1047819377976987649	2018-10-04	[]	new harry pot bar london already
1047817776025325568	2018-10-04	[]	van drop coolest disney collect tomorrow
1047809244475482112	2018-10-04	[]	meet pukka ann mat intens fem friend vers blok mat
1047796988882903041	2018-10-04	[]	megh markl wor 69 shirt on fav high street stor
1047788434952245248	2018-10-04	[]	zar mul sold on day com back stock
1047729991516114944	2018-10-04	[]	frequ fli maxim produc travel work
1047698926822985728	2018-10-04	[]	learn sex on night par daisy buch fling chang lif
1047639880338235392	2018-10-04	[]	best lip balm moist comb chap lip
1047578193732009986	2018-10-03	[]	want affair want partn on wom quest monogamy
1047521948656439296	2018-10-03	[]	much marry kind gwyne paltrow talk lov success marry second tim round
1047520794077589505	2018-10-03	[]	much marry kind gwyne paltrow talk lov success marry second tim round
1047516307128770561	2018-10-03	[]	queen new docu upset lot peopl
1047504065775656960	2018-10-03	[]	queen new docu upset lot peopl
1047495641797079040	2018-10-03	[]	best lip balm moist comb chap lip
1047480012469915648	2018-10-03	[]	chanel rivier holiday nee liv rn
1047472943138308096	2018-10-03	[]	kat middleton sweetest respons child ask photograph follow
1047470882476552193	2018-10-03	[]	kat middleton sweetest respons child ask photograph follow
1047470869809745925	2018-10-03	[]	chanel rivier holiday nee liv rn
1047470862129979394	2018-10-03	[]	best night cream must revit skin overnight
1047462642879582209	2018-10-03	[]	donald trump mock christine blasey ford campaign ral
1047462396779008002	2018-10-03	[]	donald trump mock christine blasey campaign ral
1047457118952083456	2018-10-03	[]	kat middleton wor return matern leav quit stat
1047454503736209408	2018-10-03	[]	kat middleton wor return matern leav quit stat
1047454491052630016	2018-10-03	[]	kat middleton off back roy duty
1047451930354733057	2018-10-03	[]	kat middleton off back roy duty
1047446232023482368	2018-10-03	[]	bradley coop cast dog star born
1047441154684477443	2018-10-03	[]	bradley coop cast dog star born
1047416804392488960	2018-10-03	[]	breast cant aw mon produc shop octob
1047305560805310464	2018-10-03	[]	favourit cleans got excit upd los shit
1047230771486965761	2018-10-02	[]	kim kardash dang celebr search onlin
1047162034926903297	2018-10-02	[]	timo chalamet girlfriend know lov
1047141679369662465	2018-10-02	[]	timo chalamet girlfriend know lov
1047128933022486528	2018-10-02	[]	found best camel coat high street right
1047125461011070976	2018-10-02	[]	kim kardash dang celebr search onlin
1047125451271856129	2018-10-02	[]	found best camel coat high street right
1047096425346211840	2018-10-02	[]	48 sery cool plac brunch london
1047092600761606145	2018-10-02	[]	48 sery cool plac brunch london
1047091019894988801	2018-10-02	[]	lov island dan annount jack eng
1047085558248497152	2018-10-02	[]	megh markl found perfect hack mak lay seamless
1047080503889866753	2018-10-02	[]	princess eugeny drop hint wed dress month ago
1047076351893618688	2018-10-02	[]	princess eugeny drop hint wed dress month ago
1047076252178243589	2018-10-02	[]	megh markl sist sent publ dram apolog
1047074336379678721	2018-10-02	[]	megh markl sist sent publ dram apolog
1047057392750530560	2018-10-02	[]	best eyebrow makeup fil tam accentu arch
1046943485444657152	2018-10-02	[]	might afford effect skinc rang ev
1046848242158379009	2018-10-01	[]	emm watson wrot op let wom died due ireland abort rul
1046795648182304768	2018-10-01	[]	drip design swag becom definit success wardrob
1046791128085929986	2018-10-01	[]	gwyne paltrow already marry wed guest list af
1046787277542707217	2018-10-01	[]	gwyne paltrow already marry wed guest list af
1046783256744644608	2018-10-01	[]	ss19 fash trend modest way
1046779034942623744	2018-10-01	[]	ss19 fash trend modest way
1046775002861883392	2018-10-01	[]	buckingham palac sel replic megh markl eng ring 30
1046770737883672577	2018-10-01	[]	might afford effect skinc rang ev
1046770728681390081	2018-10-01	[]	buckingham palac sel replic megh markl eng ring 30
1046765645231255552	2018-10-01	[]	roy famy memb remov brit lin throne
1046762575566856193	2018-10-01	[]	roy famy memb remov brit lin throne
1046747103102476288	2018-10-01	[]	icym ins mom par fash week
1046729477584089088	2018-10-01	[]	icym ins mom par fash week
1046729471544291328	2018-10-01	[]	emm watson wrot op let wom died due ireland abort rul
1046713103092658179	2018-10-01	[]	internet turn pet davidson controvers com arian grand bir control
1046711682356183041	2018-10-01	[]	wom city app least satisfy sex liv
1046705050800668672	2018-10-01	[]	wom city app least satisfy sex liv
1046662962566635525	2018-10-01	[]	donald trump held 80 press conf bret kavanaugh bar ment
1046565654629879808	2018-10-01	[]	retinol ingredy reduc wrinkl
1046393215816019968	2018-09-30	[]	brac mak murd part com
1046294254014930944	2018-09-30	[]	influ sho collect nev knew nee
1046163721536630784	2018-09-29	[]	writ kil crim novel val mcdermid sold 15 mil
1046015929946173440	2018-09-29	[]	car nagin fantast beast
1045895527492198400	2018-09-29	[]	season sel stat coat com back stock
1045795600225193985	2018-09-28	[]	work ant ayurv wel trend beauty routin
1045725853496225792	2018-09-28	[]	best fac london relax complect perfect
1045693635642241025	2018-09-28	[]	lady gag told get nos job first start
1045692643584270336	2018-09-28	[]	car nagin fantast beast
1045676144534548481	2018-09-28	[]	lady gag told get nos job first start
1045640274825945088	2018-09-28	[]	soph turn said lot gam thrones fan disappoint moon fin
1045634752064049152	2018-09-28	[]	soph turn think gam thrones fan disappoint moon fin
1045629340833255425	2018-09-28	[]	grab cop octob issu get fre @thebodyshopuk hand cream
1045626318686117889	2018-09-28	[]	megh markl said spirit hack mad much happy
1045626311446654976	2018-09-28	[]	work ant ayurv wel trend beauty routin
1045578221864067072	2018-09-28	[]	limit edit harry pot stamp com break quil parch
1045524971106291713	2018-09-28	[]	queen latest tribut unveil lit design ipad
1045500327586398209	2018-09-28	[]	on roy famy model beauty brand speechless
1045447161679360002	2018-09-27	[]	on week megh markl char cookbook already best sel
1045394978103545863	2018-09-27	[]	gisel b op leonardo dicaprio break
1045387818124660736	2018-09-27	[]	here's want get hand 5 @thebodyshopuk hand cream fre octob issu
1045352642950529024	2018-09-27	[]	megh markl might duchess on thing nev chang
1045352540160905217	2018-09-27	[]	unexpect act want harry pot film sent j rowl cv ref
1045346916551282689	2018-09-27	[]	megh markl might duchess on thing nev chang
1045344585629593600	2018-09-27	[]	donald trump held 80 press conf bret kavanaugh bar ment
1045336430233313285	2018-09-27	[]	post hair detox lock nee sery tlc heat
1045332522987655169	2018-09-27	[]	post hair detox lock nee sery tlc hot hot sum
1045326688027127808	2018-09-27	[]	12 aust fash brand nee know
1045319671853985792	2018-09-27	[]	12 aust fash brand nee know
1045311385452703745	2018-09-27	[]	brac mak murd part com
1045305626090508288	2018-09-27	[]	drop everyth hud beauty annount new eyeshadow palet
1045286423169921024	2018-09-27	[]	limit edit harry pot stamp com break quil parch
1045286413984444416	2018-09-27	[]	kermit frog collab icon french brand surpr chic
1045273715687268352	2018-09-27	[]	tru @thebodyshopuk mak best hand cream around
1045268509817745413	2018-09-27	[]	print william rev hil reason kat want go tour
1045262581739507712	2018-09-27	[]	kermit frog collab icon french brand surpr chic
1045257162719670277	2018-09-27	[]	mulberry coat edit covet par
1045251681729085441	2018-09-27	[]	going see lot kat middleton cannot wait
1045251496667885568	2018-09-27	[]	mulberry coat edit covet par
1045251474664521729	2018-09-27	[]	influ sho collect nev knew nee
1045177737433042944	2018-09-27	[]	best kit heel wom hat stiletto
1045037359404896257	2018-09-26	[]	padm lakshm shar story rap respons trump scand
1045029513279627264	2018-09-26	[]	padm lakshm shar story rap respons trump scand
1044999623725776896	2018-09-26	[]	best design handb invest right
1044988254984925184	2018-09-26	[]	best design handb invest right
1044979925038452736	2018-09-26	[]	dress next season
1044979301261750273	2018-09-26	[]	everyth buy aso right
1044971633713106945	2018-09-26	[]	everyth buy aso right
1044955524268089344	2018-09-26	[]	best fac ser transform skin
1044945806304976896	2018-09-26	[]	arian grand hold onto piec mac mil
1044939424490905600	2018-09-26	[]	arian grand hold onto piec mac mil
1044926033382821889	2018-09-26	[]	suit fan sad megh answ quest show
1044923321152749570	2018-09-26	[]	suit fan sad megh answ quest show
1044923307038978048	2018-09-26	[]	breast cant aw mon produc shop octob
1044882956865687552	2018-09-26	[]	season sel stat coat com back stock
1044882941946601478	2018-09-26	[]	megh markl wed dress act tribut queen
1044845548510072832	2018-09-26	[]	megh markl wed dress act tribut queen
1044790572387618816	2018-09-26	[]	styl aw18 maj anim print trend lik pro
1044694617160110080	2018-09-25	[]	coc work rang marijuan drink
1044651477736849408	2018-09-25	[]	downton abbey movy way cannot wait
1044642703768719362	2018-09-25	[]	on writ tel us everyth know liv fibromyalg
1044620387265523712	2018-09-25	[]	gwyne paltrow goop com uk fin
1044614459006881792	2018-09-25	[]	on mom crown upset queen
1044612335250227200	2018-09-25	[]	downton abbey movy way cannot wait
1044612270519545856	2018-09-25	[]	on writ tel us everyth know liv fibromyalg
1044603953583841284	2018-09-25	[]	on mom crown upset queen
1044595920170442753	2018-09-25	[]	best lug every travel scenario wheth light pack
1044578660458479617	2018-09-25	[]	best kit heel wom hat stiletto
1044554040028221446	2018-09-25	[]	writ kil crim novel val mcdermid sold 15 mil
1044552095452606464	2018-09-25	[]	megh harry weekend break amsterdam star holiday ev
1044545742470180864	2018-09-25	[]	megh harry weekend break amsterdam star holiday ev
1044539277940609024	2018-09-25	[]	first roy sex marry off tak plac
1044533794496237568	2018-09-25	[]	30 primark coat act wait list
1044528855795417093	2018-09-25	[]	first roy sex marry off tak plac
1044520052777570304	2018-09-25	[]	chic pjs mak cas nev get dress
1044520047601807360	2018-09-25	[]	retinol ingredy reduc wrinkl
1044519671876210688	2018-09-25	[]	believ long crazy rich as wed dress took mak
1044441311493984257	2018-09-25	[]	beauty crack glam fest fac gam
1044333913034903562	2018-09-24	[]	mil fash week street styl pic prov it real sho bet
1044277360814698496	2018-09-24	[]	chic pjs mak cas nev get dress
1044267886133563392	2018-09-24	[]	crazy rich as lead lady tel truth as wom hollywood
1044248130558951424	2018-09-24	[]	want nail strong lip dar skip step
1044248109721673728	2018-09-24	[]	styl aw18 maj anim print trend lik pro
1044198904722608129	2018-09-24	[]	kat middleton join print william holiday
1044190244407394304	2018-09-24	[]	mil fash week street styl pic prov it real sho bet
1044190236694085632	2018-09-24	[]	kat middleton join print william holiday
1044181937173159938	2018-09-24	[]	seren william text megh markl follow u op loss
1044181924124667904	2018-09-24	[]	wom writ publ let ivank trump shock reason
1044181914331086849	2018-09-24	[]	seren william text megh markl follow u op loss
1044174444099440641	2018-09-24	[]	rom detail nev not megh markl wed dress
1044173617292931073	2018-09-24	[]	rom detail nev not megh markl wed dress
1044165321207083009	2018-09-24	[]	princess eugeny jack brooksbank delay eng
1044164832910602240	2018-09-24	[]	princess eugeny jack brooksbank delay eng
1044159178296762368	2018-09-24	[]	justin theroux fin brok sil heartbreak split jen aniston
1044157138057125890	2018-09-24	[]	justin theroux fin brok sil heartbreak split jen aniston
1044157130012610560	2018-09-24	[]	unexpect detail lov rixo laur jackson collab
1044154059656237057	2018-09-24	[]	unexpect detail lov rixo laur jackson collab
1044043108902739974	2018-09-24	[]	pet dinkl fak dea gam thrones mess peopl
1043906568604012544	2018-09-23	[]	word miss onlin dat profil
1043784922270445570	2018-09-23	[]	halloween costum idea celeb
1043681745403621376	2018-09-23	[]	troubl get eight hour kip every night nee sleep ap
1043572967429611521	2018-09-22	[]	dem lovato moth op daught suspect overdos
1043457690717102080	2018-09-22	[]	alex chung latest superg caps ev bet last
1043340348624388096	2018-09-22	[]	celebr sel tear onlin gon bit far
1043266130922668034	2018-09-21	[]	rees witherspoon ryan philip agr marry brok
1043170415613538304	2018-09-21	[]	victor beckham mua say secret perfect smokey ey every tim
1043123261037596677	2018-09-21	[]	joe alwyn op priv rel tayl swift
1043122953028694016	2018-09-21	[]	word miss onlin dat profil
1043122939460108288	2018-09-21	[]	joe alwyn op priv rel tayl swift
1043114653914562562	2018-09-21	[]	alex chung latest superg caps ev bet last
1043106353504342017	2018-09-21	[]	victor beckham mua say secret perfect smokey ey every tim
1043106336496472065	2018-09-21	[]	print harry caught internet ste samosa megh markl cookbook launch
1043103410881482752	2018-09-21	[]	print harry caught internet ste samosa megh markl cookbook launch
1043098291603267584	2018-09-21	[]	seren william pra bff megh markl ad way instagram
1043095597429997568	2018-09-21	[]	seren william pra bff megh markl ad way instagram
1043081731916460032	2018-09-21	[]	pet dinkl fak dea gam thrones mess peopl
1043081178159493120	2018-09-21	[]	icon 00s bag mak comeback
1043075928430133253	2018-09-21	[]	tiar princess eugeny wear wed day
1043073031852060672	2018-09-21	[]	tiar princess eugeny wear wed day
1043056654026076160	2018-09-21	[]	megh markl brought mum along first solo out
1043048712853839873	2018-09-21	[]	megh markl brought mum along first solo out
1042983412720578561	2018-09-21	[]	2 found highlight stick best travel comp perfect skin
1042861879683678213	2018-09-20	[]	megh markl polit issu fit roy famy
1042804280456044550	2018-09-20	[]	get fem superhero tv show wond wom screenwriter
1042792796229271552	2018-09-20	[]	found new fragr crush tom daxon
1042790302833106945	2018-09-20	[]	surv bikin season ib
1042783920318808066	2018-09-20	[]	everyon talk brad angelin secret fac fac meet
1042771212584316928	2018-09-20	[]	kat middleton feat queen new docu
1042765400298192897	2018-09-20	[]	found new fragr crush tom daxon
1042753501959532545	2018-09-20	[]	orl kie gon admin 23 year
1042749741015027713	2018-09-20	[]	2 found highlight stick best travel comp perfect skin
1042741693059981317	2018-09-20	[]	orl kie gon admin 23 year
1042738028232495104	2018-09-20	[]	blak liv want stop trol suit
1042733628835344385	2018-09-20	[]	blak liv want stop trol suit
1042731419716468739	2018-09-20	[]	emil clark ditch gam thrones rom holiday film
1042726050663460864	2018-09-20	[]	charlot tilbury releas surpr new eyeshadow palet worthy
1042725578611146753	2018-09-20	[]	megh markl polit issu fit roy famy
1042720209390526468	2018-09-20	[]	megh markl said saw wed veil first tim
1042562952589701125	2018-09-19	[]	exclud rit shop ev
1042459956560187392	2018-09-19	[]	spring 2019 trend wear
1042427867018215425	2018-09-19	[]	believ seen lead actress nun
1042387435819335680	2018-09-19	[]	popul dress new york accord pinterest
1042387113906384896	2018-09-19	[]	jk rowl confirm harry pot the herm
1042379050134626304	2018-09-19	[]	popul dress new york accord pinterest
1042368124757127168	2018-09-19	[]	could megh markl biggest roy test yet
1042344149297623040	2018-09-19	[]	megh markl get reunit wed dress sweetest thing see day
1042200078109290496	2018-09-18	[]	entir frow wear necklac london fash week
1042130788928577536	2018-09-18	[]	meet hid wom behind london fash week
1042130779847909376	2018-09-18	[]	entir frow wear necklac london fash week
1042126213404413954	2018-09-18	[]	meet hid wom behind london fash week
1042064976775503873	2018-09-18	[]	90 second fac prep model victor beckham hom
1041995496955543557	2018-09-18	[]	new mary poppin trail anyon talk
1041990255304245248	2018-09-18	[]	print harry megh markl long going print charl birthday party
1041983909729325056	2018-09-18	[]	print harry megh markl long going print charl birthday party
1041981953451282432	2018-09-18	[]	three thing charlot tilbury us giv model j lo skin fash week
1041968406021500928	2018-09-18	[]	pronount chrissy teig nam wrong
1041948020261232640	2018-09-18	[]	lik chang fut car industry wom
1041800986485055488	2018-09-17	[]	megh markl goe incognito want disgu
1041758531643498497	2018-09-17	[]	hannah shergold sometim win sometim learn everyth hap reason
1041749702843215877	2018-09-17	[]	three thing charlot tilbury us giv model j lo skin fash week
1041726932184817665	2018-09-17	[]	hannah shergold sometim win sometim learn everyth hap reason
1041723468608425984	2018-09-17	['#marieclaire30']	'there's diff strong hard' ask four men discuss modern masculin @benjaminzand @mrjamesob @professorgreen @mrnishkumar
1041702800718221313	2018-09-17	[]	princess eugeny tak leaf victor beckham book wed
1041696825521176576	2018-09-17	[]	kim kany third child chicago west could cal cal
1041693546045038593	2018-09-17	[]	kim kany third child chicago west could cal cal
1041688588763578369	2018-09-17	[]	get techn perfect beachy wav wrong
1041660239756419072	2018-09-17	[]	princess eugeny tak leaf victor beckham book wed
1041655679621230593	2018-09-17	[]	nat deod wait list thirteen thousand peopl
1041651500429193217	2018-09-17	[]	nat deod wait list thirteen thousand peopl
1041646882278330369	2018-09-17	[]	print harry megh markl roy cod nam refresh norm
1041643229785944068	2018-09-17	[]	print harry megh markl roy cod nam refresh norm
1041643218826194945	2018-09-17	[]	megh markl goe incognito want disgu
1041639571572834304	2018-09-17	[]	megh markl nev rock red lipstick
1041635005561073665	2018-09-17	[]	megh markl nev rock red lipstick
1041634905958969344	2018-09-17	[]	megh markl sist sent print harry sav birthday mess
1041634339916861440	2018-09-17	[]	megh markl sist sent print harry sav birthday mess
1041626851490193411	2018-09-17	[]	dar witch hunt old mum pra mat dad
1041618536202792960	2018-09-17	[]	arian grand brok sil sint mac mil trag dea
1041613596646625280	2018-09-17	[]	arian grand brok sil sint mac mil trag dea
1041452966249676800	2018-09-16	[]	connect scent attract explain
1041363608389672961	2018-09-16	[]	cours get nerv victor beckham lfw 10th birthday show
1041360882683572228	2018-09-16	[]	cours get nerv victor beckham lfw 10th birthday show
1041347471757205504	2018-09-16	[]	much tim mary clair team memb spend phon
1041219221852696576	2018-09-16	[]	mak bank sel pre cloth depop
1041100530788052992	2018-09-15	[]	wor deeyah khan talk mus famy root resy
1040986731934359552	2018-09-15	[]	london fash week street styl six access invest
1040982841876656129	2018-09-15	[]	london fash week street styl six access invest
1040953145654960129	2018-09-15	[]	instagram london spot fash week
1040879405105598464	2018-09-15	[]	eth beauty trailblaz nee know
1040755914888949760	2018-09-15	[]	london fash week street styl coolest look runway
1040709778412953600	2018-09-14	[]	instagram london spot fash week
1040701524731547648	2018-09-14	[]	london fash week street styl coolest look runway
1040636218650845184	2018-09-14	[]	emm thompson enough lie wom fed rom
1040622596683902986	2018-09-14	[]	london fash week best ev mom revisit
1040618194585546755	2018-09-14	[]	london fash week best ev mom revisit
1040609522941747200	2018-09-14	[]	emm thompson enough lie wom fed rom
1040609517036138496	2018-09-14	[]	princess dian let son bodyguard week pass heartfelt
1040609509733851136	2018-09-14	[]	kensington palac address surpr rumo megh markl
1040607570241773568	2018-09-14	[]	princess dian let son bodyguard week pass heartfelt
1040602129772232704	2018-09-14	[]	kensington palac address surpr rumo megh markl
1040576664978173954	2018-09-14	[]	eth beauty trailblaz nee know
1040571699673088000	2018-09-14	[]	design dup megh markl coat avail 39
1040560155979665408	2018-09-14	[]	ryan reynold off email mak hil jab blak liv marry
1040560071946559488	2018-09-14	[]	design dup megh markl coat avail 39
1040551755140890625	2018-09-14	[]	ryan reynold off email mak hil jab blak liv marry
1040519316637200384	2018-09-14	[]	arian grand broth mad emot tribut mac mil
1040435331915554816	2018-09-14	[]	nyfw bag mak dream spring
1040340240689455104	2018-09-13	[]	everyth nee know iphon xs
1040286262668623872	2018-09-13	[]	mak bank sel pre cloth depop
1040269139196174338	2018-09-13	[]	ug halloween jump thing kind want mak effort
1040263414403264512	2018-09-13	[]	crazy rich as tv show off way
1040255306650079233	2018-09-13	[]	crazy rich as tv show off way
1040247964093108227	2018-09-13	[]	dear dol break friend nev easy
1040246771853615104	2018-09-13	[]	nyfw bag mak dream spring
1040235600551587840	2018-09-13	[]	rihann divers sav fenty fash show world deserv right
1040230145334726658	2018-09-13	[]	rihann divers sav fenty fash show world deserv right
1040227436640784384	2018-09-13	[]	famy memb liv print harry megh markl month
1040213404164665344	2018-09-13	[]	dear dol break friend nev easy
1040213394668707840	2018-09-13	[]	famy memb liv print harry megh markl month
1040211692091858950	2018-09-13	[]	funniest react mark wahlberg ridic superhum dai routin
1040206454299471874	2018-09-13	[]	sweet pict kat middleton sent wel print lou christening
1040205084829708288	2018-09-13	[]	funniest react mark wahlberg ridic superhum dai routin
1040200471699488774	2018-09-13	[]	princess eugeny wed dress cod step cousin print harry
1040196790606163969	2018-09-13	[]	princess eugeny wed dress cod step cousin print harry
1040196783563931648	2018-09-13	[]	sweet pict kat middleton sent wel print lou christening
1040190264487436288	2018-09-13	[]	viol dav say regret rol help
1040188668927823872	2018-09-13	[]	viol dav say regret rol help
1040145145033883662	2018-09-13	[]	fut wom accord mc 30th birthday panel
1040047343343677440	2018-09-13	[]	stop scrolling ap help cut screen tim
1039925524204867584	2018-09-12	[]	photo rees witherspoon ryan phillip childr going vir
1039923110181404672	2018-09-12	[]	photo rees witherspoon ryan phillip childr going vir
1039891114105430019	2018-09-12	[]	wint boot lov season
1039889395967385600	2018-09-12	[]	wint boot lov season
1039882700801363968	2018-09-12	[]	sweet reason everyon talk megh markl thank card
1039873029881249792	2018-09-12	[]	sweet reason everyon talk megh markl thank card
1039848364928421889	2018-09-12	[]	victor secret model shut trol said pretty smart
1039848078252105728	2018-09-12	[]	victor secret model shut trol said pretty smart
1039837881643294720	2018-09-12	[]	blak liv alway wear suit mom
1039832205638426624	2018-09-12	[]	jody whittak recast icon mal act rol wom
1039805081229570050	2018-09-12	[]	connect scent attract explain
1039781215728017408	2018-09-12	[]	new rel thing rememb meet famy
1039780434572275713	2018-09-12	[]	new rel thing rememb meet famy
1039780429291642880	2018-09-12	[]	wor deeyah khan talk mus famy root resy
1039649993144102917	2018-09-11	[]	instagram legit caus shop disord
1039581101654765569	2018-09-11	[]	mary clair team memb meas many hour spend phon av week horr
1039559220222353408	2018-09-11	[]	30th birthday panel trailblaz set fut wom
1039552583378120704	2018-09-11	[]	drunk eleph uk launch dat fin confirm
1039551166055501824	2018-09-11	[]	drunk eleph uk launch dat fin confirm
1039549701459259392	2018-09-11	[]	ask @bbcdoctorwho's first fem doct jody whittak would cast jam bond jason bourn @doctorwhoonline @teamwhittaker
1039521960550715392	2018-09-11	[]	tox wom socy liv nee chang fast
1039518838310633472	2018-09-11	[]	tox wom socy liv nee chang fast
1039518828474978304	2018-09-11	[]	print harry megh markl report want childr right away
1039516037048229888	2018-09-11	[]	print harry megh markl report want childr right away
1039503893301014528	2018-09-11	[]	wish could tel young self crazy rich as horizon
1039485231135260674	2018-09-11	[]	instagram legit caus shop disord
1039476934466449410	2018-09-11	[]	wish could tel young self crazy rich as horizon
1039476925301837825	2018-09-11	[]	expect see year victor secret show
1039472536709419008	2018-09-11	[]	expect see year victor secret show
1039461071298486272	2018-09-11	['#screenbreak']	first thing morn here's ap help reduc screen tim
1039432626493382659	2018-09-11	[]	crazy rich as lesson learn 2018 hottest rom
1039419486992920576	2018-09-11	[]	microblad nee know get tre
1039404939452325888	2018-09-11	[]	'at rat i'll spend year lif scrolling' mary clair team memb meas exact much tim spend phon week
1039364676428148737	2018-09-11	[]	learn six month soc med
1039268288931553280	2018-09-10	['#screenbreak']	av person scrolls height everest phon singl year tim
1039249407517052931	2018-09-10	[]	best trench coat ultim invest piec
1039227109586227200	2018-09-10	['#screenbreak']	pick phon becam 150 habit @tanyagoodin
1039192962985611264	2018-09-10	[]	dr el cannon new evid show amount alcohol saf
1039192289216745472	2018-09-10	[]	'what learn six month soc med brought back' @philbycharlotte
1039175212548464642	2018-09-10	['#screenbreak']	'without phon breathe' @tanyaburr switch
1039171276059934720	2018-09-10	[]	megh markl bodyguard mi5 film suit
1039141371322544128	2018-09-10	[]	microblad nee know get tre
1039133938244112384	2018-09-10	[]	rev megh markl &amp; print harry austral tour schedule
