id	created_at	hashtags	cleaned_text
1093188929698840577	2019-02-06	[]	brit ev head solo valentin weekend
1093169117329281025	2019-02-06	[]	crem eg ic cream improv febru
1093157676777984001	2019-02-06	[]	condom art put hom
1093136834379567104	2019-02-06	[]	soph turn latest rol lou vuitton real quit ep
1093127895864803328	2019-02-06	[]	melan trump latest outfit polit stat wardrob malfunct
1093118399176093696	2019-02-06	[]	heart yorkshir pud ex
1093118391232024576	2019-02-06	[]	skinc ord confus heck correct routin
1093118382302408707	2019-02-06	['#mangogirl']	day lif look lik
1093112418367139845	2019-02-06	[]	le creuset releas new ultr violet collect lov
1093107227832000512	2019-02-06	[]	jen lawr off eng cook maroney
1093049609876844546	2019-02-06	[]	everyth learnt ev rosy makeup art
1092970125030912001	2019-02-06	[]	jet bring celeb bafta
1092888977147916289	2019-02-05	[]	jen lopez alex rodriguez celebr rom mileston
1092856294913003520	2019-02-05	[]	app chris prat celebr eng strip club
1092841432681979905	2019-02-05	[]	megh markl throwback pict everyth
1092825334951669762	2019-02-05	[]	adam levin accid start hug sex deb sup bowl
1092812572036874240	2019-02-05	[]	mean girl return cinema galentin day
1092801438475042816	2019-02-05	[]	heart yorkshir pud ex
1092794048258207745	2019-02-05	[]	skinc ord confus heck correct routin
1092773591928786944	2019-02-05	[]	bradley coop terr perform lady gag osc
1092767936438300672	2019-02-05	[]	roy feud megh kat app start
1092755375735037952	2019-02-05	[]	almost half wom wish spent tim bffs
1092755370320191490	2019-02-05	[]	styl ski wear wheth black pist apr ski
1092755361923194881	2019-02-05	[]	16 hairstyl squ fac flat angl
1092753513275424768	2019-02-05	[]	us meat 2020
1092661172476751872	2019-02-05	[]	kit harington told ros les got end talk three day
1092563871762735105	2019-02-04	[]	nobu marbell glitz glamo miso black cod gold mil
1092489917941334019	2019-02-04	[]	valentin gift styl prob want
1092458143379058692	2019-02-04	[]	almost half wom wish spent tim bffs
1092452824506609669	2019-02-04	[]	harry megh choos popul roy baby nam
1092428884748972032	2019-02-04	[]	14 best hairstyl ov fac accord hair expert
1092408617670754306	2019-02-04	[]	h&amp;m perfect leopard print skirt less 20
1092403196021141505	2019-02-04	[]	brad pit angelin joly going back busy
1092397423987691521	2019-02-04	[]	megh markl report us doul pregn
1092392229887369216	2019-02-04	[]	princess dian almost wear icon dress sweetest reason
1092392222421528578	2019-02-04	[]	megh markl report us doul pregn
1092392216801140736	2019-02-04	[]	queen evacu ev brexit riot
1092390505659416576	2019-02-04	[]	princess dian almost wear icon dress sweetest reason
1092306493242834946	2019-02-04	[]	m&amp;s salt caramel chocol hot cross bun back
1092175515157442560	2019-02-03	[]	tu embrac boob big smal joy thing
1092069093455396864	2019-02-03	[]	bottomless brunch fre top comfort bed sold
1091938763545153536	2019-02-03	[]	instagram airbnb giv sery travel inspo
1091805714450927617	2019-02-02	[]	lat peopl liv long app
1091719700885790720	2019-02-02	[]	ess gadget effortless morn hair dat diary
1091619545285083137	2019-02-02	[]	gossip girl reboot could act hap accord cw
1091517538020851718	2019-02-02	[]	docu megh kat feud hap
1091407712116715520	2019-02-01	[]	turn hum lov dog hum
1091399207829815296	2019-02-01	[]	nat aphrodisiac drink prom happy valentin day
1091394517184303104	2019-02-01	[]	beyont giv away fre concert ticket lif fan go veg
1091377348593807361	2019-02-01	[]	aso real blackl ser return
1091347969419313152	2019-02-01	[]	megh markl rumo giv bir lindo wing
1091346328943280134	2019-02-01	[]	dem lovato latest tattoo absolv heartbreak
1091326601235783681	2019-02-01	[]	kat beckins best react mistak kat middleton
1091310754328915968	2019-02-01	[]	megh markl rumo giv bir lindo wing
1091305468943843328	2019-02-01	[]	georg charlot lou child real lik
1091302784668905473	2019-02-01	[]	georg charlot lou child real lik
1091277060067258368	2019-02-01	[]	everyth nee know buy design eng ring
1091185301563863040	2019-02-01	[]	beauty byt pixy geldof talk veg beauty buffy vampir slay sav oc
1091112676334419968	2019-01-31	[]	photograph exhibit birthmark body posit goal
1091105335635525632	2019-01-31	[]	rachel brosnah pay tribut aunt kat spad new campaign
1091099341018853376	2019-01-31	[]	app 10 peopl would rath giv sex netflix
1091064781652541440	2019-01-31	[]	cre amaz fash shot every tim help nifty littl camer
1091033103366324225	2019-01-31	[]	chris prat react fiant katherin schwarzenegger rat hil
1091031136736690177	2019-01-31	[]	everyth nee know buy design eng ring
1091010966433730560	2019-01-31	[]	arian grand react new tattoo typo hil
1090987255827705856	2019-01-31	[]	megh markl suit co explain roy wed bond
1090985074168721415	2019-01-31	[]	print harry gav sweet speech excit fath
1090981486151520258	2019-01-31	[]	guess uk popul dog bree
1090972944434638851	2019-01-31	[]	two access ste megh markl kat middleton week
1090963776785010689	2019-01-31	[]	duk duchess cambridg mad excit annount
1090948352622120963	2019-01-31	[]	print harry gav sweet speech excit fath
1090934018701488128	2019-01-31	[]	asd launch mocktail tast lik real thing
1090841846803324928	2019-01-31	[]	donald trump photoshop hand pict
1090803374931333120	2019-01-31	[]	wom trump stat un choos wear whit
1090715537208942592	2019-01-30	[]	nee know leak grammy win list
1090676450024411136	2019-01-30	[]	walk dog act mak happy
1090670133864030209	2019-01-30	[]	wom trump stat un choos wear whit
1090622806126034949	2019-01-30	[]	kat middleton giv hil upd print lou
1090610477934235648	2019-01-30	[]	kat middleton giv hil upd print lou
1090604236604391424	2019-01-30	[]	gwyne paltrow get sued $3 mil ski incid
1090594564895854592	2019-01-30	[]	aso launch afford homew collect want
1090588998567903232	2019-01-30	[]	friend fan spot someth strange rachel dat joshu
1090577387601879040	2019-01-30	[]	m&amp;s salt caramel chocol hot cross bun back
1090563483115184128	2019-01-30	[]	sag award 2019 ful win list
1090457914194780160	2019-01-30	[]	going new bag 2019
1090440229398360065	2019-01-30	[]	best ey cream comb dark circ fin lin wrinkl mak look awak
1090337413484945410	2019-01-29	[]	twit account liv tweet sag award provid best triv
1090299624810823680	2019-01-29	[]	veg fash design chang way see wardrob
1090293741926182913	2019-01-29	[]	valentin day beauty gift guid
1090287689063170050	2019-01-29	[]	harry megh spend valentin day togeth
1090282390340153344	2019-01-29	[]	asd sel pink valentin day gin
1090277231065223168	2019-01-29	[]	emy blunt recal predict would divorc john krasinsk
1090269066424537089	2019-01-29	[]	m&amp;s sel new limit edit percy pig nee
1090263141747875841	2019-01-29	[]	emy blunt op hardest scen film
1090257432041926657	2019-01-29	[]	megh markl app ban clos car door
1090224924164325376	2019-01-29	[]	kensington palac concern onlin abus megh markl kat middleton
1090214368682303494	2019-01-29	[]	tu embrac boob big smal joy thing
1090214361883275264	2019-01-29	[]	samanth markl tel book megh act sery
1090190195906002945	2019-01-29	[]	emy blunt sag award dress get ridic cool
1090093505085693953	2019-01-29	[]	sag award 2019 award best beauty look go
1090077335359873024	2019-01-29	[]	lucky get hand hol willoughby new m&amp;s denim rang
1089995767614525440	2019-01-28	[]	bradley coop took sag dat instead wif irin shayk
1089931412944404482	2019-01-28	[]	print georg new nicknam baffl internet
1089923931115524096	2019-01-28	[]	m&amp;s launch gin ton sauc tim pancak day
1089916998501441542	2019-01-28	[]	megh markl mak veg paint thing
1089911581054566405	2019-01-28	[]	30 thing brit res pay
1089883386418814976	2019-01-28	[]	kat beckins break new rush hospit emot post
1089871170575482880	2019-01-28	[]	m&amp;s 20 valentin day meal deal
1089856571578957824	2019-01-28	[]	megh markl op birac id must post
1089849463001305088	2019-01-28	[]	lucky get hand hol willoughby new m&amp;s denim rang
1089825369878921216	2019-01-28	[]	sandr oh thank someon pretty surpr sag acceiv speech
1089789893931397120	2019-01-28	[]	emy blunt john krasinsk prov cutest coupl ev sag award
1089759767982010368	2019-01-28	[]	sag award 2019 ful win list
1089759760570736640	2019-01-28	[]	lady gag wor dress sag debut runway six day ago
1089729041308020737	2019-01-28	[]	lady gag wor dress sag debut runway six day ago
1089714566391422976	2019-01-28	[]	sag award 2019 award best beauty look go
1089670281864667136	2019-01-27	[]	app princess dian favourit perfum stil buy
1089565297051402241	2019-01-27	[]	vaness hudg explain soul connect j import strong wom lif
1089469605364535298	2019-01-27	[]	fam fortun sid hustl fiv celebr sid busy vent boss
1089351450818433025	2019-01-27	[]	best prim rady blur uv protect keep mak plac
1089250344373231617	2019-01-26	[]	three typ phon not mak us feel nerv
1089176966954135552	2019-01-26	[]	suit sarah rafferty keep marc cain bag tim
1089123831615184897	2019-01-26	[]	ferragamo new print every logo lov dream
1089123823289430017	2019-01-26	[]	latest gam thrones trail act mad trick us
1089123815303479301	2019-01-26	[]	suit sarah rafferty keep marc cain bag tim
1089117326371360770	2019-01-26	[]	pen badgley rev think peopl find charact attract
1088999202485690373	2019-01-26	['#mood']	design put fav mem cout dress tot
1088912221361582080	2019-01-25	[]	top valentin pick amaz wom lif
1088850004226310144	2019-01-25	[]	best veg handb nee rad
1088834063564185601	2019-01-25	[]	ferragamo new print every logo lov dream
1088812207352307712	2019-01-25	[]	an hathaway confirm princess diary 3 work
1088805065400479746	2019-01-25	[]	soph turn joe jona tak rel next level
1088787970554036226	2019-01-25	[]	kyly jen nam mak tayl swift song baffl internet
1088780860223049728	2019-01-25	[]	roy nanny strict rul georg charlot lou
1088775722775298048	2019-01-25	[]	latest gam thrones trail act mad trick us
1088771076652437504	2019-01-25	[]	vaness hudg explain soul connect j import strong wom lif
1088760437582094336	2019-01-25	[]	donald trump photoshop hand pict
1088760429520683009	2019-01-25	[]	fin confirm megh markl nev return act
1088760423271129089	2019-01-25	[]	soph turn rev gam thrones end
1088757893162242049	2019-01-25	[]	megh markl print harry might hir nanny sweet reason
1088745644674744325	2019-01-25	[]	selen gomez releas new song anxy
1088710959638691841	2019-01-25	[]	common word said sleep talk
1088625007427796992	2019-01-25	[]	going abl tel fav celeb influ paid post
1088526845694365696	2019-01-24	[]	city nee visit year everyon els
1088496147470143489	2019-01-24	[]	eth fash brand feel good wear
1088480121198202881	2019-01-24	[]	get marry kensington palac
1088459813535678467	2019-01-24	[]	best resta london celebr chines new year
1088437781771313152	2019-01-24	[]	hadid famy took body sham trol
1088432199559536640	2019-01-24	[]	lady gag address bradley coop osc snub
1088427012518236160	2019-01-24	[]	soph turn rev gam thrones end
1088418783847477248	2019-01-24	[]	fin confirm megh markl nev return act
1088402591070019585	2019-01-24	[]	megh markl avocado toast blam drought
1088397313985241090	2019-01-24	[]	win pair vip ticket see inst famy
1088397297707212800	2019-01-24	[]	easy trick help rememb everyth
1088397284562235392	2019-01-24	[]	app princess dian favourit perfum stil buy
1088349097952755712	2019-01-24	[]	wom act bet driv accord new study
1088243096721285120	2019-01-24	[]	ivank trump fash label receiv lot backlash week
1088164787010310144	2019-01-23	[]	apply next sery first dat
1088112025635643392	2019-01-23	[]	easy trick help rememb everyth
1088075411261665280	2019-01-23	[]	french connect new brid collect good nev want spend fortun wed dress
1088048587165048832	2019-01-23	[]	lady gag recal emot mom found osc nomin
1088037093337632768	2019-01-23	[]	10 typ friend every girl lif
1088034398442668033	2019-01-23	[]	arian grand form apolog instagram act
1088034393346629632	2019-01-23	[]	roy alway wear seatbelt
1088034381824806914	2019-01-23	[]	best lip stain colo budg ev eat burg
1087896131818917890	2019-01-23	[]	arian grand form apolog instagram act
1087852470087360513	2019-01-22	[]	brad pit charl theron hollywood new gold coupl
1087806669592150017	2019-01-22	[]	roy alway wear seatbelt
1087797739172388864	2019-01-22	[]	2019 osc nomin fin annount
1087758276417253376	2019-01-22	[]	krispy krem launch valentin day flavo
1087743850158936064	2019-01-22	[]	waitros avocado east eg mak comeback
1087722280875110400	2019-01-22	[]	tom felton real hap emm watson
1087711074093285376	2019-01-22	[]	best lip stain colo budg ev eat burg
1087681007812268033	2019-01-22	[]	new topshop jean styl ev bet jon
1087671004313219072	2019-01-22	[]	app unhealthiest city uk
1087670996654411782	2019-01-22	[]	megh markl shut secret instagram account last mon
1087670989192802304	2019-01-22	[]	52 sery cool plac brunch london
1087657606653591552	2019-01-22	[]	new year new getaway
1087622738108391425	2019-01-22	[]	know ph bal skinc key healthy look skin
1087502061745389568	2019-01-22	[]	carry bradshaw back outfit die
1087448854709108737	2019-01-21	[]	deciem found brandon truax died ag 40
1087447665644879873	2019-01-21	[]	deciem found brandon truax died ag 40
1087421707802030081	2019-01-21	[]	styl sportswear guarantee get gym
1087379491918438400	2019-01-21	[]	gwyne paltrow mad emot stat chris martin
1087369867479695360	2019-01-21	[]	megh markl millen nicknam ev
1087357972844634112	2019-01-21	[]	app unhealthiest city uk
1087338182918721538	2019-01-21	[]	whit chocol twix thing already uk
1087333751678533632	2019-01-21	[]	lov magazin want writ feat team vac intern start week friday 1st feb inform email cv cov let look forward hear
1087323611348779009	2019-01-21	[]	megh markl shut secret instagram account last mon
1087309352975904768	2019-01-21	[]	sweet detail miss priyank chopr wed dress
1087307976275255296	2019-01-21	[]	kendal jen mad emot stat debilit acn
1087307971187462144	2019-01-21	[]	mak fre selfy jen lopez going vir
1087307966020083713	2019-01-21	[]	internet happy melan trump weekend plan
1087296746152181760	2019-01-21	[]	kendal jen mad emot stat debilit acn
1087285549755523072	2019-01-21	[]	internet happy melan trump weekend plan
1087230372830691328	2019-01-21	[]	ultim vlog ev com london first tim
1087056271415623680	2019-01-20	[]	man crit cho award new fij wat girl
1086921041010720768	2019-01-20	[]	four team mary clair memb spend janu
1086774054143643650	2019-01-19	[]	offend gillet tox masculin advert part problem
1086638285210959872	2019-01-19	[]	29 red carpet dress real eat drink sit
1086536532909944833	2019-01-19	[]	could cook chip greas hair
1086536525356052480	2019-01-19	[]	motorol razr mak comeback wait
1086536517516836864	2019-01-19	[]	print philip left shak car crash yesterday
1086520717972262913	2019-01-19	[]	kit harington rev prop kept gam thrones
1086410238125924353	2019-01-18	[]	design bag trend invest year accord buy harvey nichol
1086282501243486208	2019-01-18	[]	print harry megh markl gon millen nursery dec
1086276657747382273	2019-01-18	[]	ben &amp; jerry launch valentin day flavo sound delicy
1086270710727827456	2019-01-18	[]	roy wed tiar expend
1086258284083011584	2019-01-18	[]	could cook chip greas hair
1086246521052581890	2019-01-18	[]	peopl worry melan trump reason
1086235327331815425	2019-01-18	[]	motorol razr mak comeback wait
1086204414862548992	2019-01-18	[]	print philip left shak car crash yesterday
1086173383266492417	2019-01-18	[]	gwyne paltrow glad brok brad pit 1997
1086173376035483648	2019-01-18	[]	best beauty gadget real work
1086173369332985856	2019-01-18	[]	best cleans mak act look forward wash fac
1086081807878103040	2019-01-18	[]	remov fak tan prob import lif lesson
1085986941609353216	2019-01-17	[]	upskirt mad illeg year ago
1085938875284054016	2019-01-17	['#riverd', '#netflix']	riverd fan reel main charact seem kil real dead
1085938346558476293	2019-01-17	[]	soph turn allow wash hair gam thrones
1085916917796429824	2019-01-17	[]	wait donald trump spent much mak inaug
1085911648680980480	2019-01-17	[]	dian bodyguard issu sery warn megh markl
1085886308814336000	2019-01-17	[]	story behind lady gag emot fin perform star born heartbreak
1085873103052435456	2019-01-17	[]	gwyne paltrow glad brok brad pit 1997
1085826984662441984	2019-01-17	[]	megh markl support big caus bracelet
1085810363004637184	2019-01-17	[]	popul pet nam uk
1085810353412308992	2019-01-17	[]	megh markl support big caus bracelet
1085810344776220672	2019-01-17	[]	wait many krispy krem del 10 down street yesterday
1085795618251886592	2019-01-17	[]	said would protect teen moth mum
1085753672288686080	2019-01-17	[]	said would protect teen moth mum
1085713874102480896	2019-01-17	[]	buy eng ring poundland
1085664206194647040	2019-01-16	[]	secret dat revolv london dat scen
1085611940385300480	2019-01-16	[]	popul pet nam uk
1085598822741487617	2019-01-16	[]	day lif 19 moth fiv
1085578062912282625	2019-01-16	[]	us thick hair on day went complet bald
1085563129898156037	2019-01-16	[]	day lif 19 moth fiv
1085552583131959297	2019-01-16	['#gillet', '#gilletteadvert', '#toxicmasculin']	'if offend gillette's advert tox masculin part problem' say juny new edit jenny proudfoot
1085550487728984064	2019-01-16	[]	megh markl &amp; print eugeny inspir biggest wed trend 2019
1085533082353102848	2019-01-16	[]	unc bring kind approach rent sold
1085523657374527488	2019-01-16	[]	wait many krispy krem del 10 down street yesterday
1085515466393747456	2019-01-16	[]	3 interest sho ev drop yet
1085507740057944064	2019-01-16	[]	megh markl talk print harry becom dad cut
1085502287919878144	2019-01-16	[]	rachel mcadam say regin georg haunt
1085496897123553281	2019-01-16	[]	donald trump mad sex jok wif expens
1085487889339895808	2019-01-16	[]	ann far off officy chris prat second wed
1085447464017059840	2019-01-16	[]	margot robby ask childr
1085447454990860293	2019-01-16	[]	kit harrington sick gam thrones tim film fin
1085447448280018944	2019-01-16	[]	doct warn wom us lush valentin day bathbomb sex toy
1085441785755848705	2019-01-16	[]	extrem fit challeng
1085359778182909952	2019-01-16	[]	kit harrington sick gam thrones tim film fin
1085261652663193600	2019-01-15	[]	beauty byt kar elson mad jo malon london ev boujy starstruck print georg const battl frizzy hair
1085228381250162689	2019-01-15	[]	extrem fit challeng
1085210767966826506	2019-01-15	[]	har hotel perfect valentin day getaway
1085202970743066626	2019-01-15	[]	alway leav sho fly
1085194047054999552	2019-01-15	[]	margot robby ask childr
1085187876952801283	2019-01-15	[]	selen gomez brok soc med sil person annount
1085182559573757952	2019-01-15	[]	10 wom ready lost virgin
1085176700915339265	2019-01-15	[]	want fiv getaway without pric tag head destin
1085168255969492997	2019-01-15	[]	ann far react chris prat eng annount ex goal
1085138014156832769	2019-01-15	[]	doct warn wom us lush valentin day bathbomb sex toy
1085084453800558593	2019-01-15	[]	forget flat whit porridg lat thing
1085084448645734401	2019-01-15	[]	everyon wor whit black crit cho award
1085084441448312833	2019-01-15	[]	megh markl bodyguard unexpect quit
1085051676996878336	2019-01-15	[]	stop everyth beauty brand dying get hand com uk less two week
1084958166960562179	2019-01-14	[]	forget flat whit porridg lat thing
1084870422976434177	2019-01-14	[]	aud tak entertain next level
1084815945590296577	2019-01-14	[]	lady gag glen clos shar best actress gong sist max
1084785044126945281	2019-01-14	[]	kat middleton secret second birthday party
1084779175981010944	2019-01-14	[]	megh markl bodyguard unexpect quit
1084769832975896578	2019-01-14	[]	kat middleton broth spok battl depress
1084759734052446208	2019-01-14	[]	chris prat annount eng katherin schwarzenegger
1084754434444414976	2019-01-14	[]	sandr oh crazy rich as cast fangirl wholesom af
1084721436621565953	2019-01-14	[]	clair foy brought femin crit cho award
1084721429340291072	2019-01-14	[]	man crit cho award new fij wat girl
1084721420104491008	2019-01-14	[]	big crit cho award last night
1084693852617879554	2019-01-14	[]	eurost sal mean get ticket par 29
1084575687095275520	2019-01-13	[]	lush op first pack stor uk
1084440408896299009	2019-01-13	[]	big gold glob last night
1084330435574935557	2019-01-13	[]	j latest film perfect antidot wint blu get ticket fre
1084201319919964160	2019-01-12	[]	hair straighteners expiry dat find nee new pair
1084058420158885890	2019-01-12	[]	pimpl pop set satisfy darkest skinc desir buy amazon
1083938259707854849	2019-01-12	[]	actress act osc
1083823237400854529	2019-01-11	[]	megh markl shar top fash tip unemploy wom
1083801502085451777	2019-01-11	[]	cur hair produc tak text next level
1083777092108673026	2019-01-11	[]	look get away hit hotspot everyon els
1083768930538274816	2019-01-11	[]	gam thrones season spoil season 1
1083754586266050560	2019-01-11	[]	20 icon outfit prov 70s real best fash decad
1083741944705175553	2019-01-11	[]	nee new job print charl camill hir
1083735826197032960	2019-01-11	[]	hair clip definit spark joy season
1083712548795383808	2019-01-11	[]	lady gag pul r kel song big apolog
1083712542625587200	2019-01-11	[]	unansw quest creepy thriller sery
1083711949316255745	2019-01-11	[]	on symptom nev ign sex
1083705849388904448	2019-01-11	[]	happy fij wat girl
1083693255668256768	2019-01-11	[]	megh markl tri don handb go plan
1083685069502459905	2019-01-11	[]	lady gag pul r kel song big apolog
1083672890950799360	2019-01-11	[]	unansw quest creepy thriller sery
1083635303812947968	2019-01-11	[]	best wint beauty produc skin sav skin body hair
1083537176699289601	2019-01-11	[]	bet nev not chandl friend
1083440052703764480	2019-01-10	[]	get pres giv high lov
1083436336520916992	2019-01-10	[]	soph turn took pier morg internet applaud
1083400983831547904	2019-01-10	[]	act hap candac netflix sery
1083389626197397510	2019-01-10	[]	rihann new lingery collect look sexy comfort
1083375840077991936	2019-01-10	[]	soph turn took pier morg internet applaud
1083352863391264771	2019-01-10	[]	weird gift queen elizabe receiv marry print philip
1083349276934078465	2019-01-10	[]	eurost sal mean get ticket par 29
1083349268033728512	2019-01-10	[]	j latest film perfect antidot wint blu get ticket fre
1083339222973640704	2019-01-10	[]	kat middleton pinterest birthday celebr giv us sery fomo
1083333512667779074	2019-01-10	[]	kat middleton app alway pack sho holiday
1083215892798939138	2019-01-10	[]	car adv jen lopez chang day
1083082333517950976	2019-01-09	[]	app on quest ask first dat
1083071182243475457	2019-01-09	[]	aw18 coat trend back next season
1083068747814981633	2019-01-09	[]	mystery around megh markl ear fin solv
1083054431850164224	2019-01-09	[]	year baft nomin fin annount
1083048622898511873	2019-01-09	[]	air hair act wors blow dry
1083021007852589056	2019-01-09	[]	gwyne paltrow explain brad pit look lik girlfriend
1082998689084424192	2019-01-09	[]	print william good track record giv kat middleton pres
1082992086302015490	2019-01-09	[]	megh markl broth get marry roy invit
1082986333507702784	2019-01-09	[]	awkward sex interview sof vergar gordon ramsay going vir
1082986328852025345	2019-01-09	[]	real lik work megh markl
1082974377069678593	2019-01-09	[]	real lik work megh markl
1082969109300682753	2019-01-09	[]	everyon talk bod coat
1082963872364023808	2019-01-09	[]	awkward sex interview sof vergar gordon ramsay going vir
1082958609556955136	2019-01-09	[]	self stop funct self mad feel control
1082848152661778432	2019-01-09	[]	secret get cheap flight deal year
1082782949278474242	2019-01-08	[]	fre period nee support new leg campaign
1082731982788927494	2019-01-08	[]	peopl real dressy pjs
1082724491221000199	2019-01-08	[]	pen cruz releas pow mess wom without childr
1082708033031917568	2019-01-08	[]	mary kondo netflix star fold tidy hack chang lif
1082683613517361153	2019-01-08	[]	everyth nee know sleep paralys
1082674725434916867	2019-01-08	[]	keir knightley costum colet incred relev today
1082656271063490560	2019-01-08	[]	megh markl disgu publ
1082651133649264641	2019-01-08	[]	dog act real good heal
1082633017817001991	2019-01-08	[]	app brad pit happy angelin joly babysit decid
1082626894028328960	2019-01-08	[]	queen excit new job megh markl
1082622721282891776	2019-01-08	[]	jameel jamil wear jean ballgown us
1082622713863188480	2019-01-08	[]	thoma markl writ book megh child internet cry
1082621821973864450	2019-01-08	[]	smuggl 40 ham sandwich gold glob
1082615857627439105	2019-01-08	[]	jameel jamil wear jean ballgown us
1082599538014253057	2019-01-08	[]	thoma markl writ book megh child internet cry
1082594336129335297	2019-01-08	[]	altern bird box end dark
1082507183978397696	2019-01-08	[]	hair suppl giv lock boost
1082421608873107457	2019-01-07	[]	job get swip right dat sit
1082356778388635648	2019-01-07	[]	gold glob beauty award goe
1082344638961176577	2019-01-07	[]	hid mean behind lady gag ep gold glob dress
1082328172144795650	2019-01-07	[]	best curl wand ton beauty wav curl
1082322062826487813	2019-01-07	[]	lady gag mad fun infam 100 peopl lin
1082314279523618816	2019-01-07	[]	hid mean behind lady gag ep gold glob dress
1082302330253529088	2019-01-07	[]	polit access worn item gold glob last night
1082296599303335937	2019-01-07	[]	everyon liv fij wat girl gold glob
1082287927495966721	2019-01-07	[]	cbd oil everyth nee know 2019 hottest ingredy
1082271222170300416	2019-01-07	[]	lush valentin day bath bomb nee
1082265695965118470	2019-01-07	[]	actress paid $2m wear dior dress 12 meg expend dress
1082259914360324103	2019-01-07	[]	john krasinsk che emy blunt absolv goal
1082252299819462656	2019-01-07	[]	sienn mil priyank chopr soph turn obsess mango coat
1082213520463314944	2019-01-07	[]	everyth know jameel jamil gold glob nam mix
1082178768515543040	2019-01-07	[]	emm ston publ apolog gold glob sandr oh com
1082166466424664067	2019-01-07	[]	big gold glob last night
1082094602771931136	2019-01-07	['#goldenglob', '#gag']	oh wow @ladygaga own @goldenglobes red carpet @maisonvalentino
1082075517845676032	2019-01-07	[]	gold glob red carpet 2019 see styl pict
