id	created_at	hashtags	cleaned_text
1067784968531787776	2018-11-28	[]	kim cattral may turn satc film due disturb storylin mirand son
1067779432092438529	2018-11-28	[]	david beckham latest instagram post real deserv much controversy
1067769381319520258	2018-11-28	[]	melan trump red glov baffl internet
1067764082558812161	2018-11-28	[]	two celebr fash influ megh markl
1067752571031433219	2018-11-28	[]	zar party sho act wait list
1067747363161296896	2018-11-28	[]	ev jen lopez suff impost syndrom
1067694738344681472	2018-11-28	[]	bod ep black friday sal includ coat cashm
1067581663792762882	2018-11-28	[]	black friday train deal streetstyle gam
1067557968860733442	2018-11-27	[]	app megh markl opt tradit matern leav
1067557962594476032	2018-11-27	[]	app play monopo wrong whol tim
1067557955736727553	2018-11-27	[]	queen elizabe refus us vulg word
1067468085362343936	2018-11-27	[]	internet trol trump ar ral christmas fireplac
1067439443525730305	2018-11-27	[]	app play monopo wrong whol tim
1067431963491876865	2018-11-27	[]	googl digit gar upskil london
1067424980709883904	2018-11-27	[]	everyon talk print harry megh markl new hom
1067419624755613698	2018-11-27	[]	michel obam giv necklac friend
1067408418732998656	2018-11-27	[]	found perfect coat primark
1067402768313393152	2018-11-27	[]	jameel jamil celeb promot diet tea
1067396986654085120	2018-11-27	[]	app megh markl opt tradit matern leav
1067374460293038082	2018-11-27	[]	queen elizabe refus us vulg word
1067338976023973888	2018-11-27	[]	black friday savvy shop guid best black friday deal
1067238081051443201	2018-11-27	[]	black friday design deal good tru honest
1067133864252981249	2018-11-26	[]	mango coat french edit gig hadid covet
1067101435928690688	2018-11-26	[]	gwyne paltrow chris martin dakot johnson redefin break goal
1067096042942939136	2018-11-26	[]	decid beach holiday safar tanzan
1067065283641257984	2018-11-26	[]	fergy wor harry pot hat princess eugeny wed
1067053489807855617	2018-11-26	[]	kit harington fin respond rumo
1067026102831513605	2018-11-26	[]	queen refus abd app princess charlot
1067002627978870784	2018-11-26	[]	black friday dress tick autumn trend
1066892526425174017	2018-11-26	[]	topshop black friday deal good abl resist
1066783793997062149	2018-11-25	[]	morph produc favourit beauty influ us get black friday tre
1066738371224047616	2018-11-25	['#blackfriday2018']	think pop quest soon check amaz eng ring deal
1066668863427891200	2018-11-25	['#blackfriday']	miss chant win 30 spend favourit produc @fabledbeauty weekend t&amp;cs apply
1066661741273251840	2018-11-25	[]	on megh markl favourit design off 30% black friday
1066560448609337344	2018-11-25	[]	best design handb black friday sal ruin credit
1066456766987337728	2018-11-24	[]	black friday eng ring sal want miss
1066373894477672449	2018-11-24	['#blackfriday']	someon say fre pandor bracelet
1066357500147044354	2018-11-24	[]	100 blog coat sel fast
1066298678447616002	2018-11-24	['#blackfriday']	miss chant win 30 spend favourit produc @fabledbeauty weekend t&amp;cs apply
1066278764408131584	2018-11-24	['#blackfriday2018']	beauty influencers' favourit produc gon mass sal
1066267076346748928	2018-11-24	[]	best way beat cold vir feel grim
1066166674666213376	2018-11-24	[]	oil pul act work
1066085526552354821	2018-11-23	[]	best fit gift gear gadget gym lif
1066070393625157633	2018-11-23	['#blackfriday2018']	best beauty deal includ mac benefit cosmet on plac
1066052912131055616	2018-11-23	[]	print charl drop hug roy baby nam hint
1066026352753676290	2018-11-23	['#evoqu', '#helloevoqu']	new rang rov prov luxury sustain
1066010749154353152	2018-11-23	['#blackfriday2018']	obsess design watch sal
1066009541245059073	2018-11-23	[]	ryan reynold admit want remarry scarlet johansson
1065999200805167104	2018-11-23	['#blackfriday']	miss chant win 30 spend favourit produc @fabledbeauty weekend t&amp;cs apply
1065996978474102784	2018-11-23	['#blackfriday2018']	we'v found amaz @topshop leopard print coat sal
1065991263411945477	2018-11-23	['#blackfriday2018']	quick quick 50% favourit brand inc swarovsk right way
1065985984687423489	2018-11-23	['#blackfriday2018']	here's get kat middleton's high look sal
1065965660625387522	2018-11-23	[]	princess eugeny shar sweetest unseen wed photo
1065959304744890368	2018-11-23	[]	kat middleton brok 350 roy tradit wed day
1065942115564351488	2018-11-23	[]	lush body lot prom get sleep sold
1065934458791084032	2018-11-23	[]	everyon talk princess beat new boyfriend
1065926886692409344	2018-11-23	[]	app print georg got dread christmas habit print william
1065920413497217025	2018-11-23	[]	new rang rov evoqu prov luxury sustain
1065888716613459968	2018-11-23	[]	person chocol resist christmas
1065831508823416832	2018-11-23	[]	el pompeo cal divers import
1065767097505128449	2018-11-23	[]	selfridg knock 20% design brand christmas mirac
1065712595301220353	2018-11-22	[]	mourn dog way mourn hum
1065674485121122305	2018-11-22	[]	dem lovato unfollow fam friend instagram
1065668185146433536	2018-11-22	[]	party makeup two grown glow look christmas party
1065662398105706496	2018-11-22	[]	black friday watch deal nee buy lat
1065662392351154176	2018-11-22	[]	30 aso leopard print skirt sold three tim
1065662384147034112	2018-11-22	[]	dem lovato unfollow fam friend instagram
1065646712243568640	2018-11-22	[]	believ much money j k rowl earn minut
1065627971392815105	2018-11-22	[]	30 aso leopard print skirt sold three tim
1065592674286227456	2018-11-22	[]	megh markl kat middleton synch match coat
1065583184946049024	2018-11-22	[]	enjoy 20% @fabledbeauty stor fre goody bag wor 85 fabl mary clair black friday shop ev tonight buy ticket
1065582879659491329	2018-11-22	[]	emm watson sent sweetest mess harry pot co
1065576529189658624	2018-11-22	[]	kat middleton gav print harry hil christmas gift
1065561555427885056	2018-11-22	[]	princess switch cast confirm harry megh inspir
1065518265567535104	2018-11-22	[]	eczem suff guid red itchy flaky skin
1065515279487250432	2018-11-22	[]	miss fabl mary clair black friday shop ev tonight get ticket enjoy 20% stor fre goody bag wor 85 glass bubbl @fabledbeauty
1065442119882588160	2018-11-22	[]	zar serv perfect party bag believ 40
1065396749722882049	2018-11-22	[]	megh markl kat middleton app play key rol roy sunday roast
1065349312480186368	2018-11-21	[]	enjoy 20% @fabledbeauty stor fre goody bag wor 85 fabl mary clair black friday shop ev thursday buy ticket
1065342415714873345	2018-11-21	[]	perfect pet gift fuzzy childr christmas
1065317289866788869	2018-11-21	[]	beany baby mak sery rich
1065306493199757314	2018-11-21	[]	stop unfair judg princess switch pleas
1065299085626769408	2018-11-21	[]	app queen surpr detail megh wed dress
1065299077674352641	2018-11-21	[]	wom brow pencil budg hit act car
1065299068748877824	2018-11-21	[]	chrissy teig contract going vir surpr reason
1065284248234573825	2018-11-21	[]	knew megh markl friend actress
1065244739220447233	2018-11-21	[]	chrissy teig contract going vir surpr reason
1065218234293649408	2018-11-21	[]	gwyne paltrow shar secret photo valentino wed dress
1065212179723493376	2018-11-21	[]	app queen surpr detail megh wed dress
1065206891926757377	2018-11-21	[]	wom brow pencil budg hit act car
1065160446628585472	2018-11-21	[]	get 20% stor fre goody bag wor 85 @fabledbeauty black friday shop ev tomorrow night forget buy ticket
1065139177619169280	2018-11-21	[]	susy lau tel us everyth nee know volez voguez voyagez new lou vuitton exhibit shangha
1065063195667247104	2018-11-21	[]	party hairstyl nail 2018 christmas party beauty look
1064994325136924677	2018-11-20	[]	megh markl latest ev dress might fav yet
1064979231770329088	2018-11-20	[]	miss fabl mary clair black friday shop ev thursday get ticket enjoy 20% stor on night @fabledbeauty
1064960923973181440	2018-11-20	[]	act surv without new iphon hack
1064935682047537152	2018-11-20	[]	emm thompson react peopl diss train us
1064935676401999873	2018-11-20	[]	samanth markl chos megh markl due dat releas book
1064935670668382208	2018-11-20	[]	ivank trump fir break maj polit rul
1064933694954184704	2018-11-20	[]	shock plot twist third satc film might real reason nev hap
1064922756800749570	2018-11-20	[]	emm thompson react peopl diss train us
1064907480294137856	2018-11-20	[]	print harry megh markl receiv sad new last night
1064873721331138560	2018-11-20	[]	megh markl dor ragland extrem weird roy christmas tradit
1064854037089136650	2018-11-20	[]	samanth markl chos megh markl due dat releas book
1064844544192274434	2018-11-20	[]	ivank trump fir break maj polit rul
1064827956369993728	2018-11-20	[]	meet inkey list ak new afford skinc obsess
1064790591370928128	2018-11-20	[]	enjoy 20% @fabledbeauty stor fre goody bag wor 85 fabl mary clair black friday shop ev thursday buy ticket
1064720416445480960	2018-11-20	[]	morrison sel magn prosecco 10
1064628068847890439	2018-11-19	[]	edit eth beauty gift top christmas wishl
1064616893892444161	2018-11-19	[]	miss fabl mary clair black friday shop ev thursday get ticket enjoy 20% stor on night @fabledbeauty
1064552186426736640	2018-11-19	[]	jessy jenn dew don comparison
1064552169347543042	2018-11-19	[]	jack reach auth lee child nev plot novel
1064552155535699968	2018-11-19	[]	waitros christmas advert mock john lew brut
1064548607909597186	2018-11-19	[]	keep littl on sweet christmas gift guid kid
1064536417030811648	2018-11-19	[]	print harry megh markl mov kensington palac
1064521301019320322	2018-11-19	[]	ike sel real christmas tre fiv want on
1064513317174210560	2018-11-19	[]	jessy jenn dew don comparison
1064505909567766528	2018-11-19	[]	hol willoughby wor m&amp;s sequin dress peopl going mad
1064494327265673217	2018-11-19	[]	jack reach auth lee child nev plot novel
1064474446147330049	2018-11-19	[]	waitros christmas advert mock john lew brut
1064420556051791872	2018-11-19	[]	get 20% stor fre goody bag wor 85 @fabledbeauty black friday shop ev thursday buy ticket
1064247011308916736	2018-11-18	[]	miss fabl mary clair black friday shop ev thursday get ticket enjoy 20% stor on night @fabledbeauty
1064229845608079360	2018-11-18	[]	luxury fest guid 48 hour jersey
1064178755701272576	2018-11-18	[]	altern adv calend lov year
1064080888324083712	2018-11-18	[]	get 20% stor fre goody bag wor 85 @fabledbeauty black friday shop ev thursday buy ticket
1063988808541224960	2018-11-18	[]	shop second hand fash lik pro
1063884646272954370	2018-11-17	[]	enjoy 20% @fabledbeauty stor fre goody bag wor 85 fabl mary clair black friday shop ev buy ticket
1063851998372601857	2018-11-17	[]	cut hair complet guid get right
1063763716687093760	2018-11-17	[]	beauty byt michael bubl king xma sharp suit fragr
1063763711536447493	2018-11-17	[]	eddy redmayn said print william rough tim play rugby back colleg
1063763705379188736	2018-11-17	[]	much memb roy famy wor
1063759748728803330	2018-11-17	[]	beauty byt michael bubl king xma sharp suit fragr
1063718543387181056	2018-11-17	[]	miss fabl mary clair black friday shop ev next thursday get ticket enjoy 20% stor on night @fabledbeauty
1063675119585902592	2018-11-17	[]	michel obam releas merch lin &amp; predict ep
1063574471674642432	2018-11-16	[]	much memb roy famy wor
1063529669008478213	2018-11-16	[]	enjoy 20% @fabledbeauty stor fre goody bag wor 85 fabl mary clair black friday shop ev buy ticket
1063524276853239809	2018-11-16	[]	perfect party dress hit dant flo
1063486765762269184	2018-11-16	[]	hypnotherapy real help drink mod
1063481348193746945	2018-11-16	[]	jud law eddy redmayn whol fantast beast cast sort hogwart hous
1063475122848313344	2018-11-16	[]	study say read harry pot prob bet person
1063467017330667525	2018-11-16	[]	kat middleton wor anoth stun dress on favourit design
1063454116435906566	2018-11-16	[]	everyon talk photo kat middleton print lou
1063436017640898562	2018-11-16	[]	megh markl wor ultim littl black dress 50 m&amp;s
1063424224642109441	2018-11-16	[]	eddy redmayn said print william rough tim play rugby back colleg
1063402427305680898	2018-11-16	[]	on beauty produc megh markl us hid tir ey
1063400192479657984	2018-11-16	[]	unseen photo baby georg charl cutest
1063400186016198657	2018-11-16	[]	tom hiddleston upload video cry twit
1063400179775168517	2018-11-16	[]	kat middleton megh markl back maj jewellery trend
1063397285697122309	2018-11-16	[]	spot brexit tweet mak laugh tear
1063385739646382081	2018-11-16	[]	anoth admit hospit hyperemes
1063373948920963072	2018-11-16	[]	stim sens best dat night ev
1063348491177594880	2018-11-16	[]	miss fabl mary clair black friday shop ev next thursday get ticket enjoy 20% stor on night @fabledbeauty
1063267484181168129	2018-11-16	[]	beauty podcast ad sery sparkl morn commut
1063217606163873793	2018-11-15	[]	convint gam thrones fan the
1063171117375016960	2018-11-15	[]	chicest road trip uk
1063142086579490822	2018-11-15	[]	drift queen meet becky ev vlog shak car world
1063115898859466752	2018-11-15	[]	disney drop cutest cact pot plant
1063110681120198658	2018-11-15	[]	unseen photo baby georg charl cutest
1063087262785851393	2018-11-15	[]	tom hiddleston upload video cry twit
1063071782608035840	2018-11-15	[]	christmas gift mum giv maj browny point
1063065940349333504	2018-11-15	[]	kat middleton megh markl back maj jewellery trend
1063050496959750148	2018-11-15	[]	everyon talk freaky photo print charl print harry
1063045052769935361	2018-11-15	[]	megh markl unexpect tak swear surpr
1063037145483436032	2018-11-15	[]	wait act recyc receipt
1063037138197835777	2018-11-15	[]	queen miss latest roy famy photo
1063037132669837312	2018-11-15	[]	car delevingn ask princess eugeny permit wear suit wed
1063023359687036928	2018-11-15	[]	top ad exec explain john lew advert act mak us cry
1062978592496328704	2018-11-15	[]	miss fabl mary clair black friday shop ev next thursday get ticket enjoy 20% stor on night @fabledbeauty
1062865857892835329	2018-11-15	[]	nam list mean real clusmy
1062826980754776064	2018-11-14	[]	wom post photo underwear onlin respons shock ir rap tri
1062768066067644417	2018-11-14	[]	queen miss latest roy famy photo
1062755187415228416	2018-11-14	[]	hud mon kat launch new fragr collect skinc lin way hooray
1062737279888867328	2018-11-14	[]	jessy rev childr roy albert hal show
1062724184554565633	2018-11-14	[]	sign behind outfit roy famy portrait
1062717577837928448	2018-11-14	[]	wait act recyc receipt
1062711753644142592	2018-11-14	[]	stell mccartney launch brid lin ye includ megh dress
1062703239785779201	2018-11-14	[]	car delevingn ask princess eugeny permit wear suit wed
1062696826208468992	2018-11-14	[]	ald hug fest hamp back want christmas
1062684103991091202	2018-11-14	[]	enjoy 20% @fabledbeauty stor fre goody bag glass bubbl fabl mary clair black friday shop ev next thursday buy ticket
1062682116541108225	2018-11-14	[]	liam hemswor shar heartbreak photo left miley cyr hous wildfir
1062673801010270209	2018-11-14	[]	harry megh pda inspir chang kat
1062673793414422528	2018-11-14	[]	dian talk marry troubl unearth person let
1062673771432075264	2018-11-14	[]	popul roy off rank ord
1062670668951629826	2018-11-14	[]	david chimp dynasty found dead heartbrok
1062665345478074368	2018-11-14	[]	barack obam review michel obam memoir much
1062580405377921026	2018-11-14	[]	ryanair mass christmas sal mean flight less fiv
1062467054698184704	2018-11-13	[]	miss fabl mary clair black friday shop ev
1062374313947488257	2018-11-13	[]	popul roy off rank ord
1062354117337776128	2018-11-13	[]	nata portm dior dress took 250 hour mak gorg
1062336024649572352	2018-11-13	[]	peopl think ivank trump im chang act polit warn
1062330696285544448	2018-11-13	[]	harry megh pda inspir chang kat
1062325368047239168	2018-11-13	[]	spic girl launch char tee want on
1062318947591176193	2018-11-13	[]	dian talk marry troubl unearth person let
1062310935396839424	2018-11-13	[]	asd harry pot adv calend pack mag
1062310336894648320	2018-11-13	[]	brimston lak district bolthol might heav
1062310329974026241	2018-11-13	[]	buy six bottl prosecco ald
1062310324471099392	2018-11-13	[]	best lip balm see wint beyond
1062150578611064833	2018-11-13	[]	buy six bottl prosecco ald
1062029645422489606	2018-11-12	[]	brimston lak district bolthol might heav
1061971812173709312	2018-11-12	[]	megh markl person assist quit everyon confus
1061946995227557888	2018-11-12	[]	look lik roy harry pot obsess
1061946988596359168	2018-11-12	[]	megh markl person assist quit everyon confus
1061946981273153538	2018-11-12	[]	pipp middleton off annount nam baby
1061944577903546368	2018-11-12	[]	megh markl sit roy famy remembr day
1061910801043374081	2018-11-12	[]	look lik roy harry pot obsess
1061905493914984448	2018-11-12	[]	pipp middleton off annount nam baby
1061585446101270529	2018-11-11	[]	bargain design buy alert bicest vil bfc pop op
1061462345384366080	2018-11-11	[]	ald sel gin christmas crack ye pleas
1061371483065327618	2018-11-10	[]	nee last wint sun ten hotel
1061279924592525314	2018-11-10	[]	@fabledbeauty celebr single's day get 20% everyth spend 60 ent promo cod single20 checkout
1061269805490204673	2018-11-10	[]	ticket situ michel obam london talk
1061189898978447361	2018-11-10	[]	best cellulit cream smooth firm skin
1061181768433369088	2018-11-10	[]	@fabledbeauty celebr single's day get 20% everyth spend 60 ent promo cod single20 checkout
1061106321846689793	2018-11-10	[]	tesco sel hug box maltes truffl want
1061049233669787648	2018-11-10	[]	get reduc appear cellulit
1060992338514841602	2018-11-09	[]	mak mad easy six simpl step world class legend mak art
1060984787026903040	2018-11-09	[]	hunt releas mary poppin disney collect want
1060984778504040448	2018-11-09	[]	print harry claim habit confus megh markl
1060984773282168832	2018-11-09	[]	emm watson tom felton harry pot reun everyth
1060947667394674688	2018-11-09	[]	fant get hand pair kat moss' sho now's chant bid help childr poverty
1060940357167407104	2018-11-09	[]	69 dj try chang leg ag 49
1060934885014208518	2018-11-09	[]	fant get hand pair kat moss sho
1060889933244698624	2018-11-09	[]	see mak bag megh took roy tour
1060881412109361152	2018-11-09	[]	strange rul chris prat ann far follow accord divorc settl
1060875501093486592	2018-11-09	[]	hunt releas mary poppin disney collect want
1060870242510032896	2018-11-09	[]	print harry claim habit confus megh markl
1060864690249756678	2018-11-09	[]	emm watson tom felton harry pot reun everyth
1060858867377147905	2018-11-09	[]	video print harry play puppy sweetest thing see today
1060844296809705472	2018-11-09	[]	chrissy teig took mum hil way
1060753413930209280	2018-11-09	[]	adrian lim retir &amp; thing hap victor secret show 2018
1060736925873721344	2018-11-09	[]	best dry shampoo chang lif proof
1060671509478473730	2018-11-08	[]	kendal jen answ googl quest
1060629177311940610	2018-11-08	[]	pco tel
1060621772456775680	2018-11-08	[]	lil reinhart introvert set lif riverd next episod favourit
1060621768333844480	2018-11-08	[]	pco tel
1060621760381378560	2018-11-08	[]	michael kor rest fai tech lux smartwatch
1060586733492953089	2018-11-08	[]	krist bel terr menst cup expery haunt
1060571741737619461	2018-11-08	[]	keir knightley rememb lov act charact end
1060554443509374976	2018-11-08	[]	beauty byt memb roy famy lov tequil cle beauty lol chat lin
1060543696570146816	2018-11-08	[]	print william kat middleton hil trick avoid photograph
1060512664596738049	2018-11-08	[]	print william told emm thompson sweetest thing dam ceremony
1060496751155646465	2018-11-08	[]	lil reinhart introvert set lif riverd next episod favourit
1060483438233468928	2018-11-08	[]	michael kor rest fai tech lux smartwatch
1060471619032879104	2018-11-08	[]	cleans oil complet transform skinc regim
1060334819845029889	2018-11-08	['#biggestworryinthe90s']	millen shar nostalg tweet
1060258637174591488	2018-11-07	[]	brad angelin report tak custody battl court
1060258631021522944	2018-11-07	[]	megh markl explain nev wear victor beckham dress
1060258608191987712	2018-11-07	[]	styl christmas gift kind want
1060239197657841664	2018-11-07	[]	everyth nee know grey hair
1060231943718162433	2018-11-07	[]	charlot tilbury party takeov look mast holiday season
1060224818040184833	2018-11-07	[]	styl christmas gift kind want
1060195040495058944	2018-11-07	[]	unus habit william harry pick charl
1060189696385605632	2018-11-07	[]	roy rul megh markl must follow baby nam
1060153454734262272	2018-11-07	[]	el macpherson op friend cameo regret
1060141746485710849	2018-11-07	[]	cost new breakfast croiss every nutell fan dream
1060134460920918016	2018-11-07	[]	brad angelin report tak custody battl court
1060114723755225088	2018-11-07	[]	megh markl explain nev wear victor beckham dress
1060109695673884672	2018-11-07	[]	on day fabl mary clair beauty shop ev london @fabledbeauty stor get ticket
1060024308012068864	2018-11-07	[]	dua lip kar kloss dua lip shay mitchel stay shap
1059928336762392578	2018-11-06	[]	best conto kit defin sculpt lik pro
1059875606681321473	2018-11-06	[]	meet mary clair beauty team 121 beauty adv recommend @fabledbeauty shop ev thursday buy ticket
1059870440754241537	2018-11-06	[]	endometrios guid symptom diagnos tre
1059843528640155648	2018-11-06	[]	rosy huntington yorkshir pud strong fem rol book bought six tim
1059810923228078081	2018-11-06	[]	ev princess charlot job describ
1059799689019691014	2018-11-06	[]	princess eugeny jack brooksbank thank card outdon harry megh
1059791070433808384	2018-11-06	[]	want zar limit edit sequin skirt nee quick
1059782699345420288	2018-11-06	[]	30 vert megh markl second wed dress
1059758142744092672	2018-11-06	[]	print harry megh markl chos annount pregn austral
1059675333614596096	2018-11-06	[]	sir david attenborough ban produc sav dying anim
1059573529799200770	2018-11-05	[]	set popul baby nam 2028
1059527014363881472	2018-11-05	[]	roy famy memb report sup fan crown
1059495730979762182	2018-11-05	[]	writ bestsel novel cecel ahern wrot first ag 21
1059485203691986944	2018-11-05	[]	rud hil birthday card dian sent account
1059472410800545792	2018-11-05	[]	best faux fur coat wear wint coolest cov
1059467031735689216	2018-11-05	[]	kri halleng frust ang serv channel breast cant aw
1059451244077449216	2018-11-05	[]	could common react rev wheth psychopa
1059451238771617795	2018-11-05	[]	wear jean megh chang lif 30 wom
1059451226171920384	2018-11-05	[]	new look sel friend christmas want
1059440024075280384	2018-11-05	[]	mc tilbury bts v2 via @youtube
1059427796597030912	2018-11-05	[]	print harry megh markl borrow victor david beckham
1059420698874044421	2018-11-05	[]	gwyne paltrow gav us peek stun custom valentino wed dress
1059412737816756227	2018-11-05	[]	kat megh app get sewn dress avoid wardrob malfunct
1059406450513117184	2018-11-05	[]	queen invit megh markl mum christmas
1059362192124977153	2018-11-05	[]	join us exclud shop ev fabl mary clair stor london stock beauty favourit get ticket
1059133067900657664	2018-11-04	[]	miss fabl mary clair beauty shop ev
1059060217529417729	2018-11-04	[]	miss fabl mary clair beauty shop ev london @fabledbeauty stor buy ticket
1059019492225900544	2018-11-04	[]	wear jean megh chang lif 30 wom
1058881199442149376	2018-11-04	[]	fre rit hand balm wor 9 decemb mary clair
1058735848966049792	2018-11-03	[]	meet mary clair beauty team 121 beauty adv recommend @fabledbeauty shop ev get ticket
1058720233135980546	2018-11-03	[]	put christmas dec ear could act mak happy
1058579172354936833	2018-11-03	[]	meet fem radio stat disrupt airwav
1058445571214721024	2018-11-02	[]	new look sel friend christmas want
1058395724755451904	2018-11-02	[]	could common react rev wheth psychopa
1058359946897735685	2018-11-02	[]	megh markl moth pul mum mov ev dress fit
1058344291498631170	2018-11-02	[]	docu print charl want see
1058332030059139072	2018-11-02	[]	ald win adv calend fin back ready
1058325718835310592	2018-11-02	[]	much megh markl aust tour wardrob cost
1058303436922458112	2018-11-02	[]	gwyne paltrow rebrand menopaus new lin madam ov
1058282703093665792	2018-11-02	[]	join us exclud shop ev fabl mary clair stor london buy ticket
1058237569597497345	2018-11-02	[]	exact balay popul
1058123439641411584	2018-11-01	[]	jenn dew app dat someon new seem lik bab
1058074778941222912	2018-11-01	[]	app peopl wash fac sparkl wat beauty
1058041486728671234	2018-11-01	[]	miss fabl mary clair beauty shop ev london @fabledbeauty stor get ticket
1058040882556035076	2018-11-01	[]	celebr tot kil halloween costum year
1058019572350115840	2018-11-01	[]	could real end roy fab four
1058002510663872512	2018-11-01	[]	megh markl allow giv femin speech kat
1057977782138032128	2018-11-01	[]	gam thrones prequel way star
1057936827779375104	2018-11-01	[]	supermarket gin beat prem brand tast test
1057843944636252160	2018-11-01	[]	best shampoo dry hair fix level brittl
1057763705688125440	2018-10-31	[]	victor beckham receiv spec hono
1057732979047497729	2018-10-31	[]	com pil hap nee know
1057668778174152704	2018-10-31	[]	kat middleton op import thing tel childr
1057662805963366401	2018-10-31	[]	wrap pap fac ex stock
1057639073140084737	2018-10-31	[]	megh markl recogn instagram fan sweetest thing see day
1057612459140411392	2018-10-31	[]	apply yorkshir pud tast sign
1057565690545221637	2018-10-31	[]	chan tat jenn dew off fil divorc
1057428471926939648	2018-10-31	[]	everyth nee know coory 2018 answ hyg
1057336580787134464	2018-10-30	[]	new way dying hair chang way tre hair
1057314156888637441	2018-10-30	[]	car delevingn rit or bffs deal cyb bul onlin neg
1057303129346195457	2018-10-30	[]	twit remov lik button tim
1057287987917176832	2018-10-30	[]	veg beauty brand produc rad
1057230735080411138	2018-10-30	[]	prosecco christmas crack thing
1057225250377740288	2018-10-30	[]	wait queen real going abd throne
1057218621162823680	2018-10-30	[]	print harry megh markl brok away tour min moon
1057199927745568773	2018-10-30	[]	print harry nicknam roy baby kind sweet
1057084073036967936	2018-10-30	[]	ant beauty produc on bathroom cabinet fac act nee
1057024494437629953	2018-10-29	[]	heid klum wear year halloween
