id	created_at	hashtags	cleaned_text
1030698724215926785	2018-08-18	[]	@americanair evil crew secret giv us issu bc sep seat partn ask mov back togeth ask giv attitud threatened let plan employ peopl lik look camera proof
1030694706743836672	2018-08-18	[]	minut 2am @americanair flight 10
1030694436525748224	2018-08-18	[]	@ls22743 @americanair @kirstenlhines sery sham
1030691768537440257	2018-08-18	[]	@americanair @kirstenlhines that's real help i'm sur confus cur ground air can't tel peopl nee know real tim
1030691344602333184	2018-08-18	['#preach']	@butterfoxsandwi @americanair
1030691162816962560	2018-08-18	[]	@butterfoxsandwi @americanair seem lik staff issu honesty policy gon awry want know clear definit word sorry work hard put us hotel already near 2am dec
1030689652326506498	2018-08-18	[]	@americanair ok hour i'm work hard get hom want know i'm exhaust get us hotel
1030689010014937089	2018-08-18	[]	@mermaldmaki @americanair exact
1030688815915126785	2018-08-18	[]	@americanair @mermaldmaki expery thing lie blam weath on giv us honest answ leav act sorry would giv us help info
1030687891616407552	2018-08-18	['#exhaust']	@americanair 1 ful crew board stil say 1 can't get answ tel us what's going
1030686438789210112	2018-08-18	[]	@americanair sery what's going
1030685557784043522	2018-08-18	[]	@americanair 1 act going leav 1 we'd board board would start what's going
1030684265372151809	2018-08-18	[]	@americanair put anyth want board 3x lie crew confirm nev weath
1030684012594032640	2018-08-18	[]	@americanair keep push back crew confirm honest i'm misinform rud liar
1030681848354091009	2018-08-18	[]	@galswander @americanair sint 6 i'm beyond fury crew issu whol tim stil push back reply eith
1030680967105732609	2018-08-18	[]	@americanair plan leav ewr jfk etc sint 9am crew rel weath
1030680575085109248	2018-08-18	[]	@americanair 1am ide leav nee rebook nee go hom giv hotel lat
1030680134288900096	2018-08-18	[]	@americanair flight 1663 leav delay bc copilot hour secret giv attitud man interv nasty thing et
1030626671400050688	2018-08-18	[]	@sammij39 @sadmizee @bbt_daily @mcmcomiccon @authorpromo @skyecity_rise @ebook_planet @realquirkycat @erkoes @tblackford3 @xaviersnews @elervin1087 @teamkdmp @dlsbeats @robbenedict @mattcohen4real @samanthajferris @tyolsson @allriot_tshirts @badturnworse @osricchau thank
1030626471805693952	2018-08-18	[]	excit @americanair flight already delay 2x leav 1am joy fly
1030587906555924480	2018-08-17	[]	welcom drink alway welcom drink that's ok alcohol fre vert avail tru mex styl cours col bright bold
1030577127257767936	2018-08-17	[]	i'm charlot dougla intern airport @cltairport charlot nc
1030431568127582208	2018-08-17	[]	new f&amp;v k4000 pow daylight bi 1 led panel light releas via @willrobertsacts
1030424020674654208	2018-08-17	[]	mak produc best sel produc onlin via @mrspaznanski
1030408933322711040	2018-08-17	[]	could work hom best decid mak famy via @pbnwhine
1030401381054722048	2018-08-17	[]	cre way enco read shar cont via @harleenas
1030393828635828224	2018-08-17	['#kidlit', '#learn', '#bil', '#backtoschool', '#bookloversday']	gre cap o' col cap de col engl pronunt guid @karlbeckstrand via @nnp_w_light
1030378738410835968	2018-08-17	[]	inexpend diy sandpap let plu altern via @debchitwood
1030371183617863680	2018-08-17	[]	green toy elmo expl outdo act set via @blm03
1030363646864572417	2018-08-17	['#ap', '#googl']	cameo celebr mak video answ popul quest via @wonderoftech
1030348540944560128	2018-08-17	[]	new study prov technolog us classroom impact grad via @digitaladdicts_
1030333486811545600	2018-08-17	[]	hist com al charlevoix quebec via @wanderingeds
1030325885562437632	2018-08-17	[]	black coff ic cream bosch ic cream mak review via @thatsusanw
1030318365259325440	2018-08-17	[]	b box snack pack giveaway via @blm03
1030310783605989376	2018-08-17	[]	din cal mar mak weekend brunch spec occas via @lastory
1030295694064734208	2018-08-17	[]	berg oslo train scen berg railway nsb komfort upgrad upd 2018 via @what_boundaries
1030280592330506240	2018-08-17	[]	lack invest new technolog maj concern employ via @adigaskell
1030273025273417729	2018-08-17	[]	gre thing chicago via @wndlustmarriage
1030257939087540224	2018-08-17	[]	thing fort wayn indian via @blm03
1030242833863790592	2018-08-17	[]	get glow marc jacob beauty sourc beyonce's glow vogue's cov look don sir john via @lastory
1030235307772465152	2018-08-16	[]	celebr nat rum day recip gustoso aguardy rum via @lastory
1030227738156781568	2018-08-16	['#disneysnutcrack']	get first look disney 2018 holiday feat film nutcrack four realm via @desireeeaglin
1030212645696233477	2018-08-16	[]	gift nap lov id job nap pillowcas via @ladyjcmuses
1030205106782957568	2018-08-16	[]	infl kayak around comino via @jamierbw
1030195695498620928	2018-08-16	['#rivieramay', '#mexico']	beauty afternoon beach @bahiaprincipe noth blu blu ski blu wat ev blu drink lol plan
1030189989404069896	2018-08-16	[]	tuesday food blog lasagn al forno via @dla1950
1030174897929183233	2018-08-16	['#inspir', '#mot', '#mondayblog', '#mondaymot']	alway gen enco word via @nnp_w_light
1030159791992328194	2018-08-16	[]	choos best produc cur hair via @inkscrblr
1030152247571869702	2018-08-16	['#review']	gramm box month subscrib via @weidknecht
1030137136677310466	2018-08-16	[]	reason lookout art bil eil via @grape_gossip
1030129595062870016	2018-08-16	[]	neocel biotin burst beauty infus review via @sonyasparks
1030122041377206273	2018-08-16	[]	fre constel print montessor inst download via @debchitwood
1030106950762201088	2018-08-16	[]	hyp height hiram visit machu picchu peru via @transamericas
1030099387295383552	2018-08-16	[]	de markth rotterdam food hal &amp; market satisfy food &amp; drink crav via @philatravelgirl
1030091856376422400	2018-08-16	[]	20 tallest mountain world contin world travel bucket list via @greenglobaltrvl
1030076736531296256	2018-08-16	['#dogdaysthefilm', '#dogday']	dog day doggon fun film entir famy @dogdaysthefilm via @2kidsandacoupon
1030061653663080449	2018-08-16	['#dogdaysthefilm', '#dogday']	behind scen dog day movy premy @dogdaysthefilm via @2kidsandacoupon
1030046528054943745	2018-08-16	[]	fiv secret becom styl today via @donnachaffins
1030038979272470530	2018-08-16	[]	celt cross work 7 bead new list yellow umb pink vint set august peyot bracelet box month kit via @kraftymax
1030023878372937728	2018-08-16	['#wednesdaywisdom', '#inspir', '#mot', '#affirm', '#wednesdaymot']	follow three affirm via @nnp_w_light
1030008782666059781	2018-08-16	[]	crayol tak not produc bundl giveaway via @3sonshavei
1030001225763368961	2018-08-16	[]	becom self via @donnachaffins
1029993678474031104	2018-08-16	[]	struggling what's right via @mssackstein
1029986134141612032	2018-08-16	[]	mamm mia diet review
1029978573854199809	2018-08-16	[]	tip adjust kindergart via @salmadinani
1029963483633393664	2018-08-16	[]	retir plan cre fin plan via @mindycrary
1029955935807188993	2018-08-16	[]	top surveil sec electron buy via @digitaladdicts_
1029948378103394304	2018-08-16	[]	am dessert gain popul across unit stat via @mommye
1029933282547388417	2018-08-16	[]	saturday eclips caterpill soup liv q&amp;a lis thursday miss liv ev via @lastory
1029918177822695424	2018-08-16	['#rom', '#postapoc', '#suspens']	book spotlight shelt reckon allyson young via @elyzabethvaley
1029903090777042944	2018-08-16	[]	cross digit skil gap via @adigaskell
1029895532746104832	2018-08-16	['#kidlit', '#ant', '#bookreview', '#backtoschool', '#bookloversday']	check war infest story three part @aunthaggis via @nnp_w_light
1029887988577255424	2018-08-16	['#socialmediamarket', '#smm', '#videomarket']	market get board digit hangout via @chrishodgeman
1029880428096839680	2018-08-16	[]	monoton man mind neg solid via @scribeandcomic
1029865347007107074	2018-08-15	[]	'a cup coffee' mean via @mommacuisine
1029857798279057409	2018-08-15	[]	latest research show soc market dept via @kathikruse
1029842687762026496	2018-08-15	[]	bar harb oceansid koa perfect visit acad nat park main via @familyfocusblog
1029835148446130186	2018-08-15	['#bookloversday', '#book', '#amread', '#99cents', '#books']	book fair stop discov new book read weekend via @nnp_w_light
1029827587319717890	2018-08-15	[]	bbl p hep air pur review
1029812499716231169	2018-08-15	[]	must guid math mat up el via @teachtoinspire5
1029804962816122880	2018-08-15	[]	infin war fangirl unforget mom infin war blu dvd via @coolchillmom
1029797380252676097	2018-08-15	['#yalit', '#yahor', '#bookreview', '#hor']	anyon surv monsterland reanim award auth @iammichaelokon via @nnp_w_light
1029789844669689856	2018-08-15	[]	cas study onlin review lost loc busy job via @michaelsbrooks
1029782286949134336	2018-08-15	[]	11 surv tip rais teen daught via @inkscrblr
1029767182195015680	2018-08-15	[]	fortnit battl roy com android dev via @digitaladdicts_
1029759658830049280	2018-08-15	[]	crayon collect 8 ev culv city hop set gui book record teach crayon via @lastory
1029744559708876801	2018-08-15	[]	mac cosmet day beauty support midnight mission's women's cris &amp; bridg hous cent via @lastory
1029729455487504384	2018-08-15	[]	loc seo step rank loc busy googl map via @highlandjamie
1029714339119472640	2018-08-15	['#coupon', '#furbaby', '#sav']	found @pupperoni via @sonyasparks
1029706792153108480	2018-08-15	[]	monit tir press phon via @wellconnectdmom
1029699247329959938	2018-08-15	[]	effect school tip keep famy zen via @coolchillmom
1029691685289119744	2018-08-15	['#99cents', '#historicalrom', '#westernrom', '#amread', '#book']	sal queen parad valley @catdubie @wildrosepress via @nnp_w_light
1029676594707816450	2018-08-15	['#mgtab']	spec ag charl book undercov fbi sery releas today ded fath second charact book @mimisgang1 via @mimibarbour
1029669052485124097	2018-08-15	[]	read notebook 4th 5th grad via @teachtoinspire5
1029661492952674304	2018-08-15	[]	easy earn cash child's school box top costco via @desireeeaglin
1029653950247718912	2018-08-15	[]	tolackcolo guy avail etsy via @ladyjcmuses
1029638878720872449	2018-08-15	[]	head uk say say via @wanderingeds
1029631287613632512	2018-08-15	[]	protect baby learn pren depress via @juliecookies
1029623762839318528	2018-08-15	['#meadv']	biodivers sum school via @ccastleview
1029608650552344578	2018-08-15	[]	top tip help teen sav colleg via @3sonshavei
1029602202325725184	2018-08-15	['#rivieramay', '#mexico']	beauty day swim @bahiaprincipe loc pretty much beauty day whatev annivers birthday
1029601506687897600	2018-08-15	['#rivieramay', '#mexico']	beauty day swim loc pretty much beauty day whatev annivers birthday
1029601094849187840	2018-08-15	[]	lat sum idea hear soul link party via @apriljharris
1029593544758112266	2018-08-15	[]	josh recommend week august 4 2018 josh garrick via @wanderingeds
1029578466579107841	2018-08-15	[]	ey educ celebr paus via @wanderingeds
1029570892244897792	2018-08-15	[]	mak homemad bubbl via @onemommasavingm
1029555804486156289	2018-08-15	['#perisil', '#coupon', '#sav']	wow hi $4 let's via @sonyasparks
1029548255867269121	2018-08-15	[]	nee say someon perhap tim via @ladyjcmuses
1029540706367549440	2018-08-15	[]	cinnamon rol recip everyon lov via @2kidsandacoupon
1029533161183698944	2018-08-15	[]	aspir lead nee good ment via @mssackstein
1029525599101087746	2018-08-15	[]	feat new book spotlight witch wel sd hintz via @westofmars
1029518054122815491	2018-08-15	[]	new peyot bracelet box kit green dragon bookmark work 1 bead beauty bird necklac set lis wing tend ros giveaway via @kraftymax
1029510497136271366	2018-08-14	['#5', '#rom', '#mgtab', '#bookreview']	two mismatch lov find way past mistak sum lovin' wound heart us today bestsel @jacqbiggar via @nnp_w_light
1029495405866872834	2018-08-14	[]	homemad ey firm cream via @wondermomwannab
1029487855205273601	2018-08-14	[]	fun toy camp golia gam pressm toy via @3sonshavei
1029480299690958848	2018-08-14	[]	bit beauty op larchmont los angel lip lab bit bring gorg col via @lastory
1029465203132522496	2018-08-14	['#win', '#sweep']	ent @barielle priz pack @verabradley tot echo dot &amp; end 8 via @sonyasparks
1029450111192125443	2018-08-14	[]	way prep young kid back school via @bestofthislife
1029442547033227264	2018-08-14	['#190']	inspir monday linky party via @mrspaznanski
1029427451301122054	2018-08-14	['#tridentatwalmart', '#ic', '#ad']	travel must hav sum vac plu win walmart gift card via @2kidsandacoupon
1029419905190453248	2018-08-14	[]	fre crayol supply cash back good thru 8 via @blm03
1029404799492665345	2018-08-14	[]	produc begin disney's liv mul via @blm03
1029397251167346689	2018-08-14	[]	montessor anim plant contin circ {from nat print libr 67% august 16 via @debchitwood
1029382159273021440	2018-08-14	[]	tuesday food blog shepherd's pie via @dla1950
1029367049569677313	2018-08-14	[]	astronaut train expery atx kennedy spac cent
1029359507107971079	2018-08-14	[]	mak best mem tip happy famy vac
1029344406992822272	2018-08-14	[]	par guid tween behavy via @wondermomwannab
1029339323622215681	2018-08-14	['#sham', '#wast']	@carolinabeer41 nam san would us amount singl us dispos non biodegrad garb resta sham wast nev patron
1029336853370036224	2018-08-14	['#dogday', '#giveaway']	dog lov must see movy $50 fandango gc via @longwait4bella
1029329305141166081	2018-08-14	['#win', '#sweep']	ent dooney &amp; bourk bag end 8 via @sonyasparks
1029316048955367424	2018-08-14	[]	i'm charlot dougla intern airport @cltairport charlot nc
1029314223950704640	2018-08-14	[]	sup ltd acquir act meas film rev putin's long gam trump via @loup_dargent
1029306668809637889	2018-08-14	[]	happy harvest sal ev ant farm hous via @weidknecht
1029299104478908419	2018-08-14	['#sav', '#coupon']	let's much today print via @sonyasparks
1029291547819421696	2018-08-14	['#win', '#ad']	sav trid sug fre gum ibott chant walmart gc's via @sonyasparks
1029279717164244992	2018-08-14	['#sav', '#coupon']	let's much today print via @sonyasparks
1029275653940686848	2018-08-14	['#mexico', '#bahiaprincip', '#bahiaprincipemo', '#experiencehappy']	way woot @bahiaprincipe @ newark liberty intern airport newark nj
1029272172949368833	2018-08-14	[]	inst pot bbq shredded chick via @wondermomwannab
1029264621243387904	2018-08-14	['#recip', '#marvel', '#marvelinfinityw']	guard galaxy inspir cooky via @onemommasavingm
1029249519035265030	2018-08-14	['#coupon', '#sav']	found @scrubbingbubble today us bathroom let via @sonyasparks
1029242061994844162	2018-08-14	[]	mot lead gen email subscrib via @reginaldchannet
1029234438079688705	2018-08-14	[]	beachwood plac back good vib via @mryjhnsn
1029226872729751554	2018-08-14	[]	sleep body good via @circlecast
1029219318108704768	2018-08-14	[]	fir hd 10 tablet giveaway blog op annount post via @sonyasparks
1029211774883700736	2018-08-14	[]	oreo ic cream via @wondermomwannab
1029204225363009536	2018-08-14	[]	audy lov ang alex jon someon lik back via @loup_dargent
1029196672134467584	2018-08-14	[]	poetry thursday 322 buttalowy via @dla1950
1029189119296110602	2018-08-14	[]	intern cat day via @circlecast
1029181569083342848	2018-08-14	[]	obers backpack back school sup sal via @weidknecht
1029174052970217472	2018-08-14	['#sav', '#coupon']	let's much today print via @sonyasparks
1029166473955160066	2018-08-14	[]	beauty visit arizona's paint desert via @pennysadler
1029158919959203841	2018-08-14	[]	cre glow constel dict writ tray via @debchitwood
1029151372401369088	2018-08-13	[]	lgbt israel task forc cre eurovision's win song toy fight israel lgbt commun pres wait youtube's antechamb via @loup_dargent
1029143834922549248	2018-08-13	[]	tun past salad recip via @apriljharris
1029136270939901954	2018-08-13	[]	get big sav back school cloth via @weidknecht
1029128722664902656	2018-08-13	[]	integr innov healthc via @adigaskell
1029121176235397120	2018-08-13	['#historicalrom', '#medievalmonday', '#bookreview']	two soul nee heal shadow swan judi sterl @wildrosepress via @nnp_w_light
1029113634318897154	2018-08-13	[]	charg protect appl pencil willgoo pow bank carry cas via @eddieofl
1029112398790250498	2018-08-13	['#travel', '#kennedyspacec']	astronaut train expery atx kennedy spac cent via @havesippy
1029106075520458752	2018-08-13	[]	ent win cop lis wingate's book tend ros beadwov bookmark krafty max origin via @kraftymax
1029098526066831370	2018-08-13	[]	divers read challeng roundup surv via @pamlovesbooks
1029090971982749696	2018-08-13	[]	weekend cleveland 2018 32 via @mryjhnsn
1029083522269634560	2018-08-13	[]	get around without cab travel abroad via @havesippy
1029075875453648896	2018-08-13	[]	aveng infin war thano would surv via @mryjhnsn
1029068322451664897	2018-08-13	[]	dog day sum via @dianecapri
1029060782196252672	2018-08-13	[]	three styl nap via @circlecast
1029045679988072450	2018-08-13	[]	find pass lif via @reginaldchannet
1029038124712845312	2018-08-13	['#196']	keep cool sum heat hm via @momfindsout
1029034599383330816	2018-08-13	['#whitemountain', '#newhampshir', '#travel', '#hik', '#outdo', '#getoutsid']	good day hik beauty day lov view peac tranquil els ask
1029030578266537985	2018-08-13	[]	us warry famy aveng assembl marvel univers liv via @loup_dargent
1029027455997280257	2018-08-13	[]	par play new york via @heraldcourier
1029020015142551555	2018-08-13	['#ad']	back school shop @costco via @havesippy @boxtops4edu
1027626331620757509	2018-08-09	['#facemask']	fac mask tre @mychelle
1027606544999800832	2018-08-09	['#babyproduc', '#airfilt', '#hom', '#safebaby', '#cleanair', '#healthybaby']	bbl p hep air pur review check @bbluv_group
1027263281130553344	2018-08-08	['#backtoschool', '#boxtopsforeduc']	head shop visit loc costco eth stor buy bulk sav money collect ton noth lik
1027249714339700736	2018-08-08	['#travel']	sum fun new york famy via @havesippy
1027247853465423872	2018-08-08	[]	back school shop @costco via @havesippy
1027232593102741509	2018-08-08	[]	sweet rom releas sweet heat baysid @addison_cole_ seren drake's best friend bus
1027232569975349251	2018-08-08	[]	e 20 piec col stainless steel flatw utensil set ga win 8 @smgurusnetwork @deliciouslysavv
1027232543488270336	2018-08-08	['#rom', '#capecod', '#newreleas']	new releas return sandy beach baysid heat @melissa_foster best
1027232510340722690	2018-08-08	['#boo']	book review kain run book on ryan kain act thriller sery donov
1027231075553161222	2018-08-08	[]	book next expery @tripadvisor via @havesippy
1027226882352275456	2018-08-08	['#broadway', '#avenueq', '#the']	see @avenueqmusical fun expery real fun tim book @tripadvisor know play 15 year
1027225565680553986	2018-08-08	['#broadway']	fin fin saw bookofmormon @tripadvisor fun funny somtim cring awkward induc show wear nonsens pant mad
1027202297162620928	2018-08-08	[]	turn tid stop fee red tid via @change
1025652827807461376	2018-08-04	[]	mifold grab boost seat giveaway new hifold high back boost seat via @mommye
1025645275342413824	2018-08-04	['#mysteryexchang']	arrest mason steamy rom suspens @amberdaulton1 via @stacyjuba
1025637723871293441	2018-08-04	[]	introduc read workshop via @ashleigh_ontpt
1025622631020732416	2018-08-04	[]	stay osak jap via @travellingking1
1025615077158936576	2018-08-04	['#elonmusk']	challeng gam develop gre new via @kunialabs
1025607529773129728	2018-08-04	[]	thing nee mak money blog via @reginaldchannet
1025599983779819520	2018-08-04	[]	alway wish mermaid enchantail plu giveaway end 8 via @homejobsbymom
1025592426445107200	2018-08-04	[]	mess sens sci col act toddl via @juliecookies
1025584879629737984	2018-08-04	[]	giv employ autonom import via @adigaskell
1025577330952024065	2018-08-04	[]	cas fronczak baby via @dianecapri
1025569778314956801	2018-08-04	[]	biggest risk job adopt ai via @adigaskell
1025562229792534528	2018-08-04	['#195']	school get ready back hm via @momfindsout
1025554684793245697	2018-08-04	['#2', '#pnr', '#dragon', '#fridayread', '#coverrev']	tess walk away surrend desir sweet surrend dragon sou @rtranbooks via @nnp_w_light
1025539583528906752	2018-08-04	[]	bel sleev flor kimono col ship $18 $39 via @onemommasavingm
1025532026462580737	2018-08-04	[]	new bal men's run mvnzll1 $34 $1 ship $74 via @onemommasavingm
1025524478216941568	2018-08-03	[]	read perfect mex daught erik sanchez nev via @pamlovesbooks
1025516926192242688	2018-08-03	[]	best sel dress 40% fre ship via @onemommasavingm
1025509392425410560	2018-08-03	[]	us print cre montessor act via @debchitwood
1025501825963835392	2018-08-03	[]	exp heal ins travel ins ful long travel via @hobonora
1025494281270845446	2018-08-03	[]	spicy crab top cod fillet via @apriljharris
1025486723231436806	2018-08-03	[]	taco rum monday dat night bomb beachwood via @mryjhnsn
1025479173903659009	2018-08-03	[]	weekend cleveland 2018 31 via @mryjhnsn
1025471628665397248	2018-08-03	[]	sum $1 movy kid reg cinema via @onemommasavingm
1025464074895810560	2018-08-03	[]	snuggl mem via @mryjhnsn
1025459544560943110	2018-08-03	['#trx', '#trxworkout']	tri new trx class week holy hannah jok i'm glad say surv lot ow today lol also i'm pretty sur we'r stil swe
1025457566174924801	2018-08-03	[]	straight vall ov fresh coff cak many diff coff cak flav choos fro
1025457493290434561	2018-08-03	[]	april 2018 upd hist zoar vil
1025457475636613120	2018-08-03	[]	know michig 3rd largest appl produc stat 2016 michig harvest 28 mil bushel find mor
1025457340127092736	2018-08-03	[]	@artistvodkin @thedavessablog that beauty
1025456526641848320	2018-08-03	['#infinityw']	aveng infin war custom facebook ar mask @avengers via @onemommasavingm
1025452485484445696	2018-08-03	[]	@americanair doubl sorry
1025448976823316480	2018-08-03	[]	lev video boost digit workplac expery via @martinjonesaz
1025444275553792000	2018-08-03	[]	@americanair send flight
1025442782087991297	2018-08-03	[]	@americanair can't get flight togeth told on thing luck pleas assist
1025439798734061568	2018-08-03	[]	@americanair troubl seat pleas assist
1025267546088501250	2018-08-03	[]	am el school kid meet french video pal par via @wanderingeds
1025252473597059074	2018-08-03	['#porkessab', '#watermelonday']	extrem flav watermelon salad gril pork chop sum menu ad via @abrecipes
1025244905910808576	2018-08-03	[]	way mak kitch funct impecc via @ccastleview
1025229815970975744	2018-08-03	[]	gre thing august hear soul link party via @apriljharris
1025222240332333056	2018-08-03	[]	tuesday food blog stir fry past salad via @dla1950
1025214696645963776	2018-08-03	['#review']	aucut whit nois sound machin via @weidknecht
1025199601031282688	2018-08-03	[]	learn sci collect level curs review via @ccastleview
1025192046607441920	2018-08-03	[]	get fre ribey bacon butcherbox via @weidknecht
1025176955610701824	2018-08-03	[]	weath detect rediscov nature's secret sign via @ccastleview
1025169402319327234	2018-08-03	[]	poetry thursday 321 blood red moon via @dla1950
1025161858301472769	2018-08-02	[]	easycloset ultim sum sal via @weidknecht
1025154308055224321	2018-08-02	['#lagostinaus']	farfal past salad greek styl perfect start famy din mak ad via @abrecipes
1025146747801284612	2018-08-02	['#franciacort', '#win']	@franciacorta ultim food win via @primlanikitchen
1025138681303191552	2018-08-02	[]	lov @theprobar org dairy fre non gmo energy go quick easy grab way gym
1024735056240304132	2018-08-01	['#ad']	fav beauty hack lov us johnson's baby oil shav leg anyth get us pool fas
1024698933677883392	2018-08-01	[]	beat homesick mak new dig abroad feel lik hom via @havesippy
1023999337389535233	2018-07-30	[]	hot work work insid anyway via @havesippy
1023640547175673856	2018-07-29	['#gym', '#workout']	@planetfitness memb year want go back bas $10 mon memb tel 12 mon commit what's commit explain shenanig pleas
1022473172107583488	2018-07-26	['#mudrun']	want hug happy mud run @toughmudder obstac cours much fun clear happy try on see on
1022090574759907329	2018-07-25	[]	there's noth lik toughmud happy end fun mud fil run challeng obstac end welcom sight fin lov mud rac
1021833282726621184	2018-07-24	['#leblancsparesort']	get roy tre los cabo spa resort @leblancresort
1021833233363873792	2018-07-24	['#travel']	get roy tre los cabo spa resort @leblancresort
1021449311182311425	2018-07-23	[]	fer wheel santa's vil new hampshir gav fantast view them park also beauty whit mountain surround view bottom
1021414349976612864	2018-07-23	[]	fly dog nee know via @havesippy
1021205266338058240	2018-07-23	['#whitemountain', '#newhampshir', '#naturephotograph', '#nat', '#getoutsid', '#beautifulday', '#travelingram']	expl much fun find hid plac expl
1021184517971857411	2018-07-23	['#lunapark', '#coneyisland']	sum fun lun park coney island
1021184286559547392	2018-07-23	[]	sum fun lun park coney island via @youtube
1021169249207955462	2018-07-22	['#mychel']	@mychelle skinc mask fruit fiest fac mask peel video
1021167970775715840	2018-07-22	[]	mychel fruit fiest fac mask via @youtube
1021159771066589184	2018-07-22	[]	mychel fruit fiest fac mask via @youtube
1020482251308650498	2018-07-21	[]	every teach mak tim travel via @wanderingeds
1020474703314636800	2018-07-21	['#book', '#fridayread', '#amread']	friday book round tak sum vac it'll return august 10th via @nnp_w_light
1020467154586689538	2018-07-21	[]	heal start person probiot kit giveaway via @lilfamadventure
1020452051904540672	2018-07-20	['#win', '#appl', '#ipad', '#sweep']	ent min end 7 via @sonyasparks
1020444502891343872	2018-07-20	[]	find afford hotel room via @thetravelfool
1020436955287441408	2018-07-20	[]	oh nee know food poison travel via @wanderingeds
1020429407536771072	2018-07-20	[]	fly canad three thing nee know via @wanderingeds
1020421850223005697	2018-07-20	['#coupon', '#sav']	us @tysonfoods tim i'm glad found today via @sonyasparks
1020414307211907072	2018-07-20	[]	rais healthy famy tip deal frequ busy trip via @pbnwhine
1020406751588487169	2018-07-20	[]	get outdo play sum
1020399201010835456	2018-07-20	[]	clog drain try roto root
1020391651259318272	2018-07-20	['#freeship', '#homedec']	matsy doorm hug person via @weidknecht
