id	created_at	hashtags	cleaned_text
1072675338021429250	2018-12-12	['#itshowyouframeit']	@babysavers @coolchillmom @momluvssportz @blogginmamas @enzasbargains @donnahup @mamasmission ha sery
1072675216554422273	2018-12-12	['#itshowyouframeit']	@beautifullypoor @heloenterprises @eyebuydirect nic ins ins us ha
1072674877449097222	2018-12-12	['#itshowyouframeit']	d1 look back holiday past favorit holiday mem ad
1072674867139543040	2018-12-12	['#itshowyouframeit']	join @blogginmamas tuesday 12 9p et twit party spons @eyebuydirect we'll
1072674831638892544	2018-12-12	['#itshowyouframeit']	join @blogginmamas tomorrow night 9p et 12 twit party spons @eyebuydirect
1072674817478967296	2018-12-12	['#itshowyouframeit']	tonight join @blogginmamas 9p et 12 twit party spons @eyebuydirect we'll
1072674791180681218	2018-12-12	['#itshowyouframeit']	littl join @blogginmamas 9p et 12 twit party spons @eyeb
1072674761677918209	2018-12-12	['#itshowyouframeit']	pleas sur follow @eyebuydirect @blogginmamas ad
1072674736235261953	2018-12-12	['#eyebuydirect', '#itshowyouframeit']	p1 priz $25 gift cod spons @eyebuydirect ad
1072674685740040194	2018-12-12	['#itshowyouframeit']	@gods_smile @heloenterprises @eyebuydirect good luck
1072674586876104705	2018-12-12	['#itshowyouframeit']	@beautifullypoor @heloenterprises @eyebuydirect sery new glass expend
1072674469171355651	2018-12-12	['#itshowyouframeit', '#sweep']	@heloenterprises @eyebuydirect want new fram sery min ant hah
1072674399961186304	2018-12-12	['#itshowyouframeit']	join blog mama &amp; eyebuydirect host twit party tuesday 12 9p est join
1072674374837256194	2018-12-12	['#itshowyouframeit']	ad twit party tuesday 12 9p est
1072674342696378368	2018-12-12	[]	rt win @eyebuydirect get fest fab way ad glow season
1072674280666738688	2018-12-12	['#itshowyouframeit']	@momluvssportz @enzasbargains @coolchillmom @blogginmamas @donnahup @mamasmission good luck
1072674202866647041	2018-12-12	['#itshowyouframeit']	@meowpar85 @blogginmamas @enzasbargains @coolchillmom @donnahup @mamasmission good luck
1072674142674141184	2018-12-12	['#itshowyouframeit']	nuestra co son @enzasbargains @coolchillmom @havesippy @donnahup @mamasmission ad
1072674124500221952	2018-12-12	['#itshowyouframeit']	@momluvssportz @blogginmamas @enzasbargains @coolchillmom @donnahup @mamasmission hello freez nj lol
1072674013644767237	2018-12-12	['#itshowyouframeit']	good luck
1072673914030055424	2018-12-12	['#itshowyouframeit']	hello
1072673735822491648	2018-12-12	['#itshowyouframeit']	thank join us welcom @eyebuydirect twit party ad
1072673722794950657	2018-12-12	['#itshowyouframeit']	thank join us welcom @eyebuydirect twit party ad
1072673706214854656	2018-12-12	['#itshowyouframeit']	rsvp rul &amp; priz ad
1072673695364190208	2018-12-12	['#itshowyouframeit']	rsvp rul &amp; priz ad
1072673674736689152	2018-12-12	['#itshowyouframeit']	good luck
1072673596030574592	2018-12-12	['#itshowyouframeit']	mod today @heloenterprises engl &amp; @bbabushka span ad
1072673585926422528	2018-12-12	['#itshowyouframeit']	mod today @heloenterprises engl &amp; @bbabushka span ad
1072673555610001408	2018-12-12	['#itshowyouframeit']	co today @enzasbargains @coolchillmom @havesippy @donnahup @coolchillmom @mamasmission
1072673537079554049	2018-12-12	['#itshowyouframeit']	ready party
1072673437733281793	2018-12-12	['#itshowyouframeit']	co today @enzasbargains @coolchillmom @havesippy @donnahup @coolchillmom @mamasmission ad
1072673419630649344	2018-12-12	['#itshowyouframeit']	panel today @babysavers ad
1072673407890845696	2018-12-12	['#itshowyouframeit']	panel today @babysavers ad
1072673380120313856	2018-12-12	['#itshowyouframeit']	priz win annount @blogginmamas ad
1072673374520918017	2018-12-12	['#itshowyouframeit']	priz win annount @blogginmamas ad
1072673343009185792	2018-12-12	['#itshowyouframeit']	pleas sur follow @eyebuydirect @blogginmamas ad
1072673294296461313	2018-12-12	['#itshowyouframeit']	@blogginmamas @enzasbargains @coolchillmom @havesippy @donnahup @mamasmission hello
1072579470769471489	2018-12-11	[]	sham
1072242852837646341	2018-12-10	['#healthyl', '#painreliev', '#giveaway']	giveaway biom pain reliev via @havesippy
1072225165805637632	2018-12-10	[]	starlink battl atla via @youtube
1072224661306572800	2018-12-10	[]	pokemon go let's go eev review
1072223654291914755	2018-12-10	[]	pokemon go let's go eev via @youtube
1072217676687310848	2018-12-10	['#giftguid']	last minut toy shop $20 via @havesippy
1072214685871677440	2018-12-10	['#wildl']	tel @blmalaska oppos dril protect habit alask western Arctic. act w @audubonsociety
1072212284586516481	2018-12-10	[]	scribblenauts meg pack via @youtube
1072207758076841990	2018-12-10	[]	tel @blmalaska oppos dril protect habit alask western arct act w @audubonsociety
1071924050904186882	2018-12-10	['#atlantisbahama', '#atl', '#bahama']	atl night lot going 24 hour day plenty see howev lik quiet outsid night wel
1071829339111649282	2018-12-09	['#atl', '#bahama', '#travel']	fun @atlantisbahamas
1071828597407662082	2018-12-09	[]	atl bahama via @youtube
1071798487078064128	2018-12-09	[]	holiday right around corn tak photo around christmas tre must 85 degr tad unus us dec @atlantisresort
1071434779504111621	2018-12-08	[]	i'm rockefel cent @rockcenternyc new york ny
1071434543905812480	2018-12-08	[]	i'm @paleycenter med new york ny
1070781661875503105	2018-12-06	['#giftguid']	ad moosh stuff toy via @havesippy
1070772912389529601	2018-12-06	['#giftguid']	reind book plush via @havesippy
1070763525004558336	2018-12-06	['#giftguid']	port nor pol toy holiday season via @havesippy
1069138118366900224	2018-12-02	[]	back root kitch herb gard via @3sonshavei
1069130563158712322	2018-12-02	[]	anticip holiday hear soul link party via @apriljharris
1069123005341675520	2018-12-02	[]	fre montessor alphabet act resourc via @debchitwood
1069115456458563584	2018-12-02	[]	nintendo switch sup mario party avail via @longwait4bella
1069107915372544002	2018-12-02	[]	wrebbit meet westero new lin gam thrones 3d puzzl com via @loup_dargent
1069100357891092480	2018-12-02	['#giftguid']	gift act men lif
1069085273290616832	2018-12-02	[]	253 exclud al wat quot blow mind via @bay_art
1069077713493913605	2018-12-02	[]	win castl cult top reason visit riquewihr alsac via @pennysadler
1069070157551738881	2018-12-02	[]	nee perfect gift ide canva photo print via @longwait4bella
1069062614053994496	2018-12-02	[]	top gift travel 2018 via @hobonora
1069055064441085953	2018-12-02	['#book', '#rom']	auth spotlight meet @authorstacygold adv lov gre outdo via @nnp_w_light
1069047518548369408	2018-12-02	[]	tuesday food blog lasagn via @dla1950
1069032412481503233	2018-12-02	[]	inspir sci airpl mov part blu ion glow via @loup_dargent
1069017309652631552	2018-12-01	[]	print christmas cooky exchang recip card via @longwait4bella
1069002222711840768	2018-12-01	['#bookreview', '#wrpbks']	mov book show pow hum spirit six month @authormsedrak via @nnp_w_light
1068994666257940482	2018-12-01	['#rom', '#bookreview', '#book']	escap behruz @judymeadows44 unexpect delight via @nnp_w_light
1068987114539442176	2018-12-01	[]	say edit auth via @westofmars
1068979568164462603	2018-12-01	['#bookreview', '#reg', '#romanticsuspens']	aveng hon everyth lady threatened aveng earl lady @alinakfield via @nnp_w_light
1068972015917416448	2018-12-01	['#artemisfowl']	get sneak peek disney artem fowl via @desireeeaglin
1068956916724965377	2018-12-01	['#givingtuesday']	lov environ nj350
1068949366000549889	2018-12-01	['#givingtuesday', '#endalz']	pledg end alzheim
1068934266397048832	2018-12-01	[]	writ man inv christmas via @dla1950
1068919166038609921	2018-12-01	['#toptoypick', '#giftide']	carn play set wood fer wheel petit col via @weidknecht
1068911635946004480	2018-12-01	['#interview', '#historicalfict', '#book']	n light's book heav sit bestsel auth stev mckay @sa_mckay via @nnp_w_light
1068904078208569345	2018-12-01	['#boymom', '#coolkid', '#teenmom']	help son confid person via @wondermomwannab
1068896529359020032	2018-12-01	['#wednesdaywisdom', '#inspir', '#mot']	someth want chang lif via @nnp_w_light
1068881418141474816	2018-12-01	[]	euro yuletid 10 christmas travel tip
1068873869950365697	2018-12-01	[]	wreck ralph break internet famy fun kit fre via @longwait4bella
1068866314838687744	2018-12-01	['#giftguid']	marketplac afric eco friend gift giv back commun
1068858767088001025	2018-12-01	['#giftguid']	stock stuff teen tween boy
1068851232121475072	2018-12-01	['#giftguid']	flex brush perfect stock stuff anyon hair
1068843671674658818	2018-12-01	[]	mak trip austral real adv
1068836112901308416	2018-12-01	[]	bring pretty pintast party feat via @inkscrblr
1068821050316734464	2018-12-01	['#inspir', '#mot']	giv gen know lov peopl strangers via @nnp_w_light
1068805923731316736	2018-12-01	[]	surv emerg kit prep via @longwait4bella
1068798372306399237	2018-12-01	['#amread', '#holidayrom', '#book', '#fridayread']	friday book round up's holiday rom pick season via @nnp_w_light
1068790822789881856	2018-12-01	[]	20 biggest waterfal world contin via @greenglobaltrvl
1068783278159736832	2018-12-01	[]	gift guid song lyr lov via @familyfocusblog
1068768168041160704	2018-12-01	[]	holiday shop tip frug christmas via @wondermomwannab
1068760614137409536	2018-12-01	[]	connect famy easy facebook port via @donnachaffins
1068753065526861826	2018-12-01	[]	poetry thursday 336 snowflak gen via @dla1950
1068745520926113793	2018-12-01	[]	lot trolley bag favorit reus shop bag set via @weidknecht
1068737978569236480	2018-12-01	[]	tak car man depress via @desireeeaglin
1068715320297340928	2018-12-01	[]	quant storey team sony pict consum produc cre first film ful vr book sony pict animation's 'hotel transylvan 3' via @loup_dargent
1068707767744122880	2018-12-01	[]	trunk club collab 'mary poppin returns' bring film's icon costum lif via @loup_dargent
1068700233578790912	2018-12-01	[]	christmas fun fact kid learn via @longwait4bella
1068692666475577344	2018-12-01	[]	nog jewelry giv gift giv back via @weidknecht
1068592132271812609	2018-11-30	['#the']	irv berlin holiday in papermil playh via @havesippy
1068591966374498305	2018-11-30	[]	irv berlin holiday in papermil playh via @havesippy
1068589447866974215	2018-11-30	['#giftguid']	sudar cloth eth mad help wom via @havesippy
1068565921541836801	2018-11-30	[]	12 plu brand mak sustain &amp; eth fash avail every wom
1068337493819498496	2018-11-30	[]	irv berlin's holiday in play go see asap @paper_mill playh millburn nj
1067894164648599569	2018-11-28	[]	story land biggest sal year
1067886610904227845	2018-11-28	[]	boat tip fun famy wat adv
1067879060683087872	2018-11-28	[]	pract approach risk man part 2 understand risk man process via @shellykramer
1067871516216475648	2018-11-28	['#givingtuesday', '#inspir', '#giv', '#char']	today giv via @nnp_w_light
1067863966842585088	2018-11-28	[]	31 easy sheet pan din mak mon via @inkscrblr
1067856428528996358	2018-11-28	['#armen', '#travel', '#urbex']	abandon check unfin hotel near lak sev via @kathmandubeyond
1067844814023077889	2018-11-28	['#giftguid', '#hairc']	flex brush perfect stock stuff anyon hair via @havesippy
1067837832432181248	2018-11-28	['#giftguid']	stock stuff teen tween boy via @havesippy
1067831277846503425	2018-11-28	[]	@ronnkelly3 @libretea pretty
1067830079844102145	2018-11-28	['#giftguid']	marketplac afric eco friend gift giv back commun via @havesippy
1067826214558154753	2018-11-28	[]	knit project idea begin
1067825095450578944	2018-11-28	['#thegrinch']	kid excit
1067818664190230533	2018-11-28	['#getunest']	u twit party
1067811117878206465	2018-11-28	['#itshowyouframeit']	eyebuydirect twit party
1067804208034910208	2018-11-28	[]	euro yuletid 10 christmas travel tip via @havesippy
1067799911972904960	2018-11-28	['#giftguid']	gift act men lif via @havesippy
1067796031599980544	2018-11-28	[]	lov travel lov bag
1067788487934517248	2018-11-28	['#travel']	nemacolin woodland resort getaway
1067777735446147072	2018-11-28	['#barbado', '#visitbarbado', '#lov', '#lovebarbado', '#island', '#beach', '#holiday', '#takemeth', '#beautifulday', '#col', '#beauty', '#experiencehappy', '#happy', '#flow']	nee barbad superm
1067773368118796289	2018-11-28	['#givingtuesday']	am brain tum assocy match don
1067765814277939201	2018-11-28	['#givingtuesday']	ny baykeep cle wat act
1067750712036200448	2018-11-28	['#givingtuesday', '#riverkeep']	upon us think
1067735613124878337	2018-11-28	[]	thing know start surf
1067728062698188801	2018-11-28	['#win', '#sweep']	ent samsung tv bos sound system end 11 via @sonyasparks
1067720513605300224	2018-11-28	[]	heartwarm japanes anim hit 'i want eat pancreas' com u cinema two day via @loup_dargent
1067705428639928320	2018-11-28	[]	eggnog truffl via @wondermomwannab
1067697872337059840	2018-11-28	[]	tip shop onlin via @wondermomwannab
1067690326192721920	2018-11-28	[]	newair 126 bev fridg bring snow via @pbnwhine
1067682771529859072	2018-11-28	[]	ripley's believ 100 year via @pbnwhine
1067675229563031552	2018-11-28	[]	cre us christmas orna via @wondermomwannab
1067652567549792257	2018-11-28	[]	christmas tre hug spruce art tre via @weidknecht
1067645025339756544	2018-11-28	[]	30 challeng healthy via @wondermomwannab
1067637471981305856	2018-11-28	[]	flash gordon feast start thanksg day via @pbnwhine
1067629930161295360	2018-11-28	[]	anoth new list brown topaz 9th an christmas tre work via @kraftymax
1067622374999277568	2018-11-28	[]	9th an christmas bracelet new butterf cre via @kraftymax
1067599730199412736	2018-11-28	[]	stir sunday via @apriljharris
1067592175309991936	2018-11-28	[]	cent univers via @amabaie
1067584627148316673	2018-11-28	['#mucinex', '#coupon', '#cold', '#flu', '#sav']	found tim &amp; weath print via @sonyasparks
1067577079531753472	2018-11-28	['#bookreview', '#newadult', '#comingof']	emot vibr nar homespun charact mak spirit talk book on fion sery must read via @nnp_w_light
1067569534272446464	2018-11-28	['#reg', '#romanticsuspens']	aveng hon everyth lady threatened aveng earl lady award @alinakfield via @nnp_w_light
1067556951301808128	2018-11-27	['#givingtuesday']	today chang liv stud lik josian attend school instead
1067546893104939015	2018-11-27	[]	mus chang autumn via @wanderingeds
1067539323921358848	2018-11-27	[]	way giv back loc commun travel via @wanderingeds
1067531789365841920	2018-11-27	[]	celebr bless hear soul link party via @apriljharris
1067524226716971013	2018-11-27	[]	food dehydr fruit veget meat tray compact afford via @weidknecht
1067511545788329984	2018-11-27	[]	today facebook payp match don mad facebook don go twic far
1067509484220755974	2018-11-27	['#givingtuesday']	don chant mak diff
1067501595007639552	2018-11-27	['#bookreview', '#99cents', '#romanticsuspens']	singl wom doubl lif covert dang mat har sery book @jo_anncarson via @nnp_w_light
1067498826037104640	2018-11-27	['#givingtuesday']	help 350nj continu rais aw urg clim cris demand solv new jersey washington dc glob don
1067494044006264832	2018-11-27	[]	zoic studio opt hor novel snowblind hir writ feat adapt via @loup_dargent
1067486474340306945	2018-11-27	['#review']	whiskw eg mix whiskw bat mix via @weidknecht
1067478926816133120	2018-11-27	['#giftide']	christmas train flo puzzl petit col via @weidknecht
1067471380827029506	2018-11-27	['#pnr', '#bookreview', '#paranormalrom']	good griffin @jc_mckenzie addict doubl shot espresso via @nnp_w_light
1067466408966139905	2018-11-27	['#givingtuesday']	lov environ nj350 via @havesippy
1067462650957836288	2018-11-27	['#givingtuesday', '#endalz']	pledg end alzheim via @havesippy
1067460344619118592	2018-11-27	[]	giv tuesday pleas join @dolphin_project protect dolphin around glob exploit slaugh
1067460313463832577	2018-11-27	['#kitchentalk', '#gourmetgift']	strawberry cranberry homemad jam perfect holiday season via @abrecipes
1067452751834214400	2018-11-27	['#1', '#bookreview', '#fantasy', '#mustread']	mage's tom cry ac duolog @arisaweauthor via @nnp_w_light
1067445200782585856	2018-11-27	['#bookreview', '#yalit', '#sff']	stop read imposs maya's mag adv continu imposs quest mag bon @thedelitroon via @nnp_w_light
1067437656068386816	2018-11-27	['#inspir', '#mot', '#thanksgivingev']	unlock ful lif thank today via @nnp_w_light
1067432676821364738	2018-11-27	[]	want giv gift littl extr mean holiday $10 don help @stjude provid new toy
1067430099253772299	2018-11-27	[]	reebok sal yourflex $24 many via @pbnwhine
1067422978110046208	2018-11-27	['#givingtuesday']	help 350nj continu rais aw urg clim cris demand solv new jersey washington dc glob don
1067422550760800257	2018-11-27	[]	direct robert rodriguez vr film 'the limit' star michel rodriguez feat norm reed avail [trailer included] via @loup_dargent
1067414997704282118	2018-11-27	[]	60% ug via @pbnwhine
1067407459487285248	2018-11-27	['#holidaygiftguid', '#blackfriday', '#cybermonday']	unveil best hom cook gift guid 2018 ded food lov hom chef list via @abrecipes
1067392360303259648	2018-11-27	[]	two new list deep red lim green necklac set ron weasley bookmark 1 bead work peyot bracelet mon septemb tend ros giveaway via @kraftymax
1067384804520411136	2018-11-27	[]	fin jewelry ron weasley bookmark red velvet cop necklac blu goldston necklac work sid peyot bracelet mon sept tend ros giveaway via @kraftymax
1067377257726005248	2018-11-27	[]	new list last week includ on sold already new project peyot bracelet mon sept giveaway win via @kraftymax
1067369698675838976	2018-11-27	[]	fab fal fun giveaway via @kraftymax
1067362157136883712	2018-11-27	[]	lif mov new set kit via @kraftymax
1067354612087308288	2018-11-27	[]	spik dragon new list purpl green win via @kraftymax
1067347065334915072	2018-11-27	[]	fin dragon new project 9th an mon 'catch up' peyot bracelet mon kit via @kraftymax
1067331983385219072	2018-11-27	[]	milit bal christmas tre stil work new list safar jasp via @kraftymax
1067324416172965888	2018-11-27	[]	9th an christmas tre purpl necklac new decemb rememb peyot bracelet box kit via @kraftymax
1067309321673994240	2018-11-27	[]	cyb monday sal new list upd purpl green butterf work via @kraftymax
1067294219121901569	2018-11-27	[]	13 surefir way thrive blog today amongst many blog via @lisapatb
1067286674760183809	2018-11-27	['#iphon', '#shortcut', '#tip']	iphon keyboard shortcut that's surpr many via @wonderoftech
1067279132055224320	2018-11-27	[]	scan slid via @marierleslie
1067256488547295232	2018-11-27	[]	get ready 25 day christmas educ print via @minimasterminds
1067241375622680576	2018-11-27	[]	mot child success gre way keep enco child via @honeyandlimeco
1067233848310882304	2018-11-27	[]	happy thanksg via @pbnwhine
1067226285380898821	2018-11-27	['#mexicancuisin', '#easyrecip']	cranberry tomatillo spicy sals surpr delicy via @abrecipes
1067212067080421376	2018-11-27	[]	biofut platform neith cle green via @rainforestresq
1067211187388145665	2018-11-27	[]	way mak car smel bet &amp; look bet via @salmadinani
1067196095451840514	2018-11-26	[]	tim start think christmas book think littl via @pamlovesbooks
1067180989586292742	2018-11-26	[]	nee know 15 austral travel tip via @wanderingeds
1067165887197777922	2018-11-26	[]	old fash christmas pud recip via @apriljharris
1067158320702767104	2018-11-26	['#diy', '#rest', '#renov', '#shiplap']	farmh mast bedroom renov via @weidknecht
1067153739142828041	2018-11-26	[]	thing know start surf via @havesippy
1067150777532190726	2018-11-26	['#foody', '#breakfast']	sunday morn appl pie fold look spec holiday breakfast try appl pie fold us favorit @missionfoodsus sup soft tortilla via @askchefdennis
1067142349808111618	2018-11-26	['#givingtuesday']	send child school via @havesippy
1067140427734753280	2018-11-26	['#givingtuesday', '#riverkeep']	upon us think via @havesippy
1067139212036751361	2018-11-26	['#givingtuesday']	ny baykeep cle wat act via @havesippy
1067122917736091648	2018-11-26	['#ad']	greg pag origin yellow wiggl new project via @havesippy
1066152719172411394	2018-11-24	['#barbado', '#visitbarbado', '#lov', '#lovebarbado', '#island', '#beach', '#holiday', '#takemeth', '#beautifulday', '#boat', '#oc', '#sea', '#islandl', '#vacationmod']	walk beauty beach barbado
1065263510467301376	2018-11-21	['#givingtuesday']	am brain tum assocy match don via @havesippy
1065260222195949568	2018-11-21	[]	knit project idea begin via @havesippy
1064948038651719680	2018-11-20	[]	nat flow barbado apt nam prid barbado strikingly beauty flow bloom year round island ak dwarf poincian flow
1064847403126325248	2018-11-20	['#sparkwarmthatwalmart']	pumpkin kiss harvest wish fal limit edit glad season fragr
1064847365918597120	2018-11-20	[]	froot loop nev gre sleep wond much adenoid
1064847324877414400	2018-11-20	['#ad']	1st christmas outfit every moth want see baby com hat cut pair
1064847257374208000	2018-11-20	['#socialmed']	get access fre min build brand clar eleg
1064847217633239040	2018-11-20	[]	lov sal sweet try easy world recip feat peanut chocol try pretzel cas
1064847137618489344	2018-11-20	['#subscrib', '#giveaway']	ent @societysocks bold sock soc caus 3 end 10 @smgurusnetwork htt
1064847096031920129	2018-11-20	[]	neptun &amp; co coll &amp; leash set 5 win end 10 doll every produc purchas don dog rescu
1064847048300785664	2018-11-20	[]	talk mak money blog read ask on quest lat mak liv blog
1064623419633881093	2018-11-19	[]	pay back 33 toy us employ op geoffrey's toy box sign petit via @change
1064585865647857668	2018-11-19	[]	insid harrison cav barbado many riv lak waterfal pretty amaz sight easy see nat treas nev put
1063831263000371200	2018-11-17	[]	green monkey groom play outsid harrison cav barbado nat wond act cav clear streams waterfal on barbado miss
1063558169077719040	2018-11-16	['#visitbarbado', '#travel', '#travelingram', '#travelblog', '#fun', '#outdo', '#getoutsid', '#lov', '#lovebarbado']	lat night stroll beauty rockley beach barbado @barbados
1063336384944050176	2018-11-16	['#jetblu']	@brooklynpam @jetblue thank wish car respond stay warm sleep wel
1063335407704842240	2018-11-16	[]	@brooklynpam @jetblue going 15 hour i'm
1063333577901989888	2018-11-16	[]	@jetblue upd
1063333222677921795	2018-11-16	[]	@brooklynpam @jetblue neith nj app nyc flight most tak stil trap runway
1063332891583807488	2018-11-16	[]	@ewrairport sit plan 1606 wait depl ag 14 hour fl airport transf et already plenty gat op can't pul
1063331971777077253	2018-11-16	[]	@brooklynpam @jetblue heard poor par
1063331476681498624	2018-11-16	[]	@brooklynpam @jetblue hop soon stil sit plan feet away airport let us go
1063331283995189248	2018-11-16	[]	@oc_thrift_boys @jetblue anyth exceiv say sorry i'd ut shock
1063329309128044544	2018-11-16	[]	@oc_thrift_boys @jetblue giv anyth say weath sorry ow anyth absolv noth
1063328908416872448	2018-11-16	[]	@brooklynpam @jetblue damn thing 14 hour lat cancel flight i'm stuck runway newark un get plan weath weath pilot tim wel poor plan oth ready etc fault
1063328149059051522	2018-11-16	[]	@jetblue want help help stop tel cal book noth lost tim money keep spend food etc us
1063327789909184512	2018-11-16	[]	@jetblue @havesippy hop help peopl fig sleep help pay &lt;3 jetblu
1063278892818014208	2018-11-16	[]	@jetblue 14 hour fin board 4th flight 14 hour day pilot tim plan jok int driv us ins evil cruel mad stupid mgrs thought wha
1063266389195190272	2018-11-16	['#getunest']	thank party us
1063266297428041733	2018-11-16	['#getunest', '#unestkid']	also rsvp priz com ad
1063266277962199040	2018-11-16	['#getunest', '#unestkid']	p5 grand priz amazon kid tablet arv $100 spons @u_nest_future ad
1063266272769728512	2018-11-16	['#getunest', '#unestkid']	rsvp priz amazon fir tablet arv $50 spons @u_nest_future ad
1063266259113074689	2018-11-16	['#getunest', '#unestkid']	rsvp priz win @david_nikki pleas claim priz ad
1063266246941118464	2018-11-16	['#getunest', '#unestkid']	grand priz win com soon ad
1063266221062266880	2018-11-16	[]	w5 congr @sassthecouponer tweet pic &amp; p5 grand priz pleas claim priz
1063266212698882048	2018-11-16	['#getunest', '#unestkid']	thank join us @u_nest_future ad
1063266206268960770	2018-11-16	['#getunest', '#unestkid']	tweet along @u_nest_future twit ad
1063266199583301632	2018-11-16	['#getunest', '#unestkid']	find @u_nest_future facebook ad
1063266189403725826	2018-11-16	['#getunest', '#unestkid']	follow @u_nest_future instagram ad
1063266185003892736	2018-11-16	['#getunest', '#unestkid']	download @u_nest_future ap iphon ad
1063266175625453568	2018-11-16	[]	ad forget @u_nest_future deposit promot $25 credit everyon would lik op account bet
1063266054712057856	2018-11-16	[]	ad forget @u_nest_future deposit promot $25 credit everyon would lik op account bet
1063266001301762048	2018-11-16	['#getunest', '#unestkid']	p5 shar pic would sav money ad
1063265953558003718	2018-11-16	[]	@heloenterprises @enzasbargains @coolchillmom @havesippy @donnahup @mamasmission thank th party host spo
1063262869675016192	2018-11-16	['#getunest']	@madreblair @blogginmamas @heloenterprises @lorileal1 congr
1063262792298491905	2018-11-16	['#getunest', '#unestkid']	d3a right us sav kid ad
1063262783796625408	2018-11-16	[]	w3 congr @pebbles2000a answ quest &amp; p3 priz pleas claim priz
1063262573460639744	2018-11-16	['#getunest', '#unestkid']	p4 com soon ad
1063262564572938241	2018-11-16	['#getunest', '#unestkid']	p4 best way sav child fut ad
1063262555043446784	2018-11-16	['#getunest', '#unestkid']	p4 priz echo dot kid edit arv $75 spons @u_nest_future ad
1063262541567197185	2018-11-16	['#getunest', '#unestkid']	d4 dream kid fut ad
1063262537494466561	2018-11-16	['#getunest', '#un']	d4a dream kid choos car path allow feel fulfil purpos
1063262504774746113	2018-11-16	[]	w4 congr @lorileal1 answ correct &amp; p4 priz pleas claim priz
1063262495366885377	2018-11-16	['#getunest', '#unestkid']	party fly grand priz quest com soon
1063262241108254720	2018-11-16	[]	lov travel lov bag via @havesippy @go_dashdot
1063261856431775745	2018-11-16	[]	@jetblue we'v rebook day 4x stil ide leav
