id	created_at	hashtags	cleaned_text
1055245312535748608	2018-10-24	[]	freeform's kickoff christmas program ev start novemb via @2kidsandacoupon
1055237769662996481	2018-10-24	[]	mag ram book cov rev ckcbh linky 63 via @ccastleview
1055230209379782656	2018-10-24	['#win', '#sweep']	ent $200 best buy gc end 11 via @sonyasparks
1055200013725458435	2018-10-24	['#holidaygiftguid', '#twokidsgiftidea']	scar fun w breakfast monst min via @2kidsandacoupon
1055192466985492480	2018-10-24	['#hotelt3', '#ad']	enjoy halloween monst movy night via @toughcookiemom
1055184915971620865	2018-10-24	[]	way get feel angry via @circlecast
1055181230168330240	2018-10-24	['#watervillevalley', '#travel', '#newhampshir', '#whitemountain']	fin thought watervil valley resort new hampshir @waterville
1055177034660528128	2018-10-24	[]	watervil valley resort condomin via @youtube
1055168199367503872	2018-10-24	['#travel', '#coconutbaytakeov', '#stlucia']	act volcano st luc
1055168025882738689	2018-10-24	[]	coconut bay's ev entertain via @youtube
1055164937599926273	2018-10-24	[]	soufry volcano st luc via @youtube
1055162264922345472	2018-10-24	['#hgg']	yogurt burst plain yogurt explod strawberry flav @yogurt_burst via @sonyasparks
1055154714936008706	2018-10-24	[]	monday morn coupon includ $2 percil proc laundry soap via @pbnwhine
1055147162663874560	2018-10-24	['#win', '#giveaway']	win ent yogurt burst end 11 via @sonyasparks
1055139618620870656	2018-10-24	['#walmartbeauty', '#lorealp', '#sugarscrubit', '#ic', '#ad']	l par pur scrubs rollback plu ent win $250 @lorealparisusa via @2kidsandacoupon
1055132062397747200	2018-10-24	['#win', '#sweep']	ent 2018 chevrolet silverado 1500 end 11 via @sonyasparks
1055124517390028800	2018-10-24	[]	tuesday food blog it hotpot via @dla1950
1055116965596065793	2018-10-24	['#kid', '#cre']	jumbo magnatab glow dark via @weidknecht
1055109415014141952	2018-10-24	[]	cre autumn snack kid oatm crem pie cooky scarecrow via @longwait4bella
1055101867485786112	2018-10-24	[]	book ticket ungag las vega 2018 via @srpatterson
1055086785896812546	2018-10-24	[]	way prev ang via @circlecast
1055078192481030144	2018-10-24	[]	roto root clog drain via @havesippy
1055071131139563525	2018-10-24	[]	ear mam org new min sunscreen via @havesippy
1055040325750849536	2018-10-24	['#shorthillsmal']	indigo fun funky bookst good stor op ready nj celebr op indigo short hil publ invit
1055018142341193729	2018-10-24	['#newhampshir']	wint yet stil beauty foly seen rid back chair lift view amaz quit trail expl
1054386594407432194	2018-10-22	[]	puget sound energy pse eight mil gallon liqu nat gas lng project threatens tacom nearby puyallup trib glob clim
1054209867156725760	2018-10-22	['#ad']	get @bose @bestbuy
1054137733738835968	2018-10-21	['#travel', '#roadtrip', '#vermont']	@ scen overlook marlboro vt
1053971821232562176	2018-10-21	['#travel', '#roadtrip', '#watervillevalley']	@waterville valley resort town squ watervil valley nh
1053488364987564033	2018-10-20	['#globalcit']	cal world lead priorit sanit hygy
1053316030477557760	2018-10-19	[]	cheap thing amsterdam via @havesippy
1052637536181477378	2018-10-17	['#endalz']	walk end alzheimer's via @havesippy
1052636139654455296	2018-10-17	['#walk2endalz']	sign walk end alzheimer's start team don today
1052632055538958342	2018-10-17	['#endalz']	expl innov resid opt person alzheimer's diseas via @havesippy
1052631974337269761	2018-10-17	[]	expl innov resid opt person alzheimer's diseas via @havesippy
1052624210781200384	2018-10-17	[]	earn retweet badg disney ic mickey's search party
1052553731043184640	2018-10-17	['#stopline3']	lin pipelin would devast clim threaten indig commun poison mississipp riv tel @govmarkdayton leav off submit
1052517350073884672	2018-10-17	['#thestormrun', '#ad']	teen lov storm run @readriordan via @toughcookiemom
1052510704501047296	2018-10-17	[]	view poolsid cbay_stlucia coconut bay resort st luc noth sneez everywh look anoth shad blu alway hard peel kid partn
1052509799617835013	2018-10-17	['#marchofdim']	join heal togeth
1052502251330330624	2018-10-17	['#coupon']	print $200 fresh long list via @sonyasparks
1052487149440983040	2018-10-17	[]	doll tre loyal program i'm via @pbnwhine
1052479602344546304	2018-10-17	[]	feat new book spotlight sak hon seek past book 2 amy valentin via @westofmars
1052472064886616064	2018-10-17	[]	travel world thoma &amp; friend
1052456951764926464	2018-10-17	[]	gift lif marrow reg step lif 5k run &amp; walk battery park sunday
1052449402118377472	2018-10-17	[]	fal leaf sens bin part leaf scaveng hunt act baby toddl via @debchitwood
1052441855193993217	2018-10-17	[]	six fair trad coff company got try via @familyfocusblog
1052426768005640193	2018-10-17	['#win', '#giveaway']	ent deenk 3 robot vacu cle $230 rv end 11 via @sonyasparks
1052411669417263105	2018-10-17	['#rom', '#coverrev']	cov rev upon kiss @rtamayo2004 @fosterembry_pub revers fairy tal via @nnp_w_light
1052404109800853505	2018-10-17	['#historicalrom', '#reg']	rhapsody rebel award auth @aubreywynne51 via @nnp_w_light
1052389014182002689	2018-10-17	['#ad']	entertain kid stuck indo via @2kidsandacoupon
1052381457556168704	2018-10-17	['#bookreview', '#romanticsuspens', '#rom']	an wom consum consum new york tim bestsel @jrward1 via @nnp_w_light
1052376006215065600	2018-10-17	['#ad']	googl chromecast streaming med play @bestbuy @madebygoogle via @havesippy
1052374006404472834	2018-10-17	['#ad']	stream favorit entertain tv famy dev @bestbuy @madebygoogle
1052373928600059904	2018-10-17	[]	giveaway via @pbnwhine
1052358809891598337	2018-10-17	[]	mak lif bet mak conscy cho via @harleenas
1052351250703032320	2018-10-17	[]	relay phon altern childr
1052346117508255745	2018-10-16	[]	i'm indigo short hil short hil nj
1052343702629376001	2018-10-16	[]	produc hom lov
1052336150021582849	2018-10-16	[]	way pack efficy weekend trip
1052328602367348736	2018-10-16	[]	learn loan thing consid tak travel loan
1052313513908162560	2018-10-16	[]	relay smartphon altern childr
1052305964114866176	2018-10-16	[]	duck tap cre
1052298408604643335	2018-10-16	[]	thing rememb furn bedroom
1052290872933576704	2018-10-16	[]	kid renov idea perfect bas
1052283315187838976	2018-10-16	[]	tak tour oldest resta germany
1052268209712312324	2018-10-16	['#eggbaby']	twit party
1052266200867237888	2018-10-16	[]	choos best wint jacket via @havesippy
1052260655967932416	2018-10-16	['#britaxmom']	go britax stroller
1052253116232548353	2018-10-16	[]	com support gift lif marrow reg 5k
1052238056160485381	2018-10-16	[]	muk luk women's count sheep grac slip $24 fre ship $44 via @onemommasavingm
1052230468232511488	2018-10-16	[]	boo la zoo via @desireeeaglin
1052222915813535745	2018-10-16	['#stress', '#mot', '#mondayblog']	feel frazzl tak deep brea indulg bath via @nnp_w_light
1052215369572728832	2018-10-16	[]	new bal kid you sho $22 $1 ship $49 via @onemommasavingm
1052207808874196992	2018-10-16	['#sparklewithgain', '#ilovegain', '#ad']	new money sav coupon gain fresh wat sparkl doll gen via @2kidsandacoupon
1052192710218706944	2018-10-16	['#stylest']	40% flannel fre ship via @onemommasavingm
1052187025829494784	2018-10-16	[]	earn lik badg disney ic mickey's search party
1052185162455441408	2018-10-16	[]	declut hom sav money via @2kidsandacoupon
1052179688079032321	2018-10-16	[]	best cop ibd vac tip help ens vac enjoy via @havesippy
1052177603896008705	2018-10-16	[]	doct jody whittak excel inspir bbc's tim lord via @loup_dargent
1052170058355695616	2018-10-16	['#ad', '#crestsmil']	match mad toothpast aisl sav $2 @crest via @2kidsandacoupon
1052162509250154496	2018-10-16	['#covergirl', '#makeup', '#coupon', '#sav']	found today print via @sonyasparks
1052147407771840512	2018-10-16	['#bookreview', '#historicalrom']	marquess return @alannalucas27 stun rom seep mystery treachery via @nnp_w_light
1052139858892865536	2018-10-16	['#scif', '#scifirom', '#amread']	meet us today bestsel auth @vscotttheauthor discov many read lik mrs n lov book via @nnp_w_light
1052132308646617088	2018-10-16	['#inspir', '#canadianthanksg', '#grat']	thanksg on n light's favourit day year here's via @nnp_w_light
1052117204815220736	2018-10-16	[]	spooky fun octob shop swago board via @sonyasparks
1052109655885910016	2018-10-16	[]	ang strength via @circlecast
1052094560988475392	2018-10-16	[]	precy mom perfect gift dec fal via @weidknecht
1052087017151090688	2018-10-16	['#coupon', '#pet', '#sav']	print rachel ray food via @sonyasparks
1052071909217710081	2018-10-16	['#parentingtip', '#par', '#screentime', '#tech', '#kidsact']	much screen tim par tip tech smart liv via @mamasmiles
1052056817944145921	2018-10-16	[]	lov beach via @pbnwhine
1052049266737332224	2018-10-16	['#timetravel', '#rom', '#historicalfict']	book heav wednesday pres palac star karin mcroberts @gaklari via @nnp_w_light
1052034163275116545	2018-10-16	[]	ang com via @circlecast
1052026619181838341	2018-10-16	['#kind', '#wednesdaywisdom', '#inspir']	extend kind everyon meet lif nev via @nnp_w_light
1052019073058517001	2018-10-16	['#brexit']	ask brit publ kind want norway model clear win via @loup_dargent
1052003975460020224	2018-10-16	['#hor', '#bookboost', '#fridayread']	spooky octob spotlight nightm nor @kwilkinsauthor via @nnp_w_light
1051996428753625095	2018-10-16	['#newadult', '#book', '#fict', '#fantasy', '#rom']	friday book round feat eight bing via @nnp_w_light
1051981321759838209	2018-10-15	['#twomilksinapod', '#collectivebia', '#ad']	get two fairl produc $6 peapod via @2kidsandacoupon
1051966222420639744	2018-10-15	[]	i've got coupon johnson's 8'oclock coff via @pbnwhine
1051958662741327872	2018-10-15	['#pledgepaperless']	scriptation launch campaign vancouv intern film fest via @loup_dargent
1051951121110102016	2018-10-15	['#mgtab']	moos mug @mimisgang1 via @mimibarbour
1051936027424776193	2018-10-15	['#coupon', '#sav']	found new york bakery texa toast print via @sonyasparks
1051922477599916032	2018-10-15	['#stopsuicid']	2018 dark walk via @havesippy
1051921266511400960	2018-10-15	[]	i'm support am found suicid prev via @donordrive
1051920913128726529	2018-10-15	['#win', '#giveaway']	lucky defens alert dev $130 end 11 via @sonyasparks
1051913355777241093	2018-10-15	['#win', '#sweep']	1000 ent $25 amazon gc end 12 via @sonyasparks
1051905817262387200	2018-10-15	[]	muse sci boston celebr charl hayd planetarium's 60th annivers releas new film via @loup_dargent
1051901240437866496	2018-10-15	[]	win barby dol &amp; swimmin' pup pool wel ap gam cod via @havesippy
1051898281318584320	2018-10-15	[]	giveaway ultim person protect via @pbnwhine
1051894452837646336	2018-10-15	['#contest', '#nedo']	win ticket join fun @disneyonice pres mickey's search party
1051889137211645952	2018-10-15	[]	i'm rais fund support wwf mak don help protect wild anim &amp; habit
1051881233544896513	2018-10-15	['#nicaragu']	many food insec quest saf fright real due polit unrest con
1051877428732284929	2018-10-15	['#freespeech']	tak act stop new law crush protest washington sav fre speech us @thepcjf's easy us com submit system reg form opposit urg lat
1051874559518003201	2018-10-15	[]	pink torch ging filt @diamondstlucia diamond bot gard st luc mean ev say plant gard absolv stun many
1051858595673976833	2018-10-15	[]	today glob handwash day estim wash hand soap wat reduc diarrh death 5
1051858579895046146	2018-10-15	[]	friday octob 5th world teacher's day we'r celebr week long shar teach around worl
1051857849150668800	2018-10-15	['#marchofdim']	join heal togeth via @havesippy
1051852347645853696	2018-10-15	[]	support fundra march dim
1050986509355094016	2018-10-13	[]	poetry thursday 329 anglo saxon gav us poetry via @dla1950
1050978958018310144	2018-10-13	['#petsinspac', '#scifirom', '#newreleas']	sergeant's unus pet wild card sav doom op ark pet spac 3 @paulinebjones via @nnp_w_light
1050963867264851968	2018-10-13	[]	montessor art hist resourc preschool el {art mus bundl 75% oct 16} via @debchitwood
1050956304175501312	2018-10-13	['#giveaway', '#mammamia2']	mamm mia go via @onemommasavingm
1050941208695099392	2018-10-13	['#mystery', '#basebal', '#bookboost']	murd basebal naz gam six judy bruc via @nnp_w_light
1050933659270832129	2018-10-13	[]	hippy cult surv rachel israel releas 'counterculture crossover' tel untold story lov israel famy via @loup_dargent
1050926112765870081	2018-10-13	[]	enemy hum rac high explod rev thought book henry balogun via @loup_dargent
1050918559398993920	2018-10-13	['#kindl']	amazon first read fre book $4 valu prim memb via @onemommasavingm
1050911011388252160	2018-10-13	[]	23rd an irvin park railroad christmas train giveaway via @desireeeaglin
1050895912464261120	2018-10-12	['#lovelittlebit', '#hotelt3', '#spons']	get fre hotel transylvan bag entenman plu $25 giveaway via @2kidsandacoupon
1050880810260279296	2018-10-12	[]	uncov best wordpress sec plugin via @srpatterson
1050873270923419649	2018-10-12	['#giftide', '#kid']	myland fir truck light sound via @weidknecht
1050865710652686336	2018-10-12	['#sav', '#coupon']	let's much today print via @sonyasparks
1050858164038656001	2018-10-12	[]	us shoph med connect brand shop via @sonyasparks
1050850619383341056	2018-10-12	[]	sav money cut cord googl chromecast via @desireeeaglin
1050843063411757056	2018-10-12	['#antmanandthewasp']	disney's ant wasp blu 4k ultr hd 10 via @onemommasavingm
1050827957311348736	2018-10-12	[]	wonky donkey paperback $6 via @onemommasavingm
1050812864435539970	2018-10-12	['#mgtab']	keep christmas mat @mimisgang1 via @mimibarbour
1050797760243490817	2018-10-12	['#inspir', '#thursdaythought']	champ see big pict via @nnp_w_light
1050790213402943488	2018-10-12	[]	fre firefight cut strips montessor inst download via @debchitwood
1050782667376156678	2018-10-12	[]	thing expery leav job go freel via @pbnwhine
1050775109819138048	2018-10-12	['#livep', '#purefragranceco', '#ad']	allergy friend hom fragr produc pur fragr co via @2kidsandacoupon
1050773586569560065	2018-10-12	['#britaxmom']	go britax stroller via @havesippy
1050770277464977408	2018-10-12	[]	com support gift lif marrow reg 5k via @havesippy
1050767557777649665	2018-10-12	['#sav', '#coupon']	let's much today print via @sonyasparks
1050763346285420544	2018-10-12	[]	gift lif marrow reg step lif 5k run &amp; walk battery park sunday via @havesippy
1050760018767867913	2018-10-12	[]	three way control ang via @circlecast
1050694641731989504	2018-10-12	[]	can't imagin get us view lik st luc col beach greenery architect wildl noth afraid stand
1050098158498385920	2018-10-10	['#holidaygiftguid', '#twokidsgiftidea']	sav bel complet collect via @2kidsandacoupon
1050090608554053632	2018-10-10	[]	via @pbnwhine
1050083065538727936	2018-10-10	['#adventureswithteddy', '#sweepstak', '#ad']	sav teddy graham outdo discovery win w @walmart via @2kidsandacoupon
1050075512033501184	2018-10-10	[]	teach self confid wish via @desireeeaglin
1050067962391158795	2018-10-10	[]	wom go cyc every day via @pbnwhine
1050060402925727744	2018-10-10	['#greatsandwich', '#oscarmay', '#delifresh', '#spons']	washington appl ham sandwich via @2kidsandacoupon
1050052858069114880	2018-10-10	['#ad']	cut cord cabl tv w chromecast @madebygoogle @bestbuy via @2kidsandacoupon
1050045305566257152	2018-10-10	['#ad', '#askforargo', '#argocornstarch', '#recipeinspo']	famy lov sit stir fri pork ho fun noodl din week try easy mak recip tonight &gt; via @askchefdennis
1050030216960200704	2018-10-10	['#mind', '#selfc']	lif hit fan turn via @jfouts
1050010622266671104	2018-10-10	['#eggbaby']	twit party via @havesippy
1050004905652617218	2018-10-10	['#coconutbay']	beauty night cbay_stlucia coconut bay st luc on thi wed spot addit us way filt pretty
1049877710586241025	2018-10-10	['#amread', '#hor', '#paranorm', '#halloween']	mr n's eight spooky book read halloween via @nnp_w_light
1049862605316247552	2018-10-10	['#mammam']	mamm mia go com hom digit blu dvd plu win cop via @2kidsandacoupon
1049855066759421952	2018-10-10	[]	10 best food help build musc nat via @harleenas
1049847507344330753	2018-10-10	[]	canva champ giveaway win 16 20 canva via @pbnwhine
1049842696683171840	2018-10-10	['#eggbaby']	thank tweet
1049840388633231360	2018-10-10	['#eggbaby']	@heloenterprises @blogginmamas littl middl on suuuup fun ag lol
1049840015696699392	2018-10-10	[]	w4 congr @angie_rm22 answ correct &amp; p4 priz pleas claim priz
1049840003101151232	2018-10-10	[]	p4 answ inspir nam eg inspir child gre pot eg might look
1049839990841065472	2018-10-10	['#eggbaby']	p5 shar pic littl on bel littl on ad
1049839973833342976	2018-10-10	['#eggbaby']	p5 grand priz $100 @eggbysusanlazar gift cod ad
1049839945467265025	2018-10-10	[]	max list gift idea sav bel fan via @momfindsout
1049838435958177798	2018-10-10	['#eggbaby']	p4 inspir nam eg hint ad
1049838373240750081	2018-10-10	['#eggbaby']	d4 favorit gend neut nam ad
1049838263329021957	2018-10-10	['#eggbaby']	@smile4toy99 @heloenterprises @eggbysusanlazar good luck
1049838215186780160	2018-10-10	['#eggbaby']	good luck
1049838198422204417	2018-10-10	[]	@heloenterprises a4 nam eg inspir child's gre pot eg might look outsid
1049838060706381825	2018-10-10	['#eggbaby']	@sherrybracy @mamasmission @beautifullypoor @bbabushka @heloenterprises @blogginmamas @joovy agr amaz deal found
1049837903998853121	2018-10-10	['#eggbaby']	@heloenterprises @blogginmamas lov ad
1049837886470795266	2018-10-10	['#eggbaby']	p4 priz $75 @eggbysusanlazar gift cod ad
1049836155552829440	2018-10-10	[]	d3a ye i've gon baby show ev birthday party know child's gend tend
1049836107599413248	2018-10-10	['#eggbaby']	p3 would us gift card get idea ad ad
1049836095570100230	2018-10-10	['#eggbaby']	p3 priz $50 @eggbysusanlazar gift cod ad
1049836080734846976	2018-10-10	[]	d3 ev buy gend neut baby gift expery lik @eggbysusanlazar
1049836069385109504	2018-10-10	[]	w3 congr @crystalnapier answ quest &amp; p3 priz pleas claim priz
1049835962048614401	2018-10-10	['#eggbaby']	@beautifullypoor @momluvssportz @heloenterprises @blogginmamas man infl pay sur gott sav wherev
1049835116367876099	2018-10-10	['#eggbaby']	@beautifullypoor @momluvssportz @heloenterprises @blogginmamas sav money alway goal
1049834910108790784	2018-10-10	['#eggbaby']	@beautifullypoor @momluvssportz @heloenterprises @blogginmamas kid thi alway grow
1049834767716413440	2018-10-10	['#hangry', '#eggbaby']	@coleyx3 @enzasbargains @mamasmission @coolchillmom @jamiejamiemay @heloenterprises @donnahup ooooo nic i'm think popchip pumpkin bread
1049834120581443584	2018-10-10	['#eggbaby']	@enzasbargains @mamasmission @coolchillmom @jamiejamiemay @heloenterprises @donnahup i'm uggghhhh
1049833999009497088	2018-10-10	['#eggbaby']	@beautifullypoor @momluvssportz @heloenterprises @blogginmamas grow second
1049833918587985921	2018-10-10	['#eggbaby']	@momluvssportz @heloenterprises @blogginmamas sav much money kid's cloth expend
1049833908802674688	2018-10-10	['#eggbaby']	@heloenterprises @blogginmamas hand down wond
1049833886140776450	2018-10-10	['#eggbaby']	@heloenterprises kid middl tornado lol noth mak past
1049833666480918528	2018-10-10	['#eggbaby']	p2 priz $25 @eggbysusanlazar gift cod ad
1049833654371971072	2018-10-10	[]	d2 on child gre pass along cloth gear mat
1049833633022955523	2018-10-10	['#eggbaby']	d2a 2 struggled find gend neut stuff shar two ad
1049833623053058048	2018-10-10	['#eggbaby']	w2 congr @marbb05 p2 priz pleas claim priz ad
1049833585526657024	2018-10-10	['#eggbaby']	toooooo
1049833468660715527	2018-10-10	['#hangry', '#eggbaby']	@mamasmission @coolchillmom @jamiejamiemay @enzasbargains @heloenterprises @donnahup right anyth lol
1049832396907061249	2018-10-10	['#win', '#sweep']	ent roku premy play end 11 via @sonyasparks
1049832038768017408	2018-10-10	['#eggbaby']	@coolchillmom @jamiejamiemay @enzasbargains @heloenterprises @donnahup @mamasmission annnnnnnd i'm hungry lol
1049831894211276800	2018-10-10	[]	thank pleas rememb rsvp ad
1049831868248539137	2018-10-10	[]	p2 fil blank besid cloth sho gift cert ______ avail @eggbysusanlazar
1049831846538829824	2018-10-10	['#eggbaby']	join @blogginmamas tuesday 10 9p et twit party gend neut baby show spons
1049831782395404288	2018-10-10	['#eggbaby']	oh em gee look found sal also com siz @heloenterprises ad
1049831751386845185	2018-10-10	[]	w1 congr @summer0001 rt mess &amp; p1 priz pleas claim priz
1049831660777328640	2018-10-10	['#eggbaby']	@jamiejamiemay @coolchillmom @heloenterprises @enzasbargains @donnahup @mamasmission cut &lt;3
1049831490824167424	2018-10-10	[]	@jamiejamiemay @havesippy @coolchillmom @heloenterprises @donnahup @mamasmission pleas send donut
1049831471178018816	2018-10-10	['#eggbaby']	@enzasbargains @havesippy @coolchillmom @heloenterprises @donnahup @mamasmission best
1049831444456050689	2018-10-10	['#eggbaby']	@jamiejamiemay @enzasbargains @coolchillmom @heloenterprises @donnahup @mamasmission get doughnut lol
1049830350564859904	2018-10-10	['#eggbaby']	p1 priz $25 @eggbysusanlazar gift cod ad
1049830343828824064	2018-10-10	['#eggbaby']	wow gre start ad
1049830333053579264	2018-10-10	['#eggbaby']	d1 want keep baby gend surpr dying find shar ad
1049830286257741824	2018-10-10	['#eg']	@havesippy @jamiejamiemay @heloenterprises @enzasbargains @donnahup @mamasmission ye show mom twit
1049830240539820034	2018-10-10	['#eggbaby']	@jamiejamiemay @coolchillmom @heloenterprises @enzasbargains @donnahup @mamasmission lol thank smal thing
1049830063989039105	2018-10-10	['#eggbaby']	@jamiejamiemay @coolchillmom @heloenterprises @enzasbargains @donnahup @mamasmission cut show us
1049829937216188417	2018-10-10	[]	@jamiejamiemay @havesippy @heloenterprises @enzasbargains @donnahup @mamasmission sweet wish could see mom'
1049829264567226368	2018-10-10	['#eggbaby']	@jamiejamiemay @coolchillmom @heloenterprises @enzasbargains @donnahup @mamasmission secret lol
1049829090461671426	2018-10-10	['#eggbaby']	rsvp rul &amp; priz ad
1049829059046334465	2018-10-10	['#eggbaby']	priz win annount @blogginmamas ad
1049829014045712386	2018-10-10	['#eggbaby']	@heloenterprises ready answ ad
1049828994672156672	2018-10-10	[]	rt win @eggbysusanlazar launch new gend neut lin baby cloth &amp; toy visit
1049828805039276032	2018-10-10	['#eggbaby']	@jamiejamiemay @heloenterprises @enzasbargains @coolchillmom @donnahup @mamasmission aw cut due
1049828667445170176	2018-10-10	['#eggbaby']	hello
1049828601426796544	2018-10-10	['#eggbaby']	@babysavers @enzasbargains @heloenterprises @coolchillmom @donnahup @mamasmission first many hop lol
1049827911782596608	2018-10-10	['#eggbaby']	@tina3c good luck
1049827839581855744	2018-10-10	['#eggbaby']	@beautifullypoor @heloenterprises @enzasbargains @coolchillmom @donnahup @mamasmission good luck
1049827752222822401	2018-10-10	['#eggbaby']	cutest lol
1049827640981491713	2018-10-10	['#eggbaby']	co today @enzasbargains @coolchillmom @havesippy @donnahup @coolchillmom @mamasmission ad
1049827601039142913	2018-10-10	['#eggbaby']	@minionmommy2be @heloenterprises @enzasbargains @coolchillmom @donnahup @mamasmission helooooo ready get tweet
1049827340958818304	2018-10-10	['#eggbaby']	ready get thi tweet
1049827152257015808	2018-10-10	[]	@coleyx3 mee tooooo lol
1049825099443003394	2018-10-10	['#eggbaby']	join 10 min 9pm est
1049824969465745409	2018-10-10	['#eggbaby']	join us littl 9p et twit party gend neut baby show spons @eggbysu
1049824881184034816	2018-10-10	['#eggbaby']	almost tim twit party ad
1049817310322679808	2018-10-10	[]	sunday remodel upd via @pbnwhine
1049802210245263360	2018-10-09	['#romanticsuspens', '#newreleas']	ghost past want man fut haunt heart kimb dean @kdean_writer via @nnp_w_light
1049794657746587654	2018-10-09	[]	fun dat idea teen via @wondermomwannab
1049787114404098050	2018-10-09	['#inspir', '#wednesdaywisdom']	risk tak heart tug someplac new go via @nnp_w_light
1049777778382520320	2018-10-09	[]	@gopro wait pleas assist ty
1049772011193544704	2018-10-09	[]	class tiramisu recip easy step step tut via @askchefdennis
1049756905583910912	2018-10-09	['#historicalfict', '#netgalley', '#bookreview']	kennedy debut @kerrimaherbooks via @nnp_w_light
1049749359011778560	2018-10-09	[]	poetry thursday 328 difficult word via @dla1950
1049742081453899777	2018-10-09	['#contest', '#nedo']	win ticket @disneyonice pres mickey's search party
1049734256988233729	2018-10-09	['#kind', '#inspir', '#thursdaythought']	last tim show without ask anyth return via @nnp_w_light
1049726717261176832	2018-10-09	[]	fre baby sign langu video {signs songs} via @debchitwood
1049711656266293249	2018-10-09	['#holidaygiftguid', '#twokidsgiftidea']	famy fun suspens tumbal via @2kidsandacoupon
1049704091562233856	2018-10-09	[]	study abroad london expery start fin via @wanderingeds
1049696523372642304	2018-10-09	['#holidaygiftguid', '#twokidsgiftidea']	put search skil test w spy dig via @2kidsandacoupon
1049688973906518018	2018-10-09	[]	ug christmas swe giveaway tim via @pbnwhine
1049681402747396099	2018-10-09	['#sav', '#coupon']	let's much today print via @sonyasparks
1049673853084069888	2018-10-09	['#204']	breast cant aw hm via @momfindsout
1049666312002265088	2018-10-09	['#hor', '#fantasy', '#bookreview', '#vampir', '#fridayread']	war nytefal lost @cyallowitz blend via @nnp_w_light
1049658756513050624	2018-10-09	['#historicalfict', '#bookreview', '#iartg']	best book sery du lac prophecy award @maryanneyarde via @nnp_w_light
1049651217268391936	2018-10-09	[]	protect priv onlin via @wondermomwannab
1049643662672564225	2018-10-09	['#fridayfeel', '#inspir', '#grat']	grat spread gratitud far wid via @nnp_w_light
1049636100241797121	2018-10-09	['#win', '#sweep']	new octob @radioflyer produc every day end 10 via @sonyasparks
1049628556639301633	2018-10-09	[]	top money mak method mak extr money via @harleenas
1049613458185089024	2018-10-09	['#sew', '#kidsact', '#tosew', '#handsew']	begin hand sew project kid via @mamasmiles
1049605914800640001	2018-10-09	[]	salmon broccol stir fry recip via @apriljharris
1049598354664112129	2018-10-09	['#eucerin', '#coupon', '#sav']	found today print via @sonyasparks
