id	created_at	hashtags	cleaned_text
1092487621857763335	2019-02-04	[]	monu valley navajo trib park arizon
1092487601985069059	2019-02-04	[]	@cherubnation @dianned03113533 @wiergeezy @reikiarthur @alvinlindsay21 @kvajpayaee @hyapatialee @antwanturman @donnafins
1092487577599442944	2019-02-04	['#tatteredcov', '#greatread']	jen &amp; colton brand &amp; mat zan non dram pop girl book stor denv
1092487566975295488	2019-02-04	[]	want let word know get auth upro pag today @earthdesires @authoruproar
1092487508481507333	2019-02-04	[]	
1092487480811679745	2019-02-04	['#superbowlsunday']	someon today
1092487461702434818	2019-02-04	['#lieb', '#debk']	neuerscheinung klara such nach der wahrheit auch wen dies al ver wird
1092487452407881728	2019-02-04	[]	
1092487443335524352	2019-02-04	['#sundaysong']	bit feel self many tox 'friends' ad neg lif @bonjovi
1092487403401609216	2019-02-04	['#nat', '#environ']	
1092487378650963971	2019-02-04	['#iartg', '#histf', '#rom', '#amazon', '#bests']	best sel act adv sery set rom britain fre kindl unlimit
1092487364117696514	2019-02-04	['#superbowlsunday']	kiddo pass chick wing tradit footbal far germ roulad lol
1092487339757264896	2019-02-04	[]	welcom wond world possumland long abl resist charm marsup warn
1092487316386562048	2019-02-04	['#superbowl', '#mag']	want escap div world adv act legend windem warlord
1092487291304595458	2019-02-04	['#wattpad', '#freeread', '#epicfantasy', '#comingof']	chapt 22 sword flam forg liv
1092487266344292352	2019-02-04	['#asmsg', '#rrbc', '#iartg', '#fre']	read gr8 book 2nite read kindleunlimit
1092487212351082507	2019-02-04	['#ian1', '#iartg', '#asm']	'moral infidel combin rom scand mystery 'moral infidelity' @rjiltonwarner
1092487168533188609	2019-02-04	['#happybirthday']	lov @oprah don much kind divers lov world
1092487140288671745	2019-02-04	[]	3am alarm goe bolt bed ruaaaaaahhhh let prim scream beat chest f
1092487130213957632	2019-02-04	[]	check audiobook nar act tom hiddleston @twhiddleston jam bond octopussy
1092487082256330753	2019-02-04	['#paperback', '#authorupro', '#bookboost']	short story collect avail
1092486979697156096	2019-02-04	['#worldcancerday']	today rememb lost battl support fight battl commemo
1092486969685356544	2019-02-04	[]	cal mr big lebowsk
1092486953038200833	2019-02-04	[]	dear friend fight lif rar form cant see many campaign rais fund
1092486927520055296	2019-02-04	['#5star', '#infinitest', '#sci']	check @virginia_wright's review chronicles book on liv pick cop today
1092486854316838916	2019-02-04	['#book', '#novel', '#fict']	feast day ian mackenzy us uk
1092486726134784001	2019-02-04	['#cust']	upr sioux begin littl bighorn riv
1092486717989416966	2019-02-04	[]	brok violin mb tos begin sery lif &amp; fai ear americ
1092486701820334080	2019-02-04	['#historicalfict', '#mystery', '#thriller', '#noir']	bet plac expery nightm ship dream
1092486686506913792	2019-02-04	['#sery', '#fanta']	broth king warry sery 1 sandr yearm via @amazon
1092486678177038336	2019-02-04	['#sery', '#fantasy', '#amread']	armad dead kingdom betray sandr yearm via @amazon
1092486590168027136	2019-02-04	[]	audiobook fastest seg publ
1092486569532030976	2019-02-04	[]	strained rel jacky kennedy sist princess lee radziwil detail l
1092486507208806400	2019-02-04	[]	off ful rang serv @jbboats day boat hir holiday rent cot marin upholstery &amp; canopy's engin
1092486498044256258	2019-02-04	['#london', '#urb', '#landscap', '#city', '#paint']	london nat gallery wint
1092486476250693632	2019-02-04	['#zen', '#uk', '#asmsg', '#asmr', '#mind', '#healtolovetol', '#daretoloveyourl']	lik sing
1092486465836236805	2019-02-04	['#fre', '#swordandsorcery', '#giveaway', '#kindl', '#fantasy', '#mybook']	book ep
1092486450959077376	2019-02-04	['#rrbc', '#ebook']	'the dinosa farm' mdheitkemper kidsbook juvenilebook childrensbook iartg ian1 asmsg book ki
1092486401222942721	2019-02-04	['#tatteredcov', '#greatread']	jen &amp; colton brand &amp; mat zan non dram pop girl book stor denv
1092486379295174656	2019-02-04	"[""#enricogarff's"", '#paint', '#artowrk']"	watch @youtube new breathtak slideshow &amp; superb accompany mesm
1092486319530479623	2019-02-04	['#fit', '#workingout', '#swe', '#bodybuild', '#weightlift', '#swol', '#run', '#crossfit', '#nopainnogain', '#gyml', '#pt', '#coach', '#tra']	
1092486311204847617	2019-02-04	[]	screenplay produc wond team poison pict read book see film lat
1092486292271783936	2019-02-04	[]	cov rev mag vodk wardrob book 3 avail next week phew madcap mayhem mus girl
1092486115980992513	2019-02-04	[]	pin shop pin silverpl demitass spoon brittany ros pattern fascin silverpl wm
1092486044468084738	2019-02-04	['#fantasy', '#urb']	wit awak miao bodhisattv just read miao awak amazon ht
1092485964381982720	2019-02-04	[]	12 wins &amp; newton promark set doubl end tip fin broad nib art craft via @ebay_uk
1092485825349255168	2019-02-04	['#mondaymotivaton']	simply enough tim abl read amount book would lik get
1092485721422790657	2019-02-04	[]	mediev triv pavil nam giv round mediev tent altern col hous knight
1092485712748994560	2019-02-04	[]	ow mul new thriller today 28th jan 6th novel lik oth bril find
1092485704888799233	2019-02-04	[]	check found whit genuin sou sea pearl ear 10 mm aa new via @ebay_uk
1092485696739311618	2019-02-04	[]	âš¡ï¸ funny fright touch aud combin fantasy real evil
1092485659686825984	2019-02-04	['#shortst', '#novella', '#novel']	two collect heat heart kindl unlimit
1092485659674185728	2019-02-04	['#rt', '#cre', '#tal']	interview carol mar phip includ spec annount
1092485640208424961	2019-02-04	[]	'an inspir book family's attempt heal deep wound car wom alzheim
1092485626031689730	2019-02-04	['#review', '#kinnar', '#phuk']	106 myth cre wait forg sea near tour beach
1092485539557769217	2019-02-04	['#pottiteam']	vint pierc pastel rhineston triangl ear
1092485516799459334	2019-02-04	['#etsymn']	valentine's day wed togeth forev lov metal red heart ring pillow via @etsy
1092485495249088512	2019-02-04	[]	soviet chess set big wood chess soviet russ vint ussr wood chess piec tourna chess board 17 russ
1092485473023479815	2019-02-04	[]	check vint mus box virgin mary sculpt lady fatim religy fig via @ebay
1092485442765762561	2019-02-04	[]	myst un big goth pend portrait lady hom dec ant bronz met whit handmad cameo desk ornam
1092485419067949057	2019-02-04	[]	rt @lemicheleyoung purpl rhineston brooch lilac light purpl ring pin heart scrolls vint gold ton
1092485394401316865	2019-02-04	['#aurorab', '#ab', '#rhineston', '#ear', '#etsy']	feminin ( marlosmarvelousfind shop enh every col
1092485372381220864	2019-02-04	[]	dragonf necklac dragonf jewelry insect jewelry gift 50 whims jewelry gold acc bead trendy neckl
1092485351250321409	2019-02-04	['#black', '#jacket', '#wed', '#bolero', '#knit', '#bridesmaid', '#shrug', '#mohair', '#swe', '#dress', '#coverup', '#ev', '#cap', '#weddingjacket']	
1092485340235993088	2019-02-04	['#vint', '#vogueteam', '#jewelry']	monet faux pearl rhineston pierc ear s42
1092485332342317056	2019-02-04	[]	vint art deco virgin mary child sacr heart jes alumin gold ton religy med pend
1092485298058133511	2019-02-04	['#porcelain', '#vas', '#ant', '#royalbon']	check roy bon bud cream gold flow franz anton mehlem
1092485267666227201	2019-02-04	[]	lov air sal 50% gift every ord end 16 heart ear on kin
1092485237194530816	2019-02-04	['#wed', '#shrug', '#black', '#bolero', '#brid', '#jacket', '#merino', '#wool', '#bridesmaid', '#ev', '#dress', '#coverup']	
1092485211923849219	2019-02-04	['#emmon', '#vintagestyl', '#vint', '#vintagecufflink', '#mensstyl']	vint emmon blu cabochon cufflink
1092485167829127168	2019-02-04	[]	amethyst pend orn scrolled sterl silv marqu shap pend genuin amethyst qual jewelry gift
1092485155325923329	2019-02-04	[]	cor reef 18x12mm ov cabochon red spong cor sterl silv solitair necklac via @et
1092485154034122753	2019-02-04	[]	coast cotton coast coff tea lin tea party gift stock stuff plac set hom liv ki
1092485114372767746	2019-02-04	['#etsymnt', '#etsy']	cream infin scarf thick &amp; chunky hand knit warm circ loop fash scarf via @etsy
1092485077206999040	2019-02-04	['#smal', '#squ', '#tableclo', '#embroid', '#retro', '#kitch', '#yellow', '#flow', '#crochet', '#lac', '#tea', '#coff']	
1092485009917775872	2019-02-04	['#purpl', '#blu', '#giraff', '#kid', '#cush', '#playroom', '#giftidea', '#zazzl', '#su']	
1092484999566319616	2019-02-04	[]	via @zazzle
1092484972995321858	2019-02-04	[]	mard gra light bottl louisian light bottl paint bringthejoycr via @etsy
1092484948420894720	2019-02-04	[]	fabr handb blu purs wom should bag beach bag veg purs knit project bag quilt tot bag handb
1092484933048852481	2019-02-04	[]	sal mir dec mir farmh dec rust wal mir larg dec wal mir rust furnit
1092484913478148096	2019-02-04	['#handmad', '#jewelry', '#travel', '#bag', '#org', '#etsy', '#mustach']	check item etsy shop
1092484867928002560	2019-02-04	[]	pleas retweet lik thank visit youtub channel subscrib click
1092484838475657216	2019-02-04	['#porcelainear', '#tribaljeweley', '#bohoch', '#bohojewel']	porcelain &amp; turquo ear via @etsy
1092484656652578816	2019-02-04	['#shakethelovearound', '#19']	alb suzy vinnick rmr canad chart @suzievinnick
1092484550574465025	2019-02-04	['#fir']	squad via @weebly
1092484471369199616	2019-02-04	[]	ea ear morn child pos bring bodymind&amp;soul back fath gentlest giant g carry
1092484458593296384	2019-02-04	['#sacr', '#beautyful']	ea oh sojourn spec min liv mov thru grow thru relax in2 &amp; ful ci
1092484445729361921	2019-02-04	['#sacr', '#soulful', '#mag', '#myst']	ea sojourn oh spec reflect import man mir &amp; ver
1092484433511354368	2019-02-04	['#beautyful', '#divin', '#gr8ful', '#grat', '#graceful']	ea remind oh depend real tru htt
1092484423315001344	2019-02-04	['#divin']	ea remind spec 'almost' fantast rom univers &amp; oh exquisit song
1092484413584273408	2019-02-04	['#divin', '#sacr']	ea oh remind mag mus synchron &amp; purest perfect rite&amp;perfect tim
1092484402926534657	2019-02-04	[]	
1092484392612777984	2019-02-04	['#divin', '#graceful', '#beautyful']	ea remind trust fai find los find &amp; oh unfold
1092484382659620864	2019-02-04	['#divin']	ea dai card remind spec ac
1092484374099124226	2019-02-04	[]	
1092471770165190657	2019-02-04	[]	road al ivy lit chronicle fin book draft complet dat london orwell's writ homelessn
1092471757007667201	2019-02-04	[]	road al ivy lit chronicle fin book draft complet dat london orwel homeless writ
1092471742273146880	2019-02-04	[]	on man journey faith lov friend precy dog ivy read mr al hand ivy best
1092471731401433088	2019-02-04	[]	road al ivy lit chronicle fin book draft complet dat london orwel homeless writ
1092471713688883202	2019-02-04	[]	road al ivy lit chronicle fin book draft complet dat london orwel homeless writ
1092471652875669504	2019-02-04	[]	road al ivy lit chronicle fin book draft complet dat london orwell's writ homelessn
1092471532922826752	2019-02-04	['#marry']	bor fault stop stagn pour ingredy giv marry lif
1092471524936814593	2019-02-04	['#iartg', '#asmsg', '#ku']	thrilling origin @seb_kirby tak plsrt
1092471517101916160	2019-02-04	[]	inform spec behind plot reveng want length will
1092471507513761792	2019-02-04	[]	silv hurt werewolv silv neg effect vary supern being moth nat
1092471498919591936	2019-02-04	[]	am div makoto kaho discov gig pearl deep coast wat jap discovery reach daimy
1092471488437997568	2019-02-04	[]	
1092471478841470976	2019-02-04	[]	real nic glob market 14
1092471470805188608	2019-02-04	['#bookboost', '#mustread', '#witchingho', '#corsairadv']	good luck sleep read
1092471461359616000	2019-02-04	[]	blackmail intrigu &amp; explod exploit stretch bond friend lost secret untold lor com light
1092471451481980929	2019-02-04	[]	corn confess novel new appl lit serv off select gen fict
1092471442288054272	2019-02-04	[]	book writ far gurkha most western writ rath on gurkhas'
1092471404665163776	2019-02-04	['#theflyingtig', '#chin']	second book tig avail amazon
1092471396876333057	2019-02-04	[]	volunt hospit today twit i'll back weekend worry rting sc
1092471387258847234	2019-02-04	[]	tak journey tim emy get cop found lov maud completel
1092471377121234945	2019-02-04	[]	rec interview charl peterson sheppard he's auth fiv star novel flint dream
1092471367407149061	2019-02-04	[]	new releas risky christmas affair @ninsthewriter fun romp etern city enjoy
1092471356451667973	2019-02-04	['#mag', '#voodoo', '#nol', '#paranorm', '#bookboost', '#iartg', '#avidread', '#mysterylov', '#adv', '#n']	city spirit
1092471336256135169	2019-02-04	['#book']	forget past liv bet yet liv day gre @mrsdbooks us
1092471324965040129	2019-02-04	['#dragon', '#kindl', '#yafantasy', '#boxset']	brok dragon best fix check compel &amp; follow hero friend w
1092471315091677189	2019-02-04	['#brid', '#bolero', '#iv', '#whit', '#weddingbolero', '#shrug', '#knit', '#mohair', '#swe', '#coverup', '#bridalsw', '#ha']	
1092471305218244608	2019-02-04	['#rom']	alex visit blu duck seek forget sens saw hot hist
1092471295911038977	2019-02-04	[]	fantasy necess ingredy liv way look lif wrong end telescop laugh
1092471282124361729	2019-02-04	['#art', '#hist']	uv book tru treas bookreview
1092471272557154304	2019-02-04	['#asmsg', '#ian1']	via writing_novel reveng friend cho blur mustread
1092471261647777793	2019-02-04	['#ian1', '#mgtab']	via tammysdragonf surrend 2016 new appl rom select
1092471199916064768	2019-02-04	['#bookreview', '#psycholog']	sil wif kerry fish @kerryfswayne bril thriller 2nd wif lov
1092471189346357250	2019-02-04	['#ian1', '#iartg', '#ww2']	at pilot midg torn lov richard &amp; lizzy marry broth ben sto
1092471177744969728	2019-02-04	['#amwrit', '#shortst', '#flashfict']	friend lik cag
1092471166663573506	2019-02-04	[]	com infinit love; whol heart lack suppress wendy e slat read
1092471151375380482	2019-02-04	['#book', '#iartg', '#kindl', '#amazon', '#readindy', '#indieauth']	spotlight o'rourke sery link
1092471137118941184	2019-02-04	['#iartg', '#rrbc', '#ku']	ter story pag turn lov day wak @seb_kirby plsrt htt
1092471113614086145	2019-02-04	[]	wom sob black market trad favorit kimono food kiyom would surrend lifetim
1092471101064650752	2019-02-04	['#etsyshop', '#etsys', '#etsysel', '#dreamcatch', '#largedreamcatch', '#nativeam']	dreamyflowerwond
1092471075873673216	2019-02-04	[]	der kia process ein auto zum verlieb
1092471065513730054	2019-02-04	[]	found wid rang feel expery express pag joy ang surpr
1092471031279824896	2019-02-04	['#2']	every cop expedit in ord launch dec 4th chris babu @realchrisbabu
1092470960635199489	2019-02-04	[]	gracia al equipo de tu libro favorito @hlfavorito gracia comp de difus por est ah los vend
1092470940049567746	2019-02-04	['#hor', '#mystery', '#paranorm', '#monst']	someth desp wrong arcad fal
1092470930528448514	2019-02-04	['#authorspotlight']	brand new today amaz auth @pennilessscribe on absolv f
1092470921183547400	2019-02-04	['#nanowrimo', '#paperback', '#cleanread', '#suspens']	miss paperback avail amazon ebo
1092470862010335232	2019-02-04	['#rt']	famy friend journey santosh check
1092470832096571392	2019-02-04	[]	review amazon book @waynezurl new prospect sam jenkin mystery wayn zurl review l g cul
1092470802841243648	2019-02-04	[]	happy annount book avail worldwid
1092470764819922945	2019-02-04	[]	read every on novel @eichinchanglim @carrycockburn @danielpollock @ericwilderok @dominicpiper1 @writerst
1092470754271207425	2019-02-04	['#newworldord', '#booksery', '#dyst']	dea liberty shal ris nor am empir
1092470708989583361	2019-02-04	['#newreleas', '#bookreview']	get 1st chapt end excit scar surpr
1092470698457686016	2019-02-04	['#iartg']	amazon
1092470689842503680	2019-02-04	['#childloss']	felt giv opportun celebr strength end wom childr
1092470649753358338	2019-02-04	['#newreleas']	heart mind holy spirit heal dream vis lov war end day 'home wayf story' kindl pap
1092470634066690049	2019-02-04	['#lastcoldcas', '#thriller', '#sery']	pleas giv book cold should giv em read book wait j
1092470621131419648	2019-02-04	['#fre', '#shortst']	keep weekend entertain littl girl pray hil somewh sery book
1092470595579727872	2019-02-04	['#alexsawick', '#jakebas', '#newmexico']	new hero real tak old tim tel
1092470581319086080	2019-02-04	[]	someth paty tug ayesh heart mad get involv yet someth
1092470562193137667	2019-02-04	['#book', '#iartg', '#kindl', '#amazon', '#readindy', '#indieauth']	murd knoxvil auth wayn zurl
1092470552034451457	2019-02-04	['#pol', '#ten', '#detect', '#org']	maf mov prospect yik sam jenkin mystery
1092470524071038979	2019-02-04	['#book', '#mystery', '#detect']	curl crack rur detect mystery
1092470498255093760	2019-02-04	[]	sent autograph cop ben's book young man &amp; receiv wond thank not mail day lat v
1092470460078534662	2019-02-04	[]	first novel anim inspir nightm
1092470448137428992	2019-02-04	['#romanceread', '#follow', '#awesom', '#freeby', '#chant', '#win', '#bo']	sur @romancenovelgiv want first three
1092470438809210884	2019-02-04	['#releas', '#book']	new tast bread somewh 2 @mrsdbooks beca
1092470385029861376	2019-02-04	['#thedeadundon', '#nz', '#zomby']	set paranorm hor ris bp get
1092470364716912640	2019-02-04	['#shortread', '#sundaymorn', '#coff']	want go cup pick man redempt &amp; see review lov
1092470352360415232	2019-02-04	[]	dai inspir
1092470337479106562	2019-02-04	[]	anoth star review dog nam derf 5 heav febru 2 2019 beauty story
1092470326104080385	2019-02-04	['#fantasy', '#thriller']	@dougromigwriter review rt plz
1092470320030724097	2019-02-04	['#amwrit']	tweet worry rting tweet i'll rt gre week fo
1092470285004144643	2019-02-04	['#99cents', '#kindleunlimit']	apprecy shar book releas day wick heart lit
1092470236790620162	2019-02-04	['#writ', '#gratitud']	breath cher breath cher being dala lam
1092470222852890625	2019-02-04	[]	castle's caut debut mak dir fut seem real thu mov sign kirk rev
1092470211800907785	2019-02-04	['#bestsel', '#johariswindow', '#suzydavy', '#memoir', '#lov', '#loss', '#intrigu', '#dang', '#selfdiscovery', '#amreadingrom', '#writ']	
1092470201931710469	2019-02-04	['#quirky', '#comedy']	shout 5 plenty laugh mom that's lead way down street
1092470171795681280	2019-02-04	[]	poss al way chant hel yet on ins thought kept nag away bac
1092470159669936128	2019-02-04	[]	'the dragon alsac farm' laurielclew book get person level multipl front lew
1092470143534485506	2019-02-04	[]	dea new black domin pip read michael connol philip ker jam lee burk domin pip ce
1092470130506911746	2019-02-04	['#thriller', '#londo']	kiss i'm dead domin pip grip thrilling detect novel
1092470117403951104	2019-02-04	[]	peau blanch besoin de vot caress je veux vot caress ai besoin de vot caress
1092470097413918720	2019-02-04	[]	dea new black domin pip daniel becket thrown cas absorb
1092470058356523008	2019-02-04	[]	@patchworknerd can't seem get ground mom due commit
1092470050919989253	2019-02-04	[]	lov walk stun febru day
1092470019009720320	2019-02-04	[]	let's see what's behind door numb two monty said @indiebooksource world build wa
1092470004518408193	2019-02-04	['#amazon']	rt @helencburke1 rt @authorellie ten story wak dead get h
1092469961451339782	2019-02-04	[]	shawn select angel guard hum vietnam war hero whos lif forev chang
1092469926223335424	2019-02-04	[]	learn whol story pass judg
1092469884573941761	2019-02-04	['#nativeam']	cod talk help win war
1092469877414289408	2019-02-04	['#vetslivesmat', '#nativeam']	pleas rt vet cris lin 1 press send text mess 838255
1092469869315063808	2019-02-04	[]	many pernicy myth nat am nee uproot
1092469855498973184	2019-02-04	['#weekendatberny']	part 2
1092469809864994816	2019-02-04	[]	un opportun ent mind kil read unedit diary man eith ser kil ni
1092469796619370496	2019-02-04	[]	dead lov play invit stay trap parl trick get kick
1092469781733797888	2019-02-04	[]	enjoy day ev though monday sur good &amp; mercy follow believ
1092469761819230210	2019-02-04	[]	kiss i'm dead domin pip prob best crim story i've read mark
1092469737299296258	2019-02-04	[]	would tel pleas way ought go depend good deal want get
1092469700787884038	2019-02-04	[]	pass jug pappy possess drink &amp; car oppress sun turn mou cotton field unl
1092469688209154048	2019-02-04	[]	flip mad agree team hot handym flip hous stol other's heart amazon
1092469665736126466	2019-02-04	[]	flip mad went back hom start flip hous spar smok hot handym watch flippin
1092469648317140993	2019-02-04	[]	carn crav tag along boyfriend's busy trip hot redhead can't stop spy sex act coupl
1092469633314144256	2019-02-04	['#hot', '#eroticrom', '#boxset', '#sexy', '#99cents']	scorch reg read steamy excerpt &gt;
1092469623499431936	2019-02-04	['#cia', '#nsa']	dr ray silv sery star act bet can't read jst ;
1092469595179499525	2019-02-04	['#globalfund']	tel world lead support fight aid tb &amp; malar act
1092469576938459137	2019-02-04	[]	fab day everyon many thank xo
1092469538602577921	2019-02-04	['#fundeduc', '#girlscount']	130m girl school sign petit lead
1092469356859146240	2019-02-04	['#amwrit', '#amread']	complet lov neighbo libr tak book leav book
1092469341071785984	2019-02-04	['#artwork', '#draw', '#oilpaint', '#art', '#contemporaryart']	contact interest
1092469060544221184	2019-02-04	[]	bloom today yamamoto typ dendrob nobl spring dream 'appollon brea spring midwint
1092468949256716290	2019-02-04	[]	night hard fathom detail fold story within every lost pet let pip dream burn smear
1092468891840929792	2019-02-04	['#dartmo']	today
1092468865261555712	2019-02-04	[]	clos end allow warm fad light sun ling fac gentl toward wax gib
1092468625389305864	2019-02-04	[]	johari's window suzy davy via @amazon
1092468595806867461	2019-02-04	['#soberl', '#sobry', '#alcoholfr']	fiv sign might alcohol
1092468587758059521	2019-02-04	[]	book poetry fast funny part excit fin round japanes gam
1092468562596450304	2019-02-04	[]	publ funny sad tim @medium
1092468554836914177	2019-02-04	[]	read forbid story tru lov tough us man think
1092468545810776064	2019-02-04	['#iartg', '#bookboost', '#ian1', '#vampir']	tak walk wild sid canad hemlock forest ber shapeshift
1092468503511269377	2019-02-04	[]	sky monst grumbl childr believ monst hid cloud mak loud boom nois hid
1092468487484780544	2019-02-04	['#read']	book fugu @mickeyhadick amnes lov story mak forget every amnes lov st
1092468365967405059	2019-02-04	['#amwrit', '#memoir', '#ya', '#goodread']	
1092468344765247491	2019-02-04	[]	angel's wing websit trail amazon
1092468322229202945	2019-02-04	[]	reg clos ey clos heart enclos heart
1092468312683020288	2019-02-04	['#amazon', '#book', '#ebook', '#kindl', '#film', '#camer', '#photogr']	1 avail pap &amp; avail
1092413668992737280	2019-02-04	[]	nee excus bad behavy say devil mad read salesm cam town fre
1092413653155020801	2019-02-04	[]	book wom sery obsess destruct lov fearless
1092413538402996225	2019-02-04	['#iartg', '#ian1', '#medtwit', '#amazon', '#kindleunlimit', '#bookboost', '#sery']	uh phys
1092413516726894592	2019-02-04	['#socialmed', '#bookmarket', '#market']	nee hand blond help
1092413503925899264	2019-02-04	['#kindleunlimit', '#ian1']	bur ward turn leav otto grab arm
1092413486133661697	2019-02-04	['#iartg', '#ian1', '#kindleunlimit', '#amazon', '#sport', '#medicin', '#neurolog', '#footbal', '#basketb']	tim gear
1092413381187956736	2019-02-04	['#fre', '#kindleunlimit', '#fant']	check latest 5 review man redempt read
1092413374250532864	2019-02-04	['#twit', '#promot', '#network', '#indy', '#book', '#ebook', '#auth', '#indieauth', '#mus', '#mov']	maxim expos â„ï¸
1092413360744906752	2019-02-04	[]	thank much @judykemp69 @harmony_kent @cdavis461 @alhanda @anitablackmann @kaceykells @ssultrie @solmullersch @iris
1092413356215070721	2019-02-04	[]	fre morn angie=nurs noon=murder suspect night=amateur sleu detect jarv want suspect pretty b
1092413203454324736	2019-02-04	[]	ordin extraordin lov story memoir real lif sarah&amp;hank clara&amp;marty dory&amp;joe &amp; terry&amp;erin
1092379556802166784	2019-02-04	[]	flight elv novel story elv kal 1 story
1092379540696064002	2019-02-04	['#highfantasy', '#epicfantasy', '#fantasy', '#norsefantasy', '#grim']	war ear wolv ton vib spectacul 5
1092379513139408897	2019-02-04	['#bookreview']	brand new today ablaz harsh thak interest n
1092379498773966849	2019-02-04	[]	i'm orac voic flap tat king ord four son 3
1092379488892190720	2019-02-04	['#ons', '#99cents', '#valentinesday2019', '#darkfantasy', '#lov', '#monst']	spend tak root ash &amp;
1092379479656280064	2019-02-04	['#dark', '#fantasy', '#iartg', '#asmsg', '#kindl']	childr nev @christianwfreed
1092379469246013443	2019-02-04	['#ebook', '#hor', '#demon', '#bookboost', '#authorupro', '#iartg', '#asm']	demon dant
1092379456302448641	2019-02-04	[]	sing world &amp; being lov kind &amp; car cho choos mom wis
1092379446437445632	2019-02-04	['#wantedantholog']	read devy second book devy sery avail pre ge
1092379437339983872	2019-02-04	[]	wisdom song
1092379426782961664	2019-02-04	['#dog', '#hund', '#hond', '#pooch', '#guinnesssixn', '#ireland', '#w']	ready ready tre @misheleneous
1092379416469143554	2019-02-04	['#book', '#booktrail', '#pnr', '#werewolf', '#indieauth']	check new book trail wolf's man htt
1092379385863262209	2019-02-04	['#rickgrim', '#michon']	eq riv fin chap 6 &amp; compet part illustry distinct protect sq
1092379370847723522	2019-02-04	[]	ex went tv shar intim secret desdemon spot ex tv world
1092379359221035008	2019-02-04	[]	vampir reclam project vampir redempt tal fiv book sery sav soul on vampir tim
1092379349788045312	2019-02-04	[]	real can't blam sun want visit farn island first morn
1092379335112253441	2019-02-04	['#midnightcross', '#historicalrom']	dram famy polit secret tryst dang ghost past bookl
1092379313985466373	2019-02-04	[]	trap box six crack see outsid dark wand kingdom wid circuit fri &amp; mus
1092379288878370816	2019-02-04	['#groundhog']	enjoy act adv 'hero' would happy mak lunch war n
