id	created_at	hashtags	cleaned_text
1093295284610887682	2019-02-06	[]	tal travers decad charact slip macabr realm consort vampir werewolv gh
1093295200993198080	2019-02-06	['#fre', '#vampir', '#hor']	montenegro book three illud within illud com soon read book on amazon
1093295178037805062	2019-02-06	[]	&gt;the clu treas hunt outstand certain keep read wond wond ne
1093295164662185985	2019-02-06	[]	look gre deal dark cozy mystery sery includ four ful novel award
1093295139919941637	2019-02-06	[]	ariel ready acceiv us pow amulet myst book spel protect hers
1093295120156377088	2019-02-06	[]	sew dang award win short story collect 2016 reader's favorit gold med
1093294959564857344	2019-02-06	[]	book delight start fin old charact ad charm hil book
1093294902363017217	2019-02-06	['#rom']	oft found least expect tongu expl wet soft eag mou on ha
1093294874009497602	2019-02-06	[]	rt@dreamheadz flight destiny 22 dark fict story satir wit frant powel
1093294849586012160	2019-02-06	[]	dad sick tonight whatev believ pray good vib nic word famy tak rig
1093294839603568640	2019-02-06	[]	found unwil stop read reach conclud perfect ca
1093294811153657856	2019-02-06	['#cozymystery']	new releas hors around murd funny furry hit rom set canad eh corp
1093294787602665475	2019-02-06	['#heartbreak', '#stoptheviol', '#preord']	hear mommy keep tel daddy's dead tak
1093294745797971969	2019-02-06	['#win', '#paperback', '#mystery']	want sign proof subscrib chant win cop near kil
1093294712432275459	2019-02-06	['#rom', '#cozymystery']	
1093294614411464705	2019-02-06	[]	whilst expl alfy com across sword first clu not left behind amel set mind find
1093294559939973120	2019-02-06	[]	want thank new wednesday follow much gratitud
1093294548267294722	2019-02-06	['#suspens']	ghost ship sail &amp; tim stand stil teen supern award sea story 99cents
1093294520064724992	2019-02-06	[]	veng gypsy curs plagu wom famy tim break curs on young moth risk
1093294423872585734	2019-02-06	[]	word fail mus speak turpitud 4th book sens capt &amp; illumin
1093294244847124480	2019-02-06	[]	5 clu treas hunt outstand certain keep read wond wond
1093294233979625473	2019-02-06	['#fre']	dea tynesid agn lockwood mystery book 2 get cop today wh
1093294212626481154	2019-02-06	[]	kid back school tim curl read good book check ht
1093294185279569921	2019-02-06	[]	glit shot crew atl sav planet naziortol troubl steal
1093294053897183234	2019-02-06	[]	captain franky lov fly childr gre adv amaz imagin fun read learn
1093294005897564160	2019-02-06	['#99c', '#bookspec']	kiss nev underestim pow unforget kiss
1093293955809271808	2019-02-06	[]	walk night light savy hel lov tel dead gam @susannele
1093293943356383232	2019-02-06	[]	lou viscont left trail tot destruct servito stol fortun excel job plot charact
1093293928181350400	2019-02-06	['#valentin', '#audiobook']	kiss &amp; kil everyth rom suspens join ev chant win
1093293900394049541	2019-02-06	['#kindl']	would fortun gain husband would pref wed man boy 99c 99p
1093293875962228743	2019-02-06	[]	devo fast hot fudg sunda two new mystery fre kindl unlimit 99 cent
1093293866030120961	2019-02-06	[]	mayb hid seek deck card two might giv peek liv rich &amp; fam des
1093293839039819778	2019-02-06	[]	much pain on wom end beauty friend fal lov story took big busy
1093293826867937287	2019-02-06	[]	monst lurk dark web prey society's bad girl mayb tim he's met match kindl countdown f
1093293803639881728	2019-02-06	['#k']	brigitt moon's newest book 13th hour avail amazon kindl stor fre fre
1093293780642512901	2019-02-06	['#adv', '#suspens']	tim's dream &amp; good soon meet real wind chang quick afr august
1093293769863122944	2019-02-06	['#thriller', '#susp']	ser kil lik stalk victim seduc look prospect kil
1093293755501817856	2019-02-06	[]	peril quest sizzl intern intrigu tend suspens mount compel pitch rick mof
1093293617437913089	2019-02-06	[]	mandr reveng new book com on market linvin thought reach hom meant saf find
1093293578439311360	2019-02-06	[]	poign com ag novel watkin writ multifacet story play beauty strongly recommend
1093293566607196160	2019-02-06	['#ilikeyouenoughto', '#newreleas']	tel lov lik tre grow accord metano (
1093293551717363715	2019-02-06	['#bookreview', '#cozy', '#mystery']	nev enough isabell adam anoth genr tal pen isabell adam fo
1093293522793492480	2019-02-06	['#paranorm', '#rom']	expery rav specy want rav get hunt pass new releas fre ku
1093293483408936962	2019-02-06	[]	sun burn body moon pal skin keep clear dead liv lif sin dead gam
1093293466749153287	2019-02-06	['#darkrom']	brand new releas c mandar nev ev fal lov enemy
1093293389494345728	2019-02-06	['#urbanfantasy', '#kindleunlimit', '#aud']	plan today solv mystery half shapeshift
1093293375690809346	2019-02-06	[]	kindl bestsel left dead lost confus drank much last know hap
1093293358225780737	2019-02-06	['#imagineaworldth']	lov lik tre grow accord tru set fre
1093293338751574018	2019-02-06	['#thriller']	moth nat kil peopl wors whiteout avail amazon kindl unlimit
1093293307076231168	2019-02-06	['#giveaway']	$25 ita midwest cozy mystery sery harm 2 ht
1093293276814295041	2019-02-06	['#sci', '#ufo', '#firstenco']	secret brief mom 1989 seem edg expos roswel
1093293228617551872	2019-02-06	[]	dar expl shadow join hero &amp; heroin op soul shadow box set fro
1093293204475125761	2019-02-06	['#bestfriend', '#serialkil', '#san']	deep chloe fal lov harry real precy lif
1093293174397767680	2019-02-06	['#amwrit', '#promot', '#tip']	market tip n n light auth promot @nnp_w_light ht
1093293058999939072	2019-02-06	['#arthur']	mordr com cho mad cannot revok new weapon war world curs
1093293014599061504	2019-02-06	['#heartbreak', '#stoptheviol', '#preord']	hear mommy keep tel daddy's dead tak
1093292985201188865	2019-02-06	[]	he's elit elit hotshot attack wildfir cor wom shat heart lov
1093292971137613825	2019-02-06	['#romanticsuspens']	gritty storylin felt rip headlin must read fan wound us marin defy report
1093292939122479107	2019-02-06	['#supern']	bit delicy mag fantasy book ghost witch aly lov fest four sex
1093292929588838400	2019-02-06	[]	noth alph man demigod nam triton impact zon fath warn mort pow
1093292875029364739	2019-02-06	['#rom', '#sery', '#asm']	feat rom novel best fem lead
1093292813628903429	2019-02-06	[]	dead walk among us they've join schools they've becom friend on stand besid dead gam
1093292785850073089	2019-02-06	['#giveawaylinky']	sunday stroll giveaway linky 1
1093292771681751040	2019-02-06	['#coldw', '#thriller']	list william jam hil read extract spy andropov's cuckoo tal lov int
1093292758834577409	2019-02-06	['#wozawednesday']	@numetro can't think anyth bet quick tre end wednesday tak
1093292711103348737	2019-02-06	['#scif', '#ebook']	review lost found absolv amaz
1093292701326458880	2019-02-06	['#romanticsuspens', '#militaryrom', '#hots']	rt@teresareasor phys therap scar hit run seal
1093292654723563520	2019-02-06	[]	demon masquerad ghost infilt withdrawn peculi town possess hum kind https
1093292639812812800	2019-02-06	['#amwrit', '#writersl', '#asmsg', '#writersunit']	writ research novel lik
1093292591003717633	2019-02-06	[]	febru am heart mon good remind pay at blood press heart diseas ris
1093292563170238465	2019-02-06	['#romcom', '#mustread', '#newreleas', '#rev']	on hot mess on hot boss on many hot encount
1093292531461296129	2019-02-06	['#mustread', '#dram', '#bookboost', '#rom', '#thriller', '#booklov', '#bookclub']	gre read valentin day
1093292521659269120	2019-02-06	[]	good morn mayb snow today glad plan stay indo writ mak wednesday dazzl
1093292507503517697	2019-02-06	['#rom']	alex visit blu duck seek forget pleas hot hist
1093292497097424897	2019-02-06	[]	confess includ divid religy issu govern scand gree could lit blow smal town
1093292484132831233	2019-02-06	['#alexsaw']	unus comanch &amp; three cousin togeth common goal rid along
1093292471457669120	2019-02-06	['#relig', '#theunho', '#iartg', '#bookboost', '#hor', '#wolfpackauth']	ðŸ”¥ gon bad @promotehorror
1093292444979003392	2019-02-06	[]	last tit buy book amazon
1093292373826826240	2019-02-06	['#99cents', '#fre', '#kindleunlimit', '#asmsg', '#p']	two soul lov lov cannot last
1093292361231355905	2019-02-06	['#newreleas', '#cadebrog', '#mustread', '#lesb', '#detect', '#med', '#psycholog', '#suspens', '#thril']	
1093292188824408070	2019-02-06	['#sassy', '#mischief', '#hum', '#friend']	swe pant allow win club bk win swe pant
1093292180901380096	2019-02-06	[]	@thistlebooks brav enough
1093292153080610816	2019-02-06	[]	joe elud crim fight help fbi track ser kil elud twenty year
1093292146000609280	2019-02-06	[]	short request @kaceykells sweet sour short story diff honeymoon
1093292123980525568	2019-02-06	[]	map book i've work past week fac east toward purpl wind
1093292113394057217	2019-02-06	['#valentinesday']	want get pant &amp; choos gift show real understand nb
1093292095551557632	2019-02-06	['#rom', '#eroticrom', '#interrac']	on look ey lock already claim lov com easy
1093292081311817729	2019-02-06	[]	alex visit blu duck seek forget sens saw
1093292067424481286	2019-02-06	[]	av tri best right thing nobl int get tangl rom interest
1093292037322010625	2019-02-06	['#xxx', '#poetry', '#naughty']	wann know kind poem hung guy writ he's horny poetry fuckin' hot com
1093292011086626818	2019-02-06	['#awenr']	here's grab lin front cov battl begun ear wrought h
1093291970787717127	2019-02-06	[]	fergus' chimp ear dwarf siz sebastian's ego henry's pen daniel adam garwood lov
1093291955629510656	2019-02-06	[]	'shining every encount lov &amp; ded malcolm feel anim arm animals' @malco
1093291942413324289	2019-02-06	['#ladyel']	entertain hist rom cal enjoy &amp; delight distract review
1093291932665683969	2019-02-06	['#yabook', '#kindleunlimit']	rt best read year wham ahread iartg 2 fre
1093291886700359681	2019-02-06	['#wednesdaywisdom']	
1093291876638228481	2019-02-06	['#childrensbook', '#claudettemelanson']	but com hom bunny's heartwarm journey readers' favorit fin
1093291866907381760	2019-02-06	[]	tend deeply mov beauty story tim ach fil compass patho read
1093291854538440704	2019-02-06	['#womensfict', '#lovest']	uv flash gold ear
1093291838528737280	2019-02-06	['#art', '#mystery']	intrigu wel story corrupt murd classy intellig dev
1093291825694167040	2019-02-06	['#99cents', '#bestsel', '#auth']	new releas @bellaemywrites sweet story littl steam singl va
1093291800008237057	2019-02-06	['#sport']	littl know legend going show us kinky wild could get
1093291770526527488	2019-02-06	['#bbw', '#fre']	18 book avail everywh lik alpha got book abby gon wild
1093291718479360003	2019-02-06	[]	joan tewkesbury filmmak screenwriter story lov compass &amp; partn last conceiv
1093291702469697537	2019-02-06	[]	russ america's decad long sil war esc shadow on last tim ear com brink destruc
1093291678893596672	2019-02-06	['#sal', '#99c', '#erotic', '#rom']	mystery mr blackston
1093291668516859904	2019-02-06	['#amread']	@dominicpiper1 domin piper's novel nonstop act nonstop fun review fem
1093291614246711296	2019-02-06	['#erotic']	fre naughty list part last tim michel got lom kne leg week
1093291591798870018	2019-02-06	['#rom', '#bundl', '#bargain', '#99cents', '#steamy', '#kindleunlimit']	scorch hot hist read
1093291582189694979	2019-02-06	['#paranorm', '#suspens']	whisp wind keep company long dark night
1093291555652292609	2019-02-06	['#fantasy']	book excel award 2017 fin conscy say he's evil want left alon
1093291522433470464	2019-02-06	['#murd', '#mystery', '#suspens']	lie ad piqu story story would fact fantasy nee lie stim
1093291509670207488	2019-02-06	[]	'so priv investig tak dat nowaday low div sawdust flo fight break
1093291491810775041	2019-02-06	['#coverrev']	upcom releas 31st janu first erot western rom read blurb two steamy
1093291466976362496	2019-02-06	['#london', '#detect', '#thr']	fem fat domin pip fast excit unputdown
1093291455169417218	2019-02-06	[]	book avail kindl unlimit
1093291440795471880	2019-02-06	[]	5 street art rat liv subway rescu person int hurt rescu turn
1093291430871814147	2019-02-06	[]	on magazin happy &amp; singl kick amatonorm ass last conceiv
1093291414123921408	2019-02-06	['#rom', '#99cents']	alex visit blu duck seek forget pleas hot hist
1093291392867201024	2019-02-06	[]	sometim deduc sometim induc reason mast detect alway catch perp
1093291375502807040	2019-02-06	[]	aristotl beg journey find bind mod 2400 year ago stein's at
1093291359216250881	2019-02-06	['#sexy', '#rom', '#fre', '#kindleunlimit']	best int reg hist read enemy lov
1093291336084738051	2019-02-06	[]	receiv angel blood &amp; overcom curs condit arel continu quest find tru fulfil '
1093291326521724929	2019-02-06	['#oob']	app foggy night best see act ralph travel 'plane' thought
1093291251200331776	2019-02-06	['#futanar', '#lprtg', '#ssrtg']	fut witch's spank fut geny 10 fut naughty
1093291215326466050	2019-02-06	[]	road al ivy lit chronicle fin book draft complet dat london orwell's writ homelessn
1093291206346457089	2019-02-06	['#amazon', '#n']	intern best sel sint releas dat stil going pleas leav review
1093291182522859521	2019-02-06	[]	wow wow wow believ put book amazon paperback wow new cov ac lov
1093291152231534592	2019-02-06	[]	novel high level emot bit humo hum sat magn
1093291140424585218	2019-02-06	['#hor', '#bookboost', '#iartg', '#litf']	within glass dark uk us
1093291127011241984	2019-02-06	['#sciencefict', '#act', '#adv']	fre amazon unlimit cold end edg galaxy @sak_stories sp
1093291084392943616	2019-02-06	[]	sid found lif covert ag crazy kind fun cryst sery class sci fut thrills
1093291074309767171	2019-02-06	[]	uns syr confus riot frant congress chin glob warm read 2050 learn c
1093291057457098752	2019-02-06	['#hor', '#bookboost', '#iartg', '#litf']	within glass dark uk us
1093291012603199488	2019-02-06	['#bookboost', '#twfbg', '#sery']	lov wov upon lay intrigu
1093290989786148866	2019-02-06	['#indiebooksbeseen', '#erotic']	check new instal thrill seek rel sery anarchy0029 r
1093290976154652678	2019-02-06	[]	discov world tony razzolito pi find littl bit everyth murd mystery dram hum lov
1093290964754550786	2019-02-06	['#werewolv', '#adv', '#rom', '#goth']	pun pain pleas sci via @kryssiefortune
1093290949806039040	2019-02-06	[]	fly new mon new book troubleshoot ear fight aly discov new planet sav ear
1093290940050165761	2019-02-06	['#fre', '#kindleunlimit']	tak rivet rid streets atlant salem reid
1093290898807537664	2019-02-06	[]	may not i've review lot @amber69skye's book that's go three char
1093290886849617920	2019-02-06	[]	prep com long first book shade's tal trilog avail amazon next week
1093290876875476993	2019-02-06	[]	lin prov juliet cromwel tru capt story bril writ amazon review h
1093290866125479936	2019-02-06	['#tud']	tim religy turmoil mort peril witty wily princess forg path engl throne
1093290855820115968	2019-02-06	[]	thank much marth perez
1093290839382650881	2019-02-06	['#fre', '#kindleunlimit', '#fant']	check latest 5 review man redempt read
1093290820218826753	2019-02-06	['#new', '#antholog', '#midnightoil', '#scif', '#timetravel', '#goodread']	check short story pickup cop today
1093290747078549507	2019-02-06	[]	believ extraordin depth peopl cap forc fac evil lin prov @ju
1093290735615569922	2019-02-06	[]	screenplay produc wond team poison pict read book see film lat
1093290723951239168	2019-02-06	[]	mak febru read list complet book 'hidden' natha r
1093290707408900099	2019-02-06	[]	look act adv sprinkled supern chil check witch hour fre read
1093290695484469251	2019-02-06	['#booklov']	kil president's wom joe mag man sery book 2 al lew via
1093290684780552194	2019-02-06	['#rt', '#theyorkshireslash']	dar walk hand hand psychopath kil told 100% kil ey
1093290661309239296	2019-02-06	['#rt']	famy friend journey santosh check
1093290636919390208	2019-02-06	[]	mess read writ insight hum person fin observ hum
1093290625053745153	2019-02-06	[]	without @delaneydiamond
1093290600579911680	2019-02-06	['#amr']	prevy releas new cov titl upd new cont ad includ epilog hot paranorm novell
1093290590442274817	2019-02-06	[]	hen hous lady blog stop visit sometim hear 0ur adv get period upd fi
1093290576282349568	2019-02-06	['#fre', '#kindleunlimit', '#kindl', '#unlimit', '#fantasy', '#angel', '#demon', '#dev']	man redempt
1093290557667987458	2019-02-06	[]	trembl lean press mou min kiss gentl soft; urg
1093290547480014849	2019-02-06	[]	wak gg anesthes wear albertson mov arm leg eyelid
1093290488961159168	2019-02-06	['#wolfpackauth']	nightm georg norton @alnortonauthor
1093290399261777921	2019-02-06	[]	observ day doll tre read glass get littl fuzzy on lens fal ye
1093290379976364032	2019-02-06	[]	nak shal return poetry prevail sens cour amid world quiet despair @crifilover @sh
1093290366311251968	2019-02-06	['#laugh', '#comedy', '#millhil', '#preview', '#booklov', '#bookclub']	loud set priv girl school london ðŸ’¥
1093290336586207232	2019-02-06	['#fre', '#bookpromot', '#bookpromo', '#facebook']	get fre &amp;
1093290287202471941	2019-02-06	[]	bring neighb diff cult togeth surv fight lifetim zomby cours com tak
1093290220341075969	2019-02-06	['#kindleunlmit']	ment lat zomby complex fre that's righ
1093290191782100992	2019-02-06	['#newreleas', '#bookstagram', '#amazon', '#bestsel']	sal 99 cent also avail paperback
1093290153441968134	2019-02-06	[]	trap box six crack see outsid dark wand kingdom wid circuit fri &amp; mus
1093290124463493121	2019-02-06	[]	ag fbi see joe elud crim fight pot asset solv difficult crim oth see
1093290111117213696	2019-02-06	['#rt']	noth short fiv star wel writ lov twist i've read work
1093290086039539713	2019-02-06	[]	sultry lov story combin rom erotic plenty kinky bdsm expl two young wom discov
1093290076115816449	2019-02-06	[]	poss al way chant hel yet on ins thought kept nag away bac
1093290064724066305	2019-02-06	[]	heart reason reason know noth debauchery 3rd book sensu
1093290055756591106	2019-02-06	['#rrbc', '#iartg', '#memoir']	websit trail amazon
1093290028925636608	2019-02-06	['#kindleunlimit', '#ku', '#bargain', '#feet']	pick naughtiest desir read storm
1093290010307112960	2019-02-06	['#follow', '#delicy', '#boyfriend', '#lov', '#fight', '#evil', '#excit', '#mag']	cas three fal &amp; tal
1093290000484106241	2019-02-06	[]	say ev tempt adam appl man ain't going know pink cadillac
1093289990870745088	2019-02-06	[]	child lov reunit sun beach sydney austral yet reun spark holiday fling
1093289955642740736	2019-02-06	[]	new favorit shar today on com wish spring real lov etsy shop amazingraceart ht
1093289945987510272	2019-02-06	['#rrbc']	heavy hour' wick disturb suspens thriller pbrownnovels iartg eartg ian1 asmsg novel fictio
1093289935208103937	2019-02-06	[]	city light &amp; sid streets assembl four short story novelet salem reid novell city light
1093289903176273922	2019-02-06	['#ww']	@drew_lee_wilkes @phoenixrainez @middletonjenni2 @kfannabellerose @authormbtosi @pebblesfelicity @albator50 @mjrocis
1093289896582791168	2019-02-06	['#sery', '#fanta']	broth king warry sery 1 sandr yearm via @amazon
1093289864794198017	2019-02-06	['#kindleunlimit', '#amazon', '#iartg', '#ian1', '#medicin', '#medtwit', '#valentinesdaygift']	perfect novel gift
1093289845236121607	2019-02-06	['#cult', '#busy', '#l']	5 corp superpow off answ &amp; pract solv cult win
1093289833810796545	2019-02-06	[]	chang situ liv fear learn wrap lov mindset &amp; refus see thing n
1093289823312453632	2019-02-06	[]	sowerbutt's blood cocker's shirt rip op long bloody lin cut across chest
1093289812457607168	2019-02-06	['#iartg', '#ian1', '#bookboost', '#thrillers', '#amazon', '#kindleunlimit', '#medtwit', '#somedoc']	spring find what's caus
1093289758208548864	2019-02-06	['#youngadult', '#mustread']	fantasy kidnap smil laury woodward @woodward_laurie &gt; tra
1093289712461205504	2019-02-06	[]	origin watercolo hillsid cot brecon beacon wal 11ins gift ide art collect hom
1093289677031907334	2019-02-06	[]	work bon quarry gre tim writ
1093289671076007936	2019-02-06	[]	mrs y's review monkey idol kd mcniven somehow crept spielberg's brain instead
1093227631733030917	2019-02-06	[]	road al ivy lit chronicle fin book draft complet dat london orwell's writ homelessn
1093227621872218112	2019-02-06	[]	road al ivy lit chronicle fin book draft complet dat london orwell's writ homel
1093227609637285888	2019-02-06	[]	road al ivy lit chronicle fin book draft complet dat london orwell's writ homeless
1093227590561738754	2019-02-06	[]	road al ivy lit chronicle celebr half mil visit oct 19 2018
1093227459649126401	2019-02-06	[]	road al ivy lit chronicle road al &amp; ivy homeless lit chr
1093227440074313728	2019-02-06	[]	road al ivy lit chronicle road al &amp; ivy lit homeless jou
1093227395610484736	2019-02-06	[]	newest dec '17 entry road al ivy lit chronicle road al &amp; ivy lit homeless chr
1093227364962713601	2019-02-06	[]	decemb 2017 entry road al ivy lit chronicle road al &amp; ivy lit homeless chr
1093227345920647168	2019-02-06	[]	road al ivy lit chronicle road al &amp; ivy lit homeless chr
1093227314018689025	2019-02-06	['#onl']	would lik tak back pow fre start cre new enjoy expery tak
1093227306393501698	2019-02-06	['#inspir', '#transform', '#conscy']	visit facebook pag
1093227274986577920	2019-02-06	['#getrealconscy', '#onlinenow', '#conscy', '#class']	everyday enlight begin aw get access
1093227250235961345	2019-02-06	[]	road al ivy lit chronicle road al &amp; ivy lit homeless chr
1093227182346960896	2019-02-06	[]	road al ivy lit chronicle road al &amp; ivy lit homeless chr
1093227133504229377	2019-02-06	[]	road al ivy lit chronicle may 2018 entry lit homeless chronicle 5
1093227105456926720	2019-02-06	[]	road al ivy lit chronicle lit homeless chronicle 5
1093227088268746752	2019-02-06	[]	road al ivy lit homeless chronicle july 1 2018
1093227083864723456	2019-02-06	[]	road al ivy lit homeless chronicle july 1 2018
1093227059294494720	2019-02-06	[]	road al ivy lit chronicle celebr half mil visit oct 19 2018
1093227050083778560	2019-02-06	[]	road al ivy lit chronicle celebr half mil visit oct 19 2018
1093226976733728768	2019-02-06	[]	road al ivy lit chronicle fin book draft complet dat london orwell's writ homelessn
1093226965409107973	2019-02-06	[]	road al ivy lit chronicle fin book draft complet dat london orwell's writ homelessn
1093226958459191298	2019-02-06	[]	road al ivy lit chronicle fin book draft complet dat london orwell's writ homelessn
1093226933838643200	2019-02-06	['#dog', '#tre', '#groom', '#toy']	alway paw want dog dog tie bow barret dog dog
1093226919909306381	2019-02-06	"[""#valentine's"", '#sal', '#gift']"	day everyth ship fre first class mail expir feb every budget $1
1093226896874242050	2019-02-06	['#newbook', '#familydram', '#mean', '#end', '#pet', '#martin', '#freekunlimit']	tre peopl
1093226883720843264	2019-02-06	[]	road al ivy lit chronicle fin book draft complet dat london orwell's writ homelessn
1093226870777303052	2019-02-06	['#homeless']	plight writ &amp; brav surv @alhanda ivy sweetest dog world succumb
1093226844063711232	2019-02-06	[]	ent win fre mon subscrib barkbox [$150 value]
1093226829891190784	2019-02-06	[]	road al ivy lit chronicle fin book draft complet dat london orwel homeless writ
1093226823578775552	2019-02-06	['#gift', '#valentinesdaygift', '#spec', '#fre']	valentine's day everyth ship first class mail expir feb
1093226790250860545	2019-02-06	[]	road al ivy lit chronicle fin book draft complet dat london orwell's writ homelessn
1093226781857992710	2019-02-06	['#writ', '#blog', '#surv']	@alhanda road al ivy lit chronicle fin book draft complet dat
1093226771976241154	2019-02-06	[]	road al ivy lit chronicle fin book draft complet dat london orwell's writ homelessn
1093226747594764289	2019-02-06	[]	road al ivy lit chronicle celebr half mil visit oct 19 2018
1093226640296038401	2019-02-06	['#quot', '#achiev', '#believ', '#con']	conceiv mind believ heart achiev lif
1093226613595127813	2019-02-06	['#fantasy', '#bookbo']	fin destiny part three vest mand trilog
1093226576790065153	2019-02-06	['#redworldtoy']	ebay sel busy lik promot happy exchang rt's help
1093226565910097921	2019-02-06	['#col']	newpost @mrsdbooks liv drench div world bril
1093226559534706688	2019-02-06	['#ian1', '#tw4rw']	air midg tig moth &amp; touch cloud john mag
1093226544523341830	2019-02-06	['#tuesdaymorn']	know min could vac lik oft
1093226535711096834	2019-02-06	[]	tru today nat cre vacu day rebel tryanny forc hom sci experim
1093226524826836992	2019-02-06	['#bookreview']	c boyack's voy lanternf via @virgilante
1093226509253394432	2019-02-06	[]	shawn chos angel guard hum vietnam war hero whos lif forev chang meet
1093226484456738816	2019-02-06	[]	wait shadow @karlholton book 'shadow series' every morn watch sunbeam glit certain
1093226474679779335	2019-02-06	['#writ']	man sometim tak long tim sound lik mil dav
1093226464651198465	2019-02-06	[]	sal adv writ nonfict book
1093226454274490368	2019-02-06	[]	horr sight moss bon eng lif struggle neith could ev win play
1093226444480753664	2019-02-06	['#voic', '#writ', '#art']	us find we'v sound lik lot peopl n gaim wel
1093226404039352325	2019-02-06	[]	
1093226380886753281	2019-02-06	[]	bestsel wel research superb detail high believ charact grip flow storylin @jugle
1093226358308831234	2019-02-06	['#fantasy', '#urbanfantasy']	wit awak miao bodhisattv just read miao awak am
1093226348372508672	2019-02-06	[]	fant thriller four star review kindl miss h
1093226294266023936	2019-02-06	[]	rom women's fict rom suspens
1093226288016441345	2019-02-06	[]	rt discov mag complet ep fantasy ya ku fre kindleunlimit
1093226267317620737	2019-02-06	['#asmsg', '#book']	guinev dawn legend tal legend reluct read ccarpinello iartg ian1
1093226237915553792	2019-02-06	['#instagram']	el collin auth regul upd el check pag
1093226226712494081	2019-02-06	['#bookboost', '#rom', '#bookclub', '#booklov', '#thriller', '#dram']	new releas ebook paperback avail wro
1093226216063188992	2019-02-06	[]	writ block sketchbook grant snid 23 nytim book review febru 3 2019
