id	created_at	hashtags	cleaned_text
1093010673053904896	2019-02-06	[]	cov rev mag vodk wardrob book 3 avail next week phew madcap mayhem mus girl
1093010634185285632	2019-02-06	[]	sery anxy girl bestsel book on fre today read preview
1093010557458939905	2019-02-06	[]	5 top thriller mystery novel review leonard tillerm see find h
1093010503297888256	2019-02-06	[]	2006 review meet new bond quit old bond
1093010492212330496	2019-02-06	[]	review 'coco chanel &amp; ig stravinsky'
1093010482116595712	2019-02-06	[]	2017 nobody distinct voic day right
1093010274536304641	2019-02-06	[]	work tim answ email bed liv par tak sid gig sav cash
1093010183008280578	2019-02-06	[]	'a hist wom medicin cun wom phys witch rev untold story forgot fem phy
1093010009271734272	2019-02-06	['#fellowwrit', '#writingcommmun', '#amwrit']	com first plot charact
1093009958348705799	2019-02-06	['#quot']	happy think say harmony mahatm gandh
1093009923804413952	2019-02-06	['#ff', '#writerscommun']	follow gre writ @gilliansisley @shaunmoffat @sonyoestavillo @qu33np3n @kentstuverauth
1093009808574296064	2019-02-06	['#amwrit', '#amedit']	rememb writ mak feel transl mak read feel wrtr alway
1093009779763658754	2019-02-06	['#imagin', '#amwrit']	everyth preview life's com attract albert einstein steampunk city
1093009693440651264	2019-02-06	[]	i've chang bio act post anyth yet i'm excit annount off sign @hansenw
1093009584288133120	2019-02-06	['#book', '#topt', '#amwrit']	top 10 list ya sci fict book
1093009553044791296	2019-02-06	[]	pick piec grip famy dram pick piec origin mov grip pag abo
1093009474732867590	2019-02-06	['#auth', '#mystery', '#thriller']	thrilled @lizaroyceagency repres daphn novel ghost harvard @rw
1093009352406040582	2019-02-06	[]	hello lov connect book lov busy own writ profess book edit &amp; auth coach
1093009324350337026	2019-02-06	[]	exclud bundl get hardcov copy; screensavers; walk tour
1093009281585156096	2019-02-06	[]	
1093009249263906816	2019-02-06	['#kindl', '#book', '#fre', '#kindleunlimit']	edit 13 99 pent equ cur subscrib
1093009208285507584	2019-02-06	[]	new story alon blog hop guy enjoy
1093009172533260288	2019-02-06	['#writersl', '#writingcommun', '#amwrit', '#win']	two cup tea kind day snow fal writ
1093009081571438592	2019-02-06	['#portugalfict', '#madeir', '#amread', '#ku']	happy launch day joseph barnaby sal @crookedc
1093009042769932289	2019-02-06	['#crimefict', '#thrillers', '#ireland', '#sharpebook', '#leitrim', '#wil']	book 4 set publ auth set
1093008982967533568	2019-02-06	['#ya', '#na', '#rom']	xpresso tour spec get book promot reach target read
1093008936997961728	2019-02-06	[]	writ lov rec beg dabbl new genr ye amaz mean say
1093008905666465792	2019-02-06	['#blossom']	children's auth edit @catherinecoe let year old daught quiz writ popul
1093008658781425665	2019-02-06	['#talkaboutit', '#men']	tuesday nee talk nee littl help sometim sign weak ask
1093008589684465664	2019-02-06	['#tuesnew']	new blog post i'm count lucky star @rnatweets
1093008554976600064	2019-02-06	[]	knew book much fun check novel childr book poetry am
1093008353796804610	2019-02-06	[]	tusc recip tak unhappy girl irasc celebr hunky troubl man mix wel warm sunny spot
1093008260070862849	2019-02-06	[]	dialog witty pros subtl spar charact brought lif fascin entert
1093008238088466432	2019-02-06	[]	star miss incred dark psycholog suspens andrew dram part novel superb
1093008205800792064	2019-02-06	['#sweet', '#reg', '#rom']	cov rev westbury @arabellasheen avail pre amazon
1093007966540845056	2019-02-06	['#ghostst', '#halfpr', '#chil']	uk read lay meto rest amazon grab cop &amp; curl
1093007907371868161	2019-02-06	['#crim', '#herefo']	@rubyfiction list grow latest titl obsess murd hor peac rur
1093007882923184128	2019-02-06	[]	foxd acr book 1 dudley sist sag grip story strong wom loyalt
1093007857748979713	2019-02-06	['#tuesdaybookblog']	@cathyry review three half heartb @mrsamandaprowse
1093007847997276160	2019-02-06	['#newreleas', '#tuesdaybookblog']	@rosieamber1 @juliehouston2 com hom hol clos farm
1093007829529739264	2019-02-06	[]	perfect famy holiday daught disappear unputdown story
1093007799523725312	2019-02-06	[]	monday market guest lizzy lamb via @lizzie_chantree @lizzie_lamb
1093007666782396417	2019-02-06	['#18thcentury', '#chin']	set sail kil jess surv journey arch enemy follow
1093007545508290560	2019-02-06	['#tuesnew']	@rnatweets accompl writ gill al man combin everyth lov charact in
1093007517402255360	2019-02-06	[]	book heart lov friend bridg soc divid tim off read
1093007418194358273	2019-02-06	[]	ann bil 1849
1093007330046853120	2019-02-06	[]	read girl foyl bookshop girl war surv dang ahead
1093007300250533888	2019-02-06	['#kindertransport']	read impress child refug world oyst charm lif resy det
1093007270462541824	2019-02-06	['#ian1', '#cr4u', '#asmsg', '#shortsto']	top500 rvwr enjoy read book sur @vbenchley
1093007258445930496	2019-02-06	[]	welcom wom hor mon 2019 introduc hist fict ghost story auth pam lecky
1093007227898785793	2019-02-06	['#productreview', '#ibean']	ibean eread ipad bean bag via @shelleywilson72
1093007179144224768	2019-02-06	[]	lind ronstadt op los voic &amp; liv parkinson
1093007142922129408	2019-02-06	[]	nesso lak como photo adr baia @waglio_o rt @flairforstyle
1093007115294310400	2019-02-06	[]	ros park prov sometim sit best way tak stand chang americ forev today would
1093006925493665792	2019-02-06	['#1920s']	thing girl nee know unmarry short men obv
1093006812578750464	2019-02-06	[]	@milliethom @sak_stories @alhanda @tudortweep @lynngerridog @wboonehedgepeth @melodycrickett @vben
1093006802558640128	2019-02-06	[]	hur invit boy hom boy quick learn squirrel pleas insid
1093006782207848448	2019-02-06	['#fre']	amazon limit tim hyd dark mus book @authorldeluca rebecc look beyond fa
1093006772430868480	2019-02-06	['#quoteoftheday']	set goal high stop til get bo jackson
1093006752214380545	2019-02-06	[]	michael blood ssbazinet 'highly recommend fact i'm look forward tim read next book
1093006695285051392	2019-02-06	[]	@milliethom @annroalistic @jennikeer @authorelaina @authoralexbaile @winter_cecily @gerribowen @tudortweep @alwhitehead6
1093006688037281793	2019-02-06	[]	@annroalistic @jennikeer @authorelaina @authoralexbaile @winter_cecily @gerribowen @tudortweep @alwhitehead63 thank th
1093006650120814598	2019-02-06	['#newprofilep']	
1093006538845900801	2019-02-06	[]	@ssbazinet get bazinet wond book gre read book lov
1093006516796440576	2019-02-06	['#rt', '#newreleas', '#mustead', '#dystop', '#fantasy']	pandor world al ha
1093006495321600001	2019-02-06	['#fre', '#bookboost', '#epicfanta']	everyday kind tal charact diff draw
1093006480499007488	2019-02-06	[]	witch blackl 1915 ireland two coupl find involv three sign ev sink th
1093006402174533632	2019-02-06	[]	list episod podcast talk friday ser entrepr dan wil interview guy work
1093006382478036997	2019-02-06	[]	âš¡ï¸ funny fright touch aud combin fantasy real evil
1093006371568656385	2019-02-06	['#afterl', '#paranorm', '#medit', '#authorupro', '#bookboost']	stim thrilling emot
1093006355638771714	2019-02-06	['#ian1']	buy lov on
1093006342707658753	2019-02-06	['#amwrit', '#shortst', '#flashfict']	if an workm
1093006327717249026	2019-02-06	['#hor', '#zomby', '#thriller', '#se']	rt @pennilessscribe arcad fal award win auth ken stark
1093006318099709954	2019-02-06	['#act', '#book', '#new', '#problem', '#lif', '#bond']	three real heat cas deal ruin brax
1093006305353183232	2019-02-06	['#rickgrim', '#michon']	eq riv fin chap 6 &amp; compet part illustry distinct protect sq
1093006290551476224	2019-02-06	['#kindl', '#freeonku']	look valentine's day read check valentin elizabe lant $2
1093006263179460608	2019-02-06	['#twofortwotuesday', '#thrillers', '#eread', '#read', '#lastc']	instead chil ser kil grab start
1093006239209058304	2019-02-06	['#thriller', '#kindl']	rt@readerfaves syr '
1093006229427884032	2019-02-06	['#crimefict']	fre kindl unlimit easy kil on grav two body many
1093006216987635712	2019-02-06	[]	angel's wing websit trail amazon
1093006196133511168	2019-02-06	[]	chapt 15 hel check firework firework &amp; find georg vs dragon quit
1093006185555546113	2019-02-06	['#ya', '#fantasy']	stun adv book box set modern day meet preh immers hero mag wiel
1093006155813548033	2019-02-06	[]	fiv star review cynth hamilton inspir memoir find ruth daught quest discov moth p
1093006134510845952	2019-02-06	[]	fiv star review escap get lov lov get book 1 weav past pres
1093006123496599552	2019-02-06	['#weekend', '#book', '#twit', '#wom']	pur pimp shar intim input research &amp; storytel dar l
1093006110641086465	2019-02-06	[]	apoca[hot]lips retitl 'cupid f up' mam th
1093006071768195072	2019-02-06	['#sery', '#fanta']	broth king warry sery 1 sandr yearm via @amazon
1093006049307701249	2019-02-06	['#cozymystery', '#shortst', '#99']	favorit unlik sleu fion quin company
1093006025165279233	2019-02-06	['#poetry', '#book']	introduc illust visit @iartg @goodreads
1093006005116567553	2019-02-06	[]	tarmac silv dc3 tran europ airlin shon sunlight step kar farm perfect ai
1093005925122826240	2019-02-06	[]	am sunset p tayl 99p 99 cdn$1 fre kindl unlimit 510 pag
1093005890238730240	2019-02-06	[]	'i thorough enjoy book way charact chang look forward read book numb fiv 'b
1093005880549928960	2019-02-06	[]	hon artic feat cynth hamilton blog cam cal
1093005870617763840	2019-02-06	['#kindleunlimit']	prob best horr first chapt ev read fre 1000
1093005861671366656	2019-02-06	['#fre']	ambit corrupt murd read suicid see feb 5 high oct suspens
1093005825210241024	2019-02-06	[]	@ssbazinet @kathleenharrym1 @terrigauthor @kristyjovolchko @cm_blackwood @sayarastclair @sandrayearman @sandrajeffs1 @an
1093005780192768003	2019-02-06	[]	see lov strangely found lover's lie fict fib threads lov mak fabr univers
1093005770935975938	2019-02-06	[]	bliss cre story &amp; post easy snap fing whol lott fun going con
1093005760739639297	2019-02-06	[]	torch sery book 5 'her book get bet bet nee book 1 find cha
1093005751172382720	2019-02-06	['#dragon', '#kindl', '#yafantasy', '#boxset']	brok dragon best fix check compel &amp; follow hero friend w
1093005734252593152	2019-02-06	[]	interview @jasonefoss2 book ghost's guid haunt go check read interview
1093005724484022275	2019-02-06	[]	tal anglo merc
1093005644624474112	2019-02-06	[]	journey dark avail kindl paperback
1093005627197140992	2019-02-06	[]	on kind ooak un handmad silv charm bracelet charm bracelet mad vint charm v
1093005617625739265	2019-02-06	[]	polit us nev dead read faithless elect dark network
1093005594032816128	2019-02-06	['#bookpromot', '#bookreview']	off liv interview $30usd weeklong pro
1093005578769784832	2019-02-06	[]	1639 excerpt och abund poet styl brim wit pass
1093005569303052289	2019-02-06	[]	excerpt flam flam com com for lik volcano rag
1093005543290167296	2019-02-06	[]	brother's keep thriller heart bazinet wond job capt
1093005511379824641	2019-02-06	[]	good good good wow pet sav back badass ev addict high thriller real gre pag
1093005470665789441	2019-02-06	['#jjil', '#vest']	check j red quilt puff vest sz med petit via @ebay
1093005429490237441	2019-02-06	[]	new ring women's 925 sterl silv siz ring squ champagn col cz clear cz acc cocktail rin
1093005420082417665	2019-02-06	['#wed', '#epiconetsy', '#etsymnt', '#pott']	yay mak lov brid connecticut @etsy
1093005405754658817	2019-02-06	[]	kawai slo plush amigurum slo toy crochet slo dol photo prop valentine's day gift birthday gift slo lov gift
1093005284790992896	2019-02-06	['#6213664', '#lenox']	check lenox spyro holloww pattern expand trivet met servew via @e
1093005246148808704	2019-02-06	[]	dragon rul via @africanhomage
1093005231389134849	2019-02-06	[]	coinig part ii via @inessa_ie
1093005037968809984	2019-02-06	[]	dosseh habitu lyr video via @youtube
1093004384156426240	2019-02-06	[]	germ folkt paracels spirit fir tre
1093004365395386368	2019-02-06	['#hor', '#mystery', '#paranorm', '#monst']	lik van fac ear
1093004289725947904	2019-02-06	['#ku']	engl king queen friend lov comp sag de grey wom book
1093004279697281024	2019-02-06	['#tuesdaymot', '#tuesdaythought']	compass rad tim dala lam 5 star spirit
1093004270063009793	2019-02-06	[]	dea fath amel southerton forc becom serv aunt beat wick pass
1093004215637737473	2019-02-06	[]	zoolon 60 second cov nevermind
1093004157718618112	2019-02-06	[]	red silk ros
1093004118073982977	2019-02-06	[]	12 ter avail audiobook christmas hor short find amazon itun
1093004108502573056	2019-02-06	[]	holiday spec emit blackwel com list guest lyn lamb anny acorn griffi tuck &amp; claudet melanson excerpt
1093004098608263169	2019-02-06	[]	mer mort fae hunt oh &amp; apocalyps yeah hap unstop hum he's immov beast
1093004070636392451	2019-02-06	['#homedec', '#monkey', '#lamp', '#light', '#bellhop', '#bamboo', '#leopard', '#ebay', '#tuesdaymorn', '#tuesdaymot', '#shop']	
1093004059420905472	2019-02-06	['#candy', '#shop', '#tuesdaymot']	check candie's glit sparkl heart wristlet handb black new gift box
1093004048838602752	2019-02-06	['#shopmycloset', '#poshmark', '#urbandecay', '#makeup', '#cosmet']	poshmark urb decay vic ltd &amp; smok check
1093004019793100800	2019-02-06	[]	lov whol book real story tel word flow auth certain someth htt
1093003965577527296	2019-02-06	[]	rt @demonia24 rt @animalcouriers fly greec driv wal v
1093003902134509568	2019-02-06	['#iloveit', '#givingfeelsawesom']	hit nail right head
1093003840960585729	2019-02-06	[]	amaz book anyon feel real org relig
1093003834794889217	2019-02-06	[]	avail amazon
1093003769921658880	2019-02-06	['#hist', '#scotland']	gallow ayr lost cov grav via @drmarkjardine
1093003760165666816	2019-02-06	['#newbook', '#pir']	back pre reduc 99p 1
1093003715223740416	2019-02-06	[]	ev sign folk email ask real pric new paperback
1093003667911917568	2019-02-06	['#lesson', '#worldbuild', '#writ', '#fict', '#annihil', '#writetip', '#amwrit', '#storyt']	learn @jeffvandermeer
1093003609267204097	2019-02-06	[]	lie liv 2nd 3 corn confess sery 'sneak peek' w pgs 137 212 310
1093003598009679872	2019-02-06	[]	reun abby chilton novel abby chilton novel book 2 via @amazon
1093003586047496192	2019-02-06	['#belllet']	day let's fin end ment heal stigm
1093003571463929856	2019-02-06	['#contemporaryart', '#art', '#sculpt', '#polychrom']	playwork workplay
1093003559774445568	2019-02-06	[]	andromed sculpt ded wom
1093003475665997827	2019-02-06	['#nat', '#photograph', '#chinesenewyear']	"middl Winter"""
1093003465025040386	2019-02-06	['#nat', '#photograph', '#col', '#naturephotograph']	decemb sunr
1093003400516640768	2019-02-06	[]	greek mytholog metamorphos ovid flow plant greek myth ii via @
1093003367645937664	2019-02-06	['#whole30', '#writ']	log day via @jeanleesworld
1093003367641743360	2019-02-06	['#whole30', '#writ']	log day via @jeanleesworld
1093003343344087041	2019-02-06	['#whole30', '#writ']	log day via @jeanleesworld
1093003295013158912	2019-02-06	[]	low light de @marioorosa
1093003224854994945	2019-02-06	[]	hol on conceiv real via @the edg magazin artic dr glen hepk
1093003163274235910	2019-02-06	[]	met zoolon via @wordpressdotcom
1093003126909607937	2019-02-06	['#lov', '#art', '#brancus', '#sculpt']	brancus kiss 1907
1093003102767198210	2019-02-06	['#poem', '#poetry', '#blog']	new thank support
1093003076133404672	2019-02-06	[]	mystery writ academy
1093003005799161856	2019-02-06	[]	fre styl dant 0114 xea b
1093002983439302659	2019-02-06	[]	hannah arendt qu es la libertad via @aquileana
1093002972634726401	2019-02-06	[]	plato republ alleg cav analog divid lin via @aquil
1093002961947639811	2019-02-06	[]	mytholog arachn greek spid wom via @aquileana
1093002947192070145	2019-02-06	[]	greek mytholog poseidon god sea via @lampmagician
1093002927566934016	2019-02-06	[]	mystery writ academy via @tueswithlaurie
1093002921912999937	2019-02-06	[]	common er engl pract exerc &amp; test onlin
1093002834793189376	2019-02-06	['#5star', '#bookreview']	thank @mywritersnook fantast lov intellig eng grip writ
1093002824424742912	2019-02-06	[]	dream sum bet way escap doldrum wint read heart christmas rom se
1093002728576638976	2019-02-06	[]	kiss &amp; kil facebook ev much giveaway
1093002718774464512	2019-02-06	[]	kiss &amp; kil facebook ev much giveaway
1093002690798456832	2019-02-06	['#mot']	lif way get energy wint
1093002671534080000	2019-02-06	[]	told said sid going blow cryst sery class sci fut thrills star
1093002658892472320	2019-02-06	['#dragon', '#fieldhockey', '#ya', '#fantasy', '#adv']	on addict may help &amp; plucky friend sav ear stun
1093002644275281920	2019-02-06	[]	sto folkl heraldry influ
1093002618849374208	2019-02-06	[]	welsh legend af riv conwy folkrealm study
1093002585487876096	2019-02-06	[]	high recommend juicy sexy viol scary sometim sad &amp; gre entertain story
1093002558174576641	2019-02-06	[]	annwyn's blood mariann spirit away unknown raid everyon expect ransom demand soon follow
1093002523382824960	2019-02-06	['#rrbc']	click join awesom auth @michaeleging @michelleabbott4 @mickipeluso @mistra
1093002507482263557	2019-02-06	[]	thrilling blend lord ring king arth writ pros annwyn's blood
1093002492076531712	2019-02-06	[]	bedevil princess curs knight print fop fight sav alb begin annwyn's blood
1093002467208560641	2019-02-06	['#rrbc']	look gre read check amaz book writ @merchantspearl @mdentnagle @michaeleging @michellea
1093002457658150914	2019-02-06	[]	@michaeleging silv horn echo song roland expl dark ag cross lant legend
1093002447306612736	2019-02-06	['#mustread', '#rrbc']	lost spel tal lost horizon michael @michaeleging febru book mon select
1093002435994546183	2019-02-06	['#hist']	silv horn echo song roland @michaeleging extraordin
1093002423986257921	2019-02-06	['#rrbc']	@4willspub welcom season blog tour @ernestinerose25 via @4willspub
1093002401299267585	2019-02-06	[]	person story poetry mak award win fairy tal un book want miss
1093002390352089088	2019-02-06	[]	award win hist fantasy silv horn echo song roland high tal battl bravery
1093002355661070337	2019-02-06	[]	journey regain soul knight must strike fat blow resurg prim dark
1093002345657585664	2019-02-06	[]	savvy indy auth self publ lik boss learn in out around publ
1093002335222222848	2019-02-06	['#shortst', '#fre']	uv lin reach margin punctu red stain poetry
1093002324895764480	2019-02-06	['#insid', '#heatwav', '#tak', '#huntsm', '#bookboost', '#kindleunlimit']	stay &amp; beat
1093002315215368193	2019-02-06	['#specialnee', '#selfhelp']	alon
1093002298547208192	2019-02-06	['#fantasy', '#read']	carol mar phip @car01am ep percy jackson harry pot took world took h
1093002288338292737	2019-02-06	['#asmsg']	famy saga lik nev read welcom world bookboost pizzazz_
1093002262656573440	2019-02-06	[]	alex visit blu duck seek forget sens saw
1093002252716068867	2019-02-06	['#audiobook', '#wwi']	uv lost found
1093002237822029824	2019-02-06	['#adv', '#mystery', '#western']	nee excit read try on bestsel novel
1093002227927707648	2019-02-06	['#democr', '#forthepeop']	circul fir squad calibr
1093002215328043008	2019-02-06	[]	wham @car01am carol mar phip tom phip sup read ful review wham
1093002190615183362	2019-02-06	['#billionair']	rebound affair prom expect brok heart least that's way start
1093002157652168705	2019-02-06	['#reveng', '#thriller']	"5 review "" exampl everyth look act us"
1093002141759926272	2019-02-06	[]	award apollo's rav sweep ep celt tal forbid lov mytholog adv polit int
1093002132133949440	2019-02-06	['#mybook', '#readasampl', '#freechapt', '#mustread', '#ebook', '#allauth']	read fre sampl book allauth read sampl
1093002122646437889	2019-02-06	['#amazongiveaway']	see chant win apollo's rav curs clansm king volum 1
1093002079994548225	2019-02-06	[]	fath touch 2
1093002041096617985	2019-02-06	['#shoppingonlin', '#shopp']	inv lin wait pict tak let see found
1093002002701975553	2019-02-06	[]	16 sery satisfy soup &amp; stew recip
1093001968862326786	2019-02-06	[]	cheesy ranch beer dip mad org ingredy includ beer inspir check @michelobultr
1093001934615789568	2019-02-06	[]	marvel com immort iron fist sev capit city heav volum 2 trad paperback fract
1093001925098962949	2019-02-06	[]	vint peppy 11 wood battery op pep mil
1093001863841136642	2019-02-06	[]	ir yang @irisyang86351 beauty writ driv story bas upon two cult tim war webst mcclell
1093001852638167040	2019-02-06	[]	good nev forget hum being war auth born &amp; rais chin &amp; drew f
1093001840940204032	2019-02-06	['#wwi', '#theflyingtig']	massacr rap loot howev jay bow 5 review
1093001831029067776	2019-02-06	[]	confess includ divid religy issu govern scand gree could lit blow smal town
1093001791783010304	2019-02-06	[]	found way morn walk known king fruit as look pretty impress
1093001777983688704	2019-02-06	['#quirky', '#comedy']	shout 5 plenty laugh mom that's lead way down street
1093001748820738048	2019-02-06	[]	import piec adv would writ writ try leav part read sk
1093001704763723776	2019-02-06	['#nat', '#environ']	
1093001688687038470	2019-02-06	['#checkout', '#new', '#howto', '#mystery']	spotlight buzz guest ron voigt @rondvoigts ron writ sery
1093001653282852864	2019-02-06	['#mag', '#hist', '#mystery', '#neworl']	want play set exot erot mecc known
1093001638585999360	2019-02-06	[]	everyon who's kind enough retweet thank try retweet everyon else's tweet
1093001617631297537	2019-02-06	['#whendaddysgoingaw']	star hold destiny william shakespear rebir reborn
1093001587042279424	2019-02-06	[]	'there gonn pin away could reach &amp; grab try every avenu
1093001570898325511	2019-02-06	['#kaceykel', '#kacey', '#kellcey']	ye i'm dream lif dream want dream dream ht
1093001543329157122	2019-02-06	[]	@abpb_1920 hello sarah ad last novel smal gray dot post tal man los everyth
1093001530897248256	2019-02-06	[]	writ wing fly tig &amp; tig way say thank am pilot chines g
1092946822371467266	2019-02-06	[]	road al ivy homeless lit chronicle dec 13th 2018 fin book draft complet dat london
1092946811717849088	2019-02-06	[]	vampir reclam project vampir redempt tal fiv book sery reclaim soul on vampir tim
1092946798048694272	2019-02-06	['#booklov']	kil president's wom joe mag man sery book 2 al lew via
1092946739550658561	2019-02-06	[]	ir nuclear ambit cia clev cyb program shut thing nev go
1092946673662418944	2019-02-06	[]	insight teen girl's mind &amp; cop joy tragedy &amp; recovery abus read review k
1092946663134633985	2019-02-06	[]	5 star kellcey kacey kel 'a brav memoir find hop trauma'
1092945322811314177	2019-02-06	[]	debut novel &amp; @reesesbookclub febru book club pick dress col sky high rat 14 les
1092945272982958080	2019-02-06	[]	guy stop street tel nee wear sunglass wint wel nee
1092945155127164928	2019-02-06	[]	dang lif wom 1770s unfold lik movy
1092945145648107521	2019-02-06	['#amread']	dream verb indulg daydream fantasy someth gre desir @canel
1092945136277950464	2019-02-06	[]	thing want read check @melissaalexia17 meliss alex beauty rom today click
1092945126014488576	2019-02-06	[]	book com soon ar find first sentinel carl
1092945112462737408	2019-02-06	[]	nam many twist turn tied togeth end on joy read can't wa
1092945079881355264	2019-02-06	['#timetravel', '#soulm']	arrog king roan us necklac 3000 year texa search
1092945061225082880	2019-02-06	[]	can't believ first texa jewel book ready read excit download cop fre fro
1092944999594057730	2019-02-06	[]	help @antcolony press want choos book cov hor com vot favorit
1092944846334160900	2019-02-06	['#writingcommun', '#fantasy', '#dnd', '#wow']	real fail prop introduc writ play fan
1092944783801229312	2019-02-06	[]	minut pick dress col sky attach charact espec pru star
1092944773231665157	2019-02-06	['#writerscommun', '#wip']	help i'm writ typ hero he's suff pan attack
1092944699239862272	2019-02-06	['#kindl', '#christmas', '#kindleunlimit', '#writin']	download hous grac famy sag fre @chindiauthors
1092944668697001984	2019-02-06	[]	dign hum spirit ex beyond limit polit envy stil immov qual
1092944620928098304	2019-02-06	['#paperback']	lif lik serv undead far would sink ord surv
1092944610207453184	2019-02-06	['#puppylov']	anyon els dog funny nam sir charl cuddleswor princess penelop falk
1092944597955813376	2019-02-06	[]	surv diary sery thought provok heart wrench ep on woman's determin
1092944586329206787	2019-02-06	"['#99cents', ""#vampire's""]"	paranorm rom spotlight tak concubin part on desir broussard &gt;
1092944574341935106	2019-02-06	[]	
1092944563822571520	2019-02-06	[]	
1092944532730187777	2019-02-06	[]	pre cov check beauty mult select look someth
1092944404887846912	2019-02-06	[]	origin watercolo paint fish boat seagul mumbl swanse wal 14 11 gift ide art collect h
1092944266106732544	2019-02-06	[]	@dawnhosmer7 charact trait on col hist anoth lik dislik anoth col combin alm
1092944176453423105	2019-02-06	['#repost', '#curlygirlmethod', '#cu']	madebykimmoritz ord cur af shirt going week
1092944130429411328	2019-02-06	['#glob', '#drivingtesteduc']	16 25 ag group 15% hug 40% dea left hand sid
1092944109604667392	2019-02-06	['#awesom', '#childr']	today though book appropry childr check
1092944092395388928	2019-02-06	['#fant']	infin mantl audio promo shar link win @authorelaina @tb_narrator
1092944086414385152	2019-02-06	['#rom', '#snowday', '#medievalengland', '#blackheroin', '#medievalrom', '#fre', '#sampl']	expl
1092944058669060097	2019-02-06	['#book', '#newbook', '#newreleas', '#quasarlin', '#sery', '#f']	devlin's darl @authorpearltate
1092944048825032704	2019-02-06	[]	ka mol abl writ story jolt complac mak quest tak grant
1092944038385369088	2019-02-06	[]	chow lei ten girl hong kong island 1896 see par murd begin sequ
1092944029170454528	2019-02-06	['#fre', '#kin']	'a joy read complet enthral beauty writ arm animals' @malcolmwelshman
1092944019947249665	2019-02-06	['#poetry']	i'm follow lov lady @echoicpoetry writ nic check follow
1092944010518368256	2019-02-06	['#rt', '#theyorkshireslash']	excel read might alway agr kil method
