id	created_at	hashtags	cleaned_text
637105057675247620	2015-08-28	['#beauty', '#ey']	get best brow buck
637099295284568064	2015-08-28	['#loveison', '#fallforbold', '#ad']	gre tip lov pink
637069406988709889	2015-08-28	[]	makeup blog jamy greenberg art interview mom meet someon feel lik
637059628816334848	2015-08-28	['#loveison', '#fallforbold', '#ad']	lov tip look fal lip col revlon
637059567675944961	2015-08-28	['#mysteryhairc', '#ad']	help guess think walgreen far silky smooth
637037469880451076	2015-08-27	['#beauty', '#bbloggers']	styl idea blond hair &amp; green ey
637028143577071617	2015-08-27	['#loveison', '#fallforbold']	gre tip lov pink bold look fal lik beckham
636997145124556800	2015-08-27	[]	bet design nat alexand mcqueen
636978103324123137	2015-08-27	['#loveison', '#fallforbold', '#ad']	lov tip look fal lip col revlon
636969392652292096	2015-08-27	[]	diff persev obstin on com strong strong h w beech
636960764998217728	2015-08-27	[]	jamy greenberg art interview
636959672486891520	2015-08-27	[]	jamy greenberg art interview mom meet someon feel lik
636901861153488896	2015-08-27	['#scent', '#fragr']	scent tak back young year
636795749712457728	2015-08-27	['#makeup', '#beautytip']	onlin lesson design exclud busy wom
636727603014029313	2015-08-27	['#beautytip', '#bbloggers']	top fiv pick gorg dat night beauty
636660082831400960	2015-08-26	['#hair', '#beautytip']	effect afford hairc ye pleas @lorealparisusa
636591943791849472	2015-08-26	['#makeup', '#beautytip']	blond hair green ey check newest video tip
636524246320181248	2015-08-26	['#quot']	kind langu deaf hear blind see mark twain
636418124699582464	2015-08-26	['#beauty']	part regim absolv liv without
636350123426103297	2015-08-26	['#beauty', '#beautytip']	buy try wrong produc onlin lesson &amp; workshop
636282538097512448	2015-08-25	['#beautytip', '#datenight']	best look dat night
636214372814200832	2015-08-25	['#hair', '#beauty']	prev hair break l tripl resist
636146506567970816	2015-08-25	['#beauty', '#ey']	get best brow buck
636085941149507584	2015-08-25	['#beauty', '#bbloggers']	styl idea blond hair &amp; green ey
636017896183988225	2015-08-25	['#makeup']	favorit brand
635963713753849860	2015-08-24	['#lovingyourself', '#mondaymot', '#dailyinspir', '#quot', '#innerbeauty', '#rockit']	start week
635950339389325312	2015-08-24	['#makeup', '#beautytip']	nee new look sum onlin makeup lesson
635882209329709056	2015-08-24	['#beautytip', '#bbloggers']	top fiv pick gorg dat night beauty
635818366926721024	2015-08-24	['#mysteryhairc', '#ad']	far good walgreen excit see big rev
635814605156155396	2015-08-24	['#hair', '#beautytip']	effect afford hairc ye pleas @lorealparisusa
635708529333002240	2015-08-24	['#beautytip', '#bbloggers']	eyebrow nee help i've got cov
635704206435815424	2015-08-24	[]	groom tip learn
635704174437515264	2015-08-24	[]	groom tip learn may giv man groom habit
635640363202555904	2015-08-24	['#makeup', '#beautytip']	blond hair green ey check newest video tip
635572628720340992	2015-08-23	[]	peopl mat old get nev los beauty mer mov fac heart martin buxba
635504546110959616	2015-08-23	['#sun', '#skinc']	sun screen spray lot
635436813088329728	2015-08-23	['#beauty', '#bbloggers']	makeup comply show
635330856492658688	2015-08-23	['#beautytip', '#datenight']	best look dat night
635262866858340352	2015-08-23	['#hair', '#beauty']	prev hair break l tripl resist
635195168438775808	2015-08-22	['#beauty', '#ey']	get best brow buck
635127057064816640	2015-08-22	['#beauty', '#bbloggers']	styl idea blond hair &amp; green ey
635059252873285632	2015-08-22	['#beautytip', '#datenight']	best look dat night
634968579209883649	2015-08-22	['#hair', '#beautytip']	effect afford hairc ye pleas @lorealparisusa
634900555081641985	2015-08-22	['#beautytip', '#bbloggers']	eyebrow nee help i've got cov
634833050652803072	2015-08-21	['#makeup', '#beautytip']	blond hair green ey check newest video tip
634803464602718208	2015-08-21	['#mysteryhairc', '#ad']	week try walgreen excit see big rev
634764919133577216	2015-08-21	['#quot']	cour enough tak risk accompl noth lif muhammad al
634697203425091584	2015-08-21	['#sum', '#hair']	sum hair bun ponytail
634611595029573632	2015-08-21	[]	makeup blog chang see
634568321040580612	2015-08-21	['#bbloggers', '#makeup']	lot makeup sur help
634500810588749826	2015-08-20	['#hair', '#beauty']	prev hair break l tripl resist
634432764721410049	2015-08-20	['#beauty', '#ey']	get best brow buck
634365387417747456	2015-08-20	['#beauty', '#bbloggers']	styl idea blond hair &amp; green ey
634259020329693185	2015-08-20	[]	god want otherw would cre otherw johan von goeth
634190840383078400	2015-08-20	['#beauty', '#bbloggers']	produc tri bas rec blog
634123305180643328	2015-08-19	['#beautytip', '#bbloggers']	look lik celeb without profess makeup art
634059738485927936	2015-08-19	[]	chang see
634059737231847424	2015-08-19	['#inspir', '#inspirationalquot', '#beautyquot']	chang see
634055406369800192	2015-08-19	['#hair', '#beautytip']	effect afford hairc ye pleas @lorealparisusa
633987835549327362	2015-08-19	['#beautytip', '#bbloggers']	eyebrow nee help i've got cov
633881514124673024	2015-08-19	['#makeup', '#beautytip']	blond hair green ey check newest video tip
633813445314486272	2015-08-19	['#quot']	you happy capac see beauty anyon keep abl see beauty nev grow old franz kafk
633803892615049216	2015-08-19	[]	am throw 500 straws year destroy environ @strawenvy com perfect pair
633803864509034496	2015-08-19	[]	video show rescu plast straw turtl nostril nom plasticstraw @strawenvy don
633745926721417216	2015-08-18	['#hair', '#beauty']	straightener curl iron
633677609411457024	2015-08-18	['#makeuptip', '#beauty']	learn apply makeup lik pro
633609849536778240	2015-08-18	['#hair', '#beauty']	prev hair break l tripl resist
633481157972246528	2015-08-18	['#beauty', '#ey']	get best brow buck
633413546722881537	2015-08-17	['#beauty', '#bbloggers']	styl idea blond hair &amp; green ey
633345521495707648	2015-08-17	[]	plac go hom someon lov famy bless donn hedg
633277942433497089	2015-08-17	['#tan', '#beauty']	self tan yay nay
633171933350207488	2015-08-17	['#makeup']	sign red lip mast smokey ey breakfast onlin lesson
633103638332866561	2015-08-17	['#hair', '#beautytip']	effect afford hairc ye pleas @lorealparisusa
633073344464728064	2015-08-17	['#ysyw', '#ad']	find styl way @cvs_extra gre tip &amp; afford hair produc
633035951900618753	2015-08-16	['#beautytip', '#bbloggers']	eyebrow nee help i've got cov
633010857539145728	2015-08-16	['#ysyw', '#ad']	styl let @cvs_extra help find go shin gre tip &amp; afford hair produc
632967785094717441	2015-08-16	['#makeup', '#beautytip']	blond hair green ey check newest video tip
632900082132774912	2015-08-16	[]	cal clan cal network cal trib cal famy whatev cal whoev nee on jan howard
632794161444462592	2015-08-16	['#found']	min cream
632726153095213056	2015-08-16	['#makeup', '#girlsnit']	grab friend &amp; book onlin workshop
632658492877373440	2015-08-15	['#hair', '#beauty']	prev hair break l tripl resist
632594834553868288	2015-08-15	[]	
632590500609040384	2015-08-15	['#beauty', '#ey']	get best brow buck
632522729548312576	2015-08-15	['#beauty', '#bbloggers']	styl idea blond hair &amp; green ey
632439235182743552	2015-08-15	['#beauty', '#bbloggers']	styl idea blond hair &amp; green ey
632371486959996929	2015-08-15	['#quot']	mountain conqu hil
632328628123082753	2015-08-14	['#doggy', '#kingarth', '#truelov']	lov affair continu boudic gold retriev
632324433315631104	2015-08-14	[]	makeup blog best beauty look dat night wheth marry dat plan dat
632317059364425728	2015-08-14	[]	styl go shin smooth lov cvs gre tip &amp; afford hair produc
632305207024619520	2015-08-14	[]	best beauty look dat night
632305205959356416	2015-08-14	[]	best beauty look dat night
632303545484734464	2015-08-14	['#beautyroutin']	loofah show puff
632293587246522368	2015-08-14	[]	best beauty look dat night wheth marry dat plan dat
632286107556777984	2015-08-14	['#ysyw', '#ad']	styl let @cvs_extra help find go shin gre tip &amp; afford hair produc
632236155837227008	2015-08-14	['#beauty', '#makeuptip']	get new look sum learn apply makeup diff
632061805112729600	2015-08-14	['#hair', '#beautytip']	effect afford hairc ye pleas @lorealparisusa
631994276700884993	2015-08-14	['#beautytip', '#bbloggers']	eyebrow nee help i've got cov
631926281794416640	2015-08-13	['#makeup', '#beautytip']	blond hair green ey check newest video tip
631858546540462080	2015-08-13	[]	stubborn persist find limit stubborn go wel beyond stubborn limit robert brault
631684294025609216	2015-08-13	['#lip', '#makeup']	lip gloss lipstick
631616589847248896	2015-08-13	['#beautytip', '#bbloggers']	find in makeup art
631548819457605632	2015-08-12	['#beauty', '#ey']	get best brow buck
631481353947738112	2015-08-12	['#beauty', '#bbloggers']	styl idea blond hair &amp; green ey
631359992524877824	2015-08-12	['#fragr', '#beauty', '#spon']	scent sum
631291758954070016	2015-08-12	['#quot']	kind pow ev fond samuel johnson
631261420731146241	2015-08-12	['#ysyw', '#ad']	lov shin produc @cvs_extra gre way discov hair produc &amp; styl work
631224324389752832	2015-08-11	['#makeup', '#beauty']	oft wash makeup brush
631198909235335168	2015-08-11	['#ysyw', '#ad']	find styl way @cvs_extra gre tip &amp; afford hair produc
631179625826095104	2015-08-11	['#ysyw']	find styl way cvs gre tip &amp; afford hair produc choos smoo shin
631178781340925954	2015-08-11	['#stressed', '#timeforyourself', '#begoodtoyourself']	feel today everyon tak
631156163980185600	2015-08-11	['#beauty', '#bbloggers']	spend on day feel lik know makeup
631088740161691649	2015-08-11	[]	ready trad heavy fac wint refresh sun stil work look
630982343046623232	2015-08-11	['#beautytip', '#healthyl']	could enjoy food reap maj beauty benefit
630914298303410176	2015-08-11	['#spon', '#sum']	spritz grab cocktail dream blu oc friend
630847062817570816	2015-08-10	['#quot']	heart drunk beauty ey could nev see georg w russel
630778683310112768	2015-08-10	['#beautyproduc']	oft toss show puff
630711007481069568	2015-08-10	['#beauty', '#makeup']	conveny fun &amp; money onlin makeup lesson
630597123009069056	2015-08-10	['#sum', '#beauty']	sum beauty trend off
630536247237177344	2015-08-10	['#makeup']	war cosmet cc rady palet
630535707023388672	2015-08-10	[]	@fashionate31 thank shar
630529454473875456	2015-08-10	['#beauty', '#heal']	food thought four thing eat gorg skin
630461430530187264	2015-08-09	['#fragr', '#beauty', '#spon']	scent sum
630459960254566400	2015-08-09	[]	
630393968136728576	2015-08-09	[]	adv
630219614664957952	2015-08-09	['#quot']	man object soon possess noth object ev low bet non carlisl
630151982590914560	2015-08-08	['#makeup', '#beauty']	oft toss old makeup
630083912274939904	2015-08-08	['#makeup', '#beautytip']	anyon learn look gorg flash
630016311146491904	2015-08-08	[]	ready trad heavy fac wint refresh sun stil work look
629910307842998273	2015-08-08	['#beautytip', '#healthyl']	could enjoy food reap maj beauty benefit
629842150813995008	2015-08-08	['#spon', '#sum']	spritz grab cocktail dream blu oc friend
629774809472311296	2015-08-07	[]	story heard &amp; sometim ev help someon els
629706803459280896	2015-08-07	['#quot']	fortun fav brav ter
629639074807214081	2015-08-07	['#beauty', '#makeup']	oft toss old makeup
629532844843470848	2015-08-07	['#makeup']	want learn look flawless ev worst day
629473968865411072	2015-08-07	[]	makeup blog styl idea blond hair &amp; green ey &lt; adsbygoogl window
629464763039399936	2015-08-07	['#sum', '#beauty']	sum beauty trend off
629397475900567554	2015-08-06	['#beauty', '#heal']	food thought four thing eat gorg skin
629374487742541824	2015-08-06	[]	styl idea blond hair &amp; green ey
629374483716042752	2015-08-06	[]	styl idea blond hair &amp; green ey
629370540696932352	2015-08-06	[]	styl idea blond hair &amp; green ey &lt; adsbygoogl window
629329105704615936	2015-08-06	['#fragr', '#beauty', '#spon']	scent sum
629261398112104449	2015-08-06	[]	lif cont mom count
629147694112632832	2015-08-06	['#quot']	fin real grat body key giv lov oprah winfrey
629080003242786816	2015-08-06	['#beauty']	oft get eyebrow wax
629012081547812864	2015-08-05	['#makeup', '#beautytip', '#bbloggers']	busy ev think put mascar onlin lesson
628944589970350080	2015-08-05	[]	ready trad heavy fac wint refresh sun stil work look
628770125789970432	2015-08-05	['#beauty', '#heal']	food thought four thing eat gorg skin
628702564100538368	2015-08-04	['#fragr', '#beauty', '#spon']	scent sum
628634503930638337	2015-08-04	[]	christina day check new blog find
628567185124925440	2015-08-04	['#quot']	tak credit beauty sixteen beauty sixty soul's mary stop
628460927592046592	2015-08-04	['#datenight', '#perfum']	favorit fragr
628405872729784320	2015-08-04	[]	makeup blog get best brow buck day pencil thin brown behind us keep
628392693505335296	2015-08-04	['#beauty', '#bbloggers']	think money &amp; tim sav onlin makeup lesson
628325182562828290	2015-08-03	[]	ready trad heavy fac wint refresh sun stil work look
628261391237955584	2015-08-03	[]	get best brow buck day pencil thin brown behind us keep
628256966947831808	2015-08-03	['#beautytip', '#heal']	could enjoy food reap maj beauty benefit
628189530777124864	2015-08-03	['#spon', '#sum']	spritz grab cocktail dream blu oc friend
628083298816925696	2015-08-03	[]	watch someon continu hurt emot spirit ev phys drain soul
628036704172052480	2015-08-03	[]	makeup blog prev hair break l tripl resist rec mad drast
628015179213721600	2015-08-03	[]	us famy mean put arm around barbar bush
627947556287418372	2015-08-02	['#hair', '#shampoo']	favorit dry shampoo
627879323995926532	2015-08-02	['#makeup', '#beautytip', '#bbloggers']	stun less minut onlin lesson
627869478542446592	2015-08-02	[]	prev hair break l tripl resist
627869472934731777	2015-08-02	[]	prev hair break l tripl resist
627869209284866048	2015-08-02	[]	prev hair break l tripl resist rec mad drast
627811651417473024	2015-08-02	['#sum', '#beauty']	sum beauty trend off
627698031677337600	2015-08-02	['#beauty', '#heal']	food thought four thing eat gorg skin
627630405106147328	2015-08-02	['#fragr', '#beauty', '#spon']	scent sum
627562248458903552	2015-08-01	['#quot']	mountain conqu hil
627494805828935680	2015-08-01	['#beauty']	stun real everyon learn insid secret
627333524043902977	2015-08-01	[]	makeup blog talik lipocil ide beauty god seem think funny start
627320704640380928	2015-08-01	[]	ready trad heavy fac wint refresh sun stil work look
627252947404070912	2015-07-31	['#beautytip']	could enjoy food reap maj beauty benefit
627184851985244160	2015-07-31	['#spon', '#sum']	spritz grab cocktail dream blu oc friend
627117427109834752	2015-07-31	['#quot']	import believ believ auth unknown
627011277580275712	2015-07-31	['#makeup', '#beauty']	favorit blush
626943259286372352	2015-07-31	['#beautytip', '#bbloggers']	priv makeup lesson makeup workshop click link info
626875614985867264	2015-07-30	['#sum', '#beauty']	sum beauty trend off
626807394643935232	2015-07-30	['#beauty', '#heal']	food thought four thing eat gorg skin
626776446841679872	2015-07-30	[]	talik lipocil
626776445977673728	2015-07-30	[]	talik lipocil
626776441485553664	2015-07-30	['#talik', '#lipocil']	ide beauty god seem think funny start
626741951681970176	2015-07-30	['#fragr', '#beauty', '#spon']	scent sum
626633842170953728	2015-07-30	[]	persev keep hon bright don hang quit fash lik rusty nail monu mockery w shakespear
626608743862566912	2015-07-30	[]	makeup blog top best blush dup oth may lust lippy fuss found b
626565654120898560	2015-07-30	['#makeup', '#beauty']	bb cream must beauty routin
626498219695042560	2015-07-29	['#makeup', '#beauty']	priv lesson &amp; workshop conveny
626496573027958784	2015-07-29	[]	top best blush dup
626496568204460033	2015-07-29	[]	top best blush dup
626496554203885568	2015-07-29	['#blush']	top best dup oth may lust lippy fuss found
626429905975255040	2015-07-29	[]	ready trad heavy fac wint refresh sun stil work look
626362217592692737	2015-07-29	['#beautytip', '#healthyl']	could enjoy food reap maj beauty benefit
626248486539927552	2015-07-29	['#spon', '#sum']	spritz grab cocktail dream blu oc friend
626180892076167168	2015-07-29	['#quot']	nic import import nic auth unknown
626134779214340097	2015-07-28	[]	photo best beauty trend 2015 themakeupblog feat red lip gloss
626134768384503808	2015-07-28	['#polyvorestyl']	best beauty trend 2015
626112814290239488	2015-07-28	['#hair', '#beauty']	us two on shampoo
626045404170338304	2015-07-28	['#beauty', '#beautytip']	onlin makeup sess onlin lesson &amp; workshop
625899105206665220	2015-07-28	[]	makeup blog trend alert hair trend follow 2015 top three hair trend straight fr
625871048806924291	2015-07-28	['#beauty', '#heal']	food thought four thing eat gorg skin
625803467018371072	2015-07-27	['#fragr', '#beauty', '#spon']	scent sum
625793074006921216	2015-07-27	[]	trend alert hair trend follow 2015
625792884717977602	2015-07-27	[]	trend alert hair trend follow 2015
625791818458755073	2015-07-27	[]	trend alert hair trend follow 2015 top three hair trend straight
625735288011268096	2015-07-27	['#quot']	in beauty nee occas told beauty robert brault
625667781007175680	2015-07-27	['#shampoo', '#hair']	complet sent favorit ______ _______
625561736280719360	2015-07-27	['#makeup', '#bbloggers']	onlin makeup lesson pro
625493510804914176	2015-07-27	[]	ready trad heavy fac wint refresh sun stil work look
625425884326043649	2015-07-26	['#beautytip', '#healthyl']	could enjoy food reap maj beauty benefit
625357772499120129	2015-07-26	['#spon', '#sum']	spritz grab cocktail dream blu oc friend
625290155646156800	2015-07-26	['#quot']	look fut spend rest lif georg burn
625184113285275648	2015-07-26	['#makeup', '#beautytip']	go prim
625116053232877568	2015-07-26	['#makeup', '#beautytip']	onlin lesson design exclud busy wom
625048401823051776	2015-07-25	['#sum', '#beauty']	sum beauty trend off
624980316713844736	2015-07-25	['#beauty', '#heal']	food thought four thing eat gorg skin
624912619992969216	2015-07-25	['#fragr', '#beauty', '#spon']	scent sum
624821772244905984	2015-07-25	['#quot']	eith lif entail cour ceas lif e forst
624753663647580160	2015-07-25	['#lot', '#beauty']	best lot dry skin
624686212385755137	2015-07-24	['#beauty', '#beautytip']	buy try wrong produc onlin lesson &amp; workshop
624685539963244545	2015-07-24	[]	@thinklikeacat thank
624618101187805184	2015-07-24	['#makeup']	recr ev mendes' peach cream glow perfect fac sum
624550397710045184	2015-07-24	['#skinc', '#beauty']	decad skin car routin
624489657439506432	2015-07-24	['#beauty', '#makeup']	best beauty trend 2015
624421473629917184	2015-07-24	['#hair', '#beauty']	rul sexy hair jet rhy
624353931284611072	2015-07-23	['#quot']	healthy emot com siz healthy mind com siz healthy body com siz cher k erdm
624285852034834432	2015-07-23	['#ped', '#spring', '#sum']	year round
624218464962641925	2015-07-23	['#makeup', '#beautytip']	nee new look sum onlin makeup lesson
624166786984882176	2015-07-23	[]	makeup blog scent sum 19 abl liv europ year scent
624123504414167041	2015-07-23	[]	scent sum
624123338567237636	2015-07-23	[]	scent sum
624123318539431936	2015-07-23	[]	scent sum 19 abl liv europ year scent
624112182100365312	2015-07-23	['#beautytip']	recr ev mendes' peach cream glow perfect fac sum
624043981010300930	2015-07-23	['#beautytip', '#bbloggers']	follow right skin car regim ag
623976388740153344	2015-07-22	['#bbloggers', '#beautytip']	2015 beauty trend on tri
623908317342081025	2015-07-22	['#beautytip', '#bbloggers']	jet rhy shar fail tip get sexy gorg hair
623840723180326912	2015-07-22	['#quot']	imperfect perm inevit flaw beauty amy bloom
623734584748953600	2015-07-22	['#eyelin']	pencil liquid
623666532380446720	2015-07-22	['#beauty', '#bbloggers']	makeup comply show
623634493954396165	2015-07-21	[]	makeup blog food thought four thing eat gorg skin wom
623599068665774080	2015-07-21	['#beauty', '#celebr']	get look ev mend
623550054213615616	2015-07-21	[]	food thought four thing eat gorg skin
623550052812718080	2015-07-21	[]	food thought four thing eat gorg skin
623550038254313473	2015-07-21	[]	food thought four thing eat gorg skin wom
623530806628253696	2015-07-21	['#skinc', '#beauty']	decad skin car routin
623463175225253888	2015-07-21	['#beauty', '#makeup']	best beauty trend 2015
623402530404474880	2015-07-21	['#hair', '#beauty']	rul sexy hair jet rhy
623334321890426880	2015-07-21	[]	look lif greatest happy famy happy joyc broth
623268030856826880	2015-07-20	[]	makeup blog sum beauty trend off sum off upon us ready tra
623266719176503296	2015-07-20	['#hair']	would rath thick straight cur thin hair
623198883506688000	2015-07-20	['#bbloggers', '#makeup']	lot makeup sur help
623180438060707840	2015-07-20	[]	sum beauty trend off
623180434352910336	2015-07-20	[]	sum beauty trend off
623173292669583360	2015-07-20	[]	sum beauty trend off sum off upon us ready trad
623131374489313280	2015-07-20	['#makeup', '#beautytip']	recr ev mendes' peach cream glow perfect fac sum
623024966519402496	2015-07-20	['#beautytip', '#bbloggers']	follow right skin car regim ag
622956818239737861	2015-07-20	['#bbloggers', '#beautytip']	2015 beauty trend on tri
622889169157779456	2015-07-19	['#beautytip', '#bbloggers']	jet rhy shar fail tip get sexy gorg hair
622821017132605444	2015-07-19	['#makeup']	recr ev mendes' peach cream glow perfect fac sum
622753304305639424	2015-07-19	['#quot']	ain't cal answ w field
622647388088500224	2015-07-19	['#makeup', '#hair', '#beauty']	would rath go without week go without produc mon
622579322671472641	2015-07-19	['#beautytip', '#bbloggers']	look lik celeb without profess makeup art
622564082823098371	2015-07-19	['#pssummersoiree', '#ad']	gorg view stun scent @dolcegabbana
622532564566147072	2015-07-18	['#pssummersoiree', '#ad']	gorg view stun scent dolc &amp; gabban
622511667532988416	2015-07-18	['#skinc', '#beauty']	decad skin car routin
622443643366993920	2015-07-18	['#beauty', '#makeup']	best beauty trend 2015
622375907295141888	2015-07-18	['#hair', '#beauty']	rul sexy hair jet rhy
622300187403415552	2015-07-18	['#beauty', '#celebr']	get look ev mend
622232074263601152	2015-07-18	['#quot']	persev hard work get tir hard work already newt gingrich
622164434136510464	2015-07-17	['#makeup']	lov
622096565549821952	2015-07-17	['#makeuptip', '#beauty']	learn apply makeup lik pro
622028865506926592	2015-07-17	['#beautytip', '#bbloggers']	follow right skin car regim ag
621922655277613056	2015-07-17	['#bbloggers', '#beautytip']	2015 beauty trend on tri
621854574702395392	2015-07-17	['#beautytip', '#bbloggers']	jet rhy shar fail tip get sexy gorg hair
621787052724613122	2015-07-16	['#quot']	char heart worst kind heart troubl bob hop
621719051430166528	2015-07-16	['#makeup', '#beauty']	must beauty item keep bag
621651528798089216	2015-07-16	['#makeup']	sign red lip mast smokey ey breakfast onlin lesson
621590798652604416	2015-07-16	['#skinc', '#beauty']	decad skin car routin
621542395310534661	2015-07-16	[]	makeup blog get look ev mend peach cream sum look combin
621522425168142336	2015-07-16	['#beauty', '#makeup']	best beauty trend 2015
621454975223377920	2015-07-15	['#hair', '#beauty']	rul sexy hair jet rhy
621388849403445248	2015-07-15	[]	get look ev mend
621388814880149504	2015-07-15	[]	get look ev mend
621388814288711680	2015-07-15	[]	get look ev mend peach cream sum look combin
621386902533472258	2015-07-15	['#quot']	nev seen smil fac beauty auth unknown
621319599057936385	2015-07-15	['#celebr', '#beauty']	celebrity's look admir
621213185111126017	2015-07-15	['#makeup', '#girlsnit']	grab friend &amp; book onlin workshop
621144972083994624	2015-07-15	['#beautytip', '#bbloggers']	follow right skin car regim ag
621077616397811712	2015-07-14	['#bbloggers', '#beautytip']	2015 beauty trend on tri
621009359624126465	2015-07-14	['#beautytip', '#bbloggers']	jet rhy shar fail tip get sexy gorg hair
620941964926668800	2015-07-14	['#quot']	get wit end find god liv auth unknown
620835627941163008	2015-07-14	['#skinc', '#beauty']	what's favorit moist
620815718708162562	2015-07-14	['#hallh', '#sdcc']	that's way end panel @realstanlee
620767468575961088	2015-07-14	['#beauty', '#makeuptip']	get new look sum learn apply makeup diff
620699989308780544	2015-07-13	['#skinc', '#beauty']	decad skin car routin
620631925670215680	2015-07-13	['#beauty', '#makeup']	best beauty trend 2015
620614089081950209	2015-07-13	['#pssummersoiree', '#ad']	rsvp &amp; join sat @dolcegabbana
620564107322896384	2015-07-13	['#hair', '#beauty']	rul sexy hair jet rhy
620503612515577856	2015-07-13	['#beautytip', '#bbloggers']	follow right skin car regim ag
620435228583165952	2015-07-13	['#bbloggers', '#beautytip']	2015 beauty trend on tri
620367488606412800	2015-07-12	['#beautytip', '#bbloggers']	jet rhy shar fail tip get sexy gorg hair
620299524700020736	2015-07-12	['#quot']	liv without aim lik sail without compass duma
620231877702586368	2015-07-12	['#beauty', '#makeup']	what's favorit long last lipstick
620125798087938048	2015-07-12	['#beautytip', '#bbloggers']	find in makeup art
620057698529374208	2015-07-12	['#skinc', '#beauty']	decad skin car routin
619991050166276096	2015-07-11	[]	get 106 top @creativemarket produc wor $1498 $39
619990043801858048	2015-07-11	['#beauty', '#makeup']	best beauty trend 2015
619921987784310784	2015-07-11	['#hair', '#beauty']	rul sexy hair jet rhy
619854382016897028	2015-07-11	['#hair', '#beauty']	rul sexy hair jet rhy
619748321725411328	2015-07-11	['#skinc', '#beauty']	germ nive cr
619680309488054276	2015-07-11	[]	year grown sign find peac work get healthy
619667490470273024	2015-07-11	['#teamep', '#sdcc2015', '#comicon', '#makeupart']	girl lov much rock
619613029693587456	2015-07-10	['#quot']	cour virtu fre daniel quin
619598346492063744	2015-07-10	[]	makeup blog rul sexy hair jet rhy celebr hairstyl on favorit wom
619594066364399616	2015-07-10	['#nerd', '#sdcc2015', '#nosham', '#loveth']	@themuppets favorit thing ev
