id	created_at	hashtags	cleaned_text
984129745397911552	2018-04-11	['#fash', '#ecommerc', '#crowdfund', '#startup']	fledgl busy @ownthelookhas launch campaign @crowdcubeto rais 175 accel grow
984106370743128064	2018-04-11	['#ethicalfash', '#luxuryfash', '#fash', '#retail']	prem eth fash brand @beulahlondon op new flag stor elizabe street london's belgrav
984073797299994624	2018-04-11	[]	gre ev @theindustryfash discuss @peterwilliams53 @wlondonhotel &amp; lov see evolv
984073371615924225	2018-04-11	[]	see im &amp; highlight last night's convers w pet william chairm @boohoo @sophiawebster @wlondonhotel last night thank cam see spot im gallery we'll see next tim
984044664750788608	2018-04-11	['#fash', '#ecommerc']	glob etail @asos achiev revenu 1 first half say visit sit excess 1bn first tim
984003438374739968	2018-04-11	[]	@ardentadvisors @peterwilliams53 @wlondonhotel gre see alway
983997767302418434	2018-04-11	['#ethicalfash', '#luxuryfash', '#fash', '#retail']	prem eth fash brand @beulahlondon op new flag stor elizabe street london's belgrav
983965730986131456	2018-04-11	['#fash', '#ecommerc']	glob etail @asos achiev revenu 1 first half say visit sit excess 1bn first tim
983820367314739201	2018-04-10	['#retail']	sanpow chines own hous fras said uk depart stor us launch platform chines brand prevy unavail uk
983805301643243520	2018-04-10	['#fash', '#ev', '#london']	pet william chairm @boohoo soph webst talk top tip @theindustryfash
983737661499244545	2018-04-10	['#fash', '#ecommerc', '#entrepr']	luxury sarah cur join bout luxury brand richard radcliff non chairm mak mov wholes
983730095687905281	2018-04-10	['#fash', '#luxury', '#startup', '#entrepr']	luxury conglom @lvmh launch accel program luxury start stat camp par tak 50 start an
983674425521426432	2018-04-10	['#fash', '#ecommerc', '#entrepr']	luxury sarah cur join bout luxury brand richard radcliff non chairm mak mov wholes
983621701505298432	2018-04-10	['#fash', '#luxury', '#startup', '#entrepr']	luxury conglom @lvmh launch accel program luxury start stat camp par tak 50 start an
983412801636044800	2018-04-09	['#fashionnew', '#fashionindustry', '#fashionretail']	dai upd newslet feat new french connect toast bestsel aso jack wil sign fre cop homep
983404355528331264	2018-04-09	['#fash', '#aso', '#ecommerc', '#retail']	glob onlin giant said pois launch homew collect
983373318010097666	2018-04-09	['#watford', '#fash', '#retail']	prem fash brand @jackwills set op new multimil pound extend intu
983297150636392450	2018-04-09	['#fash', '#retail']	dan group bestsel acquir prem women's fash lifestyl brand toast french connect
983273159402115073	2018-04-09	['#entrepr', '#fash', '#retail', '#kidswear']	retail found tig philip bier bring french childr wear retail id kid u
983227785706659841	2018-04-09	['#fashionindustry', '#fashionev', '#network']	ticket sal end midnight last chant book seat convers ev boohoo chairm pet william @wlondonhotel leiecest sq 5pm tomorrow 10 april
982524740748369921	2018-04-07	['#fash', '#retail']	matern wear baby wear retail @jojomamanbebe post strong sal grow onlin
982513770483331073	2018-04-07	['#retail']	thought opin piec read weekend shop mal stop addit cinema bas leis attract look tradit cov market inspir @thechicgeekcouk think
982513150577860608	2018-04-07	['#instagram', '#fash', '#socialmed', '#market']	nic long read weekend emerg brand outsmart est brand
982318737494863875	2018-04-06	['#fashionindustry', '#fashionbusy', '#fashionnew', '#retailnew']	dai upd newslet feat story polyv ssens @yoursclothing ker dolc &amp; gabban subscrib fre cop homep
982285996262699008	2018-04-06	['#polyv', '#fash', '#ssens']	us soc shop sit respond ang acquisit immedy clos prem etail petit rev platform set rapid accru sign
982217550342729728	2018-04-06	['#fash', '#luxury']	luxury conglom ker plan ap french leg rul award 9 form saint laur cre direct hed slim
982141915473719296	2018-04-06	['#fash', '#luxury']	it design duo dolc &amp; gabban rev brand die cre trust neith touch safeguard on die
981974191930007552	2018-04-05	['#fash', '#retail']	dai upd newslet feat new @yogaclubbox @mytheresa_com @selfridges plu read @thechicgeekcouk think shop mal nee cool fact subscrib fre cop homep
981942354100867072	2018-04-05	['#retail']	find marc jay @thechicgeekcouk think brit shop mal learn market opin return mal market
981899532802908160	2018-04-05	['#activewear', '#ecommerc', '#fash', '#yog']	popul us subscrib box serv @yogaclubbox launch uk off brit custom chant access fit outfit 50% retail pric
981884681636458496	2018-04-05	[]	@theindustryfash publ latest artic est brand vs emerg brand abl eng
981835287742550016	2018-04-05	['#birmingham', '#fash', '#footwear', '#retail']	new @selfridges sho gallery op @bullring stor
981794055309922304	2018-04-05	[]	instagram strategy nee work com join us next masterclass up instagram gam 14 may 2018 ear bird ticket pric 75 avail 16 april
981781886853898240	2018-04-05	['#fash', '#ecommerc', '#retail']	onlin luxury retail @mytheresa_com launch ded span vert sit tap grow market luxury latin americ
981515436830396416	2018-04-04	['#fash', '#socialmed']	lot follow @instagram necess mean brand wel follow they're thing char brook @photoslurp show emerg brand far much bet est brand
981454587663147008	2018-04-04	['#fash', '#publ']	cond nast deny rumo ann winto ready step us vog 30 year helm ide real far
981438083898990593	2018-04-04	['#menswear', '#tail', '#fash']	dw tail trad divid afford bespok tail suit fit plac liquid though websit remain trad new ent
981221589688741889	2018-04-03	['#fashionindustry', '#fashionnew', '#fashionbusy']	dai upd new bulletin feat new victor beckham berlut h&amp;m hous fras sign fre cop homep
981209651973894146	2018-04-03	['#fash', '#bridalwear']	h&amp;m becom latest high street retail mov boom afford bridalwear spac new collect launch today kne wed dress start 39 mov 149 ful gown
981124575357480960	2018-04-03	['#east', '#retail']	relentless rain keep briton away shop holiday accord latest fig @springboard_
981114419471110149	2018-04-03	['#fash', '#retail', '#cardiff']	inditex @stradivarius mad welsh debut weekend new stor @stdavidscardiff
981065788701466624	2018-04-03	['#retail']	icym east weekend hous fras set receiv 30m cash inject chines own sanpow
981065475592458246	2018-04-03	['#fash', '#luxury']	icym east weekend victor beckham set mak 60 staff redund new invest neo invest partn seek right siz busy set path profit
981063694984495105	2018-04-03	['#fash', '#menswear', '#luxury']	lvmh confirm appoint kri van assch art direct men's luxury hous @berluti replac haid ackerman whos depart rev weekend
981061253320904705	2018-04-03	['#fashionev', '#fashionbusy']	on week go tim run sec seat next convers network ev pet william chairm soph webst &amp; boohoo 5pm tuesday 10 april @wlondonhotel book
980803774460694529	2018-04-02	['#fash']	victor beckham oblig mak 60 staff redund luxury label follow 30m invest priv equ hous neo invest partn
980473559578488838	2018-04-01	['#retail']	depart stor hous fras report receiv 30m cash inject chines own sanpow
979350942452801536	2018-03-29	['#fash', '#retail']	fiv arcad brand includ topshop topm outfit exit monk cross shop cent york
979321290027945984	2018-03-29	[]	@ardentadvisors
979299091950817280	2018-03-29	['#fash', '#retail']	prem fash chain jigsaw report struck 20m deal result carphon wareh found david ross becom maj invest busy via @skynews
979294059419365377	2018-03-29	['#fash', '#ecommerc', '#entrepr']	perform new list onlin fash brand @sosandar excess expect man sal reach 861k nin mon decemb 2017
979251894714556416	2018-03-29	['#ecommerc', '#fash', '#luxury']	@tomford launch ded platform meet incred demand uk market
979051853970378752	2018-03-28	['#fash', '#retail']	dai upd newslet feat new @stellamccartney @coaldropsyard @tomford @ted_baker &amp; read subscrib fre cop
979032688416960514	2018-03-28	['#luxury', '#fash']	luxury conglom @keringgroup brit design @stellamccartney confirm part way design tak ful control sustain brand
979019326845014016	2018-03-28	['#ecommerc', '#fash', '#luxury']	@tomford launch ded platform meet incred demand uk market
978942874552291329	2018-03-28	['#fash', '#menswear', '#footwear', '#retail']	three brit brand known qual craftsm sign stor @coaldropsyard king's cross @cheaneyshoes @formandthread @universal_works
978932441766400000	2018-03-28	['#fash']	shar giant h&amp;m slump back 60% drop quart profit ceo say busy knowledg expery abl navig cur tough tim
978681844270010368	2018-03-27	['#fash', '#retail']	young fash retail select appoint recovery busy adv quatum adv cva credit get adv propos meet 13 april
978681843703844864	2018-03-27	['#fash', '#retail', '#char']	superdry co jul dunkerton assign 1m shar sustain fish char @bluemarinef prep stand busy foc busy interest charit work
978669545211777024	2018-03-27	['#retail']	sir philip green fac direct ban collaps bhs howev domin chappel bought busy 1 could ban 15 year
978663132473233409	2018-03-27	['#fash', '#retail', '#menswear']	moss bro report profit 6 2017 weak end year exacerb stock short hamp perform
978618616693313537	2018-03-27	['#fash', '#retail']	young fash retail select appoint recovery busy adv quatum adv cva credit get adv propos meet 13 april
978588378999476227	2018-03-27	['#fash', '#retail']	jul dunkerton co @superdryand on fash retail's success entrepr annount depart busy 15 year est
978518887980560384	2018-03-27	['#fashionev']	two week go sec seat today convers network ev boohoo soph webst chairm pet william 5pm 10 april @wlondonhotel us promo cod vip20 receiv 20% discount checkout
978517097838972928	2018-03-27	['#fash', '#ethicalfash']	young fash etail giant @asos co ev modern slavery hous lord today baro lol young aso ceo nick beighton us ev cal gre transp issu industry
978290223221280769	2018-03-26	['#fash', '#retail']	mark &amp; spencer's new md cloth &amp; hom jil mcdonald unveil new top fash team retail includ new direct menswear womenswear
978190635705434112	2018-03-26	['#fash', '#retail']	new fash lifestyl brand h&amp;m group @arketofficial op first uk stor outsid london @tweetbluewater may
978158924196139008	2018-03-26	['#luxury', '#fash', '#virgilabloh']	lou vuitton appoint am cre direct virgil abloh found high streetwear label head menswear replac kim jon last week appoint lvmh stablem dior hom
978149630503505920	2018-03-26	['#retail']	struggling depart stor hous fras report approach spec lend search fin lifelin cur lend said cal ey adv fin posit report @skynews &amp; @thetimes
977849803064467458	2018-03-25	['#retail']	struggling depart stor hous fras report approach spec lend search fin lifelin cur lend said cal ey adv fin posit report @skynews &amp; @thetimes
977233066191130624	2018-03-23	[]	john lew bring crew sist brand madewel uk exclud right sel crew
977232086661812224	2018-03-23	['#retail', '#london', '#batterse']	batterse pow stat rev plan new lead retail destin op 2020
977194991150944257	2018-03-23	['#fash', '#retail']	stacey cartwright deputy chairm form ceo harvey nichol annount depart depart stor
977145511349190657	2018-03-23	['#fash', '#luxury']	us luxury group tapestry int nam ann bakst form michael kor ceo kat spad replac craig leavit left last year
977133810038067200	2018-03-23	['#fash', '#fur', '#furfr']	anim right group hum socy welcom new donn kar dkny go fur join grow list fash hous &amp; retail gucc michael kor furl ynap
977087618130350080	2018-03-23	['#fash', '#retail']	next group sal drop 0 4 year end janu 2018 pre profit 8 726 busy describ many way challeng year fac 25 year
976933756291477504	2018-03-22	['#fash', '#footwear']	us group @kennethcole sign distribut manufact deal uk gbg continu glob expand
976859330002784257	2018-03-22	['#fash']	french hous lanvin part company art direct olivy lapid on mon busy acquir chines group fosun intern
976833268497682433	2018-03-22	['#fash', '#surrey', '#guildford']	corn &amp; lifestyl brand @seasaltclothing op first stor new @tunsgatequarter
976723706247630848	2018-03-22	['#fash', '#retail']	glob lifestyl brand @ted_baker post doubl increas sal profit continu defy tough market condit
976511170688552960	2018-03-21	['#newlook', '#fash', '#retail']	new look gain overwhelm support credit landlord propos cva includ clos 60 stor rent reduc 393 stor
976495551008182273	2018-03-21	['#fash', '#retail']	form new look ceo and kristians join hong kong fash group esprit ceo
976425998022594562	2018-03-21	[]	@imshahzadk thank enco we'r glad lik
976417199622643712	2018-03-21	['#retail', '#fash', '#menswear']	menswear retail moss bro issu profit warn result stock short follow consolid supply bas
976403436295065600	2018-03-21	['#fash', '#retail']	@zara @riverisland annount maj expand stor @intulakeside essex
976357913269821440	2018-03-21	[]	meet chairm boohoo &amp; soph webst convers on fash retail's seny expery direct pet william 5pm 10 apr @wlondonhotel book us cod vip20 20% ticket
976160577662922754	2018-03-20	['#richardquin', '#fash', '#epsonquinn18']	interview fashion's brightest ris star collab @epsonuk tear rul book
976108723256078336	2018-03-20	['#fash', '#ecommerc', '#socialmed']	instagram extend shop serv uk en brand retail link direct org post item websit
976100289043451905	2018-03-20	['#fash', '#footwear', '#retail']	prem womenswear footwear retail @lkbennettlondon appoint new ceo dar top stand
976016733633904640	2018-03-20	[]	un fash revolv tak plac ment @theindustryfash fin word @thecordsco
975758831811727360	2018-03-19	['#fash', '#retail']	missguid digit chief jonath wal tak non direct rol fast plu siz brand @yoursclothing
975751275596873728	2018-03-19	['#fash', '#retail']	analyst expect strong perform @ted_baker upd market year fig lat week
975701162728083456	2018-03-19	['#fash', '#luxury', '#menswear']	brit design kim jon appoint art direct @dior hom pres first collect par men's fash week jun
975694382614577152	2018-03-19	[]	bring [ new level person cur shop preserv bout shop @johnlewisretail md paul nickold say 50th stor new extend @westfieldlondon expery yet
975680709686898689	2018-03-19	['#fash', '#retail']	missguid digit chief jonath wal tak non direct rol fast plu siz brand @yoursclothing
975673142155907072	2018-03-19	[]	board luxury onlin group @ynap yoox net vot unanim approv propos takeov swiss gro
975672589283725313	2018-03-19	['#fash', '#retail']	analyst expect strong perform @ted_baker upd market year fig lat week
974936018666295296	2018-03-17	['#fash', '#luxury', '#ecommerc']	board luxury onlin group @ynap yoox net vot unanim approv propos takeov swiss group richemont already largest sharehold edg deal clos complet
974699425548390400	2018-03-16	['#fash', '#footwear', '#collab']	design model mus @alexa_chung design caps collect @supergauk
974683135127572485	2018-03-16	['#retail', '#fash']	manchest fast fash brand @missguided plot extend expand middl east via franch deal
974614811790147584	2018-03-16	['#retail']	access brand @skinnydiplondon continu rol fiv new standalon stor @intu shop cent nationwid retail stor key young brand's expand strategy say co richard gold
974596365815775232	2018-03-16	['#fash', '#award']	edit @britishvogue @edward_enninful among hono 2018 @cfda award along dian von furstenberg carolin herrar narciso rodriguez donatell versac
974323478190018560	2018-03-15	['#fash']	anoth fashion's high profil cre direct market nin ricc confirm depart guillaum henry prevy sought downplay rumo leav
974248815283855361	2018-03-15	['#fash', '#retail']	glob fash giant h&amp;m report flat sal q1 2018
974241906225016837	2018-03-15	['#versac', '#fash', '#furfr']	donatell ind it hous drop real fur collect it access brand furl form annount fur novemb year
973999016710197249	2018-03-14	['#fash', '#retail']	glob giant @uniqlo_jp launch resort wear collect collab @tomasmaier
973997967299563523	2018-03-14	['#fash', '#retail', '#ar']	giant @zara launch ap april allow us see cloth walk talk model point design window sens
973984350407569408	2018-03-14	['#wast', '#fash']	'britons estim throw away 12 wor cloth every year' @theindustryfash
973967154285555712	2018-03-14	['#retail', '#ecommerc', '#technolog']	dub whatsap retail @usehero connect sal assocy onlin shop via 1 mess video technolog expand us back new partn
973965151966769153	2018-03-14	['#retail', '#mayfair', '#fash']	contemp luxury womenswear label @_selfportrait_ op first stor albemarl street london's
973910401741197312	2018-03-14	['#fash', '#retail', '#ecommerc']	tot sal zar par inditex 9% 25 2017 onlin sal 41% peak busy process 249 onlin ord per hour
973888857774215168	2018-03-14	['#retail', '#ecommerc', '#technolog']	dub whatsap retail @usehero connect sal assocy onlin shop via 1 mess video technolog expand us back new partn
973857298065092608	2018-03-14	['#fash', '#retail', '#ecommerc']	tot sal zar par inditex 9% 25 2017 onlin sal 41% peak busy process 249 onlin ord per hour
973638165012430848	2018-03-13	['#johnlew', '#madewel', '#fash']	bring crew's sist brand uk start landmark new stor westfield london
973587852087918597	2018-03-13	['#oxfordstreet', '#london']	plan pedest larg sect decemb year receiv strong publ support
973583233312022530	2018-03-13	['#fash', '#retail']	goal return group profit believ clos achiev aim @fcuk french connect chairm &amp; ceo issu upb stat loss narrow 0
973575690003144704	2018-03-13	['#retail', '#sportswear']	sport giant @adidas bring stad retail conceiv uk new stor op @westfieldlondon lat mon
973549563557699584	2018-03-13	['#manchest', '#manchesterarnd', '#fash', '#retail']	h&amp;m @monkiworld set op first stor nor england @manarndale
973505088458289152	2018-03-13	['#fash', '#retail']	goal return group profit believ clos achiev aim @fcuk french connect chairm &amp; ceo issu upb stat loss narrow 0
973496724823080960	2018-03-13	['#retail', '#sportswear']	sport giant @adidas bring stad retail conceiv uk new stor op @westfieldlondon lat mon
973484957652963328	2018-03-13	['#ecommerc', '#fash']	port digit smash us dai cont mobl video mo
973267867356532736	2018-03-12	['#fash']	legend coutury hubert de givenchy pass away ag 91
973253098822160384	2018-03-12	['#highstreet', '#retail']	wint pretty brut on brit onslaught continu seny analyst @cityindex @fionacincotta giv view
973128696394592256	2018-03-12	['#farfetch']	@harveynichols becom first depart stor repres onlin luxury platform via @thein
973101073723527168	2018-03-12	['#fash', '#luxury', '#ecommerc']	harvey nichol becom first depart stor repres onlin luxury platform farfetch
972180212116008961	2018-03-09	['#footwear', '#fash', '#retail']	us prem brand @colehaan ar men's sho salon @harrods follow launch liberty selfridg last year
972155016118243328	2018-03-09	['#loveforlong']	briton throw away around 12 wor cloth year due easy fix stain hol simply feel old wash 20 throw away brand new cloth accord van launch campaign
972108966292582400	2018-03-09	['#mobl']	first foc sint 2006 stil way go gre job @portermagazine @netaporter &gt;
972079201951117312	2018-03-09	['#knightsbridg', '#fash', '#retail']	span contemp womenswear brand @bimbaylola continu uk expand new stor london's
972066375626821632	2018-03-09	[]	congrat ruth chapm co @matchesfashion shortl prestigy @veuveclicquotu
972012033930440704	2018-03-09	['#winterparalymp']	@paralympicsgb athlet wear outfit design @asos today's op ceremony 12th wint paralymp gam pyeongchang pict med prospect alpin ski rac menn fitzpatrick &amp; snowboard ow pick
971797747673260032	2018-03-08	['#fash', '#femalefound', '#iwd', '#femaleentrapr', '#pressf']	pict industry meet
971797508111388672	2018-03-08	['#fash', '#ecommerc', '#med']	luxury onlin retail @netaporter say seen spik traff sint launch dai upd cont pow edit brand @portermagazine
971760291494187008	2018-03-08	['#retail', '#iwd2018']	next fac first maj eq pay claim hundr staff reg particip claim cent fact most fem shop flo staff paid 24% less most mal wareh staff
971699594261352448	2018-03-08	['#fash', '#retail']	sal profit challeng 2017 john lew partn howev strong year buoy brand in
971682832891416576	2018-03-08	['#iwd2018', '#fash']	celebr @boxpark launch competit off fre pop on fem brand retail
971681760873533441	2018-03-08	['#fash', '#luxury', '#ecommerc', '#iwd2018']	ruth chapm co @matchesfashion shortl prestigy veuv cliquot busy wom award recogn abl innov tim turmoil
971672117711339520	2018-03-08	['#tech', '#fut']	fact simply enough wom work today @ynap invest support
971651757741953029	2018-03-08	['#miltonkeyn', '#fash', '#retail']	riv island unveil new ups reg flag stor @centremk
971432007212388355	2018-03-07	['#fash', '#retail', '#shoreditch']	mark intern women's day tomorrow @boxpark off fre pop fem start sit
971431574301487104	2018-03-07	['#retail', '#ecommerc']	onlin shop giant @shopdirect appoint rank group's henry birch new group ceo; join busy lat year
971422864690868225	2018-03-07	['#miltonkeyn', '#fash', '#retail']	riv island unveil new ups reg flag stor @centremk
971386096050495490	2018-03-07	['#fash', '#retail']	new look confirm instig cva company volunt arrang today rev list 60 pot stor clos includ flag london's marbl arch
971377885658402816	2018-03-07	['#fash']	kar mil rev ambit develop glob lifestyl brand via new licens partn img
971377700043739136	2018-03-07	['#fash']	kar mil rev ambit develop glob lifestyl brand via new licens partn img
971368445332918273	2018-03-07	['#retail', '#ecommerc']	onlin shop giant @shopdirect appoint rank group's henry birch new group ceo; join busy lat year
971358810047696896	2018-03-07	['#luxury', '#fash']	victor beckham appoint form chloe ceo ralph toledano chairm brand immedy effect help ste next stag grow
971311810925252608	2018-03-07	['#fash', '#luxury', '#ecommerc']	ynap sal 17% 2 2017
971093817729388544	2018-03-06	['#fash']	sal luxury onlin group @ynap yoox net 17% 2 2017 thank strong grow across three main busy lin
971052981746618370	2018-03-06	['#fash', '#aw18', '#pfw']	stell mccartney par fash week aw18 review stell don enough prov go alon mayb mayb on brand; custom buy long term vis
971021250343694336	2018-03-06	['#pfw', '#aw18', '#fash']	alexand mcqueen review liv homep brand known top eveningwear off grad turn someth wom wear everyday liv
970988729857970176	2018-03-06	['#fash']	convers chairm boohoo soph webst pet william 5pm @wlondonhotel 10 april com &amp; hear story network fellow profess us cod vip20 sec 20% ticket
970980628274597890	2018-03-06	['#retail']	hous fraser's chines own report sel stak depart stor anoth chines busy
970921653935984641	2018-03-06	['#fash', '#ecommerc']	fast women's etail @inthestyleuk launch new io shop ap @poqcommerce ap commerc platform
970919425422626816	2018-03-06	['#entrepr', '#cryptocur', '#tail', '#menswear']	london bespok tail @artefact_london found tatyan kozhevnikov claim world's first tail off pay
970917419157016577	2018-03-06	['#fash', '#retail']	jigsaw ceo pet rui left company immedy effect 4 year rol depart com follow spec own john robinson seek sel stak firm
970734528246484992	2018-03-05	['#fash']	pet rui ceo prem retail jigsaw left rol immedy effect 4 year
970721888212275205	2018-03-05	['#luxury', '#fash', '#ecommerc']	lvmh hous @givenchy rol platform uk four europ market
970720369949765634	2018-03-05	['#aw18', '#parisfashionweek', '#fash']	lov lik us catwalk crit start com round ide demn gvasal @balenciaga ev think cristob would spin grav
970706791737774081	2018-03-05	['#aw18', '#pfw', '#fash']	par fash week ye plenty flashy trashy influ brand off want fash peopl want wear pos look @chloefashion @driesvannoten @isabelmarant
970689872678805504	2018-03-05	['#entrepr', '#cryptocur', '#tail', '#menswear']	london bespok tail @artefact_london found tatyan kozhevnikov claim world's first tail off pay
970676253542973440	2018-03-05	['#aw18', '#pfw', '#fash']	par fash week ye plenty flashy trashy influ brand off want fash peopl want wear pos look @chloefashion @driesvannoten @isabelmarant
970675407874818048	2018-03-05	[]	@amirunkhanom @chloe @driesvannoten @isabelmarant @chloefashion ha thank fix
970674068130353152	2018-03-05	['#luxury', '#fash', '#ecommerc']	lvmh hous @givenchy rol platform uk four europ market
969692712273350657	2018-03-02	[]	2 wednesday went @theindustryfash talk fash fem found includ @goatfashion @wlondonhotel &amp; last n
969638504576770051	2018-03-02	['#retail']	mik ashley's sport direct up stak debenham takeov threshold say seek strategic partn depart stor
969598185151836161	2018-03-02	['#retail']	mik ashley's sport direct up stak debenham takeov threshold say seek strategic partn depart stor
969535704941453312	2018-03-02	['#millen', '#entrepr', '#swimwear']	new body wear rang underwear seren ree les girl les boy mad mov
969503045674520577	2018-03-02	['#fash', '#parisfashionweek']	nin ricc rebut report chief design guillaum henry set depart aw18 show par fash week today last
969492790706044928	2018-03-02	['#fash', '#ecommerc']	young fash etail giant @asos annount cfo hel ashton stand
969482501872865280	2018-03-02	['#luxury', '#fash']	chines conglom fosun continu quest cre glob group annount tak maj stak luxury hosiery bodywear brand wolford
969474924355244032	2018-03-02	['#fash', '#collab']	brit herit brand @hunterboot team us retail giant @target limit collect men wom kid hom outdo
969312907891761153	2018-03-01	[]	could voic commerc driv smart speak next big trend driv onlin retail new research @occ_s
969312887574495232	2018-03-01	['#luxury', '#fash']	chines conglom fosun continu quest cre glob group annount
969309176584376320	2018-03-01	['#luxury', '#fash']	chines conglom fosun continu quest cre glob group annount tak maj stak luxury hosiery bodywear brand wolford
969268148787728384	2018-03-01	[]	@hopefashionuk lov nayn audy lov thank much gen inspir speak xx
969267861876281344	2018-03-01	[]	last night fashion's fem found ev @theindustryfash hug thank laurett antony wond
