id	created_at	hashtags	cleaned_text
792780624868237313	2016-10-30	['#valentino']	benedict cumberbatch &amp; wif soph hunt wear tot look @drstrange screening
792652274526851073	2016-10-30	['#valentino']	act andrew garfield wear tot look screening @hacksawridge bev hil
792365382241652736	2016-10-29	['#valentino', '#ss17', '#la']	ruth negg stol spotlight whit gown @lovingthefilm premy
792274786906812416	2016-10-29	['#fw1617', '#rockstudspik']	streetstyle best @bingbing_fan916 par sport look &amp; black leath bag
792108704686411777	2016-10-28	['#rockstudspik']	vaness hong ultr sleek @thehautepursuit sup chic new bag streets par
791995579098288128	2016-10-28	['#ny', '#rockstudspik']	beauty @karliekloss spot bag black leath
791723653297688576	2016-10-27	['#valentinofw1617']	@kendalljenner statuesqu silk jersey gown deep necklin @voguespain oct issu
791648153153867777	2016-10-27	['#valentinofw1617']	sparkl fring alway good ide model @glamorcus @harpersbazaarge edit
791565122804207616	2016-10-27	['#fw1617']	del col finest craftsm blend togeth @smoda edit feat gown
791559342692663296	2016-10-27	['#valentinouomo']	see new intens fragr discov ey @princepelayo
791489618658996224	2016-10-27	[]	model liub petrov pos black on jacket satin lapel &amp; tul gown appl dai delux mag
791346163521683456	2016-10-26	['#deutschmagazin', '#valentinofw1617']	light austerityf edit model @irisrotti tul gown
791293402256142336	2016-10-26	['#valentinouomo']	see new intens fragr discov ey @cupofcouple
791275047474307072	2016-10-26	['#valentinofw1617']	@kendalljenner perfect pict tul gown enrich black diamond swarovsk bead @voguespain edit
790826138788659200	2016-10-25	[]	giv shap art person rockstud rol noir
790583009972019200	2016-10-24	[]	feel energy new rhythm seduc new rockstud rol noir collect
789493805732990976	2016-10-21	['#valentino']	black sleek styl rock rockstud rol noir collect fre spirit
789141310187839488	2016-10-20	['#romanpalazzo']	cryst prism glass stud show ashl sculpt surfac hist
789103912649306112	2016-10-20	['#nyc']	@ladygaga vis red silk taffet haut cout yesterday's @tmagazine party
789101385606426624	2016-10-20	['#joan']	confess lost ag soc kne tak test lov grat angel htt
788737026900262912	2016-10-19	['#valentinouomo']	expery phys attract flash light shadow
788006043083272192	2016-10-17	[]	friend first par party im gray sorrent
787935298961440769	2016-10-17	['#valentinoss17']	discov mem show party par gray sorrent
786935458483830785	2016-10-14	['#valentinoss17']	discov mem show party par gray sorrent
786545757507596289	2016-10-13	['#valentinoss17', '#pierpaolopicciol']	collect perfect mix rom pink detail dark intarsia
786232009446129664	2016-10-12	['#valentinoss17', '#pierpaolopicciol']	yellow green col collect combin perfect contrast
785874283419410432	2016-10-11	['#valentinoss17', '#pierpaolopicciol']	liv collect vis via select backst mom
785433609423454208	2016-10-10	['#valentinoss17', '#pierpaolopicciol']	rel fash show cre direct
785147863835615234	2016-10-09	['#valentinoss17', '#pierpaolopicciol']	grac grac poetry coloro collect
784785457821265921	2016-10-08	['#valentinoss17', '#pierpaolopicciol']	discov col renaiss collect
784409664473690113	2016-10-07	[]	pierpaolo picciol first solo show @maisonvalentino watch
784409225258737664	2016-10-07	['#valentinoss17', '#pierpaolopicciol']	tak clos look col access new collect
783986911299928064	2016-10-06	"[""#pierpaolopiccioli's"", '#ss17', '#valentino']"	show friend hous attend show support wear
783718476380774400	2016-10-05	['#pierpaolopicciol']	expl new valentino spring 2017 collect
783627816713814016	2016-10-05	"['#valentinoss17', ""#pierpaolopiccioli's""]"	clos collect rev detail first solo show
783262596392742912	2016-10-04	[]	pierpaolo picciol mak solo debut @maisonvalentino see ful collect
783213675066847232	2016-10-04	['#pierpaolopicciol', '#valentinoss17']	cre direct backst first solo collect show
782861944395104256	2016-10-03	['#pierpaolopicciol']	end journey coincid start wom repres plur individ charact
782716721367027713	2016-10-02	['#pierpaolopicciol']	refin look craft unimagin skil combin velvet light patch work lac incred ey catch shad
782684717137162242	2016-10-02	['#pierpaolopicciol']	'the past del thing keep firm root push new horizon chos new beginning'
782647365874352128	2016-10-02	['#pierpaolopicciol']	'the past del thing keep firm root push new horizon chos new beginning'
782573870792474624	2016-10-02	['#periscop', '#valentinoss17']	dirett su collect pierpaolo picciol liv par
782562187827175424	2016-10-02	['#pfw']	pierpaolo picciol pres today first solo show @valentino watch liv wwd 9am est cet
782520511104294913	2016-10-02	['#periscop', '#valentinoss17']	liv join us today 3pm cet liv stream collect pierpaolo picciol
782301573812629505	2016-10-01	['#valentinoss17', '#periscop']	diary david sim collect liv stream tomorrow 3 cet
782256273773334528	2016-10-01	['#valentinoss17', '#periscop']	diary david sim collect liv stream tomorrow 3 cet
781810300525932545	2016-09-30	['#valentinoss17', '#periscop']	collect pierpaolo picciol unveil sunday octob 2nd 3 cet watch show liv
780675295640772608	2016-09-27	[]	spend qual tim couch on new best friend @maisonvalentino know design
780668060290125824	2016-09-27	['#rockstudspik', '#newyork']	new york diary feat new rockstud spik bag show us best dant mov
780336755568414721	2016-09-26	['#rockstudspik', '#newyork']	new york diary feat new rockstud spik bag on thing lov body
779223140706709504	2016-09-23	['#rockstudspik', '#newyork']	new york diary feat new rockstud spik bag sup pow would lov
778865619030671360	2016-09-22	['#rockstudspik', '#newyork']	new york diary feat new rockstud spik bag wish world
778501974694199296	2016-09-21	['#williamshakespear']	@maisonvalentino @vanessabeecroft per la haut cout theatr mund
778156163892404224	2016-09-20	['#valentino', '#rockstudballet']	ballerina entir handsewn soft ev
777776894263590912	2016-09-19	['#valentino', '#rockstudspik']	pierpaolo piccioli's first solo design handb cal
777537710558896128	2016-09-18	['#valentino', '#fall2016']	discov collect let ench
777167749067878401	2016-09-17	['#valentino', '#astrocout']	exclud mot mad shin star &amp; whirl constel
776646808093077510	2016-09-16	['#fw1617']	sign extraordin adv gath men's collect bring punk vib
776450551252852737	2016-09-15	['#valentino', '#astrocout']	align star new print
775934862200967168	2016-09-14	['#hautecout']	the aspect ad dram cre masculin grac
775610528991444992	2016-09-13	['#rockstudspik', '#newyork']	new york diary feat new rockstud spik bag describ new york word
775290862062473216	2016-09-12	[]	pierpaolo picciol mak mark @maisonvalentino launch label new rockstud spik bag
775212363452588032	2016-09-12	['#valentino', '#myrockstud']	let individ conqu bag
774955677655511041	2016-09-11	['#enchantedwonderland']	collect irresist mix bright col &amp; unexpect print
774502679196250112	2016-09-10	['#valentino', '#fw1617']	men's collect blend vit form progress harmony
774144586432196608	2016-09-09	['#rockstudspik', '#newyork']	new york diary feat new rockstud spik bag favorit col
773894368591769600	2016-09-08	['#rockstudspik']	follow maisonvalentino snapch liv cov new bag new york diary
773799778887041024	2016-09-08	['#superbrand']	ad rockstud stat bag gam @maisonvalentino first flo
773784476568711168	2016-09-08	['#rockstudspik']	access defin person object allow express on charact
773551425766825984	2016-09-07	['#valentino', '#myrockstud', '#fall2016']	bag structured design &amp; timeless styl
773113542513786880	2016-09-06	['#enchantedwonderland']	discov print mad volcano burst light &amp; flor el
772675647411851264	2016-09-05	['#valentino', '#prefall2016']	embroid long dress renew quest auth beauty
772418968782934016	2016-09-04	['#valentino', '#hautecout', '#fw1617']	discov shakespear world collect
771981071026053121	2016-09-03	['#valentino']	men's wardrob ess reread workm noir palet
771754325529931776	2016-09-02	[]	fal 2016 collect expl faraway world join journey
771622996746211328	2016-09-02	[]	queen ran jord kick 46th birthday dazzl @maisonvalentino dress
771271404784263169	2016-09-01	['#myrockstud']	ent new chapt renew icon mad leath precy detail
770966583590223873	2016-08-31	['#enchantedwonderland']	rich col palet world detail win
770305045363437568	2016-08-29	['#fw1617']	@bat_gio pur vis organz gown embroid sequin swarovsk
769814305143304193	2016-08-28	['#rockstud']	train micro platin stud back
769406616714096641	2016-08-27	['#valentino']	un collect mad contrast mot mix wash tie&amp;dy
769225414979878912	2016-08-26	['#valentino', '#fw1617']	every dress summ impuls soul haut cout collect
768734700441440259	2016-08-25	['#valentino', '#fw1617']	strong black vib feat adv campaign stev meisel
768713015638171648	2016-08-25	['#nmhandbags']	gold soph @maisonvalentino
768435191920504832	2016-08-24	[]	ar kual lump malays meanwhil back par @maisonvalentino ht
768357204462186496	2016-08-24	['#valentino']	icon min lock bag embel bright ston im via @mytheresa_com
768100490391326721	2016-08-23	['#valentino']	stand sum crowd wear coolest men backpack im @stylebop
767602210351951873	2016-08-22	['#valentino', '#greenwithenvy']	discov sho refin shad im via @4shoppinglovers
767405932934336512	2016-08-21	['#fw1617', '#hautecout']	@lalarudge wear tul gown way show par
766862347155574784	2016-08-20	['#valentino']	discov tie&amp;dy collect let in 60 vib loos
766605660574261248	2016-08-19	['#fall16']	men access feat contemp ess satisfy styl nee
766311202217570304	2016-08-18	['#valentino']	collect conceiv portrait gallery haut cout
765828042669166592	2016-08-17	['#fw1617']	new campaign capt unrep phys auth emot
765578873685684225	2016-08-16	['#valentino', '#fw1617']	dreamy vis model @iammariaborges @ellemagazine august issu
765110799102685185	2016-08-15	['#valentino', '#rockstudrollingnoir']	collect stud black cabochon
764854100315955201	2016-08-14	['#valentino', '#fw1617']	stun priyank chopr grac @instyle edit dress
764378487113195520	2016-08-13	['#valentino', '#veryvalentino']	cappuccino &amp; favorit bag discov spac cre
764016093841068033	2016-08-12	[]	russ new york flar skirt worn reinterpret ballet sho
763751835777675264	2016-08-11	['#fw1617']	get clos look custom embel men's pear king
763397009684373505	2016-08-10	['#valentino', '#fw1617']	@gwenstefani show strongest vib look @harpersbazaarus
762951573068582914	2016-08-09	['#valentino', '#fw1617']	miss finest detail men's collect
762694882850779136	2016-08-08	['#fw617']	beauty shot @chriselletweets pastel look enrich black swarovsk
762219249838333952	2016-08-07	['#valentino', '#fw1617']	@lilyaldridge photograph @giampaolosgura wear @vogue_germany
761841767918428160	2016-08-06	['#valentino', '#veryvalentino']	discov &amp; shop cre spac pop im
761479378572222465	2016-08-05	[]	introduc rockstud rol noir eleg black lov access
761215128528228352	2016-08-04	['#valentino', '#fw1617']	punk ballet mood best @marieclaire edit
760867863506722816	2016-08-03	['#fw1617']	ary westph pos @voguebroficial edit del silhouet
760399768430403586	2016-08-02	['#enchantedwonderland']	volcano heart &amp; star explod mix @marieclaire edit
760022301433749507	2016-08-01	['#valentino']	start sum adv bold embroidery &amp; strong col tie&amp;dy
759810885095260160	2016-07-31	['#valentino', '#fw1617']	men's collect col tail discov look
759433420921458690	2016-07-30	[]	pastel pink gracy mov perfect depict @bazaaruk august edit
759003072794288131	2016-07-29	['#valentino']	opt bold &amp; strong star men's camust coolest sunglass
758678458192961536	2016-07-28	['#fw1617', '#hautecout']	@styleheroine look stun tot look way show
758255582029766657	2016-07-27	[]	shar relax mom model karm pedaru star august 2016 @harpersbazaares
757644107279839233	2016-07-25	['#valentino', '#fw1617']	dens col &amp; precy detail discov haut cout
757553526419488769	2016-07-25	['#valentino', '#fw1617']	sumptu brocad inspir shakespear gre triumph cout
757500669276205056	2016-07-25	['#valentino', '#fw1617']	tak clos look haut cout jewelry alessandro gaggio
757289272319676416	2016-07-24	['#enchantedwonderland']	discov @maripolm exhibit mil par rom ny &amp; london stor
757183567248056320	2016-07-24	['#valentino']	discov spec polaroid exhibit @maripolm select bout
757138273508614144	2016-07-24	['#valentino', '#fall16']	ench wonderland polaroid @maripolm star collect
756919318319800323	2016-07-23	['#fall16']	lan godn sport look detail cloud &amp; tre @lofficiel_de cov
756828740458459136	2016-07-23	['#valentino', '#fall16']	dress &amp; mil fal star shin @spur_magazine august cov
756768341021241344	2016-07-23	['#valentino', '#fw1617']	@garrel_louis feat cov @hommesita wear tot look
756549392862023680	2016-07-22	['#fw1617']	denim fil roug men's collect
756443695621169154	2016-07-22	['#valentino', '#fw1617']	tak wardrob trip wear embroid tie overco
756368205266817024	2016-07-22	['#valentino', '#fw1617']	start in journey styl men's collect
756179453168848896	2016-07-21	['#valentino', '#fall16', '#astrocout']	beauty @rosiehw shin bright @voguethailand
756088853606178818	2016-07-21	['#valentino', '#fall16']	col butterf embel denim jacket coolest way @saks
756013361330921473	2016-07-21	['#valentino']	am ballet dant @mistyonpointe show mov @cosmopolitan
755801974772084736	2016-07-20	['#valentino']	@1bianca_b &amp; @bat_gio shin gown attend last week haut cout show
755711374945161220	2016-07-20	['#valentino', '#fall16', '#hautecout', '#fw1617']	@chufy nail tot look show
755635878681128960	2016-07-20	['#valentino', '#ss16']	alb rohrwach vis wear haut cout last week par
755447165699231745	2016-07-19	['#valentino', '#fw1617']	imagin road journey depict @baileyquotes adv campaign
755356559870341120	2016-07-19	['#valentino', '#fw1617']	liv black &amp; whit perfect @baileyquotes adv collect
755281067913846785	2016-07-19	['#valentino', '#fw1617']	sleek styl mad unmistak detail campaign @baileyquotes
755084837388562434	2016-07-18	['#valentino', '#fw1617', '#ny']	fluid dress &amp; feminin silhouet feat new campaign shot stev meisel
754946720723763200	2016-07-18	['#fw1617']	sens pow energy pres valentino campaign shot icon photograph stev meisel
754707204003991553	2016-07-17	['#valentino']	new fal 2016 campaign shot new york icon fash photograph stev meisel
754317600503566337	2016-07-16	['#valentinofw1617', '#hautecouturefw1617']	princess olymp greec talit von f fash show
754261295000588288	2016-07-16	['#fall2016', '#hautecouturefw1617']	@thefashionguitar photograph @styledumonde outsid valentino fash
754091453924708356	2016-07-15	['#enchantedwonderland', '#hautecouturefw1617']	@chufy look beauty tot look way fash show
753995371060334592	2016-07-15	[]	un polaroid art maripol celebr op new omotesando bout
753612717492174848	2016-07-14	['#valentinoomotesando']	gre art meet japanes actress @rila_fukushima photograph @maripolm op
753584872401305600	2016-07-14	['#valentino', '#omotesando']	celebr op stor @rila_fukushima &amp; cre collab @maripolm
753340773010059264	2016-07-13	['#valentino', '#hautecout', '#fw1617']	caught outsid show stun @zoekravitz wear
753257848868524032	2016-07-13	['#alexandra_ne', '#valentino', '#hautecout', '#fw1617']	thank incred illust
753185682252791808	2016-07-13	['#valentino']	meanwhil mykono beauty @anabbofficial chos custom wed dress spec day
753001076551393280	2016-07-12	['#skp', '#valentino']	bej com visit depart stor &amp; expl on kind kaleidoscop tie&amp;dy expery
752925625988423681	2016-07-12	['#omotesando', '#valentinoomotesando']	sect new bout highlight women's bag access are
752860135723266050	2016-07-12	['#tokyo']	new omotesando bout aoyam ded menswear are fin it carrar marbl
752771478752522240	2016-07-12	['#valentinoomotesando']	new omotesando bout tokyo feat magn marbl column connect two flo
752549671525093376	2016-07-11	['#valentino', '#enchantedwonderland']	exclud video art @maripolm expl collect mus @leonardlasry
752529936401989632	2016-07-11	[]	
752526216754819072	2016-07-11	['#enchantedwonderland', '#valentinoomotesando']	collect shot @maripolm celebr new omotesando bout
752523742945931264	2016-07-11	['#omotesando']	bag sal new bout collect fund support victim kumamoto earthquak
752506616889634816	2016-07-11	['#valentinoomotesando']	
752506563835944961	2016-07-11	['#valentinoomotesando']	visit @maisonvalentino med preview
752506517186867200	2016-07-11	['#valentinoomotesando']	
752496770333216768	2016-07-11	['#omotesando', '#tokyo', '#valentinoomotesando']	polaroid art @maripolm exclud display new bout
752489388827930625	2016-07-11	['#omotesando', '#valentinoomotesando']	new valentino bout op tokyo sur mak visit
752416526473523201	2016-07-11	['#hautecout', '#fallwinter1617']	indulg precy mom collect jewelry cre alessandro gaggio
751311694794723328	2016-07-08	['#fw1617']	haut cout fin depict hum spirit aspect rel
750992833436217344	2016-07-07	[]	valentino nomin pierpaolo picciol sol cre direct maison
750974858629095424	2016-07-07	['#hautecout', '#fw1617']	fin yesterday's collect every dress summ impuls soul
750856268542279680	2016-07-07	['#valentino', '#fallwinter1617']	straight catwalk first photo shoot enjoy haut cout collect
750755295811567616	2016-07-06	['#fw1617']	cre direct mar graz chiur pierpaolo picciol tak runway haut cout
750749227526086659	2016-07-06	[]	bold red taffet dress match cap &amp; black leath boot ad dram yet punk flair mood
750749043941318656	2016-07-06	[]	innoc stage; subtl mix vivid red wool abund jewelry
750744348384489472	2016-07-06	['#valentinol']	dram coat portray charact person ant patchwork apply
750744001033232384	2016-07-06	['#hautecout', '#fw1617']	embroid organz shirt dram ful feath skirt portray ultim feminin
750743026130190336	2016-07-06	[]	bead detail dress words; lov i'm heart hat i'm mind
750742369864126464	2016-07-06	[]	490 hour craftsm at rom doubl cashm velvet coat cre
750742253942009856	2016-07-06	[]	shield tend form leath piec appear lik chain mail arm black tul ruffl
750740379012509696	2016-07-06	[]	shakespear rom dress titl graz vis pink chiffon tul boul dress
750738743477272576	2016-07-06	[]	bronz impos taffet dress charact 110 hour hand paint anim contrast poplin coll
750738535381082113	2016-07-06	[]	soft black napp leath ajo fabr knot &amp; us protect in soul thu cre charact
750738114251984896	2016-07-06	[]	pow the cout transform in secret apparel took 470 hour hand work
750737304696811521	2016-07-06	['#valentino', '#hautecout', '#fw1617']	first look op masculin shap inspir elizabeth period
750736244624257025	2016-07-06	[]	alway got right @oliviapalermo ready tak seat show liv
750735514467262464	2016-07-06	['#valentino']	perfect front row complet eleg pres @millajovovich tot look
750734247053361153	2016-07-06	['#valentinol']	ad un styl tot valentino look @zoekravitz ready show
750733073189339136	2016-07-06	['#fw1617', '#hautecout']	fash flawless @miraduma ar show
750732412099948544	2016-07-06	['#lulu', '#valentino']	chines beauty look stun tot look tun watch livestream
750723488277725184	2016-07-06	[]	fac fram del gold band &amp; tied nap neck mak @patmcgrathreal hair @guidopalau
750718724106285057	2016-07-06	['#mariagraziachiur', '#pierpaolopicciol', '#valentino', '#hautecout', '#fw1617']	cre direct &amp; overs rehears
750716561678360576	2016-07-06	['#hautecout']	loc ready beauty com join us 6 cet
750709965594226688	2016-07-06	['#hautecout', '#fw1617']	inspir tak shakespear world transform emot alchemy
750707090633752580	2016-07-06	['#fw1617']	follow @maisonvalentino snapch liv upd par haut cout fash show
750685162988593152	2016-07-06	['#valentino', '#fw1617']	haut cout collect soon unveil watch 6 cet
750669009318731776	2016-07-06	['#fw1617']	mak sur join us liv par haut cout show 6 cet
750616665428287488	2016-07-06	['#fw1617', '#valentinol']	join us today 6 cet liv stream haut cout show
750602497996316673	2016-07-06	['#fw1617']	tim watch haut cout show liv par today 6 cet
750587453174611968	2016-07-06	['#valentino', '#fw1617']	pleas invit haut cout liv stream today 6 cet
750288620561559552	2016-07-05	['#fw1617']	on day left haut cout show liv par july 6th 6 cet
750255982014504960	2016-07-05	['#fw1617']	haut cout exclud streamed par july 6th 6 cet
750060740401299457	2016-07-04	['#valentino', '#fw1617']	refin craftsm haut cout liv july 6th 6 cet
749970634571210752	2016-07-04	['#valentino', '#fw1617']	miss mag haut cout show liv july 6th 6 cet
749886636872306688	2016-07-04	['#fw1617']	watch haut cout show liv par 6 cet july 6th exclud
749678247022104576	2016-07-03	['#fw1617', '#taormin']	@matildegioli pur beauty last night tul gown 70th @nastridargento award
749637416034693121	2016-07-03	['#ss16']	alb rohrwach look lik rom goddess haut cout 70th @nastridargento taormin
748783247216087041	2016-07-01	['#fw1617']	fram hypnot black &amp; whit video film @baileyquotes model mov beat wear
748557231172497408	2016-06-30	['#fw1617']	men's choos leath lac up trim stud keep beat @baileyquotes video campaign
748499064694652928	2016-06-30	['#fw1617']	strong black whit portrait sleek silhouet edgy punk vib men's video campaign @baileyquotes
748061765158707200	2016-06-29	[]	tak styl next level myrockstud bag tie pattern denim bas
747897432487297025	2016-06-28	[]	let multicol embroid butterf tak favorit sued booty
747818872259158016	2016-06-28	['#rockstud']	new tie bag beauty craft bright embroid butterf
747777935185219585	2016-06-28	['#fall16']	rockstud bag tie print ad un touch look
747701501011828736	2016-06-28	[]	
747691692791300102	2016-06-28	['#fall2016']	put best foot forward fresh cle un tie mot
747324138570686467	2016-06-27	[]	bts @maisonvalentino '17
746353273565810688	2016-06-24	['#bofw']	@maisonvalentino thrives boy funk
746353148982337536	2016-06-24	[]	see look @maisonvalentino's ss17 collect
746346254079234049	2016-06-24	['#ss17']	feel roar men's clutch miss show catch
746321367579099136	2016-06-24	['#ss17']	detail on four haut cout coat pres catwalk men's collect par
746249623744970752	2016-06-24	[]	
745974109260120064	2016-06-23	['#ss17']	enjoy glimps backst yesterday's men's show watch
745929221080551426	2016-06-23	['#ss17']	sens unfin pervad men' access app incomplet expert ey perceiv
745906094996922372	2016-06-23	['#ss17']	inspir exhibit met breu new york 'unfinished thought left visible' men's collect
745901487172259842	2016-06-23	['#ss17']	denim patchwork soft leath cross body bag watch show
745677375975854081	2016-06-22	['#ss17']	cre direct mar graz chiur &amp; pierpaolo picciol tak fin bow pres men's
745664592060223488	2016-06-22	['#valentinol']	complet incomplet look new charact acces shad army green
745662178523484160	2016-06-22	['#valentinol']	condens col palet black whit underlin aim perfect
745661374085369856	2016-06-22	[]	liv see @maisonvalentino spring 2017 menswear collect
745661358608384000	2016-06-22	[]	highlight @maisonvalentino's men's runway show
745661346780483585	2016-06-22	[]	thank real enjoy show
745656510538203136	2016-06-22	[]	prec camoufl detail dust coat pres sens pragm modul
745655042779275264	2016-06-22	['#valentinol']	brodery angla cre eth text thu keep unfin them al
745654451508215808	2016-06-22	['#valentinol']	lie spirit atelier's craftsm haut cout coat shown today
745654060229988352	2016-06-22	['#valentino', '#ss17']	zoomorph embel sleev show fierc proport detail men's
745653610634166272	2016-06-22	['#valentinogaravan', '#verushk']	reintroduc san gallo lac look inspir '67 panth print
745647918707838976	2016-06-22	['#ss17']	unfin detail explain inspir men's incomplet keep al spirit cre
745647030081552385	2016-06-22	['#valentinol']	almost show tim @bryanboy ar tak seat
745646269549404161	2016-06-22	['#springsummer17', '#valentino']	ready tak front row seat welcom @findthewalker show
745643379703300099	2016-06-22	['#valentinol']	yang yang look effortless eleg valentino tot look
745641488323837952	2016-06-22	['#springsummer17']	cre direct mar graz chiur pierpaolo picciol ar men's collect
745639884971515904	2016-06-22	['#ss17']	join us way chic venu soon com liv men's
745634265979817984	2016-06-22	['#ss17']	today's mood inspir art &amp; cre process watch liv 5
745632767245946880	2016-06-22	['#ss17']	he's ready hit runway men fash show start
745630068077109248	2016-06-22	[]	groom process almost tim tun 5 cet
745623997820321793	2016-06-22	[]	ad fin touch backst beauty @guidopalau join liv stream 5
745612342675841028	2016-06-22	['#springsummer17']	join us today 17 liv stream men's collect
745604000993677312	2016-06-22	['#ss17']	we'r liv day today follow along access behind scen show
745597317210845184	2016-06-22	['#valentinol']	join us today
745578848088100864	2016-06-22	['#fw1617']	jacket inspir pear king london new ad campaign shot @baileyquotes break today
745564604751839232	2016-06-22	['#fallwinter1617', '#valentinol']	mak stat fring leath shot @baileyquotes new ad campaign
745557136822902784	2016-06-22	['#fw1617']	feel sup pow tie cap shot @baileyquotes ad campaign break today
745530873076822018	2016-06-22	['#ss17', '#par']	watch men's show streaming today liv 5 cet
745517228716503040	2016-06-22	['#ss17']	men's show liv stream today 5 cet
745325234425827328	2016-06-21	['#ss17']	long last men's show liv stream tomorrow 5 pm cet
745294508917592064	2016-06-21	['#valentinol', '#ss17']	enjoy mom men fash show tomorrow 5 pm cet
745289100844994560	2016-06-21	['#summitcnmi2016']	convers fut p @renzorosso mod @marchettisimone
745289087289016320	2016-06-21	[]	fash import rol defin trend nee anticip market accompany stefano sass @maiso
745276416237969408	2016-06-21	['#ss17']	new season new collect rev tomorrow 5 cet
745248638671130627	2016-06-21	['#ss17', '#par']	join us tomorrow 5 cet watch men's show liv
745242096093769733	2016-06-21	['#ss17']	inspir inspir new men's show streaming liv tomorrow
745210369535283200	2016-06-21	['#ss17']	nev say nev join us tomorrow 5 liv stream men's show
745195943864209411	2016-06-21	[]	origin join us jun 22nd 5 cet men's show liv par
