id	created_at	hashtags	cleaned_text
882239102065795072	2017-07-04	['#fallwinter1718', '#periscop']	prem ir stranieri &amp; group seamstress work cre liv tomorrow
882215047593947136	2017-07-04	['#fallwinter1718', '#pierpaolopicciol', '#periscop']	fin touch collect design cre direct liv
882170572767059968	2017-07-04	['#fw1718']	del &amp; eleg piec organz icon red ready part
882140840709193728	2017-07-04	['#fallwinter1718']	pink glimps new collect stay connect discov show liv july 5th 6 cet
881941550523199488	2017-07-03	['#fallwinter1718']	new gen work new collect liv july 5th 6pm cet
881916156436721664	2017-07-03	['#fallwinter1718', '#pierpaolopicciol']	precy collect cre direct
881871814565273600	2017-07-03	['#fw1718']	mar antoniett de angel prem work metic collect
881831833742323712	2017-07-03	['#fallwinter1718', '#pierpaolopicciol']	liv par collect unveil wed july 5th 6 cet
881550784265170948	2017-07-02	[]	@annieleibovitz capt actress @ellefanning @voguemagazine long dress embroidery reproduc lot mot
881452315475050496	2017-07-02	['#prefall17']	@glassbook magazin shot feat flow print silk pajama collect
881127601510776832	2017-07-01	['#prefall17', '#pierpaolopicciol']	flow print dress capt may issu @harpersbazaarjp
880871084643319808	2017-06-30	['#fallwinter1718']	@bellahadid star cov @instyle vict ag pink long dress collect
880775484916867072	2017-06-30	['#prefall17']	@harpersbazaarjp capt model wear flow gown bicol knit top anoth embroid dress
880698132937494528	2017-06-30	['#valentinouomoacqu']	subvert dep disench charm modern expl fresh intens
880447589354807296	2017-06-29	['#valentinodonnaacqu', '#valentinouomoacqu', '#alasdairmclel', '#clementchabernaud']	go backst &amp; campaign &amp; @maartjeverhoef
880393347969548290	2017-06-29	['#valentinodonnaacqu']	irrev clash light &amp; indulg sparkl &amp; feminin fragr
880328210604593152	2017-06-29	['#valentinouomoacqu']	scent souvenir way lif cle chabernaud shot alasdair mclellan show masculin del
880088742802976769	2017-06-28	['#valentinouomoacqu', '#valentinodonnaacqu']	invit fal lov un scent &amp; com togeth it palac background
880021128688918528	2017-06-28	['#valentinodonnaacqu']	introduc acqu latest wom men fragr maison @maartjeverhoef's incarn cod
879776370624053248	2017-06-27	['#vltn', '#valentinomenss18']	it' logo watch show
879726471304163329	2017-06-27	['#valentinomenss18', '#vltn', '#ss18']	enjoy glimps backst show discov new collect
879602721120071680	2017-06-27	['#vltn', '#valentinomenss18']	clos logo print shirt rel atmosph
879413971794632704	2017-06-26	['#valentinomenss18']	tak clos look new coat accompany body alway let back
879338488151162880	2017-06-26	['#valentinomenss18', '#pierpaolopicciol']	bright col meet finest fabr collect cre direct
879285563416772608	2017-06-26	['#valentinomenss18']	strongly influ streetwear sport new collect
879051587200602112	2017-06-25	['#ss17']	@sergeibaka_7 @raptors wor indigo jacket handmad embroid patch collect
878953428885491715	2017-06-25	['#fw1718', '#flycrew']	effortless gentlem @fra_scianna wear look collect pair pair sneak
878893030299717633	2017-06-25	['#ss17', '#valentinomenss18']	model @iza_goulart superb vis flowy dress mad chiffon &amp; georget
878689209862594560	2017-06-24	['#valentinomenss18', '#valentino', '#panth']	@jharden13 @houstonrockets attend show wear souvenir jacket
878613711564320768	2017-06-24	['#vltn', '#ss18', '#heroestrib']	new sneak show sporty attitud fring intars detail
878515560660705280	2017-06-24	['#valentinomenss18']	shiny monochrom tot real globetrot watch collect
878319251211247619	2017-06-23	['#vltn', '#ss18', '#heroestribe1']	trib mot meet bold col sporty mat look unmistak urb sneak
878215931008172032	2017-06-23	['#heroestribe1', '#vltn', '#valentinomenss18']	sneak collect strong detail embel col trim sued bas
878176418932436992	2017-06-23	['#vltn', '#ss18', '#valentinomenss18']	milit inspir backpack ol green canva ready conqu outfit collect
877972813407174657	2017-06-22	['#vltn', '#heroesreflex', '#valentinomenss18']	smal mir coolest detail discov new sneak show
877882454463401984	2017-06-22	['#pfw', '#valentinomenss18', '#pierpaolopicciol', '#vltn', '#ss18']	straight new collect watch show
877846533965627393	2017-06-22	['#valentinomenss18', '#pfw', '#ss18', '#vltn']	show op touch sport touch cout
877814395664859137	2017-06-22	['#valentinomenss18', '#pierpaolopicciol']	collect ful trac world &amp; cult show
877790624203681792	2017-06-22	['#vltn', '#valentinomenss18']	nylon cotton acet precid dynam mat aristocr touch:
877664201375969281	2017-06-21	['#valentinomenss18', '#pierpaolopicciol']	wardrob archetyp mad individ divert disassembling's vacil
877595652640788481	2017-06-21	['#valentinomenss18']	look street discov perspect everyday conscy welcom divers
877583934355361793	2017-06-21	[]	sport &amp; at antiteth langu reconcil research hum &amp; auth express valentinomenss18 collect
877554709791293441	2017-06-21	['#valentinomenss18', '#pierpaolopicciol', '#par']	collect liv tak front row seat
877538283470946305	2017-06-21	['#pfw', '#valentinomenss18', '#pierpaolopicciol']	ready set go watch show today jun 21st 5 cet
877526550899343361	2017-06-21	['#periscop', '#valentinomenss18', '#pierpaolopicciol', '#par']	tun 5 cet watch show liv
877511443289038848	2017-06-21	['#valentinomenss18']	follow us snapch maisonvalentino gre @dwyanewade tak account show
877496352153911296	2017-06-21	['#valentinomenss18', '#ss18', '#vltn']	exclud sneak peek behind scen hour fash show
877479770233155584	2017-06-21	['#valentinomenss18', '#vltn', '#pfw']	less hour collect tun today 5 cet
877462375883997184	2017-06-21	['#valentinomenss18']	behind scen mom collect pres today 5 cet watch liv
877445193175355392	2017-06-21	['#ss18', '#par', '#valentinomenss18', '#periscop']	stol shot cast show liv 5 cet
877431964441214976	2017-06-21	['#ss18', '#valentinomenss18']	fit begun fash show liv today 5 cet
877211103910137856	2017-06-20	['#ss18', '#par', '#valentinomenss18']	collect get ready miss fash show liv tomorrow 5 cet
877201892824068096	2017-06-20	['#valentinomenss18']	reserv seat tomorrow liv streamed 5 cet
877179257327304704	2017-06-20	['#valentinomenss18']	miss show liv par tomorrow 5 cet
877151393207005184	2017-06-20	['#valentinomenss18', '#par']	count day show capt collect get ready tomorrow 5 cet
877076802627358721	2017-06-20	['#par', '#valentinomenss18', '#vltn']	energy &amp; relax vib tak way tomorrow 5 cet rev
877050907703169025	2017-06-20	['#valentinomenss18', '#par']	follow us first see new collect liv jun 21st 5 cet
876915013499338752	2017-06-19	['#valentinomenss18']	detail tak clos look discov nee know upcom show
876860072655282176	2017-06-19	['#valentinomenss18']	mom show day new collect liv streamed jun 21st 5 cet
876796607089582081	2017-06-19	['#valentinomenss18', '#pierpaolopicciol']	count day fash show liv la vil lumy wednesday jun 21st 5 cet
876750457804386304	2017-06-19	['#valentinomenss18', '#pierpaolopicciol']	liv par collect rev jun 21st 5 cet
876733520143691776	2017-06-19	['#valentinomenss18']	collect unveil jun 21st 5 cet expery atmosph liv par
876540808924717056	2017-06-18	['#fallwinter1718', '#kesglozy']	subtl disrupt gentl distort defin man wear enjoy men's video campaign
876473909171892224	2017-06-18	['#fallwinter1718']	new refin punk attitud men campaign photograph london @baileyquotes
876439342562123776	2017-06-18	['#fallwinter1718', '#pierpaolopicciol']	london east end perfect indust set men collect shot @baileyquotes
876412731816935427	2017-06-18	['#fallwinter1718']	charm distinct sign spont ign rul men campaign @baileyquotes
876395292307988482	2017-06-18	[]	beauty birthright reclaim herit jamy reid slog capt @baileyquotes london east end new men`s campaign
876287023832846338	2017-06-18	['#fallwinter1718']	freedom rebel tru attitud introduc new men campaign photograph london @baileyquotes
876137394528952322	2017-06-17	['#orlandobloom', '#ss17']	weekend vib @poses @gqitalia motorcyc saddl wear denim jacket
876031690258305024	2017-06-17	['#levidyl', '#ss17', '#pierpaolopicciol']	lost mom @vman feat trench coat modern fit design
876001485418512384	2017-06-17	['#pierpaolo']	@mikasounds wear suit espec cre cre direct picciol @gq_france
875797651794477056	2017-06-16	['#levidyl', '#ss17']	grandson legend bob dyl fierc pos @crfashionbook wear camoufl jacket
875714598447398914	2017-06-16	['#luomovog', '#ss17']	am paint &amp; model @miles_mcmillan may 2017 edit wear tail trench coat
875659881000427520	2017-06-16	['#panth', '#fall17']	french act @hug0becker capt intens shot @apollomagazine wear jump men collect
875435244412747777	2017-06-15	[]	menswear ess class pea coat tak next level old school tattoo embroidery
875337123674562560	2017-06-15	['#tattoo']	print print elev punk styl wear check pant camoufl milit jacket &amp; embroidery
875282835245940737	2017-06-15	['#valentino', '#tattoo']	tak clos look coolest vars jacket men collect embel old school tattoo el
875057763352666112	2017-06-14	['#tattoo']	fash form express wear styl match camoufl &amp; tart print embroidery &amp; stud
874967161671897088	2017-06-14	['#pierpaolopicciol', '#tattoo']	cre direct revisit brit styl check coat finest embroidery
874923375633858563	2017-06-14	['#tattoo', '#pierpaolopicciol']	sign inspir london punk subcult bring new attitud men collect
874665187483111428	2017-06-13	['#tattoo', '#pierpaolopicciol']	symbol &amp; sign cre belong shop new collect cre direct
874604772497567744	2017-06-13	['#tattoo', '#pierpaolopicciol']	fresh way wear trench coat bright bold col collect
874537529726431232	2017-06-13	['#tattoo', '#pierpaolopicciol']	collect cre direct class fit polo shirt meet old school tattoo embroidery
874155890773045250	2017-06-12	['#nyc', '#sashakichigin', '#valentinoinnewyork', '#prefall17']	inspir model talk sens freedom feel city
874101773513961472	2017-06-12	['#ellamcrob', '#nyc', '#chiarac', '#valentinoinnewyork', '#prefall17']	model sing song recal daydream film
873816159463907328	2017-06-11	['#giedredukauskait', '#nyc', '#prefall17']	model shar feel impress first tim film @chiaraclementefilms
873464777476980736	2017-06-10	['#springsummer17']	dress lik bohem dream pastel shad ris star @halstonsage wear fluid chiffon dress
873169451323097090	2017-06-09	['#valentino']	act @beppefiorello attend 2017 mckim med gal tot look
873124965737873409	2017-06-09	['#vittoriapuccin', '#valentino', '#prefall17']	actress attend 2017 mckim med gal gown
873080486020620291	2017-06-09	['#prefall17']	actress @matildegioli wear embroid gown yesterday mckim med gal rom
872874137240424448	2017-06-08	['#valentino']	film direct @theoriginalgabs attend last night's mckim med gal vill aurel tot look
872857019325313028	2017-06-08	['#francescosciann', '#valentino', '#rom']	act tot look attend mckim med gal vill aurel
872819184190849025	2017-06-08	['#ss17', '#pierpaolopicciol']	fab @jlo flowy dress contrast ple design pos new @nbc show @worldofdance
872804467040804866	2017-06-08	['#achtungmod', '#ss17']	capt latest issu light flow crep de chin gown inspir bosch's 'garden earth delights'
872717296673992706	2017-06-08	['#ss17']	start sum season strong styl @glamour_de jun 2017 issu edit feat pow fre turtleneck long dress
872464123543642112	2017-06-07	['#springsummer17']	vibr col block stun @giseleofficial capt @mariotestino @vogueparis jun cov story cap
872420579533520897	2017-06-07	['#ss17']	go day night wear bright dress hippy twist seen @maartjeverhoef photograph @netaporter edit
872158654903877632	2017-06-06	['#ss17', '#dress']	tak walk red sid wear gard delight mad four diff typ crep de chin
872121122455769089	2017-06-06	['#linahoss', '#ss17']	model photograph @numero_russia april cov crochet dress embel flow plant &amp; butterf
872034399780569089	2017-06-06	['#springsummer17']	embrac sum spirit @cosmopolitande magazin star crep de chin gard delight dress ple skirt
871841575130734593	2017-06-05	['#prefall17', '#valentinogaravan']	collect spec cre @bergdorfs await tomorrow
871766076131991552	2017-06-05	['#valentinogaravan', '#demilun', '#flycrew']	tak clos look un item cre @bergdorfs bag &amp; sneak
871734545607000067	2017-06-05	['#nyc', '#prefall17', '#pierpaolopicciol']	miss @bergdorfs window ded collect display jun 6th
871403677499539456	2017-06-04	['#resort18', '#valentinogaravan']	tak clos look access sport sock worn quilt &amp; stud sand
871350841214554112	2017-06-04	['#rockstudspik', '#resort18', '#pierpaolopicciol']	new bag red shad embel whit sign stud show
871282890918641665	2017-06-04	['#resort18']	trend alert dress denim upd sum styl wear new pool slid collect
871048841612500992	2017-06-03	['#resort18', '#pierpaolopicciol']	clos look new chain matelass leath bag collect
871003561370411012	2017-06-03	[]	giv inject hip hop energy next season trend wear candy &amp; sand thin silk gym sock
870920509537398785	2017-06-03	['#resort18']	col block athlet &amp; street influ inspir new access
870678914028326912	2017-06-02	['#pierpaolopicciol', '#resort18']	norm sneak tak look wear new sporty footwear
870641159902707713	2017-06-02	['#resort18', '#valentinoinnewyork']	wash fad denim becom bag
870565663101730818	2017-06-02	['#resort18']	gym sock &amp; finest sand embel whit stud watch show
870310381562056704	2017-06-01	['#pierpaolopicciol', '#resort18', '#nyc']	cat ey mak mix '70s hip hop cult collect pres bond street
870261742772912130	2017-06-01	['#resort18', '#pierpaolopicciol', '#valentinoinnewyork']	bag detail clos new access collect design
870182010475642881	2017-06-01	['#resort18', '#pierpaolopicciol', '#valentinoinnewyork']	col palet sport eleg collect design
869908995187892224	2017-05-31	['#nyc', '#resort18', '#pierpaolopicciol']	sporty ess look feminin detail snap backst bond street collect
869476489347162112	2017-05-30	['#resort18']	next season bag perfect combin sport art craftsm maison's rom cod
869274360573505536	2017-05-29	['#resort18', '#nyc']	collect vars jacket light dress ethn embroidery capt backst bond street
869115718515687424	2017-05-29	['#resort18', '#pierpaolopicciol']	street vib maison herit tak clos look collect
868527226802667520	2017-05-27	['#resort18', '#pierpaolopicciol']	hip hop sport el merg togeth perfect collect
868444188177649664	2017-05-27	['#resort18', '#pierpaolopicciol']	backst beauty wear finest mix sporty street look collect
868391347614490628	2017-05-27	['#resort18', '#nyc']	go behind scen show via select backst mom capt bond street
868164860902756352	2017-05-26	['#resort18']	dress serv on attitud celebr cozy spacy divers collect
868110090036969473	2017-05-26	['#resort18', '#pierpaolopicciol']	enjoy mix unforget mom collect cre direct
868085486388117504	2017-05-26	['#resort18', '#pierpaolopicciol']	adorn acknowledg oneself reus form cre liv show
867651715763449856	2017-05-25	['#pierpaolopicciol', '#resort18', '#valentinoinnewyork']	enjoy sneak peek @maryjblige celebr togeth show afterparty
867407380052574208	2017-05-24	['#valentinoinnewyork', '#resort18', '#boomboomroom']	yesterday exclud afterparty top standard hotel good vib
867392437593026560	2017-05-24	['#resort18', '#pierpaolopicciol', '#nyc']	perfect bal van grac &amp; metropolit concret collect bond street
867234909328420864	2017-05-24	['#resort18', '#pierpaolopicciol']	rom meet sportswear discov ful fash show
867148162796064773	2017-05-23	['#resort18']	id construct progress dialog expand evolv form watch show
867117694344146946	2017-05-23	['#pierpaolopicciol', '#resort18', '#valentinoinnewyork']	adorn lac feminin detail on key look collect
867078070687215616	2017-05-23	['#resort18', '#pierpaolopicciol', '#valentinoinnewyork']	look street rom soul refin urb cre collect
867055660164423681	2017-05-23	['#resort18']	collect inspir perfect combin sport ethn influ hip hop cult maison herit
867023882728886272	2017-05-23	['#resort18', '#nyc']	valentino collect pierpaolo picciol liv join us front row
867005037066805250	2017-05-23	['#valentinoinnewyork', '#resort18']	discov punk sid pink less hour show liv 10am est cet
866991796139773956	2017-05-23	['#resort18', '#nyc']	follow us snapch maisonvalentino fab @shionat tak account today fash show
866976722343866368	2017-05-23	['#valentinoinnewyork']	touch pink punk join us today 10am est 3pm cet watch new collect
866808131791335424	2017-05-23	['#valentinoinnewyork', '#periscop']	today pink punk show liv may 23rd 10am est
866762672590671872	2017-05-22	['#valentinoinnewyork', '#pierpaolopicciol', '#resort18']	sav dat cre direct unveil tomorrow 10am est new collect
866744780415479808	2017-05-22	['#valentinoinnewyork', '#nyc']	pink punk vib today bond street join us liv tomorrow may 23rd 10am est 3pm cet
866709247761031168	2017-05-22	['#valentinoinnewyork', '#resort18', '#periscop']	tak sneak peek cast show liv &amp; may 23rd 10am est
866692636131827712	2017-05-22	['#valentinoinnewyork', '#resort18']	spec mom day show mak sur watch liv may 23rd 10am est
866680230940995584	2017-05-22	['#nyc', '#resort18', '#periscop']	energy inspir model cast show liv tomorrow 10am est &amp;
866663518258548737	2017-05-22	['#valentinoinnewyork', '#resort18', '#periscop']	stud wiin collect liv &amp; may 23rd 10am est
866411173712941056	2017-05-21	['#valentinoinnewyork', '#resort18']	intim detail show prep watch liv bond street may 23rd 10am est
866381780496117761	2017-05-21	['#valentinoinnewyork', '#resort18', '#pierpaolopicciol', '#nyc']	feel cult melt pot collect cre direct may 23rd 10am est
866294880259235841	2017-05-21	['#nyc', '#prefall17', '#pierpaolopicciol']	mak sur discov collect un instal @bergdorfs jun 6th
866086154797547520	2017-05-21	['#valentino', '#prefall17', '#pierpaolopicciol', '#nyc']	introduc collect spec instal @bergdorfs
866067446792409088	2017-05-20	['#resort2018', '#pierpaolopicciol', '#nyc']	collect rev tuesday may 23rd 10am est cet liv
865635671599337472	2017-05-19	['#valentinogaravan', '#rockstudspik']	ent weekend mood effortless chic @katemara hold bag
865582865253146626	2017-05-19	['#plannedp', '#fw1718']	effortless @_juliannemoore attend gal embroid black tul dress
865522220608536577	2017-05-19	['#cateblanchet', '#fw1718']	grac wear graph sabl dress cr de chin prem manifesto 2017 @tribecafilm
865238726611488768	2017-05-18	['#hautecouturess17', '#pierpaolopicciol', '#cannes2017']	alb rohrwach look lik princess dress @festival_cannes
865161580597661696	2017-05-18	['#ss17', '#hautecout', '#cannes2017']	alexandr despl &amp; domin lemonny collect gown @festival_cannes
865103649894277120	2017-05-18	['#fw1718', '#pierpaolopicciol', '#cannes2017']	it actress alb rohrwach wear leath dress cre direct @festival_cannes
864903361744601089	2017-05-17	['#fall17']	enjoy contrast navy pea coat mix bright col &amp; graph detail tattoo collect
864842975720767488	2017-05-17	['#fall17', '#tattoo']	miss outerwear collect piec dec handmad embroidery
864791178830630912	2017-05-17	['#fall17', '#tattoo']	collect inspir graph bright col old school tradit am tattoo cult
864752356264517632	2017-05-17	['#fall17']	remark soft lightweight class crew swe old school tattoo embroidery
864525872228777984	2017-05-16	[]	every man nee desert boot wardrob mak un tattoo embroidery camoufl background
864411640086880256	2017-05-16	['#fall17', '#backpack', '#punk', '#tattoo']	echo punk vib collect tattoo camoufl embroidery patch
864186123869863939	2017-05-15	['#hongkong', '#valentinobout', '#rockstudspik']	discov lee gard vast select smal med &amp; larg bag
864087981417578496	2017-05-15	['#hk', '#valentinobout']	lee gard mak us mat venet terrazzo palladian &amp; carrar marbl
864042693571170304	2017-05-15	['#valentinobout']	lee gard hong kong carry womenswear ready access fragr
863748245087936512	2017-05-14	['#valentinobout']	new showcas brand funda valu craftsm rom &amp; class styl
863665191925334016	2017-05-14	['#valentinobout']	pleas annount op 382 squ met bout lee gard hong kong
863438709701529600	2017-05-13	['#ss17']	dutch beauty @maudwelzen93 pink perfect cov @vogueaustralia wear cr de chin gown
863310359276302336	2017-05-13	['#hautecout', '#ss17']	@ellefanning @voguemagazine pal pink tul dress organz ros
863098975104016384	2017-05-12	['#pierpaolopicciol', '#lofficielhom']	cre direct goe undercov
863015926052003844	2017-05-12	[]	lov ide contemp gentl effortless eleg diff conceiv dandy
862972657691656193	2017-05-12	['#pierpaolopicciol', '#lofficielhom', '#fallwinter1718']	cre direct step front camer wear men trench coat
862668043683590144	2017-05-11	['#loveblad']	beauty @rozanneverduin wear heart sleev print pattern @voguebroficial
862615988864417792	2017-05-11	['#loveblad']	@lindseywixson seen @marieclaire_es edit wear she long dress embroid mot chest
862593355913588737	2017-05-11	[]	wish mr valentino garavan many many happy return today birthday lov everyon valentino beyond
862350896289771521	2017-05-10	['#ss17']	@lorenamaraschi @voguebroficial edit wear look collect inspir punk subcult &amp; renaiss art
862260590403874817	2017-05-10	['#ons', '#valentinoedit']	model @alimichael indulg nat beauty tradit japanes @harpersbazaarge
862238754144178177	2017-05-10	['#veronikarusakov', '#valentinoedit']	model pos @harpersbazaarjp fluid rom purpl ev dress
861959947541770240	2017-05-09	['#springsummer17']	mag mystery peac tim quintess japanes zen im via @insidefujingaho
861861171770609665	2017-05-09	['#valentinoedit']	@feifei_sun look feminin adv @southcoastplaza spring portfolio lookbook
861613003468402689	2017-05-08	[]	discov beauty mov silk pliss mid skirt styl icon trench coat seen @bazaarbr magazin
861561861434736641	2017-05-08	['#pierpaolopicciol']	afr dream @countryandtown edit model wear whit print silk ev dress design
861287038850551809	2017-05-07	['#ruthnegg', '#metgal', '#fw1718']	actress celebr first attend party dress collect
861211524861353984	2017-05-07	['#pierpaolopicciol', '#metgal']	cre direct @theweeknd strike pos custom mad tuxedo
861136029977161729	2017-05-07	['#valentinoss17', '#loveblad', '#metgal']	@jlo chang sequin minidress &amp; long ev coat party
860902001038704640	2017-05-06	['#hautecout', '#ruthnegg']	touch hand pres start fin illust cre
860773632615653377	2017-05-06	['#hautecout']	touch hand pres start fin illust cre @officialfreja
860562260095254528	2017-05-05	['#pierpaolopicciol', '#metgal']	cre direct design sleek tail look @theweeknd mom
860464106033238016	2017-05-05	['#hautecout', '#monicabellucc', '#metgal']	art custom mad gown start illust
860381046159822848	2017-05-05	['#hautecout', '#metgal']	art custom mad gown start illust @jlo
860184767425159168	2017-05-04	['#pierpaolopicciol', '#metgal', '#metmo']	cre direct beauty @jlo
860109266346065920	2017-05-04	['#metmo', '#pierpaolopicciol', '#metgal']	cre direct monic bellucc outsid pier way
859837489053179904	2017-05-03	['#metgal', '#valentino']	@jlo hit red carpet custom mad haut cout gown alex rodriguez @arod
859818145841893376	2017-05-03	[]	cat blanchett's @maisonvalentino pair sart poetry
859818046285910017	2017-05-03	['#metgala2017', '#valentino', '#harrywinston']	macho bello... @maisonvalentino
859775007060357120	2017-05-03	['#pierpaolopicciol', '#ruthnegg', '#hautecout', '#ss17', '#metgala2017']	cre direct stand proud @officialfreja wor
859491761982504961	2017-05-02	['#valentinogaravan', '#monicabellucc', '#metgal']	mr icon epitom chic custom mad haut cout gown
859406717154623489	2017-05-02	['#ruthnegg', '#hautecout', '#metgal', '#pierpaolopicciol']	statuesqu beauty spring 2017 cre direct
859363342091259905	2017-05-02	['#metgal', '#valentino', '#pierpaolopicciol']	grammy win @theweeknd look sharp tuxedo spec design cre direct
859316247674191873	2017-05-02	['#metgal', '#pierpaolopicciol']	on @jlo look stun custom mad gown cre direct
859130137744486401	2017-05-01	['#nyc']	follow cre direct pierpaolo picciol liv ig story met bal red carpet cov dress
859075627701415936	2017-05-01	['#vpunk', '#pierpaolopicciol']	punk dead al kick sneak
858952944292593667	2017-05-01	['#pierpaolopicciol', '#loveblad']	street look nev look good new backpack com print season
858594092313456642	2017-04-30	['#vpunk', '#pierpaolopicciol']	stay punk monochrom new sneak cre direct
858444785794908160	2017-04-29	['#vpunk', '#pierpaolopicciol']	punk nev sleek introduc new sneak
858284653551251456	2017-04-29	['#vpunk']	black red pink whit choos sneak best suit mood
858222909613109248	2017-04-29	['#vpunk']	tak break rul new men bag enrich stud bik chain wallet
857943596380684288	2017-04-28	['#vpunk', '#pierpaolopicciol']	sneak go punk meet new sneak collect
857876324920283136	2017-04-28	['#valentinoedit']	crep de chin turtleneck dress ple skirt @dazedkorea
857580106444816384	2017-04-27	['#valentinoss17']	get ench jacket inspir bosch's 'the gard earthy delights' @dazedkorea
857489517577519105	2017-04-27	['#valentinoss17']	dant crep de chin pink dress edit @dazedkorea
857270564364337152	2017-04-26	['#valentinoss17', '#loveblad']	A pink runway look access valentino garavan minaud @voguebroficial
857202621248962561	2017-04-26	['#valentinoss17']	@lindseywixson star may cov @bazaaruk turtleneck dress
857127127954497536	2017-04-26	['#valentinoss17']	inspir art feminin silhouet softest pink @voguebroficial feat chiffon dress
856930815355244545	2017-04-25	['#valentinoss17', '#valentinoedit']	flow dress drap back star @vogueportugal edit
856870431738875904	2017-04-25	['#valentinoss17', '#pierpaolopicciol']	relax styl wear chiffon lac velvet gown seen @graziauk
856794925244964865	2017-04-25	['#valentino', '#ss17', '#valentinoedit']	satin runway look collect star @numeromagazine
856542317175611392	2017-04-24	['#springsummer17']	queen thing pink @zandra_rhodes work origin print sign styl collect
856496137804623872	2017-04-24	[]	attract valentino project beauty dress lend wond print @zandra_rhodes
856462099953967105	2017-04-24	['#thinkpink']	liv breath on @zandra_rhodes
856183411051855872	2017-04-23	['#tokyo', '#valentinobout', '#ginza6']	visit new expery innov &amp; luxury stor conceiv
