id	created_at	hashtags	cleaned_text
1093192827968868352	2019-02-06	['#valentinoss19', '#vring', '#pierpaolopicciol']	can story city serv backdrop night extrem beauty ter converg new film feat new bag shot cre direct
1092863886565564418	2019-02-05	['#springsummer19', '#pabloarroyo']	dialog col form defin absolv kind beauty backst shot
1091124433266323456	2019-02-01	['#springsummer19', '#pierpaolopicciol']	everyth turn rot evolv rep bloom show
1090299821037142016	2019-01-29	['#ozark', '#valentino', '#sagaward']	25th an @sagawards jason batem win outstand perform mal act dram sery rol netflix's wor tuxedo
1090299620050243586	2019-01-29	['#valentinoprefall19', '#pierpaolopicciol', '#sagaward']	@janefonda attend 25th an @sagawards red dress
1090299325010403328	2019-01-29	['#springsummer19', '#pierpaolopicciol']	weightless hue expand vibr weightless fabr fre flow backst mom show shot @kevintachman
1089936741325254656	2019-01-28	['#springsummer19', '#pierpaolopicciol']	vocab langu cout chang speak body in solemn celebr spec absolv kind beauty backst mom show shot @kevintachman
1089936494318489600	2019-01-28	['#springsummer19', '#pierpaolopicciol']	repertoir class haut cout mad ruffl fril fring volum flow transform pres hier nobl corp show shot @kevintachman
1089852269644926976	2019-01-28	['#springsummer19', '#pierpaolopicciol']	emot synesthes @patmcgrathreal's leath lash show
1089582941347504129	2019-01-27	['#springsummer19', '#pierpaolopicciol']	ir germanic superstit @naomicampbell collect black taffeta organz dress vol lac tul combinas
1089553776787247109	2019-01-27	['#ugbadabd', '#springsummer19', '#pierpaolopicciol']	chocol dhal collect organdy crinolin organz chocol hood jacket dress max vol
1089551911534190593	2019-01-27	['#sabahkod', '#springsummer19', '#pierpaolopicciol']	giacinto lill collect lilac taffeta cap terracott taffeta dress multitud vol
1089251381024903169	2019-01-26	['#springsummer19', '#pierpaolopicciol']	centaure hypoleuc @liyakebede collect dress train taffeta fuchs expand fril
1089250906191921152	2019-01-26	['#springsummer19', '#pierpaolopicciol']	elicrisio @kaiagerber collect greig gauz organdy dress vol entir cov dor green sequin
1089250154421600256	2019-01-26	['#nikoriam', '#springsummer19', '#pierpaolopicciol']	ros selvatic collect gauz crin dress contrast flor lac apply embroid pearl sequin
1088882473604472834	2019-01-25	['#vittoriacerett', '#springsummer19', '#pierpaolopicciol']	melanth collect jut jacket embroid pearl black entrecro chiffon dress cr de chin lac budellin
1088864214536675328	2019-01-25	['#springsummer19', '#pierpaolopicciol']	camel taget garden ranuncolo @natasupernova collect pearl pistachio green silv ros busty dress embroid ton sur ton sequin
1088861571315654657	2019-01-25	['#mariacarlaboscono', '#springsummer19', '#pierpaolopicciol']	dal ros collect busty dress coco tul rang overlap arg ros lac
1088825879264923648	2019-01-25	['#mayowanichola', '#springsummer19', '#pierpaolopicciol']	azale margherit rov collect nud gauz dress emerald fuchs iv ram apply ajo match cap
1088430470336053249	2019-01-24	['#sanadiouf', '#springsummer19', '#pierpaolopicciol']	begon picot arlequin collect print chiffon organz dress blous lac apply cam ros poudr ch cop
1088413084803350528	2019-01-24	['#alekwek', '#springsummer19', '#pierpaolopicciol']	fior di zucc collect amb cotton silk hood coat cr de chin pearl top turquo green cr trous
1088360760810516480	2019-01-24	['#springsummer19', '#pierpaolopicciol']	ducky thot collect filadelfo poudr organz cap feath embroidery orang fluo scub wid trous
1088345661567729664	2019-01-24	['#pierpaolopicciol']	ask seamstress at person nam dress nam flow emot brought flow inspir ab de flor
1088270161935822848	2019-01-24	['#adutakech', '#springsummer19', '#pierpaolopicciol']	collect ros madam pier og cap scat ros ros fluo scub skirt
1088262611857100800	2019-01-24	['#springsummer19', '#pierpaolopicciol']	everyth turn rot evolv rep bloom backst mom collect
1088247512480272385	2019-01-24	['#springsummer19', '#pierpaolopicciol']	emot synesthes wond gaz sens enjoy collect design seen backst h salomon de rothschild
1088239404211159041	2019-01-24	['#springsummer19', '#pierpaolopicciol']	merg fantasy real behind scen mom going catwalk show
1088124360492310529	2019-01-23	['#periscop', '#springsummer19', '#pierpaolopicciol']	streaming liv new collect
1088117157618241537	2019-01-23	['#par', '#ss19', '#pierpaolopicciol']	hour left show tim watch liv new collect show today 6 pm cet liv h salomon de rothschild par
1088045094492614656	2019-01-23	['#ss19', '#pierpaolopicciol', '#par']	new 2019 collect ar plac vendom seamstress ad fin touch show start show today 6 pm cet liv h salomon de rothschild
1088037676421468160	2019-01-23	['#pierpaolopicciol', '#ss19']	new 2019 collect ar plac vendom seamstress ad fin touch show start show today 6 pm cet liv h salomon de rothschild par
1088016239706947584	2019-01-23	['#pierpaolopicciol', '#springsummer19']	new 2019 collect ar par today show ⁣ show today 6 pm cet liv h salomon de rothschild par
1088007554007994368	2019-01-23	['#springsummer19']	rom par new 2019 collect leav valentino at prep upcom show ⁣ show janu 23rd 6 pm cet liv h salomon de rothschild par
1087812566171172864	2019-01-22	['#springsummer19']	tak look behind scen 2019 collect leav at rom sent par show janu 23rd 6 pm cet liv h salomon de rothschild par
1087758305215287298	2019-01-22	['#springsummer19']	ent hist at piazz mignanell rom seamstress metic pack new 2019 collect show janu 23rd 6 pm cet liv h salomon de rothschild par
1087287190827212800	2019-01-21	['#valentinomenfw1920', '#pierpaolopicciol']	freedom definit miss show watch
1087156863106457600	2019-01-21	['#valentinomenfw1920']	freedom definit miss show watch
1087062886550261761	2019-01-20	['#valentinomenfw1920', '#pierpaolopicciol']	clos look new valentino garavan tot bag access collect shot @kevintachman
1087030994413256707	2019-01-20	['#yuyuzhangzou', '#valentinomenfw1920']	convers grand pala par show @germanlarkin
1086979858587181056	2019-01-20	['#valentinomenfw1920']	convers @carodaur &amp; @bryanboycom grand pala par show @germanlarkin
1086818723133079552	2019-01-20	['#valentinomenfw1920']	convers @marcmoreaumarc grand pala par show @germanlarkin
1086756552340635649	2019-01-19	['#lukejefferson', '#bengcob', '#valentinomenfw1920']	convers &amp; grand pala par show @germanlarkin
1086707603772764160	2019-01-19	['#pierpaolopicciol', '#benedettapicciol', '#valentinomenfw1920']	cre direct daught backst grand pala par show @germanlarkin
1086688785126051847	2019-01-19	['#kristennoelcrawley', '#valentinomenfw1920']	convers &amp; @aminamuaddi grand pala par show @germanlarkin
1086665683662966785	2019-01-19	['#valentinomenfw1920']	convers @g_eazy grand pala par show @germanlarkin
1086649435591970818	2019-01-19	['#valentinomenfw1920']	convers @mustafathepoet &amp; @taminoamir grand pala par show @germanlarkin
1086599830867202050	2019-01-19	['#eduardovaldarnin', '#valentinomenfw1920']	convers grand pala par show @germanlarkin
1086586223710347264	2019-01-19	['#kailandmor', '#valentinomenfw1920']	convers grand pala par show @germanlarkin
1086568213138292736	2019-01-19	['#valentinomenfw1920']	convers laur dubreuil heriard @lauradern grand pala par show @germanlarkin
1086564645383667712	2019-01-19	['#valentinomenfw1920']	convers @offsetyrn grand pala par show
1086352527472263168	2019-01-18	['#valentinomenfw1920', '#pierpaolopicciol']	subtl ad forc marcel aud cher backst show
1086329877782032384	2019-01-18	['#valentinomenfw1920', '#pierpaolopicciol']	two known object converg cre someth new valentino collab birkenstock show
1086322333206233088	2019-01-18	['#valentinomenfw1920', '#pierpaolopicciol']	tradit reinv look fut show
1086314777842900992	2019-01-18	['#valentinomenfw1920', '#pierpaolopicciol']	juxtaposit nat manmad highlight col form shot backst show
1086307233846251525	2019-01-18	['#valentinomenfw1920', '#pierpaolopicciol', '#valentinoundercov']	hous cod reinterpret detail show graph collab @undercover_lab shot @kevintachman
1086299678298333184	2019-01-18	['#valentinomenfw1920', '#pierpaolopicciol', '#valentinoundercov']	energy street meet tradit valentino look backst show shot @kevintachman
1086292128442056709	2019-01-18	['#valentinomenfw1920', '#pierpaolopicciol', '#valentinoundercov']	shar imagin cre cloth dialog graph outerwear collect collab @undercover_lab
1086277037579325445	2019-01-18	['#valentinomenfw1920', '#pierpaolopicciol']	sen benjamin capt backst show shot @kevintachman
1086269480706007041	2019-01-18	['#valentinomenfw1920', '#pierpaolopicciol']	vita leon dam al capt backst show shot @kevintachman
1086255637854605313	2019-01-18	['#valentinomenfw1920', '#pierpaolopicciol']	mom show lineup show shot @kevintachman
1086250326993371136	2019-01-18	['#valentinomenfw1920', '#pierpaolopicciol']	show langu cout stain becom genuin op aly tim auth el marcel wear look
1086012788412100608	2019-01-17	['#valentinomenfw1920', '#valentinofw1920', '#valentinoundercov']	show cod belong shar imagination; seiz common appear dissolv soft liquefy wang chenm wear look detail graph collab @undercover_lab
1086005247271522304	2019-01-17	['#valentinomenfw1920', '#sen', '#valentinofw1920', '#pierpaolopicciol']	show twist sobry wear
1086005240690819072	2019-01-17	['#valentinomenfw1920', '#pierpaolopicciol', '#valentinoundercov']	show attitud street ent at magn tend opposit sethu wear graph design collab @undercover_lab
1085997692684140544	2019-01-17	['#valentinomenfw1920', '#jonasglo', '#valentinofw1920', '#valentinoundercov']	show contemp tail embrac lif conf divers look
1085990142010187777	2019-01-17	['#valentinomenfw1920', '#valentinoundercov']	show valentino collab @undercover_lab convers jun takahash un way look street graph reread ey valentino valentino garavan undercov bag
1085982588957650944	2019-01-17	['#valentinomenfw1920', '#valentinoundercov']	show pict valentino garavan bag graph design collab @undercover_lab
1085975038870773760	2019-01-17	['#valentinomenfw1920', '#valentinofw1920', '#pierpaolopicciol']	show ide shap abandon form constraint antek wear pair valentino garavan @undercover_lab backpack
1085959627488006147	2019-01-17	['#valentinomenfw1920', '#valentinofw1920', '#pierpaolopicciol', '#valentinoundercov']	show bring street attitud at seba wear look embroid graph design collab @undercover_lab
1085912005322657793	2019-01-17	['#valentinomenfw1920', '#valentinofw1920', '#pierpaolopicciol', '#valentinoundercov']	show masculin mov fluid freedom definit khadim sock wear look detail graph collab @undercover_lab
1085835597577506816	2019-01-17	['#valentinomenfw1920', '#valentinofw1920', '#pierpaolopicciol']	show suit fluid volum impalp construct block monochrom jess wear pair valentino garavan @birkenstockusa sand
1085712504725024768	2019-01-17	['#valentinomenfw1920', '#valentinoundercov']	show collect new graph cre collab @undercover_lab maison includ repertoir new univers sign collab birkenstock
1085579426157527041	2019-01-16	['#periscop', '#valentinomenfw1920', '#pierpaolopicciol']	streaming liv new collect
1085544815532670976	2019-01-16	['#valentino']	convers @mustafathepoet tru lov rhythm stop play men fal 2019 show today 5 pm cet par
1085509328868642816	2019-01-16	['#valentino']	convers french street art ludo ad fin touch artwork brought lif streets par men fal 2019 show today 5 pm cet par
1085472466489786369	2019-01-16	['#valentino']	convers premy dans @marcmoreaumarc op nat de par perform near sacr men fal 2019 show today 5 pm cet par
1085256222561980418	2019-01-15	[]	convers sing @taminoamir perform indigo night alb amir liv plac vend men fal 2019 show janu 16th 5 pm cet par
1084601328482115584	2019-01-14	['#lucindachild', '#tiajonsson', '#parkerkithil', '#davidalexanderflin', '#vltn', '#agostinagalvez']	four protagon interpret world {the ful act vltn} film produc @roscoprod
1084600062125182976	2019-01-13	['#vltn']	portray set ded act charact giv interpret world
1084599746583560192	2019-01-13	['#vltn', '#parkerkithil']	diff charact interpret world {act 3 park kit hill} dant goldf goldy vltn bag dant rehears
1084528898778513408	2019-01-13	['#davidalexanderflin', '#vltn']	art capt motorcyc unexpect twist red smok highway
1084528702476685315	2019-01-13	['#vltn', '#parkerkithil', '#valentinoeyewear']	interpret park kit hil portray set ded dant act wear vltn pink bomb jacket transp bag
1083746099377176584	2019-01-11	['#vltn', '#tiajonsson']	interpret valentino garavan rockstud should bag embel logo smal stud
1083745431643922434	2019-01-11	['#tiajonsson', '#vltn']	capt walk streets new york valentino garavan sneak
1083736184218619905	2019-01-11	['#lucindachild', '#tia', '#vltn']	choreograph dant model jonsson portray set ded act
1083705052286672898	2019-01-11	['#vltn', '#tiajonsson', '#agostinagalvez']	diff charact interpret world {act 2 tia jonsson} model strolling around new york valentino garavan sneak mix valentino gown overs vltn bomb jacket @roscoprod
1083696171959443456	2019-01-11	['#tiajonsson', '#valentino', '#vltn']	vltn interpret tia jonsson model mix red gown sneak portray set ded act
1083297054208770048	2019-01-10	['#vltn', '#biennaledanza2017', '#lucindachild', '#valentino', '#roscoproduc', '#agostinagalvez']	diff charact interpret world {act 1 lucind childs} win gold lion choreograph dant dress vltn sneak dant rain ros pet
1082797427684528128	2019-01-09	['#zoey', '#valentinoresort19', '#pierpaolopicciol', '#instylewbglob']	@zoeydeutch @glenpowell mak ent @goldenglobes party @instylemagazine elev wor embroid ev dress collect video @thefacinator
1082796932681162753	2019-01-09	['#valentinoprefall19', '#pierpaolopicciol', '#instylewbglob', '#goldenglob']	@kathrynnewton capt pink ev dress @instylemagazine elev lead @goldenglobes video @thefacinator
1082796441385480192	2019-01-09	['#kikilayn', '#valentinoss19', '#pierpaolopicciol', '#instylewbglob', '#goldenglob']	attend @instylemagazine @goldenglobes party tul dress video @thefacinator
1082393019872092167	2019-01-07	['#pierpaolopicciol', '#goldenglob']	@starisbornmovie actress @ladygaga walk 2019 @goldenglobes red carpet cre design cre direct
1082338572999557121	2019-01-07	['#shallow', '#pierpaolopicciol', '#goldenglob']	@ladygaga hold best origin song troph work @starisbornmovie smash hit 76th an @goldenglobes lady gag wor custom cap dress
1082338231927164928	2019-01-07	['#shallow', '#pierpaolopicciol', '#goldenglob']	win 76th an @goldenglobes best origin song mot pict @starisbornmovie @ladygaga wor custom dress video @enews
1082244669390626816	2019-01-07	['#sandraoh', '#valentinotuxedo', '#pierpaolopicciol', '#goldenglob']	com andy samberg @thelonelyisland co actress 76th an @goldenglobes wear cre direct
1082244450074673152	2019-01-07	['#valentinoprefall19', '#pierpaolopicciol', '#goldenglob']	pres year @goldenglobes @mayarudolph wor black dress ruffl collect cre direct
1082244034716987395	2019-01-07	['#fallwinter1819', '#pierpaolopicciol', '#goldenglob']	actress @gemma_chan attend 76th an @goldenglobes part ensembl cast @crazyrichmovie petrol peau de soi crisscross dress train deep back
1082242655696969734	2019-01-07	['#valentinoprefall19', '#pierpaolopicciol', '#goldenglob']	actress @lauradern nomin best perform actress limit sery @thetalemovie attend 76th an @goldenglobes red dress
1082101827141857281	2019-01-07	['#pierpaolopicciol', '#goldenglob', '#astarisborn', '#ladygag']	@ladygaga hit 76th an @goldenglobes red carpet dress cap cre direct
1082101208582705152	2019-01-07	['#pierpaolopicciol', '#goldenglob', '#astarisborn', '#ladygag']	best perform actress nomin @ladygaga attend 76th an @goldenglobes dress cap design cre direct
1082100843296555008	2019-01-07	['#pierpaolopicciol', '#goldenglob']	76th an @goldenglobes los angel @ladygaga nomin best actress mot pict dram @starisbornmovie wor pervinc dress cap mad silk fail design cre direct
1082046810519154693	2019-01-06	['#valentino2018bestof', '#pierpaolopicciol', '#venicefilmfest']	convers @ladygaga tak 2018 red carpet organz ev dress embroid pal ros feath merlon world premy @starisbornmovie
1082015927548461056	2019-01-06	['#valentino2018bestof', '#valentinoprefall19', '#tokyo', '#valentinotky']	look back fash show video @styleheroine
1081961384156512263	2019-01-06	['#valentino2018bestof', '#pierpaolopicciol']	award design year @bfc
1081960941116370945	2019-01-06	['#valentino2018bestof', '#pierpaolopicciol', '#valentinoss19']	convers @kaiagerber throwback show par video @laurabrown99
1081620101898661890	2019-01-05	['#valentino2018bestof', '#valentinomenss19', '#pierpaolopicciol']	rel mom capt show video @manifestoasia
1081117560752488450	2019-01-04	['#valentino2018bestof', '#valentinofw1819', '#pierpaolopicciol']	model walk caltwalk fash show video @fashiontomax
1080918605003440130	2019-01-03	['#valentino2018bestof', '#pierpaolopicciol', '#fallwinter1819', '#otri']	convers @beyonce stag run ii tour wear gown
1080786115194437632	2019-01-03	['#valentino2018bestof', '#pierpaolopppicciol', '#fallwinte1819']	convers @traceeellisross gown right 70th emmy award
1080736768629096449	2019-01-03	['#valentino2018bestof', '#fallwinter1819']	kick new year mem video @andreajanke
1080571537156202496	2019-01-02	['#valentino2018bestof', '#pierpaolopicciol', '#adutakech', '#felicenovanoordhoff', '#fallwinter1819']	convers backst mom
1080195101995999233	2019-01-01	['#valentino2018bestof', '#pierpaolopicciol']	convers @troyesivan troy wor look mus video bloom
1080124161241034754	2019-01-01	['#valentino2018bestof', '#pierpaolopicciol', '#fallwinter1819', '#otri']	convers @beyonce perform run ii tour stad de frant saint dress
1079745936371388417	2018-12-31	['#valentino2018bestof', '#pierpaolopicciol', '#valentinotuxedo', '#philipt', '#metgal', '#metheavenlybody']	convers @troyesivan troy wor red satin lapel red organz blous max coll headpiec occas
1079452915004260353	2018-12-30	['#valentino2018bestof', '#pierpaolopicciol', '#francesmcdormand', '#metgal']	convers @troyesivan right ev
1079350638918725632	2018-12-30	['#valentino2018bestof', '#pierpaolopicciol', '#adutakech', '#metgal']	convers occas
1078990605395607552	2018-12-29	['#valentino2018bestof', '#pierpaolopicciol', '#annehathaway', '#metgal', '#ss18']	convers mom an red taffet ev dress deep
1078623880271613952	2018-12-28	['#valentino2018bestof', '#pierpaolopicciol', '#francesmcdormand', '#metgal', '#metheavenlybody']	convers cre direct frant got funky @voguemagazine video direct @bardiazeinali
1078232102594899969	2018-12-27	['#valentino2018bestof', '#pierpaolopicciol', '#adutaketch', '#ss18', '#metgal', '#metheavenlybody']	convers adut wear rit baby dol drag ros fail ev dress ruffl hemswhil attend
1077880881530982400	2018-12-26	['#valentino2018bestof', '#pierpaolopicciol', '#kristinscottthoma', '#valentino']	convers dant dress occas london ev standard brit film award held claridg hotel
1077631670986121216	2018-12-25	['#valentino2018bestof', '#pierpaolopicciol', '#annacleveland', '#valentinofw1819', '#gordonvonstein']	convers walk around par cap volumin hood @voguemagazine video
1077240275221839876	2018-12-24	['#valentino2018bestof', '#pierpaolopicciol', '#royalwed', '#valentinofw1819']	convers @serenawilliams head receiv ev dress pair valentino garavan sneak
1076462172350361600	2018-12-22	['#bounceitup']	@quillemons cre portrait sery extend famy valentino sneak pict high school teach mr ruth ms capobianco chart high school architect design defin fig cre car
1076120272221151232	2018-12-21	['#bount']	@quillemons attribut lov streetwear godfath khal thompson capt alongsid godmoth mo thompson godbroth kart thompson wear valentino garavan sneak
1075724723550605313	2018-12-20	[]	ish amban piram got marry anand piram mumba ev pre udaip wor ful embroid silv ev gown design exclud maison valentino
1075710511075991552	2018-12-20	['#maisonvalentino']	ish amban daught nit mukesh amban marry anand piram mumba 12 wed receiv mumba ish amban piram wor first leheng design tradit ind silhouet enrich gold embroidery
1075681924377649152	2018-12-20	['#pierpaolopicciol', '#bount']	convers @quillemons quil lemon capt season's valentino garavan sneak streets philadelph
1075448308976574469	2018-12-19	['#pierpaolopicciol']	convers @quillemon word unc david would alway say giv peopl ros stil
1075327566905597952	2018-12-19	['#bount']	@quillemons introduc peopl dear underlin famy alway biolog tim feel conform learn continu grow us valentino garavan sneak symbol item tie peopl
1075088871841558538	2018-12-18	['#pierpaolopicciol', '#bount']	convers @quillemons emerg photograph quil lemon capt step bri bradley sport new valentino garavan sneak young broth bri bugsy bradley jr hometown philadelph
1075027057627799553	2018-12-18	['#philadelph', '#bount', '#vltn']	@quillemons welcom us famy hom quil introduc peopl dear bount sneak us symbol item tie peopl quil's twin broth nasir&amp;naleek wear valentino garavan sneak logo
1074719047319781378	2018-12-17	['#bount']	pierpaolo picciol convers @quillemons young cre tal quil lemon expl them famy belong intim sery portrait feat import fig lif wear new valentino garavan sneak
1074693049094234112	2018-12-17	['#valentinosoundon']	hand embroid access drop mus art @chrt_keithape15 @asapferg ask choos spirit anim feat collect photograph @renellaice
1074428323990814721	2018-12-16	['#valentinosoundon']	collab @asapferg spirit anim black panth us embel street wear piec list playl maison valentino's spot video chad murdock
1074002396513255424	2018-12-15	['#valentino', '#valentinosoundon']	syd collab spec caps ded spirit anim peacock exclud avail onlin bev hil bal harbo san francisco new york stor video timothy smi
1073997641468522499	2018-12-15	['#valentinoonlov']	wav crash poem @yrsadaleyward
1073753356361977861	2018-12-15	['#valentinoonlov']	lov soft fact poem @yrsadaleyward
1073601385583779841	2018-12-14	['#valentinoonlov']	lov know poem @yrsadaleyward
1073587601486086146	2018-12-14	['#valentinoonlov']	rom damn self poem @yrsadaleyward
1073271834127273984	2018-12-13	['#fransum', '#kristenmcmenamy', '#fashionaward', '#pierpaolopicciol']	celebr 2018 partn @swarovski roy albert hal london wear valentino look
1073261270688706560	2018-12-13	['#fashionaward', '#pierpaolopicciol']	brit cre direct award design year @bfc
1073246170225500160	2018-12-13	['#alekwek', '#fashionaward', '#valentinoss19']	co an london dress
1073237508819951616	2018-12-13	['#mik', '#fashionaward', '#valentino']	ar 2018 tuxedo @bfc
1073237315324133377	2018-12-13	['#fransum', '#fashionaward', '#valentinoprefall19', '#pierpaolopicciol']	hit 2018 red carpet ruffl gown @bfc
1072607864232005633	2018-12-11	['#fashionaward', '#valentino']	@mikasounds ar 2018 tuxedo @bfc
1072564829104291843	2018-12-11	['#fallwinter1819', '#fashionaward']	adut akech gold lac panel dress lam brocad arabesqu encrust red carpet 2018
1072562323724951552	2018-12-11	['#pierpaolopicciol', '#fashionaward', '#fallwinter1819']	cre direct ar 2018 togeth kritstin scot thoma occas kristin wor ant ros drap dress @bfc
1072562041708265472	2018-12-11	['#fashionaward', '#london', '#kristenmcmenamy', '#fallwinter1819', '#pierpaolopicciol']	2018 grac red carpet 'sogno ad alt voce' cap collect @bfc
1072511063042723840	2018-12-11	['#pierpaolopicciol', '#designeroftheyear', '#fashionaward']	cre direct award 2018 partn @swarovski roy albert hal london priz pres brook shield @bfc
1071867735141990401	2018-12-09	['#valentinoonlov']	sometim leav city fal lov poem @yrsadaleyward
1071752100605034502	2018-12-09	['#valentinoonlov']	exact travel head lik grid ref co poem @yrsadaleyward
1071541442286362624	2018-12-08	['#valentinoonlov']	us want consum love; eat whol lov want thick got abl mov poem @yrsadaleyward
1071398637744390144	2018-12-08	['#valentinoonlov']	unspeak telepathy lov on poem @yrsadaleyward
1071211313651769347	2018-12-08	['#valentinoonlov']	lov lov ready poem @yrsadaleyward
1071100525289062401	2018-12-07	['#valentinoonlov']	valentino pres unpubl poem @yrsadaleyward book titl
1070367275566407681	2018-12-05	['#creed2', '#tessathompson', '#valentinohcfw1918', '#pierpaolopicciol']	europ premy wor ol green dress
1070357719750795270	2018-12-05	['#pierpaolopicciol', '#valentinoprefall19', '#tokyo', '#valentinotky']	cre direct capt kai gerb adut aketch aub jolico maik ing jul merkelbach nikk tiss cong cha maxim right show shot pablo arroyo
1069866488033611777	2018-12-04	['#valentinoprefall19', '#pierpaolopicciol', '#valentinotky']	{flaws imperfect regard beauty right tokyo
1069738565947543554	2018-12-03	['#valentinoprefall19', '#pierpaolopicciol', '#valentinotky']	{the spac thing plac pond inv tokyo
1069738207133216770	2018-12-03	['#valentinoprefall19', '#pierpaolopicciol', '#valentinotky']	{intermissions allow mean poss expand collect tokyo
1069234100471586819	2018-12-02	['#valentinoprefall19', '#pierpaolopicciol', '#valentinotky']	{the cod becom includ keep street horizon collect
1069232969875902466	2018-12-02	['#valentinoprefall19', '#pierpaolopicciol', '#valentinotky']	{time tang qual intrins valu sign affect surfac ignit feel tokyo
1068274202543820807	2018-11-29	['#valentinoprefall19', '#pierpaolopicciol', '#valentinotky']	{change point view quest imperfect perfect tokyo
1067560583623454721	2018-11-27	['#kaiagerb', '#valentinoprefall19', '#pierpaolopicciol', '#valentinotky']	{volumes pur ruffl crush ple misalign tokyo
1067536680003887104	2018-11-27	['#adutakech', '#valentinoprefall19', '#pierpaolopicciol', '#valentinotky']	{the iconograph maison ruffl lac grac flow col mot interpret wab sab key tokyo
1067519282660106240	2018-11-27	['#yexiang', '#valentinoprefall19', '#pierpaolopicciol', '#valentinotky']	{distant el meet merg interv sep show gest clash opposit instead hid tokyo
1067472604510842881	2018-11-27	['#valentinoprefall19', '#pierpaolopicciol', '#valentinotky']	{two idea beauty comp on strives bal symmetry harmony; asymmet fav imperm maik ing tokyo
