id	created_at	hashtags	cleaned_text
982988940687921152	2018-04-08	['#pierpaolopicciol', '#par']	nicol warn @garypeppergirl capt along cre direct fin fit maison showroom wear custom mad wed gown mad cady crep canva organz
982883240590454784	2018-04-08	['#pierpaolopicciol']	exclud design finest lac cryst flow embroid perfect fit enjoy detail nicol warn @garypeppergirl wed dress espec design cre direct
982686952917893121	2018-04-07	['#pierpaolopicciol']	choos wed dress extraordin expery enjoy nicol warn @garypeppergirl mag mom at rom cre direct
982603902255288320	2018-04-07	['#pierpaolopicciol']	tak clos look precy detail craftsm beauty wed dress design nicol warn @garypeppergirl cre direct
982513309663551488	2018-04-07	['#candyset']	ev photograph set visit valentino flag bout ginz six tokyo design temp celebr 1st annivers op
982332115823071232	2018-04-06	['#valentinogaravan', '#rockstudspik', '#pierpaolopicciol']	glad unveil exclud limit edit bag multicol napp platin stud design cre direct celebr 1st annivers valentino flag bout ginz six tokyo
982249069568376833	2018-04-06	['#valentinoss18', '#candystud', '#valentinogaravan', '#rockstudspikeb']	look collect spec item bag charm exclud multicol discov ginz six tokyo
982201545449136129	2018-04-06	['#candyset', '#valentino', '#candystud']	immers spec instal flag bout ginz six commerc complex expl valentino garavan bag collect ultim touch soph feminin
981932145496285185	2018-04-05	['#candyset', '#tokyo', '#valentinogaravan', '#candystud']	com discov instal ginz six bout display brand new matelass bag compos smoo leath embel house's goldton sign pyramid stud
981881476336750592	2018-04-05	['#candyset']	celebr us 1st annivers flag bout ginz six tokyo com discov spec instal exclud item unveil spec occas
981780977566474240	2018-04-05	['#valentinoss18', '#advcampaign']	trend get clos look backst model wear flow silhouet enrich flor styl retro print
981568221940731904	2018-04-04	['#riannevanrompaey']	red city tak clos look perfect daywear look combin fluid ap silk shirt dress underground attitud techno gabardin pant
981515007073705985	2018-04-04	['#valentinoss18', '#advcampaign', '#pierpaolopicciol']	modern heroin shar posit vib latest loc pier 59 studio new york photograph @inezandvinoodh cre direct
980843976478613504	2018-04-02	['#heroesh', '#valentinoodissey', '#ss18']	get clos look latest sho collect detail pretty feminin embroidery
980807879191121926	2018-04-02	['#valentinoss18', '#jammehoumy', '#pierpaolopicciol', '#instorenow']	collect mov watch shin eleg art print dress design
980701366443114496	2018-04-02	['#valentinoss18', '#advcampaign', '#pierpaolopicciol']	bright day enjoy loc pier 59 studio new york photograph @inezandvinoodh cre direct
980489986960183296	2018-04-01	['#advcampaign', '#valentinoss18']	rom @gigihadid conqu styl latest div collect
980444731158167552	2018-04-01	['#valentinoss18', '#advcampaign', '#pierpaolopicciol']	ev eleg model @gigihadid dant timeless yet contemp gown stag latest loc pier 59 studio new york photograph @inezandvinoodh cre direct
980338975796686848	2018-04-01	['#valentinoss18', '#advcampaign']	step behind scen enjoy @gigihadid vibr energy styl wear whit gown embel bow
980146076564017152	2018-03-31	['#valentinoss18', '#advcampaign', '#instorenow']	tr chic sup model @gigihadid capt behind scen mom wear chic tul dress velvet green bow
980027483889242113	2018-03-31	['#backst', '#valentinoss18', '#advcampaign', '#instorenow']	dress impress get clos look glam mom @gigihadid ar stag shoot
979795406149189632	2018-03-30	['#ss18', '#pierpaolopicciol']	embrac strong silhouet vibr col collect loc pier 59 studio new york photograph @inezandvinoodh cre direct
979739965826519040	2018-03-30	['#newyorkc', '#valentinoss18']	modern rom @gigihadid rock wear tul bas gown embel contrast bow pliss soleil skirt
979711492722511873	2018-03-30	['#valentinoss18', '#advcampaign']	modern eleg ultraglam look dant big vibr valentino logo back
979403862414168065	2018-03-29	['#valentinoss18']	think pink jump collect wear velvet taffeta gown charact spec glossy light
979327889794633729	2018-03-29	['#valentinoss18']	spring sign iridesc fabr meet sum shad silk dress discov collect
979281005419876352	2018-03-29	['#jammehoumy', '#valentinoss18']	go bold model elev styl wear lila silk cap collect
979047970980188160	2018-03-28	['#behindthesc', '#riannevanrompaey', '#valentinoss18', '#advcampaign']	glam sid flow capt pict star modern beauty @gigihadid ready shoot day loc pier 59 studio new york
978987578190802945	2018-03-28	['#felicenov', '#valentinoss18', '#advcampaign', '#pierpaolopicciol']	dream col tak clos look capt mak loc pier 59 studio new york photograph @inezandvinoodh cre direct
978881874780078080	2018-03-28	['#behindthesc', '#valentinoss18', '#advcampaignwi']	go latest @gigihadid show us look feminin glam allov embroid gown mad sequin recr jardin de fle mot
978631563851321344	2018-03-27	['#pierpaolopicciol']	dant loc pier 59 studio new york photograph @inezandvinoodh cre direct
978527046149263360	2018-03-27	['#valentinoss18', '#advcampaign', '#riannevanrompaey']	glam sid flow tak clos look @gigihadid co along loc pier 59 studio new york
978338298190954497	2018-03-26	['#ainovierima', '#valentinoss18']	pos transluc vinyl look march issu @harpersbazaarjp magazin
978247698422771714	2018-03-26	['#amelleahthoma', '#valentinoss18']	star @drepubblicait cov shot wear sequin embroid vinyl bik detach cap collect
978179748659638272	2018-03-26	['#danielapestov', '#valentinoss18', '#dolcevitamagazin']	rock latest collect wear vinyl jacket rom pink shad
977983465391034370	2018-03-25	['#valentinoss18']	techn outerwear ham satin detail collect capt march 2018 issu @drepubblicait
977900413331456000	2018-03-25	['#heroesh', '#valentinogaravan', '#odissey', '#ss18']	@cosmopolitan_fr light latest sho collect detail pretty feminin dec
977802264210477056	2018-03-25	['#valentinoss18', '#lorenamarasch']	feminin charm wear collect model @neelamkg star london cal cov story @elleuk
977621069275295744	2018-03-24	['#valentinoparfum']	new invit step verd gard it palac pres icon stud bottl new fragr synonym sparkl sunlight vit
977538022664122368	2018-03-24	['#valentinoparfum']	pres craft celebr individ emot beauty eleg
977470082879143936	2018-03-24	['#valentinoparfum']	scent rady fresh introduc new fresh eleg fragr wom
977266233992085504	2018-03-23	['#valentinomenss18']	pres sweet littl puff piec titl 2018 april issu @gqstyle feat mus mog collect
977168088570347520	2018-03-23	['#valentinomenss18']	styl guru mus idol @diddy grac @gqstyle april issu perfect tot look
977100134222782464	2018-03-23	[]	hip hop icon @diddy star @gqstyle's april styl bibl cov story diddy wear cab team jersey tracksuit enrich whit stich mot
976896295561445376	2018-03-22	['#ellefan', '#valentinofw1819', '#la']	vis green drap on gown neck tie collect hollywood report jimmy choo pow styl din
976828345550884866	2018-03-22	['#valeriagolino', '#pierpaolopicciol', '#david2018']	shin bright tonight 63rd @premidavid award rom best actress nomin rol movy il col nascosto del cos valer wear velvet tul gown embroid tig mot
976767963687727105	2018-03-22	['#valeriagolino', '#valentinofw1819', '#david2018']	it actress spot wear light green dress black boot collect head 63rd @premidavid nomin pres rom
976541458265075712	2018-03-21	['#dakotafan', '#valentinofw1819show', '#valentinofall18', '#vltn', '#valentinogaravan', '#candystud']	capt par wear leopard stat dress collect latest bag
976481063441543168	2018-03-21	['#avaphillip', '#valentinofall18', '#valentinogaravan', '#vltn', '#candystud']	play yet soph black whit styl coat polk dot dress team new logo bag
976441548194893825	2018-03-21	['#vltn', '#valentinogaravan', '#rockstudspik', '#nyc']	@gigihadid tak styl step wear new bag ar photoshoot brooklyn
976149553819897856	2018-03-20	['#candystud', '#stud', '#valentinoss18']	clos latest bag soft pink leath quilt icon collect
976086832000716800	2018-03-20	['#valentinogaravan', '#dollybow', '#valentinoss18']	clos pump remov bow capt catwalk
976030660191248389	2018-03-20	['#veryvalentino', '#pierpaolopicciol', '#valentinoss18']	dreamy pastel detail on should pink gown cre direct collect
975777276192350209	2018-03-19	['#valentinoss18', '#pierpaolopicciol', '#veryvalentino', '#valentino']	icon red shad reinterpret collect cre direct look herit haut cout collect avail bout
975757834846646272	2018-03-19	['#valentinoss18', '#veryvalentino']	today beauty pink look collect stay tun discov caps collect design remind aesthet haut cout mak ordin extr
975728109784879104	2018-03-19	['#veryvalentino', '#valentinoss18']	introduc caps collect evok icon shap col maison arch clos look deep necklin dress bod fril
975469390346014720	2018-03-18	[]	alessandro dress rev fuchs belt back seen march 2018 issu @vogue_italia
975371247990202368	2018-03-18	['#ss18']	tak look cinz violet ultr dress silvan entir embroid gown person perceiv collect intim pres march 2018 issu @vogue_italia
975280646489690112	2018-03-18	['#ss18']	impalp flor mot settl last framework look march 2018 issu @vogue_italia
975091905079005185	2018-03-17	[]	mar sol doubl embed cashm coat carmel p drap top team emerald green trous appear march 2018 issu @vogue_italia
975008854328004613	2018-03-17	['#ss18']	persuas light dem elev mar r emerald green look collect grac pag 2018 march issu @vogue_italia
974918264181657600	2018-03-17	['#ss18']	look rit dress ruffl hemsa seen march 2018 issu @vogue_italia
974744613259919360	2018-03-16	['#philipt', '#ss18']	volum expand feath vibr hat cre edit cfor march 2018 issu @vogue_italia
974646472640643072	2018-03-16	['#valentinoss18men', '#advcampaign']	star @troyesivan sportswear new daywear
974575896341483522	2018-03-16	['#valentinoss18', '#advcampaign']	nylon cotton acet cashm black del shad tak look @troyesivan dant latest men
974382226828742656	2018-03-15	['#vltnsweatshirt', '#valentinoss18', '#advcampaign']	perfecto whit shirt @troyesivanknows rock tot sportswear look latest men
974306728824127489	2018-03-15	['#ss18', '#valentinoss18', '#advcampaign']	sportswear al men collect wait loc pier 59 studio new york photograph @inezandvinoodh
974244250081775617	2018-03-15	['#valentinoss18', '#advcampaign']	discov new men influ sportswear us vibr red valentino logo star @troyesivan shop collect loc pier 59 studio new york photograph @inezandvinoodh
974178384321249280	2018-03-15	['#vltn', '#valentinoss18', '#advcampaign']	sportswear man tak new men feat tal sing @troyesivan loc pier 59 studio new york photograph @inezandvinoodh
973917527859499008	2018-03-14	['#valentinoss18', '#advcampaign']	wardrob archetyp mad individ divert tak look ultim men video star @troyesivan dant mus paranoim loc pier 59 studio new york photograph @inezandvinoodh
973882614020038656	2018-03-14	['#valentinoss18', '#advcampaign', '#vltn', '#pierpaolopicciol']	sing act youtub star @troyesivan conqu men wear tracksuit charact bright col tech fabr loc pier 59 studio new york photograph @inezandvinoodh cre direct
973624751632601088	2018-03-13	['#valentinoeyewear', '#valentinoss18']	introduc new vint charact round overs shap embel 32 aust cryst cut maison icon stud
973589464672014336	2018-03-13	['#valentinogaravan', '#dollybow', '#valentinoss18']	tak bow clos pump collect capt diff shad
973549894333075457	2018-03-13	['#valentinoss18']	extraordin yet wear daywear tak look effortlessy chic embroid top transp macro sequin pair techno pant
972910031661236224	2018-03-11	['#valentinofw1819']	join refin person styl wear latest cat shap sunglass embel slim met templ bi acet
972811877972660226	2018-03-11	['#valentinogaravan', '#bloom', '#valentinofw1819']	exquisit beauty tak clos look latest bag seen runway
972751480502484993	2018-03-11	['#valentinofw1819', '#pierpaolopicciol']	coll bloom graph becom beauty flow intars rom collect cre direct turn rom someth bold strong
972547637206441984	2018-03-10	['#valentinofw1819', '#rockstudshop']	simply mag tot look stat ton sur ton 24 hour bag
972487255888625665	2018-03-10	[]	grac auth new heroin seen wear flat masculin boot rom strong
972396649296351232	2018-03-10	[]	simpl ear met feath enlight beauty repres light watch collect
972177705239134208	2018-03-09	['#ringto']	kit heel sand becam eleg leath ankl boot sparkl lin smal cryst discov new
972109757015244805	2018-03-09	['#valentinofw1819']	could pierc synonym punk cult rom embel detail pearl worn grac collect
972045977174663168	2018-03-09	['#valentinogaravan', '#bloom', '#valentinofw1819']	clos look new bag caracht pansy flow intars stud icon sign maison watch entir beauty collect
971830411587440640	2018-03-08	['#valentinofw1819']	rom collect depict pres grac capt detail watch show
971771657118511104	2018-03-08	['#valentinofw1819']	deeply person theref auth point view rom way liv lif pres moodboard
971706450925023232	2018-03-08	[]	@oraclefox
971699242296397824	2018-03-08	['#valentinofw1819', '#pierpaolopicciol']	flow spread enlarg exclam palp intars straight show tak clos look new access collect cre design
971460484602843136	2018-03-07	['#valentinofall18', '#valentinofw1819']	@kathrynnewton pink gown embroid heart red whit min polk dot dress show
971422726328954880	2018-03-07	['#valentinofw1819']	model icon @karliekloss attend show anima print jumpsuit
971400095118671872	2018-03-07	['#valentinofw1819', '#valentinofall18']	@naomiscott grac show wear coat embel dragon reinterpret maison arch
971369887368085504	2018-03-07	[]	would lik express sint gratitud &amp; apprecy presid french republ emmanuel macron first lady brigit macron wond ev thank welcom collect par year gen car way
971329611891134464	2018-03-07	['#valentinofall18', '#valentinofw1819']	beauty @tessathompson_x dress black whit collect latest show
971327206009069568	2018-03-07	['#avaphillip', '#valentinofall18', '#valentinofw1819', '#pierpaolopicciol']	tak clos look beauty wear show cre direct
971279286924660736	2018-03-07	['#dakotafan', '#valentinofw1819show', '#valentinofall18']	strikes styl pos wear anim print pliss min dress collect
971128296162328577	2018-03-06	['#brandonflow', '#pierpaolopicciol', '#par']	star night perform wear jacket embel shin star espec custom mad cre direct @thekillers concert
971105635340308486	2018-03-06	[]	congrat alexandr mus alway inspir bravo con affetto pierpaolo
971082986488844289	2018-03-06	['#francesmcdormand']	congrat win @theacademy award best actress lead rol @3billboards
971052789223776257	2018-03-06	['#valentinofw1819']	fin look show charact beauty intars pansy flow stand fre think strong pow rom
971022606005612546	2018-03-06	['#kaiagerb', '#valentinofw1819']	rom strong way un tak look stun wear breathtak multiflow intars gown today show
970992401786454017	2018-03-06	['#valentinofw1819', '#pierpaolopicciol']	discov new perspect rom watch latest collect design cre direct
970964426542190592	2018-03-06	['#valentinofw1819']	eth leav sign tak clos look grac overs cap watch show
970703003496927233	2018-03-05	['#valentinofw1819']	unexpect ton diff green giv touch light coat volum expand entir collect leav sign
970675418662567936	2018-03-05	['#valentinofw1819']	fabr protagon trous const remind strong modern rom grac way mean express miss show watch
970629548512563200	2018-03-05	['#valentinofw1819']	deeply person auth rom point view look mix pink feminin strong vert silhouet discov entir collect go
970604106984419329	2018-03-05	['#valentinofw1819', '#pierpaolopicciol']	dress repres kind individ al eth watch collect design cre direct
970578316251009024	2018-03-05	['#valentinofw1819']	strong rom look collect charact spec way lay masculin overs jacket ton sur ton short dress pant discov complet collect
970470955427532807	2018-03-05	['#pierpaolopicciol']	cre direct transf fabr silhouet real emot hum touch
970455350712258562	2018-03-05	['#valentinofw1819']	hood becom eleg access sart intars bloom flow new way rev ide strong contemp rom mag show
970433381929553920	2018-03-04	['#valentinofw1819']	col multiply symphony monochrom disrupt multipl weav tak clos look look resembl gracy bloom peony
970416968527380480	2018-03-04	['#valentinofw1819']	grac mov siz stuck mom watch show discov finest rom latest collect
970401173063729152	2018-03-04	['#valentinofw1819', '#pierpaolopicciol']	flow spread palp real intars tak clos look new rom wom rev today cre direct miss show watch
970372802091024386	2018-03-04	['#valentinofw1819', '#pierpaolopicciol']	simpl rev grac flow defin silhouet collect cre direct rom strength
970332385395974145	2018-03-04	['#valentinofw1819', '#pierpaolopicciol', '#par']	collect liv front row seat
970321556541931521	2018-03-04	['#valentinofw1819', '#pierpaolopicciol']	today day show start tak look cre mind work behind scen left georg susann laur valer cre direct chiar maur gabriel sabato loredan svev daphn &amp; graz
970314560040243200	2018-03-04	['#valentinofw1819', '#linkinbio', '#instagramst']	meet francesc samuel giul g michel elin regin giorg ilen martin andre silv gessic margherit tal team behind wom collect miss show via 5pm cet
970303515297042437	2018-03-04	['#valentinofw1819', '#periscop']	countdown almost team behind upcom collect top left sir enric xhion giul federic marzio loredan marin giul g simon francesco alessandr claud show liv 5pm cet
970214404246654976	2018-03-04	['#valentinofw1819', '#periscop']	pur art stay tun show liv today 5pm cet via
969949228398186496	2018-03-03	['#valentinofw1819', '#pierpaolopicciol', '#par', '#periscop']	on day left unveil collect cre direct liv get ready dream ey op liv
969883409664397313	2018-03-03	['#valentinofw1819', '#periscop']	wond what's lik fash show get ready collect sunday march 4th 5pm liv par
969857781175111680	2018-03-03	['#valentinofw1819', '#pierpaolopicciol', '#periscop']	new chapt rev stay tun wom show cre direct liv par march 4th 5pm cet
969640825306173441	2018-03-02	['#vltn']	new cool ethn mot chino pant sem shirt new men ess
969621247180099584	2018-03-02	['#heroestribe1', '#valentinomenss18']	multicol sneak mad stretch knit fabr sued collect town
969579466396663809	2018-03-02	['#valentinogaravan', '#ss18']	tak anoth look vert tot charact light iv pip men collect
969541465604018176	2018-03-02	['#valentinomenss18', '#valentinogaravan', '#heroestrib']	athlet wear new sneak
969496136108183552	2018-03-02	['#valentinomenss18']	ethn sporty collect modern mix langu
969285564292911105	2018-03-01	['#vltn', '#menss18']	ready aim shoot basketbal affair tak look latest collect
969261050142052352	2018-03-01	['#valentinomenss18']	bright red black whit young beauty @troyesivan wear tot look collect
969134428932001795	2018-03-01	['#heroestribe1', '#valentinomenss18']	tak clos look perfect mix sporty cout el latest sneak straight show
968901173716676608	2018-02-28	['#valentinomenss18']	styl stat @troyesivan wear jumpsuit charact bright col tech fabr
968855812004343809	2018-02-28	['#valentinoss18', '#advcampaign', '#pierpaolopicciol', '#valentino']	fun dant mom @troyesivan capt mak men collect design avail onlin bout worldwid loc pier 59 studio new york
968750115526672386	2018-02-28	['#behindthescenesshot', '#valentinoss18', '#advcampaign', '#vltntracksuit']	men feat tal sing @troyesivan wear red loc pier 59 studio new york
968553825207443456	2018-02-27	['#valentinoss18', '#advcampaign', '#vltn']	@troyesivan look gre set wear new pant embel contrast col band sid
968455684848259072	2018-02-27	['#valentinoss18']	@margotrobbie tak spring trend march issu @elleuk magazin actress pos stat look
968387727388528641	2018-02-27	['#valentinoss18']	@wmag volum ii 2018 cov star @flo_tweet wear tul gown enrich contrast green velvet bow
968177234203893760	2018-02-26	['#rileymontan', '#valentinoss18', '#pierpaolopicciol']	glit girl star febru issu @elleuk reley wear embroid park top collect cre direct
968118357538082822	2018-02-26	['#agynessdein', '#valentinoss18']	model actress star cov @lofficielitalia rock techno trench coat gabardin pocket
968057065007648768	2018-02-26	['#paulineducruet', '#st', '#veryvalentino', '#ss18']	daught princess grac march issu @harpersbazaares wear dreamy pastel dress collect
967300562919202816	2018-02-24	['#clairefoy', '#valentinofall18']	strong chic walk @unsanemovie red carpet 68th @berlinale black dress feat embroid star min poi
967104278522347520	2018-02-23	['#clairefoy', '#valentinofall18', '#pierpaolopicciol']	wid shot actress star @unsanemovie red carpet 68th @berlinale see embroid gown collect design cre direct
967043871514521601	2018-02-23	['#clairefoy', '#valentinofall18']	actress ench vis wear gown embel embroid star @unsanemovie prem 68th @berlinale
966953278796742656	2018-02-23	['#valentinoss18', '#advcampaign', '#backst', '#pierpaolopicciol']	@gigihadid mak styl appear set photograph @inezandvinoodh cre direct
966727461470965762	2018-02-22	['#gigihadid', '#auroratalarico', '#riannevanrompaey', '#adutak', '#jammehoumy', '#felicenov', '#valentinoss18', '#advcampaign']	dant model feel beat loc pier 59 studio new york
966658848546160641	2018-02-22	['#behindthesc', '#valentinoss18', '#advcampaign']	enjoy chicest @gigihadid wear col polk dot dress shot
966332102647087104	2018-02-21	['#behindthesc', '#valentinoss18', '#advcampaign', '#auroratalarico', '#riannevanrompaey', '#valentinogaravan', '#rockstudspik']	look see ent feat model play new bag transp shin pvc
966213402367492097	2018-02-21	['#valentino']	act @lievschreiber attend @iisleofdogsmovie photo cal 68th @berlinale wear refin tot look
966024667378176001	2018-02-20	['#francesmcdormand', '#threebillboards', '#lipstickwav', '#pierpaolopicciol']	enjoy celebr win best actress award 2018 @bafta capt along cost frant wear dress design cre direct
965964270864420864	2018-02-20	['#albarohrwach', '#3daysinquiberon', '#ss18']	simply chic attend prem 68th @berlinale wear stefano intens black wool drap jacket trous suit big duchess satin knot back collect
965897102474858496	2018-02-20	['#valentinoss18']	@katemara rom vis pink seen @bafta nomin wear should bow dress collect
965835913807806464	2018-02-20	['#alexandredespl', '#valentinotuxedo']	compos wear acceiv origin mus award 2018 @bafta guillermo del toro @shapeofwater soundtrack
965629914467749888	2018-02-19	['#kristinscottthoma', '#valentinofall18']	actress attend @bafta nomin party shiny gown dragon pattern inspir maison arch
965496180506611712	2018-02-19	['#behindthesc', '#valentinoss18', '#advcampaign', '#riannevanrompaey', '#pierpaolopicciol']	go latest star wear red light silk shirt ton ton pant loc pier 59 studio new york photograph @inezandvinoodh cre direct
965292330243776512	2018-02-18	['#pierpaolopicciol', '#valentinoss18', '#advcampaign']	gre mak tak look @gigihadid capt dant cre direct mak loc pier 59 studio new york photograph @inezandvinoodh cre direct
965239481740726277	2018-02-18	['#behindthesc', '#valentinoss18', '#advcampaign', '#valentinogaravan', '#candystud']	red red shot latest feat beauty @gigihadid sport quilt bag soft leath
965180676222930945	2018-02-18	['#valentinoss18', '#advcampaign', '#pierpaolopicciol']	capt city nev sleep @gigihadid ad modern al loc pier 59 studio new york photograph @inezandvinoodh cre direct
964869544664641537	2018-02-17	['#valentinoss18', '#advcampaign', '#pierpaolopicciol']	modern beauty @gigihadid star latest ad touch glamo loc pier 59 studio new york photograph @inezandvinoodh cre direction:
964756300532985856	2018-02-17	['#valentinogaravan', '#lipstickwav', '#lockb', '#spring18']	wish year ful heal happy luck fash start wear velvet silk multicol bead collect
964547015345627136	2018-02-16	['#chinesenewyear', '#cny2018']	happy discov beauty cre red touch wish luck
964507160267968514	2018-02-16	['#valentinogaravan', '#chinesenewyear']	meet smal chain should bag un zandr rohd find perfect gift
964416563448131585	2018-02-16	['#lipstickwav', '#spring18', '#chinesenewyear']	cr de chin dress embel print cre collab art zandr rhod collect part gift idea select celebr
964205167062085633	2018-02-15	['#chinesenewyear']	around corn happy shar good luck joy refin gift idea
964173446040211456	2018-02-15	['#chinesenewyear', '#spring18', '#lipstickwav']	count start let celebr togeth new print collect
963865442023452672	2018-02-14	['#valentinesday', '#valentinoedit', '#asiapiwk', '#valentinoresort18', '#kikohenri']	let start touch rom feat model @vanityfairspain
963818029808340993	2018-02-14	['#natalieportm', '#annihilationmovy', '#losangel', '#valentinofall18', '#pierpaolopicciol']	actress look stun prem wear black tul velvet gown cre direct
963711583544365056	2018-02-14	['#lorenzolive2018']	@lorenzojova rock stag tour op mil wear embroid anima print teddy jacket team bowl shirt embel hibisc print espec design cre direct
963468882987159552	2018-02-13	['#pierpaolopicciol', '#lorenzolive2018']	pleas annount @lorenzojova worn exclud cloth design tour cre direct said daydream word lorenzo common imagin charact shar
963437385366241280	2018-02-13	['#vltn', '#newyork', '#soho']	bal gam town miss opportun discov men univers ded instal 121 spring street febru 20th
963374032845529089	2018-02-13	['#vltn', '#newyork', '#soho']	sport hip cult finest men collect visit pop stor 121 spring street febru 20th ev collab @hypebeast
963096679619727363	2018-02-12	['#nyc', '#vltn', '#limit', '#soho']	sneak fan miss new new york edit men sho avail febru 20th bout 121 spring street
963029318912888832	2018-02-12	['#auroratalarico', '#valentinoss18', '#pierpaolopicciol']	tak clos look finest wear pal pink gown collect design
962745608766476288	2018-02-11	['#valentinogaravan', '#candystud', '#vltn']	real want discov new bag embel print
962659116652138498	2018-02-11	['#auroratalarico', '#valentinoss18']	ris model express pink beauty funny sid wear ful leng dress poudr palet ruffl detail collect
